Sheet: 00.Info
B2: Informe de revisión de la accesibilidad | N2: Versión: 1.0.3
B3: Análisis de accesibilidad en profundidad de un sitio web
B5: Información General
B7: Instrucciones para rellenar el documento
B9: Objeto El documento sirve como soporte para la revisión de accesibilidad en profundidad, es decir, permite anotar los resultados del análisis automático y manual realizado sobre un sitio web. Para las aplicaciones para dispositivos móviles se definirá un modelo diferente. El documento sigue la estructura de la WCAG-EM (Evaluation Methodology) para generar un informe estructurado a partir de los datos que usted proporcione. Para su aplicación, las personas encargadas deberán conocer la aplicación de las Pautas de Accesibilidad para el Contenido Web (WCAG). El documento no sirve para realizar ninguna comprobación de accesibilidad.
B11: Cómo utilizar el documento El orden recomendado para cumplimentar la información es el siguiente: 1. Rellenar en primer lugar la información de las pestañas "01.Definición de ámbito" y "02. Tecnologías"
B13: 2. En la pestaña "03. Muestra" deberán indicarse las páginas que forman parte de la muestra. Para su selección deberá tenerse en cuenta lo indicado en el apdo. 3.2 de la Decisión de Ejecución (UE) 2018/1524. - Entre las páginas seleccionadas, en caso de existir, deberán figurar de forma obligatoria las siguientes: Página de inicio, Inicio de sesión, Mapa del sitio, Contacto, Ayuda, Información legal, página de la Declaración de accesibilidad y página que contenga el Mecanismo de comunicación. - También deberá seleccionarse, como mínimo, una página para cada tipo de servicio prestado por el sitio web, incluida la función de búsqueda, ejemplos de páginas cuya apariencia sea sustancialmente distinta o que presenten un tipo de contenido diferente y como mínimo, un documento descargable pertinente, si procede, para cada tipo de servicio prestado por el sitio web. - También debe tenerse en cuenta que al menos un 10% de la muestra debe ser aleatorio e indicarse en al columna tipo. - Por cada página seleccionada en la muestra deberá indicarse: Nombre corto, Tipo de página, URL de la página, Direccionamiento alternativo (útil en los sitios web con URLs dinámicas) y Tipos de elementos (indicando los elementos más característicos que incluye la página, por ejemplo imágenes, listas, tablas, formularios, multimedia …) . - Cuando la muestra sea menor de 35 URLs, las URLs restantes se dejarán vacías.
B15: 3. En las pestañas "P1. Perceptible", "P2. Operable", "P3. Comprensible" y "P4. Robusto" deberá cumplimentarse, para todos los criterios de éxito, y dentro de estos, para cada una de las páginas de la muestra, el resultado de dicha comprobación indicándolo en la columna resultado. Para realizar la evaluación de la accesibilidad puede servir de ayuda el listado de herramientas automáticas y manuales disponibles en el listado de herramientas disponibles en el Anexo de la Guía de validación de accesibilidad web.
B17: 4. Los resultados agregados del proceso de validación serán consolidados automáticamente en la pestaña "RESULTADOS".

Sheet: 01.Definición de ámbito
B2: Informe de revisión de la accesibilidad
B3: Análisis de accesibilidad en profundidad de un sitio web | D3: * Campos obligatorios
B5: Definición de ámbito
B7: Nombre de la URA*
B9: DIR3 de la URA*
B11: Ámbito competencial de la URA*
B13: DIR3 del ámbito competencial de la URA*
B17: Entidad responsable del Sitio web*
B19: DIR3 de la Entidad responsable*
B21: Correo electrónico de la Entidad/Persona responsable del Sitio web*
B25: Tipología del sitio web*
B27: Nombre Sitio Web*
B29: URL del Sitio Web*
B31: Alcance de la revisión*
B33: Funcionalidad esencial del sitio web*
B35: Fecha de la revisión*
B39: Nivel de conformidad a analizar* | C39: UNE-EN 301549 : 2019 - AA WCAG 2.1 (excluyendo el contenido excluido por el RD 1112/2018)
B41: Soporte de accesibilidad mínimo*
B45: Ámbito territorial*
B47: Ámbito temático* | C47: (i) Los ámbitos temáticos que se muestran a continuación son los indicados en la Decisión de ejecución 2018/1524. Los sitios web que no pertenezcan a ninguno de los ámbitos temáticos indicados no seleccionarán ningún ámbito.
C48: Educación | D48: No
C49: Empleo | D49: No
C50: Hacienda | D50: No
C51: Medio Ambiente | D51: No
C52: Ocio y Cultura | D52: No
C53: Protección social | D53: No
C54: Sanidad | D54: No
C55: Seguridad y Orden Público | D55: No
C56: Servicios Comunitarios | D56: No
C57: Transporte | D57: No
C58: Vivienda | D58: No
B60: Tipo de evaluación*
B62: Nombre de empresa
B64: Observaciones

Sheet: 02.Tecnologías
B2: Informe de revisión de la accesibilidad
B3: Análisis de accesibilidad en profundidad de un sitio web
B5: Tecnologías aplicadas
B6: Indicar las tecnologías web en las que se basa la conformidad de la accesibilidad
B7: Para añadir otras tecnologías, seleccionar "Otras" y rellenar los campos "Nombre Tecnología" y "URL de la Especificación o Descripción".
B9: HTML5 | C9: No | E9: ECMAScript 3 | F9: No | H9: OOXML | I9: No
B10: XHTML 1.0 | C10: No | E10: ECMAScript 5 | F10: No | H10: ODF 1.2 | I10: No
B11: HTML 4.01 | C11: No | E11: DOM | F11: No | H11: SVG | I11: No
B12: CSS | C12: No | E12: Flash | F12: No | H12: OTRAS | I12: No | K12: Nombre Tecnología | L12: URL de la Especificación o Descripción
B13: WAI-ARIA | C13: No | E13: Silverlight | F13: No
C17: * Es obligatorio rellenar esta pestaña

Sheet: 03.Muestra
B2: Informe de revisión de la accesibilidad
B3: Análisis de accesibilidad en profundidad de un sitio web | F3: * Campos obligatorios
B5: Selección de la muestra
B7: ID | C7: Nombre corto* | D7: Tipo* | E7: URL página* | F7: Direccionamiento alternativo (migas)* | G7: Tipos de elementos
B8: 1
B9: 2
B10: 3
B11: 4
B12: 5
B13: 6
B14: 7
B15: 8
B16: 9
B17: 10
B18: 11
B19: 12
B20: 13
B21: 14
B22: 15
B23: 16
B24: 17
B25: 18
B26: 19
B27: 20
B28: 21
B29: 22
B30: 23
B31: 24
B32: 25
B33: 26
B34: 27
B35: 28
B36: 29
B37: 30
B38: 31
B39: 32
B40: 33
B41: 34
B42: 35
B45: PAGINAS SELECCIONADAS | D45: of:=COUNTA([.E8:.E42]) -> 0
B47: PÁGINAS NO ALEATORIAS | D47: of:=[.D45]-[.D49] -> 0
B49: PAGINAS ALEATORIAS | D49: of:=COUNTIF([.D8:.D42];"Aleatoria") -> 0
B52: ¿MUESTRA CORRECTA? | D52: of:=IF(AND([.D49]>=0.1*[.D47];[.D49]>0; COUNTIF([.D8:.D42];"Declaración Accesibilidad"); COUNTIF([.D8:.D42];"Página inicio") ;   COUNTA([.C8:.C42])=COUNTA([.E8:.E42])  ;   COUNTA([.D8:.D42])=COUNTA([.E8:.E42])    );"SI";"NO") -> NO

Sheet: P1.Perceptible
B2: Informe de revisión de la accesibilidad
B3: Análisis de accesibilidad en profundidad de un sitio web
B5: Revisión de la muestra
B8: Principio 1: Perceptible
B9: La información y los componentes de la interfaz de usuario deben ser presentados a los usuarios de modo que ellos puedan percibirlos.
B11: Criterios de Conformidad | F11: EVALUADOS | G11: N.º Criterios x N.º Páginas | H11: % | J11: PENDIENTES | K11: N.º Criterios x N.º Páginas | L11: %
B12: A | C12: 9 | F12: Pasa | G12: of:=[.J20]+[.J58]+[.J96]+[.J134]+[.J172]+[.J210]+[.J248]+[.J286]+[.J324]+[.J362]+[.J400]+[.J438]+[.J476]+[.J514]+[.J552]+[.J590]+[.J628]+[.J666]+[.J704]+[.J742] -> 0 | H12: of:=IF(([.$G$15]+[.$K$15])=0;0;[.G12]/([.$G$15]+[.$K$15])) -> 0 | J12: No decide | K12: of:=[.G20]+[.G58]+[.G96]+[.G134]+[.G172]+[.G210]+[.G248]+[.G286]+[.G324]+[.G362]+[.G400]+[.G438]+[.G476]+[.G514]+[.G552]+[.G590]+[.G628]+[.G666]+[.G704]+[.G742] -> 0 | L12: of:=IF(([.$G$15]+[.$K$15])=0;0;[.K12]/([.$G$15]+[.$K$15])) -> 0
B13: AA | C13: 11 | F13: Falla | G13: of:=[.I20]+[.I58]+[.I96]+[.I134]+[.I172]+[.I210]+[.I248]+[.I286]+[.I324]+[.I362]+[.I400]+[.I438]+[.I476]+[.I514]+[.I552]+[.I590]+[.I628]+[.I666]+[.I704]+[.I742] -> 0 | H13: of:=IF(([.$G$15]+[.$K$15])=0;0;[.G13]/([.$G$15]+[.$K$15])) -> 0 | J13: No testeado | K13: of:=[.F20]+[.F58]+[.F96]+[.F134]+[.F172]+[.F210]+[.F248]+[.F286]+[.F324]+[.F362]+[.F400]+[.F438]+[.F476]+[.F514]+[.F552]+[.F590]+[.F628]+[.F666]+[.F704]+[.F742] -> 0 | L13: of:=IF(([.$G$15]+[.$K$15])=0;0;[.K13]/([.$G$15]+[.$K$15])) -> 0
B14: Total | C14: of:=[.C12]+[.C13] -> 20 | F14: No aplica | G14: of:=[.H20]+[.H58]+[.H96]+[.H134]+[.H172]+[.H210]+[.H248]+[.H286]+[.H324]+[.H362]+[.H400]+[.H438]+[.H476]+[.H514]+[.H552]+[.H590]+[.H628]+[.H666]+[.H704]+[.H742] -> 0 | H14: of:=IF(([.$G$15]+[.$K$15])=0;0;[.G14]/([.$G$15]+[.$K$15])) -> 0 | J14: En blanco | K14: of:=[.K20]+[.K58]+[.K96]+[.K134]+[.K172]+[.K210]+[.K248]+[.K286]+[.K324]+[.K362]+[.K400]+[.K438]+[.K476]+[.K514]+[.K552]+[.K590]+[.K628]+[.K666]+[.K704]+[.K742] -> 0 | L14: of:=IF(([.$G$15]+[.$K$15])=0;0;[.K14]/([.$G$15]+[.$K$15])) -> 0
F15: Total | G15: of:=SUM([.G12:.G14]) -> 0 | H15: of:=SUM([.H12:.H14]) -> 0 | J15: Total | K15: of:=SUM([.K12:.K14]) -> 0 | L15: of:=SUM([.L12:.L14]) -> 0
B18: A | C18: 1.1.1 Contenido no textual | D18: Resultado
B19: of:=IF( ISBLANK([$'03.Muestra'.$C8]);"";[$'03.Muestra'.$C8]) ->  | C19: of:=IF( ISBLANK([$'03.Muestra'.$E8]);"";[$'03.Muestra'.$E8]) ->  | E19: of:=IF([.D19]<>"";IF(AND(['P2.Operable'.B19]<>"";['P2.Operable'.C19]<>"");"";"ERR");"") ->  | F19: N/T | G19: N/D | H19: N/A | I19: Falla | J19: Pasa | K19: En blanco
B20: of:=IF( ISBLANK([$'03.Muestra'.$C9]);"";[$'03.Muestra'.$C9]) ->  | C20: of:=IF( ISBLANK([$'03.Muestra'.$E9]);"";[$'03.Muestra'.$E9]) ->  | E20: of:=IF([.D20]<>"";IF(AND([.B20]<>"";[.C20]<>"");"";"ERR");"") ->  | F20: of:=COUNTIF([.$D19]:INDIRECT("$D" &  SUM(ROW()-1;[$'03.Muestra'.$D$45])-1);[.F19]) -> 0 | G20: of:=COUNTIF([.$D19]:INDIRECT("$D" &  SUM(ROW()-1;[$'03.Muestra'.$D$45])-1);[.G19]) -> 0 | H20: of:=COUNTIF([.$D19]:INDIRECT("$D" &  SUM(ROW()-1;[$'03.Muestra'.$D$45])-1);[.H19]) -> 0 | I20: of:=COUNTIF([.$D19]:INDIRECT("$D" &  SUM(ROW()-1;[$'03.Muestra'.$D$45])-1);[.I19]) -> 0 | J20: of:=COUNTIF([.$D19]:INDIRECT("$D" &  SUM(ROW()-1;[$'03.Muestra'.$D$45])-1);[.J19]) -> 0 | K20: of:=IF([$'03.Muestra'.$D$45]=0;0;COUNTBLANK([.$D19]:INDIRECT("$D" &  SUM(ROW()-1;[$'03.Muestra'.$D$45])-1))) -> 0
B21: of:=IF( ISBLANK([$'03.Muestra'.$C10]);"";[$'03.Muestra'.$C10]) ->  | C21: of:=IF( ISBLANK([$'03.Muestra'.$E10]);"";[$'03.Muestra'.$E10]) ->  | E21: of:=IF([.D21]<>"";IF(AND([.B21]<>"";[.C21]<>"");"";"ERR");"") -> 
B22: of:=IF( ISBLANK([$'03.Muestra'.$C11]);"";[$'03.Muestra'.$C11]) ->  | C22: of:=IF( ISBLANK([$'03.Muestra'.$E11]);"";[$'03.Muestra'.$E11]) ->  | E22: of:=IF([.D22]<>"";IF(AND([.B22]<>"";[.C22]<>"");"";"ERR");"") ->  | K22: N/T | L22: No Testeado
B23: of:=IF( ISBLANK([$'03.Muestra'.$C12]);"";[$'03.Muestra'.$C12]) ->  | C23: of:=IF( ISBLANK([$'03.Muestra'.$E12]);"";[$'03.Muestra'.$E12]) ->  | E23: of:=IF([.D23]<>"";IF(AND([.B23]<>"";[.C23]<>"");"";"ERR");"") ->  | K23: N/A | L23: No Aplica
B24: of:=IF( ISBLANK([$'03.Muestra'.$C13]);"";[$'03.Muestra'.$C13]) ->  | C24: of:=IF( ISBLANK([$'03.Muestra'.$E13]);"";[$'03.Muestra'.$E13]) ->  | E24: of:=IF([.D24]<>"";IF(AND([.B24]<>"";[.C24]<>"");"";"ERR");"") ->  | K24: N/D | L24: No Decide
B25: of:=IF( ISBLANK([$'03.Muestra'.$C14]);"";[$'03.Muestra'.$C14]) ->  | C25: of:=IF( ISBLANK([$'03.Muestra'.$E14]);"";[$'03.Muestra'.$E14]) ->  | E25: of:=IF([.D25]<>"";IF(AND([.B25]<>"";[.C25]<>"");"";"ERR");"") -> 
B26: of:=IF( ISBLANK([$'03.Muestra'.$C15]);"";[$'03.Muestra'.$C15]) ->  | C26: of:=IF( ISBLANK([$'03.Muestra'.$E15]);"";[$'03.Muestra'.$E15]) ->  | E26: of:=IF([.D26]<>"";IF(AND([.B26]<>"";[.C26]<>"");"";"ERR");"") -> 
B27: of:=IF( ISBLANK([$'03.Muestra'.$C16]);"";[$'03.Muestra'.$C16]) ->  | C27: of:=IF( ISBLANK([$'03.Muestra'.$E16]);"";[$'03.Muestra'.$E16]) ->  | E27: of:=IF([.D27]<>"";IF(AND([.B27]<>"";[.C27]<>"");"";"ERR");"") -> 
B28: of:=IF( ISBLANK([$'03.Muestra'.$C17]);"";[$'03.Muestra'.$C17]) ->  | C28: of:=IF( ISBLANK([$'03.Muestra'.$E17]);"";[$'03.Muestra'.$E17]) ->  | E28: of:=IF([.D28]<>"";IF(AND([.B28]<>"";[.C28]<>"");"";"ERR");"") -> 
B29: of:=IF( ISBLANK([$'03.Muestra'.$C18]);"";[$'03.Muestra'.$C18]) ->  | C29: of:=IF( ISBLANK([$'03.Muestra'.$E18]);"";[$'03.Muestra'.$E18]) ->  | E29: of:=IF([.D29]<>"";IF(AND([.B29]<>"";[.C29]<>"");"";"ERR");"") -> 
B30: of:=IF( ISBLANK([$'03.Muestra'.$C19]);"";[$'03.Muestra'.$C19]) ->  | C30: of:=IF( ISBLANK([$'03.Muestra'.$E19]);"";[$'03.Muestra'.$E19]) ->  | E30: of:=IF([.D30]<>"";IF(AND([.B30]<>"";[.C30]<>"");"";"ERR");"") -> 
B31: of:=IF( ISBLANK([$'03.Muestra'.$C20]);"";[$'03.Muestra'.$C20]) ->  | C31: of:=IF( ISBLANK([$'03.Muestra'.$E20]);"";[$'03.Muestra'.$E20]) ->  | E31: of:=IF([.D31]<>"";IF(AND([.B31]<>"";[.C31]<>"");"";"ERR");"") -> 
B32: of:=IF( ISBLANK([$'03.Muestra'.$C21]);"";[$'03.Muestra'.$C21]) ->  | C32: of:=IF( ISBLANK([$'03.Muestra'.$E21]);"";[$'03.Muestra'.$E21]) ->  | E32: of:=IF([.D32]<>"";IF(AND([.B32]<>"";[.C32]<>"");"";"ERR");"") -> 
B33: of:=IF( ISBLANK([$'03.Muestra'.$C22]);"";[$'03.Muestra'.$C22]) ->  | C33: of:=IF( ISBLANK([$'03.Muestra'.$E22]);"";[$'03.Muestra'.$E22]) ->  | E33: of:=IF([.D33]<>"";IF(AND([.B33]<>"";[.C33]<>"");"";"ERR");"") -> 
B34: of:=IF( ISBLANK([$'03.Muestra'.$C23]);"";[$'03.Muestra'.$C23]) ->  | C34: of:=IF( ISBLANK([$'03.Muestra'.$E23]);"";[$'03.Muestra'.$E23]) ->  | E34: of:=IF([.D34]<>"";IF(AND([.B34]<>"";[.C34]<>"");"";"ERR");"") -> 
B35: of:=IF( ISBLANK([$'03.Muestra'.$C24]);"";[$'03.Muestra'.$C24]) ->  | C35: of:=IF( ISBLANK([$'03.Muestra'.$E24]);"";[$'03.Muestra'.$E24]) ->  | E35: of:=IF([.D35]<>"";IF(AND([.B35]<>"";[.C35]<>"");"";"ERR");"") -> 
B36: of:=IF( ISBLANK([$'03.Muestra'.$C25]);"";[$'03.Muestra'.$C25]) ->  | C36: of:=IF( ISBLANK([$'03.Muestra'.$E25]);"";[$'03.Muestra'.$E25]) ->  | E36: of:=IF([.D36]<>"";IF(AND([.B36]<>"";[.C36]<>"");"";"ERR");"") -> 
B37: of:=IF( ISBLANK([$'03.Muestra'.$C26]);"";[$'03.Muestra'.$C26]) ->  | C37: of:=IF( ISBLANK([$'03.Muestra'.$E26]);"";[$'03.Muestra'.$E26]) ->  | E37: of:=IF([.D37]<>"";IF(AND([.B37]<>"";[.C37]<>"");"";"ERR");"") -> 
B38: of:=IF( ISBLANK([$'03.Muestra'.$C27]);"";[$'03.Muestra'.$C27]) ->  | C38: of:=IF( ISBLANK([$'03.Muestra'.$E27]);"";[$'03.Muestra'.$E27]) ->  | E38: of:=IF([.D38]<>"";IF(AND([.B38]<>"";[.C38]<>"");"";"ERR");"") -> 
B39: of:=IF( ISBLANK([$'03.Muestra'.$C28]);"";[$'03.Muestra'.$C28]) ->  | C39: of:=IF( ISBLANK([$'03.Muestra'.$E28]);"";[$'03.Muestra'.$E28]) ->  | E39: of:=IF([.D39]<>"";IF(AND([.B39]<>"";[.C39]<>"");"";"ERR");"") -> 
B40: of:=IF( ISBLANK([$'03.Muestra'.$C29]);"";[$'03.Muestra'.$C29]) ->  | C40: of:=IF( ISBLANK([$'03.Muestra'.$E29]);"";[$'03.Muestra'.$E29]) ->  | E40: of:=IF([.D40]<>"";IF(AND([.B40]<>"";[.C40]<>"");"";"ERR");"") -> 
B41: of:=IF( ISBLANK([$'03.Muestra'.$C30]);"";[$'03.Muestra'.$C30]) ->  | C41: of:=IF( ISBLANK([$'03.Muestra'.$E30]);"";[$'03.Muestra'.$E30]) ->  | E41: of:=IF([.D41]<>"";IF(AND([.B41]<>"";[.C41]<>"");"";"ERR");"") -> 
B42: of:=IF( ISBLANK([$'03.Muestra'.$C31]);"";[$'03.Muestra'.$C31]) ->  | C42: of:=IF( ISBLANK([$'03.Muestra'.$E31]);"";[$'03.Muestra'.$E31]) ->  | E42: of:=IF([.D42]<>"";IF(AND([.B42]<>"";[.C42]<>"");"";"ERR");"") -> 
B43: of:=IF( ISBLANK([$'03.Muestra'.$C32]);"";[$'03.Muestra'.$C32]) ->  | C43: of:=IF( ISBLANK([$'03.Muestra'.$E32]);"";[$'03.Muestra'.$E32]) ->  | E43: of:=IF([.D43]<>"";IF(AND([.B43]<>"";[.C43]<>"");"";"ERR");"") -> 
B44: of:=IF( ISBLANK([$'03.Muestra'.$C33]);"";[$'03.Muestra'.$C33]) ->  | C44: of:=IF( ISBLANK([$'03.Muestra'.$E33]);"";[$'03.Muestra'.$E33]) ->  | E44: of:=IF([.D44]<>"";IF(AND([.B44]<>"";[.C44]<>"");"";"ERR");"") -> 
B45: of:=IF( ISBLANK([$'03.Muestra'.$C34]);"";[$'03.Muestra'.$C34]) ->  | C45: of:=IF( ISBLANK([$'03.Muestra'.$E34]);"";[$'03.Muestra'.$E34]) ->  | E45: of:=IF([.D45]<>"";IF(AND([.B45]<>"";[.C45]<>"");"";"ERR");"") -> 
B46: of:=IF( ISBLANK([$'03.Muestra'.$C35]);"";[$'03.Muestra'.$C35]) ->  | C46: of:=IF( ISBLANK([$'03.Muestra'.$E35]);"";[$'03.Muestra'.$E35]) ->  | E46: of:=IF([.D46]<>"";IF(AND([.B46]<>"";[.C46]<>"");"";"ERR");"") -> 
B47: of:=IF( ISBLANK([$'03.Muestra'.$C36]);"";[$'03.Muestra'.$C36]) ->  | C47: of:=IF( ISBLANK([$'03.Muestra'.$E36]);"";[$'03.Muestra'.$E36]) ->  | E47: of:=IF([.D47]<>"";IF(AND([.B47]<>"";[.C47]<>"");"";"ERR");"") -> 
B48: of:=IF( ISBLANK([$'03.Muestra'.$C37]);"";[$'03.Muestra'.$C37]) ->  | C48: of:=IF( ISBLANK([$'03.Muestra'.$E37]);"";[$'03.Muestra'.$E37]) ->  | E48: of:=IF([.D48]<>"";IF(AND([.B48]<>"";[.C48]<>"");"";"ERR");"") -> 
B49: of:=IF( ISBLANK([$'03.Muestra'.$C38]);"";[$'03.Muestra'.$C38]) ->  | C49: of:=IF( ISBLANK([$'03.Muestra'.$E38]);"";[$'03.Muestra'.$E38]) ->  | E49: of:=IF([.D49]<>"";IF(AND([.B49]<>"";[.C49]<>"");"";"ERR");"") -> 
B50: of:=IF( ISBLANK([$'03.Muestra'.$C39]);"";[$'03.Muestra'.$C39]) ->  | C50: of:=IF( ISBLANK([$'03.Muestra'.$E39]);"";[$'03.Muestra'.$E39]) ->  | E50: of:=IF([.D50]<>"";IF(AND([.B50]<>"";[.C50]<>"");"";"ERR");"") -> 
B51: of:=IF( ISBLANK([$'03.Muestra'.$C40]);"";[$'03.Muestra'.$C40]) ->  | C51: of:=IF( ISBLANK([$'03.Muestra'.$E40]);"";[$'03.Muestra'.$E40]) ->  | E51: of:=IF([.D51]<>"";IF(AND([.B51]<>"";[.C51]<>"");"";"ERR");"") -> 
B52: of:=IF( ISBLANK([$'03.Muestra'.$C41]);"";[$'03.Muestra'.$C41]) ->  | C52: of:=IF( ISBLANK([$'03.Muestra'.$E41]);"";[$'03.Muestra'.$E41]) ->  | E52: of:=IF([.D52]<>"";IF(AND([.B52]<>"";[.C52]<>"");"";"ERR");"") -> 
B53: of:=IF( ISBLANK([$'03.Muestra'.$C42]);"";[$'03.Muestra'.$C42]) ->  | C53: of:=IF( ISBLANK([$'03.Muestra'.$E42]);"";[$'03.Muestra'.$E42]) ->  | E53: of:=IF([.D53]<>"";IF(AND([.B53]<>"";[.C53]<>"");"";"ERR");"") -> 
B56: A | C56: 1.2.1 Sólo audio y sólo vídeo (grabado) | D56: Resultado
B57: of:=IF( ISBLANK([$'03.Muestra'.$C8]);"";[$'03.Muestra'.$C8]) ->  | C57: of:=IF( ISBLANK([$'03.Muestra'.$E8]);"";[$'03.Muestra'.$E8]) ->  | E57: of:=IF([.D57]<>"";IF(AND([.B57]<>"";[.C57]<>"");"";"ERR");"") ->  | F57: N/T | G57: N/D | H57: N/A | I57: Falla | J57: Pasa | K57: En blanco
B58: of:=IF( ISBLANK([$'03.Muestra'.$C9]);"";[$'03.Muestra'.$C9]) ->  | C58: of:=IF( ISBLANK([$'03.Muestra'.$E9]);"";[$'03.Muestra'.$E9]) ->  | E58: of:=IF([.D58]<>"";IF(AND([.B58]<>"";[.C58]<>"");"";"ERR");"") ->  | F58: of:=COUNTIF([.$D57]:INDIRECT("$D" &  SUM(ROW()-1;['03.Muestra'.$D$45])-1);[.F57]) -> 0 | G58: of:=COUNTIF([.$D57]:INDIRECT("$D" &  SUM(ROW()-1;['03.Muestra'.$D$45])-1);[.G57]) -> 0 | H58: of:=COUNTIF([.$D57]:INDIRECT("$D" &  SUM(ROW()-1;['03.Muestra'.$D$45])-1);[.H57]) -> 0 | I58: of:=COUNTIF([.$D57]:INDIRECT("$D" &  SUM(ROW()-1;['03.Muestra'.$D$45])-1);[.I57]) -> 0 | J58: of:=COUNTIF([.$D57]:INDIRECT("$D" &  SUM(ROW()-1;['03.Muestra'.$D$45])-1);[.J57]) -> 0 | K58: of:=IF(['03.Muestra'.$D$45]=0;0;COUNTBLANK([.$D57]:INDIRECT("$D" &  SUM(ROW()-1;['03.Muestra'.$D$45])-1))) -> 0
B59: of:=IF( ISBLANK([$'03.Muestra'.$C10]);"";[$'03.Muestra'.$C10]) ->  | C59: of:=IF( ISBLANK([$'03.Muestra'.$E10]);"";[$'03.Muestra'.$E10]) ->  | E59: of:=IF([.D59]<>"";IF(AND([.B59]<>"";[.C59]<>"");"";"ERR");"") -> 
B60: of:=IF( ISBLANK([$'03.Muestra'.$C11]);"";[$'03.Muestra'.$C11]) ->  | C60: of:=IF( ISBLANK([$'03.Muestra'.$E11]);"";[$'03.Muestra'.$E11]) ->  | E60: of:=IF([.D60]<>"";IF(AND([.B60]<>"";[.C60]<>"");"";"ERR");"") -> 
B61: of:=IF( ISBLANK([$'03.Muestra'.$C12]);"";[$'03.Muestra'.$C12]) ->  | C61: of:=IF( ISBLANK([$'03.Muestra'.$E12]);"";[$'03.Muestra'.$E12]) ->  | E61: of:=IF([.D61]<>"";IF(AND([.B61]<>"";[.C61]<>"");"";"ERR");"") -> 
B62: of:=IF( ISBLANK([$'03.Muestra'.$C13]);"";[$'03.Muestra'.$C13]) ->  | C62: of:=IF( ISBLANK([$'03.Muestra'.$E13]);"";[$'03.Muestra'.$E13]) ->  | E62: of:=IF([.D62]<>"";IF(AND([.B62]<>"";[.C62]<>"");"";"ERR");"") -> 
B63: of:=IF( ISBLANK([$'03.Muestra'.$C14]);"";[$'03.Muestra'.$C14]) ->  | C63: of:=IF( ISBLANK([$'03.Muestra'.$E14]);"";[$'03.Muestra'.$E14]) ->  | E63: of:=IF([.D63]<>"";IF(AND([.B63]<>"";[.C63]<>"");"";"ERR");"") -> 
B64: of:=IF( ISBLANK([$'03.Muestra'.$C15]);"";[$'03.Muestra'.$C15]) ->  | C64: of:=IF( ISBLANK([$'03.Muestra'.$E15]);"";[$'03.Muestra'.$E15]) ->  | E64: of:=IF([.D64]<>"";IF(AND([.B64]<>"";[.C64]<>"");"";"ERR");"") -> 
B65: of:=IF( ISBLANK([$'03.Muestra'.$C16]);"";[$'03.Muestra'.$C16]) ->  | C65: of:=IF( ISBLANK([$'03.Muestra'.$E16]);"";[$'03.Muestra'.$E16]) ->  | E65: of:=IF([.D65]<>"";IF(AND([.B65]<>"";[.C65]<>"");"";"ERR");"") -> 
B66: of:=IF( ISBLANK([$'03.Muestra'.$C17]);"";[$'03.Muestra'.$C17]) ->  | C66: of:=IF( ISBLANK([$'03.Muestra'.$E17]);"";[$'03.Muestra'.$E17]) ->  | E66: of:=IF([.D66]<>"";IF(AND([.B66]<>"";[.C66]<>"");"";"ERR");"") -> 
B67: of:=IF( ISBLANK([$'03.Muestra'.$C18]);"";[$'03.Muestra'.$C18]) ->  | C67: of:=IF( ISBLANK([$'03.Muestra'.$E18]);"";[$'03.Muestra'.$E18]) ->  | E67: of:=IF([.D67]<>"";IF(AND([.B67]<>"";[.C67]<>"");"";"ERR");"") -> 
B68: of:=IF( ISBLANK([$'03.Muestra'.$C19]);"";[$'03.Muestra'.$C19]) ->  | C68: of:=IF( ISBLANK([$'03.Muestra'.$E19]);"";[$'03.Muestra'.$E19]) ->  | E68: of:=IF([.D68]<>"";IF(AND([.B68]<>"";[.C68]<>"");"";"ERR");"") -> 
B69: of:=IF( ISBLANK([$'03.Muestra'.$C20]);"";[$'03.Muestra'.$C20]) ->  | C69: of:=IF( ISBLANK([$'03.Muestra'.$E20]);"";[$'03.Muestra'.$E20]) ->  | E69: of:=IF([.D69]<>"";IF(AND([.B69]<>"";[.C69]<>"");"";"ERR");"") -> 
B70: of:=IF( ISBLANK([$'03.Muestra'.$C21]);"";[$'03.Muestra'.$C21]) ->  | C70: of:=IF( ISBLANK([$'03.Muestra'.$E21]);"";[$'03.Muestra'.$E21]) ->  | E70: of:=IF([.D70]<>"";IF(AND([.B70]<>"";[.C70]<>"");"";"ERR");"") -> 
B71: of:=IF( ISBLANK([$'03.Muestra'.$C22]);"";[$'03.Muestra'.$C22]) ->  | C71: of:=IF( ISBLANK([$'03.Muestra'.$E22]);"";[$'03.Muestra'.$E22]) ->  | E71: of:=IF([.D71]<>"";IF(AND([.B71]<>"";[.C71]<>"");"";"ERR");"") -> 
B72: of:=IF( ISBLANK([$'03.Muestra'.$C23]);"";[$'03.Muestra'.$C23]) ->  | C72: of:=IF( ISBLANK([$'03.Muestra'.$E23]);"";[$'03.Muestra'.$E23]) ->  | E72: of:=IF([.D72]<>"";IF(AND([.B72]<>"";[.C72]<>"");"";"ERR");"") -> 
B73: of:=IF( ISBLANK([$'03.Muestra'.$C24]);"";[$'03.Muestra'.$C24]) ->  | C73: of:=IF( ISBLANK([$'03.Muestra'.$E24]);"";[$'03.Muestra'.$E24]) ->  | E73: of:=IF([.D73]<>"";IF(AND([.B73]<>"";[.C73]<>"");"";"ERR");"") -> 
B74: of:=IF( ISBLANK([$'03.Muestra'.$C25]);"";[$'03.Muestra'.$C25]) ->  | C74: of:=IF( ISBLANK([$'03.Muestra'.$E25]);"";[$'03.Muestra'.$E25]) ->  | E74: of:=IF([.D74]<>"";IF(AND([.B74]<>"";[.C74]<>"");"";"ERR");"") -> 
B75: of:=IF( ISBLANK([$'03.Muestra'.$C26]);"";[$'03.Muestra'.$C26]) ->  | C75: of:=IF( ISBLANK([$'03.Muestra'.$E26]);"";[$'03.Muestra'.$E26]) ->  | E75: of:=IF([.D75]<>"";IF(AND([.B75]<>"";[.C75]<>"");"";"ERR");"") -> 
B76: of:=IF( ISBLANK([$'03.Muestra'.$C27]);"";[$'03.Muestra'.$C27]) ->  | C76: of:=IF( ISBLANK([$'03.Muestra'.$E27]);"";[$'03.Muestra'.$E27]) ->  | E76: of:=IF([.D76]<>"";IF(AND([.B76]<>"";[.C76]<>"");"";"ERR");"") -> 
B77: of:=IF( ISBLANK([$'03.Muestra'.$C28]);"";[$'03.Muestra'.$C28]) ->  | C77: of:=IF( ISBLANK([$'03.Muestra'.$E28]);"";[$'03.Muestra'.$E28]) ->  | E77: of:=IF([.D77]<>"";IF(AND([.B77]<>"";[.C77]<>"");"";"ERR");"") -> 
B78: of:=IF( ISBLANK([$'03.Muestra'.$C29]);"";[$'03.Muestra'.$C29]) ->  | C78: of:=IF( ISBLANK([$'03.Muestra'.$E29]);"";[$'03.Muestra'.$E29]) ->  | E78: of:=IF([.D78]<>"";IF(AND([.B78]<>"";[.C78]<>"");"";"ERR");"") -> 
B79: of:=IF( ISBLANK([$'03.Muestra'.$C30]);"";[$'03.Muestra'.$C30]) ->  | C79: of:=IF( ISBLANK([$'03.Muestra'.$E30]);"";[$'03.Muestra'.$E30]) ->  | E79: of:=IF([.D79]<>"";IF(AND([.B79]<>"";[.C79]<>"");"";"ERR");"") -> 
B80: of:=IF( ISBLANK([$'03.Muestra'.$C31]);"";[$'03.Muestra'.$C31]) ->  | C80: of:=IF( ISBLANK([$'03.Muestra'.$E31]);"";[$'03.Muestra'.$E31]) ->  | E80: of:=IF([.D80]<>"";IF(AND([.B80]<>"";[.C80]<>"");"";"ERR");"") -> 
B81: of:=IF( ISBLANK([$'03.Muestra'.$C32]);"";[$'03.Muestra'.$C32]) ->  | C81: of:=IF( ISBLANK([$'03.Muestra'.$E32]);"";[$'03.Muestra'.$E32]) ->  | E81: of:=IF([.D81]<>"";IF(AND([.B81]<>"";[.C81]<>"");"";"ERR");"") -> 
B82: of:=IF( ISBLANK([$'03.Muestra'.$C33]);"";[$'03.Muestra'.$C33]) ->  | C82: of:=IF( ISBLANK([$'03.Muestra'.$E33]);"";[$'03.Muestra'.$E33]) ->  | E82: of:=IF([.D82]<>"";IF(AND([.B82]<>"";[.C82]<>"");"";"ERR");"") -> 
B83: of:=IF( ISBLANK([$'03.Muestra'.$C34]);"";[$'03.Muestra'.$C34]) ->  | C83: of:=IF( ISBLANK([$'03.Muestra'.$E34]);"";[$'03.Muestra'.$E34]) ->  | E83: of:=IF([.D83]<>"";IF(AND([.B83]<>"";[.C83]<>"");"";"ERR");"") -> 
B84: of:=IF( ISBLANK([$'03.Muestra'.$C35]);"";[$'03.Muestra'.$C35]) ->  | C84: of:=IF( ISBLANK([$'03.Muestra'.$E35]);"";[$'03.Muestra'.$E35]) ->  | E84: of:=IF([.D84]<>"";IF(AND([.B84]<>"";[.C84]<>"");"";"ERR");"") -> 
B85: of:=IF( ISBLANK([$'03.Muestra'.$C36]);"";[$'03.Muestra'.$C36]) ->  | C85: of:=IF( ISBLANK([$'03.Muestra'.$E36]);"";[$'03.Muestra'.$E36]) ->  | E85: of:=IF([.D85]<>"";IF(AND([.B85]<>"";[.C85]<>"");"";"ERR");"") -> 
B86: of:=IF( ISBLANK([$'03.Muestra'.$C37]);"";[$'03.Muestra'.$C37]) ->  | C86: of:=IF( ISBLANK([$'03.Muestra'.$E37]);"";[$'03.Muestra'.$E37]) ->  | E86: of:=IF([.D86]<>"";IF(AND([.B86]<>"";[.C86]<>"");"";"ERR");"") -> 
B87: of:=IF( ISBLANK([$'03.Muestra'.$C38]);"";[$'03.Muestra'.$C38]) ->  | C87: of:=IF( ISBLANK([$'03.Muestra'.$E38]);"";[$'03.Muestra'.$E38]) ->  | E87: of:=IF([.D87]<>"";IF(AND([.B87]<>"";[.C87]<>"");"";"ERR");"") -> 
B88: of:=IF( ISBLANK([$'03.Muestra'.$C39]);"";[$'03.Muestra'.$C39]) ->  | C88: of:=IF( ISBLANK([$'03.Muestra'.$E39]);"";[$'03.Muestra'.$E39]) ->  | E88: of:=IF([.D88]<>"";IF(AND([.B88]<>"";[.C88]<>"");"";"ERR");"") -> 
B89: of:=IF( ISBLANK([$'03.Muestra'.$C40]);"";[$'03.Muestra'.$C40]) ->  | C89: of:=IF( ISBLANK([$'03.Muestra'.$E40]);"";[$'03.Muestra'.$E40]) ->  | E89: of:=IF([.D89]<>"";IF(AND([.B89]<>"";[.C89]<>"");"";"ERR");"") -> 
B90: of:=IF( ISBLANK([$'03.Muestra'.$C41]);"";[$'03.Muestra'.$C41]) ->  | C90: of:=IF( ISBLANK([$'03.Muestra'.$E41]);"";[$'03.Muestra'.$E41]) ->  | E90: of:=IF([.D90]<>"";IF(AND([.B90]<>"";[.C90]<>"");"";"ERR");"") -> 
B91: of:=IF( ISBLANK([$'03.Muestra'.$C42]);"";[$'03.Muestra'.$C42]) ->  | C91: of:=IF( ISBLANK([$'03.Muestra'.$E42]);"";[$'03.Muestra'.$E42]) ->  | E91: of:=IF([.D91]<>"";IF(AND([.B91]<>"";[.C91]<>"");"";"ERR");"") -> 
B94: A | C94: 1.2.2 Subtítulos (grabados) | D94: Resultado
B95: of:=IF( ISBLANK([$'03.Muestra'.$C8]);"";[$'03.Muestra'.$C8]) ->  | C95: of:=IF( ISBLANK([$'03.Muestra'.$E8]);"";[$'03.Muestra'.$E8]) ->  | E95: of:=IF([.D95]<>"";IF(AND([.B95]<>"";[.C95]<>"");"";"ERR");"") ->  | F95: N/T | G95: N/D | H95: N/A | I95: Falla | J95: Pasa | K95: En blanco
B96: of:=IF( ISBLANK([$'03.Muestra'.$C9]);"";[$'03.Muestra'.$C9]) ->  | C96: of:=IF( ISBLANK([$'03.Muestra'.$E9]);"";[$'03.Muestra'.$E9]) ->  | E96: of:=IF([.D96]<>"";IF(AND([.B96]<>"";[.C96]<>"");"";"ERR");"") ->  | F96: of:=COUNTIF([.$D95]:INDIRECT("$D" &  SUM(ROW()-1;['03.Muestra'.$D$45])-1);[.F95]) -> 0 | G96: of:=COUNTIF([.$D95]:INDIRECT("$D" &  SUM(ROW()-1;['03.Muestra'.$D$45])-1);[.G95]) -> 0 | H96: of:=COUNTIF([.$D95]:INDIRECT("$D" &  SUM(ROW()-1;['03.Muestra'.$D$45])-1);[.H95]) -> 0 | I96: of:=COUNTIF([.$D95]:INDIRECT("$D" &  SUM(ROW()-1;['03.Muestra'.$D$45])-1);[.I95]) -> 0 | J96: of:=COUNTIF([.$D95]:INDIRECT("$D" &  SUM(ROW()-1;['03.Muestra'.$D$45])-1);[.J95]) -> 0 | K96: of:=IF(['03.Muestra'.$D$45]=0;0;COUNTBLANK([.$D95]:INDIRECT("$D" &  SUM(ROW()-1;['03.Muestra'.$D$45])-1))) -> 0
B97: of:=IF( ISBLANK([$'03.Muestra'.$C10]);"";[$'03.Muestra'.$C10]) ->  | C97: of:=IF( ISBLANK([$'03.Muestra'.$E10]);"";[$'03.Muestra'.$E10]) ->  | E97: of:=IF([.D97]<>"";IF(AND([.B97]<>"";[.C97]<>"");"";"ERR");"") -> 
B98: of:=IF( ISBLANK([$'03.Muestra'.$C11]);"";[$'03.Muestra'.$C11]) ->  | C98: of:=IF( ISBLANK([$'03.Muestra'.$E11]);"";[$'03.Muestra'.$E11]) ->  | E98: of:=IF([.D98]<>"";IF(AND([.B98]<>"";[.C98]<>"");"";"ERR");"") -> 
B99: of:=IF( ISBLANK([$'03.Muestra'.$C12]);"";[$'03.Muestra'.$C12]) ->  | C99: of:=IF( ISBLANK([$'03.Muestra'.$E12]);"";[$'03.Muestra'.$E12]) ->  | E99: of:=IF([.D99]<>"";IF(AND([.B99]<>"";[.C99]<>"");"";"ERR");"") -> 
B100: of:=IF( ISBLANK([$'03.Muestra'.$C13]);"";[$'03.Muestra'.$C13]) ->  | C100: of:=IF( ISBLANK([$'03.Muestra'.$E13]);"";[$'03.Muestra'.$E13]) ->  | E100: of:=IF([.D100]<>"";IF(AND([.B100]<>"";[.C100]<>"");"";"ERR");"") -> 
B101: of:=IF( ISBLANK([$'03.Muestra'.$C14]);"";[$'03.Muestra'.$C14]) ->  | C101: of:=IF( ISBLANK([$'03.Muestra'.$E14]);"";[$'03.Muestra'.$E14]) ->  | E101: of:=IF([.D101]<>"";IF(AND([.B101]<>"";[.C101]<>"");"";"ERR");"") -> 
B102: of:=IF( ISBLANK([$'03.Muestra'.$C15]);"";[$'03.Muestra'.$C15]) ->  | C102: of:=IF( ISBLANK([$'03.Muestra'.$E15]);"";[$'03.Muestra'.$E15]) ->  | E102: of:=IF([.D102]<>"";IF(AND([.B102]<>"";[.C102]<>"");"";"ERR");"") -> 
B103: of:=IF( ISBLANK([$'03.Muestra'.$C16]);"";[$'03.Muestra'.$C16]) ->  | C103: of:=IF( ISBLANK([$'03.Muestra'.$E16]);"";[$'03.Muestra'.$E16]) ->  | E103: of:=IF([.D103]<>"";IF(AND([.B103]<>"";[.C103]<>"");"";"ERR");"") -> 
B104: of:=IF( ISBLANK([$'03.Muestra'.$C17]);"";[$'03.Muestra'.$C17]) ->  | C104: of:=IF( ISBLANK([$'03.Muestra'.$E17]);"";[$'03.Muestra'.$E17]) ->  | E104: of:=IF([.D104]<>"";IF(AND([.B104]<>"";[.C104]<>"");"";"ERR");"") -> 
B105: of:=IF( ISBLANK([$'03.Muestra'.$C18]);"";[$'03.Muestra'.$C18]) ->  | C105: of:=IF( ISBLANK([$'03.Muestra'.$E18]);"";[$'03.Muestra'.$E18]) ->  | E105: of:=IF([.D105]<>"";IF(AND([.B105]<>"";[.C105]<>"");"";"ERR");"") -> 
B106: of:=IF( ISBLANK([$'03.Muestra'.$C19]);"";[$'03.Muestra'.$C19]) ->  | C106: of:=IF( ISBLANK([$'03.Muestra'.$E19]);"";[$'03.Muestra'.$E19]) ->  | E106: of:=IF([.D106]<>"";IF(AND([.B106]<>"";[.C106]<>"");"";"ERR");"") -> 
B107: of:=IF( ISBLANK([$'03.Muestra'.$C20]);"";[$'03.Muestra'.$C20]) ->  | C107: of:=IF( ISBLANK([$'03.Muestra'.$E20]);"";[$'03.Muestra'.$E20]) ->  | E107: of:=IF([.D107]<>"";IF(AND([.B107]<>"";[.C107]<>"");"";"ERR");"") -> 
B108: of:=IF( ISBLANK([$'03.Muestra'.$C21]);"";[$'03.Muestra'.$C21]) ->  | C108: of:=IF( ISBLANK([$'03.Muestra'.$E21]);"";[$'03.Muestra'.$E21]) ->  | E108: of:=IF([.D108]<>"";IF(AND([.B108]<>"";[.C108]<>"");"";"ERR");"") -> 
B109: of:=IF( ISBLANK([$'03.Muestra'.$C22]);"";[$'03.Muestra'.$C22]) ->  | C109: of:=IF( ISBLANK([$'03.Muestra'.$E22]);"";[$'03.Muestra'.$E22]) ->  | E109: of:=IF([.D109]<>"";IF(AND([.B109]<>"";[.C109]<>"");"";"ERR");"") -> 
B110: of:=IF( ISBLANK([$'03.Muestra'.$C23]);"";[$'03.Muestra'.$C23]) ->  | C110: of:=IF( ISBLANK([$'03.Muestra'.$E23]);"";[$'03.Muestra'.$E23]) ->  | E110: of:=IF([.D110]<>"";IF(AND([.B110]<>"";[.C110]<>"");"";"ERR");"") -> 
B111: of:=IF( ISBLANK([$'03.Muestra'.$C24]);"";[$'03.Muestra'.$C24]) ->  | C111: of:=IF( ISBLANK([$'03.Muestra'.$E24]);"";[$'03.Muestra'.$E24]) ->  | E111: of:=IF([.D111]<>"";IF(AND([.B111]<>"";[.C111]<>"");"";"ERR");"") -> 
B112: of:=IF( ISBLANK([$'03.Muestra'.$C25]);"";[$'03.Muestra'.$C25]) ->  | C112: of:=IF( ISBLANK([$'03.Muestra'.$E25]);"";[$'03.Muestra'.$E25]) ->  | E112: of:=IF([.D112]<>"";IF(AND([.B112]<>"";[.C112]<>"");"";"ERR");"") -> 
B113: of:=IF( ISBLANK([$'03.Muestra'.$C26]);"";[$'03.Muestra'.$C26]) ->  | C113: of:=IF( ISBLANK([$'03.Muestra'.$E26]);"";[$'03.Muestra'.$E26]) ->  | E113: of:=IF([.D113]<>"";IF(AND([.B113]<>"";[.C113]<>"");"";"ERR");"") -> 
B114: of:=IF( ISBLANK([$'03.Muestra'.$C27]);"";[$'03.Muestra'.$C27]) ->  | C114: of:=IF( ISBLANK([$'03.Muestra'.$E27]);"";[$'03.Muestra'.$E27]) ->  | E114: of:=IF([.D114]<>"";IF(AND([.B114]<>"";[.C114]<>"");"";"ERR");"") -> 
B115: of:=IF( ISBLANK([$'03.Muestra'.$C28]);"";[$'03.Muestra'.$C28]) ->  | C115: of:=IF( ISBLANK([$'03.Muestra'.$E28]);"";[$'03.Muestra'.$E28]) ->  | E115: of:=IF([.D115]<>"";IF(AND([.B115]<>"";[.C115]<>"");"";"ERR");"") -> 
B116: of:=IF( ISBLANK([$'03.Muestra'.$C29]);"";[$'03.Muestra'.$C29]) ->  | C116: of:=IF( ISBLANK([$'03.Muestra'.$E29]);"";[$'03.Muestra'.$E29]) ->  | E116: of:=IF([.D116]<>"";IF(AND([.B116]<>"";[.C116]<>"");"";"ERR");"") -> 
B117: of:=IF( ISBLANK([$'03.Muestra'.$C30]);"";[$'03.Muestra'.$C30]) ->  | C117: of:=IF( ISBLANK([$'03.Muestra'.$E30]);"";[$'03.Muestra'.$E30]) ->  | E117: of:=IF([.D117]<>"";IF(AND([.B117]<>"";[.C117]<>"");"";"ERR");"") -> 
B118: of:=IF( ISBLANK([$'03.Muestra'.$C31]);"";[$'03.Muestra'.$C31]) ->  | C118: of:=IF( ISBLANK([$'03.Muestra'.$E31]);"";[$'03.Muestra'.$E31]) ->  | E118: of:=IF([.D118]<>"";IF(AND([.B118]<>"";[.C118]<>"");"";"ERR");"") -> 
B119: of:=IF( ISBLANK([$'03.Muestra'.$C32]);"";[$'03.Muestra'.$C32]) ->  | C119: of:=IF( ISBLANK([$'03.Muestra'.$E32]);"";[$'03.Muestra'.$E32]) ->  | E119: of:=IF([.D119]<>"";IF(AND([.B119]<>"";[.C119]<>"");"";"ERR");"") -> 
B120: of:=IF( ISBLANK([$'03.Muestra'.$C33]);"";[$'03.Muestra'.$C33]) ->  | C120: of:=IF( ISBLANK([$'03.Muestra'.$E33]);"";[$'03.Muestra'.$E33]) ->  | E120: of:=IF([.D120]<>"";IF(AND([.B120]<>"";[.C120]<>"");"";"ERR");"") -> 
B121: of:=IF( ISBLANK([$'03.Muestra'.$C34]);"";[$'03.Muestra'.$C34]) ->  | C121: of:=IF( ISBLANK([$'03.Muestra'.$E34]);"";[$'03.Muestra'.$E34]) ->  | E121: of:=IF([.D121]<>"";IF(AND([.B121]<>"";[.C121]<>"");"";"ERR");"") -> 
B122: of:=IF( ISBLANK([$'03.Muestra'.$C35]);"";[$'03.Muestra'.$C35]) ->  | C122: of:=IF( ISBLANK([$'03.Muestra'.$E35]);"";[$'03.Muestra'.$E35]) ->  | E122: of:=IF([.D122]<>"";IF(AND([.B122]<>"";[.C122]<>"");"";"ERR");"") -> 
B123: of:=IF( ISBLANK([$'03.Muestra'.$C36]);"";[$'03.Muestra'.$C36]) ->  | C123: of:=IF( ISBLANK([$'03.Muestra'.$E36]);"";[$'03.Muestra'.$E36]) ->  | E123: of:=IF([.D123]<>"";IF(AND([.B123]<>"";[.C123]<>"");"";"ERR");"") -> 
B124: of:=IF( ISBLANK([$'03.Muestra'.$C37]);"";[$'03.Muestra'.$C37]) ->  | C124: of:=IF( ISBLANK([$'03.Muestra'.$E37]);"";[$'03.Muestra'.$E37]) ->  | E124: of:=IF([.D124]<>"";IF(AND([.B124]<>"";[.C124]<>"");"";"ERR");"") -> 
B125: of:=IF( ISBLANK([$'03.Muestra'.$C38]);"";[$'03.Muestra'.$C38]) ->  | C125: of:=IF( ISBLANK([$'03.Muestra'.$E38]);"";[$'03.Muestra'.$E38]) ->  | E125: of:=IF([.D125]<>"";IF(AND([.B125]<>"";[.C125]<>"");"";"ERR");"") -> 
B126: of:=IF( ISBLANK([$'03.Muestra'.$C39]);"";[$'03.Muestra'.$C39]) ->  | C126: of:=IF( ISBLANK([$'03.Muestra'.$E39]);"";[$'03.Muestra'.$E39]) ->  | E126: of:=IF([.D126]<>"";IF(AND([.B126]<>"";[.C126]<>"");"";"ERR");"") -> 
B127: of:=IF( ISBLANK([$'03.Muestra'.$C40]);"";[$'03.Muestra'.$C40]) ->  | C127: of:=IF( ISBLANK([$'03.Muestra'.$E40]);"";[$'03.Muestra'.$E40]) ->  | E127: of:=IF([.D127]<>"";IF(AND([.B127]<>"";[.C127]<>"");"";"ERR");"") -> 
B128: of:=IF( ISBLANK([$'03.Muestra'.$C41]);"";[$'03.Muestra'.$C41]) ->  | C128: of:=IF( ISBLANK([$'03.Muestra'.$E41]);"";[$'03.Muestra'.$E41]) ->  | E128: of:=IF([.D128]<>"";IF(AND([.B128]<>"";[.C128]<>"");"";"ERR");"") -> 
B129: of:=IF( ISBLANK([$'03.Muestra'.$C42]);"";[$'03.Muestra'.$C42]) ->  | C129: of:=IF( ISBLANK([$'03.Muestra'.$E42]);"";[$'03.Muestra'.$E42]) ->  | E129: of:=IF([.D129]<>"";IF(AND([.B129]<>"";[.C129]<>"");"";"ERR");"") -> 
B132: A | C132: 1.2.3 Audiodescripción o Medio Alternativo (grabado) | D132: Resultado
B133: of:=IF( ISBLANK([$'03.Muestra'.$C8]);"";[$'03.Muestra'.$C8]) ->  | C133: of:=IF( ISBLANK([$'03.Muestra'.$E8]);"";[$'03.Muestra'.$E8]) ->  | E133: of:=IF([.D133]<>"";IF(AND([.B133]<>"";[.C133]<>"");"";"ERR");"") ->  | F133: N/T | G133: N/D | H133: N/A | I133: Falla | J133: Pasa | K133: En blanco
B134: of:=IF( ISBLANK([$'03.Muestra'.$C9]);"";[$'03.Muestra'.$C9]) ->  | C134: of:=IF( ISBLANK([$'03.Muestra'.$E9]);"";[$'03.Muestra'.$E9]) ->  | E134: of:=IF([.D134]<>"";IF(AND([.B134]<>"";[.C134]<>"");"";"ERR");"") ->  | F134: of:=COUNTIF([.$D133]:INDIRECT("$D" &  SUM(ROW()-1;['03.Muestra'.$D$45])-1);[.F133]) -> 0 | G134: of:=COUNTIF([.$D133]:INDIRECT("$D" &  SUM(ROW()-1;['03.Muestra'.$D$45])-1);[.G133]) -> 0 | H134: of:=COUNTIF([.$D133]:INDIRECT("$D" &  SUM(ROW()-1;['03.Muestra'.$D$45])-1);[.H133]) -> 0 | I134: of:=COUNTIF([.$D133]:INDIRECT("$D" &  SUM(ROW()-1;['03.Muestra'.$D$45])-1);[.I133]) -> 0 | J134: of:=COUNTIF([.$D133]:INDIRECT("$D" &  SUM(ROW()-1;['03.Muestra'.$D$45])-1);[.J133]) -> 0 | K134: of:=IF(['03.Muestra'.$D$45]=0;0;COUNTBLANK([.$D133]:INDIRECT("$D" &  SUM(ROW()-1;['03.Muestra'.$D$45])-1))) -> 0
B135: of:=IF( ISBLANK([$'03.Muestra'.$C10]);"";[$'03.Muestra'.$C10]) ->  | C135: of:=IF( ISBLANK([$'03.Muestra'.$E10]);"";[$'03.Muestra'.$E10]) ->  | E135: of:=IF([.D135]<>"";IF(AND([.B135]<>"";[.C135]<>"");"";"ERR");"") -> 
B136: of:=IF( ISBLANK([$'03.Muestra'.$C11]);"";[$'03.Muestra'.$C11]) ->  | C136: of:=IF( ISBLANK([$'03.Muestra'.$E11]);"";[$'03.Muestra'.$E11]) ->  | E136: of:=IF([.D136]<>"";IF(AND([.B136]<>"";[.C136]<>"");"";"ERR");"") -> 
B137: of:=IF( ISBLANK([$'03.Muestra'.$C12]);"";[$'03.Muestra'.$C12]) ->  | C137: of:=IF( ISBLANK([$'03.Muestra'.$E12]);"";[$'03.Muestra'.$E12]) ->  | E137: of:=IF([.D137]<>"";IF(AND([.B137]<>"";[.C137]<>"");"";"ERR");"") -> 
B138: of:=IF( ISBLANK([$'03.Muestra'.$C13]);"";[$'03.Muestra'.$C13]) ->  | C138: of:=IF( ISBLANK([$'03.Muestra'.$E13]);"";[$'03.Muestra'.$E13]) ->  | E138: of:=IF([.D138]<>"";IF(AND([.B138]<>"";[.C138]<>"");"";"ERR");"") -> 
B139: of:=IF( ISBLANK([$'03.Muestra'.$C14]);"";[$'03.Muestra'.$C14]) ->  | C139: of:=IF( ISBLANK([$'03.Muestra'.$E14]);"";[$'03.Muestra'.$E14]) ->  | E139: of:=IF([.D139]<>"";IF(AND([.B139]<>"";[.C139]<>"");"";"ERR");"") -> 
B140: of:=IF( ISBLANK([$'03.Muestra'.$C15]);"";[$'03.Muestra'.$C15]) ->  | C140: of:=IF( ISBLANK([$'03.Muestra'.$E15]);"";[$'03.Muestra'.$E15]) ->  | E140: of:=IF([.D140]<>"";IF(AND([.B140]<>"";[.C140]<>"");"";"ERR");"") -> 
B141: of:=IF( ISBLANK([$'03.Muestra'.$C16]);"";[$'03.Muestra'.$C16]) ->  | C141: of:=IF( ISBLANK([$'03.Muestra'.$E16]);"";[$'03.Muestra'.$E16]) ->  | E141: of:=IF([.D141]<>"";IF(AND([.B141]<>"";[.C141]<>"");"";"ERR");"") -> 
B142: of:=IF( ISBLANK([$'03.Muestra'.$C17]);"";[$'03.Muestra'.$C17]) ->  | C142: of:=IF( ISBLANK([$'03.Muestra'.$E17]);"";[$'03.Muestra'.$E17]) ->  | E142: of:=IF([.D142]<>"";IF(AND([.B142]<>"";[.C142]<>"");"";"ERR");"") -> 
B143: of:=IF( ISBLANK([$'03.Muestra'.$C18]);"";[$'03.Muestra'.$C18]) ->  | C143: of:=IF( ISBLANK([$'03.Muestra'.$E18]);"";[$'03.Muestra'.$E18]) ->  | E143: of:=IF([.D143]<>"";IF(AND([.B143]<>"";[.C143]<>"");"";"ERR");"") -> 
B144: of:=IF( ISBLANK([$'03.Muestra'.$C19]);"";[$'03.Muestra'.$C19]) ->  | C144: of:=IF( ISBLANK([$'03.Muestra'.$E19]);"";[$'03.Muestra'.$E19]) ->  | E144: of:=IF([.D144]<>"";IF(AND([.B144]<>"";[.C144]<>"");"";"ERR");"") -> 
B145: of:=IF( ISBLANK([$'03.Muestra'.$C20]);"";[$'03.Muestra'.$C20]) ->  | C145: of:=IF( ISBLANK([$'03.Muestra'.$E20]);"";[$'03.Muestra'.$E20]) ->  | E145: of:=IF([.D145]<>"";IF(AND([.B145]<>"";[.C145]<>"");"";"ERR");"") -> 
B146: of:=IF( ISBLANK([$'03.Muestra'.$C21]);"";[$'03.Muestra'.$C21]) ->  | C146: of:=IF( ISBLANK([$'03.Muestra'.$E21]);"";[$'03.Muestra'.$E21]) ->  | E146: of:=IF([.D146]<>"";IF(AND([.B146]<>"";[.C146]<>"");"";"ERR");"") -> 
B147: of:=IF( ISBLANK([$'03.Muestra'.$C22]);"";[$'03.Muestra'.$C22]) ->  | C147: of:=IF( ISBLANK([$'03.Muestra'.$E22]);"";[$'03.Muestra'.$E22]) ->  | E147: of:=IF([.D147]<>"";IF(AND([.B147]<>"";[.C147]<>"");"";"ERR");"") -> 
B148: of:=IF( ISBLANK([$'03.Muestra'.$C23]);"";[$'03.Muestra'.$C23]) ->  | C148: of:=IF( ISBLANK([$'03.Muestra'.$E23]);"";[$'03.Muestra'.$E23]) ->  | E148: of:=IF([.D148]<>"";IF(AND([.B148]<>"";[.C148]<>"");"";"ERR");"") -> 
B149: of:=IF( ISBLANK([$'03.Muestra'.$C24]);"";[$'03.Muestra'.$C24]) ->  | C149: of:=IF( ISBLANK([$'03.Muestra'.$E24]);"";[$'03.Muestra'.$E24]) ->  | E149: of:=IF([.D149]<>"";IF(AND([.B149]<>"";[.C149]<>"");"";"ERR");"") -> 
B150: of:=IF( ISBLANK([$'03.Muestra'.$C25]);"";[$'03.Muestra'.$C25]) ->  | C150: of:=IF( ISBLANK([$'03.Muestra'.$E25]);"";[$'03.Muestra'.$E25]) ->  | E150: of:=IF([.D150]<>"";IF(AND([.B150]<>"";[.C150]<>"");"";"ERR");"") -> 
B151: of:=IF( ISBLANK([$'03.Muestra'.$C26]);"";[$'03.Muestra'.$C26]) ->  | C151: of:=IF( ISBLANK([$'03.Muestra'.$E26]);"";[$'03.Muestra'.$E26]) ->  | E151: of:=IF([.D151]<>"";IF(AND([.B151]<>"";[.C151]<>"");"";"ERR");"") -> 
B152: of:=IF( ISBLANK([$'03.Muestra'.$C27]);"";[$'03.Muestra'.$C27]) ->  | C152: of:=IF( ISBLANK([$'03.Muestra'.$E27]);"";[$'03.Muestra'.$E27]) ->  | E152: of:=IF([.D152]<>"";IF(AND([.B152]<>"";[.C152]<>"");"";"ERR");"") -> 
B153: of:=IF( ISBLANK([$'03.Muestra'.$C28]);"";[$'03.Muestra'.$C28]) ->  | C153: of:=IF( ISBLANK([$'03.Muestra'.$E28]);"";[$'03.Muestra'.$E28]) ->  | E153: of:=IF([.D153]<>"";IF(AND([.B153]<>"";[.C153]<>"");"";"ERR");"") -> 
B154: of:=IF( ISBLANK([$'03.Muestra'.$C29]);"";[$'03.Muestra'.$C29]) ->  | C154: of:=IF( ISBLANK([$'03.Muestra'.$E29]);"";[$'03.Muestra'.$E29]) ->  | E154: of:=IF([.D154]<>"";IF(AND([.B154]<>"";[.C154]<>"");"";"ERR");"") -> 
B155: of:=IF( ISBLANK([$'03.Muestra'.$C30]);"";[$'03.Muestra'.$C30]) ->  | C155: of:=IF( ISBLANK([$'03.Muestra'.$E30]);"";[$'03.Muestra'.$E30]) ->  | E155: of:=IF([.D155]<>"";IF(AND([.B155]<>"";[.C155]<>"");"";"ERR");"") -> 
B156: of:=IF( ISBLANK([$'03.Muestra'.$C31]);"";[$'03.Muestra'.$C31]) ->  | C156: of:=IF( ISBLANK([$'03.Muestra'.$E31]);"";[$'03.Muestra'.$E31]) ->  | E156: of:=IF([.D156]<>"";IF(AND([.B156]<>"";[.C156]<>"");"";"ERR");"") -> 
B157: of:=IF( ISBLANK([$'03.Muestra'.$C32]);"";[$'03.Muestra'.$C32]) ->  | C157: of:=IF( ISBLANK([$'03.Muestra'.$E32]);"";[$'03.Muestra'.$E32]) ->  | E157: of:=IF([.D157]<>"";IF(AND([.B157]<>"";[.C157]<>"");"";"ERR");"") -> 
B158: of:=IF( ISBLANK([$'03.Muestra'.$C33]);"";[$'03.Muestra'.$C33]) ->  | C158: of:=IF( ISBLANK([$'03.Muestra'.$E33]);"";[$'03.Muestra'.$E33]) ->  | E158: of:=IF([.D158]<>"";IF(AND([.B158]<>"";[.C158]<>"");"";"ERR");"") -> 
B159: of:=IF( ISBLANK([$'03.Muestra'.$C34]);"";[$'03.Muestra'.$C34]) ->  | C159: of:=IF( ISBLANK([$'03.Muestra'.$E34]);"";[$'03.Muestra'.$E34]) ->  | E159: of:=IF([.D159]<>"";IF(AND([.B159]<>"";[.C159]<>"");"";"ERR");"") -> 
B160: of:=IF( ISBLANK([$'03.Muestra'.$C35]);"";[$'03.Muestra'.$C35]) ->  | C160: of:=IF( ISBLANK([$'03.Muestra'.$E35]);"";[$'03.Muestra'.$E35]) ->  | E160: of:=IF([.D160]<>"";IF(AND([.B160]<>"";[.C160]<>"");"";"ERR");"") -> 
B161: of:=IF( ISBLANK([$'03.Muestra'.$C36]);"";[$'03.Muestra'.$C36]) ->  | C161: of:=IF( ISBLANK([$'03.Muestra'.$E36]);"";[$'03.Muestra'.$E36]) ->  | E161: of:=IF([.D161]<>"";IF(AND([.B161]<>"";[.C161]<>"");"";"ERR");"") -> 
B162: of:=IF( ISBLANK([$'03.Muestra'.$C37]);"";[$'03.Muestra'.$C37]) ->  | C162: of:=IF( ISBLANK([$'03.Muestra'.$E37]);"";[$'03.Muestra'.$E37]) ->  | E162: of:=IF([.D162]<>"";IF(AND([.B162]<>"";[.C162]<>"");"";"ERR");"") -> 
B163: of:=IF( ISBLANK([$'03.Muestra'.$C38]);"";[$'03.Muestra'.$C38]) ->  | C163: of:=IF( ISBLANK([$'03.Muestra'.$E38]);"";[$'03.Muestra'.$E38]) ->  | E163: of:=IF([.D163]<>"";IF(AND([.B163]<>"";[.C163]<>"");"";"ERR");"") -> 
B164: of:=IF( ISBLANK([$'03.Muestra'.$C39]);"";[$'03.Muestra'.$C39]) ->  | C164: of:=IF( ISBLANK([$'03.Muestra'.$E39]);"";[$'03.Muestra'.$E39]) ->  | E164: of:=IF([.D164]<>"";IF(AND([.B164]<>"";[.C164]<>"");"";"ERR");"") -> 
B165: of:=IF( ISBLANK([$'03.Muestra'.$C40]);"";[$'03.Muestra'.$C40]) ->  | C165: of:=IF( ISBLANK([$'03.Muestra'.$E40]);"";[$'03.Muestra'.$E40]) ->  | E165: of:=IF([.D165]<>"";IF(AND([.B165]<>"";[.C165]<>"");"";"ERR");"") -> 
B166: of:=IF( ISBLANK([$'03.Muestra'.$C41]);"";[$'03.Muestra'.$C41]) ->  | C166: of:=IF( ISBLANK([$'03.Muestra'.$E41]);"";[$'03.Muestra'.$E41]) ->  | E166: of:=IF([.D166]<>"";IF(AND([.B166]<>"";[.C166]<>"");"";"ERR");"") -> 
B167: of:=IF( ISBLANK([$'03.Muestra'.$C42]);"";[$'03.Muestra'.$C42]) ->  | C167: of:=IF( ISBLANK([$'03.Muestra'.$E42]);"";[$'03.Muestra'.$E42]) ->  | E167: of:=IF([.D167]<>"";IF(AND([.B167]<>"";[.C167]<>"");"";"ERR");"") -> 
B170: AA | C170: 1.2.4 Subtítulos (en directo) | D170: Resultado
B171: of:=IF( ISBLANK([$'03.Muestra'.$C8]);"";[$'03.Muestra'.$C8]) ->  | C171: of:=IF( ISBLANK([$'03.Muestra'.$E8]);"";[$'03.Muestra'.$E8]) ->  | E171: of:=IF([.D171]<>"";IF(AND([.B171]<>"";[.C171]<>"");"";"ERR");"") ->  | F171: N/T | G171: N/D | H171: N/A | I171: Falla | J171: Pasa | K171: En blanco
B172: of:=IF( ISBLANK([$'03.Muestra'.$C9]);"";[$'03.Muestra'.$C9]) ->  | C172: of:=IF( ISBLANK([$'03.Muestra'.$E9]);"";[$'03.Muestra'.$E9]) ->  | E172: of:=IF([.D172]<>"";IF(AND([.B172]<>"";[.C172]<>"");"";"ERR");"") ->  | F172: of:=COUNTIF([.$D171]:INDIRECT("$D" &  SUM(ROW()-1;['03.Muestra'.$D$45])-1);[.F171]) -> 0 | G172: of:=COUNTIF([.$D171]:INDIRECT("$D" &  SUM(ROW()-1;['03.Muestra'.$D$45])-1);[.G171]) -> 0 | H172: of:=COUNTIF([.$D171]:INDIRECT("$D" &  SUM(ROW()-1;['03.Muestra'.$D$45])-1);[.H171]) -> 0 | I172: of:=COUNTIF([.$D171]:INDIRECT("$D" &  SUM(ROW()-1;['03.Muestra'.$D$45])-1);[.I171]) -> 0 | J172: of:=COUNTIF([.$D171]:INDIRECT("$D" &  SUM(ROW()-1;['03.Muestra'.$D$45])-1);[.J171]) -> 0 | K172: of:=IF(['03.Muestra'.$D$45]=0;0;COUNTBLANK([.$D171]:INDIRECT("$D" &  SUM(ROW()-1;['03.Muestra'.$D$45])-1))) -> 0
B173: of:=IF( ISBLANK([$'03.Muestra'.$C10]);"";[$'03.Muestra'.$C10]) ->  | C173: of:=IF( ISBLANK([$'03.Muestra'.$E10]);"";[$'03.Muestra'.$E10]) ->  | E173: of:=IF([.D173]<>"";IF(AND([.B173]<>"";[.C173]<>"");"";"ERR");"") -> 
B174: of:=IF( ISBLANK([$'03.Muestra'.$C11]);"";[$'03.Muestra'.$C11]) ->  | C174: of:=IF( ISBLANK([$'03.Muestra'.$E11]);"";[$'03.Muestra'.$E11]) ->  | E174: of:=IF([.D174]<>"";IF(AND([.B174]<>"";[.C174]<>"");"";"ERR");"") -> 
B175: of:=IF( ISBLANK([$'03.Muestra'.$C12]);"";[$'03.Muestra'.$C12]) ->  | C175: of:=IF( ISBLANK([$'03.Muestra'.$E12]);"";[$'03.Muestra'.$E12]) ->  | E175: of:=IF([.D175]<>"";IF(AND([.B175]<>"";[.C175]<>"");"";"ERR");"") -> 
B176: of:=IF( ISBLANK([$'03.Muestra'.$C13]);"";[$'03.Muestra'.$C13]) ->  | C176: of:=IF( ISBLANK([$'03.Muestra'.$E13]);"";[$'03.Muestra'.$E13]) ->  | E176: of:=IF([.D176]<>"";IF(AND([.B176]<>"";[.C176]<>"");"";"ERR");"") -> 
B177: of:=IF( ISBLANK([$'03.Muestra'.$C14]);"";[$'03.Muestra'.$C14]) ->  | C177: of:=IF( ISBLANK([$'03.Muestra'.$E14]);"";[$'03.Muestra'.$E14]) ->  | E177: of:=IF([.D177]<>"";IF(AND([.B177]<>"";[.C177]<>"");"";"ERR");"") -> 
B178: of:=IF( ISBLANK([$'03.Muestra'.$C15]);"";[$'03.Muestra'.$C15]) ->  | C178: of:=IF( ISBLANK([$'03.Muestra'.$E15]);"";[$'03.Muestra'.$E15]) ->  | E178: of:=IF([.D178]<>"";IF(AND([.B178]<>"";[.C178]<>"");"";"ERR");"") -> 
B179: of:=IF( ISBLANK([$'03.Muestra'.$C16]);"";[$'03.Muestra'.$C16]) ->  | C179: of:=IF( ISBLANK([$'03.Muestra'.$E16]);"";[$'03.Muestra'.$E16]) ->  | E179: of:=IF([.D179]<>"";IF(AND([.B179]<>"";[.C179]<>"");"";"ERR");"") -> 
B180: of:=IF( ISBLANK([$'03.Muestra'.$C17]);"";[$'03.Muestra'.$C17]) ->  | C180: of:=IF( ISBLANK([$'03.Muestra'.$E17]);"";[$'03.Muestra'.$E17]) ->  | E180: of:=IF([.D180]<>"";IF(AND([.B180]<>"";[.C180]<>"");"";"ERR");"") -> 
B181: of:=IF( ISBLANK([$'03.Muestra'.$C18]);"";[$'03.Muestra'.$C18]) ->  | C181: of:=IF( ISBLANK([$'03.Muestra'.$E18]);"";[$'03.Muestra'.$E18]) ->  | E181: of:=IF([.D181]<>"";IF(AND([.B181]<>"";[.C181]<>"");"";"ERR");"") -> 
B182: of:=IF( ISBLANK([$'03.Muestra'.$C19]);"";[$'03.Muestra'.$C19]) ->  | C182: of:=IF( ISBLANK([$'03.Muestra'.$E19]);"";[$'03.Muestra'.$E19]) ->  | E182: of:=IF([.D182]<>"";IF(AND([.B182]<>"";[.C182]<>"");"";"ERR");"") -> 
B183: of:=IF( ISBLANK([$'03.Muestra'.$C20]);"";[$'03.Muestra'.$C20]) ->  | C183: of:=IF( ISBLANK([$'03.Muestra'.$E20]);"";[$'03.Muestra'.$E20]) ->  | E183: of:=IF([.D183]<>"";IF(AND([.B183]<>"";[.C183]<>"");"";"ERR");"") -> 
B184: of:=IF( ISBLANK([$'03.Muestra'.$C21]);"";[$'03.Muestra'.$C21]) ->  | C184: of:=IF( ISBLANK([$'03.Muestra'.$E21]);"";[$'03.Muestra'.$E21]) ->  | E184: of:=IF([.D184]<>"";IF(AND([.B184]<>"";[.C184]<>"");"";"ERR");"") -> 
B185: of:=IF( ISBLANK([$'03.Muestra'.$C22]);"";[$'03.Muestra'.$C22]) ->  | C185: of:=IF( ISBLANK([$'03.Muestra'.$E22]);"";[$'03.Muestra'.$E22]) ->  | E185: of:=IF([.D185]<>"";IF(AND([.B185]<>"";[.C185]<>"");"";"ERR");"") -> 
B186: of:=IF( ISBLANK([$'03.Muestra'.$C23]);"";[$'03.Muestra'.$C23]) ->  | C186: of:=IF( ISBLANK([$'03.Muestra'.$E23]);"";[$'03.Muestra'.$E23]) ->  | E186: of:=IF([.D186]<>"";IF(AND([.B186]<>"";[.C186]<>"");"";"ERR");"") -> 
B187: of:=IF( ISBLANK([$'03.Muestra'.$C24]);"";[$'03.Muestra'.$C24]) ->  | C187: of:=IF( ISBLANK([$'03.Muestra'.$E24]);"";[$'03.Muestra'.$E24]) ->  | E187: of:=IF([.D187]<>"";IF(AND([.B187]<>"";[.C187]<>"");"";"ERR");"") -> 
B188: of:=IF( ISBLANK([$'03.Muestra'.$C25]);"";[$'03.Muestra'.$C25]) ->  | C188: of:=IF( ISBLANK([$'03.Muestra'.$E25]);"";[$'03.Muestra'.$E25]) ->  | E188: of:=IF([.D188]<>"";IF(AND([.B188]<>"";[.C188]<>"");"";"ERR");"") -> 
B189: of:=IF( ISBLANK([$'03.Muestra'.$C26]);"";[$'03.Muestra'.$C26]) ->  | C189: of:=IF( ISBLANK([$'03.Muestra'.$E26]);"";[$'03.Muestra'.$E26]) ->  | E189: of:=IF([.D189]<>"";IF(AND([.B189]<>"";[.C189]<>"");"";"ERR");"") -> 
B190: of:=IF( ISBLANK([$'03.Muestra'.$C27]);"";[$'03.Muestra'.$C27]) ->  | C190: of:=IF( ISBLANK([$'03.Muestra'.$E27]);"";[$'03.Muestra'.$E27]) ->  | E190: of:=IF([.D190]<>"";IF(AND([.B190]<>"";[.C190]<>"");"";"ERR");"") -> 
B191: of:=IF( ISBLANK([$'03.Muestra'.$C28]);"";[$'03.Muestra'.$C28]) ->  | C191: of:=IF( ISBLANK([$'03.Muestra'.$E28]);"";[$'03.Muestra'.$E28]) ->  | E191: of:=IF([.D191]<>"";IF(AND([.B191]<>"";[.C191]<>"");"";"ERR");"") -> 
B192: of:=IF( ISBLANK([$'03.Muestra'.$C29]);"";[$'03.Muestra'.$C29]) ->  | C192: of:=IF( ISBLANK([$'03.Muestra'.$E29]);"";[$'03.Muestra'.$E29]) ->  | E192: of:=IF([.D192]<>"";IF(AND([.B192]<>"";[.C192]<>"");"";"ERR");"") -> 
B193: of:=IF( ISBLANK([$'03.Muestra'.$C30]);"";[$'03.Muestra'.$C30]) ->  | C193: of:=IF( ISBLANK([$'03.Muestra'.$E30]);"";[$'03.Muestra'.$E30]) ->  | E193: of:=IF([.D193]<>"";IF(AND([.B193]<>"";[.C193]<>"");"";"ERR");"") -> 
B194: of:=IF( ISBLANK([$'03.Muestra'.$C31]);"";[$'03.Muestra'.$C31]) ->  | C194: of:=IF( ISBLANK([$'03.Muestra'.$E31]);"";[$'03.Muestra'.$E31]) ->  | E194: of:=IF([.D194]<>"";IF(AND([.B194]<>"";[.C194]<>"");"";"ERR");"") -> 
B195: of:=IF( ISBLANK([$'03.Muestra'.$C32]);"";[$'03.Muestra'.$C32]) ->  | C195: of:=IF( ISBLANK([$'03.Muestra'.$E32]);"";[$'03.Muestra'.$E32]) ->  | E195: of:=IF([.D195]<>"";IF(AND([.B195]<>"";[.C195]<>"");"";"ERR");"") -> 
B196: of:=IF( ISBLANK([$'03.Muestra'.$C33]);"";[$'03.Muestra'.$C33]) ->  | C196: of:=IF( ISBLANK([$'03.Muestra'.$E33]);"";[$'03.Muestra'.$E33]) ->  | E196: of:=IF([.D196]<>"";IF(AND([.B196]<>"";[.C196]<>"");"";"ERR");"") -> 
B197: of:=IF( ISBLANK([$'03.Muestra'.$C34]);"";[$'03.Muestra'.$C34]) ->  | C197: of:=IF( ISBLANK([$'03.Muestra'.$E34]);"";[$'03.Muestra'.$E34]) ->  | E197: of:=IF([.D197]<>"";IF(AND([.B197]<>"";[.C197]<>"");"";"ERR");"") -> 
B198: of:=IF( ISBLANK([$'03.Muestra'.$C35]);"";[$'03.Muestra'.$C35]) ->  | C198: of:=IF( ISBLANK([$'03.Muestra'.$E35]);"";[$'03.Muestra'.$E35]) ->  | E198: of:=IF([.D198]<>"";IF(AND([.B198]<>"";[.C198]<>"");"";"ERR");"") -> 
B199: of:=IF( ISBLANK([$'03.Muestra'.$C36]);"";[$'03.Muestra'.$C36]) ->  | C199: of:=IF( ISBLANK([$'03.Muestra'.$E36]);"";[$'03.Muestra'.$E36]) ->  | E199: of:=IF([.D199]<>"";IF(AND([.B199]<>"";[.C199]<>"");"";"ERR");"") -> 
B200: of:=IF( ISBLANK([$'03.Muestra'.$C37]);"";[$'03.Muestra'.$C37]) ->  | C200: of:=IF( ISBLANK([$'03.Muestra'.$E37]);"";[$'03.Muestra'.$E37]) ->  | E200: of:=IF([.D200]<>"";IF(AND([.B200]<>"";[.C200]<>"");"";"ERR");"") -> 
B201: of:=IF( ISBLANK([$'03.Muestra'.$C38]);"";[$'03.Muestra'.$C38]) ->  | C201: of:=IF( ISBLANK([$'03.Muestra'.$E38]);"";[$'03.Muestra'.$E38]) ->  | E201: of:=IF([.D201]<>"";IF(AND([.B201]<>"";[.C201]<>"");"";"ERR");"") -> 
B202: of:=IF( ISBLANK([$'03.Muestra'.$C39]);"";[$'03.Muestra'.$C39]) ->  | C202: of:=IF( ISBLANK([$'03.Muestra'.$E39]);"";[$'03.Muestra'.$E39]) ->  | E202: of:=IF([.D202]<>"";IF(AND([.B202]<>"";[.C202]<>"");"";"ERR");"") -> 
B203: of:=IF( ISBLANK([$'03.Muestra'.$C40]);"";[$'03.Muestra'.$C40]) ->  | C203: of:=IF( ISBLANK([$'03.Muestra'.$E40]);"";[$'03.Muestra'.$E40]) ->  | E203: of:=IF([.D203]<>"";IF(AND([.B203]<>"";[.C203]<>"");"";"ERR");"") -> 
B204: of:=IF( ISBLANK([$'03.Muestra'.$C41]);"";[$'03.Muestra'.$C41]) ->  | C204: of:=IF( ISBLANK([$'03.Muestra'.$E41]);"";[$'03.Muestra'.$E41]) ->  | E204: of:=IF([.D204]<>"";IF(AND([.B204]<>"";[.C204]<>"");"";"ERR");"") -> 
B205: of:=IF( ISBLANK([$'03.Muestra'.$C42]);"";[$'03.Muestra'.$C42]) ->  | C205: of:=IF( ISBLANK([$'03.Muestra'.$E42]);"";[$'03.Muestra'.$E42]) ->  | E205: of:=IF([.D205]<>"";IF(AND([.B205]<>"";[.C205]<>"");"";"ERR");"") -> 
B208: AA | C208: 1.2.5 Audiodescripción (grabado) | D208: Resultado
B209: of:=IF( ISBLANK([$'03.Muestra'.$C8]);"";[$'03.Muestra'.$C8]) ->  | C209: of:=IF( ISBLANK([$'03.Muestra'.$E8]);"";[$'03.Muestra'.$E8]) ->  | E209: of:=IF([.D209]<>"";IF(AND([.B209]<>"";[.C209]<>"");"";"ERR");"") ->  | F209: N/T | G209: N/D | H209: N/A | I209: Falla | J209: Pasa | K209: En blanco
B210: of:=IF( ISBLANK([$'03.Muestra'.$C9]);"";[$'03.Muestra'.$C9]) ->  | C210: of:=IF( ISBLANK([$'03.Muestra'.$E9]);"";[$'03.Muestra'.$E9]) ->  | E210: of:=IF([.D210]<>"";IF(AND([.B210]<>"";[.C210]<>"");"";"ERR");"") ->  | F210: of:=COUNTIF([.$D209]:INDIRECT("$D" &  SUM(ROW()-1;['03.Muestra'.$D$45])-1);[.F209]) -> 0 | G210: of:=COUNTIF([.$D209]:INDIRECT("$D" &  SUM(ROW()-1;['03.Muestra'.$D$45])-1);[.G209]) -> 0 | H210: of:=COUNTIF([.$D209]:INDIRECT("$D" &  SUM(ROW()-1;['03.Muestra'.$D$45])-1);[.H209]) -> 0 | I210: of:=COUNTIF([.$D209]:INDIRECT("$D" &  SUM(ROW()-1;['03.Muestra'.$D$45])-1);[.I209]) -> 0 | J210: of:=COUNTIF([.$D209]:INDIRECT("$D" &  SUM(ROW()-1;['03.Muestra'.$D$45])-1);[.J209]) -> 0 | K210: of:=IF(['03.Muestra'.$D$45]=0;0;COUNTBLANK([.$D209]:INDIRECT("$D" &  SUM(ROW()-1;['03.Muestra'.$D$45])-1))) -> 0
B211: of:=IF( ISBLANK([$'03.Muestra'.$C10]);"";[$'03.Muestra'.$C10]) ->  | C211: of:=IF( ISBLANK([$'03.Muestra'.$E10]);"";[$'03.Muestra'.$E10]) ->  | E211: of:=IF([.D211]<>"";IF(AND([.B211]<>"";[.C211]<>"");"";"ERR");"") -> 
B212: of:=IF( ISBLANK([$'03.Muestra'.$C11]);"";[$'03.Muestra'.$C11]) ->  | C212: of:=IF( ISBLANK([$'03.Muestra'.$E11]);"";[$'03.Muestra'.$E11]) ->  | E212: of:=IF([.D212]<>"";IF(AND([.B212]<>"";[.C212]<>"");"";"ERR");"") -> 
B213: of:=IF( ISBLANK([$'03.Muestra'.$C12]);"";[$'03.Muestra'.$C12]) ->  | C213: of:=IF( ISBLANK([$'03.Muestra'.$E12]);"";[$'03.Muestra'.$E12]) ->  | E213: of:=IF([.D213]<>"";IF(AND([.B213]<>"";[.C213]<>"");"";"ERR");"") -> 
B214: of:=IF( ISBLANK([$'03.Muestra'.$C13]);"";[$'03.Muestra'.$C13]) ->  | C214: of:=IF( ISBLANK([$'03.Muestra'.$E13]);"";[$'03.Muestra'.$E13]) ->  | E214: of:=IF([.D214]<>"";IF(AND([.B214]<>"";[.C214]<>"");"";"ERR");"") -> 
B215: of:=IF( ISBLANK([$'03.Muestra'.$C14]);"";[$'03.Muestra'.$C14]) ->  | C215: of:=IF( ISBLANK([$'03.Muestra'.$E14]);"";[$'03.Muestra'.$E14]) ->  | E215: of:=IF([.D215]<>"";IF(AND([.B215]<>"";[.C215]<>"");"";"ERR");"") -> 
B216: of:=IF( ISBLANK([$'03.Muestra'.$C15]);"";[$'03.Muestra'.$C15]) ->  | C216: of:=IF( ISBLANK([$'03.Muestra'.$E15]);"";[$'03.Muestra'.$E15]) ->  | E216: of:=IF([.D216]<>"";IF(AND([.B216]<>"";[.C216]<>"");"";"ERR");"") -> 
B217: of:=IF( ISBLANK([$'03.Muestra'.$C16]);"";[$'03.Muestra'.$C16]) ->  | C217: of:=IF( ISBLANK([$'03.Muestra'.$E16]);"";[$'03.Muestra'.$E16]) ->  | E217: of:=IF([.D217]<>"";IF(AND([.B217]<>"";[.C217]<>"");"";"ERR");"") -> 
B218: of:=IF( ISBLANK([$'03.Muestra'.$C17]);"";[$'03.Muestra'.$C17]) ->  | C218: of:=IF( ISBLANK([$'03.Muestra'.$E17]);"";[$'03.Muestra'.$E17]) ->  | E218: of:=IF([.D218]<>"";IF(AND([.B218]<>"";[.C218]<>"");"";"ERR");"") -> 
B219: of:=IF( ISBLANK([$'03.Muestra'.$C18]);"";[$'03.Muestra'.$C18]) ->  | C219: of:=IF( ISBLANK([$'03.Muestra'.$E18]);"";[$'03.Muestra'.$E18]) ->  | E219: of:=IF([.D219]<>"";IF(AND([.B219]<>"";[.C219]<>"");"";"ERR");"") -> 
B220: of:=IF( ISBLANK([$'03.Muestra'.$C19]);"";[$'03.Muestra'.$C19]) ->  | C220: of:=IF( ISBLANK([$'03.Muestra'.$E19]);"";[$'03.Muestra'.$E19]) ->  | E220: of:=IF([.D220]<>"";IF(AND([.B220]<>"";[.C220]<>"");"";"ERR");"") -> 
B221: of:=IF( ISBLANK([$'03.Muestra'.$C20]);"";[$'03.Muestra'.$C20]) ->  | C221: of:=IF( ISBLANK([$'03.Muestra'.$E20]);"";[$'03.Muestra'.$E20]) ->  | E221: of:=IF([.D221]<>"";IF(AND([.B221]<>"";[.C221]<>"");"";"ERR");"") -> 
B222: of:=IF( ISBLANK([$'03.Muestra'.$C21]);"";[$'03.Muestra'.$C21]) ->  | C222: of:=IF( ISBLANK([$'03.Muestra'.$E21]);"";[$'03.Muestra'.$E21]) ->  | E222: of:=IF([.D222]<>"";IF(AND([.B222]<>"";[.C222]<>"");"";"ERR");"") -> 
B223: of:=IF( ISBLANK([$'03.Muestra'.$C22]);"";[$'03.Muestra'.$C22]) ->  | C223: of:=IF( ISBLANK([$'03.Muestra'.$E22]);"";[$'03.Muestra'.$E22]) ->  | E223: of:=IF([.D223]<>"";IF(AND([.B223]<>"";[.C223]<>"");"";"ERR");"") -> 
B224: of:=IF( ISBLANK([$'03.Muestra'.$C23]);"";[$'03.Muestra'.$C23]) ->  | C224: of:=IF( ISBLANK([$'03.Muestra'.$E23]);"";[$'03.Muestra'.$E23]) ->  | E224: of:=IF([.D224]<>"";IF(AND([.B224]<>"";[.C224]<>"");"";"ERR");"") -> 
B225: of:=IF( ISBLANK([$'03.Muestra'.$C24]);"";[$'03.Muestra'.$C24]) ->  | C225: of:=IF( ISBLANK([$'03.Muestra'.$E24]);"";[$'03.Muestra'.$E24]) ->  | E225: of:=IF([.D225]<>"";IF(AND([.B225]<>"";[.C225]<>"");"";"ERR");"") -> 
B226: of:=IF( ISBLANK([$'03.Muestra'.$C25]);"";[$'03.Muestra'.$C25]) ->  | C226: of:=IF( ISBLANK([$'03.Muestra'.$E25]);"";[$'03.Muestra'.$E25]) ->  | E226: of:=IF([.D226]<>"";IF(AND([.B226]<>"";[.C226]<>"");"";"ERR");"") -> 
B227: of:=IF( ISBLANK([$'03.Muestra'.$C26]);"";[$'03.Muestra'.$C26]) ->  | C227: of:=IF( ISBLANK([$'03.Muestra'.$E26]);"";[$'03.Muestra'.$E26]) ->  | E227: of:=IF([.D227]<>"";IF(AND([.B227]<>"";[.C227]<>"");"";"ERR");"") -> 
B228: of:=IF( ISBLANK([$'03.Muestra'.$C27]);"";[$'03.Muestra'.$C27]) ->  | C228: of:=IF( ISBLANK([$'03.Muestra'.$E27]);"";[$'03.Muestra'.$E27]) ->  | E228: of:=IF([.D228]<>"";IF(AND([.B228]<>"";[.C228]<>"");"";"ERR");"") -> 
B229: of:=IF( ISBLANK([$'03.Muestra'.$C28]);"";[$'03.Muestra'.$C28]) ->  | C229: of:=IF( ISBLANK([$'03.Muestra'.$E28]);"";[$'03.Muestra'.$E28]) ->  | E229: of:=IF([.D229]<>"";IF(AND([.B229]<>"";[.C229]<>"");"";"ERR");"") -> 
B230: of:=IF( ISBLANK([$'03.Muestra'.$C29]);"";[$'03.Muestra'.$C29]) ->  | C230: of:=IF( ISBLANK([$'03.Muestra'.$E29]);"";[$'03.Muestra'.$E29]) ->  | E230: of:=IF([.D230]<>"";IF(AND([.B230]<>"";[.C230]<>"");"";"ERR");"") -> 
B231: of:=IF( ISBLANK([$'03.Muestra'.$C30]);"";[$'03.Muestra'.$C30]) ->  | C231: of:=IF( ISBLANK([$'03.Muestra'.$E30]);"";[$'03.Muestra'.$E30]) ->  | E231: of:=IF([.D231]<>"";IF(AND([.B231]<>"";[.C231]<>"");"";"ERR");"") -> 
B232: of:=IF( ISBLANK([$'03.Muestra'.$C31]);"";[$'03.Muestra'.$C31]) ->  | C232: of:=IF( ISBLANK([$'03.Muestra'.$E31]);"";[$'03.Muestra'.$E31]) ->  | E232: of:=IF([.D232]<>"";IF(AND([.B232]<>"";[.C232]<>"");"";"ERR");"") -> 
B233: of:=IF( ISBLANK([$'03.Muestra'.$C32]);"";[$'03.Muestra'.$C32]) ->  | C233: of:=IF( ISBLANK([$'03.Muestra'.$E32]);"";[$'03.Muestra'.$E32]) ->  | E233: of:=IF([.D233]<>"";IF(AND([.B233]<>"";[.C233]<>"");"";"ERR");"") -> 
B234: of:=IF( ISBLANK([$'03.Muestra'.$C33]);"";[$'03.Muestra'.$C33]) ->  | C234: of:=IF( ISBLANK([$'03.Muestra'.$E33]);"";[$'03.Muestra'.$E33]) ->  | E234: of:=IF([.D234]<>"";IF(AND([.B234]<>"";[.C234]<>"");"";"ERR");"") -> 
B235: of:=IF( ISBLANK([$'03.Muestra'.$C34]);"";[$'03.Muestra'.$C34]) ->  | C235: of:=IF( ISBLANK([$'03.Muestra'.$E34]);"";[$'03.Muestra'.$E34]) ->  | E235: of:=IF([.D235]<>"";IF(AND([.B235]<>"";[.C235]<>"");"";"ERR");"") -> 
B236: of:=IF( ISBLANK([$'03.Muestra'.$C35]);"";[$'03.Muestra'.$C35]) ->  | C236: of:=IF( ISBLANK([$'03.Muestra'.$E35]);"";[$'03.Muestra'.$E35]) ->  | E236: of:=IF([.D236]<>"";IF(AND([.B236]<>"";[.C236]<>"");"";"ERR");"") -> 
B237: of:=IF( ISBLANK([$'03.Muestra'.$C36]);"";[$'03.Muestra'.$C36]) ->  | C237: of:=IF( ISBLANK([$'03.Muestra'.$E36]);"";[$'03.Muestra'.$E36]) ->  | E237: of:=IF([.D237]<>"";IF(AND([.B237]<>"";[.C237]<>"");"";"ERR");"") -> 
B238: of:=IF( ISBLANK([$'03.Muestra'.$C37]);"";[$'03.Muestra'.$C37]) ->  | C238: of:=IF( ISBLANK([$'03.Muestra'.$E37]);"";[$'03.Muestra'.$E37]) ->  | E238: of:=IF([.D238]<>"";IF(AND([.B238]<>"";[.C238]<>"");"";"ERR");"") -> 
B239: of:=IF( ISBLANK([$'03.Muestra'.$C38]);"";[$'03.Muestra'.$C38]) ->  | C239: of:=IF( ISBLANK([$'03.Muestra'.$E38]);"";[$'03.Muestra'.$E38]) ->  | E239: of:=IF([.D239]<>"";IF(AND([.B239]<>"";[.C239]<>"");"";"ERR");"") -> 
B240: of:=IF( ISBLANK([$'03.Muestra'.$C39]);"";[$'03.Muestra'.$C39]) ->  | C240: of:=IF( ISBLANK([$'03.Muestra'.$E39]);"";[$'03.Muestra'.$E39]) ->  | E240: of:=IF([.D240]<>"";IF(AND([.B240]<>"";[.C240]<>"");"";"ERR");"") -> 
B241: of:=IF( ISBLANK([$'03.Muestra'.$C40]);"";[$'03.Muestra'.$C40]) ->  | C241: of:=IF( ISBLANK([$'03.Muestra'.$E40]);"";[$'03.Muestra'.$E40]) ->  | E241: of:=IF([.D241]<>"";IF(AND([.B241]<>"";[.C241]<>"");"";"ERR");"") -> 
B242: of:=IF( ISBLANK([$'03.Muestra'.$C41]);"";[$'03.Muestra'.$C41]) ->  | C242: of:=IF( ISBLANK([$'03.Muestra'.$E41]);"";[$'03.Muestra'.$E41]) ->  | E242: of:=IF([.D242]<>"";IF(AND([.B242]<>"";[.C242]<>"");"";"ERR");"") -> 
B243: of:=IF( ISBLANK([$'03.Muestra'.$C42]);"";[$'03.Muestra'.$C42]) ->  | C243: of:=IF( ISBLANK([$'03.Muestra'.$E42]);"";[$'03.Muestra'.$E42]) ->  | E243: of:=IF([.D243]<>"";IF(AND([.B243]<>"";[.C243]<>"");"";"ERR");"") -> 
B246: A | C246: 1.3.1 Información y relaciones | D246: Resultado
B247: of:=IF( ISBLANK([$'03.Muestra'.$C8]);"";[$'03.Muestra'.$C8]) ->  | C247: of:=IF( ISBLANK([$'03.Muestra'.$E8]);"";[$'03.Muestra'.$E8]) ->  | E247: of:=IF([.D247]<>"";IF(AND([.B247]<>"";[.C247]<>"");"";"ERR");"") ->  | F247: N/T | G247: N/D | H247: N/A | I247: Falla | J247: Pasa | K247: En blanco
B248: of:=IF( ISBLANK([$'03.Muestra'.$C9]);"";[$'03.Muestra'.$C9]) ->  | C248: of:=IF( ISBLANK([$'03.Muestra'.$E9]);"";[$'03.Muestra'.$E9]) ->  | E248: of:=IF([.D248]<>"";IF(AND([.B248]<>"";[.C248]<>"");"";"ERR");"") ->  | F248: of:=COUNTIF([.$D247]:INDIRECT("$D" &  SUM(ROW()-1;['03.Muestra'.$D$45])-1);[.F247]) -> 0 | G248: of:=COUNTIF([.$D247]:INDIRECT("$D" &  SUM(ROW()-1;['03.Muestra'.$D$45])-1);[.G247]) -> 0 | H248: of:=COUNTIF([.$D247]:INDIRECT("$D" &  SUM(ROW()-1;['03.Muestra'.$D$45])-1);[.H247]) -> 0 | I248: of:=COUNTIF([.$D247]:INDIRECT("$D" &  SUM(ROW()-1;['03.Muestra'.$D$45])-1);[.I247]) -> 0 | J248: of:=COUNTIF([.$D247]:INDIRECT("$D" &  SUM(ROW()-1;['03.Muestra'.$D$45])-1);[.J247]) -> 0 | K248: of:=IF(['03.Muestra'.$D$45]=0;0;COUNTBLANK([.$D247]:INDIRECT("$D" &  SUM(ROW()-1;['03.Muestra'.$D$45])-1))) -> 0
B249: of:=IF( ISBLANK([$'03.Muestra'.$C10]);"";[$'03.Muestra'.$C10]) ->  | C249: of:=IF( ISBLANK([$'03.Muestra'.$E10]);"";[$'03.Muestra'.$E10]) ->  | E249: of:=IF([.D249]<>"";IF(AND([.B249]<>"";[.C249]<>"");"";"ERR");"") -> 
B250: of:=IF( ISBLANK([$'03.Muestra'.$C11]);"";[$'03.Muestra'.$C11]) ->  | C250: of:=IF( ISBLANK([$'03.Muestra'.$E11]);"";[$'03.Muestra'.$E11]) ->  | E250: of:=IF([.D250]<>"";IF(AND([.B250]<>"";[.C250]<>"");"";"ERR");"") -> 
B251: of:=IF( ISBLANK([$'03.Muestra'.$C12]);"";[$'03.Muestra'.$C12]) ->  | C251: of:=IF( ISBLANK([$'03.Muestra'.$E12]);"";[$'03.Muestra'.$E12]) ->  | E251: of:=IF([.D251]<>"";IF(AND([.B251]<>"";[.C251]<>"");"";"ERR");"") -> 
B252: of:=IF( ISBLANK([$'03.Muestra'.$C13]);"";[$'03.Muestra'.$C13]) ->  | C252: of:=IF( ISBLANK([$'03.Muestra'.$E13]);"";[$'03.Muestra'.$E13]) ->  | E252: of:=IF([.D252]<>"";IF(AND([.B252]<>"";[.C252]<>"");"";"ERR");"") -> 
B253: of:=IF( ISBLANK([$'03.Muestra'.$C14]);"";[$'03.Muestra'.$C14]) ->  | C253: of:=IF( ISBLANK([$'03.Muestra'.$E14]);"";[$'03.Muestra'.$E14]) ->  | E253: of:=IF([.D253]<>"";IF(AND([.B253]<>"";[.C253]<>"");"";"ERR");"") -> 
B254: of:=IF( ISBLANK([$'03.Muestra'.$C15]);"";[$'03.Muestra'.$C15]) ->  | C254: of:=IF( ISBLANK([$'03.Muestra'.$E15]);"";[$'03.Muestra'.$E15]) ->  | E254: of:=IF([.D254]<>"";IF(AND([.B254]<>"";[.C254]<>"");"";"ERR");"") -> 
B255: of:=IF( ISBLANK([$'03.Muestra'.$C16]);"";[$'03.Muestra'.$C16]) ->  | C255: of:=IF( ISBLANK([$'03.Muestra'.$E16]);"";[$'03.Muestra'.$E16]) ->  | E255: of:=IF([.D255]<>"";IF(AND([.B255]<>"";[.C255]<>"");"";"ERR");"") -> 
B256: of:=IF( ISBLANK([$'03.Muestra'.$C17]);"";[$'03.Muestra'.$C17]) ->  | C256: of:=IF( ISBLANK([$'03.Muestra'.$E17]);"";[$'03.Muestra'.$E17]) ->  | E256: of:=IF([.D256]<>"";IF(AND([.B256]<>"";[.C256]<>"");"";"ERR");"") -> 
B257: of:=IF( ISBLANK([$'03.Muestra'.$C18]);"";[$'03.Muestra'.$C18]) ->  | C257: of:=IF( ISBLANK([$'03.Muestra'.$E18]);"";[$'03.Muestra'.$E18]) ->  | E257: of:=IF([.D257]<>"";IF(AND([.B257]<>"";[.C257]<>"");"";"ERR");"") -> 
B258: of:=IF( ISBLANK([$'03.Muestra'.$C19]);"";[$'03.Muestra'.$C19]) ->  | C258: of:=IF( ISBLANK([$'03.Muestra'.$E19]);"";[$'03.Muestra'.$E19]) ->  | E258: of:=IF([.D258]<>"";IF(AND([.B258]<>"";[.C258]<>"");"";"ERR");"") -> 
B259: of:=IF( ISBLANK([$'03.Muestra'.$C20]);"";[$'03.Muestra'.$C20]) ->  | C259: of:=IF( ISBLANK([$'03.Muestra'.$E20]);"";[$'03.Muestra'.$E20]) ->  | E259: of:=IF([.D259]<>"";IF(AND([.B259]<>"";[.C259]<>"");"";"ERR");"") -> 
B260: of:=IF( ISBLANK([$'03.Muestra'.$C21]);"";[$'03.Muestra'.$C21]) ->  | C260: of:=IF( ISBLANK([$'03.Muestra'.$E21]);"";[$'03.Muestra'.$E21]) ->  | E260: of:=IF([.D260]<>"";IF(AND([.B260]<>"";[.C260]<>"");"";"ERR");"") -> 
B261: of:=IF( ISBLANK([$'03.Muestra'.$C22]);"";[$'03.Muestra'.$C22]) ->  | C261: of:=IF( ISBLANK([$'03.Muestra'.$E22]);"";[$'03.Muestra'.$E22]) ->  | E261: of:=IF([.D261]<>"";IF(AND([.B261]<>"";[.C261]<>"");"";"ERR");"") -> 
B262: of:=IF( ISBLANK([$'03.Muestra'.$C23]);"";[$'03.Muestra'.$C23]) ->  | C262: of:=IF( ISBLANK([$'03.Muestra'.$E23]);"";[$'03.Muestra'.$E23]) ->  | E262: of:=IF([.D262]<>"";IF(AND([.B262]<>"";[.C262]<>"");"";"ERR");"") -> 
B263: of:=IF( ISBLANK([$'03.Muestra'.$C24]);"";[$'03.Muestra'.$C24]) ->  | C263: of:=IF( ISBLANK([$'03.Muestra'.$E24]);"";[$'03.Muestra'.$E24]) ->  | E263: of:=IF([.D263]<>"";IF(AND([.B263]<>"";[.C263]<>"");"";"ERR");"") -> 
B264: of:=IF( ISBLANK([$'03.Muestra'.$C25]);"";[$'03.Muestra'.$C25]) ->  | C264: of:=IF( ISBLANK([$'03.Muestra'.$E25]);"";[$'03.Muestra'.$E25]) ->  | E264: of:=IF([.D264]<>"";IF(AND([.B264]<>"";[.C264]<>"");"";"ERR");"") -> 
B265: of:=IF( ISBLANK([$'03.Muestra'.$C26]);"";[$'03.Muestra'.$C26]) ->  | C265: of:=IF( ISBLANK([$'03.Muestra'.$E26]);"";[$'03.Muestra'.$E26]) ->  | E265: of:=IF([.D265]<>"";IF(AND([.B265]<>"";[.C265]<>"");"";"ERR");"") -> 
B266: of:=IF( ISBLANK([$'03.Muestra'.$C27]);"";[$'03.Muestra'.$C27]) ->  | C266: of:=IF( ISBLANK([$'03.Muestra'.$E27]);"";[$'03.Muestra'.$E27]) ->  | E266: of:=IF([.D266]<>"";IF(AND([.B266]<>"";[.C266]<>"");"";"ERR");"") -> 
B267: of:=IF( ISBLANK([$'03.Muestra'.$C28]);"";[$'03.Muestra'.$C28]) ->  | C267: of:=IF( ISBLANK([$'03.Muestra'.$E28]);"";[$'03.Muestra'.$E28]) ->  | E267: of:=IF([.D267]<>"";IF(AND([.B267]<>"";[.C267]<>"");"";"ERR");"") -> 
B268: of:=IF( ISBLANK([$'03.Muestra'.$C29]);"";[$'03.Muestra'.$C29]) ->  | C268: of:=IF( ISBLANK([$'03.Muestra'.$E29]);"";[$'03.Muestra'.$E29]) ->  | E268: of:=IF([.D268]<>"";IF(AND([.B268]<>"";[.C268]<>"");"";"ERR");"") -> 
B269: of:=IF( ISBLANK([$'03.Muestra'.$C30]);"";[$'03.Muestra'.$C30]) ->  | C269: of:=IF( ISBLANK([$'03.Muestra'.$E30]);"";[$'03.Muestra'.$E30]) ->  | E269: of:=IF([.D269]<>"";IF(AND([.B269]<>"";[.C269]<>"");"";"ERR");"") -> 
B270: of:=IF( ISBLANK([$'03.Muestra'.$C31]);"";[$'03.Muestra'.$C31]) ->  | C270: of:=IF( ISBLANK([$'03.Muestra'.$E31]);"";[$'03.Muestra'.$E31]) ->  | E270: of:=IF([.D270]<>"";IF(AND([.B270]<>"";[.C270]<>"");"";"ERR");"") -> 
B271: of:=IF( ISBLANK([$'03.Muestra'.$C32]);"";[$'03.Muestra'.$C32]) ->  | C271: of:=IF( ISBLANK([$'03.Muestra'.$E32]);"";[$'03.Muestra'.$E32]) ->  | E271: of:=IF([.D271]<>"";IF(AND([.B271]<>"";[.C271]<>"");"";"ERR");"") -> 
B272: of:=IF( ISBLANK([$'03.Muestra'.$C33]);"";[$'03.Muestra'.$C33]) ->  | C272: of:=IF( ISBLANK([$'03.Muestra'.$E33]);"";[$'03.Muestra'.$E33]) ->  | E272: of:=IF([.D272]<>"";IF(AND([.B272]<>"";[.C272]<>"");"";"ERR");"") -> 
B273: of:=IF( ISBLANK([$'03.Muestra'.$C34]);"";[$'03.Muestra'.$C34]) ->  | C273: of:=IF( ISBLANK([$'03.Muestra'.$E34]);"";[$'03.Muestra'.$E34]) ->  | E273: of:=IF([.D273]<>"";IF(AND([.B273]<>"";[.C273]<>"");"";"ERR");"") -> 
B274: of:=IF( ISBLANK([$'03.Muestra'.$C35]);"";[$'03.Muestra'.$C35]) ->  | C274: of:=IF( ISBLANK([$'03.Muestra'.$E35]);"";[$'03.Muestra'.$E35]) ->  | E274: of:=IF([.D274]<>"";IF(AND([.B274]<>"";[.C274]<>"");"";"ERR");"") -> 
B275: of:=IF( ISBLANK([$'03.Muestra'.$C36]);"";[$'03.Muestra'.$C36]) ->  | C275: of:=IF( ISBLANK([$'03.Muestra'.$E36]);"";[$'03.Muestra'.$E36]) ->  | E275: of:=IF([.D275]<>"";IF(AND([.B275]<>"";[.C275]<>"");"";"ERR");"") -> 
B276: of:=IF( ISBLANK([$'03.Muestra'.$C37]);"";[$'03.Muestra'.$C37]) ->  | C276: of:=IF( ISBLANK([$'03.Muestra'.$E37]);"";[$'03.Muestra'.$E37]) ->  | E276: of:=IF([.D276]<>"";IF(AND([.B276]<>"";[.C276]<>"");"";"ERR");"") -> 
B277: of:=IF( ISBLANK([$'03.Muestra'.$C38]);"";[$'03.Muestra'.$C38]) ->  | C277: of:=IF( ISBLANK([$'03.Muestra'.$E38]);"";[$'03.Muestra'.$E38]) ->  | E277: of:=IF([.D277]<>"";IF(AND([.B277]<>"";[.C277]<>"");"";"ERR");"") -> 
B278: of:=IF( ISBLANK([$'03.Muestra'.$C39]);"";[$'03.Muestra'.$C39]) ->  | C278: of:=IF( ISBLANK([$'03.Muestra'.$E39]);"";[$'03.Muestra'.$E39]) ->  | E278: of:=IF([.D278]<>"";IF(AND([.B278]<>"";[.C278]<>"");"";"ERR");"") -> 
B279: of:=IF( ISBLANK([$'03.Muestra'.$C40]);"";[$'03.Muestra'.$C40]) ->  | C279: of:=IF( ISBLANK([$'03.Muestra'.$E40]);"";[$'03.Muestra'.$E40]) ->  | E279: of:=IF([.D279]<>"";IF(AND([.B279]<>"";[.C279]<>"");"";"ERR");"") -> 
B280: of:=IF( ISBLANK([$'03.Muestra'.$C41]);"";[$'03.Muestra'.$C41]) ->  | C280: of:=IF( ISBLANK([$'03.Muestra'.$E41]);"";[$'03.Muestra'.$E41]) ->  | E280: of:=IF([.D280]<>"";IF(AND([.B280]<>"";[.C280]<>"");"";"ERR");"") -> 
B281: of:=IF( ISBLANK([$'03.Muestra'.$C42]);"";[$'03.Muestra'.$C42]) ->  | C281: of:=IF( ISBLANK([$'03.Muestra'.$E42]);"";[$'03.Muestra'.$E42]) ->  | E281: of:=IF([.D281]<>"";IF(AND([.B281]<>"";[.C281]<>"");"";"ERR");"") -> 
B284: A | C284: 1.3.2 Secuencia significativa | D284: Resultado
B285: of:=IF( ISBLANK([$'03.Muestra'.$C8]);"";[$'03.Muestra'.$C8]) ->  | C285: of:=IF( ISBLANK([$'03.Muestra'.$E8]);"";[$'03.Muestra'.$E8]) ->  | E285: of:=IF([.D285]<>"";IF(AND([.B285]<>"";[.C285]<>"");"";"ERR");"") ->  | F285: N/T | G285: N/D | H285: N/A | I285: Falla | J285: Pasa | K285: En blanco
B286: of:=IF( ISBLANK([$'03.Muestra'.$C9]);"";[$'03.Muestra'.$C9]) ->  | C286: of:=IF( ISBLANK([$'03.Muestra'.$E9]);"";[$'03.Muestra'.$E9]) ->  | E286: of:=IF([.D286]<>"";IF(AND([.B286]<>"";[.C286]<>"");"";"ERR");"") ->  | F286: of:=COUNTIF([.$D285]:INDIRECT("$D" &  SUM(ROW()-1;['03.Muestra'.$D$45])-1);[.F285]) -> 0 | G286: of:=COUNTIF([.$D285]:INDIRECT("$D" &  SUM(ROW()-1;['03.Muestra'.$D$45])-1);[.G285]) -> 0 | H286: of:=COUNTIF([.$D285]:INDIRECT("$D" &  SUM(ROW()-1;['03.Muestra'.$D$45])-1);[.H285]) -> 0 | I286: of:=COUNTIF([.$D285]:INDIRECT("$D" &  SUM(ROW()-1;['03.Muestra'.$D$45])-1);[.I285]) -> 0 | J286: of:=COUNTIF([.$D285]:INDIRECT("$D" &  SUM(ROW()-1;['03.Muestra'.$D$45])-1);[.J285]) -> 0 | K286: of:=IF(['03.Muestra'.$D$45]=0;0;COUNTBLANK([.$D285]:INDIRECT("$D" &  SUM(ROW()-1;['03.Muestra'.$D$45])-1))) -> 0
B287: of:=IF( ISBLANK([$'03.Muestra'.$C10]);"";[$'03.Muestra'.$C10]) ->  | C287: of:=IF( ISBLANK([$'03.Muestra'.$E10]);"";[$'03.Muestra'.$E10]) ->  | E287: of:=IF([.D287]<>"";IF(AND([.B287]<>"";[.C287]<>"");"";"ERR");"") -> 
B288: of:=IF( ISBLANK([$'03.Muestra'.$C11]);"";[$'03.Muestra'.$C11]) ->  | C288: of:=IF( ISBLANK([$'03.Muestra'.$E11]);"";[$'03.Muestra'.$E11]) ->  | E288: of:=IF([.D288]<>"";IF(AND([.B288]<>"";[.C288]<>"");"";"ERR");"") -> 
B289: of:=IF( ISBLANK([$'03.Muestra'.$C12]);"";[$'03.Muestra'.$C12]) ->  | C289: of:=IF( ISBLANK([$'03.Muestra'.$E12]);"";[$'03.Muestra'.$E12]) ->  | E289: of:=IF([.D289]<>"";IF(AND([.B289]<>"";[.C289]<>"");"";"ERR");"") -> 
B290: of:=IF( ISBLANK([$'03.Muestra'.$C13]);"";[$'03.Muestra'.$C13]) ->  | C290: of:=IF( ISBLANK([$'03.Muestra'.$E13]);"";[$'03.Muestra'.$E13]) ->  | E290: of:=IF([.D290]<>"";IF(AND([.B290]<>"";[.C290]<>"");"";"ERR");"") -> 
B291: of:=IF( ISBLANK([$'03.Muestra'.$C14]);"";[$'03.Muestra'.$C14]) ->  | C291: of:=IF( ISBLANK([$'03.Muestra'.$E14]);"";[$'03.Muestra'.$E14]) ->  | E291: of:=IF([.D291]<>"";IF(AND([.B291]<>"";[.C291]<>"");"";"ERR");"") -> 
B292: of:=IF( ISBLANK([$'03.Muestra'.$C15]);"";[$'03.Muestra'.$C15]) ->  | C292: of:=IF( ISBLANK([$'03.Muestra'.$E15]);"";[$'03.Muestra'.$E15]) ->  | E292: of:=IF([.D292]<>"";IF(AND([.B292]<>"";[.C292]<>"");"";"ERR");"") -> 
B293: of:=IF( ISBLANK([$'03.Muestra'.$C16]);"";[$'03.Muestra'.$C16]) ->  | C293: of:=IF( ISBLANK([$'03.Muestra'.$E16]);"";[$'03.Muestra'.$E16]) ->  | E293: of:=IF([.D293]<>"";IF(AND([.B293]<>"";[.C293]<>"");"";"ERR");"") -> 
B294: of:=IF( ISBLANK([$'03.Muestra'.$C17]);"";[$'03.Muestra'.$C17]) ->  | C294: of:=IF( ISBLANK([$'03.Muestra'.$E17]);"";[$'03.Muestra'.$E17]) ->  | E294: of:=IF([.D294]<>"";IF(AND([.B294]<>"";[.C294]<>"");"";"ERR");"") -> 
B295: of:=IF( ISBLANK([$'03.Muestra'.$C18]);"";[$'03.Muestra'.$C18]) ->  | C295: of:=IF( ISBLANK([$'03.Muestra'.$E18]);"";[$'03.Muestra'.$E18]) ->  | E295: of:=IF([.D295]<>"";IF(AND([.B295]<>"";[.C295]<>"");"";"ERR");"") -> 
B296: of:=IF( ISBLANK([$'03.Muestra'.$C19]);"";[$'03.Muestra'.$C19]) ->  | C296: of:=IF( ISBLANK([$'03.Muestra'.$E19]);"";[$'03.Muestra'.$E19]) ->  | E296: of:=IF([.D296]<>"";IF(AND([.B296]<>"";[.C296]<>"");"";"ERR");"") -> 
B297: of:=IF( ISBLANK([$'03.Muestra'.$C20]);"";[$'03.Muestra'.$C20]) ->  | C297: of:=IF( ISBLANK([$'03.Muestra'.$E20]);"";[$'03.Muestra'.$E20]) ->  | E297: of:=IF([.D297]<>"";IF(AND([.B297]<>"";[.C297]<>"");"";"ERR");"") -> 
B298: of:=IF( ISBLANK([$'03.Muestra'.$C21]);"";[$'03.Muestra'.$C21]) ->  | C298: of:=IF( ISBLANK([$'03.Muestra'.$E21]);"";[$'03.Muestra'.$E21]) ->  | E298: of:=IF([.D298]<>"";IF(AND([.B298]<>"";[.C298]<>"");"";"ERR");"") -> 
B299: of:=IF( ISBLANK([$'03.Muestra'.$C22]);"";[$'03.Muestra'.$C22]) ->  | C299: of:=IF( ISBLANK([$'03.Muestra'.$E22]);"";[$'03.Muestra'.$E22]) ->  | E299: of:=IF([.D299]<>"";IF(AND([.B299]<>"";[.C299]<>"");"";"ERR");"") -> 
B300: of:=IF( ISBLANK([$'03.Muestra'.$C23]);"";[$'03.Muestra'.$C23]) ->  | C300: of:=IF( ISBLANK([$'03.Muestra'.$E23]);"";[$'03.Muestra'.$E23]) ->  | E300: of:=IF([.D300]<>"";IF(AND([.B300]<>"";[.C300]<>"");"";"ERR");"") -> 
B301: of:=IF( ISBLANK([$'03.Muestra'.$C24]);"";[$'03.Muestra'.$C24]) ->  | C301: of:=IF( ISBLANK([$'03.Muestra'.$E24]);"";[$'03.Muestra'.$E24]) ->  | E301: of:=IF([.D301]<>"";IF(AND([.B301]<>"";[.C301]<>"");"";"ERR");"") -> 
B302: of:=IF( ISBLANK([$'03.Muestra'.$C25]);"";[$'03.Muestra'.$C25]) ->  | C302: of:=IF( ISBLANK([$'03.Muestra'.$E25]);"";[$'03.Muestra'.$E25]) ->  | E302: of:=IF([.D302]<>"";IF(AND([.B302]<>"";[.C302]<>"");"";"ERR");"") -> 
B303: of:=IF( ISBLANK([$'03.Muestra'.$C26]);"";[$'03.Muestra'.$C26]) ->  | C303: of:=IF( ISBLANK([$'03.Muestra'.$E26]);"";[$'03.Muestra'.$E26]) ->  | E303: of:=IF([.D303]<>"";IF(AND([.B303]<>"";[.C303]<>"");"";"ERR");"") -> 
B304: of:=IF( ISBLANK([$'03.Muestra'.$C27]);"";[$'03.Muestra'.$C27]) ->  | C304: of:=IF( ISBLANK([$'03.Muestra'.$E27]);"";[$'03.Muestra'.$E27]) ->  | E304: of:=IF([.D304]<>"";IF(AND([.B304]<>"";[.C304]<>"");"";"ERR");"") -> 
B305: of:=IF( ISBLANK([$'03.Muestra'.$C28]);"";[$'03.Muestra'.$C28]) ->  | C305: of:=IF( ISBLANK([$'03.Muestra'.$E28]);"";[$'03.Muestra'.$E28]) ->  | E305: of:=IF([.D305]<>"";IF(AND([.B305]<>"";[.C305]<>"");"";"ERR");"") -> 
B306: of:=IF( ISBLANK([$'03.Muestra'.$C29]);"";[$'03.Muestra'.$C29]) ->  | C306: of:=IF( ISBLANK([$'03.Muestra'.$E29]);"";[$'03.Muestra'.$E29]) ->  | E306: of:=IF([.D306]<>"";IF(AND([.B306]<>"";[.C306]<>"");"";"ERR");"") -> 
B307: of:=IF( ISBLANK([$'03.Muestra'.$C30]);"";[$'03.Muestra'.$C30]) ->  | C307: of:=IF( ISBLANK([$'03.Muestra'.$E30]);"";[$'03.Muestra'.$E30]) ->  | E307: of:=IF([.D307]<>"";IF(AND([.B307]<>"";[.C307]<>"");"";"ERR");"") -> 
B308: of:=IF( ISBLANK([$'03.Muestra'.$C31]);"";[$'03.Muestra'.$C31]) ->  | C308: of:=IF( ISBLANK([$'03.Muestra'.$E31]);"";[$'03.Muestra'.$E31]) ->  | E308: of:=IF([.D308]<>"";IF(AND([.B308]<>"";[.C308]<>"");"";"ERR");"") -> 
B309: of:=IF( ISBLANK([$'03.Muestra'.$C32]);"";[$'03.Muestra'.$C32]) ->  | C309: of:=IF( ISBLANK([$'03.Muestra'.$E32]);"";[$'03.Muestra'.$E32]) ->  | E309: of:=IF([.D309]<>"";IF(AND([.B309]<>"";[.C309]<>"");"";"ERR");"") -> 
B310: of:=IF( ISBLANK([$'03.Muestra'.$C33]);"";[$'03.Muestra'.$C33]) ->  | C310: of:=IF( ISBLANK([$'03.Muestra'.$E33]);"";[$'03.Muestra'.$E33]) ->  | E310: of:=IF([.D310]<>"";IF(AND([.B310]<>"";[.C310]<>"");"";"ERR");"") -> 
B311: of:=IF( ISBLANK([$'03.Muestra'.$C34]);"";[$'03.Muestra'.$C34]) ->  | C311: of:=IF( ISBLANK([$'03.Muestra'.$E34]);"";[$'03.Muestra'.$E34]) ->  | E311: of:=IF([.D311]<>"";IF(AND([.B311]<>"";[.C311]<>"");"";"ERR");"") -> 
B312: of:=IF( ISBLANK([$'03.Muestra'.$C35]);"";[$'03.Muestra'.$C35]) ->  | C312: of:=IF( ISBLANK([$'03.Muestra'.$E35]);"";[$'03.Muestra'.$E35]) ->  | E312: of:=IF([.D312]<>"";IF(AND([.B312]<>"";[.C312]<>"");"";"ERR");"") -> 
B313: of:=IF( ISBLANK([$'03.Muestra'.$C36]);"";[$'03.Muestra'.$C36]) ->  | C313: of:=IF( ISBLANK([$'03.Muestra'.$E36]);"";[$'03.Muestra'.$E36]) ->  | E313: of:=IF([.D313]<>"";IF(AND([.B313]<>"";[.C313]<>"");"";"ERR");"") -> 
B314: of:=IF( ISBLANK([$'03.Muestra'.$C37]);"";[$'03.Muestra'.$C37]) ->  | C314: of:=IF( ISBLANK([$'03.Muestra'.$E37]);"";[$'03.Muestra'.$E37]) ->  | E314: of:=IF([.D314]<>"";IF(AND([.B314]<>"";[.C314]<>"");"";"ERR");"") -> 
B315: of:=IF( ISBLANK([$'03.Muestra'.$C38]);"";[$'03.Muestra'.$C38]) ->  | C315: of:=IF( ISBLANK([$'03.Muestra'.$E38]);"";[$'03.Muestra'.$E38]) ->  | E315: of:=IF([.D315]<>"";IF(AND([.B315]<>"";[.C315]<>"");"";"ERR");"") -> 
B316: of:=IF( ISBLANK([$'03.Muestra'.$C39]);"";[$'03.Muestra'.$C39]) ->  | C316: of:=IF( ISBLANK([$'03.Muestra'.$E39]);"";[$'03.Muestra'.$E39]) ->  | E316: of:=IF([.D316]<>"";IF(AND([.B316]<>"";[.C316]<>"");"";"ERR");"") -> 
B317: of:=IF( ISBLANK([$'03.Muestra'.$C40]);"";[$'03.Muestra'.$C40]) ->  | C317: of:=IF( ISBLANK([$'03.Muestra'.$E40]);"";[$'03.Muestra'.$E40]) ->  | E317: of:=IF([.D317]<>"";IF(AND([.B317]<>"";[.C317]<>"");"";"ERR");"") -> 
B318: of:=IF( ISBLANK([$'03.Muestra'.$C41]);"";[$'03.Muestra'.$C41]) ->  | C318: of:=IF( ISBLANK([$'03.Muestra'.$E41]);"";[$'03.Muestra'.$E41]) ->  | E318: of:=IF([.D318]<>"";IF(AND([.B318]<>"";[.C318]<>"");"";"ERR");"") -> 
B319: of:=IF( ISBLANK([$'03.Muestra'.$C42]);"";[$'03.Muestra'.$C42]) ->  | C319: of:=IF( ISBLANK([$'03.Muestra'.$E42]);"";[$'03.Muestra'.$E42]) ->  | E319: of:=IF([.D319]<>"";IF(AND([.B319]<>"";[.C319]<>"");"";"ERR");"") -> 
B322: A | C322: 1.3.3 Características sensoriales | D322: Resultado
B323: of:=IF( ISBLANK([$'03.Muestra'.$C8]);"";[$'03.Muestra'.$C8]) ->  | C323: of:=IF( ISBLANK([$'03.Muestra'.$E8]);"";[$'03.Muestra'.$E8]) ->  | E323: of:=IF([.D323]<>"";IF(AND([.B323]<>"";[.C323]<>"");"";"ERR");"") ->  | F323: N/T | G323: N/D | H323: N/A | I323: Falla | J323: Pasa | K323: En blanco
B324: of:=IF( ISBLANK([$'03.Muestra'.$C9]);"";[$'03.Muestra'.$C9]) ->  | C324: of:=IF( ISBLANK([$'03.Muestra'.$E9]);"";[$'03.Muestra'.$E9]) ->  | E324: of:=IF([.D324]<>"";IF(AND([.B324]<>"";[.C324]<>"");"";"ERR");"") ->  | F324: of:=COUNTIF([.$D323]:INDIRECT("$D" &  SUM(ROW()-1;['03.Muestra'.$D$45])-1);[.F323]) -> 0 | G324: of:=COUNTIF([.$D323]:INDIRECT("$D" &  SUM(ROW()-1;['03.Muestra'.$D$45])-1);[.G323]) -> 0 | H324: of:=COUNTIF([.$D323]:INDIRECT("$D" &  SUM(ROW()-1;['03.Muestra'.$D$45])-1);[.H323]) -> 0 | I324: of:=COUNTIF([.$D323]:INDIRECT("$D" &  SUM(ROW()-1;['03.Muestra'.$D$45])-1);[.I323]) -> 0 | J324: of:=COUNTIF([.$D323]:INDIRECT("$D" &  SUM(ROW()-1;['03.Muestra'.$D$45])-1);[.J323]) -> 0 | K324: of:=IF(['03.Muestra'.$D$45]=0;0;COUNTBLANK([.$D323]:INDIRECT("$D" &  SUM(ROW()-1;['03.Muestra'.$D$45])-1))) -> 0
B325: of:=IF( ISBLANK([$'03.Muestra'.$C10]);"";[$'03.Muestra'.$C10]) ->  | C325: of:=IF( ISBLANK([$'03.Muestra'.$E10]);"";[$'03.Muestra'.$E10]) ->  | E325: of:=IF([.D325]<>"";IF(AND([.B325]<>"";[.C325]<>"");"";"ERR");"") -> 
B326: of:=IF( ISBLANK([$'03.Muestra'.$C11]);"";[$'03.Muestra'.$C11]) ->  | C326: of:=IF( ISBLANK([$'03.Muestra'.$E11]);"";[$'03.Muestra'.$E11]) ->  | E326: of:=IF([.D326]<>"";IF(AND([.B326]<>"";[.C326]<>"");"";"ERR");"") -> 
B327: of:=IF( ISBLANK([$'03.Muestra'.$C12]);"";[$'03.Muestra'.$C12]) ->  | C327: of:=IF( ISBLANK([$'03.Muestra'.$E12]);"";[$'03.Muestra'.$E12]) ->  | E327: of:=IF([.D327]<>"";IF(AND([.B327]<>"";[.C327]<>"");"";"ERR");"") -> 
B328: of:=IF( ISBLANK([$'03.Muestra'.$C13]);"";[$'03.Muestra'.$C13]) ->  | C328: of:=IF( ISBLANK([$'03.Muestra'.$E13]);"";[$'03.Muestra'.$E13]) ->  | E328: of:=IF([.D328]<>"";IF(AND([.B328]<>"";[.C328]<>"");"";"ERR");"") -> 
B329: of:=IF( ISBLANK([$'03.Muestra'.$C14]);"";[$'03.Muestra'.$C14]) ->  | C329: of:=IF( ISBLANK([$'03.Muestra'.$E14]);"";[$'03.Muestra'.$E14]) ->  | E329: of:=IF([.D329]<>"";IF(AND([.B329]<>"";[.C329]<>"");"";"ERR");"") -> 
B330: of:=IF( ISBLANK([$'03.Muestra'.$C15]);"";[$'03.Muestra'.$C15]) ->  | C330: of:=IF( ISBLANK([$'03.Muestra'.$E15]);"";[$'03.Muestra'.$E15]) ->  | E330: of:=IF([.D330]<>"";IF(AND([.B330]<>"";[.C330]<>"");"";"ERR");"") -> 
B331: of:=IF( ISBLANK([$'03.Muestra'.$C16]);"";[$'03.Muestra'.$C16]) ->  | C331: of:=IF( ISBLANK([$'03.Muestra'.$E16]);"";[$'03.Muestra'.$E16]) ->  | E331: of:=IF([.D331]<>"";IF(AND([.B331]<>"";[.C331]<>"");"";"ERR");"") -> 
B332: of:=IF( ISBLANK([$'03.Muestra'.$C17]);"";[$'03.Muestra'.$C17]) ->  | C332: of:=IF( ISBLANK([$'03.Muestra'.$E17]);"";[$'03.Muestra'.$E17]) ->  | E332: of:=IF([.D332]<>"";IF(AND([.B332]<>"";[.C332]<>"");"";"ERR");"") -> 
B333: of:=IF( ISBLANK([$'03.Muestra'.$C18]);"";[$'03.Muestra'.$C18]) ->  | C333: of:=IF( ISBLANK([$'03.Muestra'.$E18]);"";[$'03.Muestra'.$E18]) ->  | E333: of:=IF([.D333]<>"";IF(AND([.B333]<>"";[.C333]<>"");"";"ERR");"") -> 
B334: of:=IF( ISBLANK([$'03.Muestra'.$C19]);"";[$'03.Muestra'.$C19]) ->  | C334: of:=IF( ISBLANK([$'03.Muestra'.$E19]);"";[$'03.Muestra'.$E19]) ->  | E334: of:=IF([.D334]<>"";IF(AND([.B334]<>"";[.C334]<>"");"";"ERR");"") -> 
B335: of:=IF( ISBLANK([$'03.Muestra'.$C20]);"";[$'03.Muestra'.$C20]) ->  | C335: of:=IF( ISBLANK([$'03.Muestra'.$E20]);"";[$'03.Muestra'.$E20]) ->  | E335: of:=IF([.D335]<>"";IF(AND([.B335]<>"";[.C335]<>"");"";"ERR");"") -> 
B336: of:=IF( ISBLANK([$'03.Muestra'.$C21]);"";[$'03.Muestra'.$C21]) ->  | C336: of:=IF( ISBLANK([$'03.Muestra'.$E21]);"";[$'03.Muestra'.$E21]) ->  | E336: of:=IF([.D336]<>"";IF(AND([.B336]<>"";[.C336]<>"");"";"ERR");"") -> 
B337: of:=IF( ISBLANK([$'03.Muestra'.$C22]);"";[$'03.Muestra'.$C22]) ->  | C337: of:=IF( ISBLANK([$'03.Muestra'.$E22]);"";[$'03.Muestra'.$E22]) ->  | E337: of:=IF([.D337]<>"";IF(AND([.B337]<>"";[.C337]<>"");"";"ERR");"") -> 
B338: of:=IF( ISBLANK([$'03.Muestra'.$C23]);"";[$'03.Muestra'.$C23]) ->  | C338: of:=IF( ISBLANK([$'03.Muestra'.$E23]);"";[$'03.Muestra'.$E23]) ->  | E338: of:=IF([.D338]<>"";IF(AND([.B338]<>"";[.C338]<>"");"";"ERR");"") -> 
B339: of:=IF( ISBLANK([$'03.Muestra'.$C24]);"";[$'03.Muestra'.$C24]) ->  | C339: of:=IF( ISBLANK([$'03.Muestra'.$E24]);"";[$'03.Muestra'.$E24]) ->  | E339: of:=IF([.D339]<>"";IF(AND([.B339]<>"";[.C339]<>"");"";"ERR");"") -> 
B340: of:=IF( ISBLANK([$'03.Muestra'.$C25]);"";[$'03.Muestra'.$C25]) ->  | C340: of:=IF( ISBLANK([$'03.Muestra'.$E25]);"";[$'03.Muestra'.$E25]) ->  | E340: of:=IF([.D340]<>"";IF(AND([.B340]<>"";[.C340]<>"");"";"ERR");"") -> 
B341: of:=IF( ISBLANK([$'03.Muestra'.$C26]);"";[$'03.Muestra'.$C26]) ->  | C341: of:=IF( ISBLANK([$'03.Muestra'.$E26]);"";[$'03.Muestra'.$E26]) ->  | E341: of:=IF([.D341]<>"";IF(AND([.B341]<>"";[.C341]<>"");"";"ERR");"") -> 
B342: of:=IF( ISBLANK([$'03.Muestra'.$C27]);"";[$'03.Muestra'.$C27]) ->  | C342: of:=IF( ISBLANK([$'03.Muestra'.$E27]);"";[$'03.Muestra'.$E27]) ->  | E342: of:=IF([.D342]<>"";IF(AND([.B342]<>"";[.C342]<>"");"";"ERR");"") -> 
B343: of:=IF( ISBLANK([$'03.Muestra'.$C28]);"";[$'03.Muestra'.$C28]) ->  | C343: of:=IF( ISBLANK([$'03.Muestra'.$E28]);"";[$'03.Muestra'.$E28]) ->  | E343: of:=IF([.D343]<>"";IF(AND([.B343]<>"";[.C343]<>"");"";"ERR");"") -> 
B344: of:=IF( ISBLANK([$'03.Muestra'.$C29]);"";[$'03.Muestra'.$C29]) ->  | C344: of:=IF( ISBLANK([$'03.Muestra'.$E29]);"";[$'03.Muestra'.$E29]) ->  | E344: of:=IF([.D344]<>"";IF(AND([.B344]<>"";[.C344]<>"");"";"ERR");"") -> 
B345: of:=IF( ISBLANK([$'03.Muestra'.$C30]);"";[$'03.Muestra'.$C30]) ->  | C345: of:=IF( ISBLANK([$'03.Muestra'.$E30]);"";[$'03.Muestra'.$E30]) ->  | E345: of:=IF([.D345]<>"";IF(AND([.B345]<>"";[.C345]<>"");"";"ERR");"") -> 
B346: of:=IF( ISBLANK([$'03.Muestra'.$C31]);"";[$'03.Muestra'.$C31]) ->  | C346: of:=IF( ISBLANK([$'03.Muestra'.$E31]);"";[$'03.Muestra'.$E31]) ->  | E346: of:=IF([.D346]<>"";IF(AND([.B346]<>"";[.C346]<>"");"";"ERR");"") -> 
B347: of:=IF( ISBLANK([$'03.Muestra'.$C32]);"";[$'03.Muestra'.$C32]) ->  | C347: of:=IF( ISBLANK([$'03.Muestra'.$E32]);"";[$'03.Muestra'.$E32]) ->  | E347: of:=IF([.D347]<>"";IF(AND([.B347]<>"";[.C347]<>"");"";"ERR");"") -> 
B348: of:=IF( ISBLANK([$'03.Muestra'.$C33]);"";[$'03.Muestra'.$C33]) ->  | C348: of:=IF( ISBLANK([$'03.Muestra'.$E33]);"";[$'03.Muestra'.$E33]) ->  | E348: of:=IF([.D348]<>"";IF(AND([.B348]<>"";[.C348]<>"");"";"ERR");"") -> 
B349: of:=IF( ISBLANK([$'03.Muestra'.$C34]);"";[$'03.Muestra'.$C34]) ->  | C349: of:=IF( ISBLANK([$'03.Muestra'.$E34]);"";[$'03.Muestra'.$E34]) ->  | E349: of:=IF([.D349]<>"";IF(AND([.B349]<>"";[.C349]<>"");"";"ERR");"") -> 
B350: of:=IF( ISBLANK([$'03.Muestra'.$C35]);"";[$'03.Muestra'.$C35]) ->  | C350: of:=IF( ISBLANK([$'03.Muestra'.$E35]);"";[$'03.Muestra'.$E35]) ->  | E350: of:=IF([.D350]<>"";IF(AND([.B350]<>"";[.C350]<>"");"";"ERR");"") -> 
B351: of:=IF( ISBLANK([$'03.Muestra'.$C36]);"";[$'03.Muestra'.$C36]) ->  | C351: of:=IF( ISBLANK([$'03.Muestra'.$E36]);"";[$'03.Muestra'.$E36]) ->  | E351: of:=IF([.D351]<>"";IF(AND([.B351]<>"";[.C351]<>"");"";"ERR");"") -> 
B352: of:=IF( ISBLANK([$'03.Muestra'.$C37]);"";[$'03.Muestra'.$C37]) ->  | C352: of:=IF( ISBLANK([$'03.Muestra'.$E37]);"";[$'03.Muestra'.$E37]) ->  | E352: of:=IF([.D352]<>"";IF(AND([.B352]<>"";[.C352]<>"");"";"ERR");"") -> 
B353: of:=IF( ISBLANK([$'03.Muestra'.$C38]);"";[$'03.Muestra'.$C38]) ->  | C353: of:=IF( ISBLANK([$'03.Muestra'.$E38]);"";[$'03.Muestra'.$E38]) ->  | E353: of:=IF([.D353]<>"";IF(AND([.B353]<>"";[.C353]<>"");"";"ERR");"") -> 
B354: of:=IF( ISBLANK([$'03.Muestra'.$C39]);"";[$'03.Muestra'.$C39]) ->  | C354: of:=IF( ISBLANK([$'03.Muestra'.$E39]);"";[$'03.Muestra'.$E39]) ->  | E354: of:=IF([.D354]<>"";IF(AND([.B354]<>"";[.C354]<>"");"";"ERR");"") -> 
B355: of:=IF( ISBLANK([$'03.Muestra'.$C40]);"";[$'03.Muestra'.$C40]) ->  | C355: of:=IF( ISBLANK([$'03.Muestra'.$E40]);"";[$'03.Muestra'.$E40]) ->  | E355: of:=IF([.D355]<>"";IF(AND([.B355]<>"";[.C355]<>"");"";"ERR");"") -> 
B356: of:=IF( ISBLANK([$'03.Muestra'.$C41]);"";[$'03.Muestra'.$C41]) ->  | C356: of:=IF( ISBLANK([$'03.Muestra'.$E41]);"";[$'03.Muestra'.$E41]) ->  | E356: of:=IF([.D356]<>"";IF(AND([.B356]<>"";[.C356]<>"");"";"ERR");"") -> 
B357: of:=IF( ISBLANK([$'03.Muestra'.$C42]);"";[$'03.Muestra'.$C42]) ->  | C357: of:=IF( ISBLANK([$'03.Muestra'.$E42]);"";[$'03.Muestra'.$E42]) ->  | E357: of:=IF([.D357]<>"";IF(AND([.B357]<>"";[.C357]<>"");"";"ERR");"") -> 
B360: AA | C360: 1.3.4 Orientación | D360: Resultado
B361: of:=IF( ISBLANK([$'03.Muestra'.$C8]);"";[$'03.Muestra'.$C8]) ->  | C361: of:=IF( ISBLANK([$'03.Muestra'.$E8]);"";[$'03.Muestra'.$E8]) ->  | E361: of:=IF([.D361]<>"";IF(AND([.B361]<>"";[.C361]<>"");"";"ERR");"") ->  | F361: N/T | G361: N/D | H361: N/A | I361: Falla | J361: Pasa | K361: En blanco
B362: of:=IF( ISBLANK([$'03.Muestra'.$C9]);"";[$'03.Muestra'.$C9]) ->  | C362: of:=IF( ISBLANK([$'03.Muestra'.$E9]);"";[$'03.Muestra'.$E9]) ->  | E362: of:=IF([.D362]<>"";IF(AND([.B362]<>"";[.C362]<>"");"";"ERR");"") ->  | F362: of:=COUNTIF([.$D361]:INDIRECT("$D" &  SUM(ROW()-1;['03.Muestra'.$D$45])-1);[.F361]) -> 0 | G362: of:=COUNTIF([.$D361]:INDIRECT("$D" &  SUM(ROW()-1;['03.Muestra'.$D$45])-1);[.G361]) -> 0 | H362: of:=COUNTIF([.$D361]:INDIRECT("$D" &  SUM(ROW()-1;['03.Muestra'.$D$45])-1);[.H361]) -> 0 | I362: of:=COUNTIF([.$D361]:INDIRECT("$D" &  SUM(ROW()-1;['03.Muestra'.$D$45])-1);[.I361]) -> 0 | J362: of:=COUNTIF([.$D361]:INDIRECT("$D" &  SUM(ROW()-1;['03.Muestra'.$D$45])-1);[.J361]) -> 0 | K362: of:=IF(['03.Muestra'.$D$45]=0;0;COUNTBLANK([.$D361]:INDIRECT("$D" &  SUM(ROW()-1;['03.Muestra'.$D$45])-1))) -> 0
B363: of:=IF( ISBLANK([$'03.Muestra'.$C10]);"";[$'03.Muestra'.$C10]) ->  | C363: of:=IF( ISBLANK([$'03.Muestra'.$E10]);"";[$'03.Muestra'.$E10]) ->  | E363: of:=IF([.D363]<>"";IF(AND([.B363]<>"";[.C363]<>"");"";"ERR");"") -> 
B364: of:=IF( ISBLANK([$'03.Muestra'.$C11]);"";[$'03.Muestra'.$C11]) ->  | C364: of:=IF( ISBLANK([$'03.Muestra'.$E11]);"";[$'03.Muestra'.$E11]) ->  | E364: of:=IF([.D364]<>"";IF(AND([.B364]<>"";[.C364]<>"");"";"ERR");"") -> 
B365: of:=IF( ISBLANK([$'03.Muestra'.$C12]);"";[$'03.Muestra'.$C12]) ->  | C365: of:=IF( ISBLANK([$'03.Muestra'.$E12]);"";[$'03.Muestra'.$E12]) ->  | E365: of:=IF([.D365]<>"";IF(AND([.B365]<>"";[.C365]<>"");"";"ERR");"") -> 
B366: of:=IF( ISBLANK([$'03.Muestra'.$C13]);"";[$'03.Muestra'.$C13]) ->  | C366: of:=IF( ISBLANK([$'03.Muestra'.$E13]);"";[$'03.Muestra'.$E13]) ->  | E366: of:=IF([.D366]<>"";IF(AND([.B366]<>"";[.C366]<>"");"";"ERR");"") -> 
B367: of:=IF( ISBLANK([$'03.Muestra'.$C14]);"";[$'03.Muestra'.$C14]) ->  | C367: of:=IF( ISBLANK([$'03.Muestra'.$E14]);"";[$'03.Muestra'.$E14]) ->  | E367: of:=IF([.D367]<>"";IF(AND([.B367]<>"";[.C367]<>"");"";"ERR");"") -> 
B368: of:=IF( ISBLANK([$'03.Muestra'.$C15]);"";[$'03.Muestra'.$C15]) ->  | C368: of:=IF( ISBLANK([$'03.Muestra'.$E15]);"";[$'03.Muestra'.$E15]) ->  | E368: of:=IF([.D368]<>"";IF(AND([.B368]<>"";[.C368]<>"");"";"ERR");"") -> 
B369: of:=IF( ISBLANK([$'03.Muestra'.$C16]);"";[$'03.Muestra'.$C16]) ->  | C369: of:=IF( ISBLANK([$'03.Muestra'.$E16]);"";[$'03.Muestra'.$E16]) ->  | E369: of:=IF([.D369]<>"";IF(AND([.B369]<>"";[.C369]<>"");"";"ERR");"") -> 
B370: of:=IF( ISBLANK([$'03.Muestra'.$C17]);"";[$'03.Muestra'.$C17]) ->  | C370: of:=IF( ISBLANK([$'03.Muestra'.$E17]);"";[$'03.Muestra'.$E17]) ->  | E370: of:=IF([.D370]<>"";IF(AND([.B370]<>"";[.C370]<>"");"";"ERR");"") -> 
B371: of:=IF( ISBLANK([$'03.Muestra'.$C18]);"";[$'03.Muestra'.$C18]) ->  | C371: of:=IF( ISBLANK([$'03.Muestra'.$E18]);"";[$'03.Muestra'.$E18]) ->  | E371: of:=IF([.D371]<>"";IF(AND([.B371]<>"";[.C371]<>"");"";"ERR");"") -> 
B372: of:=IF( ISBLANK([$'03.Muestra'.$C19]);"";[$'03.Muestra'.$C19]) ->  | C372: of:=IF( ISBLANK([$'03.Muestra'.$E19]);"";[$'03.Muestra'.$E19]) ->  | E372: of:=IF([.D372]<>"";IF(AND([.B372]<>"";[.C372]<>"");"";"ERR");"") -> 
B373: of:=IF( ISBLANK([$'03.Muestra'.$C20]);"";[$'03.Muestra'.$C20]) ->  | C373: of:=IF( ISBLANK([$'03.Muestra'.$E20]);"";[$'03.Muestra'.$E20]) ->  | E373: of:=IF([.D373]<>"";IF(AND([.B373]<>"";[.C373]<>"");"";"ERR");"") -> 
B374: of:=IF( ISBLANK([$'03.Muestra'.$C21]);"";[$'03.Muestra'.$C21]) ->  | C374: of:=IF( ISBLANK([$'03.Muestra'.$E21]);"";[$'03.Muestra'.$E21]) ->  | E374: of:=IF([.D374]<>"";IF(AND([.B374]<>"";[.C374]<>"");"";"ERR");"") -> 
B375: of:=IF( ISBLANK([$'03.Muestra'.$C22]);"";[$'03.Muestra'.$C22]) ->  | C375: of:=IF( ISBLANK([$'03.Muestra'.$E22]);"";[$'03.Muestra'.$E22]) ->  | E375: of:=IF([.D375]<>"";IF(AND([.B375]<>"";[.C375]<>"");"";"ERR");"") -> 
B376: of:=IF( ISBLANK([$'03.Muestra'.$C23]);"";[$'03.Muestra'.$C23]) ->  | C376: of:=IF( ISBLANK([$'03.Muestra'.$E23]);"";[$'03.Muestra'.$E23]) ->  | E376: of:=IF([.D376]<>"";IF(AND([.B376]<>"";[.C376]<>"");"";"ERR");"") -> 
B377: of:=IF( ISBLANK([$'03.Muestra'.$C24]);"";[$'03.Muestra'.$C24]) ->  | C377: of:=IF( ISBLANK([$'03.Muestra'.$E24]);"";[$'03.Muestra'.$E24]) ->  | E377: of:=IF([.D377]<>"";IF(AND([.B377]<>"";[.C377]<>"");"";"ERR");"") -> 
B378: of:=IF( ISBLANK([$'03.Muestra'.$C25]);"";[$'03.Muestra'.$C25]) ->  | C378: of:=IF( ISBLANK([$'03.Muestra'.$E25]);"";[$'03.Muestra'.$E25]) ->  | E378: of:=IF([.D378]<>"";IF(AND([.B378]<>"";[.C378]<>"");"";"ERR");"") -> 
B379: of:=IF( ISBLANK([$'03.Muestra'.$C26]);"";[$'03.Muestra'.$C26]) ->  | C379: of:=IF( ISBLANK([$'03.Muestra'.$E26]);"";[$'03.Muestra'.$E26]) ->  | E379: of:=IF([.D379]<>"";IF(AND([.B379]<>"";[.C379]<>"");"";"ERR");"") -> 
B380: of:=IF( ISBLANK([$'03.Muestra'.$C27]);"";[$'03.Muestra'.$C27]) ->  | C380: of:=IF( ISBLANK([$'03.Muestra'.$E27]);"";[$'03.Muestra'.$E27]) ->  | E380: of:=IF([.D380]<>"";IF(AND([.B380]<>"";[.C380]<>"");"";"ERR");"") -> 
B381: of:=IF( ISBLANK([$'03.Muestra'.$C28]);"";[$'03.Muestra'.$C28]) ->  | C381: of:=IF( ISBLANK([$'03.Muestra'.$E28]);"";[$'03.Muestra'.$E28]) ->  | E381: of:=IF([.D381]<>"";IF(AND([.B381]<>"";[.C381]<>"");"";"ERR");"") -> 
B382: of:=IF( ISBLANK([$'03.Muestra'.$C29]);"";[$'03.Muestra'.$C29]) ->  | C382: of:=IF( ISBLANK([$'03.Muestra'.$E29]);"";[$'03.Muestra'.$E29]) ->  | E382: of:=IF([.D382]<>"";IF(AND([.B382]<>"";[.C382]<>"");"";"ERR");"") -> 
B383: of:=IF( ISBLANK([$'03.Muestra'.$C30]);"";[$'03.Muestra'.$C30]) ->  | C383: of:=IF( ISBLANK([$'03.Muestra'.$E30]);"";[$'03.Muestra'.$E30]) ->  | E383: of:=IF([.D383]<>"";IF(AND([.B383]<>"";[.C383]<>"");"";"ERR");"") -> 
B384: of:=IF( ISBLANK([$'03.Muestra'.$C31]);"";[$'03.Muestra'.$C31]) ->  | C384: of:=IF( ISBLANK([$'03.Muestra'.$E31]);"";[$'03.Muestra'.$E31]) ->  | E384: of:=IF([.D384]<>"";IF(AND([.B384]<>"";[.C384]<>"");"";"ERR");"") -> 
B385: of:=IF( ISBLANK([$'03.Muestra'.$C32]);"";[$'03.Muestra'.$C32]) ->  | C385: of:=IF( ISBLANK([$'03.Muestra'.$E32]);"";[$'03.Muestra'.$E32]) ->  | E385: of:=IF([.D385]<>"";IF(AND([.B385]<>"";[.C385]<>"");"";"ERR");"") -> 
B386: of:=IF( ISBLANK([$'03.Muestra'.$C33]);"";[$'03.Muestra'.$C33]) ->  | C386: of:=IF( ISBLANK([$'03.Muestra'.$E33]);"";[$'03.Muestra'.$E33]) ->  | E386: of:=IF([.D386]<>"";IF(AND([.B386]<>"";[.C386]<>"");"";"ERR");"") -> 
B387: of:=IF( ISBLANK([$'03.Muestra'.$C34]);"";[$'03.Muestra'.$C34]) ->  | C387: of:=IF( ISBLANK([$'03.Muestra'.$E34]);"";[$'03.Muestra'.$E34]) ->  | E387: of:=IF([.D387]<>"";IF(AND([.B387]<>"";[.C387]<>"");"";"ERR");"") -> 
B388: of:=IF( ISBLANK([$'03.Muestra'.$C35]);"";[$'03.Muestra'.$C35]) ->  | C388: of:=IF( ISBLANK([$'03.Muestra'.$E35]);"";[$'03.Muestra'.$E35]) ->  | E388: of:=IF([.D388]<>"";IF(AND([.B388]<>"";[.C388]<>"");"";"ERR");"") -> 
B389: of:=IF( ISBLANK([$'03.Muestra'.$C36]);"";[$'03.Muestra'.$C36]) ->  | C389: of:=IF( ISBLANK([$'03.Muestra'.$E36]);"";[$'03.Muestra'.$E36]) ->  | E389: of:=IF([.D389]<>"";IF(AND([.B389]<>"";[.C389]<>"");"";"ERR");"") -> 
B390: of:=IF( ISBLANK([$'03.Muestra'.$C37]);"";[$'03.Muestra'.$C37]) ->  | C390: of:=IF( ISBLANK([$'03.Muestra'.$E37]);"";[$'03.Muestra'.$E37]) ->  | E390: of:=IF([.D390]<>"";IF(AND([.B390]<>"";[.C390]<>"");"";"ERR");"") -> 
B391: of:=IF( ISBLANK([$'03.Muestra'.$C38]);"";[$'03.Muestra'.$C38]) ->  | C391: of:=IF( ISBLANK([$'03.Muestra'.$E38]);"";[$'03.Muestra'.$E38]) ->  | E391: of:=IF([.D391]<>"";IF(AND([.B391]<>"";[.C391]<>"");"";"ERR");"") -> 
B392: of:=IF( ISBLANK([$'03.Muestra'.$C39]);"";[$'03.Muestra'.$C39]) ->  | C392: of:=IF( ISBLANK([$'03.Muestra'.$E39]);"";[$'03.Muestra'.$E39]) ->  | E392: of:=IF([.D392]<>"";IF(AND([.B392]<>"";[.C392]<>"");"";"ERR");"") -> 
B393: of:=IF( ISBLANK([$'03.Muestra'.$C40]);"";[$'03.Muestra'.$C40]) ->  | C393: of:=IF( ISBLANK([$'03.Muestra'.$E40]);"";[$'03.Muestra'.$E40]) ->  | E393: of:=IF([.D393]<>"";IF(AND([.B393]<>"";[.C393]<>"");"";"ERR");"") -> 
B394: of:=IF( ISBLANK([$'03.Muestra'.$C41]);"";[$'03.Muestra'.$C41]) ->  | C394: of:=IF( ISBLANK([$'03.Muestra'.$E41]);"";[$'03.Muestra'.$E41]) ->  | E394: of:=IF([.D394]<>"";IF(AND([.B394]<>"";[.C394]<>"");"";"ERR");"") -> 
B395: of:=IF( ISBLANK([$'03.Muestra'.$C42]);"";[$'03.Muestra'.$C42]) ->  | C395: of:=IF( ISBLANK([$'03.Muestra'.$E42]);"";[$'03.Muestra'.$E42]) ->  | E395: of:=IF([.D395]<>"";IF(AND([.B395]<>"";[.C395]<>"");"";"ERR");"") -> 
B398: AA | C398: 1.3.5 Identificar el propósito de campo | D398: Resultado
B399: of:=IF( ISBLANK([$'03.Muestra'.$C8]);"";[$'03.Muestra'.$C8]) ->  | C399: of:=IF( ISBLANK([$'03.Muestra'.$E8]);"";[$'03.Muestra'.$E8]) ->  | E399: of:=IF([.D399]<>"";IF(AND([.B399]<>"";[.C399]<>"");"";"ERR");"") ->  | F399: N/T | G399: N/D | H399: N/A | I399: Falla | J399: Pasa | K399: En blanco
B400: of:=IF( ISBLANK([$'03.Muestra'.$C9]);"";[$'03.Muestra'.$C9]) ->  | C400: of:=IF( ISBLANK([$'03.Muestra'.$E9]);"";[$'03.Muestra'.$E9]) ->  | E400: of:=IF([.D400]<>"";IF(AND([.B400]<>"";[.C400]<>"");"";"ERR");"") ->  | F400: of:=COUNTIF([.$D399]:INDIRECT("$D" &  SUM(ROW()-1;['03.Muestra'.$D$45])-1);[.F399]) -> 0 | G400: of:=COUNTIF([.$D399]:INDIRECT("$D" &  SUM(ROW()-1;['03.Muestra'.$D$45])-1);[.G399]) -> 0 | H400: of:=COUNTIF([.$D399]:INDIRECT("$D" &  SUM(ROW()-1;['03.Muestra'.$D$45])-1);[.H399]) -> 0 | I400: of:=COUNTIF([.$D399]:INDIRECT("$D" &  SUM(ROW()-1;['03.Muestra'.$D$45])-1);[.I399]) -> 0 | J400: of:=COUNTIF([.$D399]:INDIRECT("$D" &  SUM(ROW()-1;['03.Muestra'.$D$45])-1);[.J399]) -> 0 | K400: of:=IF(['03.Muestra'.$D$45]=0;0;COUNTBLANK([.$D399]:INDIRECT("$D" &  SUM(ROW()-1;['03.Muestra'.$D$45])-1))) -> 0
B401: of:=IF( ISBLANK([$'03.Muestra'.$C10]);"";[$'03.Muestra'.$C10]) ->  | C401: of:=IF( ISBLANK([$'03.Muestra'.$E10]);"";[$'03.Muestra'.$E10]) ->  | E401: of:=IF([.D401]<>"";IF(AND([.B401]<>"";[.C401]<>"");"";"ERR");"") -> 
B402: of:=IF( ISBLANK([$'03.Muestra'.$C11]);"";[$'03.Muestra'.$C11]) ->  | C402: of:=IF( ISBLANK([$'03.Muestra'.$E11]);"";[$'03.Muestra'.$E11]) ->  | E402: of:=IF([.D402]<>"";IF(AND([.B402]<>"";[.C402]<>"");"";"ERR");"") -> 
B403: of:=IF( ISBLANK([$'03.Muestra'.$C12]);"";[$'03.Muestra'.$C12]) ->  | C403: of:=IF( ISBLANK([$'03.Muestra'.$E12]);"";[$'03.Muestra'.$E12]) ->  | E403: of:=IF([.D403]<>"";IF(AND([.B403]<>"";[.C403]<>"");"";"ERR");"") -> 
B404: of:=IF( ISBLANK([$'03.Muestra'.$C13]);"";[$'03.Muestra'.$C13]) ->  | C404: of:=IF( ISBLANK([$'03.Muestra'.$E13]);"";[$'03.Muestra'.$E13]) ->  | E404: of:=IF([.D404]<>"";IF(AND([.B404]<>"";[.C404]<>"");"";"ERR");"") -> 
B405: of:=IF( ISBLANK([$'03.Muestra'.$C14]);"";[$'03.Muestra'.$C14]) ->  | C405: of:=IF( ISBLANK([$'03.Muestra'.$E14]);"";[$'03.Muestra'.$E14]) ->  | E405: of:=IF([.D405]<>"";IF(AND([.B405]<>"";[.C405]<>"");"";"ERR");"") -> 
B406: of:=IF( ISBLANK([$'03.Muestra'.$C15]);"";[$'03.Muestra'.$C15]) ->  | C406: of:=IF( ISBLANK([$'03.Muestra'.$E15]);"";[$'03.Muestra'.$E15]) ->  | E406: of:=IF([.D406]<>"";IF(AND([.B406]<>"";[.C406]<>"");"";"ERR");"") -> 
B407: of:=IF( ISBLANK([$'03.Muestra'.$C16]);"";[$'03.Muestra'.$C16]) ->  | C407: of:=IF( ISBLANK([$'03.Muestra'.$E16]);"";[$'03.Muestra'.$E16]) ->  | E407: of:=IF([.D407]<>"";IF(AND([.B407]<>"";[.C407]<>"");"";"ERR");"") -> 
B408: of:=IF( ISBLANK([$'03.Muestra'.$C17]);"";[$'03.Muestra'.$C17]) ->  | C408: of:=IF( ISBLANK([$'03.Muestra'.$E17]);"";[$'03.Muestra'.$E17]) ->  | E408: of:=IF([.D408]<>"";IF(AND([.B408]<>"";[.C408]<>"");"";"ERR");"") -> 
B409: of:=IF( ISBLANK([$'03.Muestra'.$C18]);"";[$'03.Muestra'.$C18]) ->  | C409: of:=IF( ISBLANK([$'03.Muestra'.$E18]);"";[$'03.Muestra'.$E18]) ->  | E409: of:=IF([.D409]<>"";IF(AND([.B409]<>"";[.C409]<>"");"";"ERR");"") -> 
B410: of:=IF( ISBLANK([$'03.Muestra'.$C19]);"";[$'03.Muestra'.$C19]) ->  | C410: of:=IF( ISBLANK([$'03.Muestra'.$E19]);"";[$'03.Muestra'.$E19]) ->  | E410: of:=IF([.D410]<>"";IF(AND([.B410]<>"";[.C410]<>"");"";"ERR");"") -> 
B411: of:=IF( ISBLANK([$'03.Muestra'.$C20]);"";[$'03.Muestra'.$C20]) ->  | C411: of:=IF( ISBLANK([$'03.Muestra'.$E20]);"";[$'03.Muestra'.$E20]) ->  | E411: of:=IF([.D411]<>"";IF(AND([.B411]<>"";[.C411]<>"");"";"ERR");"") -> 
B412: of:=IF( ISBLANK([$'03.Muestra'.$C21]);"";[$'03.Muestra'.$C21]) ->  | C412: of:=IF( ISBLANK([$'03.Muestra'.$E21]);"";[$'03.Muestra'.$E21]) ->  | E412: of:=IF([.D412]<>"";IF(AND([.B412]<>"";[.C412]<>"");"";"ERR");"") -> 
B413: of:=IF( ISBLANK([$'03.Muestra'.$C22]);"";[$'03.Muestra'.$C22]) ->  | C413: of:=IF( ISBLANK([$'03.Muestra'.$E22]);"";[$'03.Muestra'.$E22]) ->  | E413: of:=IF([.D413]<>"";IF(AND([.B413]<>"";[.C413]<>"");"";"ERR");"") -> 
B414: of:=IF( ISBLANK([$'03.Muestra'.$C23]);"";[$'03.Muestra'.$C23]) ->  | C414: of:=IF( ISBLANK([$'03.Muestra'.$E23]);"";[$'03.Muestra'.$E23]) ->  | E414: of:=IF([.D414]<>"";IF(AND([.B414]<>"";[.C414]<>"");"";"ERR");"") -> 
B415: of:=IF( ISBLANK([$'03.Muestra'.$C24]);"";[$'03.Muestra'.$C24]) ->  | C415: of:=IF( ISBLANK([$'03.Muestra'.$E24]);"";[$'03.Muestra'.$E24]) ->  | E415: of:=IF([.D415]<>"";IF(AND([.B415]<>"";[.C415]<>"");"";"ERR");"") -> 
B416: of:=IF( ISBLANK([$'03.Muestra'.$C25]);"";[$'03.Muestra'.$C25]) ->  | C416: of:=IF( ISBLANK([$'03.Muestra'.$E25]);"";[$'03.Muestra'.$E25]) ->  | E416: of:=IF([.D416]<>"";IF(AND([.B416]<>"";[.C416]<>"");"";"ERR");"") -> 
B417: of:=IF( ISBLANK([$'03.Muestra'.$C26]);"";[$'03.Muestra'.$C26]) ->  | C417: of:=IF( ISBLANK([$'03.Muestra'.$E26]);"";[$'03.Muestra'.$E26]) ->  | E417: of:=IF([.D417]<>"";IF(AND([.B417]<>"";[.C417]<>"");"";"ERR");"") -> 
B418: of:=IF( ISBLANK([$'03.Muestra'.$C27]);"";[$'03.Muestra'.$C27]) ->  | C418: of:=IF( ISBLANK([$'03.Muestra'.$E27]);"";[$'03.Muestra'.$E27]) ->  | E418: of:=IF([.D418]<>"";IF(AND([.B418]<>"";[.C418]<>"");"";"ERR");"") -> 
B419: of:=IF( ISBLANK([$'03.Muestra'.$C28]);"";[$'03.Muestra'.$C28]) ->  | C419: of:=IF( ISBLANK([$'03.Muestra'.$E28]);"";[$'03.Muestra'.$E28]) ->  | E419: of:=IF([.D419]<>"";IF(AND([.B419]<>"";[.C419]<>"");"";"ERR");"") -> 
B420: of:=IF( ISBLANK([$'03.Muestra'.$C29]);"";[$'03.Muestra'.$C29]) ->  | C420: of:=IF( ISBLANK([$'03.Muestra'.$E29]);"";[$'03.Muestra'.$E29]) ->  | E420: of:=IF([.D420]<>"";IF(AND([.B420]<>"";[.C420]<>"");"";"ERR");"") -> 
B421: of:=IF( ISBLANK([$'03.Muestra'.$C30]);"";[$'03.Muestra'.$C30]) ->  | C421: of:=IF( ISBLANK([$'03.Muestra'.$E30]);"";[$'03.Muestra'.$E30]) ->  | E421: of:=IF([.D421]<>"";IF(AND([.B421]<>"";[.C421]<>"");"";"ERR");"") -> 
B422: of:=IF( ISBLANK([$'03.Muestra'.$C31]);"";[$'03.Muestra'.$C31]) ->  | C422: of:=IF( ISBLANK([$'03.Muestra'.$E31]);"";[$'03.Muestra'.$E31]) ->  | E422: of:=IF([.D422]<>"";IF(AND([.B422]<>"";[.C422]<>"");"";"ERR");"") -> 
B423: of:=IF( ISBLANK([$'03.Muestra'.$C32]);"";[$'03.Muestra'.$C32]) ->  | C423: of:=IF( ISBLANK([$'03.Muestra'.$E32]);"";[$'03.Muestra'.$E32]) ->  | E423: of:=IF([.D423]<>"";IF(AND([.B423]<>"";[.C423]<>"");"";"ERR");"") -> 
B424: of:=IF( ISBLANK([$'03.Muestra'.$C33]);"";[$'03.Muestra'.$C33]) ->  | C424: of:=IF( ISBLANK([$'03.Muestra'.$E33]);"";[$'03.Muestra'.$E33]) ->  | E424: of:=IF([.D424]<>"";IF(AND([.B424]<>"";[.C424]<>"");"";"ERR");"") -> 
B425: of:=IF( ISBLANK([$'03.Muestra'.$C34]);"";[$'03.Muestra'.$C34]) ->  | C425: of:=IF( ISBLANK([$'03.Muestra'.$E34]);"";[$'03.Muestra'.$E34]) ->  | E425: of:=IF([.D425]<>"";IF(AND([.B425]<>"";[.C425]<>"");"";"ERR");"") -> 
B426: of:=IF( ISBLANK([$'03.Muestra'.$C35]);"";[$'03.Muestra'.$C35]) ->  | C426: of:=IF( ISBLANK([$'03.Muestra'.$E35]);"";[$'03.Muestra'.$E35]) ->  | E426: of:=IF([.D426]<>"";IF(AND([.B426]<>"";[.C426]<>"");"";"ERR");"") -> 
B427: of:=IF( ISBLANK([$'03.Muestra'.$C36]);"";[$'03.Muestra'.$C36]) ->  | C427: of:=IF( ISBLANK([$'03.Muestra'.$E36]);"";[$'03.Muestra'.$E36]) ->  | E427: of:=IF([.D427]<>"";IF(AND([.B427]<>"";[.C427]<>"");"";"ERR");"") -> 
B428: of:=IF( ISBLANK([$'03.Muestra'.$C37]);"";[$'03.Muestra'.$C37]) ->  | C428: of:=IF( ISBLANK([$'03.Muestra'.$E37]);"";[$'03.Muestra'.$E37]) ->  | E428: of:=IF([.D428]<>"";IF(AND([.B428]<>"";[.C428]<>"");"";"ERR");"") -> 
B429: of:=IF( ISBLANK([$'03.Muestra'.$C38]);"";[$'03.Muestra'.$C38]) ->  | C429: of:=IF( ISBLANK([$'03.Muestra'.$E38]);"";[$'03.Muestra'.$E38]) ->  | E429: of:=IF([.D429]<>"";IF(AND([.B429]<>"";[.C429]<>"");"";"ERR");"") -> 
B430: of:=IF( ISBLANK([$'03.Muestra'.$C39]);"";[$'03.Muestra'.$C39]) ->  | C430: of:=IF( ISBLANK([$'03.Muestra'.$E39]);"";[$'03.Muestra'.$E39]) ->  | E430: of:=IF([.D430]<>"";IF(AND([.B430]<>"";[.C430]<>"");"";"ERR");"") -> 
B431: of:=IF( ISBLANK([$'03.Muestra'.$C40]);"";[$'03.Muestra'.$C40]) ->  | C431: of:=IF( ISBLANK([$'03.Muestra'.$E40]);"";[$'03.Muestra'.$E40]) ->  | E431: of:=IF([.D431]<>"";IF(AND([.B431]<>"";[.C431]<>"");"";"ERR");"") -> 
B432: of:=IF( ISBLANK([$'03.Muestra'.$C41]);"";[$'03.Muestra'.$C41]) ->  | C432: of:=IF( ISBLANK([$'03.Muestra'.$E41]);"";[$'03.Muestra'.$E41]) ->  | E432: of:=IF([.D432]<>"";IF(AND([.B432]<>"";[.C432]<>"");"";"ERR");"") -> 
B433: of:=IF( ISBLANK([$'03.Muestra'.$C42]);"";[$'03.Muestra'.$C42]) ->  | C433: of:=IF( ISBLANK([$'03.Muestra'.$E42]);"";[$'03.Muestra'.$E42]) ->  | E433: of:=IF([.D433]<>"";IF(AND([.B433]<>"";[.C433]<>"");"";"ERR");"") -> 
B436: A | C436: 1.4.1 Uso del Color | D436: Resultado
B437: of:=IF( ISBLANK([$'03.Muestra'.$C8]);"";[$'03.Muestra'.$C8]) ->  | C437: of:=IF( ISBLANK([$'03.Muestra'.$E8]);"";[$'03.Muestra'.$E8]) ->  | E437: of:=IF([.D437]<>"";IF(AND([.B437]<>"";[.C437]<>"");"";"ERR");"") ->  | F437: N/T | G437: N/D | H437: N/A | I437: Falla | J437: Pasa | K437: En blanco
B438: of:=IF( ISBLANK([$'03.Muestra'.$C9]);"";[$'03.Muestra'.$C9]) ->  | C438: of:=IF( ISBLANK([$'03.Muestra'.$E9]);"";[$'03.Muestra'.$E9]) ->  | E438: of:=IF([.D438]<>"";IF(AND([.B438]<>"";[.C438]<>"");"";"ERR");"") ->  | F438: of:=COUNTIF([.$D437]:INDIRECT("$D" &  SUM(ROW()-1;['03.Muestra'.$D$45])-1);[.F437]) -> 0 | G438: of:=COUNTIF([.$D437]:INDIRECT("$D" &  SUM(ROW()-1;['03.Muestra'.$D$45])-1);[.G437]) -> 0 | H438: of:=COUNTIF([.$D437]:INDIRECT("$D" &  SUM(ROW()-1;['03.Muestra'.$D$45])-1);[.H437]) -> 0 | I438: of:=COUNTIF([.$D437]:INDIRECT("$D" &  SUM(ROW()-1;['03.Muestra'.$D$45])-1);[.I437]) -> 0 | J438: of:=COUNTIF([.$D437]:INDIRECT("$D" &  SUM(ROW()-1;['03.Muestra'.$D$45])-1);[.J437]) -> 0 | K438: of:=IF(['03.Muestra'.$D$45]=0;0;COUNTBLANK([.$D437]:INDIRECT("$D" &  SUM(ROW()-1;['03.Muestra'.$D$45])-1))) -> 0
B439: of:=IF( ISBLANK([$'03.Muestra'.$C10]);"";[$'03.Muestra'.$C10]) ->  | C439: of:=IF( ISBLANK([$'03.Muestra'.$E10]);"";[$'03.Muestra'.$E10]) ->  | E439: of:=IF([.D439]<>"";IF(AND([.B439]<>"";[.C439]<>"");"";"ERR");"") -> 
B440: of:=IF( ISBLANK([$'03.Muestra'.$C11]);"";[$'03.Muestra'.$C11]) ->  | C440: of:=IF( ISBLANK([$'03.Muestra'.$E11]);"";[$'03.Muestra'.$E11]) ->  | E440: of:=IF([.D440]<>"";IF(AND([.B440]<>"";[.C440]<>"");"";"ERR");"") -> 
B441: of:=IF( ISBLANK([$'03.Muestra'.$C12]);"";[$'03.Muestra'.$C12]) ->  | C441: of:=IF( ISBLANK([$'03.Muestra'.$E12]);"";[$'03.Muestra'.$E12]) ->  | E441: of:=IF([.D441]<>"";IF(AND([.B441]<>"";[.C441]<>"");"";"ERR");"") -> 
B442: of:=IF( ISBLANK([$'03.Muestra'.$C13]);"";[$'03.Muestra'.$C13]) ->  | C442: of:=IF( ISBLANK([$'03.Muestra'.$E13]);"";[$'03.Muestra'.$E13]) ->  | E442: of:=IF([.D442]<>"";IF(AND([.B442]<>"";[.C442]<>"");"";"ERR");"") -> 
B443: of:=IF( ISBLANK([$'03.Muestra'.$C14]);"";[$'03.Muestra'.$C14]) ->  | C443: of:=IF( ISBLANK([$'03.Muestra'.$E14]);"";[$'03.Muestra'.$E14]) ->  | E443: of:=IF([.D443]<>"";IF(AND([.B443]<>"";[.C443]<>"");"";"ERR");"") -> 
B444: of:=IF( ISBLANK([$'03.Muestra'.$C15]);"";[$'03.Muestra'.$C15]) ->  | C444: of:=IF( ISBLANK([$'03.Muestra'.$E15]);"";[$'03.Muestra'.$E15]) ->  | E444: of:=IF([.D444]<>"";IF(AND([.B444]<>"";[.C444]<>"");"";"ERR");"") -> 
B445: of:=IF( ISBLANK([$'03.Muestra'.$C16]);"";[$'03.Muestra'.$C16]) ->  | C445: of:=IF( ISBLANK([$'03.Muestra'.$E16]);"";[$'03.Muestra'.$E16]) ->  | E445: of:=IF([.D445]<>"";IF(AND([.B445]<>"";[.C445]<>"");"";"ERR");"") -> 
B446: of:=IF( ISBLANK([$'03.Muestra'.$C17]);"";[$'03.Muestra'.$C17]) ->  | C446: of:=IF( ISBLANK([$'03.Muestra'.$E17]);"";[$'03.Muestra'.$E17]) ->  | E446: of:=IF([.D446]<>"";IF(AND([.B446]<>"";[.C446]<>"");"";"ERR");"") -> 
B447: of:=IF( ISBLANK([$'03.Muestra'.$C18]);"";[$'03.Muestra'.$C18]) ->  | C447: of:=IF( ISBLANK([$'03.Muestra'.$E18]);"";[$'03.Muestra'.$E18]) ->  | E447: of:=IF([.D447]<>"";IF(AND([.B447]<>"";[.C447]<>"");"";"ERR");"") -> 
B448: of:=IF( ISBLANK([$'03.Muestra'.$C19]);"";[$'03.Muestra'.$C19]) ->  | C448: of:=IF( ISBLANK([$'03.Muestra'.$E19]);"";[$'03.Muestra'.$E19]) ->  | E448: of:=IF([.D448]<>"";IF(AND([.B448]<>"";[.C448]<>"");"";"ERR");"") -> 
B449: of:=IF( ISBLANK([$'03.Muestra'.$C20]);"";[$'03.Muestra'.$C20]) ->  | C449: of:=IF( ISBLANK([$'03.Muestra'.$E20]);"";[$'03.Muestra'.$E20]) ->  | E449: of:=IF([.D449]<>"";IF(AND([.B449]<>"";[.C449]<>"");"";"ERR");"") -> 
B450: of:=IF( ISBLANK([$'03.Muestra'.$C21]);"";[$'03.Muestra'.$C21]) ->  | C450: of:=IF( ISBLANK([$'03.Muestra'.$E21]);"";[$'03.Muestra'.$E21]) ->  | E450: of:=IF([.D450]<>"";IF(AND([.B450]<>"";[.C450]<>"");"";"ERR");"") -> 
B451: of:=IF( ISBLANK([$'03.Muestra'.$C22]);"";[$'03.Muestra'.$C22]) ->  | C451: of:=IF( ISBLANK([$'03.Muestra'.$E22]);"";[$'03.Muestra'.$E22]) ->  | E451: of:=IF([.D451]<>"";IF(AND([.B451]<>"";[.C451]<>"");"";"ERR");"") -> 
B452: of:=IF( ISBLANK([$'03.Muestra'.$C23]);"";[$'03.Muestra'.$C23]) ->  | C452: of:=IF( ISBLANK([$'03.Muestra'.$E23]);"";[$'03.Muestra'.$E23]) ->  | E452: of:=IF([.D452]<>"";IF(AND([.B452]<>"";[.C452]<>"");"";"ERR");"") -> 
B453: of:=IF( ISBLANK([$'03.Muestra'.$C24]);"";[$'03.Muestra'.$C24]) ->  | C453: of:=IF( ISBLANK([$'03.Muestra'.$E24]);"";[$'03.Muestra'.$E24]) ->  | E453: of:=IF([.D453]<>"";IF(AND([.B453]<>"";[.C453]<>"");"";"ERR");"") -> 
B454: of:=IF( ISBLANK([$'03.Muestra'.$C25]);"";[$'03.Muestra'.$C25]) ->  | C454: of:=IF( ISBLANK([$'03.Muestra'.$E25]);"";[$'03.Muestra'.$E25]) ->  | E454: of:=IF([.D454]<>"";IF(AND([.B454]<>"";[.C454]<>"");"";"ERR");"") -> 
B455: of:=IF( ISBLANK([$'03.Muestra'.$C26]);"";[$'03.Muestra'.$C26]) ->  | C455: of:=IF( ISBLANK([$'03.Muestra'.$E26]);"";[$'03.Muestra'.$E26]) ->  | E455: of:=IF([.D455]<>"";IF(AND([.B455]<>"";[.C455]<>"");"";"ERR");"") -> 
B456: of:=IF( ISBLANK([$'03.Muestra'.$C27]);"";[$'03.Muestra'.$C27]) ->  | C456: of:=IF( ISBLANK([$'03.Muestra'.$E27]);"";[$'03.Muestra'.$E27]) ->  | E456: of:=IF([.D456]<>"";IF(AND([.B456]<>"";[.C456]<>"");"";"ERR");"") -> 
B457: of:=IF( ISBLANK([$'03.Muestra'.$C28]);"";[$'03.Muestra'.$C28]) ->  | C457: of:=IF( ISBLANK([$'03.Muestra'.$E28]);"";[$'03.Muestra'.$E28]) ->  | E457: of:=IF([.D457]<>"";IF(AND([.B457]<>"";[.C457]<>"");"";"ERR");"") -> 
B458: of:=IF( ISBLANK([$'03.Muestra'.$C29]);"";[$'03.Muestra'.$C29]) ->  | C458: of:=IF( ISBLANK([$'03.Muestra'.$E29]);"";[$'03.Muestra'.$E29]) ->  | E458: of:=IF([.D458]<>"";IF(AND([.B458]<>"";[.C458]<>"");"";"ERR");"") -> 
B459: of:=IF( ISBLANK([$'03.Muestra'.$C30]);"";[$'03.Muestra'.$C30]) ->  | C459: of:=IF( ISBLANK([$'03.Muestra'.$E30]);"";[$'03.Muestra'.$E30]) ->  | E459: of:=IF([.D459]<>"";IF(AND([.B459]<>"";[.C459]<>"");"";"ERR");"") -> 
B460: of:=IF( ISBLANK([$'03.Muestra'.$C31]);"";[$'03.Muestra'.$C31]) ->  | C460: of:=IF( ISBLANK([$'03.Muestra'.$E31]);"";[$'03.Muestra'.$E31]) ->  | E460: of:=IF([.D460]<>"";IF(AND([.B460]<>"";[.C460]<>"");"";"ERR");"") -> 
B461: of:=IF( ISBLANK([$'03.Muestra'.$C32]);"";[$'03.Muestra'.$C32]) ->  | C461: of:=IF( ISBLANK([$'03.Muestra'.$E32]);"";[$'03.Muestra'.$E32]) ->  | E461: of:=IF([.D461]<>"";IF(AND([.B461]<>"";[.C461]<>"");"";"ERR");"") -> 
B462: of:=IF( ISBLANK([$'03.Muestra'.$C33]);"";[$'03.Muestra'.$C33]) ->  | C462: of:=IF( ISBLANK([$'03.Muestra'.$E33]);"";[$'03.Muestra'.$E33]) ->  | E462: of:=IF([.D462]<>"";IF(AND([.B462]<>"";[.C462]<>"");"";"ERR");"") -> 
B463: of:=IF( ISBLANK([$'03.Muestra'.$C34]);"";[$'03.Muestra'.$C34]) ->  | C463: of:=IF( ISBLANK([$'03.Muestra'.$E34]);"";[$'03.Muestra'.$E34]) ->  | E463: of:=IF([.D463]<>"";IF(AND([.B463]<>"";[.C463]<>"");"";"ERR");"") -> 
B464: of:=IF( ISBLANK([$'03.Muestra'.$C35]);"";[$'03.Muestra'.$C35]) ->  | C464: of:=IF( ISBLANK([$'03.Muestra'.$E35]);"";[$'03.Muestra'.$E35]) ->  | E464: of:=IF([.D464]<>"";IF(AND([.B464]<>"";[.C464]<>"");"";"ERR");"") -> 
B465: of:=IF( ISBLANK([$'03.Muestra'.$C36]);"";[$'03.Muestra'.$C36]) ->  | C465: of:=IF( ISBLANK([$'03.Muestra'.$E36]);"";[$'03.Muestra'.$E36]) ->  | E465: of:=IF([.D465]<>"";IF(AND([.B465]<>"";[.C465]<>"");"";"ERR");"") -> 
B466: of:=IF( ISBLANK([$'03.Muestra'.$C37]);"";[$'03.Muestra'.$C37]) ->  | C466: of:=IF( ISBLANK([$'03.Muestra'.$E37]);"";[$'03.Muestra'.$E37]) ->  | E466: of:=IF([.D466]<>"";IF(AND([.B466]<>"";[.C466]<>"");"";"ERR");"") -> 
B467: of:=IF( ISBLANK([$'03.Muestra'.$C38]);"";[$'03.Muestra'.$C38]) ->  | C467: of:=IF( ISBLANK([$'03.Muestra'.$E38]);"";[$'03.Muestra'.$E38]) ->  | E467: of:=IF([.D467]<>"";IF(AND([.B467]<>"";[.C467]<>"");"";"ERR");"") -> 
B468: of:=IF( ISBLANK([$'03.Muestra'.$C39]);"";[$'03.Muestra'.$C39]) ->  | C468: of:=IF( ISBLANK([$'03.Muestra'.$E39]);"";[$'03.Muestra'.$E39]) ->  | E468: of:=IF([.D468]<>"";IF(AND([.B468]<>"";[.C468]<>"");"";"ERR");"") -> 
B469: of:=IF( ISBLANK([$'03.Muestra'.$C40]);"";[$'03.Muestra'.$C40]) ->  | C469: of:=IF( ISBLANK([$'03.Muestra'.$E40]);"";[$'03.Muestra'.$E40]) ->  | E469: of:=IF([.D469]<>"";IF(AND([.B469]<>"";[.C469]<>"");"";"ERR");"") -> 
B470: of:=IF( ISBLANK([$'03.Muestra'.$C41]);"";[$'03.Muestra'.$C41]) ->  | C470: of:=IF( ISBLANK([$'03.Muestra'.$E41]);"";[$'03.Muestra'.$E41]) ->  | E470: of:=IF([.D470]<>"";IF(AND([.B470]<>"";[.C470]<>"");"";"ERR");"") -> 
B471: of:=IF( ISBLANK([$'03.Muestra'.$C42]);"";[$'03.Muestra'.$C42]) ->  | C471: of:=IF( ISBLANK([$'03.Muestra'.$E42]);"";[$'03.Muestra'.$E42]) ->  | E471: of:=IF([.D471]<>"";IF(AND([.B471]<>"";[.C471]<>"");"";"ERR");"") -> 
B474: A | C474: 1.4.2 Control del audio | D474: Resultado
B475: of:=IF( ISBLANK([$'03.Muestra'.$C8]);"";[$'03.Muestra'.$C8]) ->  | C475: of:=IF( ISBLANK([$'03.Muestra'.$E8]);"";[$'03.Muestra'.$E8]) ->  | E475: of:=IF([.D475]<>"";IF(AND([.B475]<>"";[.C475]<>"");"";"ERR");"") ->  | F475: N/T | G475: N/D | H475: N/A | I475: Falla | J475: Pasa | K475: En blanco
B476: of:=IF( ISBLANK([$'03.Muestra'.$C9]);"";[$'03.Muestra'.$C9]) ->  | C476: of:=IF( ISBLANK([$'03.Muestra'.$E9]);"";[$'03.Muestra'.$E9]) ->  | E476: of:=IF([.D476]<>"";IF(AND([.B476]<>"";[.C476]<>"");"";"ERR");"") ->  | F476: of:=COUNTIF([.$D475]:INDIRECT("$D" &  SUM(ROW()-1;['03.Muestra'.$D$45])-1);[.F475]) -> 0 | G476: of:=COUNTIF([.$D475]:INDIRECT("$D" &  SUM(ROW()-1;['03.Muestra'.$D$45])-1);[.G475]) -> 0 | H476: of:=COUNTIF([.$D475]:INDIRECT("$D" &  SUM(ROW()-1;['03.Muestra'.$D$45])-1);[.H475]) -> 0 | I476: of:=COUNTIF([.$D475]:INDIRECT("$D" &  SUM(ROW()-1;['03.Muestra'.$D$45])-1);[.I475]) -> 0 | J476: of:=COUNTIF([.$D475]:INDIRECT("$D" &  SUM(ROW()-1;['03.Muestra'.$D$45])-1);[.J475]) -> 0 | K476: of:=IF(['03.Muestra'.$D$45]=0;0;COUNTBLANK([.$D475]:INDIRECT("$D" &  SUM(ROW()-1;['03.Muestra'.$D$45])-1))) -> 0
B477: of:=IF( ISBLANK([$'03.Muestra'.$C10]);"";[$'03.Muestra'.$C10]) ->  | C477: of:=IF( ISBLANK([$'03.Muestra'.$E10]);"";[$'03.Muestra'.$E10]) ->  | E477: of:=IF([.D477]<>"";IF(AND([.B477]<>"";[.C477]<>"");"";"ERR");"") -> 
B478: of:=IF( ISBLANK([$'03.Muestra'.$C11]);"";[$'03.Muestra'.$C11]) ->  | C478: of:=IF( ISBLANK([$'03.Muestra'.$E11]);"";[$'03.Muestra'.$E11]) ->  | E478: of:=IF([.D478]<>"";IF(AND([.B478]<>"";[.C478]<>"");"";"ERR");"") -> 
B479: of:=IF( ISBLANK([$'03.Muestra'.$C12]);"";[$'03.Muestra'.$C12]) ->  | C479: of:=IF( ISBLANK([$'03.Muestra'.$E12]);"";[$'03.Muestra'.$E12]) ->  | E479: of:=IF([.D479]<>"";IF(AND([.B479]<>"";[.C479]<>"");"";"ERR");"") -> 
B480: of:=IF( ISBLANK([$'03.Muestra'.$C13]);"";[$'03.Muestra'.$C13]) ->  | C480: of:=IF( ISBLANK([$'03.Muestra'.$E13]);"";[$'03.Muestra'.$E13]) ->  | E480: of:=IF([.D480]<>"";IF(AND([.B480]<>"";[.C480]<>"");"";"ERR");"") -> 
B481: of:=IF( ISBLANK([$'03.Muestra'.$C14]);"";[$'03.Muestra'.$C14]) ->  | C481: of:=IF( ISBLANK([$'03.Muestra'.$E14]);"";[$'03.Muestra'.$E14]) ->  | E481: of:=IF([.D481]<>"";IF(AND([.B481]<>"";[.C481]<>"");"";"ERR");"") -> 
B482: of:=IF( ISBLANK([$'03.Muestra'.$C15]);"";[$'03.Muestra'.$C15]) ->  | C482: of:=IF( ISBLANK([$'03.Muestra'.$E15]);"";[$'03.Muestra'.$E15]) ->  | E482: of:=IF([.D482]<>"";IF(AND([.B482]<>"";[.C482]<>"");"";"ERR");"") -> 
B483: of:=IF( ISBLANK([$'03.Muestra'.$C16]);"";[$'03.Muestra'.$C16]) ->  | C483: of:=IF( ISBLANK([$'03.Muestra'.$E16]);"";[$'03.Muestra'.$E16]) ->  | E483: of:=IF([.D483]<>"";IF(AND([.B483]<>"";[.C483]<>"");"";"ERR");"") -> 
B484: of:=IF( ISBLANK([$'03.Muestra'.$C17]);"";[$'03.Muestra'.$C17]) ->  | C484: of:=IF( ISBLANK([$'03.Muestra'.$E17]);"";[$'03.Muestra'.$E17]) ->  | E484: of:=IF([.D484]<>"";IF(AND([.B484]<>"";[.C484]<>"");"";"ERR");"") -> 
B485: of:=IF( ISBLANK([$'03.Muestra'.$C18]);"";[$'03.Muestra'.$C18]) ->  | C485: of:=IF( ISBLANK([$'03.Muestra'.$E18]);"";[$'03.Muestra'.$E18]) ->  | E485: of:=IF([.D485]<>"";IF(AND([.B485]<>"";[.C485]<>"");"";"ERR");"") -> 
B486: of:=IF( ISBLANK([$'03.Muestra'.$C19]);"";[$'03.Muestra'.$C19]) ->  | C486: of:=IF( ISBLANK([$'03.Muestra'.$E19]);"";[$'03.Muestra'.$E19]) ->  | E486: of:=IF([.D486]<>"";IF(AND([.B486]<>"";[.C486]<>"");"";"ERR");"") -> 
B487: of:=IF( ISBLANK([$'03.Muestra'.$C20]);"";[$'03.Muestra'.$C20]) ->  | C487: of:=IF( ISBLANK([$'03.Muestra'.$E20]);"";[$'03.Muestra'.$E20]) ->  | E487: of:=IF([.D487]<>"";IF(AND([.B487]<>"";[.C487]<>"");"";"ERR");"") -> 
B488: of:=IF( ISBLANK([$'03.Muestra'.$C21]);"";[$'03.Muestra'.$C21]) ->  | C488: of:=IF( ISBLANK([$'03.Muestra'.$E21]);"";[$'03.Muestra'.$E21]) ->  | E488: of:=IF([.D488]<>"";IF(AND([.B488]<>"";[.C488]<>"");"";"ERR");"") -> 
B489: of:=IF( ISBLANK([$'03.Muestra'.$C22]);"";[$'03.Muestra'.$C22]) ->  | C489: of:=IF( ISBLANK([$'03.Muestra'.$E22]);"";[$'03.Muestra'.$E22]) ->  | E489: of:=IF([.D489]<>"";IF(AND([.B489]<>"";[.C489]<>"");"";"ERR");"") -> 
B490: of:=IF( ISBLANK([$'03.Muestra'.$C23]);"";[$'03.Muestra'.$C23]) ->  | C490: of:=IF( ISBLANK([$'03.Muestra'.$E23]);"";[$'03.Muestra'.$E23]) ->  | E490: of:=IF([.D490]<>"";IF(AND([.B490]<>"";[.C490]<>"");"";"ERR");"") -> 
B491: of:=IF( ISBLANK([$'03.Muestra'.$C24]);"";[$'03.Muestra'.$C24]) ->  | C491: of:=IF( ISBLANK([$'03.Muestra'.$E24]);"";[$'03.Muestra'.$E24]) ->  | E491: of:=IF([.D491]<>"";IF(AND([.B491]<>"";[.C491]<>"");"";"ERR");"") -> 
B492: of:=IF( ISBLANK([$'03.Muestra'.$C25]);"";[$'03.Muestra'.$C25]) ->  | C492: of:=IF( ISBLANK([$'03.Muestra'.$E25]);"";[$'03.Muestra'.$E25]) ->  | E492: of:=IF([.D492]<>"";IF(AND([.B492]<>"";[.C492]<>"");"";"ERR");"") -> 
B493: of:=IF( ISBLANK([$'03.Muestra'.$C26]);"";[$'03.Muestra'.$C26]) ->  | C493: of:=IF( ISBLANK([$'03.Muestra'.$E26]);"";[$'03.Muestra'.$E26]) ->  | E493: of:=IF([.D493]<>"";IF(AND([.B493]<>"";[.C493]<>"");"";"ERR");"") -> 
B494: of:=IF( ISBLANK([$'03.Muestra'.$C27]);"";[$'03.Muestra'.$C27]) ->  | C494: of:=IF( ISBLANK([$'03.Muestra'.$E27]);"";[$'03.Muestra'.$E27]) ->  | E494: of:=IF([.D494]<>"";IF(AND([.B494]<>"";[.C494]<>"");"";"ERR");"") -> 
B495: of:=IF( ISBLANK([$'03.Muestra'.$C28]);"";[$'03.Muestra'.$C28]) ->  | C495: of:=IF( ISBLANK([$'03.Muestra'.$E28]);"";[$'03.Muestra'.$E28]) ->  | E495: of:=IF([.D495]<>"";IF(AND([.B495]<>"";[.C495]<>"");"";"ERR");"") -> 
B496: of:=IF( ISBLANK([$'03.Muestra'.$C29]);"";[$'03.Muestra'.$C29]) ->  | C496: of:=IF( ISBLANK([$'03.Muestra'.$E29]);"";[$'03.Muestra'.$E29]) ->  | E496: of:=IF([.D496]<>"";IF(AND([.B496]<>"";[.C496]<>"");"";"ERR");"") -> 
B497: of:=IF( ISBLANK([$'03.Muestra'.$C30]);"";[$'03.Muestra'.$C30]) ->  | C497: of:=IF( ISBLANK([$'03.Muestra'.$E30]);"";[$'03.Muestra'.$E30]) ->  | E497: of:=IF([.D497]<>"";IF(AND([.B497]<>"";[.C497]<>"");"";"ERR");"") -> 
B498: of:=IF( ISBLANK([$'03.Muestra'.$C31]);"";[$'03.Muestra'.$C31]) ->  | C498: of:=IF( ISBLANK([$'03.Muestra'.$E31]);"";[$'03.Muestra'.$E31]) ->  | E498: of:=IF([.D498]<>"";IF(AND([.B498]<>"";[.C498]<>"");"";"ERR");"") -> 
B499: of:=IF( ISBLANK([$'03.Muestra'.$C32]);"";[$'03.Muestra'.$C32]) ->  | C499: of:=IF( ISBLANK([$'03.Muestra'.$E32]);"";[$'03.Muestra'.$E32]) ->  | E499: of:=IF([.D499]<>"";IF(AND([.B499]<>"";[.C499]<>"");"";"ERR");"") -> 
B500: of:=IF( ISBLANK([$'03.Muestra'.$C33]);"";[$'03.Muestra'.$C33]) ->  | C500: of:=IF( ISBLANK([$'03.Muestra'.$E33]);"";[$'03.Muestra'.$E33]) ->  | E500: of:=IF([.D500]<>"";IF(AND([.B500]<>"";[.C500]<>"");"";"ERR");"") -> 
B501: of:=IF( ISBLANK([$'03.Muestra'.$C34]);"";[$'03.Muestra'.$C34]) ->  | C501: of:=IF( ISBLANK([$'03.Muestra'.$E34]);"";[$'03.Muestra'.$E34]) ->  | E501: of:=IF([.D501]<>"";IF(AND([.B501]<>"";[.C501]<>"");"";"ERR");"") -> 
B502: of:=IF( ISBLANK([$'03.Muestra'.$C35]);"";[$'03.Muestra'.$C35]) ->  | C502: of:=IF( ISBLANK([$'03.Muestra'.$E35]);"";[$'03.Muestra'.$E35]) ->  | E502: of:=IF([.D502]<>"";IF(AND([.B502]<>"";[.C502]<>"");"";"ERR");"") -> 
B503: of:=IF( ISBLANK([$'03.Muestra'.$C36]);"";[$'03.Muestra'.$C36]) ->  | C503: of:=IF( ISBLANK([$'03.Muestra'.$E36]);"";[$'03.Muestra'.$E36]) ->  | E503: of:=IF([.D503]<>"";IF(AND([.B503]<>"";[.C503]<>"");"";"ERR");"") -> 
B504: of:=IF( ISBLANK([$'03.Muestra'.$C37]);"";[$'03.Muestra'.$C37]) ->  | C504: of:=IF( ISBLANK([$'03.Muestra'.$E37]);"";[$'03.Muestra'.$E37]) ->  | E504: of:=IF([.D504]<>"";IF(AND([.B504]<>"";[.C504]<>"");"";"ERR");"") -> 
B505: of:=IF( ISBLANK([$'03.Muestra'.$C38]);"";[$'03.Muestra'.$C38]) ->  | C505: of:=IF( ISBLANK([$'03.Muestra'.$E38]);"";[$'03.Muestra'.$E38]) ->  | E505: of:=IF([.D505]<>"";IF(AND([.B505]<>"";[.C505]<>"");"";"ERR");"") -> 
B506: of:=IF( ISBLANK([$'03.Muestra'.$C39]);"";[$'03.Muestra'.$C39]) ->  | C506: of:=IF( ISBLANK([$'03.Muestra'.$E39]);"";[$'03.Muestra'.$E39]) ->  | E506: of:=IF([.D506]<>"";IF(AND([.B506]<>"";[.C506]<>"");"";"ERR");"") -> 
B507: of:=IF( ISBLANK([$'03.Muestra'.$C40]);"";[$'03.Muestra'.$C40]) ->  | C507: of:=IF( ISBLANK([$'03.Muestra'.$E40]);"";[$'03.Muestra'.$E40]) ->  | E507: of:=IF([.D507]<>"";IF(AND([.B507]<>"";[.C507]<>"");"";"ERR");"") -> 
B508: of:=IF( ISBLANK([$'03.Muestra'.$C41]);"";[$'03.Muestra'.$C41]) ->  | C508: of:=IF( ISBLANK([$'03.Muestra'.$E41]);"";[$'03.Muestra'.$E41]) ->  | E508: of:=IF([.D508]<>"";IF(AND([.B508]<>"";[.C508]<>"");"";"ERR");"") -> 
B509: of:=IF( ISBLANK([$'03.Muestra'.$C42]);"";[$'03.Muestra'.$C42]) ->  | C509: of:=IF( ISBLANK([$'03.Muestra'.$E42]);"";[$'03.Muestra'.$E42]) ->  | E509: of:=IF([.D509]<>"";IF(AND([.B509]<>"";[.C509]<>"");"";"ERR");"") -> 
B512: AA | C512: 1.4.3 Contraste (mínimo) | D512: Resultado
B513: of:=IF( ISBLANK([$'03.Muestra'.$C8]);"";[$'03.Muestra'.$C8]) ->  | C513: of:=IF( ISBLANK([$'03.Muestra'.$E8]);"";[$'03.Muestra'.$E8]) ->  | E513: of:=IF([.D513]<>"";IF(AND([.B513]<>"";[.C513]<>"");"";"ERR");"") ->  | F513: N/T | G513: N/D | H513: N/A | I513: Falla | J513: Pasa | K513: En blanco
B514: of:=IF( ISBLANK([$'03.Muestra'.$C9]);"";[$'03.Muestra'.$C9]) ->  | C514: of:=IF( ISBLANK([$'03.Muestra'.$E9]);"";[$'03.Muestra'.$E9]) ->  | E514: of:=IF([.D514]<>"";IF(AND([.B514]<>"";[.C514]<>"");"";"ERR");"") ->  | F514: of:=COUNTIF([.$D513]:INDIRECT("$D" &  SUM(ROW()-1;['03.Muestra'.$D$45])-1);[.F513]) -> 0 | G514: of:=COUNTIF([.$D513]:INDIRECT("$D" &  SUM(ROW()-1;['03.Muestra'.$D$45])-1);[.G513]) -> 0 | H514: of:=COUNTIF([.$D513]:INDIRECT("$D" &  SUM(ROW()-1;['03.Muestra'.$D$45])-1);[.H513]) -> 0 | I514: of:=COUNTIF([.$D513]:INDIRECT("$D" &  SUM(ROW()-1;['03.Muestra'.$D$45])-1);[.I513]) -> 0 | J514: of:=COUNTIF([.$D513]:INDIRECT("$D" &  SUM(ROW()-1;['03.Muestra'.$D$45])-1);[.J513]) -> 0 | K514: of:=IF(['03.Muestra'.$D$45]=0;0;COUNTBLANK([.$D513]:INDIRECT("$D" &  SUM(ROW()-1;['03.Muestra'.$D$45])-1))) -> 0
B515: of:=IF( ISBLANK([$'03.Muestra'.$C10]);"";[$'03.Muestra'.$C10]) ->  | C515: of:=IF( ISBLANK([$'03.Muestra'.$E10]);"";[$'03.Muestra'.$E10]) ->  | E515: of:=IF([.D515]<>"";IF(AND([.B515]<>"";[.C515]<>"");"";"ERR");"") -> 
B516: of:=IF( ISBLANK([$'03.Muestra'.$C11]);"";[$'03.Muestra'.$C11]) ->  | C516: of:=IF( ISBLANK([$'03.Muestra'.$E11]);"";[$'03.Muestra'.$E11]) ->  | E516: of:=IF([.D516]<>"";IF(AND([.B516]<>"";[.C516]<>"");"";"ERR");"") -> 
B517: of:=IF( ISBLANK([$'03.Muestra'.$C12]);"";[$'03.Muestra'.$C12]) ->  | C517: of:=IF( ISBLANK([$'03.Muestra'.$E12]);"";[$'03.Muestra'.$E12]) ->  | E517: of:=IF([.D517]<>"";IF(AND([.B517]<>"";[.C517]<>"");"";"ERR");"") -> 
B518: of:=IF( ISBLANK([$'03.Muestra'.$C13]);"";[$'03.Muestra'.$C13]) ->  | C518: of:=IF( ISBLANK([$'03.Muestra'.$E13]);"";[$'03.Muestra'.$E13]) ->  | E518: of:=IF([.D518]<>"";IF(AND([.B518]<>"";[.C518]<>"");"";"ERR");"") -> 
B519: of:=IF( ISBLANK([$'03.Muestra'.$C14]);"";[$'03.Muestra'.$C14]) ->  | C519: of:=IF( ISBLANK([$'03.Muestra'.$E14]);"";[$'03.Muestra'.$E14]) ->  | E519: of:=IF([.D519]<>"";IF(AND([.B519]<>"";[.C519]<>"");"";"ERR");"") -> 
B520: of:=IF( ISBLANK([$'03.Muestra'.$C15]);"";[$'03.Muestra'.$C15]) ->  | C520: of:=IF( ISBLANK([$'03.Muestra'.$E15]);"";[$'03.Muestra'.$E15]) ->  | E520: of:=IF([.D520]<>"";IF(AND([.B520]<>"";[.C520]<>"");"";"ERR");"") -> 
B521: of:=IF( ISBLANK([$'03.Muestra'.$C16]);"";[$'03.Muestra'.$C16]) ->  | C521: of:=IF( ISBLANK([$'03.Muestra'.$E16]);"";[$'03.Muestra'.$E16]) ->  | E521: of:=IF([.D521]<>"";IF(AND([.B521]<>"";[.C521]<>"");"";"ERR");"") -> 
B522: of:=IF( ISBLANK([$'03.Muestra'.$C17]);"";[$'03.Muestra'.$C17]) ->  | C522: of:=IF( ISBLANK([$'03.Muestra'.$E17]);"";[$'03.Muestra'.$E17]) ->  | E522: of:=IF([.D522]<>"";IF(AND([.B522]<>"";[.C522]<>"");"";"ERR");"") -> 
B523: of:=IF( ISBLANK([$'03.Muestra'.$C18]);"";[$'03.Muestra'.$C18]) ->  | C523: of:=IF( ISBLANK([$'03.Muestra'.$E18]);"";[$'03.Muestra'.$E18]) ->  | E523: of:=IF([.D523]<>"";IF(AND([.B523]<>"";[.C523]<>"");"";"ERR");"") -> 
B524: of:=IF( ISBLANK([$'03.Muestra'.$C19]);"";[$'03.Muestra'.$C19]) ->  | C524: of:=IF( ISBLANK([$'03.Muestra'.$E19]);"";[$'03.Muestra'.$E19]) ->  | E524: of:=IF([.D524]<>"";IF(AND([.B524]<>"";[.C524]<>"");"";"ERR");"") -> 
B525: of:=IF( ISBLANK([$'03.Muestra'.$C20]);"";[$'03.Muestra'.$C20]) ->  | C525: of:=IF( ISBLANK([$'03.Muestra'.$E20]);"";[$'03.Muestra'.$E20]) ->  | E525: of:=IF([.D525]<>"";IF(AND([.B525]<>"";[.C525]<>"");"";"ERR");"") -> 
B526: of:=IF( ISBLANK([$'03.Muestra'.$C21]);"";[$'03.Muestra'.$C21]) ->  | C526: of:=IF( ISBLANK([$'03.Muestra'.$E21]);"";[$'03.Muestra'.$E21]) ->  | E526: of:=IF([.D526]<>"";IF(AND([.B526]<>"";[.C526]<>"");"";"ERR");"") -> 
B527: of:=IF( ISBLANK([$'03.Muestra'.$C22]);"";[$'03.Muestra'.$C22]) ->  | C527: of:=IF( ISBLANK([$'03.Muestra'.$E22]);"";[$'03.Muestra'.$E22]) ->  | E527: of:=IF([.D527]<>"";IF(AND([.B527]<>"";[.C527]<>"");"";"ERR");"") -> 
B528: of:=IF( ISBLANK([$'03.Muestra'.$C23]);"";[$'03.Muestra'.$C23]) ->  | C528: of:=IF( ISBLANK([$'03.Muestra'.$E23]);"";[$'03.Muestra'.$E23]) ->  | E528: of:=IF([.D528]<>"";IF(AND([.B528]<>"";[.C528]<>"");"";"ERR");"") -> 
B529: of:=IF( ISBLANK([$'03.Muestra'.$C24]);"";[$'03.Muestra'.$C24]) ->  | C529: of:=IF( ISBLANK([$'03.Muestra'.$E24]);"";[$'03.Muestra'.$E24]) ->  | E529: of:=IF([.D529]<>"";IF(AND([.B529]<>"";[.C529]<>"");"";"ERR");"") -> 
B530: of:=IF( ISBLANK([$'03.Muestra'.$C25]);"";[$'03.Muestra'.$C25]) ->  | C530: of:=IF( ISBLANK([$'03.Muestra'.$E25]);"";[$'03.Muestra'.$E25]) ->  | E530: of:=IF([.D530]<>"";IF(AND([.B530]<>"";[.C530]<>"");"";"ERR");"") -> 
B531: of:=IF( ISBLANK([$'03.Muestra'.$C26]);"";[$'03.Muestra'.$C26]) ->  | C531: of:=IF( ISBLANK([$'03.Muestra'.$E26]);"";[$'03.Muestra'.$E26]) ->  | E531: of:=IF([.D531]<>"";IF(AND([.B531]<>"";[.C531]<>"");"";"ERR");"") -> 
B532: of:=IF( ISBLANK([$'03.Muestra'.$C27]);"";[$'03.Muestra'.$C27]) ->  | C532: of:=IF( ISBLANK([$'03.Muestra'.$E27]);"";[$'03.Muestra'.$E27]) ->  | E532: of:=IF([.D532]<>"";IF(AND([.B532]<>"";[.C532]<>"");"";"ERR");"") -> 
B533: of:=IF( ISBLANK([$'03.Muestra'.$C28]);"";[$'03.Muestra'.$C28]) ->  | C533: of:=IF( ISBLANK([$'03.Muestra'.$E28]);"";[$'03.Muestra'.$E28]) ->  | E533: of:=IF([.D533]<>"";IF(AND([.B533]<>"";[.C533]<>"");"";"ERR");"") -> 
B534: of:=IF( ISBLANK([$'03.Muestra'.$C29]);"";[$'03.Muestra'.$C29]) ->  | C534: of:=IF( ISBLANK([$'03.Muestra'.$E29]);"";[$'03.Muestra'.$E29]) ->  | E534: of:=IF([.D534]<>"";IF(AND([.B534]<>"";[.C534]<>"");"";"ERR");"") -> 
B535: of:=IF( ISBLANK([$'03.Muestra'.$C30]);"";[$'03.Muestra'.$C30]) ->  | C535: of:=IF( ISBLANK([$'03.Muestra'.$E30]);"";[$'03.Muestra'.$E30]) ->  | E535: of:=IF([.D535]<>"";IF(AND([.B535]<>"";[.C535]<>"");"";"ERR");"") -> 
B536: of:=IF( ISBLANK([$'03.Muestra'.$C31]);"";[$'03.Muestra'.$C31]) ->  | C536: of:=IF( ISBLANK([$'03.Muestra'.$E31]);"";[$'03.Muestra'.$E31]) ->  | E536: of:=IF([.D536]<>"";IF(AND([.B536]<>"";[.C536]<>"");"";"ERR");"") -> 
B537: of:=IF( ISBLANK([$'03.Muestra'.$C32]);"";[$'03.Muestra'.$C32]) ->  | C537: of:=IF( ISBLANK([$'03.Muestra'.$E32]);"";[$'03.Muestra'.$E32]) ->  | E537: of:=IF([.D537]<>"";IF(AND([.B537]<>"";[.C537]<>"");"";"ERR");"") -> 
B538: of:=IF( ISBLANK([$'03.Muestra'.$C33]);"";[$'03.Muestra'.$C33]) ->  | C538: of:=IF( ISBLANK([$'03.Muestra'.$E33]);"";[$'03.Muestra'.$E33]) ->  | E538: of:=IF([.D538]<>"";IF(AND([.B538]<>"";[.C538]<>"");"";"ERR");"") -> 
B539: of:=IF( ISBLANK([$'03.Muestra'.$C34]);"";[$'03.Muestra'.$C34]) ->  | C539: of:=IF( ISBLANK([$'03.Muestra'.$E34]);"";[$'03.Muestra'.$E34]) ->  | E539: of:=IF([.D539]<>"";IF(AND([.B539]<>"";[.C539]<>"");"";"ERR");"") -> 
B540: of:=IF( ISBLANK([$'03.Muestra'.$C35]);"";[$'03.Muestra'.$C35]) ->  | C540: of:=IF( ISBLANK([$'03.Muestra'.$E35]);"";[$'03.Muestra'.$E35]) ->  | E540: of:=IF([.D540]<>"";IF(AND([.B540]<>"";[.C540]<>"");"";"ERR");"") -> 
B541: of:=IF( ISBLANK([$'03.Muestra'.$C36]);"";[$'03.Muestra'.$C36]) ->  | C541: of:=IF( ISBLANK([$'03.Muestra'.$E36]);"";[$'03.Muestra'.$E36]) ->  | E541: of:=IF([.D541]<>"";IF(AND([.B541]<>"";[.C541]<>"");"";"ERR");"") -> 
B542: of:=IF( ISBLANK([$'03.Muestra'.$C37]);"";[$'03.Muestra'.$C37]) ->  | C542: of:=IF( ISBLANK([$'03.Muestra'.$E37]);"";[$'03.Muestra'.$E37]) ->  | E542: of:=IF([.D542]<>"";IF(AND([.B542]<>"";[.C542]<>"");"";"ERR");"") -> 
B543: of:=IF( ISBLANK([$'03.Muestra'.$C38]);"";[$'03.Muestra'.$C38]) ->  | C543: of:=IF( ISBLANK([$'03.Muestra'.$E38]);"";[$'03.Muestra'.$E38]) ->  | E543: of:=IF([.D543]<>"";IF(AND([.B543]<>"";[.C543]<>"");"";"ERR");"") -> 
B544: of:=IF( ISBLANK([$'03.Muestra'.$C39]);"";[$'03.Muestra'.$C39]) ->  | C544: of:=IF( ISBLANK([$'03.Muestra'.$E39]);"";[$'03.Muestra'.$E39]) ->  | E544: of:=IF([.D544]<>"";IF(AND([.B544]<>"";[.C544]<>"");"";"ERR");"") -> 
B545: of:=IF( ISBLANK([$'03.Muestra'.$C40]);"";[$'03.Muestra'.$C40]) ->  | C545: of:=IF( ISBLANK([$'03.Muestra'.$E40]);"";[$'03.Muestra'.$E40]) ->  | E545: of:=IF([.D545]<>"";IF(AND([.B545]<>"";[.C545]<>"");"";"ERR");"") -> 
B546: of:=IF( ISBLANK([$'03.Muestra'.$C41]);"";[$'03.Muestra'.$C41]) ->  | C546: of:=IF( ISBLANK([$'03.Muestra'.$E41]);"";[$'03.Muestra'.$E41]) ->  | E546: of:=IF([.D546]<>"";IF(AND([.B546]<>"";[.C546]<>"");"";"ERR");"") -> 
B547: of:=IF( ISBLANK([$'03.Muestra'.$C42]);"";[$'03.Muestra'.$C42]) ->  | C547: of:=IF( ISBLANK([$'03.Muestra'.$E42]);"";[$'03.Muestra'.$E42]) ->  | E547: of:=IF([.D547]<>"";IF(AND([.B547]<>"";[.C547]<>"");"";"ERR");"") -> 
B550: AA | C550: 1.4.4 Redimensión del texto | D550: Resultado
B551: of:=IF( ISBLANK([$'03.Muestra'.$C8]);"";[$'03.Muestra'.$C8]) ->  | C551: of:=IF( ISBLANK([$'03.Muestra'.$E8]);"";[$'03.Muestra'.$E8]) ->  | E551: of:=IF([.D551]<>"";IF(AND([.B551]<>"";[.C551]<>"");"";"ERR");"") ->  | F551: N/T | G551: N/D | H551: N/A | I551: Falla | J551: Pasa | K551: En blanco
B552: of:=IF( ISBLANK([$'03.Muestra'.$C9]);"";[$'03.Muestra'.$C9]) ->  | C552: of:=IF( ISBLANK([$'03.Muestra'.$E9]);"";[$'03.Muestra'.$E9]) ->  | E552: of:=IF([.D552]<>"";IF(AND([.B552]<>"";[.C552]<>"");"";"ERR");"") ->  | F552: of:=COUNTIF([.$D551]:INDIRECT("$D" &  SUM(ROW()-1;['03.Muestra'.$D$45])-1);[.F551]) -> 0 | G552: of:=COUNTIF([.$D551]:INDIRECT("$D" &  SUM(ROW()-1;['03.Muestra'.$D$45])-1);[.G551]) -> 0 | H552: of:=COUNTIF([.$D551]:INDIRECT("$D" &  SUM(ROW()-1;['03.Muestra'.$D$45])-1);[.H551]) -> 0 | I552: of:=COUNTIF([.$D551]:INDIRECT("$D" &  SUM(ROW()-1;['03.Muestra'.$D$45])-1);[.I551]) -> 0 | J552: of:=COUNTIF([.$D551]:INDIRECT("$D" &  SUM(ROW()-1;['03.Muestra'.$D$45])-1);[.J551]) -> 0 | K552: of:=IF(['03.Muestra'.$D$45]=0;0;COUNTBLANK([.$D551]:INDIRECT("$D" &  SUM(ROW()-1;['03.Muestra'.$D$45])-1))) -> 0
B553: of:=IF( ISBLANK([$'03.Muestra'.$C10]);"";[$'03.Muestra'.$C10]) ->  | C553: of:=IF( ISBLANK([$'03.Muestra'.$E10]);"";[$'03.Muestra'.$E10]) ->  | E553: of:=IF([.D553]<>"";IF(AND([.B553]<>"";[.C553]<>"");"";"ERR");"") -> 
B554: of:=IF( ISBLANK([$'03.Muestra'.$C11]);"";[$'03.Muestra'.$C11]) ->  | C554: of:=IF( ISBLANK([$'03.Muestra'.$E11]);"";[$'03.Muestra'.$E11]) ->  | E554: of:=IF([.D554]<>"";IF(AND([.B554]<>"";[.C554]<>"");"";"ERR");"") -> 
B555: of:=IF( ISBLANK([$'03.Muestra'.$C12]);"";[$'03.Muestra'.$C12]) ->  | C555: of:=IF( ISBLANK([$'03.Muestra'.$E12]);"";[$'03.Muestra'.$E12]) ->  | E555: of:=IF([.D555]<>"";IF(AND([.B555]<>"";[.C555]<>"");"";"ERR");"") -> 
B556: of:=IF( ISBLANK([$'03.Muestra'.$C13]);"";[$'03.Muestra'.$C13]) ->  | C556: of:=IF( ISBLANK([$'03.Muestra'.$E13]);"";[$'03.Muestra'.$E13]) ->  | E556: of:=IF([.D556]<>"";IF(AND([.B556]<>"";[.C556]<>"");"";"ERR");"") -> 
B557: of:=IF( ISBLANK([$'03.Muestra'.$C14]);"";[$'03.Muestra'.$C14]) ->  | C557: of:=IF( ISBLANK([$'03.Muestra'.$E14]);"";[$'03.Muestra'.$E14]) ->  | E557: of:=IF([.D557]<>"";IF(AND([.B557]<>"";[.C557]<>"");"";"ERR");"") -> 
B558: of:=IF( ISBLANK([$'03.Muestra'.$C15]);"";[$'03.Muestra'.$C15]) ->  | C558: of:=IF( ISBLANK([$'03.Muestra'.$E15]);"";[$'03.Muestra'.$E15]) ->  | E558: of:=IF([.D558]<>"";IF(AND([.B558]<>"";[.C558]<>"");"";"ERR");"") -> 
B559: of:=IF( ISBLANK([$'03.Muestra'.$C16]);"";[$'03.Muestra'.$C16]) ->  | C559: of:=IF( ISBLANK([$'03.Muestra'.$E16]);"";[$'03.Muestra'.$E16]) ->  | E559: of:=IF([.D559]<>"";IF(AND([.B559]<>"";[.C559]<>"");"";"ERR");"") -> 
B560: of:=IF( ISBLANK([$'03.Muestra'.$C17]);"";[$'03.Muestra'.$C17]) ->  | C560: of:=IF( ISBLANK([$'03.Muestra'.$E17]);"";[$'03.Muestra'.$E17]) ->  | E560: of:=IF([.D560]<>"";IF(AND([.B560]<>"";[.C560]<>"");"";"ERR");"") -> 
B561: of:=IF( ISBLANK([$'03.Muestra'.$C18]);"";[$'03.Muestra'.$C18]) ->  | C561: of:=IF( ISBLANK([$'03.Muestra'.$E18]);"";[$'03.Muestra'.$E18]) ->  | E561: of:=IF([.D561]<>"";IF(AND([.B561]<>"";[.C561]<>"");"";"ERR");"") -> 
B562: of:=IF( ISBLANK([$'03.Muestra'.$C19]);"";[$'03.Muestra'.$C19]) ->  | C562: of:=IF( ISBLANK([$'03.Muestra'.$E19]);"";[$'03.Muestra'.$E19]) ->  | E562: of:=IF([.D562]<>"";IF(AND([.B562]<>"";[.C562]<>"");"";"ERR");"") -> 
B563: of:=IF( ISBLANK([$'03.Muestra'.$C20]);"";[$'03.Muestra'.$C20]) ->  | C563: of:=IF( ISBLANK([$'03.Muestra'.$E20]);"";[$'03.Muestra'.$E20]) ->  | E563: of:=IF([.D563]<>"";IF(AND([.B563]<>"";[.C563]<>"");"";"ERR");"") -> 
B564: of:=IF( ISBLANK([$'03.Muestra'.$C21]);"";[$'03.Muestra'.$C21]) ->  | C564: of:=IF( ISBLANK([$'03.Muestra'.$E21]);"";[$'03.Muestra'.$E21]) ->  | E564: of:=IF([.D564]<>"";IF(AND([.B564]<>"";[.C564]<>"");"";"ERR");"") -> 
B565: of:=IF( ISBLANK([$'03.Muestra'.$C22]);"";[$'03.Muestra'.$C22]) ->  | C565: of:=IF( ISBLANK([$'03.Muestra'.$E22]);"";[$'03.Muestra'.$E22]) ->  | E565: of:=IF([.D565]<>"";IF(AND([.B565]<>"";[.C565]<>"");"";"ERR");"") -> 
B566: of:=IF( ISBLANK([$'03.Muestra'.$C23]);"";[$'03.Muestra'.$C23]) ->  | C566: of:=IF( ISBLANK([$'03.Muestra'.$E23]);"";[$'03.Muestra'.$E23]) ->  | E566: of:=IF([.D566]<>"";IF(AND([.B566]<>"";[.C566]<>"");"";"ERR");"") -> 
B567: of:=IF( ISBLANK([$'03.Muestra'.$C24]);"";[$'03.Muestra'.$C24]) ->  | C567: of:=IF( ISBLANK([$'03.Muestra'.$E24]);"";[$'03.Muestra'.$E24]) ->  | E567: of:=IF([.D567]<>"";IF(AND([.B567]<>"";[.C567]<>"");"";"ERR");"") -> 
B568: of:=IF( ISBLANK([$'03.Muestra'.$C25]);"";[$'03.Muestra'.$C25]) ->  | C568: of:=IF( ISBLANK([$'03.Muestra'.$E25]);"";[$'03.Muestra'.$E25]) ->  | E568: of:=IF([.D568]<>"";IF(AND([.B568]<>"";[.C568]<>"");"";"ERR");"") -> 
B569: of:=IF( ISBLANK([$'03.Muestra'.$C26]);"";[$'03.Muestra'.$C26]) ->  | C569: of:=IF( ISBLANK([$'03.Muestra'.$E26]);"";[$'03.Muestra'.$E26]) ->  | E569: of:=IF([.D569]<>"";IF(AND([.B569]<>"";[.C569]<>"");"";"ERR");"") -> 
B570: of:=IF( ISBLANK([$'03.Muestra'.$C27]);"";[$'03.Muestra'.$C27]) ->  | C570: of:=IF( ISBLANK([$'03.Muestra'.$E27]);"";[$'03.Muestra'.$E27]) ->  | E570: of:=IF([.D570]<>"";IF(AND([.B570]<>"";[.C570]<>"");"";"ERR");"") -> 
B571: of:=IF( ISBLANK([$'03.Muestra'.$C28]);"";[$'03.Muestra'.$C28]) ->  | C571: of:=IF( ISBLANK([$'03.Muestra'.$E28]);"";[$'03.Muestra'.$E28]) ->  | E571: of:=IF([.D571]<>"";IF(AND([.B571]<>"";[.C571]<>"");"";"ERR");"") -> 
B572: of:=IF( ISBLANK([$'03.Muestra'.$C29]);"";[$'03.Muestra'.$C29]) ->  | C572: of:=IF( ISBLANK([$'03.Muestra'.$E29]);"";[$'03.Muestra'.$E29]) ->  | E572: of:=IF([.D572]<>"";IF(AND([.B572]<>"";[.C572]<>"");"";"ERR");"") -> 
B573: of:=IF( ISBLANK([$'03.Muestra'.$C30]);"";[$'03.Muestra'.$C30]) ->  | C573: of:=IF( ISBLANK([$'03.Muestra'.$E30]);"";[$'03.Muestra'.$E30]) ->  | E573: of:=IF([.D573]<>"";IF(AND([.B573]<>"";[.C573]<>"");"";"ERR");"") -> 
B574: of:=IF( ISBLANK([$'03.Muestra'.$C31]);"";[$'03.Muestra'.$C31]) ->  | C574: of:=IF( ISBLANK([$'03.Muestra'.$E31]);"";[$'03.Muestra'.$E31]) ->  | E574: of:=IF([.D574]<>"";IF(AND([.B574]<>"";[.C574]<>"");"";"ERR");"") -> 
B575: of:=IF( ISBLANK([$'03.Muestra'.$C32]);"";[$'03.Muestra'.$C32]) ->  | C575: of:=IF( ISBLANK([$'03.Muestra'.$E32]);"";[$'03.Muestra'.$E32]) ->  | E575: of:=IF([.D575]<>"";IF(AND([.B575]<>"";[.C575]<>"");"";"ERR");"") -> 
B576: of:=IF( ISBLANK([$'03.Muestra'.$C33]);"";[$'03.Muestra'.$C33]) ->  | C576: of:=IF( ISBLANK([$'03.Muestra'.$E33]);"";[$'03.Muestra'.$E33]) ->  | E576: of:=IF([.D576]<>"";IF(AND([.B576]<>"";[.C576]<>"");"";"ERR");"") -> 
B577: of:=IF( ISBLANK([$'03.Muestra'.$C34]);"";[$'03.Muestra'.$C34]) ->  | C577: of:=IF( ISBLANK([$'03.Muestra'.$E34]);"";[$'03.Muestra'.$E34]) ->  | E577: of:=IF([.D577]<>"";IF(AND([.B577]<>"";[.C577]<>"");"";"ERR");"") -> 
B578: of:=IF( ISBLANK([$'03.Muestra'.$C35]);"";[$'03.Muestra'.$C35]) ->  | C578: of:=IF( ISBLANK([$'03.Muestra'.$E35]);"";[$'03.Muestra'.$E35]) ->  | E578: of:=IF([.D578]<>"";IF(AND([.B578]<>"";[.C578]<>"");"";"ERR");"") -> 
B579: of:=IF( ISBLANK([$'03.Muestra'.$C36]);"";[$'03.Muestra'.$C36]) ->  | C579: of:=IF( ISBLANK([$'03.Muestra'.$E36]);"";[$'03.Muestra'.$E36]) ->  | E579: of:=IF([.D579]<>"";IF(AND([.B579]<>"";[.C579]<>"");"";"ERR");"") -> 
B580: of:=IF( ISBLANK([$'03.Muestra'.$C37]);"";[$'03.Muestra'.$C37]) ->  | C580: of:=IF( ISBLANK([$'03.Muestra'.$E37]);"";[$'03.Muestra'.$E37]) ->  | E580: of:=IF([.D580]<>"";IF(AND([.B580]<>"";[.C580]<>"");"";"ERR");"") -> 
B581: of:=IF( ISBLANK([$'03.Muestra'.$C38]);"";[$'03.Muestra'.$C38]) ->  | C581: of:=IF( ISBLANK([$'03.Muestra'.$E38]);"";[$'03.Muestra'.$E38]) ->  | E581: of:=IF([.D581]<>"";IF(AND([.B581]<>"";[.C581]<>"");"";"ERR");"") -> 
B582: of:=IF( ISBLANK([$'03.Muestra'.$C39]);"";[$'03.Muestra'.$C39]) ->  | C582: of:=IF( ISBLANK([$'03.Muestra'.$E39]);"";[$'03.Muestra'.$E39]) ->  | E582: of:=IF([.D582]<>"";IF(AND([.B582]<>"";[.C582]<>"");"";"ERR");"") -> 
B583: of:=IF( ISBLANK([$'03.Muestra'.$C40]);"";[$'03.Muestra'.$C40]) ->  | C583: of:=IF( ISBLANK([$'03.Muestra'.$E40]);"";[$'03.Muestra'.$E40]) ->  | E583: of:=IF([.D583]<>"";IF(AND([.B583]<>"";[.C583]<>"");"";"ERR");"") -> 
B584: of:=IF( ISBLANK([$'03.Muestra'.$C41]);"";[$'03.Muestra'.$C41]) ->  | C584: of:=IF( ISBLANK([$'03.Muestra'.$E41]);"";[$'03.Muestra'.$E41]) ->  | E584: of:=IF([.D584]<>"";IF(AND([.B584]<>"";[.C584]<>"");"";"ERR");"") -> 
B585: of:=IF( ISBLANK([$'03.Muestra'.$C42]);"";[$'03.Muestra'.$C42]) ->  | C585: of:=IF( ISBLANK([$'03.Muestra'.$E42]);"";[$'03.Muestra'.$E42]) ->  | E585: of:=IF([.D585]<>"";IF(AND([.B585]<>"";[.C585]<>"");"";"ERR");"") -> 
B588: AA | C588: 1.4.5 Imágenes de texto | D588: Resultado
B589: of:=IF( ISBLANK([$'03.Muestra'.$C8]);"";[$'03.Muestra'.$C8]) ->  | C589: of:=IF( ISBLANK([$'03.Muestra'.$E8]);"";[$'03.Muestra'.$E8]) ->  | E589: of:=IF([.D589]<>"";IF(AND([.B589]<>"";[.C589]<>"");"";"ERR");"") ->  | F589: N/T | G589: N/D | H589: N/A | I589: Falla | J589: Pasa | K589: En blanco
B590: of:=IF( ISBLANK([$'03.Muestra'.$C9]);"";[$'03.Muestra'.$C9]) ->  | C590: of:=IF( ISBLANK([$'03.Muestra'.$E9]);"";[$'03.Muestra'.$E9]) ->  | E590: of:=IF([.D590]<>"";IF(AND([.B590]<>"";[.C590]<>"");"";"ERR");"") ->  | F590: of:=COUNTIF([.$D589]:INDIRECT("$D" &  SUM(ROW()-1;['03.Muestra'.$D$45])-1);[.F589]) -> 0 | G590: of:=COUNTIF([.$D589]:INDIRECT("$D" &  SUM(ROW()-1;['03.Muestra'.$D$45])-1);[.G589]) -> 0 | H590: of:=COUNTIF([.$D589]:INDIRECT("$D" &  SUM(ROW()-1;['03.Muestra'.$D$45])-1);[.H589]) -> 0 | I590: of:=COUNTIF([.$D589]:INDIRECT("$D" &  SUM(ROW()-1;['03.Muestra'.$D$45])-1);[.I589]) -> 0 | J590: of:=COUNTIF([.$D589]:INDIRECT("$D" &  SUM(ROW()-1;['03.Muestra'.$D$45])-1);[.J589]) -> 0 | K590: of:=IF(['03.Muestra'.$D$45]=0;0;COUNTBLANK([.$D589]:INDIRECT("$D" &  SUM(ROW()-1;['03.Muestra'.$D$45])-1))) -> 0
B591: of:=IF( ISBLANK([$'03.Muestra'.$C10]);"";[$'03.Muestra'.$C10]) ->  | C591: of:=IF( ISBLANK([$'03.Muestra'.$E10]);"";[$'03.Muestra'.$E10]) ->  | E591: of:=IF([.D591]<>"";IF(AND([.B591]<>"";[.C591]<>"");"";"ERR");"") -> 
B592: of:=IF( ISBLANK([$'03.Muestra'.$C11]);"";[$'03.Muestra'.$C11]) ->  | C592: of:=IF( ISBLANK([$'03.Muestra'.$E11]);"";[$'03.Muestra'.$E11]) ->  | E592: of:=IF([.D592]<>"";IF(AND([.B592]<>"";[.C592]<>"");"";"ERR");"") -> 
B593: of:=IF( ISBLANK([$'03.Muestra'.$C12]);"";[$'03.Muestra'.$C12]) ->  | C593: of:=IF( ISBLANK([$'03.Muestra'.$E12]);"";[$'03.Muestra'.$E12]) ->  | E593: of:=IF([.D593]<>"";IF(AND([.B593]<>"";[.C593]<>"");"";"ERR");"") -> 
B594: of:=IF( ISBLANK([$'03.Muestra'.$C13]);"";[$'03.Muestra'.$C13]) ->  | C594: of:=IF( ISBLANK([$'03.Muestra'.$E13]);"";[$'03.Muestra'.$E13]) ->  | E594: of:=IF([.D594]<>"";IF(AND([.B594]<>"";[.C594]<>"");"";"ERR");"") -> 
B595: of:=IF( ISBLANK([$'03.Muestra'.$C14]);"";[$'03.Muestra'.$C14]) ->  | C595: of:=IF( ISBLANK([$'03.Muestra'.$E14]);"";[$'03.Muestra'.$E14]) ->  | E595: of:=IF([.D595]<>"";IF(AND([.B595]<>"";[.C595]<>"");"";"ERR");"") -> 
B596: of:=IF( ISBLANK([$'03.Muestra'.$C15]);"";[$'03.Muestra'.$C15]) ->  | C596: of:=IF( ISBLANK([$'03.Muestra'.$E15]);"";[$'03.Muestra'.$E15]) ->  | E596: of:=IF([.D596]<>"";IF(AND([.B596]<>"";[.C596]<>"");"";"ERR");"") -> 
B597: of:=IF( ISBLANK([$'03.Muestra'.$C16]);"";[$'03.Muestra'.$C16]) ->  | C597: of:=IF( ISBLANK([$'03.Muestra'.$E16]);"";[$'03.Muestra'.$E16]) ->  | E597: of:=IF([.D597]<>"";IF(AND([.B597]<>"";[.C597]<>"");"";"ERR");"") -> 
B598: of:=IF( ISBLANK([$'03.Muestra'.$C17]);"";[$'03.Muestra'.$C17]) ->  | C598: of:=IF( ISBLANK([$'03.Muestra'.$E17]);"";[$'03.Muestra'.$E17]) ->  | E598: of:=IF([.D598]<>"";IF(AND([.B598]<>"";[.C598]<>"");"";"ERR");"") -> 
B599: of:=IF( ISBLANK([$'03.Muestra'.$C18]);"";[$'03.Muestra'.$C18]) ->  | C599: of:=IF( ISBLANK([$'03.Muestra'.$E18]);"";[$'03.Muestra'.$E18]) ->  | E599: of:=IF([.D599]<>"";IF(AND([.B599]<>"";[.C599]<>"");"";"ERR");"") -> 
B600: of:=IF( ISBLANK([$'03.Muestra'.$C19]);"";[$'03.Muestra'.$C19]) ->  | C600: of:=IF( ISBLANK([$'03.Muestra'.$E19]);"";[$'03.Muestra'.$E19]) ->  | E600: of:=IF([.D600]<>"";IF(AND([.B600]<>"";[.C600]<>"");"";"ERR");"") -> 
B601: of:=IF( ISBLANK([$'03.Muestra'.$C20]);"";[$'03.Muestra'.$C20]) ->  | C601: of:=IF( ISBLANK([$'03.Muestra'.$E20]);"";[$'03.Muestra'.$E20]) ->  | E601: of:=IF([.D601]<>"";IF(AND([.B601]<>"";[.C601]<>"");"";"ERR");"") -> 
B602: of:=IF( ISBLANK([$'03.Muestra'.$C21]);"";[$'03.Muestra'.$C21]) ->  | C602: of:=IF( ISBLANK([$'03.Muestra'.$E21]);"";[$'03.Muestra'.$E21]) ->  | E602: of:=IF([.D602]<>"";IF(AND([.B602]<>"";[.C602]<>"");"";"ERR");"") -> 
B603: of:=IF( ISBLANK([$'03.Muestra'.$C22]);"";[$'03.Muestra'.$C22]) ->  | C603: of:=IF( ISBLANK([$'03.Muestra'.$E22]);"";[$'03.Muestra'.$E22]) ->  | E603: of:=IF([.D603]<>"";IF(AND([.B603]<>"";[.C603]<>"");"";"ERR");"") -> 
B604: of:=IF( ISBLANK([$'03.Muestra'.$C23]);"";[$'03.Muestra'.$C23]) ->  | C604: of:=IF( ISBLANK([$'03.Muestra'.$E23]);"";[$'03.Muestra'.$E23]) ->  | E604: of:=IF([.D604]<>"";IF(AND([.B604]<>"";[.C604]<>"");"";"ERR");"") -> 
B605: of:=IF( ISBLANK([$'03.Muestra'.$C24]);"";[$'03.Muestra'.$C24]) ->  | C605: of:=IF( ISBLANK([$'03.Muestra'.$E24]);"";[$'03.Muestra'.$E24]) ->  | E605: of:=IF([.D605]<>"";IF(AND([.B605]<>"";[.C605]<>"");"";"ERR");"") -> 
B606: of:=IF( ISBLANK([$'03.Muestra'.$C25]);"";[$'03.Muestra'.$C25]) ->  | C606: of:=IF( ISBLANK([$'03.Muestra'.$E25]);"";[$'03.Muestra'.$E25]) ->  | E606: of:=IF([.D606]<>"";IF(AND([.B606]<>"";[.C606]<>"");"";"ERR");"") -> 
B607: of:=IF( ISBLANK([$'03.Muestra'.$C26]);"";[$'03.Muestra'.$C26]) ->  | C607: of:=IF( ISBLANK([$'03.Muestra'.$E26]);"";[$'03.Muestra'.$E26]) ->  | E607: of:=IF([.D607]<>"";IF(AND([.B607]<>"";[.C607]<>"");"";"ERR");"") -> 
B608: of:=IF( ISBLANK([$'03.Muestra'.$C27]);"";[$'03.Muestra'.$C27]) ->  | C608: of:=IF( ISBLANK([$'03.Muestra'.$E27]);"";[$'03.Muestra'.$E27]) ->  | E608: of:=IF([.D608]<>"";IF(AND([.B608]<>"";[.C608]<>"");"";"ERR");"") -> 
B609: of:=IF( ISBLANK([$'03.Muestra'.$C28]);"";[$'03.Muestra'.$C28]) ->  | C609: of:=IF( ISBLANK([$'03.Muestra'.$E28]);"";[$'03.Muestra'.$E28]) ->  | E609: of:=IF([.D609]<>"";IF(AND([.B609]<>"";[.C609]<>"");"";"ERR");"") -> 
B610: of:=IF( ISBLANK([$'03.Muestra'.$C29]);"";[$'03.Muestra'.$C29]) ->  | C610: of:=IF( ISBLANK([$'03.Muestra'.$E29]);"";[$'03.Muestra'.$E29]) ->  | E610: of:=IF([.D610]<>"";IF(AND([.B610]<>"";[.C610]<>"");"";"ERR");"") -> 
B611: of:=IF( ISBLANK([$'03.Muestra'.$C30]);"";[$'03.Muestra'.$C30]) ->  | C611: of:=IF( ISBLANK([$'03.Muestra'.$E30]);"";[$'03.Muestra'.$E30]) ->  | E611: of:=IF([.D611]<>"";IF(AND([.B611]<>"";[.C611]<>"");"";"ERR");"") -> 
B612: of:=IF( ISBLANK([$'03.Muestra'.$C31]);"";[$'03.Muestra'.$C31]) ->  | C612: of:=IF( ISBLANK([$'03.Muestra'.$E31]);"";[$'03.Muestra'.$E31]) ->  | E612: of:=IF([.D612]<>"";IF(AND([.B612]<>"";[.C612]<>"");"";"ERR");"") -> 
B613: of:=IF( ISBLANK([$'03.Muestra'.$C32]);"";[$'03.Muestra'.$C32]) ->  | C613: of:=IF( ISBLANK([$'03.Muestra'.$E32]);"";[$'03.Muestra'.$E32]) ->  | E613: of:=IF([.D613]<>"";IF(AND([.B613]<>"";[.C613]<>"");"";"ERR");"") -> 
B614: of:=IF( ISBLANK([$'03.Muestra'.$C33]);"";[$'03.Muestra'.$C33]) ->  | C614: of:=IF( ISBLANK([$'03.Muestra'.$E33]);"";[$'03.Muestra'.$E33]) ->  | E614: of:=IF([.D614]<>"";IF(AND([.B614]<>"";[.C614]<>"");"";"ERR");"") -> 
B615: of:=IF( ISBLANK([$'03.Muestra'.$C34]);"";[$'03.Muestra'.$C34]) ->  | C615: of:=IF( ISBLANK([$'03.Muestra'.$E34]);"";[$'03.Muestra'.$E34]) ->  | E615: of:=IF([.D615]<>"";IF(AND([.B615]<>"";[.C615]<>"");"";"ERR");"") -> 
B616: of:=IF( ISBLANK([$'03.Muestra'.$C35]);"";[$'03.Muestra'.$C35]) ->  | C616: of:=IF( ISBLANK([$'03.Muestra'.$E35]);"";[$'03.Muestra'.$E35]) ->  | E616: of:=IF([.D616]<>"";IF(AND([.B616]<>"";[.C616]<>"");"";"ERR");"") -> 
B617: of:=IF( ISBLANK([$'03.Muestra'.$C36]);"";[$'03.Muestra'.$C36]) ->  | C617: of:=IF( ISBLANK([$'03.Muestra'.$E36]);"";[$'03.Muestra'.$E36]) ->  | E617: of:=IF([.D617]<>"";IF(AND([.B617]<>"";[.C617]<>"");"";"ERR");"") -> 
B618: of:=IF( ISBLANK([$'03.Muestra'.$C37]);"";[$'03.Muestra'.$C37]) ->  | C618: of:=IF( ISBLANK([$'03.Muestra'.$E37]);"";[$'03.Muestra'.$E37]) ->  | E618: of:=IF([.D618]<>"";IF(AND([.B618]<>"";[.C618]<>"");"";"ERR");"") -> 
B619: of:=IF( ISBLANK([$'03.Muestra'.$C38]);"";[$'03.Muestra'.$C38]) ->  | C619: of:=IF( ISBLANK([$'03.Muestra'.$E38]);"";[$'03.Muestra'.$E38]) ->  | E619: of:=IF([.D619]<>"";IF(AND([.B619]<>"";[.C619]<>"");"";"ERR");"") -> 
B620: of:=IF( ISBLANK([$'03.Muestra'.$C39]);"";[$'03.Muestra'.$C39]) ->  | C620: of:=IF( ISBLANK([$'03.Muestra'.$E39]);"";[$'03.Muestra'.$E39]) ->  | E620: of:=IF([.D620]<>"";IF(AND([.B620]<>"";[.C620]<>"");"";"ERR");"") -> 
B621: of:=IF( ISBLANK([$'03.Muestra'.$C40]);"";[$'03.Muestra'.$C40]) ->  | C621: of:=IF( ISBLANK([$'03.Muestra'.$E40]);"";[$'03.Muestra'.$E40]) ->  | E621: of:=IF([.D621]<>"";IF(AND([.B621]<>"";[.C621]<>"");"";"ERR");"") -> 
B622: of:=IF( ISBLANK([$'03.Muestra'.$C41]);"";[$'03.Muestra'.$C41]) ->  | C622: of:=IF( ISBLANK([$'03.Muestra'.$E41]);"";[$'03.Muestra'.$E41]) ->  | E622: of:=IF([.D622]<>"";IF(AND([.B622]<>"";[.C622]<>"");"";"ERR");"") -> 
B623: of:=IF( ISBLANK([$'03.Muestra'.$C42]);"";[$'03.Muestra'.$C42]) ->  | C623: of:=IF( ISBLANK([$'03.Muestra'.$E42]);"";[$'03.Muestra'.$E42]) ->  | E623: of:=IF([.D623]<>"";IF(AND([.B623]<>"";[.C623]<>"");"";"ERR");"") -> 
B626: AA | C626: 1.4.10 Reflow | D626: Resultado
B627: of:=IF( ISBLANK([$'03.Muestra'.$C8]);"";[$'03.Muestra'.$C8]) ->  | C627: of:=IF( ISBLANK([$'03.Muestra'.$E8]);"";[$'03.Muestra'.$E8]) ->  | E627: of:=IF([.D627]<>"";IF(AND([.B627]<>"";[.C627]<>"");"";"ERR");"") ->  | F627: N/T | G627: N/D | H627: N/A | I627: Falla | J627: Pasa | K627: En blanco
B628: of:=IF( ISBLANK([$'03.Muestra'.$C9]);"";[$'03.Muestra'.$C9]) ->  | C628: of:=IF( ISBLANK([$'03.Muestra'.$E9]);"";[$'03.Muestra'.$E9]) ->  | E628: of:=IF([.D628]<>"";IF(AND([.B628]<>"";[.C628]<>"");"";"ERR");"") ->  | F628: of:=COUNTIF([.$D627]:INDIRECT("$D" &  SUM(ROW()-1;['03.Muestra'.$D$45])-1);[.F627]) -> 0 | G628: of:=COUNTIF([.$D627]:INDIRECT("$D" &  SUM(ROW()-1;['03.Muestra'.$D$45])-1);[.G627]) -> 0 | H628: of:=COUNTIF([.$D627]:INDIRECT("$D" &  SUM(ROW()-1;['03.Muestra'.$D$45])-1);[.H627]) -> 0 | I628: of:=COUNTIF([.$D627]:INDIRECT("$D" &  SUM(ROW()-1;['03.Muestra'.$D$45])-1);[.I627]) -> 0 | J628: of:=COUNTIF([.$D627]:INDIRECT("$D" &  SUM(ROW()-1;['03.Muestra'.$D$45])-1);[.J627]) -> 0 | K628: of:=IF(['03.Muestra'.$D$45]=0;0;COUNTBLANK([.$D627]:INDIRECT("$D" &  SUM(ROW()-1;['03.Muestra'.$D$45])-1))) -> 0
B629: of:=IF( ISBLANK([$'03.Muestra'.$C10]);"";[$'03.Muestra'.$C10]) ->  | C629: of:=IF( ISBLANK([$'03.Muestra'.$E10]);"";[$'03.Muestra'.$E10]) ->  | E629: of:=IF([.D629]<>"";IF(AND([.B629]<>"";[.C629]<>"");"";"ERR");"") -> 
B630: of:=IF( ISBLANK([$'03.Muestra'.$C11]);"";[$'03.Muestra'.$C11]) ->  | C630: of:=IF( ISBLANK([$'03.Muestra'.$E11]);"";[$'03.Muestra'.$E11]) ->  | E630: of:=IF([.D630]<>"";IF(AND([.B630]<>"";[.C630]<>"");"";"ERR");"") -> 
B631: of:=IF( ISBLANK([$'03.Muestra'.$C12]);"";[$'03.Muestra'.$C12]) ->  | C631: of:=IF( ISBLANK([$'03.Muestra'.$E12]);"";[$'03.Muestra'.$E12]) ->  | E631: of:=IF([.D631]<>"";IF(AND([.B631]<>"";[.C631]<>"");"";"ERR");"") -> 
B632: of:=IF( ISBLANK([$'03.Muestra'.$C13]);"";[$'03.Muestra'.$C13]) ->  | C632: of:=IF( ISBLANK([$'03.Muestra'.$E13]);"";[$'03.Muestra'.$E13]) ->  | E632: of:=IF([.D632]<>"";IF(AND([.B632]<>"";[.C632]<>"");"";"ERR");"") -> 
B633: of:=IF( ISBLANK([$'03.Muestra'.$C14]);"";[$'03.Muestra'.$C14]) ->  | C633: of:=IF( ISBLANK([$'03.Muestra'.$E14]);"";[$'03.Muestra'.$E14]) ->  | E633: of:=IF([.D633]<>"";IF(AND([.B633]<>"";[.C633]<>"");"";"ERR");"") -> 
B634: of:=IF( ISBLANK([$'03.Muestra'.$C15]);"";[$'03.Muestra'.$C15]) ->  | C634: of:=IF( ISBLANK([$'03.Muestra'.$E15]);"";[$'03.Muestra'.$E15]) ->  | E634: of:=IF([.D634]<>"";IF(AND([.B634]<>"";[.C634]<>"");"";"ERR");"") -> 
B635: of:=IF( ISBLANK([$'03.Muestra'.$C16]);"";[$'03.Muestra'.$C16]) ->  | C635: of:=IF( ISBLANK([$'03.Muestra'.$E16]);"";[$'03.Muestra'.$E16]) ->  | E635: of:=IF([.D635]<>"";IF(AND([.B635]<>"";[.C635]<>"");"";"ERR");"") -> 
B636: of:=IF( ISBLANK([$'03.Muestra'.$C17]);"";[$'03.Muestra'.$C17]) ->  | C636: of:=IF( ISBLANK([$'03.Muestra'.$E17]);"";[$'03.Muestra'.$E17]) ->  | E636: of:=IF([.D636]<>"";IF(AND([.B636]<>"";[.C636]<>"");"";"ERR");"") -> 
B637: of:=IF( ISBLANK([$'03.Muestra'.$C18]);"";[$'03.Muestra'.$C18]) ->  | C637: of:=IF( ISBLANK([$'03.Muestra'.$E18]);"";[$'03.Muestra'.$E18]) ->  | E637: of:=IF([.D637]<>"";IF(AND([.B637]<>"";[.C637]<>"");"";"ERR");"") -> 
B638: of:=IF( ISBLANK([$'03.Muestra'.$C19]);"";[$'03.Muestra'.$C19]) ->  | C638: of:=IF( ISBLANK([$'03.Muestra'.$E19]);"";[$'03.Muestra'.$E19]) ->  | E638: of:=IF([.D638]<>"";IF(AND([.B638]<>"";[.C638]<>"");"";"ERR");"") -> 
B639: of:=IF( ISBLANK([$'03.Muestra'.$C20]);"";[$'03.Muestra'.$C20]) ->  | C639: of:=IF( ISBLANK([$'03.Muestra'.$E20]);"";[$'03.Muestra'.$E20]) ->  | E639: of:=IF([.D639]<>"";IF(AND([.B639]<>"";[.C639]<>"");"";"ERR");"") -> 
B640: of:=IF( ISBLANK([$'03.Muestra'.$C21]);"";[$'03.Muestra'.$C21]) ->  | C640: of:=IF( ISBLANK([$'03.Muestra'.$E21]);"";[$'03.Muestra'.$E21]) ->  | E640: of:=IF([.D640]<>"";IF(AND([.B640]<>"";[.C640]<>"");"";"ERR");"") -> 
B641: of:=IF( ISBLANK([$'03.Muestra'.$C22]);"";[$'03.Muestra'.$C22]) ->  | C641: of:=IF( ISBLANK([$'03.Muestra'.$E22]);"";[$'03.Muestra'.$E22]) ->  | E641: of:=IF([.D641]<>"";IF(AND([.B641]<>"";[.C641]<>"");"";"ERR");"") -> 
B642: of:=IF( ISBLANK([$'03.Muestra'.$C23]);"";[$'03.Muestra'.$C23]) ->  | C642: of:=IF( ISBLANK([$'03.Muestra'.$E23]);"";[$'03.Muestra'.$E23]) ->  | E642: of:=IF([.D642]<>"";IF(AND([.B642]<>"";[.C642]<>"");"";"ERR");"") -> 
B643: of:=IF( ISBLANK([$'03.Muestra'.$C24]);"";[$'03.Muestra'.$C24]) ->  | C643: of:=IF( ISBLANK([$'03.Muestra'.$E24]);"";[$'03.Muestra'.$E24]) ->  | E643: of:=IF([.D643]<>"";IF(AND([.B643]<>"";[.C643]<>"");"";"ERR");"") -> 
B644: of:=IF( ISBLANK([$'03.Muestra'.$C25]);"";[$'03.Muestra'.$C25]) ->  | C644: of:=IF( ISBLANK([$'03.Muestra'.$E25]);"";[$'03.Muestra'.$E25]) ->  | E644: of:=IF([.D644]<>"";IF(AND([.B644]<>"";[.C644]<>"");"";"ERR");"") -> 
B645: of:=IF( ISBLANK([$'03.Muestra'.$C26]);"";[$'03.Muestra'.$C26]) ->  | C645: of:=IF( ISBLANK([$'03.Muestra'.$E26]);"";[$'03.Muestra'.$E26]) ->  | E645: of:=IF([.D645]<>"";IF(AND([.B645]<>"";[.C645]<>"");"";"ERR");"") -> 
B646: of:=IF( ISBLANK([$'03.Muestra'.$C27]);"";[$'03.Muestra'.$C27]) ->  | C646: of:=IF( ISBLANK([$'03.Muestra'.$E27]);"";[$'03.Muestra'.$E27]) ->  | E646: of:=IF([.D646]<>"";IF(AND([.B646]<>"";[.C646]<>"");"";"ERR");"") -> 
B647: of:=IF( ISBLANK([$'03.Muestra'.$C28]);"";[$'03.Muestra'.$C28]) ->  | C647: of:=IF( ISBLANK([$'03.Muestra'.$E28]);"";[$'03.Muestra'.$E28]) ->  | E647: of:=IF([.D647]<>"";IF(AND([.B647]<>"";[.C647]<>"");"";"ERR");"") -> 
B648: of:=IF( ISBLANK([$'03.Muestra'.$C29]);"";[$'03.Muestra'.$C29]) ->  | C648: of:=IF( ISBLANK([$'03.Muestra'.$E29]);"";[$'03.Muestra'.$E29]) ->  | E648: of:=IF([.D648]<>"";IF(AND([.B648]<>"";[.C648]<>"");"";"ERR");"") -> 
B649: of:=IF( ISBLANK([$'03.Muestra'.$C30]);"";[$'03.Muestra'.$C30]) ->  | C649: of:=IF( ISBLANK([$'03.Muestra'.$E30]);"";[$'03.Muestra'.$E30]) ->  | E649: of:=IF([.D649]<>"";IF(AND([.B649]<>"";[.C649]<>"");"";"ERR");"") -> 
B650: of:=IF( ISBLANK([$'03.Muestra'.$C31]);"";[$'03.Muestra'.$C31]) ->  | C650: of:=IF( ISBLANK([$'03.Muestra'.$E31]);"";[$'03.Muestra'.$E31]) ->  | E650: of:=IF([.D650]<>"";IF(AND([.B650]<>"";[.C650]<>"");"";"ERR");"") -> 
B651: of:=IF( ISBLANK([$'03.Muestra'.$C32]);"";[$'03.Muestra'.$C32]) ->  | C651: of:=IF( ISBLANK([$'03.Muestra'.$E32]);"";[$'03.Muestra'.$E32]) ->  | E651: of:=IF([.D651]<>"";IF(AND([.B651]<>"";[.C651]<>"");"";"ERR");"") -> 
B652: of:=IF( ISBLANK([$'03.Muestra'.$C33]);"";[$'03.Muestra'.$C33]) ->  | C652: of:=IF( ISBLANK([$'03.Muestra'.$E33]);"";[$'03.Muestra'.$E33]) ->  | E652: of:=IF([.D652]<>"";IF(AND([.B652]<>"";[.C652]<>"");"";"ERR");"") -> 
B653: of:=IF( ISBLANK([$'03.Muestra'.$C34]);"";[$'03.Muestra'.$C34]) ->  | C653: of:=IF( ISBLANK([$'03.Muestra'.$E34]);"";[$'03.Muestra'.$E34]) ->  | E653: of:=IF([.D653]<>"";IF(AND([.B653]<>"";[.C653]<>"");"";"ERR");"") -> 
B654: of:=IF( ISBLANK([$'03.Muestra'.$C35]);"";[$'03.Muestra'.$C35]) ->  | C654: of:=IF( ISBLANK([$'03.Muestra'.$E35]);"";[$'03.Muestra'.$E35]) ->  | E654: of:=IF([.D654]<>"";IF(AND([.B654]<>"";[.C654]<>"");"";"ERR");"") -> 
B655: of:=IF( ISBLANK([$'03.Muestra'.$C36]);"";[$'03.Muestra'.$C36]) ->  | C655: of:=IF( ISBLANK([$'03.Muestra'.$E36]);"";[$'03.Muestra'.$E36]) ->  | E655: of:=IF([.D655]<>"";IF(AND([.B655]<>"";[.C655]<>"");"";"ERR");"") -> 
B656: of:=IF( ISBLANK([$'03.Muestra'.$C37]);"";[$'03.Muestra'.$C37]) ->  | C656: of:=IF( ISBLANK([$'03.Muestra'.$E37]);"";[$'03.Muestra'.$E37]) ->  | E656: of:=IF([.D656]<>"";IF(AND([.B656]<>"";[.C656]<>"");"";"ERR");"") -> 
B657: of:=IF( ISBLANK([$'03.Muestra'.$C38]);"";[$'03.Muestra'.$C38]) ->  | C657: of:=IF( ISBLANK([$'03.Muestra'.$E38]);"";[$'03.Muestra'.$E38]) ->  | E657: of:=IF([.D657]<>"";IF(AND([.B657]<>"";[.C657]<>"");"";"ERR");"") -> 
B658: of:=IF( ISBLANK([$'03.Muestra'.$C39]);"";[$'03.Muestra'.$C39]) ->  | C658: of:=IF( ISBLANK([$'03.Muestra'.$E39]);"";[$'03.Muestra'.$E39]) ->  | E658: of:=IF([.D658]<>"";IF(AND([.B658]<>"";[.C658]<>"");"";"ERR");"") -> 
B659: of:=IF( ISBLANK([$'03.Muestra'.$C40]);"";[$'03.Muestra'.$C40]) ->  | C659: of:=IF( ISBLANK([$'03.Muestra'.$E40]);"";[$'03.Muestra'.$E40]) ->  | E659: of:=IF([.D659]<>"";IF(AND([.B659]<>"";[.C659]<>"");"";"ERR");"") -> 
B660: of:=IF( ISBLANK([$'03.Muestra'.$C41]);"";[$'03.Muestra'.$C41]) ->  | C660: of:=IF( ISBLANK([$'03.Muestra'.$E41]);"";[$'03.Muestra'.$E41]) ->  | E660: of:=IF([.D660]<>"";IF(AND([.B660]<>"";[.C660]<>"");"";"ERR");"") -> 
B661: of:=IF( ISBLANK([$'03.Muestra'.$C42]);"";[$'03.Muestra'.$C42]) ->  | C661: of:=IF( ISBLANK([$'03.Muestra'.$E42]);"";[$'03.Muestra'.$E42]) ->  | E661: of:=IF([.D661]<>"";IF(AND([.B661]<>"";[.C661]<>"");"";"ERR");"") -> 
B664: AA | C664: 1.4.11 Contraste en elementos no textuales | D664: Resultado
B665: of:=IF( ISBLANK([$'03.Muestra'.$C8]);"";[$'03.Muestra'.$C8]) ->  | C665: of:=IF( ISBLANK([$'03.Muestra'.$E8]);"";[$'03.Muestra'.$E8]) ->  | E665: of:=IF([.D665]<>"";IF(AND([.B665]<>"";[.C665]<>"");"";"ERR");"") ->  | F665: N/T | G665: N/D | H665: N/A | I665: Falla | J665: Pasa | K665: En blanco
B666: of:=IF( ISBLANK([$'03.Muestra'.$C9]);"";[$'03.Muestra'.$C9]) ->  | C666: of:=IF( ISBLANK([$'03.Muestra'.$E9]);"";[$'03.Muestra'.$E9]) ->  | E666: of:=IF([.D666]<>"";IF(AND([.B666]<>"";[.C666]<>"");"";"ERR");"") ->  | F666: of:=COUNTIF([.$D665]:INDIRECT("$D" &  SUM(ROW()-1;['03.Muestra'.$D$45])-1);[.F665]) -> 0 | G666: of:=COUNTIF([.$D665]:INDIRECT("$D" &  SUM(ROW()-1;['03.Muestra'.$D$45])-1);[.G665]) -> 0 | H666: of:=COUNTIF([.$D665]:INDIRECT("$D" &  SUM(ROW()-1;['03.Muestra'.$D$45])-1);[.H665]) -> 0 | I666: of:=COUNTIF([.$D665]:INDIRECT("$D" &  SUM(ROW()-1;['03.Muestra'.$D$45])-1);[.I665]) -> 0 | J666: of:=COUNTIF([.$D665]:INDIRECT("$D" &  SUM(ROW()-1;['03.Muestra'.$D$45])-1);[.J665]) -> 0 | K666: of:=IF(['03.Muestra'.$D$45]=0;0;COUNTBLANK([.$D665]:INDIRECT("$D" &  SUM(ROW()-1;['03.Muestra'.$D$45])-1))) -> 0
B667: of:=IF( ISBLANK([$'03.Muestra'.$C10]);"";[$'03.Muestra'.$C10]) ->  | C667: of:=IF( ISBLANK([$'03.Muestra'.$E10]);"";[$'03.Muestra'.$E10]) ->  | E667: of:=IF([.D667]<>"";IF(AND([.B667]<>"";[.C667]<>"");"";"ERR");"") -> 
B668: of:=IF( ISBLANK([$'03.Muestra'.$C11]);"";[$'03.Muestra'.$C11]) ->  | C668: of:=IF( ISBLANK([$'03.Muestra'.$E11]);"";[$'03.Muestra'.$E11]) ->  | E668: of:=IF([.D668]<>"";IF(AND([.B668]<>"";[.C668]<>"");"";"ERR");"") -> 
B669: of:=IF( ISBLANK([$'03.Muestra'.$C12]);"";[$'03.Muestra'.$C12]) ->  | C669: of:=IF( ISBLANK([$'03.Muestra'.$E12]);"";[$'03.Muestra'.$E12]) ->  | E669: of:=IF([.D669]<>"";IF(AND([.B669]<>"";[.C669]<>"");"";"ERR");"") -> 
B670: of:=IF( ISBLANK([$'03.Muestra'.$C13]);"";[$'03.Muestra'.$C13]) ->  | C670: of:=IF( ISBLANK([$'03.Muestra'.$E13]);"";[$'03.Muestra'.$E13]) ->  | E670: of:=IF([.D670]<>"";IF(AND([.B670]<>"";[.C670]<>"");"";"ERR");"") -> 
B671: of:=IF( ISBLANK([$'03.Muestra'.$C14]);"";[$'03.Muestra'.$C14]) ->  | C671: of:=IF( ISBLANK([$'03.Muestra'.$E14]);"";[$'03.Muestra'.$E14]) ->  | E671: of:=IF([.D671]<>"";IF(AND([.B671]<>"";[.C671]<>"");"";"ERR");"") -> 
B672: of:=IF( ISBLANK([$'03.Muestra'.$C15]);"";[$'03.Muestra'.$C15]) ->  | C672: of:=IF( ISBLANK([$'03.Muestra'.$E15]);"";[$'03.Muestra'.$E15]) ->  | E672: of:=IF([.D672]<>"";IF(AND([.B672]<>"";[.C672]<>"");"";"ERR");"") -> 
B673: of:=IF( ISBLANK([$'03.Muestra'.$C16]);"";[$'03.Muestra'.$C16]) ->  | C673: of:=IF( ISBLANK([$'03.Muestra'.$E16]);"";[$'03.Muestra'.$E16]) ->  | E673: of:=IF([.D673]<>"";IF(AND([.B673]<>"";[.C673]<>"");"";"ERR");"") -> 
B674: of:=IF( ISBLANK([$'03.Muestra'.$C17]);"";[$'03.Muestra'.$C17]) ->  | C674: of:=IF( ISBLANK([$'03.Muestra'.$E17]);"";[$'03.Muestra'.$E17]) ->  | E674: of:=IF([.D674]<>"";IF(AND([.B674]<>"";[.C674]<>"");"";"ERR");"") -> 
B675: of:=IF( ISBLANK([$'03.Muestra'.$C18]);"";[$'03.Muestra'.$C18]) ->  | C675: of:=IF( ISBLANK([$'03.Muestra'.$E18]);"";[$'03.Muestra'.$E18]) ->  | E675: of:=IF([.D675]<>"";IF(AND([.B675]<>"";[.C675]<>"");"";"ERR");"") -> 
B676: of:=IF( ISBLANK([$'03.Muestra'.$C19]);"";[$'03.Muestra'.$C19]) ->  | C676: of:=IF( ISBLANK([$'03.Muestra'.$E19]);"";[$'03.Muestra'.$E19]) ->  | E676: of:=IF([.D676]<>"";IF(AND([.B676]<>"";[.C676]<>"");"";"ERR");"") -> 
B677: of:=IF( ISBLANK([$'03.Muestra'.$C20]);"";[$'03.Muestra'.$C20]) ->  | C677: of:=IF( ISBLANK([$'03.Muestra'.$E20]);"";[$'03.Muestra'.$E20]) ->  | E677: of:=IF([.D677]<>"";IF(AND([.B677]<>"";[.C677]<>"");"";"ERR");"") -> 
B678: of:=IF( ISBLANK([$'03.Muestra'.$C21]);"";[$'03.Muestra'.$C21]) ->  | C678: of:=IF( ISBLANK([$'03.Muestra'.$E21]);"";[$'03.Muestra'.$E21]) ->  | E678: of:=IF([.D678]<>"";IF(AND([.B678]<>"";[.C678]<>"");"";"ERR");"") -> 
B679: of:=IF( ISBLANK([$'03.Muestra'.$C22]);"";[$'03.Muestra'.$C22]) ->  | C679: of:=IF( ISBLANK([$'03.Muestra'.$E22]);"";[$'03.Muestra'.$E22]) ->  | E679: of:=IF([.D679]<>"";IF(AND([.B679]<>"";[.C679]<>"");"";"ERR");"") -> 
B680: of:=IF( ISBLANK([$'03.Muestra'.$C23]);"";[$'03.Muestra'.$C23]) ->  | C680: of:=IF( ISBLANK([$'03.Muestra'.$E23]);"";[$'03.Muestra'.$E23]) ->  | E680: of:=IF([.D680]<>"";IF(AND([.B680]<>"";[.C680]<>"");"";"ERR");"") -> 
B681: of:=IF( ISBLANK([$'03.Muestra'.$C24]);"";[$'03.Muestra'.$C24]) ->  | C681: of:=IF( ISBLANK([$'03.Muestra'.$E24]);"";[$'03.Muestra'.$E24]) ->  | E681: of:=IF([.D681]<>"";IF(AND([.B681]<>"";[.C681]<>"");"";"ERR");"") -> 
B682: of:=IF( ISBLANK([$'03.Muestra'.$C25]);"";[$'03.Muestra'.$C25]) ->  | C682: of:=IF( ISBLANK([$'03.Muestra'.$E25]);"";[$'03.Muestra'.$E25]) ->  | E682: of:=IF([.D682]<>"";IF(AND([.B682]<>"";[.C682]<>"");"";"ERR");"") -> 
B683: of:=IF( ISBLANK([$'03.Muestra'.$C26]);"";[$'03.Muestra'.$C26]) ->  | C683: of:=IF( ISBLANK([$'03.Muestra'.$E26]);"";[$'03.Muestra'.$E26]) ->  | E683: of:=IF([.D683]<>"";IF(AND([.B683]<>"";[.C683]<>"");"";"ERR");"") -> 
B684: of:=IF( ISBLANK([$'03.Muestra'.$C27]);"";[$'03.Muestra'.$C27]) ->  | C684: of:=IF( ISBLANK([$'03.Muestra'.$E27]);"";[$'03.Muestra'.$E27]) ->  | E684: of:=IF([.D684]<>"";IF(AND([.B684]<>"";[.C684]<>"");"";"ERR");"") -> 
B685: of:=IF( ISBLANK([$'03.Muestra'.$C28]);"";[$'03.Muestra'.$C28]) ->  | C685: of:=IF( ISBLANK([$'03.Muestra'.$E28]);"";[$'03.Muestra'.$E28]) ->  | E685: of:=IF([.D685]<>"";IF(AND([.B685]<>"";[.C685]<>"");"";"ERR");"") -> 
B686: of:=IF( ISBLANK([$'03.Muestra'.$C29]);"";[$'03.Muestra'.$C29]) ->  | C686: of:=IF( ISBLANK([$'03.Muestra'.$E29]);"";[$'03.Muestra'.$E29]) ->  | E686: of:=IF([.D686]<>"";IF(AND([.B686]<>"";[.C686]<>"");"";"ERR");"") -> 
B687: of:=IF( ISBLANK([$'03.Muestra'.$C30]);"";[$'03.Muestra'.$C30]) ->  | C687: of:=IF( ISBLANK([$'03.Muestra'.$E30]);"";[$'03.Muestra'.$E30]) ->  | E687: of:=IF([.D687]<>"";IF(AND([.B687]<>"";[.C687]<>"");"";"ERR");"") -> 
B688: of:=IF( ISBLANK([$'03.Muestra'.$C31]);"";[$'03.Muestra'.$C31]) ->  | C688: of:=IF( ISBLANK([$'03.Muestra'.$E31]);"";[$'03.Muestra'.$E31]) ->  | E688: of:=IF([.D688]<>"";IF(AND([.B688]<>"";[.C688]<>"");"";"ERR");"") -> 
B689: of:=IF( ISBLANK([$'03.Muestra'.$C32]);"";[$'03.Muestra'.$C32]) ->  | C689: of:=IF( ISBLANK([$'03.Muestra'.$E32]);"";[$'03.Muestra'.$E32]) ->  | E689: of:=IF([.D689]<>"";IF(AND([.B689]<>"";[.C689]<>"");"";"ERR");"") -> 
B690: of:=IF( ISBLANK([$'03.Muestra'.$C33]);"";[$'03.Muestra'.$C33]) ->  | C690: of:=IF( ISBLANK([$'03.Muestra'.$E33]);"";[$'03.Muestra'.$E33]) ->  | E690: of:=IF([.D690]<>"";IF(AND([.B690]<>"";[.C690]<>"");"";"ERR");"") -> 
B691: of:=IF( ISBLANK([$'03.Muestra'.$C34]);"";[$'03.Muestra'.$C34]) ->  | C691: of:=IF( ISBLANK([$'03.Muestra'.$E34]);"";[$'03.Muestra'.$E34]) ->  | E691: of:=IF([.D691]<>"";IF(AND([.B691]<>"";[.C691]<>"");"";"ERR");"") -> 
B692: of:=IF( ISBLANK([$'03.Muestra'.$C35]);"";[$'03.Muestra'.$C35]) ->  | C692: of:=IF( ISBLANK([$'03.Muestra'.$E35]);"";[$'03.Muestra'.$E35]) ->  | E692: of:=IF([.D692]<>"";IF(AND([.B692]<>"";[.C692]<>"");"";"ERR");"") -> 
B693: of:=IF( ISBLANK([$'03.Muestra'.$C36]);"";[$'03.Muestra'.$C36]) ->  | C693: of:=IF( ISBLANK([$'03.Muestra'.$E36]);"";[$'03.Muestra'.$E36]) ->  | E693: of:=IF([.D693]<>"";IF(AND([.B693]<>"";[.C693]<>"");"";"ERR");"") -> 
B694: of:=IF( ISBLANK([$'03.Muestra'.$C37]);"";[$'03.Muestra'.$C37]) ->  | C694: of:=IF( ISBLANK([$'03.Muestra'.$E37]);"";[$'03.Muestra'.$E37]) ->  | E694: of:=IF([.D694]<>"";IF(AND([.B694]<>"";[.C694]<>"");"";"ERR");"") -> 
B695: of:=IF( ISBLANK([$'03.Muestra'.$C38]);"";[$'03.Muestra'.$C38]) ->  | C695: of:=IF( ISBLANK([$'03.Muestra'.$E38]);"";[$'03.Muestra'.$E38]) ->  | E695: of:=IF([.D695]<>"";IF(AND([.B695]<>"";[.C695]<>"");"";"ERR");"") -> 
B696: of:=IF( ISBLANK([$'03.Muestra'.$C39]);"";[$'03.Muestra'.$C39]) ->  | C696: of:=IF( ISBLANK([$'03.Muestra'.$E39]);"";[$'03.Muestra'.$E39]) ->  | E696: of:=IF([.D696]<>"";IF(AND([.B696]<>"";[.C696]<>"");"";"ERR");"") -> 
B697: of:=IF( ISBLANK([$'03.Muestra'.$C40]);"";[$'03.Muestra'.$C40]) ->  | C697: of:=IF( ISBLANK([$'03.Muestra'.$E40]);"";[$'03.Muestra'.$E40]) ->  | E697: of:=IF([.D697]<>"";IF(AND([.B697]<>"";[.C697]<>"");"";"ERR");"") -> 
B698: of:=IF( ISBLANK([$'03.Muestra'.$C41]);"";[$'03.Muestra'.$C41]) ->  | C698: of:=IF( ISBLANK([$'03.Muestra'.$E41]);"";[$'03.Muestra'.$E41]) ->  | E698: of:=IF([.D698]<>"";IF(AND([.B698]<>"";[.C698]<>"");"";"ERR");"") -> 
B699: of:=IF( ISBLANK([$'03.Muestra'.$C42]);"";[$'03.Muestra'.$C42]) ->  | C699: of:=IF( ISBLANK([$'03.Muestra'.$E42]);"";[$'03.Muestra'.$E42]) ->  | E699: of:=IF([.D699]<>"";IF(AND([.B699]<>"";[.C699]<>"");"";"ERR");"") -> 
B702: AA | C702: 1.4.12 Espaciado en el texto | D702: Resultado
B703: of:=IF( ISBLANK([$'03.Muestra'.$C8]);"";[$'03.Muestra'.$C8]) ->  | C703: of:=IF( ISBLANK([$'03.Muestra'.$E8]);"";[$'03.Muestra'.$E8]) ->  | E703: of:=IF([.D703]<>"";IF(AND([.B703]<>"";[.C703]<>"");"";"ERR");"") ->  | F703: N/T | G703: N/D | H703: N/A | I703: Falla | J703: Pasa | K703: En blanco
B704: of:=IF( ISBLANK([$'03.Muestra'.$C9]);"";[$'03.Muestra'.$C9]) ->  | C704: of:=IF( ISBLANK([$'03.Muestra'.$E9]);"";[$'03.Muestra'.$E9]) ->  | E704: of:=IF([.D704]<>"";IF(AND([.B704]<>"";[.C704]<>"");"";"ERR");"") ->  | F704: of:=COUNTIF([.$D703]:INDIRECT("$D" &  SUM(ROW()-1;['03.Muestra'.$D$45])-1);[.F703]) -> 0 | G704: of:=COUNTIF([.$D703]:INDIRECT("$D" &  SUM(ROW()-1;['03.Muestra'.$D$45])-1);[.G703]) -> 0 | H704: of:=COUNTIF([.$D703]:INDIRECT("$D" &  SUM(ROW()-1;['03.Muestra'.$D$45])-1);[.H703]) -> 0 | I704: of:=COUNTIF([.$D703]:INDIRECT("$D" &  SUM(ROW()-1;['03.Muestra'.$D$45])-1);[.I703]) -> 0 | J704: of:=COUNTIF([.$D703]:INDIRECT("$D" &  SUM(ROW()-1;['03.Muestra'.$D$45])-1);[.J703]) -> 0 | K704: of:=IF(['03.Muestra'.$D$45]=0;0;COUNTBLANK([.$D703]:INDIRECT("$D" &  SUM(ROW()-1;['03.Muestra'.$D$45])-1))) -> 0
B705: of:=IF( ISBLANK([$'03.Muestra'.$C10]);"";[$'03.Muestra'.$C10]) ->  | C705: of:=IF( ISBLANK([$'03.Muestra'.$E10]);"";[$'03.Muestra'.$E10]) ->  | E705: of:=IF([.D705]<>"";IF(AND([.B705]<>"";[.C705]<>"");"";"ERR");"") -> 
B706: of:=IF( ISBLANK([$'03.Muestra'.$C11]);"";[$'03.Muestra'.$C11]) ->  | C706: of:=IF( ISBLANK([$'03.Muestra'.$E11]);"";[$'03.Muestra'.$E11]) ->  | E706: of:=IF([.D706]<>"";IF(AND([.B706]<>"";[.C706]<>"");"";"ERR");"") -> 
B707: of:=IF( ISBLANK([$'03.Muestra'.$C12]);"";[$'03.Muestra'.$C12]) ->  | C707: of:=IF( ISBLANK([$'03.Muestra'.$E12]);"";[$'03.Muestra'.$E12]) ->  | E707: of:=IF([.D707]<>"";IF(AND([.B707]<>"";[.C707]<>"");"";"ERR");"") -> 
B708: of:=IF( ISBLANK([$'03.Muestra'.$C13]);"";[$'03.Muestra'.$C13]) ->  | C708: of:=IF( ISBLANK([$'03.Muestra'.$E13]);"";[$'03.Muestra'.$E13]) ->  | E708: of:=IF([.D708]<>"";IF(AND([.B708]<>"";[.C708]<>"");"";"ERR");"") -> 
B709: of:=IF( ISBLANK([$'03.Muestra'.$C14]);"";[$'03.Muestra'.$C14]) ->  | C709: of:=IF( ISBLANK([$'03.Muestra'.$E14]);"";[$'03.Muestra'.$E14]) ->  | E709: of:=IF([.D709]<>"";IF(AND([.B709]<>"";[.C709]<>"");"";"ERR");"") -> 
B710: of:=IF( ISBLANK([$'03.Muestra'.$C15]);"";[$'03.Muestra'.$C15]) ->  | C710: of:=IF( ISBLANK([$'03.Muestra'.$E15]);"";[$'03.Muestra'.$E15]) ->  | E710: of:=IF([.D710]<>"";IF(AND([.B710]<>"";[.C710]<>"");"";"ERR");"") -> 
B711: of:=IF( ISBLANK([$'03.Muestra'.$C16]);"";[$'03.Muestra'.$C16]) ->  | C711: of:=IF( ISBLANK([$'03.Muestra'.$E16]);"";[$'03.Muestra'.$E16]) ->  | E711: of:=IF([.D711]<>"";IF(AND([.B711]<>"";[.C711]<>"");"";"ERR");"") -> 
B712: of:=IF( ISBLANK([$'03.Muestra'.$C17]);"";[$'03.Muestra'.$C17]) ->  | C712: of:=IF( ISBLANK([$'03.Muestra'.$E17]);"";[$'03.Muestra'.$E17]) ->  | E712: of:=IF([.D712]<>"";IF(AND([.B712]<>"";[.C712]<>"");"";"ERR");"") -> 
B713: of:=IF( ISBLANK([$'03.Muestra'.$C18]);"";[$'03.Muestra'.$C18]) ->  | C713: of:=IF( ISBLANK([$'03.Muestra'.$E18]);"";[$'03.Muestra'.$E18]) ->  | E713: of:=IF([.D713]<>"";IF(AND([.B713]<>"";[.C713]<>"");"";"ERR");"") -> 
B714: of:=IF( ISBLANK([$'03.Muestra'.$C19]);"";[$'03.Muestra'.$C19]) ->  | C714: of:=IF( ISBLANK([$'03.Muestra'.$E19]);"";[$'03.Muestra'.$E19]) ->  | E714: of:=IF([.D714]<>"";IF(AND([.B714]<>"";[.C714]<>"");"";"ERR");"") -> 
B715: of:=IF( ISBLANK([$'03.Muestra'.$C20]);"";[$'03.Muestra'.$C20]) ->  | C715: of:=IF( ISBLANK([$'03.Muestra'.$E20]);"";[$'03.Muestra'.$E20]) ->  | E715: of:=IF([.D715]<>"";IF(AND([.B715]<>"";[.C715]<>"");"";"ERR");"") -> 
B716: of:=IF( ISBLANK([$'03.Muestra'.$C21]);"";[$'03.Muestra'.$C21]) ->  | C716: of:=IF( ISBLANK([$'03.Muestra'.$E21]);"";[$'03.Muestra'.$E21]) ->  | E716: of:=IF([.D716]<>"";IF(AND([.B716]<>"";[.C716]<>"");"";"ERR");"") -> 
B717: of:=IF( ISBLANK([$'03.Muestra'.$C22]);"";[$'03.Muestra'.$C22]) ->  | C717: of:=IF( ISBLANK([$'03.Muestra'.$E22]);"";[$'03.Muestra'.$E22]) ->  | E717: of:=IF([.D717]<>"";IF(AND([.B717]<>"";[.C717]<>"");"";"ERR");"") -> 
B718: of:=IF( ISBLANK([$'03.Muestra'.$C23]);"";[$'03.Muestra'.$C23]) ->  | C718: of:=IF( ISBLANK([$'03.Muestra'.$E23]);"";[$'03.Muestra'.$E23]) ->  | E718: of:=IF([.D718]<>"";IF(AND([.B718]<>"";[.C718]<>"");"";"ERR");"") -> 
B719: of:=IF( ISBLANK([$'03.Muestra'.$C24]);"";[$'03.Muestra'.$C24]) ->  | C719: of:=IF( ISBLANK([$'03.Muestra'.$E24]);"";[$'03.Muestra'.$E24]) ->  | E719: of:=IF([.D719]<>"";IF(AND([.B719]<>"";[.C719]<>"");"";"ERR");"") -> 
B720: of:=IF( ISBLANK([$'03.Muestra'.$C25]);"";[$'03.Muestra'.$C25]) ->  | C720: of:=IF( ISBLANK([$'03.Muestra'.$E25]);"";[$'03.Muestra'.$E25]) ->  | E720: of:=IF([.D720]<>"";IF(AND([.B720]<>"";[.C720]<>"");"";"ERR");"") -> 
B721: of:=IF( ISBLANK([$'03.Muestra'.$C26]);"";[$'03.Muestra'.$C26]) ->  | C721: of:=IF( ISBLANK([$'03.Muestra'.$E26]);"";[$'03.Muestra'.$E26]) ->  | E721: of:=IF([.D721]<>"";IF(AND([.B721]<>"";[.C721]<>"");"";"ERR");"") -> 
B722: of:=IF( ISBLANK([$'03.Muestra'.$C27]);"";[$'03.Muestra'.$C27]) ->  | C722: of:=IF( ISBLANK([$'03.Muestra'.$E27]);"";[$'03.Muestra'.$E27]) ->  | E722: of:=IF([.D722]<>"";IF(AND([.B722]<>"";[.C722]<>"");"";"ERR");"") -> 
B723: of:=IF( ISBLANK([$'03.Muestra'.$C28]);"";[$'03.Muestra'.$C28]) ->  | C723: of:=IF( ISBLANK([$'03.Muestra'.$E28]);"";[$'03.Muestra'.$E28]) ->  | E723: of:=IF([.D723]<>"";IF(AND([.B723]<>"";[.C723]<>"");"";"ERR");"") -> 
B724: of:=IF( ISBLANK([$'03.Muestra'.$C29]);"";[$'03.Muestra'.$C29]) ->  | C724: of:=IF( ISBLANK([$'03.Muestra'.$E29]);"";[$'03.Muestra'.$E29]) ->  | E724: of:=IF([.D724]<>"";IF(AND([.B724]<>"";[.C724]<>"");"";"ERR");"") -> 
B725: of:=IF( ISBLANK([$'03.Muestra'.$C30]);"";[$'03.Muestra'.$C30]) ->  | C725: of:=IF( ISBLANK([$'03.Muestra'.$E30]);"";[$'03.Muestra'.$E30]) ->  | E725: of:=IF([.D725]<>"";IF(AND([.B725]<>"";[.C725]<>"");"";"ERR");"") -> 
B726: of:=IF( ISBLANK([$'03.Muestra'.$C31]);"";[$'03.Muestra'.$C31]) ->  | C726: of:=IF( ISBLANK([$'03.Muestra'.$E31]);"";[$'03.Muestra'.$E31]) ->  | E726: of:=IF([.D726]<>"";IF(AND([.B726]<>"";[.C726]<>"");"";"ERR");"") -> 
B727: of:=IF( ISBLANK([$'03.Muestra'.$C32]);"";[$'03.Muestra'.$C32]) ->  | C727: of:=IF( ISBLANK([$'03.Muestra'.$E32]);"";[$'03.Muestra'.$E32]) ->  | E727: of:=IF([.D727]<>"";IF(AND([.B727]<>"";[.C727]<>"");"";"ERR");"") -> 
B728: of:=IF( ISBLANK([$'03.Muestra'.$C33]);"";[$'03.Muestra'.$C33]) ->  | C728: of:=IF( ISBLANK([$'03.Muestra'.$E33]);"";[$'03.Muestra'.$E33]) ->  | E728: of:=IF([.D728]<>"";IF(AND([.B728]<>"";[.C728]<>"");"";"ERR");"") -> 
B729: of:=IF( ISBLANK([$'03.Muestra'.$C34]);"";[$'03.Muestra'.$C34]) ->  | C729: of:=IF( ISBLANK([$'03.Muestra'.$E34]);"";[$'03.Muestra'.$E34]) ->  | E729: of:=IF([.D729]<>"";IF(AND([.B729]<>"";[.C729]<>"");"";"ERR");"") -> 
B730: of:=IF( ISBLANK([$'03.Muestra'.$C35]);"";[$'03.Muestra'.$C35]) ->  | C730: of:=IF( ISBLANK([$'03.Muestra'.$E35]);"";[$'03.Muestra'.$E35]) ->  | E730: of:=IF([.D730]<>"";IF(AND([.B730]<>"";[.C730]<>"");"";"ERR");"") -> 
B731: of:=IF( ISBLANK([$'03.Muestra'.$C36]);"";[$'03.Muestra'.$C36]) ->  | C731: of:=IF( ISBLANK([$'03.Muestra'.$E36]);"";[$'03.Muestra'.$E36]) ->  | E731: of:=IF([.D731]<>"";IF(AND([.B731]<>"";[.C731]<>"");"";"ERR");"") -> 
B732: of:=IF( ISBLANK([$'03.Muestra'.$C37]);"";[$'03.Muestra'.$C37]) ->  | C732: of:=IF( ISBLANK([$'03.Muestra'.$E37]);"";[$'03.Muestra'.$E37]) ->  | E732: of:=IF([.D732]<>"";IF(AND([.B732]<>"";[.C732]<>"");"";"ERR");"") -> 
B733: of:=IF( ISBLANK([$'03.Muestra'.$C38]);"";[$'03.Muestra'.$C38]) ->  | C733: of:=IF( ISBLANK([$'03.Muestra'.$E38]);"";[$'03.Muestra'.$E38]) ->  | E733: of:=IF([.D733]<>"";IF(AND([.B733]<>"";[.C733]<>"");"";"ERR");"") -> 
B734: of:=IF( ISBLANK([$'03.Muestra'.$C39]);"";[$'03.Muestra'.$C39]) ->  | C734: of:=IF( ISBLANK([$'03.Muestra'.$E39]);"";[$'03.Muestra'.$E39]) ->  | E734: of:=IF([.D734]<>"";IF(AND([.B734]<>"";[.C734]<>"");"";"ERR");"") -> 
B735: of:=IF( ISBLANK([$'03.Muestra'.$C40]);"";[$'03.Muestra'.$C40]) ->  | C735: of:=IF( ISBLANK([$'03.Muestra'.$E40]);"";[$'03.Muestra'.$E40]) ->  | E735: of:=IF([.D735]<>"";IF(AND([.B735]<>"";[.C735]<>"");"";"ERR");"") -> 
B736: of:=IF( ISBLANK([$'03.Muestra'.$C41]);"";[$'03.Muestra'.$C41]) ->  | C736: of:=IF( ISBLANK([$'03.Muestra'.$E41]);"";[$'03.Muestra'.$E41]) ->  | E736: of:=IF([.D736]<>"";IF(AND([.B736]<>"";[.C736]<>"");"";"ERR");"") -> 
B737: of:=IF( ISBLANK([$'03.Muestra'.$C42]);"";[$'03.Muestra'.$C42]) ->  | C737: of:=IF( ISBLANK([$'03.Muestra'.$E42]);"";[$'03.Muestra'.$E42]) ->  | E737: of:=IF([.D737]<>"";IF(AND([.B737]<>"";[.C737]<>"");"";"ERR");"") -> 
B740: AA | C740: 1.4.13 Contenido en over o focus | D740: Resultado
B741: of:=IF( ISBLANK([$'03.Muestra'.$C8]);"";[$'03.Muestra'.$C8]) ->  | C741: of:=IF( ISBLANK([$'03.Muestra'.$E8]);"";[$'03.Muestra'.$E8]) ->  | E741: of:=IF([.D741]<>"";IF(AND([.B741]<>"";[.C741]<>"");"";"ERR");"") ->  | F741: N/T | G741: N/D | H741: N/A | I741: Falla | J741: Pasa | K741: En blanco
B742: of:=IF( ISBLANK([$'03.Muestra'.$C9]);"";[$'03.Muestra'.$C9]) ->  | C742: of:=IF( ISBLANK([$'03.Muestra'.$E9]);"";[$'03.Muestra'.$E9]) ->  | E742: of:=IF([.D742]<>"";IF(AND([.B742]<>"";[.C742]<>"");"";"ERR");"") ->  | F742: of:=COUNTIF([.$D741]:INDIRECT("$D" &  SUM(ROW()-1;['03.Muestra'.$D$45])-1);[.F741]) -> 0 | G742: of:=COUNTIF([.$D741]:INDIRECT("$D" &  SUM(ROW()-1;['03.Muestra'.$D$45])-1);[.G741]) -> 0 | H742: of:=COUNTIF([.$D741]:INDIRECT("$D" &  SUM(ROW()-1;['03.Muestra'.$D$45])-1);[.H741]) -> 0 | I742: of:=COUNTIF([.$D741]:INDIRECT("$D" &  SUM(ROW()-1;['03.Muestra'.$D$45])-1);[.I741]) -> 0 | J742: of:=COUNTIF([.$D741]:INDIRECT("$D" &  SUM(ROW()-1;['03.Muestra'.$D$45])-1);[.J741]) -> 0 | K742: of:=IF(['03.Muestra'.$D$45]=0;0;COUNTBLANK([.$D741]:INDIRECT("$D" &  SUM(ROW()-1;['03.Muestra'.$D$45])-1))) -> 0
B743: of:=IF( ISBLANK([$'03.Muestra'.$C10]);"";[$'03.Muestra'.$C10]) ->  | C743: of:=IF( ISBLANK([$'03.Muestra'.$E10]);"";[$'03.Muestra'.$E10]) ->  | E743: of:=IF([.D743]<>"";IF(AND([.B743]<>"";[.C743]<>"");"";"ERR");"") -> 
B744: of:=IF( ISBLANK([$'03.Muestra'.$C11]);"";[$'03.Muestra'.$C11]) ->  | C744: of:=IF( ISBLANK([$'03.Muestra'.$E11]);"";[$'03.Muestra'.$E11]) ->  | E744: of:=IF([.D744]<>"";IF(AND([.B744]<>"";[.C744]<>"");"";"ERR");"") -> 
B745: of:=IF( ISBLANK([$'03.Muestra'.$C12]);"";[$'03.Muestra'.$C12]) ->  | C745: of:=IF( ISBLANK([$'03.Muestra'.$E12]);"";[$'03.Muestra'.$E12]) ->  | E745: of:=IF([.D745]<>"";IF(AND([.B745]<>"";[.C745]<>"");"";"ERR");"") -> 
B746: of:=IF( ISBLANK([$'03.Muestra'.$C13]);"";[$'03.Muestra'.$C13]) ->  | C746: of:=IF( ISBLANK([$'03.Muestra'.$E13]);"";[$'03.Muestra'.$E13]) ->  | E746: of:=IF([.D746]<>"";IF(AND([.B746]<>"";[.C746]<>"");"";"ERR");"") -> 
B747: of:=IF( ISBLANK([$'03.Muestra'.$C14]);"";[$'03.Muestra'.$C14]) ->  | C747: of:=IF( ISBLANK([$'03.Muestra'.$E14]);"";[$'03.Muestra'.$E14]) ->  | E747: of:=IF([.D747]<>"";IF(AND([.B747]<>"";[.C747]<>"");"";"ERR");"") -> 
B748: of:=IF( ISBLANK([$'03.Muestra'.$C15]);"";[$'03.Muestra'.$C15]) ->  | C748: of:=IF( ISBLANK([$'03.Muestra'.$E15]);"";[$'03.Muestra'.$E15]) ->  | E748: of:=IF([.D748]<>"";IF(AND([.B748]<>"";[.C748]<>"");"";"ERR");"") -> 
B749: of:=IF( ISBLANK([$'03.Muestra'.$C16]);"";[$'03.Muestra'.$C16]) ->  | C749: of:=IF( ISBLANK([$'03.Muestra'.$E16]);"";[$'03.Muestra'.$E16]) ->  | E749: of:=IF([.D749]<>"";IF(AND([.B749]<>"";[.C749]<>"");"";"ERR");"") -> 
B750: of:=IF( ISBLANK([$'03.Muestra'.$C17]);"";[$'03.Muestra'.$C17]) ->  | C750: of:=IF( ISBLANK([$'03.Muestra'.$E17]);"";[$'03.Muestra'.$E17]) ->  | E750: of:=IF([.D750]<>"";IF(AND([.B750]<>"";[.C750]<>"");"";"ERR");"") -> 
B751: of:=IF( ISBLANK([$'03.Muestra'.$C18]);"";[$'03.Muestra'.$C18]) ->  | C751: of:=IF( ISBLANK([$'03.Muestra'.$E18]);"";[$'03.Muestra'.$E18]) ->  | E751: of:=IF([.D751]<>"";IF(AND([.B751]<>"";[.C751]<>"");"";"ERR");"") -> 
B752: of:=IF( ISBLANK([$'03.Muestra'.$C19]);"";[$'03.Muestra'.$C19]) ->  | C752: of:=IF( ISBLANK([$'03.Muestra'.$E19]);"";[$'03.Muestra'.$E19]) ->  | E752: of:=IF([.D752]<>"";IF(AND([.B752]<>"";[.C752]<>"");"";"ERR");"") -> 
B753: of:=IF( ISBLANK([$'03.Muestra'.$C20]);"";[$'03.Muestra'.$C20]) ->  | C753: of:=IF( ISBLANK([$'03.Muestra'.$E20]);"";[$'03.Muestra'.$E20]) ->  | E753: of:=IF([.D753]<>"";IF(AND([.B753]<>"";[.C753]<>"");"";"ERR");"") -> 
B754: of:=IF( ISBLANK([$'03.Muestra'.$C21]);"";[$'03.Muestra'.$C21]) ->  | C754: of:=IF( ISBLANK([$'03.Muestra'.$E21]);"";[$'03.Muestra'.$E21]) ->  | E754: of:=IF([.D754]<>"";IF(AND([.B754]<>"";[.C754]<>"");"";"ERR");"") -> 
B755: of:=IF( ISBLANK([$'03.Muestra'.$C22]);"";[$'03.Muestra'.$C22]) ->  | C755: of:=IF( ISBLANK([$'03.Muestra'.$E22]);"";[$'03.Muestra'.$E22]) ->  | E755: of:=IF([.D755]<>"";IF(AND([.B755]<>"";[.C755]<>"");"";"ERR");"") -> 
B756: of:=IF( ISBLANK([$'03.Muestra'.$C23]);"";[$'03.Muestra'.$C23]) ->  | C756: of:=IF( ISBLANK([$'03.Muestra'.$E23]);"";[$'03.Muestra'.$E23]) ->  | E756: of:=IF([.D756]<>"";IF(AND([.B756]<>"";[.C756]<>"");"";"ERR");"") -> 
B757: of:=IF( ISBLANK([$'03.Muestra'.$C24]);"";[$'03.Muestra'.$C24]) ->  | C757: of:=IF( ISBLANK([$'03.Muestra'.$E24]);"";[$'03.Muestra'.$E24]) ->  | E757: of:=IF([.D757]<>"";IF(AND([.B757]<>"";[.C757]<>"");"";"ERR");"") -> 
B758: of:=IF( ISBLANK([$'03.Muestra'.$C25]);"";[$'03.Muestra'.$C25]) ->  | C758: of:=IF( ISBLANK([$'03.Muestra'.$E25]);"";[$'03.Muestra'.$E25]) ->  | E758: of:=IF([.D758]<>"";IF(AND([.B758]<>"";[.C758]<>"");"";"ERR");"") -> 
B759: of:=IF( ISBLANK([$'03.Muestra'.$C26]);"";[$'03.Muestra'.$C26]) ->  | C759: of:=IF( ISBLANK([$'03.Muestra'.$E26]);"";[$'03.Muestra'.$E26]) ->  | E759: of:=IF([.D759]<>"";IF(AND([.B759]<>"";[.C759]<>"");"";"ERR");"") -> 
B760: of:=IF( ISBLANK([$'03.Muestra'.$C27]);"";[$'03.Muestra'.$C27]) ->  | C760: of:=IF( ISBLANK([$'03.Muestra'.$E27]);"";[$'03.Muestra'.$E27]) ->  | E760: of:=IF([.D760]<>"";IF(AND([.B760]<>"";[.C760]<>"");"";"ERR");"") -> 
B761: of:=IF( ISBLANK([$'03.Muestra'.$C28]);"";[$'03.Muestra'.$C28]) ->  | C761: of:=IF( ISBLANK([$'03.Muestra'.$E28]);"";[$'03.Muestra'.$E28]) ->  | E761: of:=IF([.D761]<>"";IF(AND([.B761]<>"";[.C761]<>"");"";"ERR");"") -> 
B762: of:=IF( ISBLANK([$'03.Muestra'.$C29]);"";[$'03.Muestra'.$C29]) ->  | C762: of:=IF( ISBLANK([$'03.Muestra'.$E29]);"";[$'03.Muestra'.$E29]) ->  | E762: of:=IF([.D762]<>"";IF(AND([.B762]<>"";[.C762]<>"");"";"ERR");"") -> 
B763: of:=IF( ISBLANK([$'03.Muestra'.$C30]);"";[$'03.Muestra'.$C30]) ->  | C763: of:=IF( ISBLANK([$'03.Muestra'.$E30]);"";[$'03.Muestra'.$E30]) ->  | E763: of:=IF([.D763]<>"";IF(AND([.B763]<>"";[.C763]<>"");"";"ERR");"") -> 
B764: of:=IF( ISBLANK([$'03.Muestra'.$C31]);"";[$'03.Muestra'.$C31]) ->  | C764: of:=IF( ISBLANK([$'03.Muestra'.$E31]);"";[$'03.Muestra'.$E31]) ->  | E764: of:=IF([.D764]<>"";IF(AND([.B764]<>"";[.C764]<>"");"";"ERR");"") -> 
B765: of:=IF( ISBLANK([$'03.Muestra'.$C32]);"";[$'03.Muestra'.$C32]) ->  | C765: of:=IF( ISBLANK([$'03.Muestra'.$E32]);"";[$'03.Muestra'.$E32]) ->  | E765: of:=IF([.D765]<>"";IF(AND([.B765]<>"";[.C765]<>"");"";"ERR");"") -> 
B766: of:=IF( ISBLANK([$'03.Muestra'.$C33]);"";[$'03.Muestra'.$C33]) ->  | C766: of:=IF( ISBLANK([$'03.Muestra'.$E33]);"";[$'03.Muestra'.$E33]) ->  | E766: of:=IF([.D766]<>"";IF(AND([.B766]<>"";[.C766]<>"");"";"ERR");"") -> 
B767: of:=IF( ISBLANK([$'03.Muestra'.$C34]);"";[$'03.Muestra'.$C34]) ->  | C767: of:=IF( ISBLANK([$'03.Muestra'.$E34]);"";[$'03.Muestra'.$E34]) ->  | E767: of:=IF([.D767]<>"";IF(AND([.B767]<>"";[.C767]<>"");"";"ERR");"") -> 
B768: of:=IF( ISBLANK([$'03.Muestra'.$C35]);"";[$'03.Muestra'.$C35]) ->  | C768: of:=IF( ISBLANK([$'03.Muestra'.$E35]);"";[$'03.Muestra'.$E35]) ->  | E768: of:=IF([.D768]<>"";IF(AND([.B768]<>"";[.C768]<>"");"";"ERR");"") -> 
B769: of:=IF( ISBLANK([$'03.Muestra'.$C36]);"";[$'03.Muestra'.$C36]) ->  | C769: of:=IF( ISBLANK([$'03.Muestra'.$E36]);"";[$'03.Muestra'.$E36]) ->  | E769: of:=IF([.D769]<>"";IF(AND([.B769]<>"";[.C769]<>"");"";"ERR");"") -> 
B770: of:=IF( ISBLANK([$'03.Muestra'.$C37]);"";[$'03.Muestra'.$C37]) ->  | C770: of:=IF( ISBLANK([$'03.Muestra'.$E37]);"";[$'03.Muestra'.$E37]) ->  | E770: of:=IF([.D770]<>"";IF(AND([.B770]<>"";[.C770]<>"");"";"ERR");"") -> 
B771: of:=IF( ISBLANK([$'03.Muestra'.$C38]);"";[$'03.Muestra'.$C38]) ->  | C771: of:=IF( ISBLANK([$'03.Muestra'.$E38]);"";[$'03.Muestra'.$E38]) ->  | E771: of:=IF([.D771]<>"";IF(AND([.B771]<>"";[.C771]<>"");"";"ERR");"") -> 
B772: of:=IF( ISBLANK([$'03.Muestra'.$C39]);"";[$'03.Muestra'.$C39]) ->  | C772: of:=IF( ISBLANK([$'03.Muestra'.$E39]);"";[$'03.Muestra'.$E39]) ->  | E772: of:=IF([.D772]<>"";IF(AND([.B772]<>"";[.C772]<>"");"";"ERR");"") -> 
B773: of:=IF( ISBLANK([$'03.Muestra'.$C40]);"";[$'03.Muestra'.$C40]) ->  | C773: of:=IF( ISBLANK([$'03.Muestra'.$E40]);"";[$'03.Muestra'.$E40]) ->  | E773: of:=IF([.D773]<>"";IF(AND([.B773]<>"";[.C773]<>"");"";"ERR");"") -> 
B774: of:=IF( ISBLANK([$'03.Muestra'.$C41]);"";[$'03.Muestra'.$C41]) ->  | C774: of:=IF( ISBLANK([$'03.Muestra'.$E41]);"";[$'03.Muestra'.$E41]) ->  | E774: of:=IF([.D774]<>"";IF(AND([.B774]<>"";[.C774]<>"");"";"ERR");"") -> 
B775: of:=IF( ISBLANK([$'03.Muestra'.$C42]);"";[$'03.Muestra'.$C42]) ->  | C775: of:=IF( ISBLANK([$'03.Muestra'.$E42]);"";[$'03.Muestra'.$E42]) ->  | E775: of:=IF([.D775]<>"";IF(AND([.B775]<>"";[.C775]<>"");"";"ERR");"") -> 

Sheet: P2.Operable
B2: Informe de revisión de la accesibilidad
B3: Análisis de accesibilidad en profundidad de un sitio web
B5: Revisión de la muestra
B8: Principio 2: Operable
B9: Los componentes de la interfaz de usuario y la navegación deben ser operables.
B11: Criterios de Conformidad | F11: EVALUADOS | G11: N.º Criterios x N.º Páginas | H11: % | J11: PENDIENTES | K11: N.º Criterios x N.º Páginas | L11: %
B12: A | C12: 14 | F12: Pasa | G12: of:=[.J20]+[.J58]+[.J96]+[.J134]+[.J172]+[.J210]+[.J248]+[.J286]+[.J324]+[.J362]+[.J400]+[.J438]+[.J476]+[.J514]+[.J552]+[.J590]+[.J628] -> 0 | H12: of:=IF(([.$G$15]+[.$K$15])=0;0;[.G12]/([.$G$15]+[.$K$15])) -> 0 | J12: No decide | K12: of:=[.G20]+[.G58]+[.G96]+[.G134]+[.G172]+[.G210]+[.G248]+[.G286]+[.G324]+[.G362]+[.G400]+[.G438]+[.G476]+[.G514]+[.G552]+[.G590]+[.G628] -> 0 | L12: of:=IF(([.$G$15]+[.$K$15])=0;0;[.K12]/([.$G$15]+[.$K$15])) -> 0
B13: AA | C13: 3 | F13: Falla | G13: of:=[.I20]+[.I58]+[.I96]+[.I134]+[.I172]+[.I210]+[.I248]+[.I286]+[.I324]+[.I362]+[.I400]+[.I438]+[.I476]+[.I514]+[.I552]+[.I590]+[.I628] -> 0 | H13: of:=IF(([.$G$15]+[.$K$15])=0;0;[.G13]/([.$G$15]+[.$K$15])) -> 0 | J13: No testeado | K13: of:=[.F20]+[.F58]+[.F96]+[.F134]+[.F172]+[.F210]+[.F248]+[.F286]+[.F324]+[.F362]+[.F400]+[.F438]+[.F476]+[.F514]+[.F552]+[.F590]+[.F628] -> 0 | L13: of:=IF(([.$G$15]+[.$K$15])=0;0;[.K13]/([.$G$15]+[.$K$15])) -> 0
B14: Total | C14: of:=SUM([.C12:.C13]) -> 17 | F14: No aplica | G14: of:=[.H20]+[.H58]+[.H96]+[.H134]+[.H172]+[.H210]+[.H248]+[.H286]+[.H324]+[.H362]+[.H400]+[.H438]+[.H476]+[.H514]+[.H552]+[.H590]+[.H628] -> 0 | H14: of:=IF(([.$G$15]+[.$K$15])=0;0;[.G14]/([.$G$15]+[.$K$15])) -> 0 | J14: En blanco | K14: of:=[.K20]+[.K58]+[.K96]+[.K134]+[.K172]+[.K210]+[.K248]+[.K286]+[.K324]+[.K362]+[.K400]+[.K438]+[.K476]+[.K514]+[.K552]+[.K590]+[.K628] -> 0 | L14: of:=IF(([.$G$15]+[.$K$15])=0;0;[.K14]/([.$G$15]+[.$K$15])) -> 0
F15: Total | G15: of:=SUM([.G12:.G14]) -> 0 | H15: of:=SUM([.H12:.H14]) -> 0 | J15: Total | K15: of:=SUM([.K12:.K14]) -> 0 | L15: of:=SUM([.L12:.L14]) -> 0
B18: A | C18: 2.1.1 Teclado | D18: Resultado
B19: of:=IF( ISBLANK([$'03.Muestra'.$C8]);"";[$'03.Muestra'.$C8]) ->  | C19: of:=IF( ISBLANK([$'03.Muestra'.$E8]);"";[$'03.Muestra'.$E8]) ->  | E19: of:=IF([.D19]<>"";IF(AND([.B19]<>"";[.C19]<>"");"";"ERR");"") ->  | F19: N/T | G19: N/D | H19: N/A | I19: Falla | J19: Pasa | K19: En blanco
B20: of:=IF( ISBLANK([$'03.Muestra'.$C9]);"";[$'03.Muestra'.$C9]) ->  | C20: of:=IF( ISBLANK([$'03.Muestra'.$E9]);"";[$'03.Muestra'.$E9]) ->  | E20: of:=IF([.D20]<>"";IF(AND([.B20]<>"";[.C20]<>"");"";"ERR");"") ->  | F20: of:=COUNTIF([.$D19]:INDIRECT("$D" &  SUM(ROW()-1;[$'03.Muestra'.$D$45])-1);[.F19]) -> 0 | G20: of:=COUNTIF([.$D19]:INDIRECT("$D" &  SUM(ROW()-1;[$'03.Muestra'.$D$45])-1);[.G19]) -> 0 | H20: of:=COUNTIF([.$D19]:INDIRECT("$D" &  SUM(ROW()-1;[$'03.Muestra'.$D$45])-1);[.H19]) -> 0 | I20: of:=COUNTIF([.$D19]:INDIRECT("$D" &  SUM(ROW()-1;[$'03.Muestra'.$D$45])-1);[.I19]) -> 0 | J20: of:=COUNTIF([.$D19]:INDIRECT("$D" &  SUM(ROW()-1;[$'03.Muestra'.$D$45])-1);[.J19]) -> 0 | K20: of:=IF([$'03.Muestra'.$D$45]=0;0;COUNTBLANK([.$D19]:INDIRECT("$D" &  SUM(ROW()-1;[$'03.Muestra'.$D$45])-1))) -> 0
B21: of:=IF( ISBLANK([$'03.Muestra'.$C10]);"";[$'03.Muestra'.$C10]) ->  | C21: of:=IF( ISBLANK([$'03.Muestra'.$E10]);"";[$'03.Muestra'.$E10]) ->  | E21: of:=IF([.D21]<>"";IF(AND([.B21]<>"";[.C21]<>"");"";"ERR");"") -> 
B22: of:=IF( ISBLANK([$'03.Muestra'.$C11]);"";[$'03.Muestra'.$C11]) ->  | C22: of:=IF( ISBLANK([$'03.Muestra'.$E11]);"";[$'03.Muestra'.$E11]) ->  | E22: of:=IF([.D22]<>"";IF(AND([.B22]<>"";[.C22]<>"");"";"ERR");"") ->  | K22: N/T | L22: No Testeado
B23: of:=IF( ISBLANK([$'03.Muestra'.$C12]);"";[$'03.Muestra'.$C12]) ->  | C23: of:=IF( ISBLANK([$'03.Muestra'.$E12]);"";[$'03.Muestra'.$E12]) ->  | E23: of:=IF([.D23]<>"";IF(AND([.B23]<>"";[.C23]<>"");"";"ERR");"") ->  | K23: N/A | L23: No Aplica
B24: of:=IF( ISBLANK([$'03.Muestra'.$C13]);"";[$'03.Muestra'.$C13]) ->  | C24: of:=IF( ISBLANK([$'03.Muestra'.$E13]);"";[$'03.Muestra'.$E13]) ->  | E24: of:=IF([.D24]<>"";IF(AND([.B24]<>"";[.C24]<>"");"";"ERR");"") ->  | K24: N/D | L24: No Decide
B25: of:=IF( ISBLANK([$'03.Muestra'.$C14]);"";[$'03.Muestra'.$C14]) ->  | C25: of:=IF( ISBLANK([$'03.Muestra'.$E14]);"";[$'03.Muestra'.$E14]) ->  | E25: of:=IF([.D25]<>"";IF(AND([.B25]<>"";[.C25]<>"");"";"ERR");"") -> 
B26: of:=IF( ISBLANK([$'03.Muestra'.$C15]);"";[$'03.Muestra'.$C15]) ->  | C26: of:=IF( ISBLANK([$'03.Muestra'.$E15]);"";[$'03.Muestra'.$E15]) ->  | E26: of:=IF([.D26]<>"";IF(AND([.B26]<>"";[.C26]<>"");"";"ERR");"") -> 
B27: of:=IF( ISBLANK([$'03.Muestra'.$C16]);"";[$'03.Muestra'.$C16]) ->  | C27: of:=IF( ISBLANK([$'03.Muestra'.$E16]);"";[$'03.Muestra'.$E16]) ->  | E27: of:=IF([.D27]<>"";IF(AND([.B27]<>"";[.C27]<>"");"";"ERR");"") -> 
B28: of:=IF( ISBLANK([$'03.Muestra'.$C17]);"";[$'03.Muestra'.$C17]) ->  | C28: of:=IF( ISBLANK([$'03.Muestra'.$E17]);"";[$'03.Muestra'.$E17]) ->  | E28: of:=IF([.D28]<>"";IF(AND([.B28]<>"";[.C28]<>"");"";"ERR");"") -> 
B29: of:=IF( ISBLANK([$'03.Muestra'.$C18]);"";[$'03.Muestra'.$C18]) ->  | C29: of:=IF( ISBLANK([$'03.Muestra'.$E18]);"";[$'03.Muestra'.$E18]) ->  | E29: of:=IF([.D29]<>"";IF(AND([.B29]<>"";[.C29]<>"");"";"ERR");"") -> 
B30: of:=IF( ISBLANK([$'03.Muestra'.$C19]);"";[$'03.Muestra'.$C19]) ->  | C30: of:=IF( ISBLANK([$'03.Muestra'.$E19]);"";[$'03.Muestra'.$E19]) ->  | E30: of:=IF([.D30]<>"";IF(AND([.B30]<>"";[.C30]<>"");"";"ERR");"") -> 
B31: of:=IF( ISBLANK([$'03.Muestra'.$C20]);"";[$'03.Muestra'.$C20]) ->  | C31: of:=IF( ISBLANK([$'03.Muestra'.$E20]);"";[$'03.Muestra'.$E20]) ->  | E31: of:=IF([.D31]<>"";IF(AND([.B31]<>"";[.C31]<>"");"";"ERR");"") -> 
B32: of:=IF( ISBLANK([$'03.Muestra'.$C21]);"";[$'03.Muestra'.$C21]) ->  | C32: of:=IF( ISBLANK([$'03.Muestra'.$E21]);"";[$'03.Muestra'.$E21]) ->  | E32: of:=IF([.D32]<>"";IF(AND([.B32]<>"";[.C32]<>"");"";"ERR");"") -> 
B33: of:=IF( ISBLANK([$'03.Muestra'.$C22]);"";[$'03.Muestra'.$C22]) ->  | C33: of:=IF( ISBLANK([$'03.Muestra'.$E22]);"";[$'03.Muestra'.$E22]) ->  | E33: of:=IF([.D33]<>"";IF(AND([.B33]<>"";[.C33]<>"");"";"ERR");"") -> 
B34: of:=IF( ISBLANK([$'03.Muestra'.$C23]);"";[$'03.Muestra'.$C23]) ->  | C34: of:=IF( ISBLANK([$'03.Muestra'.$E23]);"";[$'03.Muestra'.$E23]) ->  | E34: of:=IF([.D34]<>"";IF(AND([.B34]<>"";[.C34]<>"");"";"ERR");"") -> 
B35: of:=IF( ISBLANK([$'03.Muestra'.$C24]);"";[$'03.Muestra'.$C24]) ->  | C35: of:=IF( ISBLANK([$'03.Muestra'.$E24]);"";[$'03.Muestra'.$E24]) ->  | E35: of:=IF([.D35]<>"";IF(AND([.B35]<>"";[.C35]<>"");"";"ERR");"") -> 
B36: of:=IF( ISBLANK([$'03.Muestra'.$C25]);"";[$'03.Muestra'.$C25]) ->  | C36: of:=IF( ISBLANK([$'03.Muestra'.$E25]);"";[$'03.Muestra'.$E25]) ->  | E36: of:=IF([.D36]<>"";IF(AND([.B36]<>"";[.C36]<>"");"";"ERR");"") -> 
B37: of:=IF( ISBLANK([$'03.Muestra'.$C26]);"";[$'03.Muestra'.$C26]) ->  | C37: of:=IF( ISBLANK([$'03.Muestra'.$E26]);"";[$'03.Muestra'.$E26]) ->  | E37: of:=IF([.D37]<>"";IF(AND([.B37]<>"";[.C37]<>"");"";"ERR");"") -> 
B38: of:=IF( ISBLANK([$'03.Muestra'.$C27]);"";[$'03.Muestra'.$C27]) ->  | C38: of:=IF( ISBLANK([$'03.Muestra'.$E27]);"";[$'03.Muestra'.$E27]) ->  | E38: of:=IF([.D38]<>"";IF(AND([.B38]<>"";[.C38]<>"");"";"ERR");"") -> 
B39: of:=IF( ISBLANK([$'03.Muestra'.$C28]);"";[$'03.Muestra'.$C28]) ->  | C39: of:=IF( ISBLANK([$'03.Muestra'.$E28]);"";[$'03.Muestra'.$E28]) ->  | E39: of:=IF([.D39]<>"";IF(AND([.B39]<>"";[.C39]<>"");"";"ERR");"") -> 
B40: of:=IF( ISBLANK([$'03.Muestra'.$C29]);"";[$'03.Muestra'.$C29]) ->  | C40: of:=IF( ISBLANK([$'03.Muestra'.$E29]);"";[$'03.Muestra'.$E29]) ->  | E40: of:=IF([.D40]<>"";IF(AND([.B40]<>"";[.C40]<>"");"";"ERR");"") -> 
B41: of:=IF( ISBLANK([$'03.Muestra'.$C30]);"";[$'03.Muestra'.$C30]) ->  | C41: of:=IF( ISBLANK([$'03.Muestra'.$E30]);"";[$'03.Muestra'.$E30]) ->  | E41: of:=IF([.D41]<>"";IF(AND([.B41]<>"";[.C41]<>"");"";"ERR");"") -> 
B42: of:=IF( ISBLANK([$'03.Muestra'.$C31]);"";[$'03.Muestra'.$C31]) ->  | C42: of:=IF( ISBLANK([$'03.Muestra'.$E31]);"";[$'03.Muestra'.$E31]) ->  | E42: of:=IF([.D42]<>"";IF(AND([.B42]<>"";[.C42]<>"");"";"ERR");"") -> 
B43: of:=IF( ISBLANK([$'03.Muestra'.$C32]);"";[$'03.Muestra'.$C32]) ->  | C43: of:=IF( ISBLANK([$'03.Muestra'.$E32]);"";[$'03.Muestra'.$E32]) ->  | E43: of:=IF([.D43]<>"";IF(AND([.B43]<>"";[.C43]<>"");"";"ERR");"") -> 
B44: of:=IF( ISBLANK([$'03.Muestra'.$C33]);"";[$'03.Muestra'.$C33]) ->  | C44: of:=IF( ISBLANK([$'03.Muestra'.$E33]);"";[$'03.Muestra'.$E33]) ->  | E44: of:=IF([.D44]<>"";IF(AND([.B44]<>"";[.C44]<>"");"";"ERR");"") -> 
B45: of:=IF( ISBLANK([$'03.Muestra'.$C34]);"";[$'03.Muestra'.$C34]) ->  | C45: of:=IF( ISBLANK([$'03.Muestra'.$E34]);"";[$'03.Muestra'.$E34]) ->  | E45: of:=IF([.D45]<>"";IF(AND([.B45]<>"";[.C45]<>"");"";"ERR");"") -> 
B46: of:=IF( ISBLANK([$'03.Muestra'.$C35]);"";[$'03.Muestra'.$C35]) ->  | C46: of:=IF( ISBLANK([$'03.Muestra'.$E35]);"";[$'03.Muestra'.$E35]) ->  | E46: of:=IF([.D46]<>"";IF(AND([.B46]<>"";[.C46]<>"");"";"ERR");"") -> 
B47: of:=IF( ISBLANK([$'03.Muestra'.$C36]);"";[$'03.Muestra'.$C36]) ->  | C47: of:=IF( ISBLANK([$'03.Muestra'.$E36]);"";[$'03.Muestra'.$E36]) ->  | E47: of:=IF([.D47]<>"";IF(AND([.B47]<>"";[.C47]<>"");"";"ERR");"") -> 
B48: of:=IF( ISBLANK([$'03.Muestra'.$C37]);"";[$'03.Muestra'.$C37]) ->  | C48: of:=IF( ISBLANK([$'03.Muestra'.$E37]);"";[$'03.Muestra'.$E37]) ->  | E48: of:=IF([.D48]<>"";IF(AND([.B48]<>"";[.C48]<>"");"";"ERR");"") -> 
B49: of:=IF( ISBLANK([$'03.Muestra'.$C38]);"";[$'03.Muestra'.$C38]) ->  | C49: of:=IF( ISBLANK([$'03.Muestra'.$E38]);"";[$'03.Muestra'.$E38]) ->  | E49: of:=IF([.D49]<>"";IF(AND([.B49]<>"";[.C49]<>"");"";"ERR");"") -> 
B50: of:=IF( ISBLANK([$'03.Muestra'.$C39]);"";[$'03.Muestra'.$C39]) ->  | C50: of:=IF( ISBLANK([$'03.Muestra'.$E39]);"";[$'03.Muestra'.$E39]) ->  | E50: of:=IF([.D50]<>"";IF(AND([.B50]<>"";[.C50]<>"");"";"ERR");"") -> 
B51: of:=IF( ISBLANK([$'03.Muestra'.$C40]);"";[$'03.Muestra'.$C40]) ->  | C51: of:=IF( ISBLANK([$'03.Muestra'.$E40]);"";[$'03.Muestra'.$E40]) ->  | E51: of:=IF([.D51]<>"";IF(AND([.B51]<>"";[.C51]<>"");"";"ERR");"") -> 
B52: of:=IF( ISBLANK([$'03.Muestra'.$C41]);"";[$'03.Muestra'.$C41]) ->  | C52: of:=IF( ISBLANK([$'03.Muestra'.$E41]);"";[$'03.Muestra'.$E41]) ->  | E52: of:=IF([.D52]<>"";IF(AND([.B52]<>"";[.C52]<>"");"";"ERR");"") -> 
B53: of:=IF( ISBLANK([$'03.Muestra'.$C42]);"";[$'03.Muestra'.$C42]) ->  | C53: of:=IF( ISBLANK([$'03.Muestra'.$E42]);"";[$'03.Muestra'.$E42]) ->  | E53: of:=IF([.D53]<>"";IF(AND([.B53]<>"";[.C53]<>"");"";"ERR");"") -> 
B56: A | C56: 2.1.2 Sin trampas para el foco del teclado | D56: Resultado
B57: of:=IF( ISBLANK([$'03.Muestra'.$C8]);"";[$'03.Muestra'.$C8]) ->  | C57: of:=IF( ISBLANK([$'03.Muestra'.$E8]);"";[$'03.Muestra'.$E8]) ->  | E57: of:=IF([.D57]<>"";IF(AND([.B57]<>"";[.C57]<>"");"";"ERR");"") ->  | F57: N/T | G57: N/D | H57: N/A | I57: Falla | J57: Pasa | K57: En blanco
B58: of:=IF( ISBLANK([$'03.Muestra'.$C9]);"";[$'03.Muestra'.$C9]) ->  | C58: of:=IF( ISBLANK([$'03.Muestra'.$E9]);"";[$'03.Muestra'.$E9]) ->  | E58: of:=IF([.D58]<>"";IF(AND([.B58]<>"";[.C58]<>"");"";"ERR");"") ->  | F58: of:=COUNTIF([.$D57]:INDIRECT("$D" &  SUM(ROW()-1;[$'03.Muestra'.$D$45])-1);[.F57]) -> 0 | G58: of:=COUNTIF([.$D57]:INDIRECT("$D" &  SUM(ROW()-1;[$'03.Muestra'.$D$45])-1);[.G57]) -> 0 | H58: of:=COUNTIF([.$D57]:INDIRECT("$D" &  SUM(ROW()-1;[$'03.Muestra'.$D$45])-1);[.H57]) -> 0 | I58: of:=COUNTIF([.$D57]:INDIRECT("$D" &  SUM(ROW()-1;[$'03.Muestra'.$D$45])-1);[.I57]) -> 0 | J58: of:=COUNTIF([.$D57]:INDIRECT("$D" &  SUM(ROW()-1;[$'03.Muestra'.$D$45])-1);[.J57]) -> 0 | K58: of:=IF([$'03.Muestra'.$D$45]=0;0;COUNTBLANK([.$D57]:INDIRECT("$D" &  SUM(ROW()-1;[$'03.Muestra'.$D$45])-1))) -> 0
B59: of:=IF( ISBLANK([$'03.Muestra'.$C10]);"";[$'03.Muestra'.$C10]) ->  | C59: of:=IF( ISBLANK([$'03.Muestra'.$E10]);"";[$'03.Muestra'.$E10]) ->  | E59: of:=IF([.D59]<>"";IF(AND([.B59]<>"";[.C59]<>"");"";"ERR");"") -> 
B60: of:=IF( ISBLANK([$'03.Muestra'.$C11]);"";[$'03.Muestra'.$C11]) ->  | C60: of:=IF( ISBLANK([$'03.Muestra'.$E11]);"";[$'03.Muestra'.$E11]) ->  | E60: of:=IF([.D60]<>"";IF(AND([.B60]<>"";[.C60]<>"");"";"ERR");"") -> 
B61: of:=IF( ISBLANK([$'03.Muestra'.$C12]);"";[$'03.Muestra'.$C12]) ->  | C61: of:=IF( ISBLANK([$'03.Muestra'.$E12]);"";[$'03.Muestra'.$E12]) ->  | E61: of:=IF([.D61]<>"";IF(AND([.B61]<>"";[.C61]<>"");"";"ERR");"") -> 
B62: of:=IF( ISBLANK([$'03.Muestra'.$C13]);"";[$'03.Muestra'.$C13]) ->  | C62: of:=IF( ISBLANK([$'03.Muestra'.$E13]);"";[$'03.Muestra'.$E13]) ->  | E62: of:=IF([.D62]<>"";IF(AND([.B62]<>"";[.C62]<>"");"";"ERR");"") -> 
B63: of:=IF( ISBLANK([$'03.Muestra'.$C14]);"";[$'03.Muestra'.$C14]) ->  | C63: of:=IF( ISBLANK([$'03.Muestra'.$E14]);"";[$'03.Muestra'.$E14]) ->  | E63: of:=IF([.D63]<>"";IF(AND([.B63]<>"";[.C63]<>"");"";"ERR");"") -> 
B64: of:=IF( ISBLANK([$'03.Muestra'.$C15]);"";[$'03.Muestra'.$C15]) ->  | C64: of:=IF( ISBLANK([$'03.Muestra'.$E15]);"";[$'03.Muestra'.$E15]) ->  | E64: of:=IF([.D64]<>"";IF(AND([.B64]<>"";[.C64]<>"");"";"ERR");"") -> 
B65: of:=IF( ISBLANK([$'03.Muestra'.$C16]);"";[$'03.Muestra'.$C16]) ->  | C65: of:=IF( ISBLANK([$'03.Muestra'.$E16]);"";[$'03.Muestra'.$E16]) ->  | E65: of:=IF([.D65]<>"";IF(AND([.B65]<>"";[.C65]<>"");"";"ERR");"") -> 
B66: of:=IF( ISBLANK([$'03.Muestra'.$C17]);"";[$'03.Muestra'.$C17]) ->  | C66: of:=IF( ISBLANK([$'03.Muestra'.$E17]);"";[$'03.Muestra'.$E17]) ->  | E66: of:=IF([.D66]<>"";IF(AND([.B66]<>"";[.C66]<>"");"";"ERR");"") -> 
B67: of:=IF( ISBLANK([$'03.Muestra'.$C18]);"";[$'03.Muestra'.$C18]) ->  | C67: of:=IF( ISBLANK([$'03.Muestra'.$E18]);"";[$'03.Muestra'.$E18]) ->  | E67: of:=IF([.D67]<>"";IF(AND([.B67]<>"";[.C67]<>"");"";"ERR");"") -> 
B68: of:=IF( ISBLANK([$'03.Muestra'.$C19]);"";[$'03.Muestra'.$C19]) ->  | C68: of:=IF( ISBLANK([$'03.Muestra'.$E19]);"";[$'03.Muestra'.$E19]) ->  | E68: of:=IF([.D68]<>"";IF(AND([.B68]<>"";[.C68]<>"");"";"ERR");"") -> 
B69: of:=IF( ISBLANK([$'03.Muestra'.$C20]);"";[$'03.Muestra'.$C20]) ->  | C69: of:=IF( ISBLANK([$'03.Muestra'.$E20]);"";[$'03.Muestra'.$E20]) ->  | E69: of:=IF([.D69]<>"";IF(AND([.B69]<>"";[.C69]<>"");"";"ERR");"") -> 
B70: of:=IF( ISBLANK([$'03.Muestra'.$C21]);"";[$'03.Muestra'.$C21]) ->  | C70: of:=IF( ISBLANK([$'03.Muestra'.$E21]);"";[$'03.Muestra'.$E21]) ->  | E70: of:=IF([.D70]<>"";IF(AND([.B70]<>"";[.C70]<>"");"";"ERR");"") -> 
B71: of:=IF( ISBLANK([$'03.Muestra'.$C22]);"";[$'03.Muestra'.$C22]) ->  | C71: of:=IF( ISBLANK([$'03.Muestra'.$E22]);"";[$'03.Muestra'.$E22]) ->  | E71: of:=IF([.D71]<>"";IF(AND([.B71]<>"";[.C71]<>"");"";"ERR");"") -> 
B72: of:=IF( ISBLANK([$'03.Muestra'.$C23]);"";[$'03.Muestra'.$C23]) ->  | C72: of:=IF( ISBLANK([$'03.Muestra'.$E23]);"";[$'03.Muestra'.$E23]) ->  | E72: of:=IF([.D72]<>"";IF(AND([.B72]<>"";[.C72]<>"");"";"ERR");"") -> 
B73: of:=IF( ISBLANK([$'03.Muestra'.$C24]);"";[$'03.Muestra'.$C24]) ->  | C73: of:=IF( ISBLANK([$'03.Muestra'.$E24]);"";[$'03.Muestra'.$E24]) ->  | E73: of:=IF([.D73]<>"";IF(AND([.B73]<>"";[.C73]<>"");"";"ERR");"") -> 
B74: of:=IF( ISBLANK([$'03.Muestra'.$C25]);"";[$'03.Muestra'.$C25]) ->  | C74: of:=IF( ISBLANK([$'03.Muestra'.$E25]);"";[$'03.Muestra'.$E25]) ->  | E74: of:=IF([.D74]<>"";IF(AND([.B74]<>"";[.C74]<>"");"";"ERR");"") -> 
B75: of:=IF( ISBLANK([$'03.Muestra'.$C26]);"";[$'03.Muestra'.$C26]) ->  | C75: of:=IF( ISBLANK([$'03.Muestra'.$E26]);"";[$'03.Muestra'.$E26]) ->  | E75: of:=IF([.D75]<>"";IF(AND([.B75]<>"";[.C75]<>"");"";"ERR");"") -> 
B76: of:=IF( ISBLANK([$'03.Muestra'.$C27]);"";[$'03.Muestra'.$C27]) ->  | C76: of:=IF( ISBLANK([$'03.Muestra'.$E27]);"";[$'03.Muestra'.$E27]) ->  | E76: of:=IF([.D76]<>"";IF(AND([.B76]<>"";[.C76]<>"");"";"ERR");"") -> 
B77: of:=IF( ISBLANK([$'03.Muestra'.$C28]);"";[$'03.Muestra'.$C28]) ->  | C77: of:=IF( ISBLANK([$'03.Muestra'.$E28]);"";[$'03.Muestra'.$E28]) ->  | E77: of:=IF([.D77]<>"";IF(AND([.B77]<>"";[.C77]<>"");"";"ERR");"") -> 
B78: of:=IF( ISBLANK([$'03.Muestra'.$C29]);"";[$'03.Muestra'.$C29]) ->  | C78: of:=IF( ISBLANK([$'03.Muestra'.$E29]);"";[$'03.Muestra'.$E29]) ->  | E78: of:=IF([.D78]<>"";IF(AND([.B78]<>"";[.C78]<>"");"";"ERR");"") -> 
B79: of:=IF( ISBLANK([$'03.Muestra'.$C30]);"";[$'03.Muestra'.$C30]) ->  | C79: of:=IF( ISBLANK([$'03.Muestra'.$E30]);"";[$'03.Muestra'.$E30]) ->  | E79: of:=IF([.D79]<>"";IF(AND([.B79]<>"";[.C79]<>"");"";"ERR");"") -> 
B80: of:=IF( ISBLANK([$'03.Muestra'.$C31]);"";[$'03.Muestra'.$C31]) ->  | C80: of:=IF( ISBLANK([$'03.Muestra'.$E31]);"";[$'03.Muestra'.$E31]) ->  | E80: of:=IF([.D80]<>"";IF(AND([.B80]<>"";[.C80]<>"");"";"ERR");"") -> 
B81: of:=IF( ISBLANK([$'03.Muestra'.$C32]);"";[$'03.Muestra'.$C32]) ->  | C81: of:=IF( ISBLANK([$'03.Muestra'.$E32]);"";[$'03.Muestra'.$E32]) ->  | E81: of:=IF([.D81]<>"";IF(AND([.B81]<>"";[.C81]<>"");"";"ERR");"") -> 
B82: of:=IF( ISBLANK([$'03.Muestra'.$C33]);"";[$'03.Muestra'.$C33]) ->  | C82: of:=IF( ISBLANK([$'03.Muestra'.$E33]);"";[$'03.Muestra'.$E33]) ->  | E82: of:=IF([.D82]<>"";IF(AND([.B82]<>"";[.C82]<>"");"";"ERR");"") -> 
B83: of:=IF( ISBLANK([$'03.Muestra'.$C34]);"";[$'03.Muestra'.$C34]) ->  | C83: of:=IF( ISBLANK([$'03.Muestra'.$E34]);"";[$'03.Muestra'.$E34]) ->  | E83: of:=IF([.D83]<>"";IF(AND([.B83]<>"";[.C83]<>"");"";"ERR");"") -> 
B84: of:=IF( ISBLANK([$'03.Muestra'.$C35]);"";[$'03.Muestra'.$C35]) ->  | C84: of:=IF( ISBLANK([$'03.Muestra'.$E35]);"";[$'03.Muestra'.$E35]) ->  | E84: of:=IF([.D84]<>"";IF(AND([.B84]<>"";[.C84]<>"");"";"ERR");"") -> 
B85: of:=IF( ISBLANK([$'03.Muestra'.$C36]);"";[$'03.Muestra'.$C36]) ->  | C85: of:=IF( ISBLANK([$'03.Muestra'.$E36]);"";[$'03.Muestra'.$E36]) ->  | E85: of:=IF([.D85]<>"";IF(AND([.B85]<>"";[.C85]<>"");"";"ERR");"") -> 
B86: of:=IF( ISBLANK([$'03.Muestra'.$C37]);"";[$'03.Muestra'.$C37]) ->  | C86: of:=IF( ISBLANK([$'03.Muestra'.$E37]);"";[$'03.Muestra'.$E37]) ->  | E86: of:=IF([.D86]<>"";IF(AND([.B86]<>"";[.C86]<>"");"";"ERR");"") -> 
B87: of:=IF( ISBLANK([$'03.Muestra'.$C38]);"";[$'03.Muestra'.$C38]) ->  | C87: of:=IF( ISBLANK([$'03.Muestra'.$E38]);"";[$'03.Muestra'.$E38]) ->  | E87: of:=IF([.D87]<>"";IF(AND([.B87]<>"";[.C87]<>"");"";"ERR");"") -> 
B88: of:=IF( ISBLANK([$'03.Muestra'.$C39]);"";[$'03.Muestra'.$C39]) ->  | C88: of:=IF( ISBLANK([$'03.Muestra'.$E39]);"";[$'03.Muestra'.$E39]) ->  | E88: of:=IF([.D88]<>"";IF(AND([.B88]<>"";[.C88]<>"");"";"ERR");"") -> 
B89: of:=IF( ISBLANK([$'03.Muestra'.$C40]);"";[$'03.Muestra'.$C40]) ->  | C89: of:=IF( ISBLANK([$'03.Muestra'.$E40]);"";[$'03.Muestra'.$E40]) ->  | E89: of:=IF([.D89]<>"";IF(AND([.B89]<>"";[.C89]<>"");"";"ERR");"") -> 
B90: of:=IF( ISBLANK([$'03.Muestra'.$C41]);"";[$'03.Muestra'.$C41]) ->  | C90: of:=IF( ISBLANK([$'03.Muestra'.$E41]);"";[$'03.Muestra'.$E41]) ->  | E90: of:=IF([.D90]<>"";IF(AND([.B90]<>"";[.C90]<>"");"";"ERR");"") -> 
B91: of:=IF( ISBLANK([$'03.Muestra'.$C42]);"";[$'03.Muestra'.$C42]) ->  | C91: of:=IF( ISBLANK([$'03.Muestra'.$E42]);"";[$'03.Muestra'.$E42]) ->  | E91: of:=IF([.D91]<>"";IF(AND([.B91]<>"";[.C91]<>"");"";"ERR");"") -> 
B94: A | C94: 2.1.4 Atajos con teclas de caracteres | D94: Resultado
B95: of:=IF( ISBLANK([$'03.Muestra'.$C8]);"";[$'03.Muestra'.$C8]) ->  | C95: of:=IF( ISBLANK([$'03.Muestra'.$E8]);"";[$'03.Muestra'.$E8]) ->  | E95: of:=IF([.D95]<>"";IF(AND([.B95]<>"";[.C95]<>"");"";"ERR");"") ->  | F95: N/T | G95: N/D | H95: N/A | I95: Falla | J95: Pasa | K95: En blanco
B96: of:=IF( ISBLANK([$'03.Muestra'.$C9]);"";[$'03.Muestra'.$C9]) ->  | C96: of:=IF( ISBLANK([$'03.Muestra'.$E9]);"";[$'03.Muestra'.$E9]) ->  | E96: of:=IF([.D96]<>"";IF(AND([.B96]<>"";[.C96]<>"");"";"ERR");"") ->  | F96: of:=COUNTIF([.$D95]:INDIRECT("$D" &  SUM(ROW()-1;[$'03.Muestra'.$D$45])-1);[.F95]) -> 0 | G96: of:=COUNTIF([.$D95]:INDIRECT("$D" &  SUM(ROW()-1;[$'03.Muestra'.$D$45])-1);[.G95]) -> 0 | H96: of:=COUNTIF([.$D95]:INDIRECT("$D" &  SUM(ROW()-1;[$'03.Muestra'.$D$45])-1);[.H95]) -> 0 | I96: of:=COUNTIF([.$D95]:INDIRECT("$D" &  SUM(ROW()-1;[$'03.Muestra'.$D$45])-1);[.I95]) -> 0 | J96: of:=COUNTIF([.$D95]:INDIRECT("$D" &  SUM(ROW()-1;[$'03.Muestra'.$D$45])-1);[.J95]) -> 0 | K96: of:=IF([$'03.Muestra'.$D$45]=0;0;COUNTBLANK([.$D95]:INDIRECT("$D" &  SUM(ROW()-1;[$'03.Muestra'.$D$45])-1))) -> 0
B97: of:=IF( ISBLANK([$'03.Muestra'.$C10]);"";[$'03.Muestra'.$C10]) ->  | C97: of:=IF( ISBLANK([$'03.Muestra'.$E10]);"";[$'03.Muestra'.$E10]) ->  | E97: of:=IF([.D97]<>"";IF(AND([.B97]<>"";[.C97]<>"");"";"ERR");"") -> 
B98: of:=IF( ISBLANK([$'03.Muestra'.$C11]);"";[$'03.Muestra'.$C11]) ->  | C98: of:=IF( ISBLANK([$'03.Muestra'.$E11]);"";[$'03.Muestra'.$E11]) ->  | E98: of:=IF([.D98]<>"";IF(AND([.B98]<>"";[.C98]<>"");"";"ERR");"") -> 
B99: of:=IF( ISBLANK([$'03.Muestra'.$C12]);"";[$'03.Muestra'.$C12]) ->  | C99: of:=IF( ISBLANK([$'03.Muestra'.$E12]);"";[$'03.Muestra'.$E12]) ->  | E99: of:=IF([.D99]<>"";IF(AND([.B99]<>"";[.C99]<>"");"";"ERR");"") -> 
B100: of:=IF( ISBLANK([$'03.Muestra'.$C13]);"";[$'03.Muestra'.$C13]) ->  | C100: of:=IF( ISBLANK([$'03.Muestra'.$E13]);"";[$'03.Muestra'.$E13]) ->  | E100: of:=IF([.D100]<>"";IF(AND([.B100]<>"";[.C100]<>"");"";"ERR");"") -> 
B101: of:=IF( ISBLANK([$'03.Muestra'.$C14]);"";[$'03.Muestra'.$C14]) ->  | C101: of:=IF( ISBLANK([$'03.Muestra'.$E14]);"";[$'03.Muestra'.$E14]) ->  | E101: of:=IF([.D101]<>"";IF(AND([.B101]<>"";[.C101]<>"");"";"ERR");"") -> 
B102: of:=IF( ISBLANK([$'03.Muestra'.$C15]);"";[$'03.Muestra'.$C15]) ->  | C102: of:=IF( ISBLANK([$'03.Muestra'.$E15]);"";[$'03.Muestra'.$E15]) ->  | E102: of:=IF([.D102]<>"";IF(AND([.B102]<>"";[.C102]<>"");"";"ERR");"") -> 
B103: of:=IF( ISBLANK([$'03.Muestra'.$C16]);"";[$'03.Muestra'.$C16]) ->  | C103: of:=IF( ISBLANK([$'03.Muestra'.$E16]);"";[$'03.Muestra'.$E16]) ->  | E103: of:=IF([.D103]<>"";IF(AND([.B103]<>"";[.C103]<>"");"";"ERR");"") -> 
B104: of:=IF( ISBLANK([$'03.Muestra'.$C17]);"";[$'03.Muestra'.$C17]) ->  | C104: of:=IF( ISBLANK([$'03.Muestra'.$E17]);"";[$'03.Muestra'.$E17]) ->  | E104: of:=IF([.D104]<>"";IF(AND([.B104]<>"";[.C104]<>"");"";"ERR");"") -> 
B105: of:=IF( ISBLANK([$'03.Muestra'.$C18]);"";[$'03.Muestra'.$C18]) ->  | C105: of:=IF( ISBLANK([$'03.Muestra'.$E18]);"";[$'03.Muestra'.$E18]) ->  | E105: of:=IF([.D105]<>"";IF(AND([.B105]<>"";[.C105]<>"");"";"ERR");"") -> 
B106: of:=IF( ISBLANK([$'03.Muestra'.$C19]);"";[$'03.Muestra'.$C19]) ->  | C106: of:=IF( ISBLANK([$'03.Muestra'.$E19]);"";[$'03.Muestra'.$E19]) ->  | E106: of:=IF([.D106]<>"";IF(AND([.B106]<>"";[.C106]<>"");"";"ERR");"") -> 
B107: of:=IF( ISBLANK([$'03.Muestra'.$C20]);"";[$'03.Muestra'.$C20]) ->  | C107: of:=IF( ISBLANK([$'03.Muestra'.$E20]);"";[$'03.Muestra'.$E20]) ->  | E107: of:=IF([.D107]<>"";IF(AND([.B107]<>"";[.C107]<>"");"";"ERR");"") -> 
B108: of:=IF( ISBLANK([$'03.Muestra'.$C21]);"";[$'03.Muestra'.$C21]) ->  | C108: of:=IF( ISBLANK([$'03.Muestra'.$E21]);"";[$'03.Muestra'.$E21]) ->  | E108: of:=IF([.D108]<>"";IF(AND([.B108]<>"";[.C108]<>"");"";"ERR");"") -> 
B109: of:=IF( ISBLANK([$'03.Muestra'.$C22]);"";[$'03.Muestra'.$C22]) ->  | C109: of:=IF( ISBLANK([$'03.Muestra'.$E22]);"";[$'03.Muestra'.$E22]) ->  | E109: of:=IF([.D109]<>"";IF(AND([.B109]<>"";[.C109]<>"");"";"ERR");"") -> 
B110: of:=IF( ISBLANK([$'03.Muestra'.$C23]);"";[$'03.Muestra'.$C23]) ->  | C110: of:=IF( ISBLANK([$'03.Muestra'.$E23]);"";[$'03.Muestra'.$E23]) ->  | E110: of:=IF([.D110]<>"";IF(AND([.B110]<>"";[.C110]<>"");"";"ERR");"") -> 
B111: of:=IF( ISBLANK([$'03.Muestra'.$C24]);"";[$'03.Muestra'.$C24]) ->  | C111: of:=IF( ISBLANK([$'03.Muestra'.$E24]);"";[$'03.Muestra'.$E24]) ->  | E111: of:=IF([.D111]<>"";IF(AND([.B111]<>"";[.C111]<>"");"";"ERR");"") -> 
B112: of:=IF( ISBLANK([$'03.Muestra'.$C25]);"";[$'03.Muestra'.$C25]) ->  | C112: of:=IF( ISBLANK([$'03.Muestra'.$E25]);"";[$'03.Muestra'.$E25]) ->  | E112: of:=IF([.D112]<>"";IF(AND([.B112]<>"";[.C112]<>"");"";"ERR");"") -> 
B113: of:=IF( ISBLANK([$'03.Muestra'.$C26]);"";[$'03.Muestra'.$C26]) ->  | C113: of:=IF( ISBLANK([$'03.Muestra'.$E26]);"";[$'03.Muestra'.$E26]) ->  | E113: of:=IF([.D113]<>"";IF(AND([.B113]<>"";[.C113]<>"");"";"ERR");"") -> 
B114: of:=IF( ISBLANK([$'03.Muestra'.$C27]);"";[$'03.Muestra'.$C27]) ->  | C114: of:=IF( ISBLANK([$'03.Muestra'.$E27]);"";[$'03.Muestra'.$E27]) ->  | E114: of:=IF([.D114]<>"";IF(AND([.B114]<>"";[.C114]<>"");"";"ERR");"") -> 
B115: of:=IF( ISBLANK([$'03.Muestra'.$C28]);"";[$'03.Muestra'.$C28]) ->  | C115: of:=IF( ISBLANK([$'03.Muestra'.$E28]);"";[$'03.Muestra'.$E28]) ->  | E115: of:=IF([.D115]<>"";IF(AND([.B115]<>"";[.C115]<>"");"";"ERR");"") -> 
B116: of:=IF( ISBLANK([$'03.Muestra'.$C29]);"";[$'03.Muestra'.$C29]) ->  | C116: of:=IF( ISBLANK([$'03.Muestra'.$E29]);"";[$'03.Muestra'.$E29]) ->  | E116: of:=IF([.D116]<>"";IF(AND([.B116]<>"";[.C116]<>"");"";"ERR");"") -> 
B117: of:=IF( ISBLANK([$'03.Muestra'.$C30]);"";[$'03.Muestra'.$C30]) ->  | C117: of:=IF( ISBLANK([$'03.Muestra'.$E30]);"";[$'03.Muestra'.$E30]) ->  | E117: of:=IF([.D117]<>"";IF(AND([.B117]<>"";[.C117]<>"");"";"ERR");"") -> 
B118: of:=IF( ISBLANK([$'03.Muestra'.$C31]);"";[$'03.Muestra'.$C31]) ->  | C118: of:=IF( ISBLANK([$'03.Muestra'.$E31]);"";[$'03.Muestra'.$E31]) ->  | E118: of:=IF([.D118]<>"";IF(AND([.B118]<>"";[.C118]<>"");"";"ERR");"") -> 
B119: of:=IF( ISBLANK([$'03.Muestra'.$C32]);"";[$'03.Muestra'.$C32]) ->  | C119: of:=IF( ISBLANK([$'03.Muestra'.$E32]);"";[$'03.Muestra'.$E32]) ->  | E119: of:=IF([.D119]<>"";IF(AND([.B119]<>"";[.C119]<>"");"";"ERR");"") -> 
B120: of:=IF( ISBLANK([$'03.Muestra'.$C33]);"";[$'03.Muestra'.$C33]) ->  | C120: of:=IF( ISBLANK([$'03.Muestra'.$E33]);"";[$'03.Muestra'.$E33]) ->  | E120: of:=IF([.D120]<>"";IF(AND([.B120]<>"";[.C120]<>"");"";"ERR");"") -> 
B121: of:=IF( ISBLANK([$'03.Muestra'.$C34]);"";[$'03.Muestra'.$C34]) ->  | C121: of:=IF( ISBLANK([$'03.Muestra'.$E34]);"";[$'03.Muestra'.$E34]) ->  | E121: of:=IF([.D121]<>"";IF(AND([.B121]<>"";[.C121]<>"");"";"ERR");"") -> 
B122: of:=IF( ISBLANK([$'03.Muestra'.$C35]);"";[$'03.Muestra'.$C35]) ->  | C122: of:=IF( ISBLANK([$'03.Muestra'.$E35]);"";[$'03.Muestra'.$E35]) ->  | E122: of:=IF([.D122]<>"";IF(AND([.B122]<>"";[.C122]<>"");"";"ERR");"") -> 
B123: of:=IF( ISBLANK([$'03.Muestra'.$C36]);"";[$'03.Muestra'.$C36]) ->  | C123: of:=IF( ISBLANK([$'03.Muestra'.$E36]);"";[$'03.Muestra'.$E36]) ->  | E123: of:=IF([.D123]<>"";IF(AND([.B123]<>"";[.C123]<>"");"";"ERR");"") -> 
B124: of:=IF( ISBLANK([$'03.Muestra'.$C37]);"";[$'03.Muestra'.$C37]) ->  | C124: of:=IF( ISBLANK([$'03.Muestra'.$E37]);"";[$'03.Muestra'.$E37]) ->  | E124: of:=IF([.D124]<>"";IF(AND([.B124]<>"";[.C124]<>"");"";"ERR");"") -> 
B125: of:=IF( ISBLANK([$'03.Muestra'.$C38]);"";[$'03.Muestra'.$C38]) ->  | C125: of:=IF( ISBLANK([$'03.Muestra'.$E38]);"";[$'03.Muestra'.$E38]) ->  | E125: of:=IF([.D125]<>"";IF(AND([.B125]<>"";[.C125]<>"");"";"ERR");"") -> 
B126: of:=IF( ISBLANK([$'03.Muestra'.$C39]);"";[$'03.Muestra'.$C39]) ->  | C126: of:=IF( ISBLANK([$'03.Muestra'.$E39]);"";[$'03.Muestra'.$E39]) ->  | E126: of:=IF([.D126]<>"";IF(AND([.B126]<>"";[.C126]<>"");"";"ERR");"") -> 
B127: of:=IF( ISBLANK([$'03.Muestra'.$C40]);"";[$'03.Muestra'.$C40]) ->  | C127: of:=IF( ISBLANK([$'03.Muestra'.$E40]);"";[$'03.Muestra'.$E40]) ->  | E127: of:=IF([.D127]<>"";IF(AND([.B127]<>"";[.C127]<>"");"";"ERR");"") -> 
B128: of:=IF( ISBLANK([$'03.Muestra'.$C41]);"";[$'03.Muestra'.$C41]) ->  | C128: of:=IF( ISBLANK([$'03.Muestra'.$E41]);"";[$'03.Muestra'.$E41]) ->  | E128: of:=IF([.D128]<>"";IF(AND([.B128]<>"";[.C128]<>"");"";"ERR");"") -> 
B129: of:=IF( ISBLANK([$'03.Muestra'.$C42]);"";[$'03.Muestra'.$C42]) ->  | C129: of:=IF( ISBLANK([$'03.Muestra'.$E42]);"";[$'03.Muestra'.$E42]) ->  | E129: of:=IF([.D129]<>"";IF(AND([.B129]<>"";[.C129]<>"");"";"ERR");"") -> 
B132: A | C132: 2.2.1 Tiempo ajustable | D132: Resultado
B133: of:=IF( ISBLANK([$'03.Muestra'.$C8]);"";[$'03.Muestra'.$C8]) ->  | C133: of:=IF( ISBLANK([$'03.Muestra'.$E8]);"";[$'03.Muestra'.$E8]) ->  | E133: of:=IF([.D133]<>"";IF(AND([.B133]<>"";[.C133]<>"");"";"ERR");"") ->  | F133: N/T | G133: N/D | H133: N/A | I133: Falla | J133: Pasa | K133: En blanco
B134: of:=IF( ISBLANK([$'03.Muestra'.$C9]);"";[$'03.Muestra'.$C9]) ->  | C134: of:=IF( ISBLANK([$'03.Muestra'.$E9]);"";[$'03.Muestra'.$E9]) ->  | E134: of:=IF([.D134]<>"";IF(AND([.B134]<>"";[.C134]<>"");"";"ERR");"") ->  | F134: of:=COUNTIF([.$D133]:INDIRECT("$D" &  SUM(ROW()-1;[$'03.Muestra'.$D$45])-1);[.F133]) -> 0 | G134: of:=COUNTIF([.$D133]:INDIRECT("$D" &  SUM(ROW()-1;[$'03.Muestra'.$D$45])-1);[.G133]) -> 0 | H134: of:=COUNTIF([.$D133]:INDIRECT("$D" &  SUM(ROW()-1;[$'03.Muestra'.$D$45])-1);[.H133]) -> 0 | I134: of:=COUNTIF([.$D133]:INDIRECT("$D" &  SUM(ROW()-1;[$'03.Muestra'.$D$45])-1);[.I133]) -> 0 | J134: of:=COUNTIF([.$D133]:INDIRECT("$D" &  SUM(ROW()-1;[$'03.Muestra'.$D$45])-1);[.J133]) -> 0 | K134: of:=IF([$'03.Muestra'.$D$45]=0;0;COUNTBLANK([.$D133]:INDIRECT("$D" &  SUM(ROW()-1;[$'03.Muestra'.$D$45])-1))) -> 0
B135: of:=IF( ISBLANK([$'03.Muestra'.$C10]);"";[$'03.Muestra'.$C10]) ->  | C135: of:=IF( ISBLANK([$'03.Muestra'.$E10]);"";[$'03.Muestra'.$E10]) ->  | E135: of:=IF([.D135]<>"";IF(AND([.B135]<>"";[.C135]<>"");"";"ERR");"") -> 
B136: of:=IF( ISBLANK([$'03.Muestra'.$C11]);"";[$'03.Muestra'.$C11]) ->  | C136: of:=IF( ISBLANK([$'03.Muestra'.$E11]);"";[$'03.Muestra'.$E11]) ->  | E136: of:=IF([.D136]<>"";IF(AND([.B136]<>"";[.C136]<>"");"";"ERR");"") -> 
B137: of:=IF( ISBLANK([$'03.Muestra'.$C12]);"";[$'03.Muestra'.$C12]) ->  | C137: of:=IF( ISBLANK([$'03.Muestra'.$E12]);"";[$'03.Muestra'.$E12]) ->  | E137: of:=IF([.D137]<>"";IF(AND([.B137]<>"";[.C137]<>"");"";"ERR");"") -> 
B138: of:=IF( ISBLANK([$'03.Muestra'.$C13]);"";[$'03.Muestra'.$C13]) ->  | C138: of:=IF( ISBLANK([$'03.Muestra'.$E13]);"";[$'03.Muestra'.$E13]) ->  | E138: of:=IF([.D138]<>"";IF(AND([.B138]<>"";[.C138]<>"");"";"ERR");"") -> 
B139: of:=IF( ISBLANK([$'03.Muestra'.$C14]);"";[$'03.Muestra'.$C14]) ->  | C139: of:=IF( ISBLANK([$'03.Muestra'.$E14]);"";[$'03.Muestra'.$E14]) ->  | E139: of:=IF([.D139]<>"";IF(AND([.B139]<>"";[.C139]<>"");"";"ERR");"") -> 
B140: of:=IF( ISBLANK([$'03.Muestra'.$C15]);"";[$'03.Muestra'.$C15]) ->  | C140: of:=IF( ISBLANK([$'03.Muestra'.$E15]);"";[$'03.Muestra'.$E15]) ->  | E140: of:=IF([.D140]<>"";IF(AND([.B140]<>"";[.C140]<>"");"";"ERR");"") -> 
B141: of:=IF( ISBLANK([$'03.Muestra'.$C16]);"";[$'03.Muestra'.$C16]) ->  | C141: of:=IF( ISBLANK([$'03.Muestra'.$E16]);"";[$'03.Muestra'.$E16]) ->  | E141: of:=IF([.D141]<>"";IF(AND([.B141]<>"";[.C141]<>"");"";"ERR");"") -> 
B142: of:=IF( ISBLANK([$'03.Muestra'.$C17]);"";[$'03.Muestra'.$C17]) ->  | C142: of:=IF( ISBLANK([$'03.Muestra'.$E17]);"";[$'03.Muestra'.$E17]) ->  | E142: of:=IF([.D142]<>"";IF(AND([.B142]<>"";[.C142]<>"");"";"ERR");"") -> 
B143: of:=IF( ISBLANK([$'03.Muestra'.$C18]);"";[$'03.Muestra'.$C18]) ->  | C143: of:=IF( ISBLANK([$'03.Muestra'.$E18]);"";[$'03.Muestra'.$E18]) ->  | E143: of:=IF([.D143]<>"";IF(AND([.B143]<>"";[.C143]<>"");"";"ERR");"") -> 
B144: of:=IF( ISBLANK([$'03.Muestra'.$C19]);"";[$'03.Muestra'.$C19]) ->  | C144: of:=IF( ISBLANK([$'03.Muestra'.$E19]);"";[$'03.Muestra'.$E19]) ->  | E144: of:=IF([.D144]<>"";IF(AND([.B144]<>"";[.C144]<>"");"";"ERR");"") -> 
B145: of:=IF( ISBLANK([$'03.Muestra'.$C20]);"";[$'03.Muestra'.$C20]) ->  | C145: of:=IF( ISBLANK([$'03.Muestra'.$E20]);"";[$'03.Muestra'.$E20]) ->  | E145: of:=IF([.D145]<>"";IF(AND([.B145]<>"";[.C145]<>"");"";"ERR");"") -> 
B146: of:=IF( ISBLANK([$'03.Muestra'.$C21]);"";[$'03.Muestra'.$C21]) ->  | C146: of:=IF( ISBLANK([$'03.Muestra'.$E21]);"";[$'03.Muestra'.$E21]) ->  | E146: of:=IF([.D146]<>"";IF(AND([.B146]<>"";[.C146]<>"");"";"ERR");"") -> 
B147: of:=IF( ISBLANK([$'03.Muestra'.$C22]);"";[$'03.Muestra'.$C22]) ->  | C147: of:=IF( ISBLANK([$'03.Muestra'.$E22]);"";[$'03.Muestra'.$E22]) ->  | E147: of:=IF([.D147]<>"";IF(AND([.B147]<>"";[.C147]<>"");"";"ERR");"") -> 
B148: of:=IF( ISBLANK([$'03.Muestra'.$C23]);"";[$'03.Muestra'.$C23]) ->  | C148: of:=IF( ISBLANK([$'03.Muestra'.$E23]);"";[$'03.Muestra'.$E23]) ->  | E148: of:=IF([.D148]<>"";IF(AND([.B148]<>"";[.C148]<>"");"";"ERR");"") -> 
B149: of:=IF( ISBLANK([$'03.Muestra'.$C24]);"";[$'03.Muestra'.$C24]) ->  | C149: of:=IF( ISBLANK([$'03.Muestra'.$E24]);"";[$'03.Muestra'.$E24]) ->  | E149: of:=IF([.D149]<>"";IF(AND([.B149]<>"";[.C149]<>"");"";"ERR");"") -> 
B150: of:=IF( ISBLANK([$'03.Muestra'.$C25]);"";[$'03.Muestra'.$C25]) ->  | C150: of:=IF( ISBLANK([$'03.Muestra'.$E25]);"";[$'03.Muestra'.$E25]) ->  | E150: of:=IF([.D150]<>"";IF(AND([.B150]<>"";[.C150]<>"");"";"ERR");"") -> 
B151: of:=IF( ISBLANK([$'03.Muestra'.$C26]);"";[$'03.Muestra'.$C26]) ->  | C151: of:=IF( ISBLANK([$'03.Muestra'.$E26]);"";[$'03.Muestra'.$E26]) ->  | E151: of:=IF([.D151]<>"";IF(AND([.B151]<>"";[.C151]<>"");"";"ERR");"") -> 
B152: of:=IF( ISBLANK([$'03.Muestra'.$C27]);"";[$'03.Muestra'.$C27]) ->  | C152: of:=IF( ISBLANK([$'03.Muestra'.$E27]);"";[$'03.Muestra'.$E27]) ->  | E152: of:=IF([.D152]<>"";IF(AND([.B152]<>"";[.C152]<>"");"";"ERR");"") -> 
B153: of:=IF( ISBLANK([$'03.Muestra'.$C28]);"";[$'03.Muestra'.$C28]) ->  | C153: of:=IF( ISBLANK([$'03.Muestra'.$E28]);"";[$'03.Muestra'.$E28]) ->  | E153: of:=IF([.D153]<>"";IF(AND([.B153]<>"";[.C153]<>"");"";"ERR");"") -> 
B154: of:=IF( ISBLANK([$'03.Muestra'.$C29]);"";[$'03.Muestra'.$C29]) ->  | C154: of:=IF( ISBLANK([$'03.Muestra'.$E29]);"";[$'03.Muestra'.$E29]) ->  | E154: of:=IF([.D154]<>"";IF(AND([.B154]<>"";[.C154]<>"");"";"ERR");"") -> 
B155: of:=IF( ISBLANK([$'03.Muestra'.$C30]);"";[$'03.Muestra'.$C30]) ->  | C155: of:=IF( ISBLANK([$'03.Muestra'.$E30]);"";[$'03.Muestra'.$E30]) ->  | E155: of:=IF([.D155]<>"";IF(AND([.B155]<>"";[.C155]<>"");"";"ERR");"") -> 
B156: of:=IF( ISBLANK([$'03.Muestra'.$C31]);"";[$'03.Muestra'.$C31]) ->  | C156: of:=IF( ISBLANK([$'03.Muestra'.$E31]);"";[$'03.Muestra'.$E31]) ->  | E156: of:=IF([.D156]<>"";IF(AND([.B156]<>"";[.C156]<>"");"";"ERR");"") -> 
B157: of:=IF( ISBLANK([$'03.Muestra'.$C32]);"";[$'03.Muestra'.$C32]) ->  | C157: of:=IF( ISBLANK([$'03.Muestra'.$E32]);"";[$'03.Muestra'.$E32]) ->  | E157: of:=IF([.D157]<>"";IF(AND([.B157]<>"";[.C157]<>"");"";"ERR");"") -> 
B158: of:=IF( ISBLANK([$'03.Muestra'.$C33]);"";[$'03.Muestra'.$C33]) ->  | C158: of:=IF( ISBLANK([$'03.Muestra'.$E33]);"";[$'03.Muestra'.$E33]) ->  | E158: of:=IF([.D158]<>"";IF(AND([.B158]<>"";[.C158]<>"");"";"ERR");"") -> 
B159: of:=IF( ISBLANK([$'03.Muestra'.$C34]);"";[$'03.Muestra'.$C34]) ->  | C159: of:=IF( ISBLANK([$'03.Muestra'.$E34]);"";[$'03.Muestra'.$E34]) ->  | E159: of:=IF([.D159]<>"";IF(AND([.B159]<>"";[.C159]<>"");"";"ERR");"") -> 
B160: of:=IF( ISBLANK([$'03.Muestra'.$C35]);"";[$'03.Muestra'.$C35]) ->  | C160: of:=IF( ISBLANK([$'03.Muestra'.$E35]);"";[$'03.Muestra'.$E35]) ->  | E160: of:=IF([.D160]<>"";IF(AND([.B160]<>"";[.C160]<>"");"";"ERR");"") -> 
B161: of:=IF( ISBLANK([$'03.Muestra'.$C36]);"";[$'03.Muestra'.$C36]) ->  | C161: of:=IF( ISBLANK([$'03.Muestra'.$E36]);"";[$'03.Muestra'.$E36]) ->  | E161: of:=IF([.D161]<>"";IF(AND([.B161]<>"";[.C161]<>"");"";"ERR");"") -> 
B162: of:=IF( ISBLANK([$'03.Muestra'.$C37]);"";[$'03.Muestra'.$C37]) ->  | C162: of:=IF( ISBLANK([$'03.Muestra'.$E37]);"";[$'03.Muestra'.$E37]) ->  | E162: of:=IF([.D162]<>"";IF(AND([.B162]<>"";[.C162]<>"");"";"ERR");"") -> 
B163: of:=IF( ISBLANK([$'03.Muestra'.$C38]);"";[$'03.Muestra'.$C38]) ->  | C163: of:=IF( ISBLANK([$'03.Muestra'.$E38]);"";[$'03.Muestra'.$E38]) ->  | E163: of:=IF([.D163]<>"";IF(AND([.B163]<>"";[.C163]<>"");"";"ERR");"") -> 
B164: of:=IF( ISBLANK([$'03.Muestra'.$C39]);"";[$'03.Muestra'.$C39]) ->  | C164: of:=IF( ISBLANK([$'03.Muestra'.$E39]);"";[$'03.Muestra'.$E39]) ->  | E164: of:=IF([.D164]<>"";IF(AND([.B164]<>"";[.C164]<>"");"";"ERR");"") -> 
B165: of:=IF( ISBLANK([$'03.Muestra'.$C40]);"";[$'03.Muestra'.$C40]) ->  | C165: of:=IF( ISBLANK([$'03.Muestra'.$E40]);"";[$'03.Muestra'.$E40]) ->  | E165: of:=IF([.D165]<>"";IF(AND([.B165]<>"";[.C165]<>"");"";"ERR");"") -> 
B166: of:=IF( ISBLANK([$'03.Muestra'.$C41]);"";[$'03.Muestra'.$C41]) ->  | C166: of:=IF( ISBLANK([$'03.Muestra'.$E41]);"";[$'03.Muestra'.$E41]) ->  | E166: of:=IF([.D166]<>"";IF(AND([.B166]<>"";[.C166]<>"");"";"ERR");"") -> 
B167: of:=IF( ISBLANK([$'03.Muestra'.$C42]);"";[$'03.Muestra'.$C42]) ->  | C167: of:=IF( ISBLANK([$'03.Muestra'.$E42]);"";[$'03.Muestra'.$E42]) ->  | E167: of:=IF([.D167]<>"";IF(AND([.B167]<>"";[.C167]<>"");"";"ERR");"") -> 
B170: A | C170: 2.2.2 Poner en pausa, detener, ocultar | D170: Resultado
B171: of:=IF( ISBLANK([$'03.Muestra'.$C8]);"";[$'03.Muestra'.$C8]) ->  | C171: of:=IF( ISBLANK([$'03.Muestra'.$E8]);"";[$'03.Muestra'.$E8]) ->  | E171: of:=IF([.D171]<>"";IF(AND([.B171]<>"";[.C171]<>"");"";"ERR");"") ->  | F171: N/T | G171: N/D | H171: N/A | I171: Falla | J171: Pasa | K171: En blanco
B172: of:=IF( ISBLANK([$'03.Muestra'.$C9]);"";[$'03.Muestra'.$C9]) ->  | C172: of:=IF( ISBLANK([$'03.Muestra'.$E9]);"";[$'03.Muestra'.$E9]) ->  | E172: of:=IF([.D172]<>"";IF(AND([.B172]<>"";[.C172]<>"");"";"ERR");"") ->  | F172: of:=COUNTIF([.$D171]:INDIRECT("$D" &  SUM(ROW()-1;[$'03.Muestra'.$D$45])-1);[.F171]) -> 0 | G172: of:=COUNTIF([.$D171]:INDIRECT("$D" &  SUM(ROW()-1;[$'03.Muestra'.$D$45])-1);[.G171]) -> 0 | H172: of:=COUNTIF([.$D171]:INDIRECT("$D" &  SUM(ROW()-1;[$'03.Muestra'.$D$45])-1);[.H171]) -> 0 | I172: of:=COUNTIF([.$D171]:INDIRECT("$D" &  SUM(ROW()-1;[$'03.Muestra'.$D$45])-1);[.I171]) -> 0 | J172: of:=COUNTIF([.$D171]:INDIRECT("$D" &  SUM(ROW()-1;[$'03.Muestra'.$D$45])-1);[.J171]) -> 0 | K172: of:=IF([$'03.Muestra'.$D$45]=0;0;COUNTBLANK([.$D171]:INDIRECT("$D" &  SUM(ROW()-1;[$'03.Muestra'.$D$45])-1))) -> 0
B173: of:=IF( ISBLANK([$'03.Muestra'.$C10]);"";[$'03.Muestra'.$C10]) ->  | C173: of:=IF( ISBLANK([$'03.Muestra'.$E10]);"";[$'03.Muestra'.$E10]) ->  | E173: of:=IF([.D173]<>"";IF(AND([.B173]<>"";[.C173]<>"");"";"ERR");"") -> 
B174: of:=IF( ISBLANK([$'03.Muestra'.$C11]);"";[$'03.Muestra'.$C11]) ->  | C174: of:=IF( ISBLANK([$'03.Muestra'.$E11]);"";[$'03.Muestra'.$E11]) ->  | E174: of:=IF([.D174]<>"";IF(AND([.B174]<>"";[.C174]<>"");"";"ERR");"") -> 
B175: of:=IF( ISBLANK([$'03.Muestra'.$C12]);"";[$'03.Muestra'.$C12]) ->  | C175: of:=IF( ISBLANK([$'03.Muestra'.$E12]);"";[$'03.Muestra'.$E12]) ->  | E175: of:=IF([.D175]<>"";IF(AND([.B175]<>"";[.C175]<>"");"";"ERR");"") -> 
B176: of:=IF( ISBLANK([$'03.Muestra'.$C13]);"";[$'03.Muestra'.$C13]) ->  | C176: of:=IF( ISBLANK([$'03.Muestra'.$E13]);"";[$'03.Muestra'.$E13]) ->  | E176: of:=IF([.D176]<>"";IF(AND([.B176]<>"";[.C176]<>"");"";"ERR");"") -> 
B177: of:=IF( ISBLANK([$'03.Muestra'.$C14]);"";[$'03.Muestra'.$C14]) ->  | C177: of:=IF( ISBLANK([$'03.Muestra'.$E14]);"";[$'03.Muestra'.$E14]) ->  | E177: of:=IF([.D177]<>"";IF(AND([.B177]<>"";[.C177]<>"");"";"ERR");"") -> 
B178: of:=IF( ISBLANK([$'03.Muestra'.$C15]);"";[$'03.Muestra'.$C15]) ->  | C178: of:=IF( ISBLANK([$'03.Muestra'.$E15]);"";[$'03.Muestra'.$E15]) ->  | E178: of:=IF([.D178]<>"";IF(AND([.B178]<>"";[.C178]<>"");"";"ERR");"") -> 
B179: of:=IF( ISBLANK([$'03.Muestra'.$C16]);"";[$'03.Muestra'.$C16]) ->  | C179: of:=IF( ISBLANK([$'03.Muestra'.$E16]);"";[$'03.Muestra'.$E16]) ->  | E179: of:=IF([.D179]<>"";IF(AND([.B179]<>"";[.C179]<>"");"";"ERR");"") -> 
B180: of:=IF( ISBLANK([$'03.Muestra'.$C17]);"";[$'03.Muestra'.$C17]) ->  | C180: of:=IF( ISBLANK([$'03.Muestra'.$E17]);"";[$'03.Muestra'.$E17]) ->  | E180: of:=IF([.D180]<>"";IF(AND([.B180]<>"";[.C180]<>"");"";"ERR");"") -> 
B181: of:=IF( ISBLANK([$'03.Muestra'.$C18]);"";[$'03.Muestra'.$C18]) ->  | C181: of:=IF( ISBLANK([$'03.Muestra'.$E18]);"";[$'03.Muestra'.$E18]) ->  | E181: of:=IF([.D181]<>"";IF(AND([.B181]<>"";[.C181]<>"");"";"ERR");"") -> 
B182: of:=IF( ISBLANK([$'03.Muestra'.$C19]);"";[$'03.Muestra'.$C19]) ->  | C182: of:=IF( ISBLANK([$'03.Muestra'.$E19]);"";[$'03.Muestra'.$E19]) ->  | E182: of:=IF([.D182]<>"";IF(AND([.B182]<>"";[.C182]<>"");"";"ERR");"") -> 
B183: of:=IF( ISBLANK([$'03.Muestra'.$C20]);"";[$'03.Muestra'.$C20]) ->  | C183: of:=IF( ISBLANK([$'03.Muestra'.$E20]);"";[$'03.Muestra'.$E20]) ->  | E183: of:=IF([.D183]<>"";IF(AND([.B183]<>"";[.C183]<>"");"";"ERR");"") -> 
B184: of:=IF( ISBLANK([$'03.Muestra'.$C21]);"";[$'03.Muestra'.$C21]) ->  | C184: of:=IF( ISBLANK([$'03.Muestra'.$E21]);"";[$'03.Muestra'.$E21]) ->  | E184: of:=IF([.D184]<>"";IF(AND([.B184]<>"";[.C184]<>"");"";"ERR");"") -> 
B185: of:=IF( ISBLANK([$'03.Muestra'.$C22]);"";[$'03.Muestra'.$C22]) ->  | C185: of:=IF( ISBLANK([$'03.Muestra'.$E22]);"";[$'03.Muestra'.$E22]) ->  | E185: of:=IF([.D185]<>"";IF(AND([.B185]<>"";[.C185]<>"");"";"ERR");"") -> 
B186: of:=IF( ISBLANK([$'03.Muestra'.$C23]);"";[$'03.Muestra'.$C23]) ->  | C186: of:=IF( ISBLANK([$'03.Muestra'.$E23]);"";[$'03.Muestra'.$E23]) ->  | E186: of:=IF([.D186]<>"";IF(AND([.B186]<>"";[.C186]<>"");"";"ERR");"") -> 
B187: of:=IF( ISBLANK([$'03.Muestra'.$C24]);"";[$'03.Muestra'.$C24]) ->  | C187: of:=IF( ISBLANK([$'03.Muestra'.$E24]);"";[$'03.Muestra'.$E24]) ->  | E187: of:=IF([.D187]<>"";IF(AND([.B187]<>"";[.C187]<>"");"";"ERR");"") -> 
B188: of:=IF( ISBLANK([$'03.Muestra'.$C25]);"";[$'03.Muestra'.$C25]) ->  | C188: of:=IF( ISBLANK([$'03.Muestra'.$E25]);"";[$'03.Muestra'.$E25]) ->  | E188: of:=IF([.D188]<>"";IF(AND([.B188]<>"";[.C188]<>"");"";"ERR");"") -> 
B189: of:=IF( ISBLANK([$'03.Muestra'.$C26]);"";[$'03.Muestra'.$C26]) ->  | C189: of:=IF( ISBLANK([$'03.Muestra'.$E26]);"";[$'03.Muestra'.$E26]) ->  | E189: of:=IF([.D189]<>"";IF(AND([.B189]<>"";[.C189]<>"");"";"ERR");"") -> 
B190: of:=IF( ISBLANK([$'03.Muestra'.$C27]);"";[$'03.Muestra'.$C27]) ->  | C190: of:=IF( ISBLANK([$'03.Muestra'.$E27]);"";[$'03.Muestra'.$E27]) ->  | E190: of:=IF([.D190]<>"";IF(AND([.B190]<>"";[.C190]<>"");"";"ERR");"") -> 
B191: of:=IF( ISBLANK([$'03.Muestra'.$C28]);"";[$'03.Muestra'.$C28]) ->  | C191: of:=IF( ISBLANK([$'03.Muestra'.$E28]);"";[$'03.Muestra'.$E28]) ->  | E191: of:=IF([.D191]<>"";IF(AND([.B191]<>"";[.C191]<>"");"";"ERR");"") -> 
B192: of:=IF( ISBLANK([$'03.Muestra'.$C29]);"";[$'03.Muestra'.$C29]) ->  | C192: of:=IF( ISBLANK([$'03.Muestra'.$E29]);"";[$'03.Muestra'.$E29]) ->  | E192: of:=IF([.D192]<>"";IF(AND([.B192]<>"";[.C192]<>"");"";"ERR");"") -> 
B193: of:=IF( ISBLANK([$'03.Muestra'.$C30]);"";[$'03.Muestra'.$C30]) ->  | C193: of:=IF( ISBLANK([$'03.Muestra'.$E30]);"";[$'03.Muestra'.$E30]) ->  | E193: of:=IF([.D193]<>"";IF(AND([.B193]<>"";[.C193]<>"");"";"ERR");"") -> 
B194: of:=IF( ISBLANK([$'03.Muestra'.$C31]);"";[$'03.Muestra'.$C31]) ->  | C194: of:=IF( ISBLANK([$'03.Muestra'.$E31]);"";[$'03.Muestra'.$E31]) ->  | E194: of:=IF([.D194]<>"";IF(AND([.B194]<>"";[.C194]<>"");"";"ERR");"") -> 
B195: of:=IF( ISBLANK([$'03.Muestra'.$C32]);"";[$'03.Muestra'.$C32]) ->  | C195: of:=IF( ISBLANK([$'03.Muestra'.$E32]);"";[$'03.Muestra'.$E32]) ->  | E195: of:=IF([.D195]<>"";IF(AND([.B195]<>"";[.C195]<>"");"";"ERR");"") -> 
B196: of:=IF( ISBLANK([$'03.Muestra'.$C33]);"";[$'03.Muestra'.$C33]) ->  | C196: of:=IF( ISBLANK([$'03.Muestra'.$E33]);"";[$'03.Muestra'.$E33]) ->  | E196: of:=IF([.D196]<>"";IF(AND([.B196]<>"";[.C196]<>"");"";"ERR");"") -> 
B197: of:=IF( ISBLANK([$'03.Muestra'.$C34]);"";[$'03.Muestra'.$C34]) ->  | C197: of:=IF( ISBLANK([$'03.Muestra'.$E34]);"";[$'03.Muestra'.$E34]) ->  | E197: of:=IF([.D197]<>"";IF(AND([.B197]<>"";[.C197]<>"");"";"ERR");"") -> 
B198: of:=IF( ISBLANK([$'03.Muestra'.$C35]);"";[$'03.Muestra'.$C35]) ->  | C198: of:=IF( ISBLANK([$'03.Muestra'.$E35]);"";[$'03.Muestra'.$E35]) ->  | E198: of:=IF([.D198]<>"";IF(AND([.B198]<>"";[.C198]<>"");"";"ERR");"") -> 
B199: of:=IF( ISBLANK([$'03.Muestra'.$C36]);"";[$'03.Muestra'.$C36]) ->  | C199: of:=IF( ISBLANK([$'03.Muestra'.$E36]);"";[$'03.Muestra'.$E36]) ->  | E199: of:=IF([.D199]<>"";IF(AND([.B199]<>"";[.C199]<>"");"";"ERR");"") -> 
B200: of:=IF( ISBLANK([$'03.Muestra'.$C37]);"";[$'03.Muestra'.$C37]) ->  | C200: of:=IF( ISBLANK([$'03.Muestra'.$E37]);"";[$'03.Muestra'.$E37]) ->  | E200: of:=IF([.D200]<>"";IF(AND([.B200]<>"";[.C200]<>"");"";"ERR");"") -> 
B201: of:=IF( ISBLANK([$'03.Muestra'.$C38]);"";[$'03.Muestra'.$C38]) ->  | C201: of:=IF( ISBLANK([$'03.Muestra'.$E38]);"";[$'03.Muestra'.$E38]) ->  | E201: of:=IF([.D201]<>"";IF(AND([.B201]<>"";[.C201]<>"");"";"ERR");"") -> 
B202: of:=IF( ISBLANK([$'03.Muestra'.$C39]);"";[$'03.Muestra'.$C39]) ->  | C202: of:=IF( ISBLANK([$'03.Muestra'.$E39]);"";[$'03.Muestra'.$E39]) ->  | E202: of:=IF([.D202]<>"";IF(AND([.B202]<>"";[.C202]<>"");"";"ERR");"") -> 
B203: of:=IF( ISBLANK([$'03.Muestra'.$C40]);"";[$'03.Muestra'.$C40]) ->  | C203: of:=IF( ISBLANK([$'03.Muestra'.$E40]);"";[$'03.Muestra'.$E40]) ->  | E203: of:=IF([.D203]<>"";IF(AND([.B203]<>"";[.C203]<>"");"";"ERR");"") -> 
B204: of:=IF( ISBLANK([$'03.Muestra'.$C41]);"";[$'03.Muestra'.$C41]) ->  | C204: of:=IF( ISBLANK([$'03.Muestra'.$E41]);"";[$'03.Muestra'.$E41]) ->  | E204: of:=IF([.D204]<>"";IF(AND([.B204]<>"";[.C204]<>"");"";"ERR");"") -> 
B205: of:=IF( ISBLANK([$'03.Muestra'.$C42]);"";[$'03.Muestra'.$C42]) ->  | C205: of:=IF( ISBLANK([$'03.Muestra'.$E42]);"";[$'03.Muestra'.$E42]) ->  | E205: of:=IF([.D205]<>"";IF(AND([.B205]<>"";[.C205]<>"");"";"ERR");"") -> 
B208: A | C208: 2.3.1 Umbral de tres destellos o menos | D208: Resultado
B209: of:=IF( ISBLANK([$'03.Muestra'.$C8]);"";[$'03.Muestra'.$C8]) ->  | C209: of:=IF( ISBLANK([$'03.Muestra'.$E8]);"";[$'03.Muestra'.$E8]) ->  | E209: of:=IF([.D209]<>"";IF(AND([.B209]<>"";[.C209]<>"");"";"ERR");"") ->  | F209: N/T | G209: N/D | H209: N/A | I209: Falla | J209: Pasa | K209: En blanco
B210: of:=IF( ISBLANK([$'03.Muestra'.$C9]);"";[$'03.Muestra'.$C9]) ->  | C210: of:=IF( ISBLANK([$'03.Muestra'.$E9]);"";[$'03.Muestra'.$E9]) ->  | E210: of:=IF([.D210]<>"";IF(AND([.B210]<>"";[.C210]<>"");"";"ERR");"") ->  | F210: of:=COUNTIF([.$D209]:INDIRECT("$D" &  SUM(ROW()-1;[$'03.Muestra'.$D$45])-1);[.F209]) -> 0 | G210: of:=COUNTIF([.$D209]:INDIRECT("$D" &  SUM(ROW()-1;[$'03.Muestra'.$D$45])-1);[.G209]) -> 0 | H210: of:=COUNTIF([.$D209]:INDIRECT("$D" &  SUM(ROW()-1;[$'03.Muestra'.$D$45])-1);[.H209]) -> 0 | I210: of:=COUNTIF([.$D209]:INDIRECT("$D" &  SUM(ROW()-1;[$'03.Muestra'.$D$45])-1);[.I209]) -> 0 | J210: of:=COUNTIF([.$D209]:INDIRECT("$D" &  SUM(ROW()-1;[$'03.Muestra'.$D$45])-1);[.J209]) -> 0 | K210: of:=IF([$'03.Muestra'.$D$45]=0;0;COUNTBLANK([.$D209]:INDIRECT("$D" &  SUM(ROW()-1;[$'03.Muestra'.$D$45])-1))) -> 0
B211: of:=IF( ISBLANK([$'03.Muestra'.$C10]);"";[$'03.Muestra'.$C10]) ->  | C211: of:=IF( ISBLANK([$'03.Muestra'.$E10]);"";[$'03.Muestra'.$E10]) ->  | E211: of:=IF([.D211]<>"";IF(AND([.B211]<>"";[.C211]<>"");"";"ERR");"") -> 
B212: of:=IF( ISBLANK([$'03.Muestra'.$C11]);"";[$'03.Muestra'.$C11]) ->  | C212: of:=IF( ISBLANK([$'03.Muestra'.$E11]);"";[$'03.Muestra'.$E11]) ->  | E212: of:=IF([.D212]<>"";IF(AND([.B212]<>"";[.C212]<>"");"";"ERR");"") -> 
B213: of:=IF( ISBLANK([$'03.Muestra'.$C12]);"";[$'03.Muestra'.$C12]) ->  | C213: of:=IF( ISBLANK([$'03.Muestra'.$E12]);"";[$'03.Muestra'.$E12]) ->  | E213: of:=IF([.D213]<>"";IF(AND([.B213]<>"";[.C213]<>"");"";"ERR");"") -> 
B214: of:=IF( ISBLANK([$'03.Muestra'.$C13]);"";[$'03.Muestra'.$C13]) ->  | C214: of:=IF( ISBLANK([$'03.Muestra'.$E13]);"";[$'03.Muestra'.$E13]) ->  | E214: of:=IF([.D214]<>"";IF(AND([.B214]<>"";[.C214]<>"");"";"ERR");"") -> 
B215: of:=IF( ISBLANK([$'03.Muestra'.$C14]);"";[$'03.Muestra'.$C14]) ->  | C215: of:=IF( ISBLANK([$'03.Muestra'.$E14]);"";[$'03.Muestra'.$E14]) ->  | E215: of:=IF([.D215]<>"";IF(AND([.B215]<>"";[.C215]<>"");"";"ERR");"") -> 
B216: of:=IF( ISBLANK([$'03.Muestra'.$C15]);"";[$'03.Muestra'.$C15]) ->  | C216: of:=IF( ISBLANK([$'03.Muestra'.$E15]);"";[$'03.Muestra'.$E15]) ->  | E216: of:=IF([.D216]<>"";IF(AND([.B216]<>"";[.C216]<>"");"";"ERR");"") -> 
B217: of:=IF( ISBLANK([$'03.Muestra'.$C16]);"";[$'03.Muestra'.$C16]) ->  | C217: of:=IF( ISBLANK([$'03.Muestra'.$E16]);"";[$'03.Muestra'.$E16]) ->  | E217: of:=IF([.D217]<>"";IF(AND([.B217]<>"";[.C217]<>"");"";"ERR");"") -> 
B218: of:=IF( ISBLANK([$'03.Muestra'.$C17]);"";[$'03.Muestra'.$C17]) ->  | C218: of:=IF( ISBLANK([$'03.Muestra'.$E17]);"";[$'03.Muestra'.$E17]) ->  | E218: of:=IF([.D218]<>"";IF(AND([.B218]<>"";[.C218]<>"");"";"ERR");"") -> 
B219: of:=IF( ISBLANK([$'03.Muestra'.$C18]);"";[$'03.Muestra'.$C18]) ->  | C219: of:=IF( ISBLANK([$'03.Muestra'.$E18]);"";[$'03.Muestra'.$E18]) ->  | E219: of:=IF([.D219]<>"";IF(AND([.B219]<>"";[.C219]<>"");"";"ERR");"") -> 
B220: of:=IF( ISBLANK([$'03.Muestra'.$C19]);"";[$'03.Muestra'.$C19]) ->  | C220: of:=IF( ISBLANK([$'03.Muestra'.$E19]);"";[$'03.Muestra'.$E19]) ->  | E220: of:=IF([.D220]<>"";IF(AND([.B220]<>"";[.C220]<>"");"";"ERR");"") -> 
B221: of:=IF( ISBLANK([$'03.Muestra'.$C20]);"";[$'03.Muestra'.$C20]) ->  | C221: of:=IF( ISBLANK([$'03.Muestra'.$E20]);"";[$'03.Muestra'.$E20]) ->  | E221: of:=IF([.D221]<>"";IF(AND([.B221]<>"";[.C221]<>"");"";"ERR");"") -> 
B222: of:=IF( ISBLANK([$'03.Muestra'.$C21]);"";[$'03.Muestra'.$C21]) ->  | C222: of:=IF( ISBLANK([$'03.Muestra'.$E21]);"";[$'03.Muestra'.$E21]) ->  | E222: of:=IF([.D222]<>"";IF(AND([.B222]<>"";[.C222]<>"");"";"ERR");"") -> 
B223: of:=IF( ISBLANK([$'03.Muestra'.$C22]);"";[$'03.Muestra'.$C22]) ->  | C223: of:=IF( ISBLANK([$'03.Muestra'.$E22]);"";[$'03.Muestra'.$E22]) ->  | E223: of:=IF([.D223]<>"";IF(AND([.B223]<>"";[.C223]<>"");"";"ERR");"") -> 
B224: of:=IF( ISBLANK([$'03.Muestra'.$C23]);"";[$'03.Muestra'.$C23]) ->  | C224: of:=IF( ISBLANK([$'03.Muestra'.$E23]);"";[$'03.Muestra'.$E23]) ->  | E224: of:=IF([.D224]<>"";IF(AND([.B224]<>"";[.C224]<>"");"";"ERR");"") -> 
B225: of:=IF( ISBLANK([$'03.Muestra'.$C24]);"";[$'03.Muestra'.$C24]) ->  | C225: of:=IF( ISBLANK([$'03.Muestra'.$E24]);"";[$'03.Muestra'.$E24]) ->  | E225: of:=IF([.D225]<>"";IF(AND([.B225]<>"";[.C225]<>"");"";"ERR");"") -> 
B226: of:=IF( ISBLANK([$'03.Muestra'.$C25]);"";[$'03.Muestra'.$C25]) ->  | C226: of:=IF( ISBLANK([$'03.Muestra'.$E25]);"";[$'03.Muestra'.$E25]) ->  | E226: of:=IF([.D226]<>"";IF(AND([.B226]<>"";[.C226]<>"");"";"ERR");"") -> 
B227: of:=IF( ISBLANK([$'03.Muestra'.$C26]);"";[$'03.Muestra'.$C26]) ->  | C227: of:=IF( ISBLANK([$'03.Muestra'.$E26]);"";[$'03.Muestra'.$E26]) ->  | E227: of:=IF([.D227]<>"";IF(AND([.B227]<>"";[.C227]<>"");"";"ERR");"") -> 
B228: of:=IF( ISBLANK([$'03.Muestra'.$C27]);"";[$'03.Muestra'.$C27]) ->  | C228: of:=IF( ISBLANK([$'03.Muestra'.$E27]);"";[$'03.Muestra'.$E27]) ->  | E228: of:=IF([.D228]<>"";IF(AND([.B228]<>"";[.C228]<>"");"";"ERR");"") -> 
B229: of:=IF( ISBLANK([$'03.Muestra'.$C28]);"";[$'03.Muestra'.$C28]) ->  | C229: of:=IF( ISBLANK([$'03.Muestra'.$E28]);"";[$'03.Muestra'.$E28]) ->  | E229: of:=IF([.D229]<>"";IF(AND([.B229]<>"";[.C229]<>"");"";"ERR");"") -> 
B230: of:=IF( ISBLANK([$'03.Muestra'.$C29]);"";[$'03.Muestra'.$C29]) ->  | C230: of:=IF( ISBLANK([$'03.Muestra'.$E29]);"";[$'03.Muestra'.$E29]) ->  | E230: of:=IF([.D230]<>"";IF(AND([.B230]<>"";[.C230]<>"");"";"ERR");"") -> 
B231: of:=IF( ISBLANK([$'03.Muestra'.$C30]);"";[$'03.Muestra'.$C30]) ->  | C231: of:=IF( ISBLANK([$'03.Muestra'.$E30]);"";[$'03.Muestra'.$E30]) ->  | E231: of:=IF([.D231]<>"";IF(AND([.B231]<>"";[.C231]<>"");"";"ERR");"") -> 
B232: of:=IF( ISBLANK([$'03.Muestra'.$C31]);"";[$'03.Muestra'.$C31]) ->  | C232: of:=IF( ISBLANK([$'03.Muestra'.$E31]);"";[$'03.Muestra'.$E31]) ->  | E232: of:=IF([.D232]<>"";IF(AND([.B232]<>"";[.C232]<>"");"";"ERR");"") -> 
B233: of:=IF( ISBLANK([$'03.Muestra'.$C32]);"";[$'03.Muestra'.$C32]) ->  | C233: of:=IF( ISBLANK([$'03.Muestra'.$E32]);"";[$'03.Muestra'.$E32]) ->  | E233: of:=IF([.D233]<>"";IF(AND([.B233]<>"";[.C233]<>"");"";"ERR");"") -> 
B234: of:=IF( ISBLANK([$'03.Muestra'.$C33]);"";[$'03.Muestra'.$C33]) ->  | C234: of:=IF( ISBLANK([$'03.Muestra'.$E33]);"";[$'03.Muestra'.$E33]) ->  | E234: of:=IF([.D234]<>"";IF(AND([.B234]<>"";[.C234]<>"");"";"ERR");"") -> 
B235: of:=IF( ISBLANK([$'03.Muestra'.$C34]);"";[$'03.Muestra'.$C34]) ->  | C235: of:=IF( ISBLANK([$'03.Muestra'.$E34]);"";[$'03.Muestra'.$E34]) ->  | E235: of:=IF([.D235]<>"";IF(AND([.B235]<>"";[.C235]<>"");"";"ERR");"") -> 
B236: of:=IF( ISBLANK([$'03.Muestra'.$C35]);"";[$'03.Muestra'.$C35]) ->  | C236: of:=IF( ISBLANK([$'03.Muestra'.$E35]);"";[$'03.Muestra'.$E35]) ->  | E236: of:=IF([.D236]<>"";IF(AND([.B236]<>"";[.C236]<>"");"";"ERR");"") -> 
B237: of:=IF( ISBLANK([$'03.Muestra'.$C36]);"";[$'03.Muestra'.$C36]) ->  | C237: of:=IF( ISBLANK([$'03.Muestra'.$E36]);"";[$'03.Muestra'.$E36]) ->  | E237: of:=IF([.D237]<>"";IF(AND([.B237]<>"";[.C237]<>"");"";"ERR");"") -> 
B238: of:=IF( ISBLANK([$'03.Muestra'.$C37]);"";[$'03.Muestra'.$C37]) ->  | C238: of:=IF( ISBLANK([$'03.Muestra'.$E37]);"";[$'03.Muestra'.$E37]) ->  | E238: of:=IF([.D238]<>"";IF(AND([.B238]<>"";[.C238]<>"");"";"ERR");"") -> 
B239: of:=IF( ISBLANK([$'03.Muestra'.$C38]);"";[$'03.Muestra'.$C38]) ->  | C239: of:=IF( ISBLANK([$'03.Muestra'.$E38]);"";[$'03.Muestra'.$E38]) ->  | E239: of:=IF([.D239]<>"";IF(AND([.B239]<>"";[.C239]<>"");"";"ERR");"") -> 
B240: of:=IF( ISBLANK([$'03.Muestra'.$C39]);"";[$'03.Muestra'.$C39]) ->  | C240: of:=IF( ISBLANK([$'03.Muestra'.$E39]);"";[$'03.Muestra'.$E39]) ->  | E240: of:=IF([.D240]<>"";IF(AND([.B240]<>"";[.C240]<>"");"";"ERR");"") -> 
B241: of:=IF( ISBLANK([$'03.Muestra'.$C40]);"";[$'03.Muestra'.$C40]) ->  | C241: of:=IF( ISBLANK([$'03.Muestra'.$E40]);"";[$'03.Muestra'.$E40]) ->  | E241: of:=IF([.D241]<>"";IF(AND([.B241]<>"";[.C241]<>"");"";"ERR");"") -> 
B242: of:=IF( ISBLANK([$'03.Muestra'.$C41]);"";[$'03.Muestra'.$C41]) ->  | C242: of:=IF( ISBLANK([$'03.Muestra'.$E41]);"";[$'03.Muestra'.$E41]) ->  | E242: of:=IF([.D242]<>"";IF(AND([.B242]<>"";[.C242]<>"");"";"ERR");"") -> 
B243: of:=IF( ISBLANK([$'03.Muestra'.$C42]);"";[$'03.Muestra'.$C42]) ->  | C243: of:=IF( ISBLANK([$'03.Muestra'.$E42]);"";[$'03.Muestra'.$E42]) ->  | E243: of:=IF([.D243]<>"";IF(AND([.B243]<>"";[.C243]<>"");"";"ERR");"") -> 
B246: A | C246: 2.4.1 Evitar bloques | D246: Resultado
B247: of:=IF( ISBLANK([$'03.Muestra'.$C8]);"";[$'03.Muestra'.$C8]) ->  | C247: of:=IF( ISBLANK([$'03.Muestra'.$E8]);"";[$'03.Muestra'.$E8]) ->  | E247: of:=IF([.D247]<>"";IF(AND([.B247]<>"";[.C247]<>"");"";"ERR");"") ->  | F247: N/T | G247: N/D | H247: N/A | I247: Falla | J247: Pasa | K247: En blanco
B248: of:=IF( ISBLANK([$'03.Muestra'.$C9]);"";[$'03.Muestra'.$C9]) ->  | C248: of:=IF( ISBLANK([$'03.Muestra'.$E9]);"";[$'03.Muestra'.$E9]) ->  | E248: of:=IF([.D248]<>"";IF(AND([.B248]<>"";[.C248]<>"");"";"ERR");"") ->  | F248: of:=COUNTIF([.$D247]:INDIRECT("$D" &  SUM(ROW()-1;[$'03.Muestra'.$D$45])-1);[.F247]) -> 0 | G248: of:=COUNTIF([.$D247]:INDIRECT("$D" &  SUM(ROW()-1;[$'03.Muestra'.$D$45])-1);[.G247]) -> 0 | H248: of:=COUNTIF([.$D247]:INDIRECT("$D" &  SUM(ROW()-1;[$'03.Muestra'.$D$45])-1);[.H247]) -> 0 | I248: of:=COUNTIF([.$D247]:INDIRECT("$D" &  SUM(ROW()-1;[$'03.Muestra'.$D$45])-1);[.I247]) -> 0 | J248: of:=COUNTIF([.$D247]:INDIRECT("$D" &  SUM(ROW()-1;[$'03.Muestra'.$D$45])-1);[.J247]) -> 0 | K248: of:=IF([$'03.Muestra'.$D$45]=0;0;COUNTBLANK([.$D247]:INDIRECT("$D" &  SUM(ROW()-1;[$'03.Muestra'.$D$45])-1))) -> 0
B249: of:=IF( ISBLANK([$'03.Muestra'.$C10]);"";[$'03.Muestra'.$C10]) ->  | C249: of:=IF( ISBLANK([$'03.Muestra'.$E10]);"";[$'03.Muestra'.$E10]) ->  | E249: of:=IF([.D249]<>"";IF(AND([.B249]<>"";[.C249]<>"");"";"ERR");"") -> 
B250: of:=IF( ISBLANK([$'03.Muestra'.$C11]);"";[$'03.Muestra'.$C11]) ->  | C250: of:=IF( ISBLANK([$'03.Muestra'.$E11]);"";[$'03.Muestra'.$E11]) ->  | E250: of:=IF([.D250]<>"";IF(AND([.B250]<>"";[.C250]<>"");"";"ERR");"") -> 
B251: of:=IF( ISBLANK([$'03.Muestra'.$C12]);"";[$'03.Muestra'.$C12]) ->  | C251: of:=IF( ISBLANK([$'03.Muestra'.$E12]);"";[$'03.Muestra'.$E12]) ->  | E251: of:=IF([.D251]<>"";IF(AND([.B251]<>"";[.C251]<>"");"";"ERR");"") -> 
B252: of:=IF( ISBLANK([$'03.Muestra'.$C13]);"";[$'03.Muestra'.$C13]) ->  | C252: of:=IF( ISBLANK([$'03.Muestra'.$E13]);"";[$'03.Muestra'.$E13]) ->  | E252: of:=IF([.D252]<>"";IF(AND([.B252]<>"";[.C252]<>"");"";"ERR");"") -> 
B253: of:=IF( ISBLANK([$'03.Muestra'.$C14]);"";[$'03.Muestra'.$C14]) ->  | C253: of:=IF( ISBLANK([$'03.Muestra'.$E14]);"";[$'03.Muestra'.$E14]) ->  | E253: of:=IF([.D253]<>"";IF(AND([.B253]<>"";[.C253]<>"");"";"ERR");"") -> 
B254: of:=IF( ISBLANK([$'03.Muestra'.$C15]);"";[$'03.Muestra'.$C15]) ->  | C254: of:=IF( ISBLANK([$'03.Muestra'.$E15]);"";[$'03.Muestra'.$E15]) ->  | E254: of:=IF([.D254]<>"";IF(AND([.B254]<>"";[.C254]<>"");"";"ERR");"") -> 
B255: of:=IF( ISBLANK([$'03.Muestra'.$C16]);"";[$'03.Muestra'.$C16]) ->  | C255: of:=IF( ISBLANK([$'03.Muestra'.$E16]);"";[$'03.Muestra'.$E16]) ->  | E255: of:=IF([.D255]<>"";IF(AND([.B255]<>"";[.C255]<>"");"";"ERR");"") -> 
B256: of:=IF( ISBLANK([$'03.Muestra'.$C17]);"";[$'03.Muestra'.$C17]) ->  | C256: of:=IF( ISBLANK([$'03.Muestra'.$E17]);"";[$'03.Muestra'.$E17]) ->  | E256: of:=IF([.D256]<>"";IF(AND([.B256]<>"";[.C256]<>"");"";"ERR");"") -> 
B257: of:=IF( ISBLANK([$'03.Muestra'.$C18]);"";[$'03.Muestra'.$C18]) ->  | C257: of:=IF( ISBLANK([$'03.Muestra'.$E18]);"";[$'03.Muestra'.$E18]) ->  | E257: of:=IF([.D257]<>"";IF(AND([.B257]<>"";[.C257]<>"");"";"ERR");"") -> 
B258: of:=IF( ISBLANK([$'03.Muestra'.$C19]);"";[$'03.Muestra'.$C19]) ->  | C258: of:=IF( ISBLANK([$'03.Muestra'.$E19]);"";[$'03.Muestra'.$E19]) ->  | E258: of:=IF([.D258]<>"";IF(AND([.B258]<>"";[.C258]<>"");"";"ERR");"") -> 
B259: of:=IF( ISBLANK([$'03.Muestra'.$C20]);"";[$'03.Muestra'.$C20]) ->  | C259: of:=IF( ISBLANK([$'03.Muestra'.$E20]);"";[$'03.Muestra'.$E20]) ->  | E259: of:=IF([.D259]<>"";IF(AND([.B259]<>"";[.C259]<>"");"";"ERR");"") -> 
B260: of:=IF( ISBLANK([$'03.Muestra'.$C21]);"";[$'03.Muestra'.$C21]) ->  | C260: of:=IF( ISBLANK([$'03.Muestra'.$E21]);"";[$'03.Muestra'.$E21]) ->  | E260: of:=IF([.D260]<>"";IF(AND([.B260]<>"";[.C260]<>"");"";"ERR");"") -> 
B261: of:=IF( ISBLANK([$'03.Muestra'.$C22]);"";[$'03.Muestra'.$C22]) ->  | C261: of:=IF( ISBLANK([$'03.Muestra'.$E22]);"";[$'03.Muestra'.$E22]) ->  | E261: of:=IF([.D261]<>"";IF(AND([.B261]<>"";[.C261]<>"");"";"ERR");"") -> 
B262: of:=IF( ISBLANK([$'03.Muestra'.$C23]);"";[$'03.Muestra'.$C23]) ->  | C262: of:=IF( ISBLANK([$'03.Muestra'.$E23]);"";[$'03.Muestra'.$E23]) ->  | E262: of:=IF([.D262]<>"";IF(AND([.B262]<>"";[.C262]<>"");"";"ERR");"") -> 
B263: of:=IF( ISBLANK([$'03.Muestra'.$C24]);"";[$'03.Muestra'.$C24]) ->  | C263: of:=IF( ISBLANK([$'03.Muestra'.$E24]);"";[$'03.Muestra'.$E24]) ->  | E263: of:=IF([.D263]<>"";IF(AND([.B263]<>"";[.C263]<>"");"";"ERR");"") -> 
B264: of:=IF( ISBLANK([$'03.Muestra'.$C25]);"";[$'03.Muestra'.$C25]) ->  | C264: of:=IF( ISBLANK([$'03.Muestra'.$E25]);"";[$'03.Muestra'.$E25]) ->  | E264: of:=IF([.D264]<>"";IF(AND([.B264]<>"";[.C264]<>"");"";"ERR");"") -> 
B265: of:=IF( ISBLANK([$'03.Muestra'.$C26]);"";[$'03.Muestra'.$C26]) ->  | C265: of:=IF( ISBLANK([$'03.Muestra'.$E26]);"";[$'03.Muestra'.$E26]) ->  | E265: of:=IF([.D265]<>"";IF(AND([.B265]<>"";[.C265]<>"");"";"ERR");"") -> 
B266: of:=IF( ISBLANK([$'03.Muestra'.$C27]);"";[$'03.Muestra'.$C27]) ->  | C266: of:=IF( ISBLANK([$'03.Muestra'.$E27]);"";[$'03.Muestra'.$E27]) ->  | E266: of:=IF([.D266]<>"";IF(AND([.B266]<>"";[.C266]<>"");"";"ERR");"") -> 
B267: of:=IF( ISBLANK([$'03.Muestra'.$C28]);"";[$'03.Muestra'.$C28]) ->  | C267: of:=IF( ISBLANK([$'03.Muestra'.$E28]);"";[$'03.Muestra'.$E28]) ->  | E267: of:=IF([.D267]<>"";IF(AND([.B267]<>"";[.C267]<>"");"";"ERR");"") -> 
B268: of:=IF( ISBLANK([$'03.Muestra'.$C29]);"";[$'03.Muestra'.$C29]) ->  | C268: of:=IF( ISBLANK([$'03.Muestra'.$E29]);"";[$'03.Muestra'.$E29]) ->  | E268: of:=IF([.D268]<>"";IF(AND([.B268]<>"";[.C268]<>"");"";"ERR");"") -> 
B269: of:=IF( ISBLANK([$'03.Muestra'.$C30]);"";[$'03.Muestra'.$C30]) ->  | C269: of:=IF( ISBLANK([$'03.Muestra'.$E30]);"";[$'03.Muestra'.$E30]) ->  | E269: of:=IF([.D269]<>"";IF(AND([.B269]<>"";[.C269]<>"");"";"ERR");"") -> 
B270: of:=IF( ISBLANK([$'03.Muestra'.$C31]);"";[$'03.Muestra'.$C31]) ->  | C270: of:=IF( ISBLANK([$'03.Muestra'.$E31]);"";[$'03.Muestra'.$E31]) ->  | E270: of:=IF([.D270]<>"";IF(AND([.B270]<>"";[.C270]<>"");"";"ERR");"") -> 
B271: of:=IF( ISBLANK([$'03.Muestra'.$C32]);"";[$'03.Muestra'.$C32]) ->  | C271: of:=IF( ISBLANK([$'03.Muestra'.$E32]);"";[$'03.Muestra'.$E32]) ->  | E271: of:=IF([.D271]<>"";IF(AND([.B271]<>"";[.C271]<>"");"";"ERR");"") -> 
B272: of:=IF( ISBLANK([$'03.Muestra'.$C33]);"";[$'03.Muestra'.$C33]) ->  | C272: of:=IF( ISBLANK([$'03.Muestra'.$E33]);"";[$'03.Muestra'.$E33]) ->  | E272: of:=IF([.D272]<>"";IF(AND([.B272]<>"";[.C272]<>"");"";"ERR");"") -> 
B273: of:=IF( ISBLANK([$'03.Muestra'.$C34]);"";[$'03.Muestra'.$C34]) ->  | C273: of:=IF( ISBLANK([$'03.Muestra'.$E34]);"";[$'03.Muestra'.$E34]) ->  | E273: of:=IF([.D273]<>"";IF(AND([.B273]<>"";[.C273]<>"");"";"ERR");"") -> 
B274: of:=IF( ISBLANK([$'03.Muestra'.$C35]);"";[$'03.Muestra'.$C35]) ->  | C274: of:=IF( ISBLANK([$'03.Muestra'.$E35]);"";[$'03.Muestra'.$E35]) ->  | E274: of:=IF([.D274]<>"";IF(AND([.B274]<>"";[.C274]<>"");"";"ERR");"") -> 
B275: of:=IF( ISBLANK([$'03.Muestra'.$C36]);"";[$'03.Muestra'.$C36]) ->  | C275: of:=IF( ISBLANK([$'03.Muestra'.$E36]);"";[$'03.Muestra'.$E36]) ->  | E275: of:=IF([.D275]<>"";IF(AND([.B275]<>"";[.C275]<>"");"";"ERR");"") -> 
B276: of:=IF( ISBLANK([$'03.Muestra'.$C37]);"";[$'03.Muestra'.$C37]) ->  | C276: of:=IF( ISBLANK([$'03.Muestra'.$E37]);"";[$'03.Muestra'.$E37]) ->  | E276: of:=IF([.D276]<>"";IF(AND([.B276]<>"";[.C276]<>"");"";"ERR");"") -> 
B277: of:=IF( ISBLANK([$'03.Muestra'.$C38]);"";[$'03.Muestra'.$C38]) ->  | C277: of:=IF( ISBLANK([$'03.Muestra'.$E38]);"";[$'03.Muestra'.$E38]) ->  | E277: of:=IF([.D277]<>"";IF(AND([.B277]<>"";[.C277]<>"");"";"ERR");"") -> 
B278: of:=IF( ISBLANK([$'03.Muestra'.$C39]);"";[$'03.Muestra'.$C39]) ->  | C278: of:=IF( ISBLANK([$'03.Muestra'.$E39]);"";[$'03.Muestra'.$E39]) ->  | E278: of:=IF([.D278]<>"";IF(AND([.B278]<>"";[.C278]<>"");"";"ERR");"") -> 
B279: of:=IF( ISBLANK([$'03.Muestra'.$C40]);"";[$'03.Muestra'.$C40]) ->  | C279: of:=IF( ISBLANK([$'03.Muestra'.$E40]);"";[$'03.Muestra'.$E40]) ->  | E279: of:=IF([.D279]<>"";IF(AND([.B279]<>"";[.C279]<>"");"";"ERR");"") -> 
B280: of:=IF( ISBLANK([$'03.Muestra'.$C41]);"";[$'03.Muestra'.$C41]) ->  | C280: of:=IF( ISBLANK([$'03.Muestra'.$E41]);"";[$'03.Muestra'.$E41]) ->  | E280: of:=IF([.D280]<>"";IF(AND([.B280]<>"";[.C280]<>"");"";"ERR");"") -> 
B281: of:=IF( ISBLANK([$'03.Muestra'.$C42]);"";[$'03.Muestra'.$C42]) ->  | C281: of:=IF( ISBLANK([$'03.Muestra'.$E42]);"";[$'03.Muestra'.$E42]) ->  | E281: of:=IF([.D281]<>"";IF(AND([.B281]<>"";[.C281]<>"");"";"ERR");"") -> 
B284: A | C284: 2.4.2 Titulado de páginas | D284: Resultado
B285: of:=IF( ISBLANK([$'03.Muestra'.$C8]);"";[$'03.Muestra'.$C8]) ->  | C285: of:=IF( ISBLANK([$'03.Muestra'.$E8]);"";[$'03.Muestra'.$E8]) ->  | E285: of:=IF([.D285]<>"";IF(AND([.B285]<>"";[.C285]<>"");"";"ERR");"") ->  | F285: N/T | G285: N/D | H285: N/A | I285: Falla | J285: Pasa | K285: En blanco
B286: of:=IF( ISBLANK([$'03.Muestra'.$C9]);"";[$'03.Muestra'.$C9]) ->  | C286: of:=IF( ISBLANK([$'03.Muestra'.$E9]);"";[$'03.Muestra'.$E9]) ->  | E286: of:=IF([.D286]<>"";IF(AND([.B286]<>"";[.C286]<>"");"";"ERR");"") ->  | F286: of:=COUNTIF([.$D285]:INDIRECT("$D" &  SUM(ROW()-1;[$'03.Muestra'.$D$45])-1);[.F285]) -> 0 | G286: of:=COUNTIF([.$D285]:INDIRECT("$D" &  SUM(ROW()-1;[$'03.Muestra'.$D$45])-1);[.G285]) -> 0 | H286: of:=COUNTIF([.$D285]:INDIRECT("$D" &  SUM(ROW()-1;[$'03.Muestra'.$D$45])-1);[.H285]) -> 0 | I286: of:=COUNTIF([.$D285]:INDIRECT("$D" &  SUM(ROW()-1;[$'03.Muestra'.$D$45])-1);[.I285]) -> 0 | J286: of:=COUNTIF([.$D285]:INDIRECT("$D" &  SUM(ROW()-1;[$'03.Muestra'.$D$45])-1);[.J285]) -> 0 | K286: of:=IF([$'03.Muestra'.$D$45]=0;0;COUNTBLANK([.$D285]:INDIRECT("$D" &  SUM(ROW()-1;[$'03.Muestra'.$D$45])-1))) -> 0
B287: of:=IF( ISBLANK([$'03.Muestra'.$C10]);"";[$'03.Muestra'.$C10]) ->  | C287: of:=IF( ISBLANK([$'03.Muestra'.$E10]);"";[$'03.Muestra'.$E10]) ->  | E287: of:=IF([.D287]<>"";IF(AND([.B287]<>"";[.C287]<>"");"";"ERR");"") -> 
B288: of:=IF( ISBLANK([$'03.Muestra'.$C11]);"";[$'03.Muestra'.$C11]) ->  | C288: of:=IF( ISBLANK([$'03.Muestra'.$E11]);"";[$'03.Muestra'.$E11]) ->  | E288: of:=IF([.D288]<>"";IF(AND([.B288]<>"";[.C288]<>"");"";"ERR");"") -> 
B289: of:=IF( ISBLANK([$'03.Muestra'.$C12]);"";[$'03.Muestra'.$C12]) ->  | C289: of:=IF( ISBLANK([$'03.Muestra'.$E12]);"";[$'03.Muestra'.$E12]) ->  | E289: of:=IF([.D289]<>"";IF(AND([.B289]<>"";[.C289]<>"");"";"ERR");"") -> 
B290: of:=IF( ISBLANK([$'03.Muestra'.$C13]);"";[$'03.Muestra'.$C13]) ->  | C290: of:=IF( ISBLANK([$'03.Muestra'.$E13]);"";[$'03.Muestra'.$E13]) ->  | E290: of:=IF([.D290]<>"";IF(AND([.B290]<>"";[.C290]<>"");"";"ERR");"") -> 
B291: of:=IF( ISBLANK([$'03.Muestra'.$C14]);"";[$'03.Muestra'.$C14]) ->  | C291: of:=IF( ISBLANK([$'03.Muestra'.$E14]);"";[$'03.Muestra'.$E14]) ->  | E291: of:=IF([.D291]<>"";IF(AND([.B291]<>"";[.C291]<>"");"";"ERR");"") -> 
B292: of:=IF( ISBLANK([$'03.Muestra'.$C15]);"";[$'03.Muestra'.$C15]) ->  | C292: of:=IF( ISBLANK([$'03.Muestra'.$E15]);"";[$'03.Muestra'.$E15]) ->  | E292: of:=IF([.D292]<>"";IF(AND([.B292]<>"";[.C292]<>"");"";"ERR");"") -> 
B293: of:=IF( ISBLANK([$'03.Muestra'.$C16]);"";[$'03.Muestra'.$C16]) ->  | C293: of:=IF( ISBLANK([$'03.Muestra'.$E16]);"";[$'03.Muestra'.$E16]) ->  | E293: of:=IF([.D293]<>"";IF(AND([.B293]<>"";[.C293]<>"");"";"ERR");"") -> 
B294: of:=IF( ISBLANK([$'03.Muestra'.$C17]);"";[$'03.Muestra'.$C17]) ->  | C294: of:=IF( ISBLANK([$'03.Muestra'.$E17]);"";[$'03.Muestra'.$E17]) ->  | E294: of:=IF([.D294]<>"";IF(AND([.B294]<>"";[.C294]<>"");"";"ERR");"") -> 
B295: of:=IF( ISBLANK([$'03.Muestra'.$C18]);"";[$'03.Muestra'.$C18]) ->  | C295: of:=IF( ISBLANK([$'03.Muestra'.$E18]);"";[$'03.Muestra'.$E18]) ->  | E295: of:=IF([.D295]<>"";IF(AND([.B295]<>"";[.C295]<>"");"";"ERR");"") -> 
B296: of:=IF( ISBLANK([$'03.Muestra'.$C19]);"";[$'03.Muestra'.$C19]) ->  | C296: of:=IF( ISBLANK([$'03.Muestra'.$E19]);"";[$'03.Muestra'.$E19]) ->  | E296: of:=IF([.D296]<>"";IF(AND([.B296]<>"";[.C296]<>"");"";"ERR");"") -> 
B297: of:=IF( ISBLANK([$'03.Muestra'.$C20]);"";[$'03.Muestra'.$C20]) ->  | C297: of:=IF( ISBLANK([$'03.Muestra'.$E20]);"";[$'03.Muestra'.$E20]) ->  | E297: of:=IF([.D297]<>"";IF(AND([.B297]<>"";[.C297]<>"");"";"ERR");"") -> 
B298: of:=IF( ISBLANK([$'03.Muestra'.$C21]);"";[$'03.Muestra'.$C21]) ->  | C298: of:=IF( ISBLANK([$'03.Muestra'.$E21]);"";[$'03.Muestra'.$E21]) ->  | E298: of:=IF([.D298]<>"";IF(AND([.B298]<>"";[.C298]<>"");"";"ERR");"") -> 
B299: of:=IF( ISBLANK([$'03.Muestra'.$C22]);"";[$'03.Muestra'.$C22]) ->  | C299: of:=IF( ISBLANK([$'03.Muestra'.$E22]);"";[$'03.Muestra'.$E22]) ->  | E299: of:=IF([.D299]<>"";IF(AND([.B299]<>"";[.C299]<>"");"";"ERR");"") -> 
B300: of:=IF( ISBLANK([$'03.Muestra'.$C23]);"";[$'03.Muestra'.$C23]) ->  | C300: of:=IF( ISBLANK([$'03.Muestra'.$E23]);"";[$'03.Muestra'.$E23]) ->  | E300: of:=IF([.D300]<>"";IF(AND([.B300]<>"";[.C300]<>"");"";"ERR");"") -> 
B301: of:=IF( ISBLANK([$'03.Muestra'.$C24]);"";[$'03.Muestra'.$C24]) ->  | C301: of:=IF( ISBLANK([$'03.Muestra'.$E24]);"";[$'03.Muestra'.$E24]) ->  | E301: of:=IF([.D301]<>"";IF(AND([.B301]<>"";[.C301]<>"");"";"ERR");"") -> 
B302: of:=IF( ISBLANK([$'03.Muestra'.$C25]);"";[$'03.Muestra'.$C25]) ->  | C302: of:=IF( ISBLANK([$'03.Muestra'.$E25]);"";[$'03.Muestra'.$E25]) ->  | E302: of:=IF([.D302]<>"";IF(AND([.B302]<>"";[.C302]<>"");"";"ERR");"") -> 
B303: of:=IF( ISBLANK([$'03.Muestra'.$C26]);"";[$'03.Muestra'.$C26]) ->  | C303: of:=IF( ISBLANK([$'03.Muestra'.$E26]);"";[$'03.Muestra'.$E26]) ->  | E303: of:=IF([.D303]<>"";IF(AND([.B303]<>"";[.C303]<>"");"";"ERR");"") -> 
B304: of:=IF( ISBLANK([$'03.Muestra'.$C27]);"";[$'03.Muestra'.$C27]) ->  | C304: of:=IF( ISBLANK([$'03.Muestra'.$E27]);"";[$'03.Muestra'.$E27]) ->  | E304: of:=IF([.D304]<>"";IF(AND([.B304]<>"";[.C304]<>"");"";"ERR");"") -> 
B305: of:=IF( ISBLANK([$'03.Muestra'.$C28]);"";[$'03.Muestra'.$C28]) ->  | C305: of:=IF( ISBLANK([$'03.Muestra'.$E28]);"";[$'03.Muestra'.$E28]) ->  | E305: of:=IF([.D305]<>"";IF(AND([.B305]<>"";[.C305]<>"");"";"ERR");"") -> 
B306: of:=IF( ISBLANK([$'03.Muestra'.$C29]);"";[$'03.Muestra'.$C29]) ->  | C306: of:=IF( ISBLANK([$'03.Muestra'.$E29]);"";[$'03.Muestra'.$E29]) ->  | E306: of:=IF([.D306]<>"";IF(AND([.B306]<>"";[.C306]<>"");"";"ERR");"") -> 
B307: of:=IF( ISBLANK([$'03.Muestra'.$C30]);"";[$'03.Muestra'.$C30]) ->  | C307: of:=IF( ISBLANK([$'03.Muestra'.$E30]);"";[$'03.Muestra'.$E30]) ->  | E307: of:=IF([.D307]<>"";IF(AND([.B307]<>"";[.C307]<>"");"";"ERR");"") -> 
B308: of:=IF( ISBLANK([$'03.Muestra'.$C31]);"";[$'03.Muestra'.$C31]) ->  | C308: of:=IF( ISBLANK([$'03.Muestra'.$E31]);"";[$'03.Muestra'.$E31]) ->  | E308: of:=IF([.D308]<>"";IF(AND([.B308]<>"";[.C308]<>"");"";"ERR");"") -> 
B309: of:=IF( ISBLANK([$'03.Muestra'.$C32]);"";[$'03.Muestra'.$C32]) ->  | C309: of:=IF( ISBLANK([$'03.Muestra'.$E32]);"";[$'03.Muestra'.$E32]) ->  | E309: of:=IF([.D309]<>"";IF(AND([.B309]<>"";[.C309]<>"");"";"ERR");"") -> 
B310: of:=IF( ISBLANK([$'03.Muestra'.$C33]);"";[$'03.Muestra'.$C33]) ->  | C310: of:=IF( ISBLANK([$'03.Muestra'.$E33]);"";[$'03.Muestra'.$E33]) ->  | E310: of:=IF([.D310]<>"";IF(AND([.B310]<>"";[.C310]<>"");"";"ERR");"") -> 
B311: of:=IF( ISBLANK([$'03.Muestra'.$C34]);"";[$'03.Muestra'.$C34]) ->  | C311: of:=IF( ISBLANK([$'03.Muestra'.$E34]);"";[$'03.Muestra'.$E34]) ->  | E311: of:=IF([.D311]<>"";IF(AND([.B311]<>"";[.C311]<>"");"";"ERR");"") -> 
B312: of:=IF( ISBLANK([$'03.Muestra'.$C35]);"";[$'03.Muestra'.$C35]) ->  | C312: of:=IF( ISBLANK([$'03.Muestra'.$E35]);"";[$'03.Muestra'.$E35]) ->  | E312: of:=IF([.D312]<>"";IF(AND([.B312]<>"";[.C312]<>"");"";"ERR");"") -> 
B313: of:=IF( ISBLANK([$'03.Muestra'.$C36]);"";[$'03.Muestra'.$C36]) ->  | C313: of:=IF( ISBLANK([$'03.Muestra'.$E36]);"";[$'03.Muestra'.$E36]) ->  | E313: of:=IF([.D313]<>"";IF(AND([.B313]<>"";[.C313]<>"");"";"ERR");"") -> 
B314: of:=IF( ISBLANK([$'03.Muestra'.$C37]);"";[$'03.Muestra'.$C37]) ->  | C314: of:=IF( ISBLANK([$'03.Muestra'.$E37]);"";[$'03.Muestra'.$E37]) ->  | E314: of:=IF([.D314]<>"";IF(AND([.B314]<>"";[.C314]<>"");"";"ERR");"") -> 
B315: of:=IF( ISBLANK([$'03.Muestra'.$C38]);"";[$'03.Muestra'.$C38]) ->  | C315: of:=IF( ISBLANK([$'03.Muestra'.$E38]);"";[$'03.Muestra'.$E38]) ->  | E315: of:=IF([.D315]<>"";IF(AND([.B315]<>"";[.C315]<>"");"";"ERR");"") -> 
B316: of:=IF( ISBLANK([$'03.Muestra'.$C39]);"";[$'03.Muestra'.$C39]) ->  | C316: of:=IF( ISBLANK([$'03.Muestra'.$E39]);"";[$'03.Muestra'.$E39]) ->  | E316: of:=IF([.D316]<>"";IF(AND([.B316]<>"";[.C316]<>"");"";"ERR");"") -> 
B317: of:=IF( ISBLANK([$'03.Muestra'.$C40]);"";[$'03.Muestra'.$C40]) ->  | C317: of:=IF( ISBLANK([$'03.Muestra'.$E40]);"";[$'03.Muestra'.$E40]) ->  | E317: of:=IF([.D317]<>"";IF(AND([.B317]<>"";[.C317]<>"");"";"ERR");"") -> 
B318: of:=IF( ISBLANK([$'03.Muestra'.$C41]);"";[$'03.Muestra'.$C41]) ->  | C318: of:=IF( ISBLANK([$'03.Muestra'.$E41]);"";[$'03.Muestra'.$E41]) ->  | E318: of:=IF([.D318]<>"";IF(AND([.B318]<>"";[.C318]<>"");"";"ERR");"") -> 
B319: of:=IF( ISBLANK([$'03.Muestra'.$C42]);"";[$'03.Muestra'.$C42]) ->  | C319: of:=IF( ISBLANK([$'03.Muestra'.$E42]);"";[$'03.Muestra'.$E42]) ->  | E319: of:=IF([.D319]<>"";IF(AND([.B319]<>"";[.C319]<>"");"";"ERR");"") -> 
E320: of:=IF([.D320]<>"";IF(AND([.B320]<>"";[.C320]<>"");"";"ERR");"") -> 
B322: A | C322: 2.4.3 Orden del foco | D322: Resultado
B323: of:=IF( ISBLANK([$'03.Muestra'.$C8]);"";[$'03.Muestra'.$C8]) ->  | C323: of:=IF( ISBLANK([$'03.Muestra'.$E8]);"";[$'03.Muestra'.$E8]) ->  | E323: of:=IF([.D323]<>"";IF(AND([.B323]<>"";[.C323]<>"");"";"ERR");"") ->  | F323: N/T | G323: N/D | H323: N/A | I323: Falla | J323: Pasa | K323: En blanco
B324: of:=IF( ISBLANK([$'03.Muestra'.$C9]);"";[$'03.Muestra'.$C9]) ->  | C324: of:=IF( ISBLANK([$'03.Muestra'.$E9]);"";[$'03.Muestra'.$E9]) ->  | E324: of:=IF([.D324]<>"";IF(AND([.B324]<>"";[.C324]<>"");"";"ERR");"") ->  | F324: of:=COUNTIF([.$D323]:INDIRECT("$D" &  SUM(ROW()-1;[$'03.Muestra'.$D$45])-1);[.F323]) -> 0 | G324: of:=COUNTIF([.$D323]:INDIRECT("$D" &  SUM(ROW()-1;[$'03.Muestra'.$D$45])-1);[.G323]) -> 0 | H324: of:=COUNTIF([.$D323]:INDIRECT("$D" &  SUM(ROW()-1;[$'03.Muestra'.$D$45])-1);[.H323]) -> 0 | I324: of:=COUNTIF([.$D323]:INDIRECT("$D" &  SUM(ROW()-1;[$'03.Muestra'.$D$45])-1);[.I323]) -> 0 | J324: of:=COUNTIF([.$D323]:INDIRECT("$D" &  SUM(ROW()-1;[$'03.Muestra'.$D$45])-1);[.J323]) -> 0 | K324: of:=IF([$'03.Muestra'.$D$45]=0;0;COUNTBLANK([.$D323]:INDIRECT("$D" &  SUM(ROW()-1;[$'03.Muestra'.$D$45])-1))) -> 0
B325: of:=IF( ISBLANK([$'03.Muestra'.$C10]);"";[$'03.Muestra'.$C10]) ->  | C325: of:=IF( ISBLANK([$'03.Muestra'.$E10]);"";[$'03.Muestra'.$E10]) ->  | E325: of:=IF([.D325]<>"";IF(AND([.B325]<>"";[.C325]<>"");"";"ERR");"") -> 
B326: of:=IF( ISBLANK([$'03.Muestra'.$C11]);"";[$'03.Muestra'.$C11]) ->  | C326: of:=IF( ISBLANK([$'03.Muestra'.$E11]);"";[$'03.Muestra'.$E11]) ->  | E326: of:=IF([.D326]<>"";IF(AND([.B326]<>"";[.C326]<>"");"";"ERR");"") -> 
B327: of:=IF( ISBLANK([$'03.Muestra'.$C12]);"";[$'03.Muestra'.$C12]) ->  | C327: of:=IF( ISBLANK([$'03.Muestra'.$E12]);"";[$'03.Muestra'.$E12]) ->  | E327: of:=IF([.D327]<>"";IF(AND([.B327]<>"";[.C327]<>"");"";"ERR");"") -> 
B328: of:=IF( ISBLANK([$'03.Muestra'.$C13]);"";[$'03.Muestra'.$C13]) ->  | C328: of:=IF( ISBLANK([$'03.Muestra'.$E13]);"";[$'03.Muestra'.$E13]) ->  | E328: of:=IF([.D328]<>"";IF(AND([.B328]<>"";[.C328]<>"");"";"ERR");"") -> 
B329: of:=IF( ISBLANK([$'03.Muestra'.$C14]);"";[$'03.Muestra'.$C14]) ->  | C329: of:=IF( ISBLANK([$'03.Muestra'.$E14]);"";[$'03.Muestra'.$E14]) ->  | E329: of:=IF([.D329]<>"";IF(AND([.B329]<>"";[.C329]<>"");"";"ERR");"") -> 
B330: of:=IF( ISBLANK([$'03.Muestra'.$C15]);"";[$'03.Muestra'.$C15]) ->  | C330: of:=IF( ISBLANK([$'03.Muestra'.$E15]);"";[$'03.Muestra'.$E15]) ->  | E330: of:=IF([.D330]<>"";IF(AND([.B330]<>"";[.C330]<>"");"";"ERR");"") -> 
B331: of:=IF( ISBLANK([$'03.Muestra'.$C16]);"";[$'03.Muestra'.$C16]) ->  | C331: of:=IF( ISBLANK([$'03.Muestra'.$E16]);"";[$'03.Muestra'.$E16]) ->  | E331: of:=IF([.D331]<>"";IF(AND([.B331]<>"";[.C331]<>"");"";"ERR");"") -> 
B332: of:=IF( ISBLANK([$'03.Muestra'.$C17]);"";[$'03.Muestra'.$C17]) ->  | C332: of:=IF( ISBLANK([$'03.Muestra'.$E17]);"";[$'03.Muestra'.$E17]) ->  | E332: of:=IF([.D332]<>"";IF(AND([.B332]<>"";[.C332]<>"");"";"ERR");"") -> 
B333: of:=IF( ISBLANK([$'03.Muestra'.$C18]);"";[$'03.Muestra'.$C18]) ->  | C333: of:=IF( ISBLANK([$'03.Muestra'.$E18]);"";[$'03.Muestra'.$E18]) ->  | E333: of:=IF([.D333]<>"";IF(AND([.B333]<>"";[.C333]<>"");"";"ERR");"") -> 
B334: of:=IF( ISBLANK([$'03.Muestra'.$C19]);"";[$'03.Muestra'.$C19]) ->  | C334: of:=IF( ISBLANK([$'03.Muestra'.$E19]);"";[$'03.Muestra'.$E19]) ->  | E334: of:=IF([.D334]<>"";IF(AND([.B334]<>"";[.C334]<>"");"";"ERR");"") -> 
B335: of:=IF( ISBLANK([$'03.Muestra'.$C20]);"";[$'03.Muestra'.$C20]) ->  | C335: of:=IF( ISBLANK([$'03.Muestra'.$E20]);"";[$'03.Muestra'.$E20]) ->  | E335: of:=IF([.D335]<>"";IF(AND([.B335]<>"";[.C335]<>"");"";"ERR");"") -> 
B336: of:=IF( ISBLANK([$'03.Muestra'.$C21]);"";[$'03.Muestra'.$C21]) ->  | C336: of:=IF( ISBLANK([$'03.Muestra'.$E21]);"";[$'03.Muestra'.$E21]) ->  | E336: of:=IF([.D336]<>"";IF(AND([.B336]<>"";[.C336]<>"");"";"ERR");"") -> 
B337: of:=IF( ISBLANK([$'03.Muestra'.$C22]);"";[$'03.Muestra'.$C22]) ->  | C337: of:=IF( ISBLANK([$'03.Muestra'.$E22]);"";[$'03.Muestra'.$E22]) ->  | E337: of:=IF([.D337]<>"";IF(AND([.B337]<>"";[.C337]<>"");"";"ERR");"") -> 
B338: of:=IF( ISBLANK([$'03.Muestra'.$C23]);"";[$'03.Muestra'.$C23]) ->  | C338: of:=IF( ISBLANK([$'03.Muestra'.$E23]);"";[$'03.Muestra'.$E23]) ->  | E338: of:=IF([.D338]<>"";IF(AND([.B338]<>"";[.C338]<>"");"";"ERR");"") -> 
B339: of:=IF( ISBLANK([$'03.Muestra'.$C24]);"";[$'03.Muestra'.$C24]) ->  | C339: of:=IF( ISBLANK([$'03.Muestra'.$E24]);"";[$'03.Muestra'.$E24]) ->  | E339: of:=IF([.D339]<>"";IF(AND([.B339]<>"";[.C339]<>"");"";"ERR");"") -> 
B340: of:=IF( ISBLANK([$'03.Muestra'.$C25]);"";[$'03.Muestra'.$C25]) ->  | C340: of:=IF( ISBLANK([$'03.Muestra'.$E25]);"";[$'03.Muestra'.$E25]) ->  | E340: of:=IF([.D340]<>"";IF(AND([.B340]<>"";[.C340]<>"");"";"ERR");"") -> 
B341: of:=IF( ISBLANK([$'03.Muestra'.$C26]);"";[$'03.Muestra'.$C26]) ->  | C341: of:=IF( ISBLANK([$'03.Muestra'.$E26]);"";[$'03.Muestra'.$E26]) ->  | E341: of:=IF([.D341]<>"";IF(AND([.B341]<>"";[.C341]<>"");"";"ERR");"") -> 
B342: of:=IF( ISBLANK([$'03.Muestra'.$C27]);"";[$'03.Muestra'.$C27]) ->  | C342: of:=IF( ISBLANK([$'03.Muestra'.$E27]);"";[$'03.Muestra'.$E27]) ->  | E342: of:=IF([.D342]<>"";IF(AND([.B342]<>"";[.C342]<>"");"";"ERR");"") -> 
B343: of:=IF( ISBLANK([$'03.Muestra'.$C28]);"";[$'03.Muestra'.$C28]) ->  | C343: of:=IF( ISBLANK([$'03.Muestra'.$E28]);"";[$'03.Muestra'.$E28]) ->  | E343: of:=IF([.D343]<>"";IF(AND([.B343]<>"";[.C343]<>"");"";"ERR");"") -> 
B344: of:=IF( ISBLANK([$'03.Muestra'.$C29]);"";[$'03.Muestra'.$C29]) ->  | C344: of:=IF( ISBLANK([$'03.Muestra'.$E29]);"";[$'03.Muestra'.$E29]) ->  | E344: of:=IF([.D344]<>"";IF(AND([.B344]<>"";[.C344]<>"");"";"ERR");"") -> 
B345: of:=IF( ISBLANK([$'03.Muestra'.$C30]);"";[$'03.Muestra'.$C30]) ->  | C345: of:=IF( ISBLANK([$'03.Muestra'.$E30]);"";[$'03.Muestra'.$E30]) ->  | E345: of:=IF([.D345]<>"";IF(AND([.B345]<>"";[.C345]<>"");"";"ERR");"") -> 
B346: of:=IF( ISBLANK([$'03.Muestra'.$C31]);"";[$'03.Muestra'.$C31]) ->  | C346: of:=IF( ISBLANK([$'03.Muestra'.$E31]);"";[$'03.Muestra'.$E31]) ->  | E346: of:=IF([.D346]<>"";IF(AND([.B346]<>"";[.C346]<>"");"";"ERR");"") -> 
B347: of:=IF( ISBLANK([$'03.Muestra'.$C32]);"";[$'03.Muestra'.$C32]) ->  | C347: of:=IF( ISBLANK([$'03.Muestra'.$E32]);"";[$'03.Muestra'.$E32]) ->  | E347: of:=IF([.D347]<>"";IF(AND([.B347]<>"";[.C347]<>"");"";"ERR");"") -> 
B348: of:=IF( ISBLANK([$'03.Muestra'.$C33]);"";[$'03.Muestra'.$C33]) ->  | C348: of:=IF( ISBLANK([$'03.Muestra'.$E33]);"";[$'03.Muestra'.$E33]) ->  | E348: of:=IF([.D348]<>"";IF(AND([.B348]<>"";[.C348]<>"");"";"ERR");"") -> 
B349: of:=IF( ISBLANK([$'03.Muestra'.$C34]);"";[$'03.Muestra'.$C34]) ->  | C349: of:=IF( ISBLANK([$'03.Muestra'.$E34]);"";[$'03.Muestra'.$E34]) ->  | E349: of:=IF([.D349]<>"";IF(AND([.B349]<>"";[.C349]<>"");"";"ERR");"") -> 
B350: of:=IF( ISBLANK([$'03.Muestra'.$C35]);"";[$'03.Muestra'.$C35]) ->  | C350: of:=IF( ISBLANK([$'03.Muestra'.$E35]);"";[$'03.Muestra'.$E35]) ->  | E350: of:=IF([.D350]<>"";IF(AND([.B350]<>"";[.C350]<>"");"";"ERR");"") -> 
B351: of:=IF( ISBLANK([$'03.Muestra'.$C36]);"";[$'03.Muestra'.$C36]) ->  | C351: of:=IF( ISBLANK([$'03.Muestra'.$E36]);"";[$'03.Muestra'.$E36]) ->  | E351: of:=IF([.D351]<>"";IF(AND([.B351]<>"";[.C351]<>"");"";"ERR");"") -> 
B352: of:=IF( ISBLANK([$'03.Muestra'.$C37]);"";[$'03.Muestra'.$C37]) ->  | C352: of:=IF( ISBLANK([$'03.Muestra'.$E37]);"";[$'03.Muestra'.$E37]) ->  | E352: of:=IF([.D352]<>"";IF(AND([.B352]<>"";[.C352]<>"");"";"ERR");"") -> 
B353: of:=IF( ISBLANK([$'03.Muestra'.$C38]);"";[$'03.Muestra'.$C38]) ->  | C353: of:=IF( ISBLANK([$'03.Muestra'.$E38]);"";[$'03.Muestra'.$E38]) ->  | E353: of:=IF([.D353]<>"";IF(AND([.B353]<>"";[.C353]<>"");"";"ERR");"") -> 
B354: of:=IF( ISBLANK([$'03.Muestra'.$C39]);"";[$'03.Muestra'.$C39]) ->  | C354: of:=IF( ISBLANK([$'03.Muestra'.$E39]);"";[$'03.Muestra'.$E39]) ->  | E354: of:=IF([.D354]<>"";IF(AND([.B354]<>"";[.C354]<>"");"";"ERR");"") -> 
B355: of:=IF( ISBLANK([$'03.Muestra'.$C40]);"";[$'03.Muestra'.$C40]) ->  | C355: of:=IF( ISBLANK([$'03.Muestra'.$E40]);"";[$'03.Muestra'.$E40]) ->  | E355: of:=IF([.D355]<>"";IF(AND([.B355]<>"";[.C355]<>"");"";"ERR");"") -> 
B356: of:=IF( ISBLANK([$'03.Muestra'.$C41]);"";[$'03.Muestra'.$C41]) ->  | C356: of:=IF( ISBLANK([$'03.Muestra'.$E41]);"";[$'03.Muestra'.$E41]) ->  | E356: of:=IF([.D356]<>"";IF(AND([.B356]<>"";[.C356]<>"");"";"ERR");"") -> 
B357: of:=IF( ISBLANK([$'03.Muestra'.$C42]);"";[$'03.Muestra'.$C42]) ->  | C357: of:=IF( ISBLANK([$'03.Muestra'.$E42]);"";[$'03.Muestra'.$E42]) ->  | E357: of:=IF([.D357]<>"";IF(AND([.B357]<>"";[.C357]<>"");"";"ERR");"") -> 
B360: A | C360: 2.4.4 Propósito de los enlaces (en contexto) | D360: Resultado
B361: of:=IF( ISBLANK([$'03.Muestra'.$C8]);"";[$'03.Muestra'.$C8]) ->  | C361: of:=IF( ISBLANK([$'03.Muestra'.$E8]);"";[$'03.Muestra'.$E8]) ->  | E361: of:=IF([.D361]<>"";IF(AND([.B361]<>"";[.C361]<>"");"";"ERR");"") ->  | F361: N/T | G361: N/D | H361: N/A | I361: Falla | J361: Pasa | K361: En blanco
B362: of:=IF( ISBLANK([$'03.Muestra'.$C9]);"";[$'03.Muestra'.$C9]) ->  | C362: of:=IF( ISBLANK([$'03.Muestra'.$E9]);"";[$'03.Muestra'.$E9]) ->  | E362: of:=IF([.D362]<>"";IF(AND([.B362]<>"";[.C362]<>"");"";"ERR");"") ->  | F362: of:=COUNTIF([.$D361]:INDIRECT("$D" &  SUM(ROW()-1;[$'03.Muestra'.$D$45])-1);[.F361]) -> 0 | G362: of:=COUNTIF([.$D361]:INDIRECT("$D" &  SUM(ROW()-1;[$'03.Muestra'.$D$45])-1);[.G361]) -> 0 | H362: of:=COUNTIF([.$D361]:INDIRECT("$D" &  SUM(ROW()-1;[$'03.Muestra'.$D$45])-1);[.H361]) -> 0 | I362: of:=COUNTIF([.$D361]:INDIRECT("$D" &  SUM(ROW()-1;[$'03.Muestra'.$D$45])-1);[.I361]) -> 0 | J362: of:=COUNTIF([.$D361]:INDIRECT("$D" &  SUM(ROW()-1;[$'03.Muestra'.$D$45])-1);[.J361]) -> 0 | K362: of:=IF([$'03.Muestra'.$D$45]=0;0;COUNTBLANK([.$D361]:INDIRECT("$D" &  SUM(ROW()-1;[$'03.Muestra'.$D$45])-1))) -> 0
B363: of:=IF( ISBLANK([$'03.Muestra'.$C10]);"";[$'03.Muestra'.$C10]) ->  | C363: of:=IF( ISBLANK([$'03.Muestra'.$E10]);"";[$'03.Muestra'.$E10]) ->  | E363: of:=IF([.D363]<>"";IF(AND([.B363]<>"";[.C363]<>"");"";"ERR");"") -> 
B364: of:=IF( ISBLANK([$'03.Muestra'.$C11]);"";[$'03.Muestra'.$C11]) ->  | C364: of:=IF( ISBLANK([$'03.Muestra'.$E11]);"";[$'03.Muestra'.$E11]) ->  | E364: of:=IF([.D364]<>"";IF(AND([.B364]<>"";[.C364]<>"");"";"ERR");"") -> 
B365: of:=IF( ISBLANK([$'03.Muestra'.$C12]);"";[$'03.Muestra'.$C12]) ->  | C365: of:=IF( ISBLANK([$'03.Muestra'.$E12]);"";[$'03.Muestra'.$E12]) ->  | E365: of:=IF([.D365]<>"";IF(AND([.B365]<>"";[.C365]<>"");"";"ERR");"") -> 
B366: of:=IF( ISBLANK([$'03.Muestra'.$C13]);"";[$'03.Muestra'.$C13]) ->  | C366: of:=IF( ISBLANK([$'03.Muestra'.$E13]);"";[$'03.Muestra'.$E13]) ->  | E366: of:=IF([.D366]<>"";IF(AND([.B366]<>"";[.C366]<>"");"";"ERR");"") -> 
B367: of:=IF( ISBLANK([$'03.Muestra'.$C14]);"";[$'03.Muestra'.$C14]) ->  | C367: of:=IF( ISBLANK([$'03.Muestra'.$E14]);"";[$'03.Muestra'.$E14]) ->  | E367: of:=IF([.D367]<>"";IF(AND([.B367]<>"";[.C367]<>"");"";"ERR");"") -> 
B368: of:=IF( ISBLANK([$'03.Muestra'.$C15]);"";[$'03.Muestra'.$C15]) ->  | C368: of:=IF( ISBLANK([$'03.Muestra'.$E15]);"";[$'03.Muestra'.$E15]) ->  | E368: of:=IF([.D368]<>"";IF(AND([.B368]<>"";[.C368]<>"");"";"ERR");"") -> 
B369: of:=IF( ISBLANK([$'03.Muestra'.$C16]);"";[$'03.Muestra'.$C16]) ->  | C369: of:=IF( ISBLANK([$'03.Muestra'.$E16]);"";[$'03.Muestra'.$E16]) ->  | E369: of:=IF([.D369]<>"";IF(AND([.B369]<>"";[.C369]<>"");"";"ERR");"") -> 
B370: of:=IF( ISBLANK([$'03.Muestra'.$C17]);"";[$'03.Muestra'.$C17]) ->  | C370: of:=IF( ISBLANK([$'03.Muestra'.$E17]);"";[$'03.Muestra'.$E17]) ->  | E370: of:=IF([.D370]<>"";IF(AND([.B370]<>"";[.C370]<>"");"";"ERR");"") -> 
B371: of:=IF( ISBLANK([$'03.Muestra'.$C18]);"";[$'03.Muestra'.$C18]) ->  | C371: of:=IF( ISBLANK([$'03.Muestra'.$E18]);"";[$'03.Muestra'.$E18]) ->  | E371: of:=IF([.D371]<>"";IF(AND([.B371]<>"";[.C371]<>"");"";"ERR");"") -> 
B372: of:=IF( ISBLANK([$'03.Muestra'.$C19]);"";[$'03.Muestra'.$C19]) ->  | C372: of:=IF( ISBLANK([$'03.Muestra'.$E19]);"";[$'03.Muestra'.$E19]) ->  | E372: of:=IF([.D372]<>"";IF(AND([.B372]<>"";[.C372]<>"");"";"ERR");"") -> 
B373: of:=IF( ISBLANK([$'03.Muestra'.$C20]);"";[$'03.Muestra'.$C20]) ->  | C373: of:=IF( ISBLANK([$'03.Muestra'.$E20]);"";[$'03.Muestra'.$E20]) ->  | E373: of:=IF([.D373]<>"";IF(AND([.B373]<>"";[.C373]<>"");"";"ERR");"") -> 
B374: of:=IF( ISBLANK([$'03.Muestra'.$C21]);"";[$'03.Muestra'.$C21]) ->  | C374: of:=IF( ISBLANK([$'03.Muestra'.$E21]);"";[$'03.Muestra'.$E21]) ->  | E374: of:=IF([.D374]<>"";IF(AND([.B374]<>"";[.C374]<>"");"";"ERR");"") -> 
B375: of:=IF( ISBLANK([$'03.Muestra'.$C22]);"";[$'03.Muestra'.$C22]) ->  | C375: of:=IF( ISBLANK([$'03.Muestra'.$E22]);"";[$'03.Muestra'.$E22]) ->  | E375: of:=IF([.D375]<>"";IF(AND([.B375]<>"";[.C375]<>"");"";"ERR");"") -> 
B376: of:=IF( ISBLANK([$'03.Muestra'.$C23]);"";[$'03.Muestra'.$C23]) ->  | C376: of:=IF( ISBLANK([$'03.Muestra'.$E23]);"";[$'03.Muestra'.$E23]) ->  | E376: of:=IF([.D376]<>"";IF(AND([.B376]<>"";[.C376]<>"");"";"ERR");"") -> 
B377: of:=IF( ISBLANK([$'03.Muestra'.$C24]);"";[$'03.Muestra'.$C24]) ->  | C377: of:=IF( ISBLANK([$'03.Muestra'.$E24]);"";[$'03.Muestra'.$E24]) ->  | E377: of:=IF([.D377]<>"";IF(AND([.B377]<>"";[.C377]<>"");"";"ERR");"") -> 
B378: of:=IF( ISBLANK([$'03.Muestra'.$C25]);"";[$'03.Muestra'.$C25]) ->  | C378: of:=IF( ISBLANK([$'03.Muestra'.$E25]);"";[$'03.Muestra'.$E25]) ->  | E378: of:=IF([.D378]<>"";IF(AND([.B378]<>"";[.C378]<>"");"";"ERR");"") -> 
B379: of:=IF( ISBLANK([$'03.Muestra'.$C26]);"";[$'03.Muestra'.$C26]) ->  | C379: of:=IF( ISBLANK([$'03.Muestra'.$E26]);"";[$'03.Muestra'.$E26]) ->  | E379: of:=IF([.D379]<>"";IF(AND([.B379]<>"";[.C379]<>"");"";"ERR");"") -> 
B380: of:=IF( ISBLANK([$'03.Muestra'.$C27]);"";[$'03.Muestra'.$C27]) ->  | C380: of:=IF( ISBLANK([$'03.Muestra'.$E27]);"";[$'03.Muestra'.$E27]) ->  | E380: of:=IF([.D380]<>"";IF(AND([.B380]<>"";[.C380]<>"");"";"ERR");"") -> 
B381: of:=IF( ISBLANK([$'03.Muestra'.$C28]);"";[$'03.Muestra'.$C28]) ->  | C381: of:=IF( ISBLANK([$'03.Muestra'.$E28]);"";[$'03.Muestra'.$E28]) ->  | E381: of:=IF([.D381]<>"";IF(AND([.B381]<>"";[.C381]<>"");"";"ERR");"") -> 
B382: of:=IF( ISBLANK([$'03.Muestra'.$C29]);"";[$'03.Muestra'.$C29]) ->  | C382: of:=IF( ISBLANK([$'03.Muestra'.$E29]);"";[$'03.Muestra'.$E29]) ->  | E382: of:=IF([.D382]<>"";IF(AND([.B382]<>"";[.C382]<>"");"";"ERR");"") -> 
B383: of:=IF( ISBLANK([$'03.Muestra'.$C30]);"";[$'03.Muestra'.$C30]) ->  | C383: of:=IF( ISBLANK([$'03.Muestra'.$E30]);"";[$'03.Muestra'.$E30]) ->  | E383: of:=IF([.D383]<>"";IF(AND([.B383]<>"";[.C383]<>"");"";"ERR");"") -> 
B384: of:=IF( ISBLANK([$'03.Muestra'.$C31]);"";[$'03.Muestra'.$C31]) ->  | C384: of:=IF( ISBLANK([$'03.Muestra'.$E31]);"";[$'03.Muestra'.$E31]) ->  | E384: of:=IF([.D384]<>"";IF(AND([.B384]<>"";[.C384]<>"");"";"ERR");"") -> 
B385: of:=IF( ISBLANK([$'03.Muestra'.$C32]);"";[$'03.Muestra'.$C32]) ->  | C385: of:=IF( ISBLANK([$'03.Muestra'.$E32]);"";[$'03.Muestra'.$E32]) ->  | E385: of:=IF([.D385]<>"";IF(AND([.B385]<>"";[.C385]<>"");"";"ERR");"") -> 
B386: of:=IF( ISBLANK([$'03.Muestra'.$C33]);"";[$'03.Muestra'.$C33]) ->  | C386: of:=IF( ISBLANK([$'03.Muestra'.$E33]);"";[$'03.Muestra'.$E33]) ->  | E386: of:=IF([.D386]<>"";IF(AND([.B386]<>"";[.C386]<>"");"";"ERR");"") -> 
B387: of:=IF( ISBLANK([$'03.Muestra'.$C34]);"";[$'03.Muestra'.$C34]) ->  | C387: of:=IF( ISBLANK([$'03.Muestra'.$E34]);"";[$'03.Muestra'.$E34]) ->  | E387: of:=IF([.D387]<>"";IF(AND([.B387]<>"";[.C387]<>"");"";"ERR");"") -> 
B388: of:=IF( ISBLANK([$'03.Muestra'.$C35]);"";[$'03.Muestra'.$C35]) ->  | C388: of:=IF( ISBLANK([$'03.Muestra'.$E35]);"";[$'03.Muestra'.$E35]) ->  | E388: of:=IF([.D388]<>"";IF(AND([.B388]<>"";[.C388]<>"");"";"ERR");"") -> 
B389: of:=IF( ISBLANK([$'03.Muestra'.$C36]);"";[$'03.Muestra'.$C36]) ->  | C389: of:=IF( ISBLANK([$'03.Muestra'.$E36]);"";[$'03.Muestra'.$E36]) ->  | E389: of:=IF([.D389]<>"";IF(AND([.B389]<>"";[.C389]<>"");"";"ERR");"") -> 
B390: of:=IF( ISBLANK([$'03.Muestra'.$C37]);"";[$'03.Muestra'.$C37]) ->  | C390: of:=IF( ISBLANK([$'03.Muestra'.$E37]);"";[$'03.Muestra'.$E37]) ->  | E390: of:=IF([.D390]<>"";IF(AND([.B390]<>"";[.C390]<>"");"";"ERR");"") -> 
B391: of:=IF( ISBLANK([$'03.Muestra'.$C38]);"";[$'03.Muestra'.$C38]) ->  | C391: of:=IF( ISBLANK([$'03.Muestra'.$E38]);"";[$'03.Muestra'.$E38]) ->  | E391: of:=IF([.D391]<>"";IF(AND([.B391]<>"";[.C391]<>"");"";"ERR");"") -> 
B392: of:=IF( ISBLANK([$'03.Muestra'.$C39]);"";[$'03.Muestra'.$C39]) ->  | C392: of:=IF( ISBLANK([$'03.Muestra'.$E39]);"";[$'03.Muestra'.$E39]) ->  | E392: of:=IF([.D392]<>"";IF(AND([.B392]<>"";[.C392]<>"");"";"ERR");"") -> 
B393: of:=IF( ISBLANK([$'03.Muestra'.$C40]);"";[$'03.Muestra'.$C40]) ->  | C393: of:=IF( ISBLANK([$'03.Muestra'.$E40]);"";[$'03.Muestra'.$E40]) ->  | E393: of:=IF([.D393]<>"";IF(AND([.B393]<>"";[.C393]<>"");"";"ERR");"") -> 
B394: of:=IF( ISBLANK([$'03.Muestra'.$C41]);"";[$'03.Muestra'.$C41]) ->  | C394: of:=IF( ISBLANK([$'03.Muestra'.$E41]);"";[$'03.Muestra'.$E41]) ->  | E394: of:=IF([.D394]<>"";IF(AND([.B394]<>"";[.C394]<>"");"";"ERR");"") -> 
B395: of:=IF( ISBLANK([$'03.Muestra'.$C42]);"";[$'03.Muestra'.$C42]) ->  | C395: of:=IF( ISBLANK([$'03.Muestra'.$E42]);"";[$'03.Muestra'.$E42]) ->  | E395: of:=IF([.D395]<>"";IF(AND([.B395]<>"";[.C395]<>"");"";"ERR");"") -> 
B398: AA | C398: 2.4.5 Múltiples vías | D398: Resultado
B399: of:=IF( ISBLANK([$'03.Muestra'.$C8]);"";[$'03.Muestra'.$C8]) ->  | C399: of:=IF( ISBLANK([$'03.Muestra'.$E8]);"";[$'03.Muestra'.$E8]) ->  | E399: of:=IF([.D399]<>"";IF(AND([.B399]<>"";[.C399]<>"");"";"ERR");"") ->  | F399: N/T | G399: N/D | H399: N/A | I399: Falla | J399: Pasa | K399: En blanco
B400: of:=IF( ISBLANK([$'03.Muestra'.$C9]);"";[$'03.Muestra'.$C9]) ->  | C400: of:=IF( ISBLANK([$'03.Muestra'.$E9]);"";[$'03.Muestra'.$E9]) ->  | E400: of:=IF([.D400]<>"";IF(AND([.B400]<>"";[.C400]<>"");"";"ERR");"") ->  | F400: of:=COUNTIF([.$D399]:INDIRECT("$D" &  SUM(ROW()-1;[$'03.Muestra'.$D$45])-1);[.F399]) -> 0 | G400: of:=COUNTIF([.$D399]:INDIRECT("$D" &  SUM(ROW()-1;[$'03.Muestra'.$D$45])-1);[.G399]) -> 0 | H400: of:=COUNTIF([.$D399]:INDIRECT("$D" &  SUM(ROW()-1;[$'03.Muestra'.$D$45])-1);[.H399]) -> 0 | I400: of:=COUNTIF([.$D399]:INDIRECT("$D" &  SUM(ROW()-1;[$'03.Muestra'.$D$45])-1);[.I399]) -> 0 | J400: of:=COUNTIF([.$D399]:INDIRECT("$D" &  SUM(ROW()-1;[$'03.Muestra'.$D$45])-1);[.J399]) -> 0 | K400: of:=IF([$'03.Muestra'.$D$45]=0;0;COUNTBLANK([.$D399]:INDIRECT("$D" &  SUM(ROW()-1;[$'03.Muestra'.$D$45])-1))) -> 0
B401: of:=IF( ISBLANK([$'03.Muestra'.$C10]);"";[$'03.Muestra'.$C10]) ->  | C401: of:=IF( ISBLANK([$'03.Muestra'.$E10]);"";[$'03.Muestra'.$E10]) ->  | E401: of:=IF([.D401]<>"";IF(AND([.B401]<>"";[.C401]<>"");"";"ERR");"") -> 
B402: of:=IF( ISBLANK([$'03.Muestra'.$C11]);"";[$'03.Muestra'.$C11]) ->  | C402: of:=IF( ISBLANK([$'03.Muestra'.$E11]);"";[$'03.Muestra'.$E11]) ->  | E402: of:=IF([.D402]<>"";IF(AND([.B402]<>"";[.C402]<>"");"";"ERR");"") -> 
B403: of:=IF( ISBLANK([$'03.Muestra'.$C12]);"";[$'03.Muestra'.$C12]) ->  | C403: of:=IF( ISBLANK([$'03.Muestra'.$E12]);"";[$'03.Muestra'.$E12]) ->  | E403: of:=IF([.D403]<>"";IF(AND([.B403]<>"";[.C403]<>"");"";"ERR");"") -> 
B404: of:=IF( ISBLANK([$'03.Muestra'.$C13]);"";[$'03.Muestra'.$C13]) ->  | C404: of:=IF( ISBLANK([$'03.Muestra'.$E13]);"";[$'03.Muestra'.$E13]) ->  | E404: of:=IF([.D404]<>"";IF(AND([.B404]<>"";[.C404]<>"");"";"ERR");"") -> 
B405: of:=IF( ISBLANK([$'03.Muestra'.$C14]);"";[$'03.Muestra'.$C14]) ->  | C405: of:=IF( ISBLANK([$'03.Muestra'.$E14]);"";[$'03.Muestra'.$E14]) ->  | E405: of:=IF([.D405]<>"";IF(AND([.B405]<>"";[.C405]<>"");"";"ERR");"") -> 
B406: of:=IF( ISBLANK([$'03.Muestra'.$C15]);"";[$'03.Muestra'.$C15]) ->  | C406: of:=IF( ISBLANK([$'03.Muestra'.$E15]);"";[$'03.Muestra'.$E15]) ->  | E406: of:=IF([.D406]<>"";IF(AND([.B406]<>"";[.C406]<>"");"";"ERR");"") -> 
B407: of:=IF( ISBLANK([$'03.Muestra'.$C16]);"";[$'03.Muestra'.$C16]) ->  | C407: of:=IF( ISBLANK([$'03.Muestra'.$E16]);"";[$'03.Muestra'.$E16]) ->  | E407: of:=IF([.D407]<>"";IF(AND([.B407]<>"";[.C407]<>"");"";"ERR");"") -> 
B408: of:=IF( ISBLANK([$'03.Muestra'.$C17]);"";[$'03.Muestra'.$C17]) ->  | C408: of:=IF( ISBLANK([$'03.Muestra'.$E17]);"";[$'03.Muestra'.$E17]) ->  | E408: of:=IF([.D408]<>"";IF(AND([.B408]<>"";[.C408]<>"");"";"ERR");"") -> 
B409: of:=IF( ISBLANK([$'03.Muestra'.$C18]);"";[$'03.Muestra'.$C18]) ->  | C409: of:=IF( ISBLANK([$'03.Muestra'.$E18]);"";[$'03.Muestra'.$E18]) ->  | E409: of:=IF([.D409]<>"";IF(AND([.B409]<>"";[.C409]<>"");"";"ERR");"") -> 
B410: of:=IF( ISBLANK([$'03.Muestra'.$C19]);"";[$'03.Muestra'.$C19]) ->  | C410: of:=IF( ISBLANK([$'03.Muestra'.$E19]);"";[$'03.Muestra'.$E19]) ->  | E410: of:=IF([.D410]<>"";IF(AND([.B410]<>"";[.C410]<>"");"";"ERR");"") -> 
B411: of:=IF( ISBLANK([$'03.Muestra'.$C20]);"";[$'03.Muestra'.$C20]) ->  | C411: of:=IF( ISBLANK([$'03.Muestra'.$E20]);"";[$'03.Muestra'.$E20]) ->  | E411: of:=IF([.D411]<>"";IF(AND([.B411]<>"";[.C411]<>"");"";"ERR");"") -> 
B412: of:=IF( ISBLANK([$'03.Muestra'.$C21]);"";[$'03.Muestra'.$C21]) ->  | C412: of:=IF( ISBLANK([$'03.Muestra'.$E21]);"";[$'03.Muestra'.$E21]) ->  | E412: of:=IF([.D412]<>"";IF(AND([.B412]<>"";[.C412]<>"");"";"ERR");"") -> 
B413: of:=IF( ISBLANK([$'03.Muestra'.$C22]);"";[$'03.Muestra'.$C22]) ->  | C413: of:=IF( ISBLANK([$'03.Muestra'.$E22]);"";[$'03.Muestra'.$E22]) ->  | E413: of:=IF([.D413]<>"";IF(AND([.B413]<>"";[.C413]<>"");"";"ERR");"") -> 
B414: of:=IF( ISBLANK([$'03.Muestra'.$C23]);"";[$'03.Muestra'.$C23]) ->  | C414: of:=IF( ISBLANK([$'03.Muestra'.$E23]);"";[$'03.Muestra'.$E23]) ->  | E414: of:=IF([.D414]<>"";IF(AND([.B414]<>"";[.C414]<>"");"";"ERR");"") -> 
B415: of:=IF( ISBLANK([$'03.Muestra'.$C24]);"";[$'03.Muestra'.$C24]) ->  | C415: of:=IF( ISBLANK([$'03.Muestra'.$E24]);"";[$'03.Muestra'.$E24]) ->  | E415: of:=IF([.D415]<>"";IF(AND([.B415]<>"";[.C415]<>"");"";"ERR");"") -> 
B416: of:=IF( ISBLANK([$'03.Muestra'.$C25]);"";[$'03.Muestra'.$C25]) ->  | C416: of:=IF( ISBLANK([$'03.Muestra'.$E25]);"";[$'03.Muestra'.$E25]) ->  | E416: of:=IF([.D416]<>"";IF(AND([.B416]<>"";[.C416]<>"");"";"ERR");"") -> 
B417: of:=IF( ISBLANK([$'03.Muestra'.$C26]);"";[$'03.Muestra'.$C26]) ->  | C417: of:=IF( ISBLANK([$'03.Muestra'.$E26]);"";[$'03.Muestra'.$E26]) ->  | E417: of:=IF([.D417]<>"";IF(AND([.B417]<>"";[.C417]<>"");"";"ERR");"") -> 
B418: of:=IF( ISBLANK([$'03.Muestra'.$C27]);"";[$'03.Muestra'.$C27]) ->  | C418: of:=IF( ISBLANK([$'03.Muestra'.$E27]);"";[$'03.Muestra'.$E27]) ->  | E418: of:=IF([.D418]<>"";IF(AND([.B418]<>"";[.C418]<>"");"";"ERR");"") -> 
B419: of:=IF( ISBLANK([$'03.Muestra'.$C28]);"";[$'03.Muestra'.$C28]) ->  | C419: of:=IF( ISBLANK([$'03.Muestra'.$E28]);"";[$'03.Muestra'.$E28]) ->  | E419: of:=IF([.D419]<>"";IF(AND([.B419]<>"";[.C419]<>"");"";"ERR");"") -> 
B420: of:=IF( ISBLANK([$'03.Muestra'.$C29]);"";[$'03.Muestra'.$C29]) ->  | C420: of:=IF( ISBLANK([$'03.Muestra'.$E29]);"";[$'03.Muestra'.$E29]) ->  | E420: of:=IF([.D420]<>"";IF(AND([.B420]<>"";[.C420]<>"");"";"ERR");"") -> 
B421: of:=IF( ISBLANK([$'03.Muestra'.$C30]);"";[$'03.Muestra'.$C30]) ->  | C421: of:=IF( ISBLANK([$'03.Muestra'.$E30]);"";[$'03.Muestra'.$E30]) ->  | E421: of:=IF([.D421]<>"";IF(AND([.B421]<>"";[.C421]<>"");"";"ERR");"") -> 
B422: of:=IF( ISBLANK([$'03.Muestra'.$C31]);"";[$'03.Muestra'.$C31]) ->  | C422: of:=IF( ISBLANK([$'03.Muestra'.$E31]);"";[$'03.Muestra'.$E31]) ->  | E422: of:=IF([.D422]<>"";IF(AND([.B422]<>"";[.C422]<>"");"";"ERR");"") -> 
B423: of:=IF( ISBLANK([$'03.Muestra'.$C32]);"";[$'03.Muestra'.$C32]) ->  | C423: of:=IF( ISBLANK([$'03.Muestra'.$E32]);"";[$'03.Muestra'.$E32]) ->  | E423: of:=IF([.D423]<>"";IF(AND([.B423]<>"";[.C423]<>"");"";"ERR");"") -> 
B424: of:=IF( ISBLANK([$'03.Muestra'.$C33]);"";[$'03.Muestra'.$C33]) ->  | C424: of:=IF( ISBLANK([$'03.Muestra'.$E33]);"";[$'03.Muestra'.$E33]) ->  | E424: of:=IF([.D424]<>"";IF(AND([.B424]<>"";[.C424]<>"");"";"ERR");"") -> 
B425: of:=IF( ISBLANK([$'03.Muestra'.$C34]);"";[$'03.Muestra'.$C34]) ->  | C425: of:=IF( ISBLANK([$'03.Muestra'.$E34]);"";[$'03.Muestra'.$E34]) ->  | E425: of:=IF([.D425]<>"";IF(AND([.B425]<>"";[.C425]<>"");"";"ERR");"") -> 
B426: of:=IF( ISBLANK([$'03.Muestra'.$C35]);"";[$'03.Muestra'.$C35]) ->  | C426: of:=IF( ISBLANK([$'03.Muestra'.$E35]);"";[$'03.Muestra'.$E35]) ->  | E426: of:=IF([.D426]<>"";IF(AND([.B426]<>"";[.C426]<>"");"";"ERR");"") -> 
B427: of:=IF( ISBLANK([$'03.Muestra'.$C36]);"";[$'03.Muestra'.$C36]) ->  | C427: of:=IF( ISBLANK([$'03.Muestra'.$E36]);"";[$'03.Muestra'.$E36]) ->  | E427: of:=IF([.D427]<>"";IF(AND([.B427]<>"";[.C427]<>"");"";"ERR");"") -> 
B428: of:=IF( ISBLANK([$'03.Muestra'.$C37]);"";[$'03.Muestra'.$C37]) ->  | C428: of:=IF( ISBLANK([$'03.Muestra'.$E37]);"";[$'03.Muestra'.$E37]) ->  | E428: of:=IF([.D428]<>"";IF(AND([.B428]<>"";[.C428]<>"");"";"ERR");"") -> 
B429: of:=IF( ISBLANK([$'03.Muestra'.$C38]);"";[$'03.Muestra'.$C38]) ->  | C429: of:=IF( ISBLANK([$'03.Muestra'.$E38]);"";[$'03.Muestra'.$E38]) ->  | E429: of:=IF([.D429]<>"";IF(AND([.B429]<>"";[.C429]<>"");"";"ERR");"") -> 
B430: of:=IF( ISBLANK([$'03.Muestra'.$C39]);"";[$'03.Muestra'.$C39]) ->  | C430: of:=IF( ISBLANK([$'03.Muestra'.$E39]);"";[$'03.Muestra'.$E39]) ->  | E430: of:=IF([.D430]<>"";IF(AND([.B430]<>"";[.C430]<>"");"";"ERR");"") -> 
B431: of:=IF( ISBLANK([$'03.Muestra'.$C40]);"";[$'03.Muestra'.$C40]) ->  | C431: of:=IF( ISBLANK([$'03.Muestra'.$E40]);"";[$'03.Muestra'.$E40]) ->  | E431: of:=IF([.D431]<>"";IF(AND([.B431]<>"";[.C431]<>"");"";"ERR");"") -> 
B432: of:=IF( ISBLANK([$'03.Muestra'.$C41]);"";[$'03.Muestra'.$C41]) ->  | C432: of:=IF( ISBLANK([$'03.Muestra'.$E41]);"";[$'03.Muestra'.$E41]) ->  | E432: of:=IF([.D432]<>"";IF(AND([.B432]<>"";[.C432]<>"");"";"ERR");"") -> 
B433: of:=IF( ISBLANK([$'03.Muestra'.$C42]);"";[$'03.Muestra'.$C42]) ->  | C433: of:=IF( ISBLANK([$'03.Muestra'.$E42]);"";[$'03.Muestra'.$E42]) ->  | E433: of:=IF([.D433]<>"";IF(AND([.B433]<>"";[.C433]<>"");"";"ERR");"") -> 
B436: AA | C436: 2.4.6 Encabezados y etiquetas | D436: Resultado
B437: of:=IF( ISBLANK([$'03.Muestra'.$C8]);"";[$'03.Muestra'.$C8]) ->  | C437: of:=IF( ISBLANK([$'03.Muestra'.$E8]);"";[$'03.Muestra'.$E8]) ->  | E437: of:=IF([.D437]<>"";IF(AND([.B437]<>"";[.C437]<>"");"";"ERR");"") ->  | F437: N/T | G437: N/D | H437: N/A | I437: Falla | J437: Pasa | K437: En blanco
B438: of:=IF( ISBLANK([$'03.Muestra'.$C9]);"";[$'03.Muestra'.$C9]) ->  | C438: of:=IF( ISBLANK([$'03.Muestra'.$E9]);"";[$'03.Muestra'.$E9]) ->  | E438: of:=IF([.D438]<>"";IF(AND([.B438]<>"";[.C438]<>"");"";"ERR");"") ->  | F438: of:=COUNTIF([.$D437]:INDIRECT("$D" &  SUM(ROW()-1;[$'03.Muestra'.$D$45])-1);[.F437]) -> 0 | G438: of:=COUNTIF([.$D437]:INDIRECT("$D" &  SUM(ROW()-1;[$'03.Muestra'.$D$45])-1);[.G437]) -> 0 | H438: of:=COUNTIF([.$D437]:INDIRECT("$D" &  SUM(ROW()-1;[$'03.Muestra'.$D$45])-1);[.H437]) -> 0 | I438: of:=COUNTIF([.$D437]:INDIRECT("$D" &  SUM(ROW()-1;[$'03.Muestra'.$D$45])-1);[.I437]) -> 0 | J438: of:=COUNTIF([.$D437]:INDIRECT("$D" &  SUM(ROW()-1;[$'03.Muestra'.$D$45])-1);[.J437]) -> 0 | K438: of:=IF([$'03.Muestra'.$D$45]=0;0;COUNTBLANK([.$D437]:INDIRECT("$D" &  SUM(ROW()-1;[$'03.Muestra'.$D$45])-1))) -> 0
B439: of:=IF( ISBLANK([$'03.Muestra'.$C10]);"";[$'03.Muestra'.$C10]) ->  | C439: of:=IF( ISBLANK([$'03.Muestra'.$E10]);"";[$'03.Muestra'.$E10]) ->  | E439: of:=IF([.D439]<>"";IF(AND([.B439]<>"";[.C439]<>"");"";"ERR");"") -> 
B440: of:=IF( ISBLANK([$'03.Muestra'.$C11]);"";[$'03.Muestra'.$C11]) ->  | C440: of:=IF( ISBLANK([$'03.Muestra'.$E11]);"";[$'03.Muestra'.$E11]) ->  | E440: of:=IF([.D440]<>"";IF(AND([.B440]<>"";[.C440]<>"");"";"ERR");"") -> 
B441: of:=IF( ISBLANK([$'03.Muestra'.$C12]);"";[$'03.Muestra'.$C12]) ->  | C441: of:=IF( ISBLANK([$'03.Muestra'.$E12]);"";[$'03.Muestra'.$E12]) ->  | E441: of:=IF([.D441]<>"";IF(AND([.B441]<>"";[.C441]<>"");"";"ERR");"") -> 
B442: of:=IF( ISBLANK([$'03.Muestra'.$C13]);"";[$'03.Muestra'.$C13]) ->  | C442: of:=IF( ISBLANK([$'03.Muestra'.$E13]);"";[$'03.Muestra'.$E13]) ->  | E442: of:=IF([.D442]<>"";IF(AND([.B442]<>"";[.C442]<>"");"";"ERR");"") -> 
B443: of:=IF( ISBLANK([$'03.Muestra'.$C14]);"";[$'03.Muestra'.$C14]) ->  | C443: of:=IF( ISBLANK([$'03.Muestra'.$E14]);"";[$'03.Muestra'.$E14]) ->  | E443: of:=IF([.D443]<>"";IF(AND([.B443]<>"";[.C443]<>"");"";"ERR");"") -> 
B444: of:=IF( ISBLANK([$'03.Muestra'.$C15]);"";[$'03.Muestra'.$C15]) ->  | C444: of:=IF( ISBLANK([$'03.Muestra'.$E15]);"";[$'03.Muestra'.$E15]) ->  | E444: of:=IF([.D444]<>"";IF(AND([.B444]<>"";[.C444]<>"");"";"ERR");"") -> 
B445: of:=IF( ISBLANK([$'03.Muestra'.$C16]);"";[$'03.Muestra'.$C16]) ->  | C445: of:=IF( ISBLANK([$'03.Muestra'.$E16]);"";[$'03.Muestra'.$E16]) ->  | E445: of:=IF([.D445]<>"";IF(AND([.B445]<>"";[.C445]<>"");"";"ERR");"") -> 
B446: of:=IF( ISBLANK([$'03.Muestra'.$C17]);"";[$'03.Muestra'.$C17]) ->  | C446: of:=IF( ISBLANK([$'03.Muestra'.$E17]);"";[$'03.Muestra'.$E17]) ->  | E446: of:=IF([.D446]<>"";IF(AND([.B446]<>"";[.C446]<>"");"";"ERR");"") -> 
B447: of:=IF( ISBLANK([$'03.Muestra'.$C18]);"";[$'03.Muestra'.$C18]) ->  | C447: of:=IF( ISBLANK([$'03.Muestra'.$E18]);"";[$'03.Muestra'.$E18]) ->  | E447: of:=IF([.D447]<>"";IF(AND([.B447]<>"";[.C447]<>"");"";"ERR");"") -> 
B448: of:=IF( ISBLANK([$'03.Muestra'.$C19]);"";[$'03.Muestra'.$C19]) ->  | C448: of:=IF( ISBLANK([$'03.Muestra'.$E19]);"";[$'03.Muestra'.$E19]) ->  | E448: of:=IF([.D448]<>"";IF(AND([.B448]<>"";[.C448]<>"");"";"ERR");"") -> 
B449: of:=IF( ISBLANK([$'03.Muestra'.$C20]);"";[$'03.Muestra'.$C20]) ->  | C449: of:=IF( ISBLANK([$'03.Muestra'.$E20]);"";[$'03.Muestra'.$E20]) ->  | E449: of:=IF([.D449]<>"";IF(AND([.B449]<>"";[.C449]<>"");"";"ERR");"") -> 
B450: of:=IF( ISBLANK([$'03.Muestra'.$C21]);"";[$'03.Muestra'.$C21]) ->  | C450: of:=IF( ISBLANK([$'03.Muestra'.$E21]);"";[$'03.Muestra'.$E21]) ->  | E450: of:=IF([.D450]<>"";IF(AND([.B450]<>"";[.C450]<>"");"";"ERR");"") -> 
B451: of:=IF( ISBLANK([$'03.Muestra'.$C22]);"";[$'03.Muestra'.$C22]) ->  | C451: of:=IF( ISBLANK([$'03.Muestra'.$E22]);"";[$'03.Muestra'.$E22]) ->  | E451: of:=IF([.D451]<>"";IF(AND([.B451]<>"";[.C451]<>"");"";"ERR");"") -> 
B452: of:=IF( ISBLANK([$'03.Muestra'.$C23]);"";[$'03.Muestra'.$C23]) ->  | C452: of:=IF( ISBLANK([$'03.Muestra'.$E23]);"";[$'03.Muestra'.$E23]) ->  | E452: of:=IF([.D452]<>"";IF(AND([.B452]<>"";[.C452]<>"");"";"ERR");"") -> 
B453: of:=IF( ISBLANK([$'03.Muestra'.$C24]);"";[$'03.Muestra'.$C24]) ->  | C453: of:=IF( ISBLANK([$'03.Muestra'.$E24]);"";[$'03.Muestra'.$E24]) ->  | E453: of:=IF([.D453]<>"";IF(AND([.B453]<>"";[.C453]<>"");"";"ERR");"") -> 
B454: of:=IF( ISBLANK([$'03.Muestra'.$C25]);"";[$'03.Muestra'.$C25]) ->  | C454: of:=IF( ISBLANK([$'03.Muestra'.$E25]);"";[$'03.Muestra'.$E25]) ->  | E454: of:=IF([.D454]<>"";IF(AND([.B454]<>"";[.C454]<>"");"";"ERR");"") -> 
B455: of:=IF( ISBLANK([$'03.Muestra'.$C26]);"";[$'03.Muestra'.$C26]) ->  | C455: of:=IF( ISBLANK([$'03.Muestra'.$E26]);"";[$'03.Muestra'.$E26]) ->  | E455: of:=IF([.D455]<>"";IF(AND([.B455]<>"";[.C455]<>"");"";"ERR");"") -> 
B456: of:=IF( ISBLANK([$'03.Muestra'.$C27]);"";[$'03.Muestra'.$C27]) ->  | C456: of:=IF( ISBLANK([$'03.Muestra'.$E27]);"";[$'03.Muestra'.$E27]) ->  | E456: of:=IF([.D456]<>"";IF(AND([.B456]<>"";[.C456]<>"");"";"ERR");"") -> 
B457: of:=IF( ISBLANK([$'03.Muestra'.$C28]);"";[$'03.Muestra'.$C28]) ->  | C457: of:=IF( ISBLANK([$'03.Muestra'.$E28]);"";[$'03.Muestra'.$E28]) ->  | E457: of:=IF([.D457]<>"";IF(AND([.B457]<>"";[.C457]<>"");"";"ERR");"") -> 
B458: of:=IF( ISBLANK([$'03.Muestra'.$C29]);"";[$'03.Muestra'.$C29]) ->  | C458: of:=IF( ISBLANK([$'03.Muestra'.$E29]);"";[$'03.Muestra'.$E29]) ->  | E458: of:=IF([.D458]<>"";IF(AND([.B458]<>"";[.C458]<>"");"";"ERR");"") -> 
B459: of:=IF( ISBLANK([$'03.Muestra'.$C30]);"";[$'03.Muestra'.$C30]) ->  | C459: of:=IF( ISBLANK([$'03.Muestra'.$E30]);"";[$'03.Muestra'.$E30]) ->  | E459: of:=IF([.D459]<>"";IF(AND([.B459]<>"";[.C459]<>"");"";"ERR");"") -> 
B460: of:=IF( ISBLANK([$'03.Muestra'.$C31]);"";[$'03.Muestra'.$C31]) ->  | C460: of:=IF( ISBLANK([$'03.Muestra'.$E31]);"";[$'03.Muestra'.$E31]) ->  | E460: of:=IF([.D460]<>"";IF(AND([.B460]<>"";[.C460]<>"");"";"ERR");"") -> 
B461: of:=IF( ISBLANK([$'03.Muestra'.$C32]);"";[$'03.Muestra'.$C32]) ->  | C461: of:=IF( ISBLANK([$'03.Muestra'.$E32]);"";[$'03.Muestra'.$E32]) ->  | E461: of:=IF([.D461]<>"";IF(AND([.B461]<>"";[.C461]<>"");"";"ERR");"") -> 
B462: of:=IF( ISBLANK([$'03.Muestra'.$C33]);"";[$'03.Muestra'.$C33]) ->  | C462: of:=IF( ISBLANK([$'03.Muestra'.$E33]);"";[$'03.Muestra'.$E33]) ->  | E462: of:=IF([.D462]<>"";IF(AND([.B462]<>"";[.C462]<>"");"";"ERR");"") -> 
B463: of:=IF( ISBLANK([$'03.Muestra'.$C34]);"";[$'03.Muestra'.$C34]) ->  | C463: of:=IF( ISBLANK([$'03.Muestra'.$E34]);"";[$'03.Muestra'.$E34]) ->  | E463: of:=IF([.D463]<>"";IF(AND([.B463]<>"";[.C463]<>"");"";"ERR");"") -> 
B464: of:=IF( ISBLANK([$'03.Muestra'.$C35]);"";[$'03.Muestra'.$C35]) ->  | C464: of:=IF( ISBLANK([$'03.Muestra'.$E35]);"";[$'03.Muestra'.$E35]) ->  | E464: of:=IF([.D464]<>"";IF(AND([.B464]<>"";[.C464]<>"");"";"ERR");"") -> 
B465: of:=IF( ISBLANK([$'03.Muestra'.$C36]);"";[$'03.Muestra'.$C36]) ->  | C465: of:=IF( ISBLANK([$'03.Muestra'.$E36]);"";[$'03.Muestra'.$E36]) ->  | E465: of:=IF([.D465]<>"";IF(AND([.B465]<>"";[.C465]<>"");"";"ERR");"") -> 
B466: of:=IF( ISBLANK([$'03.Muestra'.$C37]);"";[$'03.Muestra'.$C37]) ->  | C466: of:=IF( ISBLANK([$'03.Muestra'.$E37]);"";[$'03.Muestra'.$E37]) ->  | E466: of:=IF([.D466]<>"";IF(AND([.B466]<>"";[.C466]<>"");"";"ERR");"") -> 
B467: of:=IF( ISBLANK([$'03.Muestra'.$C38]);"";[$'03.Muestra'.$C38]) ->  | C467: of:=IF( ISBLANK([$'03.Muestra'.$E38]);"";[$'03.Muestra'.$E38]) ->  | E467: of:=IF([.D467]<>"";IF(AND([.B467]<>"";[.C467]<>"");"";"ERR");"") -> 
B468: of:=IF( ISBLANK([$'03.Muestra'.$C39]);"";[$'03.Muestra'.$C39]) ->  | C468: of:=IF( ISBLANK([$'03.Muestra'.$E39]);"";[$'03.Muestra'.$E39]) ->  | E468: of:=IF([.D468]<>"";IF(AND([.B468]<>"";[.C468]<>"");"";"ERR");"") -> 
B469: of:=IF( ISBLANK([$'03.Muestra'.$C40]);"";[$'03.Muestra'.$C40]) ->  | C469: of:=IF( ISBLANK([$'03.Muestra'.$E40]);"";[$'03.Muestra'.$E40]) ->  | E469: of:=IF([.D469]<>"";IF(AND([.B469]<>"";[.C469]<>"");"";"ERR");"") -> 
B470: of:=IF( ISBLANK([$'03.Muestra'.$C41]);"";[$'03.Muestra'.$C41]) ->  | C470: of:=IF( ISBLANK([$'03.Muestra'.$E41]);"";[$'03.Muestra'.$E41]) ->  | E470: of:=IF([.D470]<>"";IF(AND([.B470]<>"";[.C470]<>"");"";"ERR");"") -> 
B471: of:=IF( ISBLANK([$'03.Muestra'.$C42]);"";[$'03.Muestra'.$C42]) ->  | C471: of:=IF( ISBLANK([$'03.Muestra'.$E42]);"";[$'03.Muestra'.$E42]) ->  | E471: of:=IF([.D471]<>"";IF(AND([.B471]<>"";[.C471]<>"");"";"ERR");"") -> 
B474: AA | C474: 2.4.7 Foco visible | D474: Resultado
B475: of:=IF( ISBLANK([$'03.Muestra'.$C8]);"";[$'03.Muestra'.$C8]) ->  | C475: of:=IF( ISBLANK([$'03.Muestra'.$E8]);"";[$'03.Muestra'.$E8]) ->  | E475: of:=IF([.D475]<>"";IF(AND([.B475]<>"";[.C475]<>"");"";"ERR");"") ->  | F475: N/T | G475: N/D | H475: N/A | I475: Falla | J475: Pasa | K475: En blanco
B476: of:=IF( ISBLANK([$'03.Muestra'.$C9]);"";[$'03.Muestra'.$C9]) ->  | C476: of:=IF( ISBLANK([$'03.Muestra'.$E9]);"";[$'03.Muestra'.$E9]) ->  | E476: of:=IF([.D476]<>"";IF(AND([.B476]<>"";[.C476]<>"");"";"ERR");"") ->  | F476: of:=COUNTIF([.$D475]:INDIRECT("$D" &  SUM(ROW()-1;[$'03.Muestra'.$D$45])-1);[.F475]) -> 0 | G476: of:=COUNTIF([.$D475]:INDIRECT("$D" &  SUM(ROW()-1;[$'03.Muestra'.$D$45])-1);[.G475]) -> 0 | H476: of:=COUNTIF([.$D475]:INDIRECT("$D" &  SUM(ROW()-1;[$'03.Muestra'.$D$45])-1);[.H475]) -> 0 | I476: of:=COUNTIF([.$D475]:INDIRECT("$D" &  SUM(ROW()-1;[$'03.Muestra'.$D$45])-1);[.I475]) -> 0 | J476: of:=COUNTIF([.$D475]:INDIRECT("$D" &  SUM(ROW()-1;[$'03.Muestra'.$D$45])-1);[.J475]) -> 0 | K476: of:=IF([$'03.Muestra'.$D$45]=0;0;COUNTBLANK([.$D475]:INDIRECT("$D" &  SUM(ROW()-1;[$'03.Muestra'.$D$45])-1))) -> 0
B477: of:=IF( ISBLANK([$'03.Muestra'.$C10]);"";[$'03.Muestra'.$C10]) ->  | C477: of:=IF( ISBLANK([$'03.Muestra'.$E10]);"";[$'03.Muestra'.$E10]) ->  | E477: of:=IF([.D477]<>"";IF(AND([.B477]<>"";[.C477]<>"");"";"ERR");"") -> 
B478: of:=IF( ISBLANK([$'03.Muestra'.$C11]);"";[$'03.Muestra'.$C11]) ->  | C478: of:=IF( ISBLANK([$'03.Muestra'.$E11]);"";[$'03.Muestra'.$E11]) ->  | E478: of:=IF([.D478]<>"";IF(AND([.B478]<>"";[.C478]<>"");"";"ERR");"") -> 
B479: of:=IF( ISBLANK([$'03.Muestra'.$C12]);"";[$'03.Muestra'.$C12]) ->  | C479: of:=IF( ISBLANK([$'03.Muestra'.$E12]);"";[$'03.Muestra'.$E12]) ->  | E479: of:=IF([.D479]<>"";IF(AND([.B479]<>"";[.C479]<>"");"";"ERR");"") -> 
B480: of:=IF( ISBLANK([$'03.Muestra'.$C13]);"";[$'03.Muestra'.$C13]) ->  | C480: of:=IF( ISBLANK([$'03.Muestra'.$E13]);"";[$'03.Muestra'.$E13]) ->  | E480: of:=IF([.D480]<>"";IF(AND([.B480]<>"";[.C480]<>"");"";"ERR");"") -> 
B481: of:=IF( ISBLANK([$'03.Muestra'.$C14]);"";[$'03.Muestra'.$C14]) ->  | C481: of:=IF( ISBLANK([$'03.Muestra'.$E14]);"";[$'03.Muestra'.$E14]) ->  | E481: of:=IF([.D481]<>"";IF(AND([.B481]<>"";[.C481]<>"");"";"ERR");"") -> 
B482: of:=IF( ISBLANK([$'03.Muestra'.$C15]);"";[$'03.Muestra'.$C15]) ->  | C482: of:=IF( ISBLANK([$'03.Muestra'.$E15]);"";[$'03.Muestra'.$E15]) ->  | E482: of:=IF([.D482]<>"";IF(AND([.B482]<>"";[.C482]<>"");"";"ERR");"") -> 
B483: of:=IF( ISBLANK([$'03.Muestra'.$C16]);"";[$'03.Muestra'.$C16]) ->  | C483: of:=IF( ISBLANK([$'03.Muestra'.$E16]);"";[$'03.Muestra'.$E16]) ->  | E483: of:=IF([.D483]<>"";IF(AND([.B483]<>"";[.C483]<>"");"";"ERR");"") -> 
B484: of:=IF( ISBLANK([$'03.Muestra'.$C17]);"";[$'03.Muestra'.$C17]) ->  | C484: of:=IF( ISBLANK([$'03.Muestra'.$E17]);"";[$'03.Muestra'.$E17]) ->  | E484: of:=IF([.D484]<>"";IF(AND([.B484]<>"";[.C484]<>"");"";"ERR");"") -> 
B485: of:=IF( ISBLANK([$'03.Muestra'.$C18]);"";[$'03.Muestra'.$C18]) ->  | C485: of:=IF( ISBLANK([$'03.Muestra'.$E18]);"";[$'03.Muestra'.$E18]) ->  | E485: of:=IF([.D485]<>"";IF(AND([.B485]<>"";[.C485]<>"");"";"ERR");"") -> 
B486: of:=IF( ISBLANK([$'03.Muestra'.$C19]);"";[$'03.Muestra'.$C19]) ->  | C486: of:=IF( ISBLANK([$'03.Muestra'.$E19]);"";[$'03.Muestra'.$E19]) ->  | E486: of:=IF([.D486]<>"";IF(AND([.B486]<>"";[.C486]<>"");"";"ERR");"") -> 
B487: of:=IF( ISBLANK([$'03.Muestra'.$C20]);"";[$'03.Muestra'.$C20]) ->  | C487: of:=IF( ISBLANK([$'03.Muestra'.$E20]);"";[$'03.Muestra'.$E20]) ->  | E487: of:=IF([.D487]<>"";IF(AND([.B487]<>"";[.C487]<>"");"";"ERR");"") -> 
B488: of:=IF( ISBLANK([$'03.Muestra'.$C21]);"";[$'03.Muestra'.$C21]) ->  | C488: of:=IF( ISBLANK([$'03.Muestra'.$E21]);"";[$'03.Muestra'.$E21]) ->  | E488: of:=IF([.D488]<>"";IF(AND([.B488]<>"";[.C488]<>"");"";"ERR");"") -> 
B489: of:=IF( ISBLANK([$'03.Muestra'.$C22]);"";[$'03.Muestra'.$C22]) ->  | C489: of:=IF( ISBLANK([$'03.Muestra'.$E22]);"";[$'03.Muestra'.$E22]) ->  | E489: of:=IF([.D489]<>"";IF(AND([.B489]<>"";[.C489]<>"");"";"ERR");"") -> 
B490: of:=IF( ISBLANK([$'03.Muestra'.$C23]);"";[$'03.Muestra'.$C23]) ->  | C490: of:=IF( ISBLANK([$'03.Muestra'.$E23]);"";[$'03.Muestra'.$E23]) ->  | E490: of:=IF([.D490]<>"";IF(AND([.B490]<>"";[.C490]<>"");"";"ERR");"") -> 
B491: of:=IF( ISBLANK([$'03.Muestra'.$C24]);"";[$'03.Muestra'.$C24]) ->  | C491: of:=IF( ISBLANK([$'03.Muestra'.$E24]);"";[$'03.Muestra'.$E24]) ->  | E491: of:=IF([.D491]<>"";IF(AND([.B491]<>"";[.C491]<>"");"";"ERR");"") -> 
B492: of:=IF( ISBLANK([$'03.Muestra'.$C25]);"";[$'03.Muestra'.$C25]) ->  | C492: of:=IF( ISBLANK([$'03.Muestra'.$E25]);"";[$'03.Muestra'.$E25]) ->  | E492: of:=IF([.D492]<>"";IF(AND([.B492]<>"";[.C492]<>"");"";"ERR");"") -> 
B493: of:=IF( ISBLANK([$'03.Muestra'.$C26]);"";[$'03.Muestra'.$C26]) ->  | C493: of:=IF( ISBLANK([$'03.Muestra'.$E26]);"";[$'03.Muestra'.$E26]) ->  | E493: of:=IF([.D493]<>"";IF(AND([.B493]<>"";[.C493]<>"");"";"ERR");"") -> 
B494: of:=IF( ISBLANK([$'03.Muestra'.$C27]);"";[$'03.Muestra'.$C27]) ->  | C494: of:=IF( ISBLANK([$'03.Muestra'.$E27]);"";[$'03.Muestra'.$E27]) ->  | E494: of:=IF([.D494]<>"";IF(AND([.B494]<>"";[.C494]<>"");"";"ERR");"") -> 
B495: of:=IF( ISBLANK([$'03.Muestra'.$C28]);"";[$'03.Muestra'.$C28]) ->  | C495: of:=IF( ISBLANK([$'03.Muestra'.$E28]);"";[$'03.Muestra'.$E28]) ->  | E495: of:=IF([.D495]<>"";IF(AND([.B495]<>"";[.C495]<>"");"";"ERR");"") -> 
B496: of:=IF( ISBLANK([$'03.Muestra'.$C29]);"";[$'03.Muestra'.$C29]) ->  | C496: of:=IF( ISBLANK([$'03.Muestra'.$E29]);"";[$'03.Muestra'.$E29]) ->  | E496: of:=IF([.D496]<>"";IF(AND([.B496]<>"";[.C496]<>"");"";"ERR");"") -> 
B497: of:=IF( ISBLANK([$'03.Muestra'.$C30]);"";[$'03.Muestra'.$C30]) ->  | C497: of:=IF( ISBLANK([$'03.Muestra'.$E30]);"";[$'03.Muestra'.$E30]) ->  | E497: of:=IF([.D497]<>"";IF(AND([.B497]<>"";[.C497]<>"");"";"ERR");"") -> 
B498: of:=IF( ISBLANK([$'03.Muestra'.$C31]);"";[$'03.Muestra'.$C31]) ->  | C498: of:=IF( ISBLANK([$'03.Muestra'.$E31]);"";[$'03.Muestra'.$E31]) ->  | E498: of:=IF([.D498]<>"";IF(AND([.B498]<>"";[.C498]<>"");"";"ERR");"") -> 
B499: of:=IF( ISBLANK([$'03.Muestra'.$C32]);"";[$'03.Muestra'.$C32]) ->  | C499: of:=IF( ISBLANK([$'03.Muestra'.$E32]);"";[$'03.Muestra'.$E32]) ->  | E499: of:=IF([.D499]<>"";IF(AND([.B499]<>"";[.C499]<>"");"";"ERR");"") -> 
B500: of:=IF( ISBLANK([$'03.Muestra'.$C33]);"";[$'03.Muestra'.$C33]) ->  | C500: of:=IF( ISBLANK([$'03.Muestra'.$E33]);"";[$'03.Muestra'.$E33]) ->  | E500: of:=IF([.D500]<>"";IF(AND([.B500]<>"";[.C500]<>"");"";"ERR");"") -> 
B501: of:=IF( ISBLANK([$'03.Muestra'.$C34]);"";[$'03.Muestra'.$C34]) ->  | C501: of:=IF( ISBLANK([$'03.Muestra'.$E34]);"";[$'03.Muestra'.$E34]) ->  | E501: of:=IF([.D501]<>"";IF(AND([.B501]<>"";[.C501]<>"");"";"ERR");"") -> 
B502: of:=IF( ISBLANK([$'03.Muestra'.$C35]);"";[$'03.Muestra'.$C35]) ->  | C502: of:=IF( ISBLANK([$'03.Muestra'.$E35]);"";[$'03.Muestra'.$E35]) ->  | E502: of:=IF([.D502]<>"";IF(AND([.B502]<>"";[.C502]<>"");"";"ERR");"") -> 
B503: of:=IF( ISBLANK([$'03.Muestra'.$C36]);"";[$'03.Muestra'.$C36]) ->  | C503: of:=IF( ISBLANK([$'03.Muestra'.$E36]);"";[$'03.Muestra'.$E36]) ->  | E503: of:=IF([.D503]<>"";IF(AND([.B503]<>"";[.C503]<>"");"";"ERR");"") -> 
B504: of:=IF( ISBLANK([$'03.Muestra'.$C37]);"";[$'03.Muestra'.$C37]) ->  | C504: of:=IF( ISBLANK([$'03.Muestra'.$E37]);"";[$'03.Muestra'.$E37]) ->  | E504: of:=IF([.D504]<>"";IF(AND([.B504]<>"";[.C504]<>"");"";"ERR");"") -> 
B505: of:=IF( ISBLANK([$'03.Muestra'.$C38]);"";[$'03.Muestra'.$C38]) ->  | C505: of:=IF( ISBLANK([$'03.Muestra'.$E38]);"";[$'03.Muestra'.$E38]) ->  | E505: of:=IF([.D505]<>"";IF(AND([.B505]<>"";[.C505]<>"");"";"ERR");"") -> 
B506: of:=IF( ISBLANK([$'03.Muestra'.$C39]);"";[$'03.Muestra'.$C39]) ->  | C506: of:=IF( ISBLANK([$'03.Muestra'.$E39]);"";[$'03.Muestra'.$E39]) ->  | E506: of:=IF([.D506]<>"";IF(AND([.B506]<>"";[.C506]<>"");"";"ERR");"") -> 
B507: of:=IF( ISBLANK([$'03.Muestra'.$C40]);"";[$'03.Muestra'.$C40]) ->  | C507: of:=IF( ISBLANK([$'03.Muestra'.$E40]);"";[$'03.Muestra'.$E40]) ->  | E507: of:=IF([.D507]<>"";IF(AND([.B507]<>"";[.C507]<>"");"";"ERR");"") -> 
B508: of:=IF( ISBLANK([$'03.Muestra'.$C41]);"";[$'03.Muestra'.$C41]) ->  | C508: of:=IF( ISBLANK([$'03.Muestra'.$E41]);"";[$'03.Muestra'.$E41]) ->  | E508: of:=IF([.D508]<>"";IF(AND([.B508]<>"";[.C508]<>"");"";"ERR");"") -> 
B509: of:=IF( ISBLANK([$'03.Muestra'.$C42]);"";[$'03.Muestra'.$C42]) ->  | C509: of:=IF( ISBLANK([$'03.Muestra'.$E42]);"";[$'03.Muestra'.$E42]) ->  | E509: of:=IF([.D509]<>"";IF(AND([.B509]<>"";[.C509]<>"");"";"ERR");"") -> 
B512: A | C512: 2.5.1 Gestos del puntero | D512: Resultado
B513: of:=IF( ISBLANK([$'03.Muestra'.$C8]);"";[$'03.Muestra'.$C8]) ->  | C513: of:=IF( ISBLANK([$'03.Muestra'.$E8]);"";[$'03.Muestra'.$E8]) ->  | E513: of:=IF([.D513]<>"";IF(AND([.B513]<>"";[.C513]<>"");"";"ERR");"") ->  | F513: N/T | G513: N/D | H513: N/A | I513: Falla | J513: Pasa | K513: En blanco
B514: of:=IF( ISBLANK([$'03.Muestra'.$C9]);"";[$'03.Muestra'.$C9]) ->  | C514: of:=IF( ISBLANK([$'03.Muestra'.$E9]);"";[$'03.Muestra'.$E9]) ->  | E514: of:=IF([.D514]<>"";IF(AND([.B514]<>"";[.C514]<>"");"";"ERR");"") ->  | F514: of:=COUNTIF([.$D513]:INDIRECT("$D" &  SUM(ROW()-1;[$'03.Muestra'.$D$45])-1);[.F513]) -> 0 | G514: of:=COUNTIF([.$D513]:INDIRECT("$D" &  SUM(ROW()-1;[$'03.Muestra'.$D$45])-1);[.G513]) -> 0 | H514: of:=COUNTIF([.$D513]:INDIRECT("$D" &  SUM(ROW()-1;[$'03.Muestra'.$D$45])-1);[.H513]) -> 0 | I514: of:=COUNTIF([.$D513]:INDIRECT("$D" &  SUM(ROW()-1;[$'03.Muestra'.$D$45])-1);[.I513]) -> 0 | J514: of:=COUNTIF([.$D513]:INDIRECT("$D" &  SUM(ROW()-1;[$'03.Muestra'.$D$45])-1);[.J513]) -> 0 | K514: of:=IF([$'03.Muestra'.$D$45]=0;0;COUNTBLANK([.$D513]:INDIRECT("$D" &  SUM(ROW()-1;[$'03.Muestra'.$D$45])-1))) -> 0
B515: of:=IF( ISBLANK([$'03.Muestra'.$C10]);"";[$'03.Muestra'.$C10]) ->  | C515: of:=IF( ISBLANK([$'03.Muestra'.$E10]);"";[$'03.Muestra'.$E10]) ->  | E515: of:=IF([.D515]<>"";IF(AND([.B515]<>"";[.C515]<>"");"";"ERR");"") -> 
B516: of:=IF( ISBLANK([$'03.Muestra'.$C11]);"";[$'03.Muestra'.$C11]) ->  | C516: of:=IF( ISBLANK([$'03.Muestra'.$E11]);"";[$'03.Muestra'.$E11]) ->  | E516: of:=IF([.D516]<>"";IF(AND([.B516]<>"";[.C516]<>"");"";"ERR");"") -> 
B517: of:=IF( ISBLANK([$'03.Muestra'.$C12]);"";[$'03.Muestra'.$C12]) ->  | C517: of:=IF( ISBLANK([$'03.Muestra'.$E12]);"";[$'03.Muestra'.$E12]) ->  | E517: of:=IF([.D517]<>"";IF(AND([.B517]<>"";[.C517]<>"");"";"ERR");"") -> 
B518: of:=IF( ISBLANK([$'03.Muestra'.$C13]);"";[$'03.Muestra'.$C13]) ->  | C518: of:=IF( ISBLANK([$'03.Muestra'.$E13]);"";[$'03.Muestra'.$E13]) ->  | E518: of:=IF([.D518]<>"";IF(AND([.B518]<>"";[.C518]<>"");"";"ERR");"") -> 
B519: of:=IF( ISBLANK([$'03.Muestra'.$C14]);"";[$'03.Muestra'.$C14]) ->  | C519: of:=IF( ISBLANK([$'03.Muestra'.$E14]);"";[$'03.Muestra'.$E14]) ->  | E519: of:=IF([.D519]<>"";IF(AND([.B519]<>"";[.C519]<>"");"";"ERR");"") -> 
B520: of:=IF( ISBLANK([$'03.Muestra'.$C15]);"";[$'03.Muestra'.$C15]) ->  | C520: of:=IF( ISBLANK([$'03.Muestra'.$E15]);"";[$'03.Muestra'.$E15]) ->  | E520: of:=IF([.D520]<>"";IF(AND([.B520]<>"";[.C520]<>"");"";"ERR");"") -> 
B521: of:=IF( ISBLANK([$'03.Muestra'.$C16]);"";[$'03.Muestra'.$C16]) ->  | C521: of:=IF( ISBLANK([$'03.Muestra'.$E16]);"";[$'03.Muestra'.$E16]) ->  | E521: of:=IF([.D521]<>"";IF(AND([.B521]<>"";[.C521]<>"");"";"ERR");"") -> 
B522: of:=IF( ISBLANK([$'03.Muestra'.$C17]);"";[$'03.Muestra'.$C17]) ->  | C522: of:=IF( ISBLANK([$'03.Muestra'.$E17]);"";[$'03.Muestra'.$E17]) ->  | E522: of:=IF([.D522]<>"";IF(AND([.B522]<>"";[.C522]<>"");"";"ERR");"") -> 
B523: of:=IF( ISBLANK([$'03.Muestra'.$C18]);"";[$'03.Muestra'.$C18]) ->  | C523: of:=IF( ISBLANK([$'03.Muestra'.$E18]);"";[$'03.Muestra'.$E18]) ->  | E523: of:=IF([.D523]<>"";IF(AND([.B523]<>"";[.C523]<>"");"";"ERR");"") -> 
B524: of:=IF( ISBLANK([$'03.Muestra'.$C19]);"";[$'03.Muestra'.$C19]) ->  | C524: of:=IF( ISBLANK([$'03.Muestra'.$E19]);"";[$'03.Muestra'.$E19]) ->  | E524: of:=IF([.D524]<>"";IF(AND([.B524]<>"";[.C524]<>"");"";"ERR");"") -> 
B525: of:=IF( ISBLANK([$'03.Muestra'.$C20]);"";[$'03.Muestra'.$C20]) ->  | C525: of:=IF( ISBLANK([$'03.Muestra'.$E20]);"";[$'03.Muestra'.$E20]) ->  | E525: of:=IF([.D525]<>"";IF(AND([.B525]<>"";[.C525]<>"");"";"ERR");"") -> 
B526: of:=IF( ISBLANK([$'03.Muestra'.$C21]);"";[$'03.Muestra'.$C21]) ->  | C526: of:=IF( ISBLANK([$'03.Muestra'.$E21]);"";[$'03.Muestra'.$E21]) ->  | E526: of:=IF([.D526]<>"";IF(AND([.B526]<>"";[.C526]<>"");"";"ERR");"") -> 
B527: of:=IF( ISBLANK([$'03.Muestra'.$C22]);"";[$'03.Muestra'.$C22]) ->  | C527: of:=IF( ISBLANK([$'03.Muestra'.$E22]);"";[$'03.Muestra'.$E22]) ->  | E527: of:=IF([.D527]<>"";IF(AND([.B527]<>"";[.C527]<>"");"";"ERR");"") -> 
B528: of:=IF( ISBLANK([$'03.Muestra'.$C23]);"";[$'03.Muestra'.$C23]) ->  | C528: of:=IF( ISBLANK([$'03.Muestra'.$E23]);"";[$'03.Muestra'.$E23]) ->  | E528: of:=IF([.D528]<>"";IF(AND([.B528]<>"";[.C528]<>"");"";"ERR");"") -> 
B529: of:=IF( ISBLANK([$'03.Muestra'.$C24]);"";[$'03.Muestra'.$C24]) ->  | C529: of:=IF( ISBLANK([$'03.Muestra'.$E24]);"";[$'03.Muestra'.$E24]) ->  | E529: of:=IF([.D529]<>"";IF(AND([.B529]<>"";[.C529]<>"");"";"ERR");"") -> 
B530: of:=IF( ISBLANK([$'03.Muestra'.$C25]);"";[$'03.Muestra'.$C25]) ->  | C530: of:=IF( ISBLANK([$'03.Muestra'.$E25]);"";[$'03.Muestra'.$E25]) ->  | E530: of:=IF([.D530]<>"";IF(AND([.B530]<>"";[.C530]<>"");"";"ERR");"") -> 
B531: of:=IF( ISBLANK([$'03.Muestra'.$C26]);"";[$'03.Muestra'.$C26]) ->  | C531: of:=IF( ISBLANK([$'03.Muestra'.$E26]);"";[$'03.Muestra'.$E26]) ->  | E531: of:=IF([.D531]<>"";IF(AND([.B531]<>"";[.C531]<>"");"";"ERR");"") -> 
B532: of:=IF( ISBLANK([$'03.Muestra'.$C27]);"";[$'03.Muestra'.$C27]) ->  | C532: of:=IF( ISBLANK([$'03.Muestra'.$E27]);"";[$'03.Muestra'.$E27]) ->  | E532: of:=IF([.D532]<>"";IF(AND([.B532]<>"";[.C532]<>"");"";"ERR");"") -> 
B533: of:=IF( ISBLANK([$'03.Muestra'.$C28]);"";[$'03.Muestra'.$C28]) ->  | C533: of:=IF( ISBLANK([$'03.Muestra'.$E28]);"";[$'03.Muestra'.$E28]) ->  | E533: of:=IF([.D533]<>"";IF(AND([.B533]<>"";[.C533]<>"");"";"ERR");"") -> 
B534: of:=IF( ISBLANK([$'03.Muestra'.$C29]);"";[$'03.Muestra'.$C29]) ->  | C534: of:=IF( ISBLANK([$'03.Muestra'.$E29]);"";[$'03.Muestra'.$E29]) ->  | E534: of:=IF([.D534]<>"";IF(AND([.B534]<>"";[.C534]<>"");"";"ERR");"") -> 
B535: of:=IF( ISBLANK([$'03.Muestra'.$C30]);"";[$'03.Muestra'.$C30]) ->  | C535: of:=IF( ISBLANK([$'03.Muestra'.$E30]);"";[$'03.Muestra'.$E30]) ->  | E535: of:=IF([.D535]<>"";IF(AND([.B535]<>"";[.C535]<>"");"";"ERR");"") -> 
B536: of:=IF( ISBLANK([$'03.Muestra'.$C31]);"";[$'03.Muestra'.$C31]) ->  | C536: of:=IF( ISBLANK([$'03.Muestra'.$E31]);"";[$'03.Muestra'.$E31]) ->  | E536: of:=IF([.D536]<>"";IF(AND([.B536]<>"";[.C536]<>"");"";"ERR");"") -> 
B537: of:=IF( ISBLANK([$'03.Muestra'.$C32]);"";[$'03.Muestra'.$C32]) ->  | C537: of:=IF( ISBLANK([$'03.Muestra'.$E32]);"";[$'03.Muestra'.$E32]) ->  | E537: of:=IF([.D537]<>"";IF(AND([.B537]<>"";[.C537]<>"");"";"ERR");"") -> 
B538: of:=IF( ISBLANK([$'03.Muestra'.$C33]);"";[$'03.Muestra'.$C33]) ->  | C538: of:=IF( ISBLANK([$'03.Muestra'.$E33]);"";[$'03.Muestra'.$E33]) ->  | E538: of:=IF([.D538]<>"";IF(AND([.B538]<>"";[.C538]<>"");"";"ERR");"") -> 
B539: of:=IF( ISBLANK([$'03.Muestra'.$C34]);"";[$'03.Muestra'.$C34]) ->  | C539: of:=IF( ISBLANK([$'03.Muestra'.$E34]);"";[$'03.Muestra'.$E34]) ->  | E539: of:=IF([.D539]<>"";IF(AND([.B539]<>"";[.C539]<>"");"";"ERR");"") -> 
B540: of:=IF( ISBLANK([$'03.Muestra'.$C35]);"";[$'03.Muestra'.$C35]) ->  | C540: of:=IF( ISBLANK([$'03.Muestra'.$E35]);"";[$'03.Muestra'.$E35]) ->  | E540: of:=IF([.D540]<>"";IF(AND([.B540]<>"";[.C540]<>"");"";"ERR");"") -> 
B541: of:=IF( ISBLANK([$'03.Muestra'.$C36]);"";[$'03.Muestra'.$C36]) ->  | C541: of:=IF( ISBLANK([$'03.Muestra'.$E36]);"";[$'03.Muestra'.$E36]) ->  | E541: of:=IF([.D541]<>"";IF(AND([.B541]<>"";[.C541]<>"");"";"ERR");"") -> 
B542: of:=IF( ISBLANK([$'03.Muestra'.$C37]);"";[$'03.Muestra'.$C37]) ->  | C542: of:=IF( ISBLANK([$'03.Muestra'.$E37]);"";[$'03.Muestra'.$E37]) ->  | E542: of:=IF([.D542]<>"";IF(AND([.B542]<>"";[.C542]<>"");"";"ERR");"") -> 
B543: of:=IF( ISBLANK([$'03.Muestra'.$C38]);"";[$'03.Muestra'.$C38]) ->  | C543: of:=IF( ISBLANK([$'03.Muestra'.$E38]);"";[$'03.Muestra'.$E38]) ->  | E543: of:=IF([.D543]<>"";IF(AND([.B543]<>"";[.C543]<>"");"";"ERR");"") -> 
B544: of:=IF( ISBLANK([$'03.Muestra'.$C39]);"";[$'03.Muestra'.$C39]) ->  | C544: of:=IF( ISBLANK([$'03.Muestra'.$E39]);"";[$'03.Muestra'.$E39]) ->  | E544: of:=IF([.D544]<>"";IF(AND([.B544]<>"";[.C544]<>"");"";"ERR");"") -> 
B545: of:=IF( ISBLANK([$'03.Muestra'.$C40]);"";[$'03.Muestra'.$C40]) ->  | C545: of:=IF( ISBLANK([$'03.Muestra'.$E40]);"";[$'03.Muestra'.$E40]) ->  | E545: of:=IF([.D545]<>"";IF(AND([.B545]<>"";[.C545]<>"");"";"ERR");"") -> 
B546: of:=IF( ISBLANK([$'03.Muestra'.$C41]);"";[$'03.Muestra'.$C41]) ->  | C546: of:=IF( ISBLANK([$'03.Muestra'.$E41]);"";[$'03.Muestra'.$E41]) ->  | E546: of:=IF([.D546]<>"";IF(AND([.B546]<>"";[.C546]<>"");"";"ERR");"") -> 
B547: of:=IF( ISBLANK([$'03.Muestra'.$C42]);"";[$'03.Muestra'.$C42]) ->  | C547: of:=IF( ISBLANK([$'03.Muestra'.$E42]);"";[$'03.Muestra'.$E42]) ->  | E547: of:=IF([.D547]<>"";IF(AND([.B547]<>"";[.C547]<>"");"";"ERR");"") -> 
B550: A | C550: 2.5.2 Cancelación del puntero | D550: Resultado
B551: of:=IF( ISBLANK([$'03.Muestra'.$C8]);"";[$'03.Muestra'.$C8]) ->  | C551: of:=IF( ISBLANK([$'03.Muestra'.$E8]);"";[$'03.Muestra'.$E8]) ->  | E551: of:=IF([.D551]<>"";IF(AND([.B551]<>"";[.C551]<>"");"";"ERR");"") ->  | F551: N/T | G551: N/D | H551: N/A | I551: Falla | J551: Pasa | K551: En blanco
B552: of:=IF( ISBLANK([$'03.Muestra'.$C9]);"";[$'03.Muestra'.$C9]) ->  | C552: of:=IF( ISBLANK([$'03.Muestra'.$E9]);"";[$'03.Muestra'.$E9]) ->  | E552: of:=IF([.D552]<>"";IF(AND([.B552]<>"";[.C552]<>"");"";"ERR");"") ->  | F552: of:=COUNTIF([.$D551]:INDIRECT("$D" &  SUM(ROW()-1;[$'03.Muestra'.$D$45])-1);[.F551]) -> 0 | G552: of:=COUNTIF([.$D551]:INDIRECT("$D" &  SUM(ROW()-1;[$'03.Muestra'.$D$45])-1);[.G551]) -> 0 | H552: of:=COUNTIF([.$D551]:INDIRECT("$D" &  SUM(ROW()-1;[$'03.Muestra'.$D$45])-1);[.H551]) -> 0 | I552: of:=COUNTIF([.$D551]:INDIRECT("$D" &  SUM(ROW()-1;[$'03.Muestra'.$D$45])-1);[.I551]) -> 0 | J552: of:=COUNTIF([.$D551]:INDIRECT("$D" &  SUM(ROW()-1;[$'03.Muestra'.$D$45])-1);[.J551]) -> 0 | K552: of:=IF([$'03.Muestra'.$D$45]=0;0;COUNTBLANK([.$D551]:INDIRECT("$D" &  SUM(ROW()-1;[$'03.Muestra'.$D$45])-1))) -> 0
B553: of:=IF( ISBLANK([$'03.Muestra'.$C10]);"";[$'03.Muestra'.$C10]) ->  | C553: of:=IF( ISBLANK([$'03.Muestra'.$E10]);"";[$'03.Muestra'.$E10]) ->  | E553: of:=IF([.D553]<>"";IF(AND([.B553]<>"";[.C553]<>"");"";"ERR");"") -> 
B554: of:=IF( ISBLANK([$'03.Muestra'.$C11]);"";[$'03.Muestra'.$C11]) ->  | C554: of:=IF( ISBLANK([$'03.Muestra'.$E11]);"";[$'03.Muestra'.$E11]) ->  | E554: of:=IF([.D554]<>"";IF(AND([.B554]<>"";[.C554]<>"");"";"ERR");"") -> 
B555: of:=IF( ISBLANK([$'03.Muestra'.$C12]);"";[$'03.Muestra'.$C12]) ->  | C555: of:=IF( ISBLANK([$'03.Muestra'.$E12]);"";[$'03.Muestra'.$E12]) ->  | E555: of:=IF([.D555]<>"";IF(AND([.B555]<>"";[.C555]<>"");"";"ERR");"") -> 
B556: of:=IF( ISBLANK([$'03.Muestra'.$C13]);"";[$'03.Muestra'.$C13]) ->  | C556: of:=IF( ISBLANK([$'03.Muestra'.$E13]);"";[$'03.Muestra'.$E13]) ->  | E556: of:=IF([.D556]<>"";IF(AND([.B556]<>"";[.C556]<>"");"";"ERR");"") -> 
B557: of:=IF( ISBLANK([$'03.Muestra'.$C14]);"";[$'03.Muestra'.$C14]) ->  | C557: of:=IF( ISBLANK([$'03.Muestra'.$E14]);"";[$'03.Muestra'.$E14]) ->  | E557: of:=IF([.D557]<>"";IF(AND([.B557]<>"";[.C557]<>"");"";"ERR");"") -> 
B558: of:=IF( ISBLANK([$'03.Muestra'.$C15]);"";[$'03.Muestra'.$C15]) ->  | C558: of:=IF( ISBLANK([$'03.Muestra'.$E15]);"";[$'03.Muestra'.$E15]) ->  | E558: of:=IF([.D558]<>"";IF(AND([.B558]<>"";[.C558]<>"");"";"ERR");"") -> 
B559: of:=IF( ISBLANK([$'03.Muestra'.$C16]);"";[$'03.Muestra'.$C16]) ->  | C559: of:=IF( ISBLANK([$'03.Muestra'.$E16]);"";[$'03.Muestra'.$E16]) ->  | E559: of:=IF([.D559]<>"";IF(AND([.B559]<>"";[.C559]<>"");"";"ERR");"") -> 
B560: of:=IF( ISBLANK([$'03.Muestra'.$C17]);"";[$'03.Muestra'.$C17]) ->  | C560: of:=IF( ISBLANK([$'03.Muestra'.$E17]);"";[$'03.Muestra'.$E17]) ->  | E560: of:=IF([.D560]<>"";IF(AND([.B560]<>"";[.C560]<>"");"";"ERR");"") -> 
B561: of:=IF( ISBLANK([$'03.Muestra'.$C18]);"";[$'03.Muestra'.$C18]) ->  | C561: of:=IF( ISBLANK([$'03.Muestra'.$E18]);"";[$'03.Muestra'.$E18]) ->  | E561: of:=IF([.D561]<>"";IF(AND([.B561]<>"";[.C561]<>"");"";"ERR");"") -> 
B562: of:=IF( ISBLANK([$'03.Muestra'.$C19]);"";[$'03.Muestra'.$C19]) ->  | C562: of:=IF( ISBLANK([$'03.Muestra'.$E19]);"";[$'03.Muestra'.$E19]) ->  | E562: of:=IF([.D562]<>"";IF(AND([.B562]<>"";[.C562]<>"");"";"ERR");"") -> 
B563: of:=IF( ISBLANK([$'03.Muestra'.$C20]);"";[$'03.Muestra'.$C20]) ->  | C563: of:=IF( ISBLANK([$'03.Muestra'.$E20]);"";[$'03.Muestra'.$E20]) ->  | E563: of:=IF([.D563]<>"";IF(AND([.B563]<>"";[.C563]<>"");"";"ERR");"") -> 
B564: of:=IF( ISBLANK([$'03.Muestra'.$C21]);"";[$'03.Muestra'.$C21]) ->  | C564: of:=IF( ISBLANK([$'03.Muestra'.$E21]);"";[$'03.Muestra'.$E21]) ->  | E564: of:=IF([.D564]<>"";IF(AND([.B564]<>"";[.C564]<>"");"";"ERR");"") -> 
B565: of:=IF( ISBLANK([$'03.Muestra'.$C22]);"";[$'03.Muestra'.$C22]) ->  | C565: of:=IF( ISBLANK([$'03.Muestra'.$E22]);"";[$'03.Muestra'.$E22]) ->  | E565: of:=IF([.D565]<>"";IF(AND([.B565]<>"";[.C565]<>"");"";"ERR");"") -> 
B566: of:=IF( ISBLANK([$'03.Muestra'.$C23]);"";[$'03.Muestra'.$C23]) ->  | C566: of:=IF( ISBLANK([$'03.Muestra'.$E23]);"";[$'03.Muestra'.$E23]) ->  | E566: of:=IF([.D566]<>"";IF(AND([.B566]<>"";[.C566]<>"");"";"ERR");"") -> 
B567: of:=IF( ISBLANK([$'03.Muestra'.$C24]);"";[$'03.Muestra'.$C24]) ->  | C567: of:=IF( ISBLANK([$'03.Muestra'.$E24]);"";[$'03.Muestra'.$E24]) ->  | E567: of:=IF([.D567]<>"";IF(AND([.B567]<>"";[.C567]<>"");"";"ERR");"") -> 
B568: of:=IF( ISBLANK([$'03.Muestra'.$C25]);"";[$'03.Muestra'.$C25]) ->  | C568: of:=IF( ISBLANK([$'03.Muestra'.$E25]);"";[$'03.Muestra'.$E25]) ->  | E568: of:=IF([.D568]<>"";IF(AND([.B568]<>"";[.C568]<>"");"";"ERR");"") -> 
B569: of:=IF( ISBLANK([$'03.Muestra'.$C26]);"";[$'03.Muestra'.$C26]) ->  | C569: of:=IF( ISBLANK([$'03.Muestra'.$E26]);"";[$'03.Muestra'.$E26]) ->  | E569: of:=IF([.D569]<>"";IF(AND([.B569]<>"";[.C569]<>"");"";"ERR");"") -> 
B570: of:=IF( ISBLANK([$'03.Muestra'.$C27]);"";[$'03.Muestra'.$C27]) ->  | C570: of:=IF( ISBLANK([$'03.Muestra'.$E27]);"";[$'03.Muestra'.$E27]) ->  | E570: of:=IF([.D570]<>"";IF(AND([.B570]<>"";[.C570]<>"");"";"ERR");"") -> 
B571: of:=IF( ISBLANK([$'03.Muestra'.$C28]);"";[$'03.Muestra'.$C28]) ->  | C571: of:=IF( ISBLANK([$'03.Muestra'.$E28]);"";[$'03.Muestra'.$E28]) ->  | E571: of:=IF([.D571]<>"";IF(AND([.B571]<>"";[.C571]<>"");"";"ERR");"") -> 
B572: of:=IF( ISBLANK([$'03.Muestra'.$C29]);"";[$'03.Muestra'.$C29]) ->  | C572: of:=IF( ISBLANK([$'03.Muestra'.$E29]);"";[$'03.Muestra'.$E29]) ->  | E572: of:=IF([.D572]<>"";IF(AND([.B572]<>"";[.C572]<>"");"";"ERR");"") -> 
B573: of:=IF( ISBLANK([$'03.Muestra'.$C30]);"";[$'03.Muestra'.$C30]) ->  | C573: of:=IF( ISBLANK([$'03.Muestra'.$E30]);"";[$'03.Muestra'.$E30]) ->  | E573: of:=IF([.D573]<>"";IF(AND([.B573]<>"";[.C573]<>"");"";"ERR");"") -> 
B574: of:=IF( ISBLANK([$'03.Muestra'.$C31]);"";[$'03.Muestra'.$C31]) ->  | C574: of:=IF( ISBLANK([$'03.Muestra'.$E31]);"";[$'03.Muestra'.$E31]) ->  | E574: of:=IF([.D574]<>"";IF(AND([.B574]<>"";[.C574]<>"");"";"ERR");"") -> 
B575: of:=IF( ISBLANK([$'03.Muestra'.$C32]);"";[$'03.Muestra'.$C32]) ->  | C575: of:=IF( ISBLANK([$'03.Muestra'.$E32]);"";[$'03.Muestra'.$E32]) ->  | E575: of:=IF([.D575]<>"";IF(AND([.B575]<>"";[.C575]<>"");"";"ERR");"") -> 
B576: of:=IF( ISBLANK([$'03.Muestra'.$C33]);"";[$'03.Muestra'.$C33]) ->  | C576: of:=IF( ISBLANK([$'03.Muestra'.$E33]);"";[$'03.Muestra'.$E33]) ->  | E576: of:=IF([.D576]<>"";IF(AND([.B576]<>"";[.C576]<>"");"";"ERR");"") -> 
B577: of:=IF( ISBLANK([$'03.Muestra'.$C34]);"";[$'03.Muestra'.$C34]) ->  | C577: of:=IF( ISBLANK([$'03.Muestra'.$E34]);"";[$'03.Muestra'.$E34]) ->  | E577: of:=IF([.D577]<>"";IF(AND([.B577]<>"";[.C577]<>"");"";"ERR");"") -> 
B578: of:=IF( ISBLANK([$'03.Muestra'.$C35]);"";[$'03.Muestra'.$C35]) ->  | C578: of:=IF( ISBLANK([$'03.Muestra'.$E35]);"";[$'03.Muestra'.$E35]) ->  | E578: of:=IF([.D578]<>"";IF(AND([.B578]<>"";[.C578]<>"");"";"ERR");"") -> 
B579: of:=IF( ISBLANK([$'03.Muestra'.$C36]);"";[$'03.Muestra'.$C36]) ->  | C579: of:=IF( ISBLANK([$'03.Muestra'.$E36]);"";[$'03.Muestra'.$E36]) ->  | E579: of:=IF([.D579]<>"";IF(AND([.B579]<>"";[.C579]<>"");"";"ERR");"") -> 
B580: of:=IF( ISBLANK([$'03.Muestra'.$C37]);"";[$'03.Muestra'.$C37]) ->  | C580: of:=IF( ISBLANK([$'03.Muestra'.$E37]);"";[$'03.Muestra'.$E37]) ->  | E580: of:=IF([.D580]<>"";IF(AND([.B580]<>"";[.C580]<>"");"";"ERR");"") -> 
B581: of:=IF( ISBLANK([$'03.Muestra'.$C38]);"";[$'03.Muestra'.$C38]) ->  | C581: of:=IF( ISBLANK([$'03.Muestra'.$E38]);"";[$'03.Muestra'.$E38]) ->  | E581: of:=IF([.D581]<>"";IF(AND([.B581]<>"";[.C581]<>"");"";"ERR");"") -> 
B582: of:=IF( ISBLANK([$'03.Muestra'.$C39]);"";[$'03.Muestra'.$C39]) ->  | C582: of:=IF( ISBLANK([$'03.Muestra'.$E39]);"";[$'03.Muestra'.$E39]) ->  | E582: of:=IF([.D582]<>"";IF(AND([.B582]<>"";[.C582]<>"");"";"ERR");"") -> 
B583: of:=IF( ISBLANK([$'03.Muestra'.$C40]);"";[$'03.Muestra'.$C40]) ->  | C583: of:=IF( ISBLANK([$'03.Muestra'.$E40]);"";[$'03.Muestra'.$E40]) ->  | E583: of:=IF([.D583]<>"";IF(AND([.B583]<>"";[.C583]<>"");"";"ERR");"") -> 
B584: of:=IF( ISBLANK([$'03.Muestra'.$C41]);"";[$'03.Muestra'.$C41]) ->  | C584: of:=IF( ISBLANK([$'03.Muestra'.$E41]);"";[$'03.Muestra'.$E41]) ->  | E584: of:=IF([.D584]<>"";IF(AND([.B584]<>"";[.C584]<>"");"";"ERR");"") -> 
B585: of:=IF( ISBLANK([$'03.Muestra'.$C42]);"";[$'03.Muestra'.$C42]) ->  | C585: of:=IF( ISBLANK([$'03.Muestra'.$E42]);"";[$'03.Muestra'.$E42]) ->  | E585: of:=IF([.D585]<>"";IF(AND([.B585]<>"";[.C585]<>"");"";"ERR");"") -> 
B588: A | C588: 2.5.3 Etiqueta en el nombre | D588: Resultado
B589: of:=IF( ISBLANK([$'03.Muestra'.$C8]);"";[$'03.Muestra'.$C8]) ->  | C589: of:=IF( ISBLANK([$'03.Muestra'.$C8]);"";[$'03.Muestra'.$E8]) ->  | E589: of:=IF([.D589]<>"";IF(AND([.B589]<>"";[.C589]<>"");"";"ERR");"") ->  | F589: N/T | G589: N/D | H589: N/A | I589: Falla | J589: Pasa | K589: En blanco
B590: of:=IF( ISBLANK([$'03.Muestra'.$C9]);"";[$'03.Muestra'.$C9]) ->  | C590: of:=IF( ISBLANK([$'03.Muestra'.$C9]);"";[$'03.Muestra'.$E9]) ->  | E590: of:=IF([.D590]<>"";IF(AND([.B590]<>"";[.C590]<>"");"";"ERR");"") ->  | F590: of:=COUNTIF([.$D589]:INDIRECT("$D" &  SUM(ROW()-1;[$'03.Muestra'.$D$45])-1);[.F589]) -> 0 | G590: of:=COUNTIF([.$D589]:INDIRECT("$D" &  SUM(ROW()-1;[$'03.Muestra'.$D$45])-1);[.G589]) -> 0 | H590: of:=COUNTIF([.$D589]:INDIRECT("$D" &  SUM(ROW()-1;[$'03.Muestra'.$D$45])-1);[.H589]) -> 0 | I590: of:=COUNTIF([.$D589]:INDIRECT("$D" &  SUM(ROW()-1;[$'03.Muestra'.$D$45])-1);[.I589]) -> 0 | J590: of:=COUNTIF([.$D589]:INDIRECT("$D" &  SUM(ROW()-1;[$'03.Muestra'.$D$45])-1);[.J589]) -> 0 | K590: of:=IF([$'03.Muestra'.$D$45]=0;0;COUNTBLANK([.$D589]:INDIRECT("$D" &  SUM(ROW()-1;[$'03.Muestra'.$D$45])-1))) -> 0
B591: of:=IF( ISBLANK([$'03.Muestra'.$C10]);"";[$'03.Muestra'.$C10]) ->  | C591: of:=IF( ISBLANK([$'03.Muestra'.$C10]);"";[$'03.Muestra'.$E10]) ->  | E591: of:=IF([.D591]<>"";IF(AND([.B591]<>"";[.C591]<>"");"";"ERR");"") -> 
B592: of:=IF( ISBLANK([$'03.Muestra'.$C11]);"";[$'03.Muestra'.$C11]) ->  | C592: of:=IF( ISBLANK([$'03.Muestra'.$C11]);"";[$'03.Muestra'.$E11]) ->  | E592: of:=IF([.D592]<>"";IF(AND([.B592]<>"";[.C592]<>"");"";"ERR");"") -> 
B593: of:=IF( ISBLANK([$'03.Muestra'.$C12]);"";[$'03.Muestra'.$C12]) ->  | C593: of:=IF( ISBLANK([$'03.Muestra'.$C12]);"";[$'03.Muestra'.$E12]) ->  | E593: of:=IF([.D593]<>"";IF(AND([.B593]<>"";[.C593]<>"");"";"ERR");"") -> 
B594: of:=IF( ISBLANK([$'03.Muestra'.$C13]);"";[$'03.Muestra'.$C13]) ->  | C594: of:=IF( ISBLANK([$'03.Muestra'.$C13]);"";[$'03.Muestra'.$E13]) ->  | E594: of:=IF([.D594]<>"";IF(AND([.B594]<>"";[.C594]<>"");"";"ERR");"") -> 
B595: of:=IF( ISBLANK([$'03.Muestra'.$C14]);"";[$'03.Muestra'.$C14]) ->  | C595: of:=IF( ISBLANK([$'03.Muestra'.$C14]);"";[$'03.Muestra'.$E14]) ->  | E595: of:=IF([.D595]<>"";IF(AND([.B595]<>"";[.C595]<>"");"";"ERR");"") -> 
B596: of:=IF( ISBLANK([$'03.Muestra'.$C15]);"";[$'03.Muestra'.$C15]) ->  | C596: of:=IF( ISBLANK([$'03.Muestra'.$C15]);"";[$'03.Muestra'.$E15]) ->  | E596: of:=IF([.D596]<>"";IF(AND([.B596]<>"";[.C596]<>"");"";"ERR");"") -> 
B597: of:=IF( ISBLANK([$'03.Muestra'.$C16]);"";[$'03.Muestra'.$C16]) ->  | C597: of:=IF( ISBLANK([$'03.Muestra'.$C16]);"";[$'03.Muestra'.$E16]) ->  | E597: of:=IF([.D597]<>"";IF(AND([.B597]<>"";[.C597]<>"");"";"ERR");"") -> 
B598: of:=IF( ISBLANK([$'03.Muestra'.$C17]);"";[$'03.Muestra'.$C17]) ->  | C598: of:=IF( ISBLANK([$'03.Muestra'.$C17]);"";[$'03.Muestra'.$E17]) ->  | E598: of:=IF([.D598]<>"";IF(AND([.B598]<>"";[.C598]<>"");"";"ERR");"") -> 
B599: of:=IF( ISBLANK([$'03.Muestra'.$C18]);"";[$'03.Muestra'.$C18]) ->  | C599: of:=IF( ISBLANK([$'03.Muestra'.$C18]);"";[$'03.Muestra'.$E18]) ->  | E599: of:=IF([.D599]<>"";IF(AND([.B599]<>"";[.C599]<>"");"";"ERR");"") -> 
B600: of:=IF( ISBLANK([$'03.Muestra'.$C19]);"";[$'03.Muestra'.$C19]) ->  | C600: of:=IF( ISBLANK([$'03.Muestra'.$C19]);"";[$'03.Muestra'.$E19]) ->  | E600: of:=IF([.D600]<>"";IF(AND([.B600]<>"";[.C600]<>"");"";"ERR");"") -> 
B601: of:=IF( ISBLANK([$'03.Muestra'.$C20]);"";[$'03.Muestra'.$C20]) ->  | C601: of:=IF( ISBLANK([$'03.Muestra'.$C20]);"";[$'03.Muestra'.$E20]) ->  | E601: of:=IF([.D601]<>"";IF(AND([.B601]<>"";[.C601]<>"");"";"ERR");"") -> 
B602: of:=IF( ISBLANK([$'03.Muestra'.$C21]);"";[$'03.Muestra'.$C21]) ->  | C602: of:=IF( ISBLANK([$'03.Muestra'.$C21]);"";[$'03.Muestra'.$E21]) ->  | E602: of:=IF([.D602]<>"";IF(AND([.B602]<>"";[.C602]<>"");"";"ERR");"") -> 
B603: of:=IF( ISBLANK([$'03.Muestra'.$C22]);"";[$'03.Muestra'.$C22]) ->  | C603: of:=IF( ISBLANK([$'03.Muestra'.$C22]);"";[$'03.Muestra'.$E22]) ->  | E603: of:=IF([.D603]<>"";IF(AND([.B603]<>"";[.C603]<>"");"";"ERR");"") -> 
B604: of:=IF( ISBLANK([$'03.Muestra'.$C23]);"";[$'03.Muestra'.$C23]) ->  | C604: of:=IF( ISBLANK([$'03.Muestra'.$C23]);"";[$'03.Muestra'.$E23]) ->  | E604: of:=IF([.D604]<>"";IF(AND([.B604]<>"";[.C604]<>"");"";"ERR");"") -> 
B605: of:=IF( ISBLANK([$'03.Muestra'.$C24]);"";[$'03.Muestra'.$C24]) ->  | C605: of:=IF( ISBLANK([$'03.Muestra'.$C24]);"";[$'03.Muestra'.$E24]) ->  | E605: of:=IF([.D605]<>"";IF(AND([.B605]<>"";[.C605]<>"");"";"ERR");"") -> 
B606: of:=IF( ISBLANK([$'03.Muestra'.$C25]);"";[$'03.Muestra'.$C25]) ->  | C606: of:=IF( ISBLANK([$'03.Muestra'.$C25]);"";[$'03.Muestra'.$E25]) ->  | E606: of:=IF([.D606]<>"";IF(AND([.B606]<>"";[.C606]<>"");"";"ERR");"") -> 
B607: of:=IF( ISBLANK([$'03.Muestra'.$C26]);"";[$'03.Muestra'.$C26]) ->  | C607: of:=IF( ISBLANK([$'03.Muestra'.$C26]);"";[$'03.Muestra'.$E26]) ->  | E607: of:=IF([.D607]<>"";IF(AND([.B607]<>"";[.C607]<>"");"";"ERR");"") -> 
B608: of:=IF( ISBLANK([$'03.Muestra'.$C27]);"";[$'03.Muestra'.$C27]) ->  | C608: of:=IF( ISBLANK([$'03.Muestra'.$C27]);"";[$'03.Muestra'.$E27]) ->  | E608: of:=IF([.D608]<>"";IF(AND([.B608]<>"";[.C608]<>"");"";"ERR");"") -> 
B609: of:=IF( ISBLANK([$'03.Muestra'.$C28]);"";[$'03.Muestra'.$C28]) ->  | C609: of:=IF( ISBLANK([$'03.Muestra'.$C28]);"";[$'03.Muestra'.$E28]) ->  | E609: of:=IF([.D609]<>"";IF(AND([.B609]<>"";[.C609]<>"");"";"ERR");"") -> 
B610: of:=IF( ISBLANK([$'03.Muestra'.$C29]);"";[$'03.Muestra'.$C29]) ->  | C610: of:=IF( ISBLANK([$'03.Muestra'.$C29]);"";[$'03.Muestra'.$E29]) ->  | E610: of:=IF([.D610]<>"";IF(AND([.B610]<>"";[.C610]<>"");"";"ERR");"") -> 
B611: of:=IF( ISBLANK([$'03.Muestra'.$C30]);"";[$'03.Muestra'.$C30]) ->  | C611: of:=IF( ISBLANK([$'03.Muestra'.$C30]);"";[$'03.Muestra'.$E30]) ->  | E611: of:=IF([.D611]<>"";IF(AND([.B611]<>"";[.C611]<>"");"";"ERR");"") -> 
B612: of:=IF( ISBLANK([$'03.Muestra'.$C31]);"";[$'03.Muestra'.$C31]) ->  | C612: of:=IF( ISBLANK([$'03.Muestra'.$C31]);"";[$'03.Muestra'.$E31]) ->  | E612: of:=IF([.D612]<>"";IF(AND([.B612]<>"";[.C612]<>"");"";"ERR");"") -> 
B613: of:=IF( ISBLANK([$'03.Muestra'.$C32]);"";[$'03.Muestra'.$C32]) ->  | C613: of:=IF( ISBLANK([$'03.Muestra'.$C32]);"";[$'03.Muestra'.$E32]) ->  | E613: of:=IF([.D613]<>"";IF(AND([.B613]<>"";[.C613]<>"");"";"ERR");"") -> 
B614: of:=IF( ISBLANK([$'03.Muestra'.$C33]);"";[$'03.Muestra'.$C33]) ->  | C614: of:=IF( ISBLANK([$'03.Muestra'.$C33]);"";[$'03.Muestra'.$E33]) ->  | E614: of:=IF([.D614]<>"";IF(AND([.B614]<>"";[.C614]<>"");"";"ERR");"") -> 
B615: of:=IF( ISBLANK([$'03.Muestra'.$C34]);"";[$'03.Muestra'.$C34]) ->  | C615: of:=IF( ISBLANK([$'03.Muestra'.$C34]);"";[$'03.Muestra'.$E34]) ->  | E615: of:=IF([.D615]<>"";IF(AND([.B615]<>"";[.C615]<>"");"";"ERR");"") -> 
B616: of:=IF( ISBLANK([$'03.Muestra'.$C35]);"";[$'03.Muestra'.$C35]) ->  | C616: of:=IF( ISBLANK([$'03.Muestra'.$C35]);"";[$'03.Muestra'.$E35]) ->  | E616: of:=IF([.D616]<>"";IF(AND([.B616]<>"";[.C616]<>"");"";"ERR");"") -> 
B617: of:=IF( ISBLANK([$'03.Muestra'.$C36]);"";[$'03.Muestra'.$C36]) ->  | C617: of:=IF( ISBLANK([$'03.Muestra'.$C36]);"";[$'03.Muestra'.$E36]) ->  | E617: of:=IF([.D617]<>"";IF(AND([.B617]<>"";[.C617]<>"");"";"ERR");"") -> 
B618: of:=IF( ISBLANK([$'03.Muestra'.$C37]);"";[$'03.Muestra'.$C37]) ->  | C618: of:=IF( ISBLANK([$'03.Muestra'.$C37]);"";[$'03.Muestra'.$E37]) ->  | E618: of:=IF([.D618]<>"";IF(AND([.B618]<>"";[.C618]<>"");"";"ERR");"") -> 
B619: of:=IF( ISBLANK([$'03.Muestra'.$C38]);"";[$'03.Muestra'.$C38]) ->  | C619: of:=IF( ISBLANK([$'03.Muestra'.$C38]);"";[$'03.Muestra'.$E38]) ->  | E619: of:=IF([.D619]<>"";IF(AND([.B619]<>"";[.C619]<>"");"";"ERR");"") -> 
B620: of:=IF( ISBLANK([$'03.Muestra'.$C39]);"";[$'03.Muestra'.$C39]) ->  | C620: of:=IF( ISBLANK([$'03.Muestra'.$C39]);"";[$'03.Muestra'.$E39]) ->  | E620: of:=IF([.D620]<>"";IF(AND([.B620]<>"";[.C620]<>"");"";"ERR");"") -> 
B621: of:=IF( ISBLANK([$'03.Muestra'.$C40]);"";[$'03.Muestra'.$C40]) ->  | C621: of:=IF( ISBLANK([$'03.Muestra'.$C40]);"";[$'03.Muestra'.$E40]) ->  | E621: of:=IF([.D621]<>"";IF(AND([.B621]<>"";[.C621]<>"");"";"ERR");"") -> 
B622: of:=IF( ISBLANK([$'03.Muestra'.$C41]);"";[$'03.Muestra'.$C41]) ->  | C622: of:=IF( ISBLANK([$'03.Muestra'.$C41]);"";[$'03.Muestra'.$E41]) ->  | E622: of:=IF([.D622]<>"";IF(AND([.B622]<>"";[.C622]<>"");"";"ERR");"") -> 
B623: of:=IF( ISBLANK([$'03.Muestra'.$C42]);"";[$'03.Muestra'.$C42]) ->  | C623: of:=IF( ISBLANK([$'03.Muestra'.$C42]);"";[$'03.Muestra'.$E42]) ->  | E623: of:=IF([.D623]<>"";IF(AND([.B623]<>"";[.C623]<>"");"";"ERR");"") -> 
B626: A | C626: 2.5.4. Activación mediante movimiento | D626: Resultado
B627: of:=IF( ISBLANK([$'03.Muestra'.$C8]);"";[$'03.Muestra'.$C8]) ->  | C627: of:=IF( ISBLANK([$'03.Muestra'.$E8]);"";[$'03.Muestra'.$E8]) ->  | E627: of:=IF([.D627]<>"";IF(AND([.B627]<>"";[.C627]<>"");"";"ERR");"") ->  | F627: N/T | G627: N/D | H627: N/A | I627: Falla | J627: Pasa | K627: En blanco
B628: of:=IF( ISBLANK([$'03.Muestra'.$C9]);"";[$'03.Muestra'.$C9]) ->  | C628: of:=IF( ISBLANK([$'03.Muestra'.$E9]);"";[$'03.Muestra'.$E9]) ->  | E628: of:=IF([.D628]<>"";IF(AND([.B628]<>"";[.C628]<>"");"";"ERR");"") ->  | F628: of:=COUNTIF([.$D627]:INDIRECT("$D" &  SUM(ROW()-1;[$'03.Muestra'.$D$45])-1);[.F627]) -> 0 | G628: of:=COUNTIF([.$D627]:INDIRECT("$D" &  SUM(ROW()-1;[$'03.Muestra'.$D$45])-1);[.G627]) -> 0 | H628: of:=COUNTIF([.$D627]:INDIRECT("$D" &  SUM(ROW()-1;[$'03.Muestra'.$D$45])-1);[.H627]) -> 0 | I628: of:=COUNTIF([.$D627]:INDIRECT("$D" &  SUM(ROW()-1;[$'03.Muestra'.$D$45])-1);[.I627]) -> 0 | J628: of:=COUNTIF([.$D627]:INDIRECT("$D" &  SUM(ROW()-1;[$'03.Muestra'.$D$45])-1);[.J627]) -> 0 | K628: of:=IF([$'03.Muestra'.$D$45]=0;0;COUNTBLANK([.$D627]:INDIRECT("$D" &  SUM(ROW()-1;[$'03.Muestra'.$D$45])-1))) -> 0
B629: of:=IF( ISBLANK([$'03.Muestra'.$C10]);"";[$'03.Muestra'.$C10]) ->  | C629: of:=IF( ISBLANK([$'03.Muestra'.$E10]);"";[$'03.Muestra'.$E10]) ->  | E629: of:=IF([.D629]<>"";IF(AND([.B629]<>"";[.C629]<>"");"";"ERR");"") -> 
B630: of:=IF( ISBLANK([$'03.Muestra'.$C11]);"";[$'03.Muestra'.$C11]) ->  | C630: of:=IF( ISBLANK([$'03.Muestra'.$E11]);"";[$'03.Muestra'.$E11]) ->  | E630: of:=IF([.D630]<>"";IF(AND([.B630]<>"";[.C630]<>"");"";"ERR");"") -> 
B631: of:=IF( ISBLANK([$'03.Muestra'.$C12]);"";[$'03.Muestra'.$C12]) ->  | C631: of:=IF( ISBLANK([$'03.Muestra'.$E12]);"";[$'03.Muestra'.$E12]) ->  | E631: of:=IF([.D631]<>"";IF(AND([.B631]<>"";[.C631]<>"");"";"ERR");"") -> 
B632: of:=IF( ISBLANK([$'03.Muestra'.$C13]);"";[$'03.Muestra'.$C13]) ->  | C632: of:=IF( ISBLANK([$'03.Muestra'.$E13]);"";[$'03.Muestra'.$E13]) ->  | E632: of:=IF([.D632]<>"";IF(AND([.B632]<>"";[.C632]<>"");"";"ERR");"") -> 
B633: of:=IF( ISBLANK([$'03.Muestra'.$C14]);"";[$'03.Muestra'.$C14]) ->  | C633: of:=IF( ISBLANK([$'03.Muestra'.$E14]);"";[$'03.Muestra'.$E14]) ->  | E633: of:=IF([.D633]<>"";IF(AND([.B633]<>"";[.C633]<>"");"";"ERR");"") -> 
B634: of:=IF( ISBLANK([$'03.Muestra'.$C15]);"";[$'03.Muestra'.$C15]) ->  | C634: of:=IF( ISBLANK([$'03.Muestra'.$E15]);"";[$'03.Muestra'.$E15]) ->  | E634: of:=IF([.D634]<>"";IF(AND([.B634]<>"";[.C634]<>"");"";"ERR");"") -> 
B635: of:=IF( ISBLANK([$'03.Muestra'.$C16]);"";[$'03.Muestra'.$C16]) ->  | C635: of:=IF( ISBLANK([$'03.Muestra'.$E16]);"";[$'03.Muestra'.$E16]) ->  | E635: of:=IF([.D635]<>"";IF(AND([.B635]<>"";[.C635]<>"");"";"ERR");"") -> 
B636: of:=IF( ISBLANK([$'03.Muestra'.$C17]);"";[$'03.Muestra'.$C17]) ->  | C636: of:=IF( ISBLANK([$'03.Muestra'.$E17]);"";[$'03.Muestra'.$E17]) ->  | E636: of:=IF([.D636]<>"";IF(AND([.B636]<>"";[.C636]<>"");"";"ERR");"") -> 
B637: of:=IF( ISBLANK([$'03.Muestra'.$C18]);"";[$'03.Muestra'.$C18]) ->  | C637: of:=IF( ISBLANK([$'03.Muestra'.$E18]);"";[$'03.Muestra'.$E18]) ->  | E637: of:=IF([.D637]<>"";IF(AND([.B637]<>"";[.C637]<>"");"";"ERR");"") -> 
B638: of:=IF( ISBLANK([$'03.Muestra'.$C19]);"";[$'03.Muestra'.$C19]) ->  | C638: of:=IF( ISBLANK([$'03.Muestra'.$E19]);"";[$'03.Muestra'.$E19]) ->  | E638: of:=IF([.D638]<>"";IF(AND([.B638]<>"";[.C638]<>"");"";"ERR");"") -> 
B639: of:=IF( ISBLANK([$'03.Muestra'.$C20]);"";[$'03.Muestra'.$C20]) ->  | C639: of:=IF( ISBLANK([$'03.Muestra'.$E20]);"";[$'03.Muestra'.$E20]) ->  | E639: of:=IF([.D639]<>"";IF(AND([.B639]<>"";[.C639]<>"");"";"ERR");"") -> 
B640: of:=IF( ISBLANK([$'03.Muestra'.$C21]);"";[$'03.Muestra'.$C21]) ->  | C640: of:=IF( ISBLANK([$'03.Muestra'.$E21]);"";[$'03.Muestra'.$E21]) ->  | E640: of:=IF([.D640]<>"";IF(AND([.B640]<>"";[.C640]<>"");"";"ERR");"") -> 
B641: of:=IF( ISBLANK([$'03.Muestra'.$C22]);"";[$'03.Muestra'.$C22]) ->  | C641: of:=IF( ISBLANK([$'03.Muestra'.$E22]);"";[$'03.Muestra'.$E22]) ->  | E641: of:=IF([.D641]<>"";IF(AND([.B641]<>"";[.C641]<>"");"";"ERR");"") -> 
B642: of:=IF( ISBLANK([$'03.Muestra'.$C23]);"";[$'03.Muestra'.$C23]) ->  | C642: of:=IF( ISBLANK([$'03.Muestra'.$E23]);"";[$'03.Muestra'.$E23]) ->  | E642: of:=IF([.D642]<>"";IF(AND([.B642]<>"";[.C642]<>"");"";"ERR");"") -> 
B643: of:=IF( ISBLANK([$'03.Muestra'.$C24]);"";[$'03.Muestra'.$C24]) ->  | C643: of:=IF( ISBLANK([$'03.Muestra'.$E24]);"";[$'03.Muestra'.$E24]) ->  | E643: of:=IF([.D643]<>"";IF(AND([.B643]<>"";[.C643]<>"");"";"ERR");"") -> 
B644: of:=IF( ISBLANK([$'03.Muestra'.$C25]);"";[$'03.Muestra'.$C25]) ->  | C644: of:=IF( ISBLANK([$'03.Muestra'.$E25]);"";[$'03.Muestra'.$E25]) ->  | E644: of:=IF([.D644]<>"";IF(AND([.B644]<>"";[.C644]<>"");"";"ERR");"") -> 
B645: of:=IF( ISBLANK([$'03.Muestra'.$C26]);"";[$'03.Muestra'.$C26]) ->  | C645: of:=IF( ISBLANK([$'03.Muestra'.$E26]);"";[$'03.Muestra'.$E26]) ->  | E645: of:=IF([.D645]<>"";IF(AND([.B645]<>"";[.C645]<>"");"";"ERR");"") -> 
B646: of:=IF( ISBLANK([$'03.Muestra'.$C27]);"";[$'03.Muestra'.$C27]) ->  | C646: of:=IF( ISBLANK([$'03.Muestra'.$E27]);"";[$'03.Muestra'.$E27]) ->  | E646: of:=IF([.D646]<>"";IF(AND([.B646]<>"";[.C646]<>"");"";"ERR");"") -> 
B647: of:=IF( ISBLANK([$'03.Muestra'.$C28]);"";[$'03.Muestra'.$C28]) ->  | C647: of:=IF( ISBLANK([$'03.Muestra'.$E28]);"";[$'03.Muestra'.$E28]) ->  | E647: of:=IF([.D647]<>"";IF(AND([.B647]<>"";[.C647]<>"");"";"ERR");"") -> 
B648: of:=IF( ISBLANK([$'03.Muestra'.$C29]);"";[$'03.Muestra'.$C29]) ->  | C648: of:=IF( ISBLANK([$'03.Muestra'.$E29]);"";[$'03.Muestra'.$E29]) ->  | E648: of:=IF([.D648]<>"";IF(AND([.B648]<>"";[.C648]<>"");"";"ERR");"") -> 
B649: of:=IF( ISBLANK([$'03.Muestra'.$C30]);"";[$'03.Muestra'.$C30]) ->  | C649: of:=IF( ISBLANK([$'03.Muestra'.$E30]);"";[$'03.Muestra'.$E30]) ->  | E649: of:=IF([.D649]<>"";IF(AND([.B649]<>"";[.C649]<>"");"";"ERR");"") -> 
B650: of:=IF( ISBLANK([$'03.Muestra'.$C31]);"";[$'03.Muestra'.$C31]) ->  | C650: of:=IF( ISBLANK([$'03.Muestra'.$E31]);"";[$'03.Muestra'.$E31]) ->  | E650: of:=IF([.D650]<>"";IF(AND([.B650]<>"";[.C650]<>"");"";"ERR");"") -> 
B651: of:=IF( ISBLANK([$'03.Muestra'.$C32]);"";[$'03.Muestra'.$C32]) ->  | C651: of:=IF( ISBLANK([$'03.Muestra'.$E32]);"";[$'03.Muestra'.$E32]) ->  | E651: of:=IF([.D651]<>"";IF(AND([.B651]<>"";[.C651]<>"");"";"ERR");"") -> 
B652: of:=IF( ISBLANK([$'03.Muestra'.$C33]);"";[$'03.Muestra'.$C33]) ->  | C652: of:=IF( ISBLANK([$'03.Muestra'.$E33]);"";[$'03.Muestra'.$E33]) ->  | E652: of:=IF([.D652]<>"";IF(AND([.B652]<>"";[.C652]<>"");"";"ERR");"") -> 
B653: of:=IF( ISBLANK([$'03.Muestra'.$C34]);"";[$'03.Muestra'.$C34]) ->  | C653: of:=IF( ISBLANK([$'03.Muestra'.$E34]);"";[$'03.Muestra'.$E34]) ->  | E653: of:=IF([.D653]<>"";IF(AND([.B653]<>"";[.C653]<>"");"";"ERR");"") -> 
B654: of:=IF( ISBLANK([$'03.Muestra'.$C35]);"";[$'03.Muestra'.$C35]) ->  | C654: of:=IF( ISBLANK([$'03.Muestra'.$E35]);"";[$'03.Muestra'.$E35]) ->  | E654: of:=IF([.D654]<>"";IF(AND([.B654]<>"";[.C654]<>"");"";"ERR");"") -> 
B655: of:=IF( ISBLANK([$'03.Muestra'.$C36]);"";[$'03.Muestra'.$C36]) ->  | C655: of:=IF( ISBLANK([$'03.Muestra'.$E36]);"";[$'03.Muestra'.$E36]) ->  | E655: of:=IF([.D655]<>"";IF(AND([.B655]<>"";[.C655]<>"");"";"ERR");"") -> 
B656: of:=IF( ISBLANK([$'03.Muestra'.$C37]);"";[$'03.Muestra'.$C37]) ->  | C656: of:=IF( ISBLANK([$'03.Muestra'.$E37]);"";[$'03.Muestra'.$E37]) ->  | E656: of:=IF([.D656]<>"";IF(AND([.B656]<>"";[.C656]<>"");"";"ERR");"") -> 
B657: of:=IF( ISBLANK([$'03.Muestra'.$C38]);"";[$'03.Muestra'.$C38]) ->  | C657: of:=IF( ISBLANK([$'03.Muestra'.$E38]);"";[$'03.Muestra'.$E38]) ->  | E657: of:=IF([.D657]<>"";IF(AND([.B657]<>"";[.C657]<>"");"";"ERR");"") -> 
B658: of:=IF( ISBLANK([$'03.Muestra'.$C39]);"";[$'03.Muestra'.$C39]) ->  | C658: of:=IF( ISBLANK([$'03.Muestra'.$E39]);"";[$'03.Muestra'.$E39]) ->  | E658: of:=IF([.D658]<>"";IF(AND([.B658]<>"";[.C658]<>"");"";"ERR");"") -> 
B659: of:=IF( ISBLANK([$'03.Muestra'.$C40]);"";[$'03.Muestra'.$C40]) ->  | C659: of:=IF( ISBLANK([$'03.Muestra'.$E40]);"";[$'03.Muestra'.$E40]) ->  | E659: of:=IF([.D659]<>"";IF(AND([.B659]<>"";[.C659]<>"");"";"ERR");"") -> 
B660: of:=IF( ISBLANK([$'03.Muestra'.$C41]);"";[$'03.Muestra'.$C41]) ->  | C660: of:=IF( ISBLANK([$'03.Muestra'.$E41]);"";[$'03.Muestra'.$E41]) ->  | E660: of:=IF([.D660]<>"";IF(AND([.B660]<>"";[.C660]<>"");"";"ERR");"") -> 
B661: of:=IF( ISBLANK([$'03.Muestra'.$C42]);"";[$'03.Muestra'.$C42]) ->  | C661: of:=IF( ISBLANK([$'03.Muestra'.$E42]);"";[$'03.Muestra'.$E42]) ->  | E661: of:=IF([.D661]<>"";IF(AND([.B661]<>"";[.C661]<>"");"";"ERR");"") -> 

Sheet: P3.Comprensible
B2: Informe de revisión de la accesibilidad
B3: Análisis de accesibilidad en profundidad de un sitio web
B5: Revisión de la muestra
B8: Principio 3: Comprensible
B9: La información y el manejo de la interfaz de usuario deben ser comprensibles.
B11: Criterios de Conformidad | F11: EVALUADOS | G11: N.º Criterios x N.º Páginas | H11: % | J11: PENDIENTES | K11: N.º Criterios x N.º Páginas | L11: %
B12: A | C12: 5 | F12: Pasa | G12: of:=[.J20]+[.J58]+[.J96]+[.J134]+[.J172]+[.J210]+[.J248]+[.J286]+[.J324]+[.J362] -> 0 | H12: of:=IF(([.$G$15]+[.$K$15])=0;0;[.G12]/([.$G$15]+[.$K$15])) -> 0 | J12: No decide | K12: of:=[.G20]+[.G58]+[.G96]+[.G134]+[.G172]+[.G210]+[.G248]+[.G286]+[.G324]+[.G362] -> 0 | L12: of:=IF(([.$G$15]+[.$K$15])=0;0;[.K12]/([.$G$15]+[.$K$15])) -> 0
B13: AA | C13: 5 | F13: Falla | G13: of:=[.I20]+[.I58]+[.I96]+[.I134]+[.I172]+[.I210]+[.I248]+[.I286]+[.I324]+[.I362] -> 0 | H13: of:=IF(([.$G$15]+[.$K$15])=0;0;[.G13]/([.$G$15]+[.$K$15])) -> 0 | J13: No testeado | K13: of:=[.F20]+[.F58]+[.F96]+[.F134]+[.F172]+[.F210]+[.F248]+[.F286]+[.F324]+[.F362] -> 0 | L13: of:=IF(([.$G$15]+[.$K$15])=0;0;[.K13]/([.$G$15]+[.$K$15])) -> 0
B14: Total | C14: of:=SUM([.C12:.C13]) -> 10 | F14: No aplica | G14: of:=[.H20]+[.H58]+[.H96]+[.H134]+[.H172]+[.H210]+[.H248]+[.H286]+[.H324]+[.H362] -> 0 | H14: of:=IF(([.$G$15]+[.$K$15])=0;0;[.G14]/([.$G$15]+[.$K$15])) -> 0 | J14: En blanco | K14: of:=[.K20]+[.K58]+[.K96]+[.K134]+[.K172]+[.K210]+[.K248]+[.K286]+[.K324]+[.K362] -> 0 | L14: of:=IF(([.$G$15]+[.$K$15])=0;0;[.K14]/([.$G$15]+[.$K$15])) -> 0
F15: Total | G15: of:=SUM([.G12:.G14]) -> 0 | H15: of:=SUM([.H12:.H14]) -> 0 | J15: Total | K15: of:=SUM([.K12:.K14]) -> 0 | L15: of:=SUM([.L12:.L14]) -> 0
B18: A | C18: 3.1.1 Idioma de la página | D18: Resultado
B19: of:=IF( ISBLANK([$'03.Muestra'.$C8]);"";[$'03.Muestra'.$C8]) ->  | C19: of:=IF( ISBLANK([$'03.Muestra'.$E8]);"";[$'03.Muestra'.$E8]) ->  | E19: of:=IF([.D19]<>"";IF(AND([.B19]<>"";[.C19]<>"");"";"ERR");"") ->  | F19: N/T | G19: N/D | H19: N/A | I19: Falla | J19: Pasa | K19: En blanco
B20: of:=IF( ISBLANK([$'03.Muestra'.$C9]);"";[$'03.Muestra'.$C9]) ->  | C20: of:=IF( ISBLANK([$'03.Muestra'.$E9]);"";[$'03.Muestra'.$E9]) ->  | E20: of:=IF([.D20]<>"";IF(AND([.B20]<>"";[.C20]<>"");"";"ERR");"") ->  | F20: of:=COUNTIF([.$D19]:INDIRECT("$D" &  SUM(ROW()-1;[$'03.Muestra'.$D$45])-1);[.F19]) -> 0 | G20: of:=COUNTIF([.$D19]:INDIRECT("$D" &  SUM(ROW()-1;[$'03.Muestra'.$D$45])-1);[.G19]) -> 0 | H20: of:=COUNTIF([.$D19]:INDIRECT("$D" &  SUM(ROW()-1;[$'03.Muestra'.$D$45])-1);[.H19]) -> 0 | I20: of:=COUNTIF([.$D19]:INDIRECT("$D" &  SUM(ROW()-1;[$'03.Muestra'.$D$45])-1);[.I19]) -> 0 | J20: of:=COUNTIF([.$D19]:INDIRECT("$D" &  SUM(ROW()-1;[$'03.Muestra'.$D$45])-1);[.J19]) -> 0 | K20: of:=IF([$'03.Muestra'.$D$45]=0;0;COUNTBLANK([.$D19]:INDIRECT("$D" &  SUM(ROW()-1;[$'03.Muestra'.$D$45])-1))) -> 0
B21: of:=IF( ISBLANK([$'03.Muestra'.$C10]);"";[$'03.Muestra'.$C10]) ->  | C21: of:=IF( ISBLANK([$'03.Muestra'.$E10]);"";[$'03.Muestra'.$E10]) ->  | E21: of:=IF([.D21]<>"";IF(AND([.B21]<>"";[.C21]<>"");"";"ERR");"") -> 
B22: of:=IF( ISBLANK([$'03.Muestra'.$C11]);"";[$'03.Muestra'.$C11]) ->  | C22: of:=IF( ISBLANK([$'03.Muestra'.$E11]);"";[$'03.Muestra'.$E11]) ->  | E22: of:=IF([.D22]<>"";IF(AND([.B22]<>"";[.C22]<>"");"";"ERR");"") ->  | K22: N/T | L22: No Testeado
B23: of:=IF( ISBLANK([$'03.Muestra'.$C12]);"";[$'03.Muestra'.$C12]) ->  | C23: of:=IF( ISBLANK([$'03.Muestra'.$E12]);"";[$'03.Muestra'.$E12]) ->  | E23: of:=IF([.D23]<>"";IF(AND([.B23]<>"";[.C23]<>"");"";"ERR");"") ->  | K23: N/A | L23: No Aplica
B24: of:=IF( ISBLANK([$'03.Muestra'.$C13]);"";[$'03.Muestra'.$C13]) ->  | C24: of:=IF( ISBLANK([$'03.Muestra'.$E13]);"";[$'03.Muestra'.$E13]) ->  | E24: of:=IF([.D24]<>"";IF(AND([.B24]<>"";[.C24]<>"");"";"ERR");"") ->  | K24: N/D | L24: No Decide
B25: of:=IF( ISBLANK([$'03.Muestra'.$C14]);"";[$'03.Muestra'.$C14]) ->  | C25: of:=IF( ISBLANK([$'03.Muestra'.$E14]);"";[$'03.Muestra'.$E14]) ->  | E25: of:=IF([.D25]<>"";IF(AND([.B25]<>"";[.C25]<>"");"";"ERR");"") -> 
B26: of:=IF( ISBLANK([$'03.Muestra'.$C15]);"";[$'03.Muestra'.$C15]) ->  | C26: of:=IF( ISBLANK([$'03.Muestra'.$E15]);"";[$'03.Muestra'.$E15]) ->  | E26: of:=IF([.D26]<>"";IF(AND([.B26]<>"";[.C26]<>"");"";"ERR");"") -> 
B27: of:=IF( ISBLANK([$'03.Muestra'.$C16]);"";[$'03.Muestra'.$C16]) ->  | C27: of:=IF( ISBLANK([$'03.Muestra'.$E16]);"";[$'03.Muestra'.$E16]) ->  | E27: of:=IF([.D27]<>"";IF(AND([.B27]<>"";[.C27]<>"");"";"ERR");"") -> 
B28: of:=IF( ISBLANK([$'03.Muestra'.$C17]);"";[$'03.Muestra'.$C17]) ->  | C28: of:=IF( ISBLANK([$'03.Muestra'.$E17]);"";[$'03.Muestra'.$E17]) ->  | E28: of:=IF([.D28]<>"";IF(AND([.B28]<>"";[.C28]<>"");"";"ERR");"") -> 
B29: of:=IF( ISBLANK([$'03.Muestra'.$C18]);"";[$'03.Muestra'.$C18]) ->  | C29: of:=IF( ISBLANK([$'03.Muestra'.$E18]);"";[$'03.Muestra'.$E18]) ->  | E29: of:=IF([.D29]<>"";IF(AND([.B29]<>"";[.C29]<>"");"";"ERR");"") -> 
B30: of:=IF( ISBLANK([$'03.Muestra'.$C19]);"";[$'03.Muestra'.$C19]) ->  | C30: of:=IF( ISBLANK([$'03.Muestra'.$E19]);"";[$'03.Muestra'.$E19]) ->  | E30: of:=IF([.D30]<>"";IF(AND([.B30]<>"";[.C30]<>"");"";"ERR");"") -> 
B31: of:=IF( ISBLANK([$'03.Muestra'.$C20]);"";[$'03.Muestra'.$C20]) ->  | C31: of:=IF( ISBLANK([$'03.Muestra'.$E20]);"";[$'03.Muestra'.$E20]) ->  | E31: of:=IF([.D31]<>"";IF(AND([.B31]<>"";[.C31]<>"");"";"ERR");"") -> 
B32: of:=IF( ISBLANK([$'03.Muestra'.$C21]);"";[$'03.Muestra'.$C21]) ->  | C32: of:=IF( ISBLANK([$'03.Muestra'.$E21]);"";[$'03.Muestra'.$E21]) ->  | E32: of:=IF([.D32]<>"";IF(AND([.B32]<>"";[.C32]<>"");"";"ERR");"") -> 
B33: of:=IF( ISBLANK([$'03.Muestra'.$C22]);"";[$'03.Muestra'.$C22]) ->  | C33: of:=IF( ISBLANK([$'03.Muestra'.$E22]);"";[$'03.Muestra'.$E22]) ->  | E33: of:=IF([.D33]<>"";IF(AND([.B33]<>"";[.C33]<>"");"";"ERR");"") -> 
B34: of:=IF( ISBLANK([$'03.Muestra'.$C23]);"";[$'03.Muestra'.$C23]) ->  | C34: of:=IF( ISBLANK([$'03.Muestra'.$E23]);"";[$'03.Muestra'.$E23]) ->  | E34: of:=IF([.D34]<>"";IF(AND([.B34]<>"";[.C34]<>"");"";"ERR");"") -> 
B35: of:=IF( ISBLANK([$'03.Muestra'.$C24]);"";[$'03.Muestra'.$C24]) ->  | C35: of:=IF( ISBLANK([$'03.Muestra'.$E24]);"";[$'03.Muestra'.$E24]) ->  | E35: of:=IF([.D35]<>"";IF(AND([.B35]<>"";[.C35]<>"");"";"ERR");"") -> 
B36: of:=IF( ISBLANK([$'03.Muestra'.$C25]);"";[$'03.Muestra'.$C25]) ->  | C36: of:=IF( ISBLANK([$'03.Muestra'.$E25]);"";[$'03.Muestra'.$E25]) ->  | E36: of:=IF([.D36]<>"";IF(AND([.B36]<>"";[.C36]<>"");"";"ERR");"") -> 
B37: of:=IF( ISBLANK([$'03.Muestra'.$C26]);"";[$'03.Muestra'.$C26]) ->  | C37: of:=IF( ISBLANK([$'03.Muestra'.$E26]);"";[$'03.Muestra'.$E26]) ->  | E37: of:=IF([.D37]<>"";IF(AND([.B37]<>"";[.C37]<>"");"";"ERR");"") -> 
B38: of:=IF( ISBLANK([$'03.Muestra'.$C27]);"";[$'03.Muestra'.$C27]) ->  | C38: of:=IF( ISBLANK([$'03.Muestra'.$E27]);"";[$'03.Muestra'.$E27]) ->  | E38: of:=IF([.D38]<>"";IF(AND([.B38]<>"";[.C38]<>"");"";"ERR");"") -> 
B39: of:=IF( ISBLANK([$'03.Muestra'.$C28]);"";[$'03.Muestra'.$C28]) ->  | C39: of:=IF( ISBLANK([$'03.Muestra'.$E28]);"";[$'03.Muestra'.$E28]) ->  | E39: of:=IF([.D39]<>"";IF(AND([.B39]<>"";[.C39]<>"");"";"ERR");"") -> 
B40: of:=IF( ISBLANK([$'03.Muestra'.$C29]);"";[$'03.Muestra'.$C29]) ->  | C40: of:=IF( ISBLANK([$'03.Muestra'.$E29]);"";[$'03.Muestra'.$E29]) ->  | E40: of:=IF([.D40]<>"";IF(AND([.B40]<>"";[.C40]<>"");"";"ERR");"") -> 
B41: of:=IF( ISBLANK([$'03.Muestra'.$C30]);"";[$'03.Muestra'.$C30]) ->  | C41: of:=IF( ISBLANK([$'03.Muestra'.$E30]);"";[$'03.Muestra'.$E30]) ->  | E41: of:=IF([.D41]<>"";IF(AND([.B41]<>"";[.C41]<>"");"";"ERR");"") -> 
B42: of:=IF( ISBLANK([$'03.Muestra'.$C31]);"";[$'03.Muestra'.$C31]) ->  | C42: of:=IF( ISBLANK([$'03.Muestra'.$E31]);"";[$'03.Muestra'.$E31]) ->  | E42: of:=IF([.D42]<>"";IF(AND([.B42]<>"";[.C42]<>"");"";"ERR");"") -> 
B43: of:=IF( ISBLANK([$'03.Muestra'.$C32]);"";[$'03.Muestra'.$C32]) ->  | C43: of:=IF( ISBLANK([$'03.Muestra'.$E32]);"";[$'03.Muestra'.$E32]) ->  | E43: of:=IF([.D43]<>"";IF(AND([.B43]<>"";[.C43]<>"");"";"ERR");"") -> 
B44: of:=IF( ISBLANK([$'03.Muestra'.$C33]);"";[$'03.Muestra'.$C33]) ->  | C44: of:=IF( ISBLANK([$'03.Muestra'.$E33]);"";[$'03.Muestra'.$E33]) ->  | E44: of:=IF([.D44]<>"";IF(AND([.B44]<>"";[.C44]<>"");"";"ERR");"") -> 
B45: of:=IF( ISBLANK([$'03.Muestra'.$C34]);"";[$'03.Muestra'.$C34]) ->  | C45: of:=IF( ISBLANK([$'03.Muestra'.$E34]);"";[$'03.Muestra'.$E34]) ->  | E45: of:=IF([.D45]<>"";IF(AND([.B45]<>"";[.C45]<>"");"";"ERR");"") -> 
B46: of:=IF( ISBLANK([$'03.Muestra'.$C35]);"";[$'03.Muestra'.$C35]) ->  | C46: of:=IF( ISBLANK([$'03.Muestra'.$E35]);"";[$'03.Muestra'.$E35]) ->  | E46: of:=IF([.D46]<>"";IF(AND([.B46]<>"";[.C46]<>"");"";"ERR");"") -> 
B47: of:=IF( ISBLANK([$'03.Muestra'.$C36]);"";[$'03.Muestra'.$C36]) ->  | C47: of:=IF( ISBLANK([$'03.Muestra'.$E36]);"";[$'03.Muestra'.$E36]) ->  | E47: of:=IF([.D47]<>"";IF(AND([.B47]<>"";[.C47]<>"");"";"ERR");"") -> 
B48: of:=IF( ISBLANK([$'03.Muestra'.$C37]);"";[$'03.Muestra'.$C37]) ->  | C48: of:=IF( ISBLANK([$'03.Muestra'.$E37]);"";[$'03.Muestra'.$E37]) ->  | E48: of:=IF([.D48]<>"";IF(AND([.B48]<>"";[.C48]<>"");"";"ERR");"") -> 
B49: of:=IF( ISBLANK([$'03.Muestra'.$C38]);"";[$'03.Muestra'.$C38]) ->  | C49: of:=IF( ISBLANK([$'03.Muestra'.$E38]);"";[$'03.Muestra'.$E38]) ->  | E49: of:=IF([.D49]<>"";IF(AND([.B49]<>"";[.C49]<>"");"";"ERR");"") -> 
B50: of:=IF( ISBLANK([$'03.Muestra'.$C39]);"";[$'03.Muestra'.$C39]) ->  | C50: of:=IF( ISBLANK([$'03.Muestra'.$E39]);"";[$'03.Muestra'.$E39]) ->  | E50: of:=IF([.D50]<>"";IF(AND([.B50]<>"";[.C50]<>"");"";"ERR");"") -> 
B51: of:=IF( ISBLANK([$'03.Muestra'.$C40]);"";[$'03.Muestra'.$C40]) ->  | C51: of:=IF( ISBLANK([$'03.Muestra'.$E40]);"";[$'03.Muestra'.$E40]) ->  | E51: of:=IF([.D51]<>"";IF(AND([.B51]<>"";[.C51]<>"");"";"ERR");"") -> 
B52: of:=IF( ISBLANK([$'03.Muestra'.$C41]);"";[$'03.Muestra'.$C41]) ->  | C52: of:=IF( ISBLANK([$'03.Muestra'.$E41]);"";[$'03.Muestra'.$E41]) ->  | E52: of:=IF([.D52]<>"";IF(AND([.B52]<>"";[.C52]<>"");"";"ERR");"") -> 
B53: of:=IF( ISBLANK([$'03.Muestra'.$C42]);"";[$'03.Muestra'.$C42]) ->  | C53: of:=IF( ISBLANK([$'03.Muestra'.$E42]);"";[$'03.Muestra'.$E42]) ->  | E53: of:=IF([.D53]<>"";IF(AND([.B53]<>"";[.C53]<>"");"";"ERR");"") -> 
B56: AA | C56: 3.1.2 Idioma de las partes | D56: Resultado
B57: of:=IF( ISBLANK([$'03.Muestra'.$C8]);"";[$'03.Muestra'.$C8]) ->  | C57: of:=IF( ISBLANK([$'03.Muestra'.$E8]);"";[$'03.Muestra'.$E8]) ->  | E57: of:=IF([.D57]<>"";IF(AND([.B57]<>"";[.C57]<>"");"";"ERR");"") ->  | F57: N/T | G57: N/D | H57: N/A | I57: Falla | J57: Pasa | K57: En blanco
B58: of:=IF( ISBLANK([$'03.Muestra'.$C9]);"";[$'03.Muestra'.$C9]) ->  | C58: of:=IF( ISBLANK([$'03.Muestra'.$E9]);"";[$'03.Muestra'.$E9]) ->  | E58: of:=IF([.D58]<>"";IF(AND([.B58]<>"";[.C58]<>"");"";"ERR");"") ->  | F58: of:=COUNTIF([.$D57]:INDIRECT("$D" &  SUM(ROW()-1;[$'03.Muestra'.$D$45])-1);[.F57]) -> 0 | G58: of:=COUNTIF([.$D57]:INDIRECT("$D" &  SUM(ROW()-1;[$'03.Muestra'.$D$45])-1);[.G57]) -> 0 | H58: of:=COUNTIF([.$D57]:INDIRECT("$D" &  SUM(ROW()-1;[$'03.Muestra'.$D$45])-1);[.H57]) -> 0 | I58: of:=COUNTIF([.$D57]:INDIRECT("$D" &  SUM(ROW()-1;[$'03.Muestra'.$D$45])-1);[.I57]) -> 0 | J58: of:=COUNTIF([.$D57]:INDIRECT("$D" &  SUM(ROW()-1;[$'03.Muestra'.$D$45])-1);[.J57]) -> 0 | K58: of:=IF([$'03.Muestra'.$D$45]=0;0;COUNTBLANK([.$D57]:INDIRECT("$D" &  SUM(ROW()-1;[$'03.Muestra'.$D$45])-1))) -> 0
B59: of:=IF( ISBLANK([$'03.Muestra'.$C10]);"";[$'03.Muestra'.$C10]) ->  | C59: of:=IF( ISBLANK([$'03.Muestra'.$E10]);"";[$'03.Muestra'.$E10]) ->  | E59: of:=IF([.D59]<>"";IF(AND([.B59]<>"";[.C59]<>"");"";"ERR");"") -> 
B60: of:=IF( ISBLANK([$'03.Muestra'.$C11]);"";[$'03.Muestra'.$C11]) ->  | C60: of:=IF( ISBLANK([$'03.Muestra'.$E11]);"";[$'03.Muestra'.$E11]) ->  | E60: of:=IF([.D60]<>"";IF(AND([.B60]<>"";[.C60]<>"");"";"ERR");"") -> 
B61: of:=IF( ISBLANK([$'03.Muestra'.$C12]);"";[$'03.Muestra'.$C12]) ->  | C61: of:=IF( ISBLANK([$'03.Muestra'.$E12]);"";[$'03.Muestra'.$E12]) ->  | E61: of:=IF([.D61]<>"";IF(AND([.B61]<>"";[.C61]<>"");"";"ERR");"") -> 
B62: of:=IF( ISBLANK([$'03.Muestra'.$C13]);"";[$'03.Muestra'.$C13]) ->  | C62: of:=IF( ISBLANK([$'03.Muestra'.$E13]);"";[$'03.Muestra'.$E13]) ->  | E62: of:=IF([.D62]<>"";IF(AND([.B62]<>"";[.C62]<>"");"";"ERR");"") -> 
B63: of:=IF( ISBLANK([$'03.Muestra'.$C14]);"";[$'03.Muestra'.$C14]) ->  | C63: of:=IF( ISBLANK([$'03.Muestra'.$E14]);"";[$'03.Muestra'.$E14]) ->  | E63: of:=IF([.D63]<>"";IF(AND([.B63]<>"";[.C63]<>"");"";"ERR");"") -> 
B64: of:=IF( ISBLANK([$'03.Muestra'.$C15]);"";[$'03.Muestra'.$C15]) ->  | C64: of:=IF( ISBLANK([$'03.Muestra'.$E15]);"";[$'03.Muestra'.$E15]) ->  | E64: of:=IF([.D64]<>"";IF(AND([.B64]<>"";[.C64]<>"");"";"ERR");"") -> 
B65: of:=IF( ISBLANK([$'03.Muestra'.$C16]);"";[$'03.Muestra'.$C16]) ->  | C65: of:=IF( ISBLANK([$'03.Muestra'.$E16]);"";[$'03.Muestra'.$E16]) ->  | E65: of:=IF([.D65]<>"";IF(AND([.B65]<>"";[.C65]<>"");"";"ERR");"") -> 
B66: of:=IF( ISBLANK([$'03.Muestra'.$C17]);"";[$'03.Muestra'.$C17]) ->  | C66: of:=IF( ISBLANK([$'03.Muestra'.$E17]);"";[$'03.Muestra'.$E17]) ->  | E66: of:=IF([.D66]<>"";IF(AND([.B66]<>"";[.C66]<>"");"";"ERR");"") -> 
B67: of:=IF( ISBLANK([$'03.Muestra'.$C18]);"";[$'03.Muestra'.$C18]) ->  | C67: of:=IF( ISBLANK([$'03.Muestra'.$E18]);"";[$'03.Muestra'.$E18]) ->  | E67: of:=IF([.D67]<>"";IF(AND([.B67]<>"";[.C67]<>"");"";"ERR");"") -> 
B68: of:=IF( ISBLANK([$'03.Muestra'.$C19]);"";[$'03.Muestra'.$C19]) ->  | C68: of:=IF( ISBLANK([$'03.Muestra'.$E19]);"";[$'03.Muestra'.$E19]) ->  | E68: of:=IF([.D68]<>"";IF(AND([.B68]<>"";[.C68]<>"");"";"ERR");"") -> 
B69: of:=IF( ISBLANK([$'03.Muestra'.$C20]);"";[$'03.Muestra'.$C20]) ->  | C69: of:=IF( ISBLANK([$'03.Muestra'.$E20]);"";[$'03.Muestra'.$E20]) ->  | E69: of:=IF([.D69]<>"";IF(AND([.B69]<>"";[.C69]<>"");"";"ERR");"") -> 
B70: of:=IF( ISBLANK([$'03.Muestra'.$C21]);"";[$'03.Muestra'.$C21]) ->  | C70: of:=IF( ISBLANK([$'03.Muestra'.$E21]);"";[$'03.Muestra'.$E21]) ->  | E70: of:=IF([.D70]<>"";IF(AND([.B70]<>"";[.C70]<>"");"";"ERR");"") -> 
B71: of:=IF( ISBLANK([$'03.Muestra'.$C22]);"";[$'03.Muestra'.$C22]) ->  | C71: of:=IF( ISBLANK([$'03.Muestra'.$E22]);"";[$'03.Muestra'.$E22]) ->  | E71: of:=IF([.D71]<>"";IF(AND([.B71]<>"";[.C71]<>"");"";"ERR");"") -> 
B72: of:=IF( ISBLANK([$'03.Muestra'.$C23]);"";[$'03.Muestra'.$C23]) ->  | C72: of:=IF( ISBLANK([$'03.Muestra'.$E23]);"";[$'03.Muestra'.$E23]) ->  | E72: of:=IF([.D72]<>"";IF(AND([.B72]<>"";[.C72]<>"");"";"ERR");"") -> 
B73: of:=IF( ISBLANK([$'03.Muestra'.$C24]);"";[$'03.Muestra'.$C24]) ->  | C73: of:=IF( ISBLANK([$'03.Muestra'.$E24]);"";[$'03.Muestra'.$E24]) ->  | E73: of:=IF([.D73]<>"";IF(AND([.B73]<>"";[.C73]<>"");"";"ERR");"") -> 
B74: of:=IF( ISBLANK([$'03.Muestra'.$C25]);"";[$'03.Muestra'.$C25]) ->  | C74: of:=IF( ISBLANK([$'03.Muestra'.$E25]);"";[$'03.Muestra'.$E25]) ->  | E74: of:=IF([.D74]<>"";IF(AND([.B74]<>"";[.C74]<>"");"";"ERR");"") -> 
B75: of:=IF( ISBLANK([$'03.Muestra'.$C26]);"";[$'03.Muestra'.$C26]) ->  | C75: of:=IF( ISBLANK([$'03.Muestra'.$E26]);"";[$'03.Muestra'.$E26]) ->  | E75: of:=IF([.D75]<>"";IF(AND([.B75]<>"";[.C75]<>"");"";"ERR");"") -> 
B76: of:=IF( ISBLANK([$'03.Muestra'.$C27]);"";[$'03.Muestra'.$C27]) ->  | C76: of:=IF( ISBLANK([$'03.Muestra'.$E27]);"";[$'03.Muestra'.$E27]) ->  | E76: of:=IF([.D76]<>"";IF(AND([.B76]<>"";[.C76]<>"");"";"ERR");"") -> 
B77: of:=IF( ISBLANK([$'03.Muestra'.$C28]);"";[$'03.Muestra'.$C28]) ->  | C77: of:=IF( ISBLANK([$'03.Muestra'.$E28]);"";[$'03.Muestra'.$E28]) ->  | E77: of:=IF([.D77]<>"";IF(AND([.B77]<>"";[.C77]<>"");"";"ERR");"") -> 
B78: of:=IF( ISBLANK([$'03.Muestra'.$C29]);"";[$'03.Muestra'.$C29]) ->  | C78: of:=IF( ISBLANK([$'03.Muestra'.$E29]);"";[$'03.Muestra'.$E29]) ->  | E78: of:=IF([.D78]<>"";IF(AND([.B78]<>"";[.C78]<>"");"";"ERR");"") -> 
B79: of:=IF( ISBLANK([$'03.Muestra'.$C30]);"";[$'03.Muestra'.$C30]) ->  | C79: of:=IF( ISBLANK([$'03.Muestra'.$E30]);"";[$'03.Muestra'.$E30]) ->  | E79: of:=IF([.D79]<>"";IF(AND([.B79]<>"";[.C79]<>"");"";"ERR");"") -> 
B80: of:=IF( ISBLANK([$'03.Muestra'.$C31]);"";[$'03.Muestra'.$C31]) ->  | C80: of:=IF( ISBLANK([$'03.Muestra'.$E31]);"";[$'03.Muestra'.$E31]) ->  | E80: of:=IF([.D80]<>"";IF(AND([.B80]<>"";[.C80]<>"");"";"ERR");"") -> 
B81: of:=IF( ISBLANK([$'03.Muestra'.$C32]);"";[$'03.Muestra'.$C32]) ->  | C81: of:=IF( ISBLANK([$'03.Muestra'.$E32]);"";[$'03.Muestra'.$E32]) ->  | E81: of:=IF([.D81]<>"";IF(AND([.B81]<>"";[.C81]<>"");"";"ERR");"") -> 
B82: of:=IF( ISBLANK([$'03.Muestra'.$C33]);"";[$'03.Muestra'.$C33]) ->  | C82: of:=IF( ISBLANK([$'03.Muestra'.$E33]);"";[$'03.Muestra'.$E33]) ->  | E82: of:=IF([.D82]<>"";IF(AND([.B82]<>"";[.C82]<>"");"";"ERR");"") -> 
B83: of:=IF( ISBLANK([$'03.Muestra'.$C34]);"";[$'03.Muestra'.$C34]) ->  | C83: of:=IF( ISBLANK([$'03.Muestra'.$E34]);"";[$'03.Muestra'.$E34]) ->  | E83: of:=IF([.D83]<>"";IF(AND([.B83]<>"";[.C83]<>"");"";"ERR");"") -> 
B84: of:=IF( ISBLANK([$'03.Muestra'.$C35]);"";[$'03.Muestra'.$C35]) ->  | C84: of:=IF( ISBLANK([$'03.Muestra'.$E35]);"";[$'03.Muestra'.$E35]) ->  | E84: of:=IF([.D84]<>"";IF(AND([.B84]<>"";[.C84]<>"");"";"ERR");"") -> 
B85: of:=IF( ISBLANK([$'03.Muestra'.$C36]);"";[$'03.Muestra'.$C36]) ->  | C85: of:=IF( ISBLANK([$'03.Muestra'.$E36]);"";[$'03.Muestra'.$E36]) ->  | E85: of:=IF([.D85]<>"";IF(AND([.B85]<>"";[.C85]<>"");"";"ERR");"") -> 
B86: of:=IF( ISBLANK([$'03.Muestra'.$C37]);"";[$'03.Muestra'.$C37]) ->  | C86: of:=IF( ISBLANK([$'03.Muestra'.$E37]);"";[$'03.Muestra'.$E37]) ->  | E86: of:=IF([.D86]<>"";IF(AND([.B86]<>"";[.C86]<>"");"";"ERR");"") -> 
B87: of:=IF( ISBLANK([$'03.Muestra'.$C38]);"";[$'03.Muestra'.$C38]) ->  | C87: of:=IF( ISBLANK([$'03.Muestra'.$E38]);"";[$'03.Muestra'.$E38]) ->  | E87: of:=IF([.D87]<>"";IF(AND([.B87]<>"";[.C87]<>"");"";"ERR");"") -> 
B88: of:=IF( ISBLANK([$'03.Muestra'.$C39]);"";[$'03.Muestra'.$C39]) ->  | C88: of:=IF( ISBLANK([$'03.Muestra'.$E39]);"";[$'03.Muestra'.$E39]) ->  | E88: of:=IF([.D88]<>"";IF(AND([.B88]<>"";[.C88]<>"");"";"ERR");"") -> 
B89: of:=IF( ISBLANK([$'03.Muestra'.$C40]);"";[$'03.Muestra'.$C40]) ->  | C89: of:=IF( ISBLANK([$'03.Muestra'.$E40]);"";[$'03.Muestra'.$E40]) ->  | E89: of:=IF([.D89]<>"";IF(AND([.B89]<>"";[.C89]<>"");"";"ERR");"") -> 
B90: of:=IF( ISBLANK([$'03.Muestra'.$C41]);"";[$'03.Muestra'.$C41]) ->  | C90: of:=IF( ISBLANK([$'03.Muestra'.$E41]);"";[$'03.Muestra'.$E41]) ->  | E90: of:=IF([.D90]<>"";IF(AND([.B90]<>"";[.C90]<>"");"";"ERR");"") -> 
B91: of:=IF( ISBLANK([$'03.Muestra'.$C42]);"";[$'03.Muestra'.$C42]) ->  | C91: of:=IF( ISBLANK([$'03.Muestra'.$E42]);"";[$'03.Muestra'.$E42]) ->  | E91: of:=IF([.D91]<>"";IF(AND([.B91]<>"";[.C91]<>"");"";"ERR");"") -> 
B94: A | C94: 3.2.1 Al recibir el foco | D94: Resultado
B95: of:=IF( ISBLANK([$'03.Muestra'.$C8]);"";[$'03.Muestra'.$C8]) ->  | C95: of:=IF( ISBLANK([$'03.Muestra'.$E8]);"";[$'03.Muestra'.$E8]) ->  | E95: of:=IF([.D95]<>"";IF(AND([.B95]<>"";[.C95]<>"");"";"ERR");"") ->  | F95: N/T | G95: N/D | H95: N/A | I95: Falla | J95: Pasa | K95: En blanco
B96: of:=IF( ISBLANK([$'03.Muestra'.$C9]);"";[$'03.Muestra'.$C9]) ->  | C96: of:=IF( ISBLANK([$'03.Muestra'.$E9]);"";[$'03.Muestra'.$E9]) ->  | E96: of:=IF([.D96]<>"";IF(AND([.B96]<>"";[.C96]<>"");"";"ERR");"") ->  | F96: of:=COUNTIF([.$D95]:INDIRECT("$D" &  SUM(ROW()-1;[$'03.Muestra'.$D$45])-1);[.F95]) -> 0 | G96: of:=COUNTIF([.$D95]:INDIRECT("$D" &  SUM(ROW()-1;[$'03.Muestra'.$D$45])-1);[.G95]) -> 0 | H96: of:=COUNTIF([.$D95]:INDIRECT("$D" &  SUM(ROW()-1;[$'03.Muestra'.$D$45])-1);[.H95]) -> 0 | I96: of:=COUNTIF([.$D95]:INDIRECT("$D" &  SUM(ROW()-1;[$'03.Muestra'.$D$45])-1);[.I95]) -> 0 | J96: of:=COUNTIF([.$D95]:INDIRECT("$D" &  SUM(ROW()-1;[$'03.Muestra'.$D$45])-1);[.J95]) -> 0 | K96: of:=IF([$'03.Muestra'.$D$45]=0;0;COUNTBLANK([.$D95]:INDIRECT("$D" &  SUM(ROW()-1;[$'03.Muestra'.$D$45])-1))) -> 0
B97: of:=IF( ISBLANK([$'03.Muestra'.$C10]);"";[$'03.Muestra'.$C10]) ->  | C97: of:=IF( ISBLANK([$'03.Muestra'.$E10]);"";[$'03.Muestra'.$E10]) ->  | E97: of:=IF([.D97]<>"";IF(AND([.B97]<>"";[.C97]<>"");"";"ERR");"") -> 
B98: of:=IF( ISBLANK([$'03.Muestra'.$C11]);"";[$'03.Muestra'.$C11]) ->  | C98: of:=IF( ISBLANK([$'03.Muestra'.$E11]);"";[$'03.Muestra'.$E11]) ->  | E98: of:=IF([.D98]<>"";IF(AND([.B98]<>"";[.C98]<>"");"";"ERR");"") -> 
B99: of:=IF( ISBLANK([$'03.Muestra'.$C12]);"";[$'03.Muestra'.$C12]) ->  | C99: of:=IF( ISBLANK([$'03.Muestra'.$E12]);"";[$'03.Muestra'.$E12]) ->  | E99: of:=IF([.D99]<>"";IF(AND([.B99]<>"";[.C99]<>"");"";"ERR");"") -> 
B100: of:=IF( ISBLANK([$'03.Muestra'.$C13]);"";[$'03.Muestra'.$C13]) ->  | C100: of:=IF( ISBLANK([$'03.Muestra'.$E13]);"";[$'03.Muestra'.$E13]) ->  | E100: of:=IF([.D100]<>"";IF(AND([.B100]<>"";[.C100]<>"");"";"ERR");"") -> 
B101: of:=IF( ISBLANK([$'03.Muestra'.$C14]);"";[$'03.Muestra'.$C14]) ->  | C101: of:=IF( ISBLANK([$'03.Muestra'.$E14]);"";[$'03.Muestra'.$E14]) ->  | E101: of:=IF([.D101]<>"";IF(AND([.B101]<>"";[.C101]<>"");"";"ERR");"") -> 
B102: of:=IF( ISBLANK([$'03.Muestra'.$C15]);"";[$'03.Muestra'.$C15]) ->  | C102: of:=IF( ISBLANK([$'03.Muestra'.$E15]);"";[$'03.Muestra'.$E15]) ->  | E102: of:=IF([.D102]<>"";IF(AND([.B102]<>"";[.C102]<>"");"";"ERR");"") -> 
B103: of:=IF( ISBLANK([$'03.Muestra'.$C16]);"";[$'03.Muestra'.$C16]) ->  | C103: of:=IF( ISBLANK([$'03.Muestra'.$E16]);"";[$'03.Muestra'.$E16]) ->  | E103: of:=IF([.D103]<>"";IF(AND([.B103]<>"";[.C103]<>"");"";"ERR");"") -> 
B104: of:=IF( ISBLANK([$'03.Muestra'.$C17]);"";[$'03.Muestra'.$C17]) ->  | C104: of:=IF( ISBLANK([$'03.Muestra'.$E17]);"";[$'03.Muestra'.$E17]) ->  | E104: of:=IF([.D104]<>"";IF(AND([.B104]<>"";[.C104]<>"");"";"ERR");"") -> 
B105: of:=IF( ISBLANK([$'03.Muestra'.$C18]);"";[$'03.Muestra'.$C18]) ->  | C105: of:=IF( ISBLANK([$'03.Muestra'.$E18]);"";[$'03.Muestra'.$E18]) ->  | E105: of:=IF([.D105]<>"";IF(AND([.B105]<>"";[.C105]<>"");"";"ERR");"") -> 
B106: of:=IF( ISBLANK([$'03.Muestra'.$C19]);"";[$'03.Muestra'.$C19]) ->  | C106: of:=IF( ISBLANK([$'03.Muestra'.$E19]);"";[$'03.Muestra'.$E19]) ->  | E106: of:=IF([.D106]<>"";IF(AND([.B106]<>"";[.C106]<>"");"";"ERR");"") -> 
B107: of:=IF( ISBLANK([$'03.Muestra'.$C20]);"";[$'03.Muestra'.$C20]) ->  | C107: of:=IF( ISBLANK([$'03.Muestra'.$E20]);"";[$'03.Muestra'.$E20]) ->  | E107: of:=IF([.D107]<>"";IF(AND([.B107]<>"";[.C107]<>"");"";"ERR");"") -> 
B108: of:=IF( ISBLANK([$'03.Muestra'.$C21]);"";[$'03.Muestra'.$C21]) ->  | C108: of:=IF( ISBLANK([$'03.Muestra'.$E21]);"";[$'03.Muestra'.$E21]) ->  | E108: of:=IF([.D108]<>"";IF(AND([.B108]<>"";[.C108]<>"");"";"ERR");"") -> 
B109: of:=IF( ISBLANK([$'03.Muestra'.$C22]);"";[$'03.Muestra'.$C22]) ->  | C109: of:=IF( ISBLANK([$'03.Muestra'.$E22]);"";[$'03.Muestra'.$E22]) ->  | E109: of:=IF([.D109]<>"";IF(AND([.B109]<>"";[.C109]<>"");"";"ERR");"") -> 
B110: of:=IF( ISBLANK([$'03.Muestra'.$C23]);"";[$'03.Muestra'.$C23]) ->  | C110: of:=IF( ISBLANK([$'03.Muestra'.$E23]);"";[$'03.Muestra'.$E23]) ->  | E110: of:=IF([.D110]<>"";IF(AND([.B110]<>"";[.C110]<>"");"";"ERR");"") -> 
B111: of:=IF( ISBLANK([$'03.Muestra'.$C24]);"";[$'03.Muestra'.$C24]) ->  | C111: of:=IF( ISBLANK([$'03.Muestra'.$E24]);"";[$'03.Muestra'.$E24]) ->  | E111: of:=IF([.D111]<>"";IF(AND([.B111]<>"";[.C111]<>"");"";"ERR");"") -> 
B112: of:=IF( ISBLANK([$'03.Muestra'.$C25]);"";[$'03.Muestra'.$C25]) ->  | C112: of:=IF( ISBLANK([$'03.Muestra'.$E25]);"";[$'03.Muestra'.$E25]) ->  | E112: of:=IF([.D112]<>"";IF(AND([.B112]<>"";[.C112]<>"");"";"ERR");"") -> 
B113: of:=IF( ISBLANK([$'03.Muestra'.$C26]);"";[$'03.Muestra'.$C26]) ->  | C113: of:=IF( ISBLANK([$'03.Muestra'.$E26]);"";[$'03.Muestra'.$E26]) ->  | E113: of:=IF([.D113]<>"";IF(AND([.B113]<>"";[.C113]<>"");"";"ERR");"") -> 
B114: of:=IF( ISBLANK([$'03.Muestra'.$C27]);"";[$'03.Muestra'.$C27]) ->  | C114: of:=IF( ISBLANK([$'03.Muestra'.$E27]);"";[$'03.Muestra'.$E27]) ->  | E114: of:=IF([.D114]<>"";IF(AND([.B114]<>"";[.C114]<>"");"";"ERR");"") -> 
B115: of:=IF( ISBLANK([$'03.Muestra'.$C28]);"";[$'03.Muestra'.$C28]) ->  | C115: of:=IF( ISBLANK([$'03.Muestra'.$E28]);"";[$'03.Muestra'.$E28]) ->  | E115: of:=IF([.D115]<>"";IF(AND([.B115]<>"";[.C115]<>"");"";"ERR");"") -> 
B116: of:=IF( ISBLANK([$'03.Muestra'.$C29]);"";[$'03.Muestra'.$C29]) ->  | C116: of:=IF( ISBLANK([$'03.Muestra'.$E29]);"";[$'03.Muestra'.$E29]) ->  | E116: of:=IF([.D116]<>"";IF(AND([.B116]<>"";[.C116]<>"");"";"ERR");"") -> 
B117: of:=IF( ISBLANK([$'03.Muestra'.$C30]);"";[$'03.Muestra'.$C30]) ->  | C117: of:=IF( ISBLANK([$'03.Muestra'.$E30]);"";[$'03.Muestra'.$E30]) ->  | E117: of:=IF([.D117]<>"";IF(AND([.B117]<>"";[.C117]<>"");"";"ERR");"") -> 
B118: of:=IF( ISBLANK([$'03.Muestra'.$C31]);"";[$'03.Muestra'.$C31]) ->  | C118: of:=IF( ISBLANK([$'03.Muestra'.$E31]);"";[$'03.Muestra'.$E31]) ->  | E118: of:=IF([.D118]<>"";IF(AND([.B118]<>"";[.C118]<>"");"";"ERR");"") -> 
B119: of:=IF( ISBLANK([$'03.Muestra'.$C32]);"";[$'03.Muestra'.$C32]) ->  | C119: of:=IF( ISBLANK([$'03.Muestra'.$E32]);"";[$'03.Muestra'.$E32]) ->  | E119: of:=IF([.D119]<>"";IF(AND([.B119]<>"";[.C119]<>"");"";"ERR");"") -> 
B120: of:=IF( ISBLANK([$'03.Muestra'.$C33]);"";[$'03.Muestra'.$C33]) ->  | C120: of:=IF( ISBLANK([$'03.Muestra'.$E33]);"";[$'03.Muestra'.$E33]) ->  | E120: of:=IF([.D120]<>"";IF(AND([.B120]<>"";[.C120]<>"");"";"ERR");"") -> 
B121: of:=IF( ISBLANK([$'03.Muestra'.$C34]);"";[$'03.Muestra'.$C34]) ->  | C121: of:=IF( ISBLANK([$'03.Muestra'.$E34]);"";[$'03.Muestra'.$E34]) ->  | E121: of:=IF([.D121]<>"";IF(AND([.B121]<>"";[.C121]<>"");"";"ERR");"") -> 
B122: of:=IF( ISBLANK([$'03.Muestra'.$C35]);"";[$'03.Muestra'.$C35]) ->  | C122: of:=IF( ISBLANK([$'03.Muestra'.$E35]);"";[$'03.Muestra'.$E35]) ->  | E122: of:=IF([.D122]<>"";IF(AND([.B122]<>"";[.C122]<>"");"";"ERR");"") -> 
B123: of:=IF( ISBLANK([$'03.Muestra'.$C36]);"";[$'03.Muestra'.$C36]) ->  | C123: of:=IF( ISBLANK([$'03.Muestra'.$E36]);"";[$'03.Muestra'.$E36]) ->  | E123: of:=IF([.D123]<>"";IF(AND([.B123]<>"";[.C123]<>"");"";"ERR");"") -> 
B124: of:=IF( ISBLANK([$'03.Muestra'.$C37]);"";[$'03.Muestra'.$C37]) ->  | C124: of:=IF( ISBLANK([$'03.Muestra'.$E37]);"";[$'03.Muestra'.$E37]) ->  | E124: of:=IF([.D124]<>"";IF(AND([.B124]<>"";[.C124]<>"");"";"ERR");"") -> 
B125: of:=IF( ISBLANK([$'03.Muestra'.$C38]);"";[$'03.Muestra'.$C38]) ->  | C125: of:=IF( ISBLANK([$'03.Muestra'.$E38]);"";[$'03.Muestra'.$E38]) ->  | E125: of:=IF([.D125]<>"";IF(AND([.B125]<>"";[.C125]<>"");"";"ERR");"") -> 
B126: of:=IF( ISBLANK([$'03.Muestra'.$C39]);"";[$'03.Muestra'.$C39]) ->  | C126: of:=IF( ISBLANK([$'03.Muestra'.$E39]);"";[$'03.Muestra'.$E39]) ->  | E126: of:=IF([.D126]<>"";IF(AND([.B126]<>"";[.C126]<>"");"";"ERR");"") -> 
B127: of:=IF( ISBLANK([$'03.Muestra'.$C40]);"";[$'03.Muestra'.$C40]) ->  | C127: of:=IF( ISBLANK([$'03.Muestra'.$E40]);"";[$'03.Muestra'.$E40]) ->  | E127: of:=IF([.D127]<>"";IF(AND([.B127]<>"";[.C127]<>"");"";"ERR");"") -> 
B128: of:=IF( ISBLANK([$'03.Muestra'.$C41]);"";[$'03.Muestra'.$C41]) ->  | C128: of:=IF( ISBLANK([$'03.Muestra'.$E41]);"";[$'03.Muestra'.$E41]) ->  | E128: of:=IF([.D128]<>"";IF(AND([.B128]<>"";[.C128]<>"");"";"ERR");"") -> 
B129: of:=IF( ISBLANK([$'03.Muestra'.$C42]);"";[$'03.Muestra'.$C42]) ->  | C129: of:=IF( ISBLANK([$'03.Muestra'.$E42]);"";[$'03.Muestra'.$E42]) ->  | E129: of:=IF([.D129]<>"";IF(AND([.B129]<>"";[.C129]<>"");"";"ERR");"") -> 
B132: A | C132: 3.2.2 Al recibir entradas | D132: Resultado
B133: of:=IF( ISBLANK([$'03.Muestra'.$C8]);"";[$'03.Muestra'.$C8]) ->  | C133: of:=IF( ISBLANK([$'03.Muestra'.$E8]);"";[$'03.Muestra'.$E8]) ->  | E133: of:=IF([.D133]<>"";IF(AND([.B133]<>"";[.C133]<>"");"";"ERR");"") ->  | F133: N/T | G133: N/D | H133: N/A | I133: Falla | J133: Pasa | K133: En blanco
B134: of:=IF( ISBLANK([$'03.Muestra'.$C9]);"";[$'03.Muestra'.$C9]) ->  | C134: of:=IF( ISBLANK([$'03.Muestra'.$E9]);"";[$'03.Muestra'.$E9]) ->  | E134: of:=IF([.D134]<>"";IF(AND([.B134]<>"";[.C134]<>"");"";"ERR");"") ->  | F134: of:=COUNTIF([.$D133]:INDIRECT("$D" &  SUM(ROW()-1;[$'03.Muestra'.$D$45])-1);[.F133]) -> 0 | G134: of:=COUNTIF([.$D133]:INDIRECT("$D" &  SUM(ROW()-1;[$'03.Muestra'.$D$45])-1);[.G133]) -> 0 | H134: of:=COUNTIF([.$D133]:INDIRECT("$D" &  SUM(ROW()-1;[$'03.Muestra'.$D$45])-1);[.H133]) -> 0 | I134: of:=COUNTIF([.$D133]:INDIRECT("$D" &  SUM(ROW()-1;[$'03.Muestra'.$D$45])-1);[.I133]) -> 0 | J134: of:=COUNTIF([.$D133]:INDIRECT("$D" &  SUM(ROW()-1;[$'03.Muestra'.$D$45])-1);[.J133]) -> 0 | K134: of:=IF([$'03.Muestra'.$D$45]=0;0;COUNTBLANK([.$D133]:INDIRECT("$D" &  SUM(ROW()-1;[$'03.Muestra'.$D$45])-1))) -> 0
B135: of:=IF( ISBLANK([$'03.Muestra'.$C10]);"";[$'03.Muestra'.$C10]) ->  | C135: of:=IF( ISBLANK([$'03.Muestra'.$E10]);"";[$'03.Muestra'.$E10]) ->  | E135: of:=IF([.D135]<>"";IF(AND([.B135]<>"";[.C135]<>"");"";"ERR");"") -> 
B136: of:=IF( ISBLANK([$'03.Muestra'.$C11]);"";[$'03.Muestra'.$C11]) ->  | C136: of:=IF( ISBLANK([$'03.Muestra'.$E11]);"";[$'03.Muestra'.$E11]) ->  | E136: of:=IF([.D136]<>"";IF(AND([.B136]<>"";[.C136]<>"");"";"ERR");"") -> 
B137: of:=IF( ISBLANK([$'03.Muestra'.$C12]);"";[$'03.Muestra'.$C12]) ->  | C137: of:=IF( ISBLANK([$'03.Muestra'.$E12]);"";[$'03.Muestra'.$E12]) ->  | E137: of:=IF([.D137]<>"";IF(AND([.B137]<>"";[.C137]<>"");"";"ERR");"") -> 
B138: of:=IF( ISBLANK([$'03.Muestra'.$C13]);"";[$'03.Muestra'.$C13]) ->  | C138: of:=IF( ISBLANK([$'03.Muestra'.$E13]);"";[$'03.Muestra'.$E13]) ->  | E138: of:=IF([.D138]<>"";IF(AND([.B138]<>"";[.C138]<>"");"";"ERR");"") -> 
B139: of:=IF( ISBLANK([$'03.Muestra'.$C14]);"";[$'03.Muestra'.$C14]) ->  | C139: of:=IF( ISBLANK([$'03.Muestra'.$E14]);"";[$'03.Muestra'.$E14]) ->  | E139: of:=IF([.D139]<>"";IF(AND([.B139]<>"";[.C139]<>"");"";"ERR");"") -> 
B140: of:=IF( ISBLANK([$'03.Muestra'.$C15]);"";[$'03.Muestra'.$C15]) ->  | C140: of:=IF( ISBLANK([$'03.Muestra'.$E15]);"";[$'03.Muestra'.$E15]) ->  | E140: of:=IF([.D140]<>"";IF(AND([.B140]<>"";[.C140]<>"");"";"ERR");"") -> 
B141: of:=IF( ISBLANK([$'03.Muestra'.$C16]);"";[$'03.Muestra'.$C16]) ->  | C141: of:=IF( ISBLANK([$'03.Muestra'.$E16]);"";[$'03.Muestra'.$E16]) ->  | E141: of:=IF([.D141]<>"";IF(AND([.B141]<>"";[.C141]<>"");"";"ERR");"") -> 
B142: of:=IF( ISBLANK([$'03.Muestra'.$C17]);"";[$'03.Muestra'.$C17]) ->  | C142: of:=IF( ISBLANK([$'03.Muestra'.$E17]);"";[$'03.Muestra'.$E17]) ->  | E142: of:=IF([.D142]<>"";IF(AND([.B142]<>"";[.C142]<>"");"";"ERR");"") -> 
B143: of:=IF( ISBLANK([$'03.Muestra'.$C18]);"";[$'03.Muestra'.$C18]) ->  | C143: of:=IF( ISBLANK([$'03.Muestra'.$E18]);"";[$'03.Muestra'.$E18]) ->  | E143: of:=IF([.D143]<>"";IF(AND([.B143]<>"";[.C143]<>"");"";"ERR");"") -> 
B144: of:=IF( ISBLANK([$'03.Muestra'.$C19]);"";[$'03.Muestra'.$C19]) ->  | C144: of:=IF( ISBLANK([$'03.Muestra'.$E19]);"";[$'03.Muestra'.$E19]) ->  | E144: of:=IF([.D144]<>"";IF(AND([.B144]<>"";[.C144]<>"");"";"ERR");"") -> 
B145: of:=IF( ISBLANK([$'03.Muestra'.$C20]);"";[$'03.Muestra'.$C20]) ->  | C145: of:=IF( ISBLANK([$'03.Muestra'.$E20]);"";[$'03.Muestra'.$E20]) ->  | E145: of:=IF([.D145]<>"";IF(AND([.B145]<>"";[.C145]<>"");"";"ERR");"") -> 
B146: of:=IF( ISBLANK([$'03.Muestra'.$C21]);"";[$'03.Muestra'.$C21]) ->  | C146: of:=IF( ISBLANK([$'03.Muestra'.$E21]);"";[$'03.Muestra'.$E21]) ->  | E146: of:=IF([.D146]<>"";IF(AND([.B146]<>"";[.C146]<>"");"";"ERR");"") -> 
B147: of:=IF( ISBLANK([$'03.Muestra'.$C22]);"";[$'03.Muestra'.$C22]) ->  | C147: of:=IF( ISBLANK([$'03.Muestra'.$E22]);"";[$'03.Muestra'.$E22]) ->  | E147: of:=IF([.D147]<>"";IF(AND([.B147]<>"";[.C147]<>"");"";"ERR");"") -> 
B148: of:=IF( ISBLANK([$'03.Muestra'.$C23]);"";[$'03.Muestra'.$C23]) ->  | C148: of:=IF( ISBLANK([$'03.Muestra'.$E23]);"";[$'03.Muestra'.$E23]) ->  | E148: of:=IF([.D148]<>"";IF(AND([.B148]<>"";[.C148]<>"");"";"ERR");"") -> 
B149: of:=IF( ISBLANK([$'03.Muestra'.$C24]);"";[$'03.Muestra'.$C24]) ->  | C149: of:=IF( ISBLANK([$'03.Muestra'.$E24]);"";[$'03.Muestra'.$E24]) ->  | E149: of:=IF([.D149]<>"";IF(AND([.B149]<>"";[.C149]<>"");"";"ERR");"") -> 
B150: of:=IF( ISBLANK([$'03.Muestra'.$C25]);"";[$'03.Muestra'.$C25]) ->  | C150: of:=IF( ISBLANK([$'03.Muestra'.$E25]);"";[$'03.Muestra'.$E25]) ->  | E150: of:=IF([.D150]<>"";IF(AND([.B150]<>"";[.C150]<>"");"";"ERR");"") -> 
B151: of:=IF( ISBLANK([$'03.Muestra'.$C26]);"";[$'03.Muestra'.$C26]) ->  | C151: of:=IF( ISBLANK([$'03.Muestra'.$E26]);"";[$'03.Muestra'.$E26]) ->  | E151: of:=IF([.D151]<>"";IF(AND([.B151]<>"";[.C151]<>"");"";"ERR");"") -> 
B152: of:=IF( ISBLANK([$'03.Muestra'.$C27]);"";[$'03.Muestra'.$C27]) ->  | C152: of:=IF( ISBLANK([$'03.Muestra'.$E27]);"";[$'03.Muestra'.$E27]) ->  | E152: of:=IF([.D152]<>"";IF(AND([.B152]<>"";[.C152]<>"");"";"ERR");"") -> 
B153: of:=IF( ISBLANK([$'03.Muestra'.$C28]);"";[$'03.Muestra'.$C28]) ->  | C153: of:=IF( ISBLANK([$'03.Muestra'.$E28]);"";[$'03.Muestra'.$E28]) ->  | E153: of:=IF([.D153]<>"";IF(AND([.B153]<>"";[.C153]<>"");"";"ERR");"") -> 
B154: of:=IF( ISBLANK([$'03.Muestra'.$C29]);"";[$'03.Muestra'.$C29]) ->  | C154: of:=IF( ISBLANK([$'03.Muestra'.$E29]);"";[$'03.Muestra'.$E29]) ->  | E154: of:=IF([.D154]<>"";IF(AND([.B154]<>"";[.C154]<>"");"";"ERR");"") -> 
B155: of:=IF( ISBLANK([$'03.Muestra'.$C30]);"";[$'03.Muestra'.$C30]) ->  | C155: of:=IF( ISBLANK([$'03.Muestra'.$E30]);"";[$'03.Muestra'.$E30]) ->  | E155: of:=IF([.D155]<>"";IF(AND([.B155]<>"";[.C155]<>"");"";"ERR");"") -> 
B156: of:=IF( ISBLANK([$'03.Muestra'.$C31]);"";[$'03.Muestra'.$C31]) ->  | C156: of:=IF( ISBLANK([$'03.Muestra'.$E31]);"";[$'03.Muestra'.$E31]) ->  | E156: of:=IF([.D156]<>"";IF(AND([.B156]<>"";[.C156]<>"");"";"ERR");"") -> 
B157: of:=IF( ISBLANK([$'03.Muestra'.$C32]);"";[$'03.Muestra'.$C32]) ->  | C157: of:=IF( ISBLANK([$'03.Muestra'.$E32]);"";[$'03.Muestra'.$E32]) ->  | E157: of:=IF([.D157]<>"";IF(AND([.B157]<>"";[.C157]<>"");"";"ERR");"") -> 
B158: of:=IF( ISBLANK([$'03.Muestra'.$C33]);"";[$'03.Muestra'.$C33]) ->  | C158: of:=IF( ISBLANK([$'03.Muestra'.$E33]);"";[$'03.Muestra'.$E33]) ->  | E158: of:=IF([.D158]<>"";IF(AND([.B158]<>"";[.C158]<>"");"";"ERR");"") -> 
B159: of:=IF( ISBLANK([$'03.Muestra'.$C34]);"";[$'03.Muestra'.$C34]) ->  | C159: of:=IF( ISBLANK([$'03.Muestra'.$E34]);"";[$'03.Muestra'.$E34]) ->  | E159: of:=IF([.D159]<>"";IF(AND([.B159]<>"";[.C159]<>"");"";"ERR");"") -> 
B160: of:=IF( ISBLANK([$'03.Muestra'.$C35]);"";[$'03.Muestra'.$C35]) ->  | C160: of:=IF( ISBLANK([$'03.Muestra'.$E35]);"";[$'03.Muestra'.$E35]) ->  | E160: of:=IF([.D160]<>"";IF(AND([.B160]<>"";[.C160]<>"");"";"ERR");"") -> 
B161: of:=IF( ISBLANK([$'03.Muestra'.$C36]);"";[$'03.Muestra'.$C36]) ->  | C161: of:=IF( ISBLANK([$'03.Muestra'.$E36]);"";[$'03.Muestra'.$E36]) ->  | E161: of:=IF([.D161]<>"";IF(AND([.B161]<>"";[.C161]<>"");"";"ERR");"") -> 
B162: of:=IF( ISBLANK([$'03.Muestra'.$C37]);"";[$'03.Muestra'.$C37]) ->  | C162: of:=IF( ISBLANK([$'03.Muestra'.$E37]);"";[$'03.Muestra'.$E37]) ->  | E162: of:=IF([.D162]<>"";IF(AND([.B162]<>"";[.C162]<>"");"";"ERR");"") -> 
B163: of:=IF( ISBLANK([$'03.Muestra'.$C38]);"";[$'03.Muestra'.$C38]) ->  | C163: of:=IF( ISBLANK([$'03.Muestra'.$E38]);"";[$'03.Muestra'.$E38]) ->  | E163: of:=IF([.D163]<>"";IF(AND([.B163]<>"";[.C163]<>"");"";"ERR");"") -> 
B164: of:=IF( ISBLANK([$'03.Muestra'.$C39]);"";[$'03.Muestra'.$C39]) ->  | C164: of:=IF( ISBLANK([$'03.Muestra'.$E39]);"";[$'03.Muestra'.$E39]) ->  | E164: of:=IF([.D164]<>"";IF(AND([.B164]<>"";[.C164]<>"");"";"ERR");"") -> 
B165: of:=IF( ISBLANK([$'03.Muestra'.$C40]);"";[$'03.Muestra'.$C40]) ->  | C165: of:=IF( ISBLANK([$'03.Muestra'.$E40]);"";[$'03.Muestra'.$E40]) ->  | E165: of:=IF([.D165]<>"";IF(AND([.B165]<>"";[.C165]<>"");"";"ERR");"") -> 
B166: of:=IF( ISBLANK([$'03.Muestra'.$C41]);"";[$'03.Muestra'.$C41]) ->  | C166: of:=IF( ISBLANK([$'03.Muestra'.$E41]);"";[$'03.Muestra'.$E41]) ->  | E166: of:=IF([.D166]<>"";IF(AND([.B166]<>"";[.C166]<>"");"";"ERR");"") -> 
B167: of:=IF( ISBLANK([$'03.Muestra'.$C42]);"";[$'03.Muestra'.$C42]) ->  | C167: of:=IF( ISBLANK([$'03.Muestra'.$E42]);"";[$'03.Muestra'.$E42]) ->  | E167: of:=IF([.D167]<>"";IF(AND([.B167]<>"";[.C167]<>"");"";"ERR");"") -> 
B170: AA | C170: 3.2.3 Navegación coherente | D170: Resultado
B171: of:=IF( ISBLANK([$'03.Muestra'.$C8]);"";[$'03.Muestra'.$C8]) ->  | C171: of:=IF( ISBLANK([$'03.Muestra'.$E8]);"";[$'03.Muestra'.$E8]) ->  | E171: of:=IF([.D171]<>"";IF(AND([.B171]<>"";[.C171]<>"");"";"ERR");"") ->  | F171: N/T | G171: N/D | H171: N/A | I171: Falla | J171: Pasa | K171: En blanco
B172: of:=IF( ISBLANK([$'03.Muestra'.$C9]);"";[$'03.Muestra'.$C9]) ->  | C172: of:=IF( ISBLANK([$'03.Muestra'.$E9]);"";[$'03.Muestra'.$E9]) ->  | E172: of:=IF([.D172]<>"";IF(AND([.B172]<>"";[.C172]<>"");"";"ERR");"") ->  | F172: of:=COUNTIF([.$D171]:INDIRECT("$D" &  SUM(ROW()-1;[$'03.Muestra'.$D$45])-1);[.F171]) -> 0 | G172: of:=COUNTIF([.$D171]:INDIRECT("$D" &  SUM(ROW()-1;[$'03.Muestra'.$D$45])-1);[.G171]) -> 0 | H172: of:=COUNTIF([.$D171]:INDIRECT("$D" &  SUM(ROW()-1;[$'03.Muestra'.$D$45])-1);[.H171]) -> 0 | I172: of:=COUNTIF([.$D171]:INDIRECT("$D" &  SUM(ROW()-1;[$'03.Muestra'.$D$45])-1);[.I171]) -> 0 | J172: of:=COUNTIF([.$D171]:INDIRECT("$D" &  SUM(ROW()-1;[$'03.Muestra'.$D$45])-1);[.J171]) -> 0 | K172: of:=IF([$'03.Muestra'.$D$45]=0;0;COUNTBLANK([.$D171]:INDIRECT("$D" &  SUM(ROW()-1;[$'03.Muestra'.$D$45])-1))) -> 0
B173: of:=IF( ISBLANK([$'03.Muestra'.$C10]);"";[$'03.Muestra'.$C10]) ->  | C173: of:=IF( ISBLANK([$'03.Muestra'.$E10]);"";[$'03.Muestra'.$E10]) ->  | E173: of:=IF([.D173]<>"";IF(AND([.B173]<>"";[.C173]<>"");"";"ERR");"") -> 
B174: of:=IF( ISBLANK([$'03.Muestra'.$C11]);"";[$'03.Muestra'.$C11]) ->  | C174: of:=IF( ISBLANK([$'03.Muestra'.$E11]);"";[$'03.Muestra'.$E11]) ->  | E174: of:=IF([.D174]<>"";IF(AND([.B174]<>"";[.C174]<>"");"";"ERR");"") -> 
B175: of:=IF( ISBLANK([$'03.Muestra'.$C12]);"";[$'03.Muestra'.$C12]) ->  | C175: of:=IF( ISBLANK([$'03.Muestra'.$E12]);"";[$'03.Muestra'.$E12]) ->  | E175: of:=IF([.D175]<>"";IF(AND([.B175]<>"";[.C175]<>"");"";"ERR");"") -> 
B176: of:=IF( ISBLANK([$'03.Muestra'.$C13]);"";[$'03.Muestra'.$C13]) ->  | C176: of:=IF( ISBLANK([$'03.Muestra'.$E13]);"";[$'03.Muestra'.$E13]) ->  | E176: of:=IF([.D176]<>"";IF(AND([.B176]<>"";[.C176]<>"");"";"ERR");"") -> 
B177: of:=IF( ISBLANK([$'03.Muestra'.$C14]);"";[$'03.Muestra'.$C14]) ->  | C177: of:=IF( ISBLANK([$'03.Muestra'.$E14]);"";[$'03.Muestra'.$E14]) ->  | E177: of:=IF([.D177]<>"";IF(AND([.B177]<>"";[.C177]<>"");"";"ERR");"") -> 
B178: of:=IF( ISBLANK([$'03.Muestra'.$C15]);"";[$'03.Muestra'.$C15]) ->  | C178: of:=IF( ISBLANK([$'03.Muestra'.$E15]);"";[$'03.Muestra'.$E15]) ->  | E178: of:=IF([.D178]<>"";IF(AND([.B178]<>"";[.C178]<>"");"";"ERR");"") -> 
B179: of:=IF( ISBLANK([$'03.Muestra'.$C16]);"";[$'03.Muestra'.$C16]) ->  | C179: of:=IF( ISBLANK([$'03.Muestra'.$E16]);"";[$'03.Muestra'.$E16]) ->  | E179: of:=IF([.D179]<>"";IF(AND([.B179]<>"";[.C179]<>"");"";"ERR");"") -> 
B180: of:=IF( ISBLANK([$'03.Muestra'.$C17]);"";[$'03.Muestra'.$C17]) ->  | C180: of:=IF( ISBLANK([$'03.Muestra'.$E17]);"";[$'03.Muestra'.$E17]) ->  | E180: of:=IF([.D180]<>"";IF(AND([.B180]<>"";[.C180]<>"");"";"ERR");"") -> 
B181: of:=IF( ISBLANK([$'03.Muestra'.$C18]);"";[$'03.Muestra'.$C18]) ->  | C181: of:=IF( ISBLANK([$'03.Muestra'.$E18]);"";[$'03.Muestra'.$E18]) ->  | E181: of:=IF([.D181]<>"";IF(AND([.B181]<>"";[.C181]<>"");"";"ERR");"") -> 
B182: of:=IF( ISBLANK([$'03.Muestra'.$C19]);"";[$'03.Muestra'.$C19]) ->  | C182: of:=IF( ISBLANK([$'03.Muestra'.$E19]);"";[$'03.Muestra'.$E19]) ->  | E182: of:=IF([.D182]<>"";IF(AND([.B182]<>"";[.C182]<>"");"";"ERR");"") -> 
B183: of:=IF( ISBLANK([$'03.Muestra'.$C20]);"";[$'03.Muestra'.$C20]) ->  | C183: of:=IF( ISBLANK([$'03.Muestra'.$E20]);"";[$'03.Muestra'.$E20]) ->  | E183: of:=IF([.D183]<>"";IF(AND([.B183]<>"";[.C183]<>"");"";"ERR");"") -> 
B184: of:=IF( ISBLANK([$'03.Muestra'.$C21]);"";[$'03.Muestra'.$C21]) ->  | C184: of:=IF( ISBLANK([$'03.Muestra'.$E21]);"";[$'03.Muestra'.$E21]) ->  | E184: of:=IF([.D184]<>"";IF(AND([.B184]<>"";[.C184]<>"");"";"ERR");"") -> 
B185: of:=IF( ISBLANK([$'03.Muestra'.$C22]);"";[$'03.Muestra'.$C22]) ->  | C185: of:=IF( ISBLANK([$'03.Muestra'.$E22]);"";[$'03.Muestra'.$E22]) ->  | E185: of:=IF([.D185]<>"";IF(AND([.B185]<>"";[.C185]<>"");"";"ERR");"") -> 
B186: of:=IF( ISBLANK([$'03.Muestra'.$C23]);"";[$'03.Muestra'.$C23]) ->  | C186: of:=IF( ISBLANK([$'03.Muestra'.$E23]);"";[$'03.Muestra'.$E23]) ->  | E186: of:=IF([.D186]<>"";IF(AND([.B186]<>"";[.C186]<>"");"";"ERR");"") -> 
B187: of:=IF( ISBLANK([$'03.Muestra'.$C24]);"";[$'03.Muestra'.$C24]) ->  | C187: of:=IF( ISBLANK([$'03.Muestra'.$E24]);"";[$'03.Muestra'.$E24]) ->  | E187: of:=IF([.D187]<>"";IF(AND([.B187]<>"";[.C187]<>"");"";"ERR");"") -> 
B188: of:=IF( ISBLANK([$'03.Muestra'.$C25]);"";[$'03.Muestra'.$C25]) ->  | C188: of:=IF( ISBLANK([$'03.Muestra'.$E25]);"";[$'03.Muestra'.$E25]) ->  | E188: of:=IF([.D188]<>"";IF(AND([.B188]<>"";[.C188]<>"");"";"ERR");"") -> 
B189: of:=IF( ISBLANK([$'03.Muestra'.$C26]);"";[$'03.Muestra'.$C26]) ->  | C189: of:=IF( ISBLANK([$'03.Muestra'.$E26]);"";[$'03.Muestra'.$E26]) ->  | E189: of:=IF([.D189]<>"";IF(AND([.B189]<>"";[.C189]<>"");"";"ERR");"") -> 
B190: of:=IF( ISBLANK([$'03.Muestra'.$C27]);"";[$'03.Muestra'.$C27]) ->  | C190: of:=IF( ISBLANK([$'03.Muestra'.$E27]);"";[$'03.Muestra'.$E27]) ->  | E190: of:=IF([.D190]<>"";IF(AND([.B190]<>"";[.C190]<>"");"";"ERR");"") -> 
B191: of:=IF( ISBLANK([$'03.Muestra'.$C28]);"";[$'03.Muestra'.$C28]) ->  | C191: of:=IF( ISBLANK([$'03.Muestra'.$E28]);"";[$'03.Muestra'.$E28]) ->  | E191: of:=IF([.D191]<>"";IF(AND([.B191]<>"";[.C191]<>"");"";"ERR");"") -> 
B192: of:=IF( ISBLANK([$'03.Muestra'.$C29]);"";[$'03.Muestra'.$C29]) ->  | C192: of:=IF( ISBLANK([$'03.Muestra'.$E29]);"";[$'03.Muestra'.$E29]) ->  | E192: of:=IF([.D192]<>"";IF(AND([.B192]<>"";[.C192]<>"");"";"ERR");"") -> 
B193: of:=IF( ISBLANK([$'03.Muestra'.$C30]);"";[$'03.Muestra'.$C30]) ->  | C193: of:=IF( ISBLANK([$'03.Muestra'.$E30]);"";[$'03.Muestra'.$E30]) ->  | E193: of:=IF([.D193]<>"";IF(AND([.B193]<>"";[.C193]<>"");"";"ERR");"") -> 
B194: of:=IF( ISBLANK([$'03.Muestra'.$C31]);"";[$'03.Muestra'.$C31]) ->  | C194: of:=IF( ISBLANK([$'03.Muestra'.$E31]);"";[$'03.Muestra'.$E31]) ->  | E194: of:=IF([.D194]<>"";IF(AND([.B194]<>"";[.C194]<>"");"";"ERR");"") -> 
B195: of:=IF( ISBLANK([$'03.Muestra'.$C32]);"";[$'03.Muestra'.$C32]) ->  | C195: of:=IF( ISBLANK([$'03.Muestra'.$E32]);"";[$'03.Muestra'.$E32]) ->  | E195: of:=IF([.D195]<>"";IF(AND([.B195]<>"";[.C195]<>"");"";"ERR");"") -> 
B196: of:=IF( ISBLANK([$'03.Muestra'.$C33]);"";[$'03.Muestra'.$C33]) ->  | C196: of:=IF( ISBLANK([$'03.Muestra'.$E33]);"";[$'03.Muestra'.$E33]) ->  | E196: of:=IF([.D196]<>"";IF(AND([.B196]<>"";[.C196]<>"");"";"ERR");"") -> 
B197: of:=IF( ISBLANK([$'03.Muestra'.$C34]);"";[$'03.Muestra'.$C34]) ->  | C197: of:=IF( ISBLANK([$'03.Muestra'.$E34]);"";[$'03.Muestra'.$E34]) ->  | E197: of:=IF([.D197]<>"";IF(AND([.B197]<>"";[.C197]<>"");"";"ERR");"") -> 
B198: of:=IF( ISBLANK([$'03.Muestra'.$C35]);"";[$'03.Muestra'.$C35]) ->  | C198: of:=IF( ISBLANK([$'03.Muestra'.$E35]);"";[$'03.Muestra'.$E35]) ->  | E198: of:=IF([.D198]<>"";IF(AND([.B198]<>"";[.C198]<>"");"";"ERR");"") -> 
B199: of:=IF( ISBLANK([$'03.Muestra'.$C36]);"";[$'03.Muestra'.$C36]) ->  | C199: of:=IF( ISBLANK([$'03.Muestra'.$E36]);"";[$'03.Muestra'.$E36]) ->  | E199: of:=IF([.D199]<>"";IF(AND([.B199]<>"";[.C199]<>"");"";"ERR");"") -> 
B200: of:=IF( ISBLANK([$'03.Muestra'.$C37]);"";[$'03.Muestra'.$C37]) ->  | C200: of:=IF( ISBLANK([$'03.Muestra'.$E37]);"";[$'03.Muestra'.$E37]) ->  | E200: of:=IF([.D200]<>"";IF(AND([.B200]<>"";[.C200]<>"");"";"ERR");"") -> 
B201: of:=IF( ISBLANK([$'03.Muestra'.$C38]);"";[$'03.Muestra'.$C38]) ->  | C201: of:=IF( ISBLANK([$'03.Muestra'.$E38]);"";[$'03.Muestra'.$E38]) ->  | E201: of:=IF([.D201]<>"";IF(AND([.B201]<>"";[.C201]<>"");"";"ERR");"") -> 
B202: of:=IF( ISBLANK([$'03.Muestra'.$C39]);"";[$'03.Muestra'.$C39]) ->  | C202: of:=IF( ISBLANK([$'03.Muestra'.$E39]);"";[$'03.Muestra'.$E39]) ->  | E202: of:=IF([.D202]<>"";IF(AND([.B202]<>"";[.C202]<>"");"";"ERR");"") -> 
B203: of:=IF( ISBLANK([$'03.Muestra'.$C40]);"";[$'03.Muestra'.$C40]) ->  | C203: of:=IF( ISBLANK([$'03.Muestra'.$E40]);"";[$'03.Muestra'.$E40]) ->  | E203: of:=IF([.D203]<>"";IF(AND([.B203]<>"";[.C203]<>"");"";"ERR");"") -> 
B204: of:=IF( ISBLANK([$'03.Muestra'.$C41]);"";[$'03.Muestra'.$C41]) ->  | C204: of:=IF( ISBLANK([$'03.Muestra'.$E41]);"";[$'03.Muestra'.$E41]) ->  | E204: of:=IF([.D204]<>"";IF(AND([.B204]<>"";[.C204]<>"");"";"ERR");"") -> 
B205: of:=IF( ISBLANK([$'03.Muestra'.$C42]);"";[$'03.Muestra'.$C42]) ->  | C205: of:=IF( ISBLANK([$'03.Muestra'.$E42]);"";[$'03.Muestra'.$E42]) ->  | E205: of:=IF([.D205]<>"";IF(AND([.B205]<>"";[.C205]<>"");"";"ERR");"") -> 
B208: AA | C208: 3.2.4 Identificación coherente | D208: Resultado
B209: of:=IF( ISBLANK([$'03.Muestra'.$C8]);"";[$'03.Muestra'.$C8]) ->  | C209: of:=IF( ISBLANK([$'03.Muestra'.$E8]);"";[$'03.Muestra'.$E8]) ->  | E209: of:=IF([.D209]<>"";IF(AND([.B209]<>"";[.C209]<>"");"";"ERR");"") ->  | F209: N/T | G209: N/D | H209: N/A | I209: Falla | J209: Pasa | K209: En blanco
B210: of:=IF( ISBLANK([$'03.Muestra'.$C9]);"";[$'03.Muestra'.$C9]) ->  | C210: of:=IF( ISBLANK([$'03.Muestra'.$E9]);"";[$'03.Muestra'.$E9]) ->  | E210: of:=IF([.D210]<>"";IF(AND([.B210]<>"";[.C210]<>"");"";"ERR");"") ->  | F210: of:=COUNTIF([.$D209]:INDIRECT("$D" &  SUM(ROW()-1;[$'03.Muestra'.$D$45])-1);[.F209]) -> 0 | G210: of:=COUNTIF([.$D209]:INDIRECT("$D" &  SUM(ROW()-1;[$'03.Muestra'.$D$45])-1);[.G209]) -> 0 | H210: of:=COUNTIF([.$D209]:INDIRECT("$D" &  SUM(ROW()-1;[$'03.Muestra'.$D$45])-1);[.H209]) -> 0 | I210: of:=COUNTIF([.$D209]:INDIRECT("$D" &  SUM(ROW()-1;[$'03.Muestra'.$D$45])-1);[.I209]) -> 0 | J210: of:=COUNTIF([.$D209]:INDIRECT("$D" &  SUM(ROW()-1;[$'03.Muestra'.$D$45])-1);[.J209]) -> 0 | K210: of:=IF([$'03.Muestra'.$D$45]=0;0;COUNTBLANK([.$D209]:INDIRECT("$D" &  SUM(ROW()-1;[$'03.Muestra'.$D$45])-1))) -> 0
B211: of:=IF( ISBLANK([$'03.Muestra'.$C10]);"";[$'03.Muestra'.$C10]) ->  | C211: of:=IF( ISBLANK([$'03.Muestra'.$E10]);"";[$'03.Muestra'.$E10]) ->  | E211: of:=IF([.D211]<>"";IF(AND([.B211]<>"";[.C211]<>"");"";"ERR");"") -> 
B212: of:=IF( ISBLANK([$'03.Muestra'.$C11]);"";[$'03.Muestra'.$C11]) ->  | C212: of:=IF( ISBLANK([$'03.Muestra'.$E11]);"";[$'03.Muestra'.$E11]) ->  | E212: of:=IF([.D212]<>"";IF(AND([.B212]<>"";[.C212]<>"");"";"ERR");"") -> 
B213: of:=IF( ISBLANK([$'03.Muestra'.$C12]);"";[$'03.Muestra'.$C12]) ->  | C213: of:=IF( ISBLANK([$'03.Muestra'.$E12]);"";[$'03.Muestra'.$E12]) ->  | E213: of:=IF([.D213]<>"";IF(AND([.B213]<>"";[.C213]<>"");"";"ERR");"") -> 
B214: of:=IF( ISBLANK([$'03.Muestra'.$C13]);"";[$'03.Muestra'.$C13]) ->  | C214: of:=IF( ISBLANK([$'03.Muestra'.$E13]);"";[$'03.Muestra'.$E13]) ->  | E214: of:=IF([.D214]<>"";IF(AND([.B214]<>"";[.C214]<>"");"";"ERR");"") -> 
B215: of:=IF( ISBLANK([$'03.Muestra'.$C14]);"";[$'03.Muestra'.$C14]) ->  | C215: of:=IF( ISBLANK([$'03.Muestra'.$E14]);"";[$'03.Muestra'.$E14]) ->  | E215: of:=IF([.D215]<>"";IF(AND([.B215]<>"";[.C215]<>"");"";"ERR");"") -> 
B216: of:=IF( ISBLANK([$'03.Muestra'.$C15]);"";[$'03.Muestra'.$C15]) ->  | C216: of:=IF( ISBLANK([$'03.Muestra'.$E15]);"";[$'03.Muestra'.$E15]) ->  | E216: of:=IF([.D216]<>"";IF(AND([.B216]<>"";[.C216]<>"");"";"ERR");"") -> 
B217: of:=IF( ISBLANK([$'03.Muestra'.$C16]);"";[$'03.Muestra'.$C16]) ->  | C217: of:=IF( ISBLANK([$'03.Muestra'.$E16]);"";[$'03.Muestra'.$E16]) ->  | E217: of:=IF([.D217]<>"";IF(AND([.B217]<>"";[.C217]<>"");"";"ERR");"") -> 
B218: of:=IF( ISBLANK([$'03.Muestra'.$C17]);"";[$'03.Muestra'.$C17]) ->  | C218: of:=IF( ISBLANK([$'03.Muestra'.$E17]);"";[$'03.Muestra'.$E17]) ->  | E218: of:=IF([.D218]<>"";IF(AND([.B218]<>"";[.C218]<>"");"";"ERR");"") -> 
B219: of:=IF( ISBLANK([$'03.Muestra'.$C18]);"";[$'03.Muestra'.$C18]) ->  | C219: of:=IF( ISBLANK([$'03.Muestra'.$E18]);"";[$'03.Muestra'.$E18]) ->  | E219: of:=IF([.D219]<>"";IF(AND([.B219]<>"";[.C219]<>"");"";"ERR");"") -> 
B220: of:=IF( ISBLANK([$'03.Muestra'.$C19]);"";[$'03.Muestra'.$C19]) ->  | C220: of:=IF( ISBLANK([$'03.Muestra'.$E19]);"";[$'03.Muestra'.$E19]) ->  | E220: of:=IF([.D220]<>"";IF(AND([.B220]<>"";[.C220]<>"");"";"ERR");"") -> 
B221: of:=IF( ISBLANK([$'03.Muestra'.$C20]);"";[$'03.Muestra'.$C20]) ->  | C221: of:=IF( ISBLANK([$'03.Muestra'.$E20]);"";[$'03.Muestra'.$E20]) ->  | E221: of:=IF([.D221]<>"";IF(AND([.B221]<>"";[.C221]<>"");"";"ERR");"") -> 
B222: of:=IF( ISBLANK([$'03.Muestra'.$C21]);"";[$'03.Muestra'.$C21]) ->  | C222: of:=IF( ISBLANK([$'03.Muestra'.$E21]);"";[$'03.Muestra'.$E21]) ->  | E222: of:=IF([.D222]<>"";IF(AND([.B222]<>"";[.C222]<>"");"";"ERR");"") -> 
B223: of:=IF( ISBLANK([$'03.Muestra'.$C22]);"";[$'03.Muestra'.$C22]) ->  | C223: of:=IF( ISBLANK([$'03.Muestra'.$E22]);"";[$'03.Muestra'.$E22]) ->  | E223: of:=IF([.D223]<>"";IF(AND([.B223]<>"";[.C223]<>"");"";"ERR");"") -> 
B224: of:=IF( ISBLANK([$'03.Muestra'.$C23]);"";[$'03.Muestra'.$C23]) ->  | C224: of:=IF( ISBLANK([$'03.Muestra'.$E23]);"";[$'03.Muestra'.$E23]) ->  | E224: of:=IF([.D224]<>"";IF(AND([.B224]<>"";[.C224]<>"");"";"ERR");"") -> 
B225: of:=IF( ISBLANK([$'03.Muestra'.$C24]);"";[$'03.Muestra'.$C24]) ->  | C225: of:=IF( ISBLANK([$'03.Muestra'.$E24]);"";[$'03.Muestra'.$E24]) ->  | E225: of:=IF([.D225]<>"";IF(AND([.B225]<>"";[.C225]<>"");"";"ERR");"") -> 
B226: of:=IF( ISBLANK([$'03.Muestra'.$C25]);"";[$'03.Muestra'.$C25]) ->  | C226: of:=IF( ISBLANK([$'03.Muestra'.$E25]);"";[$'03.Muestra'.$E25]) ->  | E226: of:=IF([.D226]<>"";IF(AND([.B226]<>"";[.C226]<>"");"";"ERR");"") -> 
B227: of:=IF( ISBLANK([$'03.Muestra'.$C26]);"";[$'03.Muestra'.$C26]) ->  | C227: of:=IF( ISBLANK([$'03.Muestra'.$E26]);"";[$'03.Muestra'.$E26]) ->  | E227: of:=IF([.D227]<>"";IF(AND([.B227]<>"";[.C227]<>"");"";"ERR");"") -> 
B228: of:=IF( ISBLANK([$'03.Muestra'.$C27]);"";[$'03.Muestra'.$C27]) ->  | C228: of:=IF( ISBLANK([$'03.Muestra'.$E27]);"";[$'03.Muestra'.$E27]) ->  | E228: of:=IF([.D228]<>"";IF(AND([.B228]<>"";[.C228]<>"");"";"ERR");"") -> 
B229: of:=IF( ISBLANK([$'03.Muestra'.$C28]);"";[$'03.Muestra'.$C28]) ->  | C229: of:=IF( ISBLANK([$'03.Muestra'.$E28]);"";[$'03.Muestra'.$E28]) ->  | E229: of:=IF([.D229]<>"";IF(AND([.B229]<>"";[.C229]<>"");"";"ERR");"") -> 
B230: of:=IF( ISBLANK([$'03.Muestra'.$C29]);"";[$'03.Muestra'.$C29]) ->  | C230: of:=IF( ISBLANK([$'03.Muestra'.$E29]);"";[$'03.Muestra'.$E29]) ->  | E230: of:=IF([.D230]<>"";IF(AND([.B230]<>"";[.C230]<>"");"";"ERR");"") -> 
B231: of:=IF( ISBLANK([$'03.Muestra'.$C30]);"";[$'03.Muestra'.$C30]) ->  | C231: of:=IF( ISBLANK([$'03.Muestra'.$E30]);"";[$'03.Muestra'.$E30]) ->  | E231: of:=IF([.D231]<>"";IF(AND([.B231]<>"";[.C231]<>"");"";"ERR");"") -> 
B232: of:=IF( ISBLANK([$'03.Muestra'.$C31]);"";[$'03.Muestra'.$C31]) ->  | C232: of:=IF( ISBLANK([$'03.Muestra'.$E31]);"";[$'03.Muestra'.$E31]) ->  | E232: of:=IF([.D232]<>"";IF(AND([.B232]<>"";[.C232]<>"");"";"ERR");"") -> 
B233: of:=IF( ISBLANK([$'03.Muestra'.$C32]);"";[$'03.Muestra'.$C32]) ->  | C233: of:=IF( ISBLANK([$'03.Muestra'.$E32]);"";[$'03.Muestra'.$E32]) ->  | E233: of:=IF([.D233]<>"";IF(AND([.B233]<>"";[.C233]<>"");"";"ERR");"") -> 
B234: of:=IF( ISBLANK([$'03.Muestra'.$C33]);"";[$'03.Muestra'.$C33]) ->  | C234: of:=IF( ISBLANK([$'03.Muestra'.$E33]);"";[$'03.Muestra'.$E33]) ->  | E234: of:=IF([.D234]<>"";IF(AND([.B234]<>"";[.C234]<>"");"";"ERR");"") -> 
B235: of:=IF( ISBLANK([$'03.Muestra'.$C34]);"";[$'03.Muestra'.$C34]) ->  | C235: of:=IF( ISBLANK([$'03.Muestra'.$E34]);"";[$'03.Muestra'.$E34]) ->  | E235: of:=IF([.D235]<>"";IF(AND([.B235]<>"";[.C235]<>"");"";"ERR");"") -> 
B236: of:=IF( ISBLANK([$'03.Muestra'.$C35]);"";[$'03.Muestra'.$C35]) ->  | C236: of:=IF( ISBLANK([$'03.Muestra'.$E35]);"";[$'03.Muestra'.$E35]) ->  | E236: of:=IF([.D236]<>"";IF(AND([.B236]<>"";[.C236]<>"");"";"ERR");"") -> 
B237: of:=IF( ISBLANK([$'03.Muestra'.$C36]);"";[$'03.Muestra'.$C36]) ->  | C237: of:=IF( ISBLANK([$'03.Muestra'.$E36]);"";[$'03.Muestra'.$E36]) ->  | E237: of:=IF([.D237]<>"";IF(AND([.B237]<>"";[.C237]<>"");"";"ERR");"") -> 
B238: of:=IF( ISBLANK([$'03.Muestra'.$C37]);"";[$'03.Muestra'.$C37]) ->  | C238: of:=IF( ISBLANK([$'03.Muestra'.$E37]);"";[$'03.Muestra'.$E37]) ->  | E238: of:=IF([.D238]<>"";IF(AND([.B238]<>"";[.C238]<>"");"";"ERR");"") -> 
B239: of:=IF( ISBLANK([$'03.Muestra'.$C38]);"";[$'03.Muestra'.$C38]) ->  | C239: of:=IF( ISBLANK([$'03.Muestra'.$E38]);"";[$'03.Muestra'.$E38]) ->  | E239: of:=IF([.D239]<>"";IF(AND([.B239]<>"";[.C239]<>"");"";"ERR");"") -> 
B240: of:=IF( ISBLANK([$'03.Muestra'.$C39]);"";[$'03.Muestra'.$C39]) ->  | C240: of:=IF( ISBLANK([$'03.Muestra'.$E39]);"";[$'03.Muestra'.$E39]) ->  | E240: of:=IF([.D240]<>"";IF(AND([.B240]<>"";[.C240]<>"");"";"ERR");"") -> 
B241: of:=IF( ISBLANK([$'03.Muestra'.$C40]);"";[$'03.Muestra'.$C40]) ->  | C241: of:=IF( ISBLANK([$'03.Muestra'.$E40]);"";[$'03.Muestra'.$E40]) ->  | E241: of:=IF([.D241]<>"";IF(AND([.B241]<>"";[.C241]<>"");"";"ERR");"") -> 
B242: of:=IF( ISBLANK([$'03.Muestra'.$C41]);"";[$'03.Muestra'.$C41]) ->  | C242: of:=IF( ISBLANK([$'03.Muestra'.$E41]);"";[$'03.Muestra'.$E41]) ->  | E242: of:=IF([.D242]<>"";IF(AND([.B242]<>"";[.C242]<>"");"";"ERR");"") -> 
B243: of:=IF( ISBLANK([$'03.Muestra'.$C42]);"";[$'03.Muestra'.$C42]) ->  | C243: of:=IF( ISBLANK([$'03.Muestra'.$E42]);"";[$'03.Muestra'.$E42]) ->  | E243: of:=IF([.D243]<>"";IF(AND([.B243]<>"";[.C243]<>"");"";"ERR");"") -> 
B246: A | C246: 3.3.1 Identificación de errores | D246: Resultado
B247: of:=IF( ISBLANK([$'03.Muestra'.$C8]);"";[$'03.Muestra'.$C8]) ->  | C247: of:=IF( ISBLANK([$'03.Muestra'.$E8]);"";[$'03.Muestra'.$E8]) ->  | E247: of:=IF([.D247]<>"";IF(AND([.B247]<>"";[.C247]<>"");"";"ERR");"") ->  | F247: N/T | G247: N/D | H247: N/A | I247: Falla | J247: Pasa | K247: En blanco
B248: of:=IF( ISBLANK([$'03.Muestra'.$C9]);"";[$'03.Muestra'.$C9]) ->  | C248: of:=IF( ISBLANK([$'03.Muestra'.$E9]);"";[$'03.Muestra'.$E9]) ->  | E248: of:=IF([.D248]<>"";IF(AND([.B248]<>"";[.C248]<>"");"";"ERR");"") ->  | F248: of:=COUNTIF([.$D247]:INDIRECT("$D" &  SUM(ROW()-1;[$'03.Muestra'.$D$45])-1);[.F247]) -> 0 | G248: of:=COUNTIF([.$D247]:INDIRECT("$D" &  SUM(ROW()-1;[$'03.Muestra'.$D$45])-1);[.G247]) -> 0 | H248: of:=COUNTIF([.$D247]:INDIRECT("$D" &  SUM(ROW()-1;[$'03.Muestra'.$D$45])-1);[.H247]) -> 0 | I248: of:=COUNTIF([.$D247]:INDIRECT("$D" &  SUM(ROW()-1;[$'03.Muestra'.$D$45])-1);[.I247]) -> 0 | J248: of:=COUNTIF([.$D247]:INDIRECT("$D" &  SUM(ROW()-1;[$'03.Muestra'.$D$45])-1);[.J247]) -> 0 | K248: of:=IF([$'03.Muestra'.$D$45]=0;0;COUNTBLANK([.$D247]:INDIRECT("$D" &  SUM(ROW()-1;[$'03.Muestra'.$D$45])-1))) -> 0
B249: of:=IF( ISBLANK([$'03.Muestra'.$C10]);"";[$'03.Muestra'.$C10]) ->  | C249: of:=IF( ISBLANK([$'03.Muestra'.$E10]);"";[$'03.Muestra'.$E10]) ->  | E249: of:=IF([.D249]<>"";IF(AND([.B249]<>"";[.C249]<>"");"";"ERR");"") -> 
B250: of:=IF( ISBLANK([$'03.Muestra'.$C11]);"";[$'03.Muestra'.$C11]) ->  | C250: of:=IF( ISBLANK([$'03.Muestra'.$E11]);"";[$'03.Muestra'.$E11]) ->  | E250: of:=IF([.D250]<>"";IF(AND([.B250]<>"";[.C250]<>"");"";"ERR");"") -> 
B251: of:=IF( ISBLANK([$'03.Muestra'.$C12]);"";[$'03.Muestra'.$C12]) ->  | C251: of:=IF( ISBLANK([$'03.Muestra'.$E12]);"";[$'03.Muestra'.$E12]) ->  | E251: of:=IF([.D251]<>"";IF(AND([.B251]<>"";[.C251]<>"");"";"ERR");"") -> 
B252: of:=IF( ISBLANK([$'03.Muestra'.$C13]);"";[$'03.Muestra'.$C13]) ->  | C252: of:=IF( ISBLANK([$'03.Muestra'.$E13]);"";[$'03.Muestra'.$E13]) ->  | E252: of:=IF([.D252]<>"";IF(AND([.B252]<>"";[.C252]<>"");"";"ERR");"") -> 
B253: of:=IF( ISBLANK([$'03.Muestra'.$C14]);"";[$'03.Muestra'.$C14]) ->  | C253: of:=IF( ISBLANK([$'03.Muestra'.$E14]);"";[$'03.Muestra'.$E14]) ->  | E253: of:=IF([.D253]<>"";IF(AND([.B253]<>"";[.C253]<>"");"";"ERR");"") -> 
B254: of:=IF( ISBLANK([$'03.Muestra'.$C15]);"";[$'03.Muestra'.$C15]) ->  | C254: of:=IF( ISBLANK([$'03.Muestra'.$E15]);"";[$'03.Muestra'.$E15]) ->  | E254: of:=IF([.D254]<>"";IF(AND([.B254]<>"";[.C254]<>"");"";"ERR");"") -> 
B255: of:=IF( ISBLANK([$'03.Muestra'.$C16]);"";[$'03.Muestra'.$C16]) ->  | C255: of:=IF( ISBLANK([$'03.Muestra'.$E16]);"";[$'03.Muestra'.$E16]) ->  | E255: of:=IF([.D255]<>"";IF(AND([.B255]<>"";[.C255]<>"");"";"ERR");"") -> 
B256: of:=IF( ISBLANK([$'03.Muestra'.$C17]);"";[$'03.Muestra'.$C17]) ->  | C256: of:=IF( ISBLANK([$'03.Muestra'.$E17]);"";[$'03.Muestra'.$E17]) ->  | E256: of:=IF([.D256]<>"";IF(AND([.B256]<>"";[.C256]<>"");"";"ERR");"") -> 
B257: of:=IF( ISBLANK([$'03.Muestra'.$C18]);"";[$'03.Muestra'.$C18]) ->  | C257: of:=IF( ISBLANK([$'03.Muestra'.$E18]);"";[$'03.Muestra'.$E18]) ->  | E257: of:=IF([.D257]<>"";IF(AND([.B257]<>"";[.C257]<>"");"";"ERR");"") -> 
B258: of:=IF( ISBLANK([$'03.Muestra'.$C19]);"";[$'03.Muestra'.$C19]) ->  | C258: of:=IF( ISBLANK([$'03.Muestra'.$E19]);"";[$'03.Muestra'.$E19]) ->  | E258: of:=IF([.D258]<>"";IF(AND([.B258]<>"";[.C258]<>"");"";"ERR");"") -> 
B259: of:=IF( ISBLANK([$'03.Muestra'.$C20]);"";[$'03.Muestra'.$C20]) ->  | C259: of:=IF( ISBLANK([$'03.Muestra'.$E20]);"";[$'03.Muestra'.$E20]) ->  | E259: of:=IF([.D259]<>"";IF(AND([.B259]<>"";[.C259]<>"");"";"ERR");"") -> 
B260: of:=IF( ISBLANK([$'03.Muestra'.$C21]);"";[$'03.Muestra'.$C21]) ->  | C260: of:=IF( ISBLANK([$'03.Muestra'.$E21]);"";[$'03.Muestra'.$E21]) ->  | E260: of:=IF([.D260]<>"";IF(AND([.B260]<>"";[.C260]<>"");"";"ERR");"") -> 
B261: of:=IF( ISBLANK([$'03.Muestra'.$C22]);"";[$'03.Muestra'.$C22]) ->  | C261: of:=IF( ISBLANK([$'03.Muestra'.$E22]);"";[$'03.Muestra'.$E22]) ->  | E261: of:=IF([.D261]<>"";IF(AND([.B261]<>"";[.C261]<>"");"";"ERR");"") -> 
B262: of:=IF( ISBLANK([$'03.Muestra'.$C23]);"";[$'03.Muestra'.$C23]) ->  | C262: of:=IF( ISBLANK([$'03.Muestra'.$E23]);"";[$'03.Muestra'.$E23]) ->  | E262: of:=IF([.D262]<>"";IF(AND([.B262]<>"";[.C262]<>"");"";"ERR");"") -> 
B263: of:=IF( ISBLANK([$'03.Muestra'.$C24]);"";[$'03.Muestra'.$C24]) ->  | C263: of:=IF( ISBLANK([$'03.Muestra'.$E24]);"";[$'03.Muestra'.$E24]) ->  | E263: of:=IF([.D263]<>"";IF(AND([.B263]<>"";[.C263]<>"");"";"ERR");"") -> 
B264: of:=IF( ISBLANK([$'03.Muestra'.$C25]);"";[$'03.Muestra'.$C25]) ->  | C264: of:=IF( ISBLANK([$'03.Muestra'.$E25]);"";[$'03.Muestra'.$E25]) ->  | E264: of:=IF([.D264]<>"";IF(AND([.B264]<>"";[.C264]<>"");"";"ERR");"") -> 
B265: of:=IF( ISBLANK([$'03.Muestra'.$C26]);"";[$'03.Muestra'.$C26]) ->  | C265: of:=IF( ISBLANK([$'03.Muestra'.$E26]);"";[$'03.Muestra'.$E26]) ->  | E265: of:=IF([.D265]<>"";IF(AND([.B265]<>"";[.C265]<>"");"";"ERR");"") -> 
B266: of:=IF( ISBLANK([$'03.Muestra'.$C27]);"";[$'03.Muestra'.$C27]) ->  | C266: of:=IF( ISBLANK([$'03.Muestra'.$E27]);"";[$'03.Muestra'.$E27]) ->  | E266: of:=IF([.D266]<>"";IF(AND([.B266]<>"";[.C266]<>"");"";"ERR");"") -> 
B267: of:=IF( ISBLANK([$'03.Muestra'.$C28]);"";[$'03.Muestra'.$C28]) ->  | C267: of:=IF( ISBLANK([$'03.Muestra'.$E28]);"";[$'03.Muestra'.$E28]) ->  | E267: of:=IF([.D267]<>"";IF(AND([.B267]<>"";[.C267]<>"");"";"ERR");"") -> 
B268: of:=IF( ISBLANK([$'03.Muestra'.$C29]);"";[$'03.Muestra'.$C29]) ->  | C268: of:=IF( ISBLANK([$'03.Muestra'.$E29]);"";[$'03.Muestra'.$E29]) ->  | E268: of:=IF([.D268]<>"";IF(AND([.B268]<>"";[.C268]<>"");"";"ERR");"") -> 
B269: of:=IF( ISBLANK([$'03.Muestra'.$C30]);"";[$'03.Muestra'.$C30]) ->  | C269: of:=IF( ISBLANK([$'03.Muestra'.$E30]);"";[$'03.Muestra'.$E30]) ->  | E269: of:=IF([.D269]<>"";IF(AND([.B269]<>"";[.C269]<>"");"";"ERR");"") -> 
B270: of:=IF( ISBLANK([$'03.Muestra'.$C31]);"";[$'03.Muestra'.$C31]) ->  | C270: of:=IF( ISBLANK([$'03.Muestra'.$E31]);"";[$'03.Muestra'.$E31]) ->  | E270: of:=IF([.D270]<>"";IF(AND([.B270]<>"";[.C270]<>"");"";"ERR");"") -> 
B271: of:=IF( ISBLANK([$'03.Muestra'.$C32]);"";[$'03.Muestra'.$C32]) ->  | C271: of:=IF( ISBLANK([$'03.Muestra'.$E32]);"";[$'03.Muestra'.$E32]) ->  | E271: of:=IF([.D271]<>"";IF(AND([.B271]<>"";[.C271]<>"");"";"ERR");"") -> 
B272: of:=IF( ISBLANK([$'03.Muestra'.$C33]);"";[$'03.Muestra'.$C33]) ->  | C272: of:=IF( ISBLANK([$'03.Muestra'.$E33]);"";[$'03.Muestra'.$E33]) ->  | E272: of:=IF([.D272]<>"";IF(AND([.B272]<>"";[.C272]<>"");"";"ERR");"") -> 
B273: of:=IF( ISBLANK([$'03.Muestra'.$C34]);"";[$'03.Muestra'.$C34]) ->  | C273: of:=IF( ISBLANK([$'03.Muestra'.$E34]);"";[$'03.Muestra'.$E34]) ->  | E273: of:=IF([.D273]<>"";IF(AND([.B273]<>"";[.C273]<>"");"";"ERR");"") -> 
B274: of:=IF( ISBLANK([$'03.Muestra'.$C35]);"";[$'03.Muestra'.$C35]) ->  | C274: of:=IF( ISBLANK([$'03.Muestra'.$E35]);"";[$'03.Muestra'.$E35]) ->  | E274: of:=IF([.D274]<>"";IF(AND([.B274]<>"";[.C274]<>"");"";"ERR");"") -> 
B275: of:=IF( ISBLANK([$'03.Muestra'.$C36]);"";[$'03.Muestra'.$C36]) ->  | C275: of:=IF( ISBLANK([$'03.Muestra'.$E36]);"";[$'03.Muestra'.$E36]) ->  | E275: of:=IF([.D275]<>"";IF(AND([.B275]<>"";[.C275]<>"");"";"ERR");"") -> 
B276: of:=IF( ISBLANK([$'03.Muestra'.$C37]);"";[$'03.Muestra'.$C37]) ->  | C276: of:=IF( ISBLANK([$'03.Muestra'.$E37]);"";[$'03.Muestra'.$E37]) ->  | E276: of:=IF([.D276]<>"";IF(AND([.B276]<>"";[.C276]<>"");"";"ERR");"") -> 
B277: of:=IF( ISBLANK([$'03.Muestra'.$C38]);"";[$'03.Muestra'.$C38]) ->  | C277: of:=IF( ISBLANK([$'03.Muestra'.$E38]);"";[$'03.Muestra'.$E38]) ->  | E277: of:=IF([.D277]<>"";IF(AND([.B277]<>"";[.C277]<>"");"";"ERR");"") -> 
B278: of:=IF( ISBLANK([$'03.Muestra'.$C39]);"";[$'03.Muestra'.$C39]) ->  | C278: of:=IF( ISBLANK([$'03.Muestra'.$E39]);"";[$'03.Muestra'.$E39]) ->  | E278: of:=IF([.D278]<>"";IF(AND([.B278]<>"";[.C278]<>"");"";"ERR");"") -> 
B279: of:=IF( ISBLANK([$'03.Muestra'.$C40]);"";[$'03.Muestra'.$C40]) ->  | C279: of:=IF( ISBLANK([$'03.Muestra'.$E40]);"";[$'03.Muestra'.$E40]) ->  | E279: of:=IF([.D279]<>"";IF(AND([.B279]<>"";[.C279]<>"");"";"ERR");"") -> 
B280: of:=IF( ISBLANK([$'03.Muestra'.$C41]);"";[$'03.Muestra'.$C41]) ->  | C280: of:=IF( ISBLANK([$'03.Muestra'.$E41]);"";[$'03.Muestra'.$E41]) ->  | E280: of:=IF([.D280]<>"";IF(AND([.B280]<>"";[.C280]<>"");"";"ERR");"") -> 
B281: of:=IF( ISBLANK([$'03.Muestra'.$C42]);"";[$'03.Muestra'.$C42]) ->  | C281: of:=IF( ISBLANK([$'03.Muestra'.$E42]);"";[$'03.Muestra'.$E42]) ->  | E281: of:=IF([.D281]<>"";IF(AND([.B281]<>"";[.C281]<>"");"";"ERR");"") -> 
B284: A | C284: 3.3.2 Etiquetas o instrucciones | D284: Resultado
B285: of:=IF( ISBLANK([$'03.Muestra'.$C8]);"";[$'03.Muestra'.$C8]) ->  | C285: of:=IF( ISBLANK([$'03.Muestra'.$E8]);"";[$'03.Muestra'.$E8]) ->  | E285: of:=IF([.D285]<>"";IF(AND([.B285]<>"";[.C285]<>"");"";"ERR");"") ->  | F285: N/T | G285: N/D | H285: N/A | I285: Falla | J285: Pasa | K285: En blanco
B286: of:=IF( ISBLANK([$'03.Muestra'.$C9]);"";[$'03.Muestra'.$C9]) ->  | C286: of:=IF( ISBLANK([$'03.Muestra'.$E9]);"";[$'03.Muestra'.$E9]) ->  | E286: of:=IF([.D286]<>"";IF(AND([.B286]<>"";[.C286]<>"");"";"ERR");"") ->  | F286: of:=COUNTIF([.$D285]:INDIRECT("$D" &  SUM(ROW()-1;[$'03.Muestra'.$D$45])-1);[.F285]) -> 0 | G286: of:=COUNTIF([.$D285]:INDIRECT("$D" &  SUM(ROW()-1;[$'03.Muestra'.$D$45])-1);[.G285]) -> 0 | H286: of:=COUNTIF([.$D285]:INDIRECT("$D" &  SUM(ROW()-1;[$'03.Muestra'.$D$45])-1);[.H285]) -> 0 | I286: of:=COUNTIF([.$D285]:INDIRECT("$D" &  SUM(ROW()-1;[$'03.Muestra'.$D$45])-1);[.I285]) -> 0 | J286: of:=COUNTIF([.$D285]:INDIRECT("$D" &  SUM(ROW()-1;[$'03.Muestra'.$D$45])-1);[.J285]) -> 0 | K286: of:=IF([$'03.Muestra'.$D$45]=0;0;COUNTBLANK([.$D285]:INDIRECT("$D" &  SUM(ROW()-1;[$'03.Muestra'.$D$45])-1))) -> 0
B287: of:=IF( ISBLANK([$'03.Muestra'.$C10]);"";[$'03.Muestra'.$C10]) ->  | C287: of:=IF( ISBLANK([$'03.Muestra'.$E10]);"";[$'03.Muestra'.$E10]) ->  | E287: of:=IF([.D287]<>"";IF(AND([.B287]<>"";[.C287]<>"");"";"ERR");"") -> 
B288: of:=IF( ISBLANK([$'03.Muestra'.$C11]);"";[$'03.Muestra'.$C11]) ->  | C288: of:=IF( ISBLANK([$'03.Muestra'.$E11]);"";[$'03.Muestra'.$E11]) ->  | E288: of:=IF([.D288]<>"";IF(AND([.B288]<>"";[.C288]<>"");"";"ERR");"") -> 
B289: of:=IF( ISBLANK([$'03.Muestra'.$C12]);"";[$'03.Muestra'.$C12]) ->  | C289: of:=IF( ISBLANK([$'03.Muestra'.$E12]);"";[$'03.Muestra'.$E12]) ->  | E289: of:=IF([.D289]<>"";IF(AND([.B289]<>"";[.C289]<>"");"";"ERR");"") -> 
B290: of:=IF( ISBLANK([$'03.Muestra'.$C13]);"";[$'03.Muestra'.$C13]) ->  | C290: of:=IF( ISBLANK([$'03.Muestra'.$E13]);"";[$'03.Muestra'.$E13]) ->  | E290: of:=IF([.D290]<>"";IF(AND([.B290]<>"";[.C290]<>"");"";"ERR");"") -> 
B291: of:=IF( ISBLANK([$'03.Muestra'.$C14]);"";[$'03.Muestra'.$C14]) ->  | C291: of:=IF( ISBLANK([$'03.Muestra'.$E14]);"";[$'03.Muestra'.$E14]) ->  | E291: of:=IF([.D291]<>"";IF(AND([.B291]<>"";[.C291]<>"");"";"ERR");"") -> 
B292: of:=IF( ISBLANK([$'03.Muestra'.$C15]);"";[$'03.Muestra'.$C15]) ->  | C292: of:=IF( ISBLANK([$'03.Muestra'.$E15]);"";[$'03.Muestra'.$E15]) ->  | E292: of:=IF([.D292]<>"";IF(AND([.B292]<>"";[.C292]<>"");"";"ERR");"") -> 
B293: of:=IF( ISBLANK([$'03.Muestra'.$C16]);"";[$'03.Muestra'.$C16]) ->  | C293: of:=IF( ISBLANK([$'03.Muestra'.$E16]);"";[$'03.Muestra'.$E16]) ->  | E293: of:=IF([.D293]<>"";IF(AND([.B293]<>"";[.C293]<>"");"";"ERR");"") -> 
B294: of:=IF( ISBLANK([$'03.Muestra'.$C17]);"";[$'03.Muestra'.$C17]) ->  | C294: of:=IF( ISBLANK([$'03.Muestra'.$E17]);"";[$'03.Muestra'.$E17]) ->  | E294: of:=IF([.D294]<>"";IF(AND([.B294]<>"";[.C294]<>"");"";"ERR");"") -> 
B295: of:=IF( ISBLANK([$'03.Muestra'.$C18]);"";[$'03.Muestra'.$C18]) ->  | C295: of:=IF( ISBLANK([$'03.Muestra'.$E18]);"";[$'03.Muestra'.$E18]) ->  | E295: of:=IF([.D295]<>"";IF(AND([.B295]<>"";[.C295]<>"");"";"ERR");"") -> 
B296: of:=IF( ISBLANK([$'03.Muestra'.$C19]);"";[$'03.Muestra'.$C19]) ->  | C296: of:=IF( ISBLANK([$'03.Muestra'.$E19]);"";[$'03.Muestra'.$E19]) ->  | E296: of:=IF([.D296]<>"";IF(AND([.B296]<>"";[.C296]<>"");"";"ERR");"") -> 
B297: of:=IF( ISBLANK([$'03.Muestra'.$C20]);"";[$'03.Muestra'.$C20]) ->  | C297: of:=IF( ISBLANK([$'03.Muestra'.$E20]);"";[$'03.Muestra'.$E20]) ->  | E297: of:=IF([.D297]<>"";IF(AND([.B297]<>"";[.C297]<>"");"";"ERR");"") -> 
B298: of:=IF( ISBLANK([$'03.Muestra'.$C21]);"";[$'03.Muestra'.$C21]) ->  | C298: of:=IF( ISBLANK([$'03.Muestra'.$E21]);"";[$'03.Muestra'.$E21]) ->  | E298: of:=IF([.D298]<>"";IF(AND([.B298]<>"";[.C298]<>"");"";"ERR");"") -> 
B299: of:=IF( ISBLANK([$'03.Muestra'.$C22]);"";[$'03.Muestra'.$C22]) ->  | C299: of:=IF( ISBLANK([$'03.Muestra'.$E22]);"";[$'03.Muestra'.$E22]) ->  | E299: of:=IF([.D299]<>"";IF(AND([.B299]<>"";[.C299]<>"");"";"ERR");"") -> 
B300: of:=IF( ISBLANK([$'03.Muestra'.$C23]);"";[$'03.Muestra'.$C23]) ->  | C300: of:=IF( ISBLANK([$'03.Muestra'.$E23]);"";[$'03.Muestra'.$E23]) ->  | E300: of:=IF([.D300]<>"";IF(AND([.B300]<>"";[.C300]<>"");"";"ERR");"") -> 
B301: of:=IF( ISBLANK([$'03.Muestra'.$C24]);"";[$'03.Muestra'.$C24]) ->  | C301: of:=IF( ISBLANK([$'03.Muestra'.$E24]);"";[$'03.Muestra'.$E24]) ->  | E301: of:=IF([.D301]<>"";IF(AND([.B301]<>"";[.C301]<>"");"";"ERR");"") -> 
B302: of:=IF( ISBLANK([$'03.Muestra'.$C25]);"";[$'03.Muestra'.$C25]) ->  | C302: of:=IF( ISBLANK([$'03.Muestra'.$E25]);"";[$'03.Muestra'.$E25]) ->  | E302: of:=IF([.D302]<>"";IF(AND([.B302]<>"";[.C302]<>"");"";"ERR");"") -> 
B303: of:=IF( ISBLANK([$'03.Muestra'.$C26]);"";[$'03.Muestra'.$C26]) ->  | C303: of:=IF( ISBLANK([$'03.Muestra'.$E26]);"";[$'03.Muestra'.$E26]) ->  | E303: of:=IF([.D303]<>"";IF(AND([.B303]<>"";[.C303]<>"");"";"ERR");"") -> 
B304: of:=IF( ISBLANK([$'03.Muestra'.$C27]);"";[$'03.Muestra'.$C27]) ->  | C304: of:=IF( ISBLANK([$'03.Muestra'.$E27]);"";[$'03.Muestra'.$E27]) ->  | E304: of:=IF([.D304]<>"";IF(AND([.B304]<>"";[.C304]<>"");"";"ERR");"") -> 
B305: of:=IF( ISBLANK([$'03.Muestra'.$C28]);"";[$'03.Muestra'.$C28]) ->  | C305: of:=IF( ISBLANK([$'03.Muestra'.$E28]);"";[$'03.Muestra'.$E28]) ->  | E305: of:=IF([.D305]<>"";IF(AND([.B305]<>"";[.C305]<>"");"";"ERR");"") -> 
B306: of:=IF( ISBLANK([$'03.Muestra'.$C29]);"";[$'03.Muestra'.$C29]) ->  | C306: of:=IF( ISBLANK([$'03.Muestra'.$E29]);"";[$'03.Muestra'.$E29]) ->  | E306: of:=IF([.D306]<>"";IF(AND([.B306]<>"";[.C306]<>"");"";"ERR");"") -> 
B307: of:=IF( ISBLANK([$'03.Muestra'.$C30]);"";[$'03.Muestra'.$C30]) ->  | C307: of:=IF( ISBLANK([$'03.Muestra'.$E30]);"";[$'03.Muestra'.$E30]) ->  | E307: of:=IF([.D307]<>"";IF(AND([.B307]<>"";[.C307]<>"");"";"ERR");"") -> 
B308: of:=IF( ISBLANK([$'03.Muestra'.$C31]);"";[$'03.Muestra'.$C31]) ->  | C308: of:=IF( ISBLANK([$'03.Muestra'.$E31]);"";[$'03.Muestra'.$E31]) ->  | E308: of:=IF([.D308]<>"";IF(AND([.B308]<>"";[.C308]<>"");"";"ERR");"") -> 
B309: of:=IF( ISBLANK([$'03.Muestra'.$C32]);"";[$'03.Muestra'.$C32]) ->  | C309: of:=IF( ISBLANK([$'03.Muestra'.$E32]);"";[$'03.Muestra'.$E32]) ->  | E309: of:=IF([.D309]<>"";IF(AND([.B309]<>"";[.C309]<>"");"";"ERR");"") -> 
B310: of:=IF( ISBLANK([$'03.Muestra'.$C33]);"";[$'03.Muestra'.$C33]) ->  | C310: of:=IF( ISBLANK([$'03.Muestra'.$E33]);"";[$'03.Muestra'.$E33]) ->  | E310: of:=IF([.D310]<>"";IF(AND([.B310]<>"";[.C310]<>"");"";"ERR");"") -> 
B311: of:=IF( ISBLANK([$'03.Muestra'.$C34]);"";[$'03.Muestra'.$C34]) ->  | C311: of:=IF( ISBLANK([$'03.Muestra'.$E34]);"";[$'03.Muestra'.$E34]) ->  | E311: of:=IF([.D311]<>"";IF(AND([.B311]<>"";[.C311]<>"");"";"ERR");"") -> 
B312: of:=IF( ISBLANK([$'03.Muestra'.$C35]);"";[$'03.Muestra'.$C35]) ->  | C312: of:=IF( ISBLANK([$'03.Muestra'.$E35]);"";[$'03.Muestra'.$E35]) ->  | E312: of:=IF([.D312]<>"";IF(AND([.B312]<>"";[.C312]<>"");"";"ERR");"") -> 
B313: of:=IF( ISBLANK([$'03.Muestra'.$C36]);"";[$'03.Muestra'.$C36]) ->  | C313: of:=IF( ISBLANK([$'03.Muestra'.$E36]);"";[$'03.Muestra'.$E36]) ->  | E313: of:=IF([.D313]<>"";IF(AND([.B313]<>"";[.C313]<>"");"";"ERR");"") -> 
B314: of:=IF( ISBLANK([$'03.Muestra'.$C37]);"";[$'03.Muestra'.$C37]) ->  | C314: of:=IF( ISBLANK([$'03.Muestra'.$E37]);"";[$'03.Muestra'.$E37]) ->  | E314: of:=IF([.D314]<>"";IF(AND([.B314]<>"";[.C314]<>"");"";"ERR");"") -> 
B315: of:=IF( ISBLANK([$'03.Muestra'.$C38]);"";[$'03.Muestra'.$C38]) ->  | C315: of:=IF( ISBLANK([$'03.Muestra'.$E38]);"";[$'03.Muestra'.$E38]) ->  | E315: of:=IF([.D315]<>"";IF(AND([.B315]<>"";[.C315]<>"");"";"ERR");"") -> 
B316: of:=IF( ISBLANK([$'03.Muestra'.$C39]);"";[$'03.Muestra'.$C39]) ->  | C316: of:=IF( ISBLANK([$'03.Muestra'.$E39]);"";[$'03.Muestra'.$E39]) ->  | E316: of:=IF([.D316]<>"";IF(AND([.B316]<>"";[.C316]<>"");"";"ERR");"") -> 
B317: of:=IF( ISBLANK([$'03.Muestra'.$C40]);"";[$'03.Muestra'.$C40]) ->  | C317: of:=IF( ISBLANK([$'03.Muestra'.$E40]);"";[$'03.Muestra'.$E40]) ->  | E317: of:=IF([.D317]<>"";IF(AND([.B317]<>"";[.C317]<>"");"";"ERR");"") -> 
B318: of:=IF( ISBLANK([$'03.Muestra'.$C41]);"";[$'03.Muestra'.$C41]) ->  | C318: of:=IF( ISBLANK([$'03.Muestra'.$E41]);"";[$'03.Muestra'.$E41]) ->  | E318: of:=IF([.D318]<>"";IF(AND([.B318]<>"";[.C318]<>"");"";"ERR");"") -> 
B319: of:=IF( ISBLANK([$'03.Muestra'.$C42]);"";[$'03.Muestra'.$C42]) ->  | C319: of:=IF( ISBLANK([$'03.Muestra'.$E42]);"";[$'03.Muestra'.$E42]) ->  | E319: of:=IF([.D319]<>"";IF(AND([.B319]<>"";[.C319]<>"");"";"ERR");"") -> 
B322: AA | C322: 3.3.3 Sugerencias ante errores | D322: Resultado
B323: of:=IF( ISBLANK([$'03.Muestra'.$C8]);"";[$'03.Muestra'.$C8]) ->  | C323: of:=IF( ISBLANK([$'03.Muestra'.$E8]);"";[$'03.Muestra'.$E8]) ->  | E323: of:=IF([.D323]<>"";IF(AND([.B323]<>"";[.C323]<>"");"";"ERR");"") ->  | F323: N/T | G323: N/D | H323: N/A | I323: Falla | J323: Pasa | K323: En blanco
B324: of:=IF( ISBLANK([$'03.Muestra'.$C9]);"";[$'03.Muestra'.$C9]) ->  | C324: of:=IF( ISBLANK([$'03.Muestra'.$E9]);"";[$'03.Muestra'.$E9]) ->  | E324: of:=IF([.D324]<>"";IF(AND([.B324]<>"";[.C324]<>"");"";"ERR");"") ->  | F324: of:=COUNTIF([.$D323]:INDIRECT("$D" &  SUM(ROW()-1;[$'03.Muestra'.$D$45])-1);[.F323]) -> 0 | G324: of:=COUNTIF([.$D323]:INDIRECT("$D" &  SUM(ROW()-1;[$'03.Muestra'.$D$45])-1);[.G323]) -> 0 | H324: of:=COUNTIF([.$D323]:INDIRECT("$D" &  SUM(ROW()-1;[$'03.Muestra'.$D$45])-1);[.H323]) -> 0 | I324: of:=COUNTIF([.$D323]:INDIRECT("$D" &  SUM(ROW()-1;[$'03.Muestra'.$D$45])-1);[.I323]) -> 0 | J324: of:=COUNTIF([.$D323]:INDIRECT("$D" &  SUM(ROW()-1;[$'03.Muestra'.$D$45])-1);[.J323]) -> 0 | K324: of:=IF([$'03.Muestra'.$D$45]=0;0;COUNTBLANK([.$D323]:INDIRECT("$D" &  SUM(ROW()-1;[$'03.Muestra'.$D$45])-1))) -> 0
B325: of:=IF( ISBLANK([$'03.Muestra'.$C10]);"";[$'03.Muestra'.$C10]) ->  | C325: of:=IF( ISBLANK([$'03.Muestra'.$E10]);"";[$'03.Muestra'.$E10]) ->  | E325: of:=IF([.D325]<>"";IF(AND([.B325]<>"";[.C325]<>"");"";"ERR");"") -> 
B326: of:=IF( ISBLANK([$'03.Muestra'.$C11]);"";[$'03.Muestra'.$C11]) ->  | C326: of:=IF( ISBLANK([$'03.Muestra'.$E11]);"";[$'03.Muestra'.$E11]) ->  | E326: of:=IF([.D326]<>"";IF(AND([.B326]<>"";[.C326]<>"");"";"ERR");"") -> 
B327: of:=IF( ISBLANK([$'03.Muestra'.$C12]);"";[$'03.Muestra'.$C12]) ->  | C327: of:=IF( ISBLANK([$'03.Muestra'.$E12]);"";[$'03.Muestra'.$E12]) ->  | E327: of:=IF([.D327]<>"";IF(AND([.B327]<>"";[.C327]<>"");"";"ERR");"") -> 
B328: of:=IF( ISBLANK([$'03.Muestra'.$C13]);"";[$'03.Muestra'.$C13]) ->  | C328: of:=IF( ISBLANK([$'03.Muestra'.$E13]);"";[$'03.Muestra'.$E13]) ->  | E328: of:=IF([.D328]<>"";IF(AND([.B328]<>"";[.C328]<>"");"";"ERR");"") -> 
B329: of:=IF( ISBLANK([$'03.Muestra'.$C14]);"";[$'03.Muestra'.$C14]) ->  | C329: of:=IF( ISBLANK([$'03.Muestra'.$E14]);"";[$'03.Muestra'.$E14]) ->  | E329: of:=IF([.D329]<>"";IF(AND([.B329]<>"";[.C329]<>"");"";"ERR");"") -> 
B330: of:=IF( ISBLANK([$'03.Muestra'.$C15]);"";[$'03.Muestra'.$C15]) ->  | C330: of:=IF( ISBLANK([$'03.Muestra'.$E15]);"";[$'03.Muestra'.$E15]) ->  | E330: of:=IF([.D330]<>"";IF(AND([.B330]<>"";[.C330]<>"");"";"ERR");"") -> 
B331: of:=IF( ISBLANK([$'03.Muestra'.$C16]);"";[$'03.Muestra'.$C16]) ->  | C331: of:=IF( ISBLANK([$'03.Muestra'.$E16]);"";[$'03.Muestra'.$E16]) ->  | E331: of:=IF([.D331]<>"";IF(AND([.B331]<>"";[.C331]<>"");"";"ERR");"") -> 
B332: of:=IF( ISBLANK([$'03.Muestra'.$C17]);"";[$'03.Muestra'.$C17]) ->  | C332: of:=IF( ISBLANK([$'03.Muestra'.$E17]);"";[$'03.Muestra'.$E17]) ->  | E332: of:=IF([.D332]<>"";IF(AND([.B332]<>"";[.C332]<>"");"";"ERR");"") -> 
B333: of:=IF( ISBLANK([$'03.Muestra'.$C18]);"";[$'03.Muestra'.$C18]) ->  | C333: of:=IF( ISBLANK([$'03.Muestra'.$E18]);"";[$'03.Muestra'.$E18]) ->  | E333: of:=IF([.D333]<>"";IF(AND([.B333]<>"";[.C333]<>"");"";"ERR");"") -> 
B334: of:=IF( ISBLANK([$'03.Muestra'.$C19]);"";[$'03.Muestra'.$C19]) ->  | C334: of:=IF( ISBLANK([$'03.Muestra'.$E19]);"";[$'03.Muestra'.$E19]) ->  | E334: of:=IF([.D334]<>"";IF(AND([.B334]<>"";[.C334]<>"");"";"ERR");"") -> 
B335: of:=IF( ISBLANK([$'03.Muestra'.$C20]);"";[$'03.Muestra'.$C20]) ->  | C335: of:=IF( ISBLANK([$'03.Muestra'.$E20]);"";[$'03.Muestra'.$E20]) ->  | E335: of:=IF([.D335]<>"";IF(AND([.B335]<>"";[.C335]<>"");"";"ERR");"") -> 
B336: of:=IF( ISBLANK([$'03.Muestra'.$C21]);"";[$'03.Muestra'.$C21]) ->  | C336: of:=IF( ISBLANK([$'03.Muestra'.$E21]);"";[$'03.Muestra'.$E21]) ->  | E336: of:=IF([.D336]<>"";IF(AND([.B336]<>"";[.C336]<>"");"";"ERR");"") -> 
B337: of:=IF( ISBLANK([$'03.Muestra'.$C22]);"";[$'03.Muestra'.$C22]) ->  | C337: of:=IF( ISBLANK([$'03.Muestra'.$E22]);"";[$'03.Muestra'.$E22]) ->  | E337: of:=IF([.D337]<>"";IF(AND([.B337]<>"";[.C337]<>"");"";"ERR");"") -> 
B338: of:=IF( ISBLANK([$'03.Muestra'.$C23]);"";[$'03.Muestra'.$C23]) ->  | C338: of:=IF( ISBLANK([$'03.Muestra'.$E23]);"";[$'03.Muestra'.$E23]) ->  | E338: of:=IF([.D338]<>"";IF(AND([.B338]<>"";[.C338]<>"");"";"ERR");"") -> 
B339: of:=IF( ISBLANK([$'03.Muestra'.$C24]);"";[$'03.Muestra'.$C24]) ->  | C339: of:=IF( ISBLANK([$'03.Muestra'.$E24]);"";[$'03.Muestra'.$E24]) ->  | E339: of:=IF([.D339]<>"";IF(AND([.B339]<>"";[.C339]<>"");"";"ERR");"") -> 
B340: of:=IF( ISBLANK([$'03.Muestra'.$C25]);"";[$'03.Muestra'.$C25]) ->  | C340: of:=IF( ISBLANK([$'03.Muestra'.$E25]);"";[$'03.Muestra'.$E25]) ->  | E340: of:=IF([.D340]<>"";IF(AND([.B340]<>"";[.C340]<>"");"";"ERR");"") -> 
B341: of:=IF( ISBLANK([$'03.Muestra'.$C26]);"";[$'03.Muestra'.$C26]) ->  | C341: of:=IF( ISBLANK([$'03.Muestra'.$E26]);"";[$'03.Muestra'.$E26]) ->  | E341: of:=IF([.D341]<>"";IF(AND([.B341]<>"";[.C341]<>"");"";"ERR");"") -> 
B342: of:=IF( ISBLANK([$'03.Muestra'.$C27]);"";[$'03.Muestra'.$C27]) ->  | C342: of:=IF( ISBLANK([$'03.Muestra'.$E27]);"";[$'03.Muestra'.$E27]) ->  | E342: of:=IF([.D342]<>"";IF(AND([.B342]<>"";[.C342]<>"");"";"ERR");"") -> 
B343: of:=IF( ISBLANK([$'03.Muestra'.$C28]);"";[$'03.Muestra'.$C28]) ->  | C343: of:=IF( ISBLANK([$'03.Muestra'.$E28]);"";[$'03.Muestra'.$E28]) ->  | E343: of:=IF([.D343]<>"";IF(AND([.B343]<>"";[.C343]<>"");"";"ERR");"") -> 
B344: of:=IF( ISBLANK([$'03.Muestra'.$C29]);"";[$'03.Muestra'.$C29]) ->  | C344: of:=IF( ISBLANK([$'03.Muestra'.$E29]);"";[$'03.Muestra'.$E29]) ->  | E344: of:=IF([.D344]<>"";IF(AND([.B344]<>"";[.C344]<>"");"";"ERR");"") -> 
B345: of:=IF( ISBLANK([$'03.Muestra'.$C30]);"";[$'03.Muestra'.$C30]) ->  | C345: of:=IF( ISBLANK([$'03.Muestra'.$E30]);"";[$'03.Muestra'.$E30]) ->  | E345: of:=IF([.D345]<>"";IF(AND([.B345]<>"";[.C345]<>"");"";"ERR");"") -> 
B346: of:=IF( ISBLANK([$'03.Muestra'.$C31]);"";[$'03.Muestra'.$C31]) ->  | C346: of:=IF( ISBLANK([$'03.Muestra'.$E31]);"";[$'03.Muestra'.$E31]) ->  | E346: of:=IF([.D346]<>"";IF(AND([.B346]<>"";[.C346]<>"");"";"ERR");"") -> 
B347: of:=IF( ISBLANK([$'03.Muestra'.$C32]);"";[$'03.Muestra'.$C32]) ->  | C347: of:=IF( ISBLANK([$'03.Muestra'.$E32]);"";[$'03.Muestra'.$E32]) ->  | E347: of:=IF([.D347]<>"";IF(AND([.B347]<>"";[.C347]<>"");"";"ERR");"") -> 
B348: of:=IF( ISBLANK([$'03.Muestra'.$C33]);"";[$'03.Muestra'.$C33]) ->  | C348: of:=IF( ISBLANK([$'03.Muestra'.$E33]);"";[$'03.Muestra'.$E33]) ->  | E348: of:=IF([.D348]<>"";IF(AND([.B348]<>"";[.C348]<>"");"";"ERR");"") -> 
B349: of:=IF( ISBLANK([$'03.Muestra'.$C34]);"";[$'03.Muestra'.$C34]) ->  | C349: of:=IF( ISBLANK([$'03.Muestra'.$E34]);"";[$'03.Muestra'.$E34]) ->  | E349: of:=IF([.D349]<>"";IF(AND([.B349]<>"";[.C349]<>"");"";"ERR");"") -> 
B350: of:=IF( ISBLANK([$'03.Muestra'.$C35]);"";[$'03.Muestra'.$C35]) ->  | C350: of:=IF( ISBLANK([$'03.Muestra'.$E35]);"";[$'03.Muestra'.$E35]) ->  | E350: of:=IF([.D350]<>"";IF(AND([.B350]<>"";[.C350]<>"");"";"ERR");"") -> 
B351: of:=IF( ISBLANK([$'03.Muestra'.$C36]);"";[$'03.Muestra'.$C36]) ->  | C351: of:=IF( ISBLANK([$'03.Muestra'.$E36]);"";[$'03.Muestra'.$E36]) ->  | E351: of:=IF([.D351]<>"";IF(AND([.B351]<>"";[.C351]<>"");"";"ERR");"") -> 
B352: of:=IF( ISBLANK([$'03.Muestra'.$C37]);"";[$'03.Muestra'.$C37]) ->  | C352: of:=IF( ISBLANK([$'03.Muestra'.$E37]);"";[$'03.Muestra'.$E37]) ->  | E352: of:=IF([.D352]<>"";IF(AND([.B352]<>"";[.C352]<>"");"";"ERR");"") -> 
B353: of:=IF( ISBLANK([$'03.Muestra'.$C38]);"";[$'03.Muestra'.$C38]) ->  | C353: of:=IF( ISBLANK([$'03.Muestra'.$E38]);"";[$'03.Muestra'.$E38]) ->  | E353: of:=IF([.D353]<>"";IF(AND([.B353]<>"";[.C353]<>"");"";"ERR");"") -> 
B354: of:=IF( ISBLANK([$'03.Muestra'.$C39]);"";[$'03.Muestra'.$C39]) ->  | C354: of:=IF( ISBLANK([$'03.Muestra'.$E39]);"";[$'03.Muestra'.$E39]) ->  | E354: of:=IF([.D354]<>"";IF(AND([.B354]<>"";[.C354]<>"");"";"ERR");"") -> 
B355: of:=IF( ISBLANK([$'03.Muestra'.$C40]);"";[$'03.Muestra'.$C40]) ->  | C355: of:=IF( ISBLANK([$'03.Muestra'.$E40]);"";[$'03.Muestra'.$E40]) ->  | E355: of:=IF([.D355]<>"";IF(AND([.B355]<>"";[.C355]<>"");"";"ERR");"") -> 
B356: of:=IF( ISBLANK([$'03.Muestra'.$C41]);"";[$'03.Muestra'.$C41]) ->  | C356: of:=IF( ISBLANK([$'03.Muestra'.$E41]);"";[$'03.Muestra'.$E41]) ->  | E356: of:=IF([.D356]<>"";IF(AND([.B356]<>"";[.C356]<>"");"";"ERR");"") -> 
B357: of:=IF( ISBLANK([$'03.Muestra'.$C42]);"";[$'03.Muestra'.$C42]) ->  | C357: of:=IF( ISBLANK([$'03.Muestra'.$E42]);"";[$'03.Muestra'.$E42]) ->  | E357: of:=IF([.D357]<>"";IF(AND([.B357]<>"";[.C357]<>"");"";"ERR");"") -> 
B360: AA | C360: 3.3.4 Prevención de errores (legales, financieros, datos) | D360: Resultado
B361: of:=IF( ISBLANK([$'03.Muestra'.$C8]);"";[$'03.Muestra'.$C8]) ->  | C361: of:=IF( ISBLANK([$'03.Muestra'.$E8]);"";[$'03.Muestra'.$E8]) ->  | E361: of:=IF([.D361]<>"";IF(AND([.B361]<>"";[.C361]<>"");"";"ERR");"") ->  | F361: N/T | G361: N/D | H361: N/A | I361: Falla | J361: Pasa | K361: En blanco
B362: of:=IF( ISBLANK([$'03.Muestra'.$C9]);"";[$'03.Muestra'.$C9]) ->  | C362: of:=IF( ISBLANK([$'03.Muestra'.$E9]);"";[$'03.Muestra'.$E9]) ->  | E362: of:=IF([.D362]<>"";IF(AND([.B362]<>"";[.C362]<>"");"";"ERR");"") ->  | F362: of:=COUNTIF([.$D361]:INDIRECT("$D" &  SUM(ROW()-1;[$'03.Muestra'.$D$45])-1);[.F361]) -> 0 | G362: of:=COUNTIF([.$D361]:INDIRECT("$D" &  SUM(ROW()-1;[$'03.Muestra'.$D$45])-1);[.G361]) -> 0 | H362: of:=COUNTIF([.$D361]:INDIRECT("$D" &  SUM(ROW()-1;[$'03.Muestra'.$D$45])-1);[.H361]) -> 0 | I362: of:=COUNTIF([.$D361]:INDIRECT("$D" &  SUM(ROW()-1;[$'03.Muestra'.$D$45])-1);[.I361]) -> 0 | J362: of:=COUNTIF([.$D361]:INDIRECT("$D" &  SUM(ROW()-1;[$'03.Muestra'.$D$45])-1);[.J361]) -> 0 | K362: of:=IF([$'03.Muestra'.$D$45]=0;0;COUNTBLANK([.$D361]:INDIRECT("$D" &  SUM(ROW()-1;[$'03.Muestra'.$D$45])-1))) -> 0
B363: of:=IF( ISBLANK([$'03.Muestra'.$C10]);"";[$'03.Muestra'.$C10]) ->  | C363: of:=IF( ISBLANK([$'03.Muestra'.$E10]);"";[$'03.Muestra'.$E10]) ->  | E363: of:=IF([.D363]<>"";IF(AND([.B363]<>"";[.C363]<>"");"";"ERR");"") -> 
B364: of:=IF( ISBLANK([$'03.Muestra'.$C11]);"";[$'03.Muestra'.$C11]) ->  | C364: of:=IF( ISBLANK([$'03.Muestra'.$E11]);"";[$'03.Muestra'.$E11]) ->  | E364: of:=IF([.D364]<>"";IF(AND([.B364]<>"";[.C364]<>"");"";"ERR");"") -> 
B365: of:=IF( ISBLANK([$'03.Muestra'.$C12]);"";[$'03.Muestra'.$C12]) ->  | C365: of:=IF( ISBLANK([$'03.Muestra'.$E12]);"";[$'03.Muestra'.$E12]) ->  | E365: of:=IF([.D365]<>"";IF(AND([.B365]<>"";[.C365]<>"");"";"ERR");"") -> 
B366: of:=IF( ISBLANK([$'03.Muestra'.$C13]);"";[$'03.Muestra'.$C13]) ->  | C366: of:=IF( ISBLANK([$'03.Muestra'.$E13]);"";[$'03.Muestra'.$E13]) ->  | E366: of:=IF([.D366]<>"";IF(AND([.B366]<>"";[.C366]<>"");"";"ERR");"") -> 
B367: of:=IF( ISBLANK([$'03.Muestra'.$C14]);"";[$'03.Muestra'.$C14]) ->  | C367: of:=IF( ISBLANK([$'03.Muestra'.$E14]);"";[$'03.Muestra'.$E14]) ->  | E367: of:=IF([.D367]<>"";IF(AND([.B367]<>"";[.C367]<>"");"";"ERR");"") -> 
B368: of:=IF( ISBLANK([$'03.Muestra'.$C15]);"";[$'03.Muestra'.$C15]) ->  | C368: of:=IF( ISBLANK([$'03.Muestra'.$E15]);"";[$'03.Muestra'.$E15]) ->  | E368: of:=IF([.D368]<>"";IF(AND([.B368]<>"";[.C368]<>"");"";"ERR");"") -> 
B369: of:=IF( ISBLANK([$'03.Muestra'.$C16]);"";[$'03.Muestra'.$C16]) ->  | C369: of:=IF( ISBLANK([$'03.Muestra'.$E16]);"";[$'03.Muestra'.$E16]) ->  | E369: of:=IF([.D369]<>"";IF(AND([.B369]<>"";[.C369]<>"");"";"ERR");"") -> 
B370: of:=IF( ISBLANK([$'03.Muestra'.$C17]);"";[$'03.Muestra'.$C17]) ->  | C370: of:=IF( ISBLANK([$'03.Muestra'.$E17]);"";[$'03.Muestra'.$E17]) ->  | E370: of:=IF([.D370]<>"";IF(AND([.B370]<>"";[.C370]<>"");"";"ERR");"") -> 
B371: of:=IF( ISBLANK([$'03.Muestra'.$C18]);"";[$'03.Muestra'.$C18]) ->  | C371: of:=IF( ISBLANK([$'03.Muestra'.$E18]);"";[$'03.Muestra'.$E18]) ->  | E371: of:=IF([.D371]<>"";IF(AND([.B371]<>"";[.C371]<>"");"";"ERR");"") -> 
B372: of:=IF( ISBLANK([$'03.Muestra'.$C19]);"";[$'03.Muestra'.$C19]) ->  | C372: of:=IF( ISBLANK([$'03.Muestra'.$E19]);"";[$'03.Muestra'.$E19]) ->  | E372: of:=IF([.D372]<>"";IF(AND([.B372]<>"";[.C372]<>"");"";"ERR");"") -> 
B373: of:=IF( ISBLANK([$'03.Muestra'.$C20]);"";[$'03.Muestra'.$C20]) ->  | C373: of:=IF( ISBLANK([$'03.Muestra'.$E20]);"";[$'03.Muestra'.$E20]) ->  | E373: of:=IF([.D373]<>"";IF(AND([.B373]<>"";[.C373]<>"");"";"ERR");"") -> 
B374: of:=IF( ISBLANK([$'03.Muestra'.$C21]);"";[$'03.Muestra'.$C21]) ->  | C374: of:=IF( ISBLANK([$'03.Muestra'.$E21]);"";[$'03.Muestra'.$E21]) ->  | E374: of:=IF([.D374]<>"";IF(AND([.B374]<>"";[.C374]<>"");"";"ERR");"") -> 
B375: of:=IF( ISBLANK([$'03.Muestra'.$C22]);"";[$'03.Muestra'.$C22]) ->  | C375: of:=IF( ISBLANK([$'03.Muestra'.$E22]);"";[$'03.Muestra'.$E22]) ->  | E375: of:=IF([.D375]<>"";IF(AND([.B375]<>"";[.C375]<>"");"";"ERR");"") -> 
B376: of:=IF( ISBLANK([$'03.Muestra'.$C23]);"";[$'03.Muestra'.$C23]) ->  | C376: of:=IF( ISBLANK([$'03.Muestra'.$E23]);"";[$'03.Muestra'.$E23]) ->  | E376: of:=IF([.D376]<>"";IF(AND([.B376]<>"";[.C376]<>"");"";"ERR");"") -> 
B377: of:=IF( ISBLANK([$'03.Muestra'.$C24]);"";[$'03.Muestra'.$C24]) ->  | C377: of:=IF( ISBLANK([$'03.Muestra'.$E24]);"";[$'03.Muestra'.$E24]) ->  | E377: of:=IF([.D377]<>"";IF(AND([.B377]<>"";[.C377]<>"");"";"ERR");"") -> 
B378: of:=IF( ISBLANK([$'03.Muestra'.$C25]);"";[$'03.Muestra'.$C25]) ->  | C378: of:=IF( ISBLANK([$'03.Muestra'.$E25]);"";[$'03.Muestra'.$E25]) ->  | E378: of:=IF([.D378]<>"";IF(AND([.B378]<>"";[.C378]<>"");"";"ERR");"") -> 
B379: of:=IF( ISBLANK([$'03.Muestra'.$C26]);"";[$'03.Muestra'.$C26]) ->  | C379: of:=IF( ISBLANK([$'03.Muestra'.$E26]);"";[$'03.Muestra'.$E26]) ->  | E379: of:=IF([.D379]<>"";IF(AND([.B379]<>"";[.C379]<>"");"";"ERR");"") -> 
B380: of:=IF( ISBLANK([$'03.Muestra'.$C27]);"";[$'03.Muestra'.$C27]) ->  | C380: of:=IF( ISBLANK([$'03.Muestra'.$E27]);"";[$'03.Muestra'.$E27]) ->  | E380: of:=IF([.D380]<>"";IF(AND([.B380]<>"";[.C380]<>"");"";"ERR");"") -> 
B381: of:=IF( ISBLANK([$'03.Muestra'.$C28]);"";[$'03.Muestra'.$C28]) ->  | C381: of:=IF( ISBLANK([$'03.Muestra'.$E28]);"";[$'03.Muestra'.$E28]) ->  | E381: of:=IF([.D381]<>"";IF(AND([.B381]<>"";[.C381]<>"");"";"ERR");"") -> 
B382: of:=IF( ISBLANK([$'03.Muestra'.$C29]);"";[$'03.Muestra'.$C29]) ->  | C382: of:=IF( ISBLANK([$'03.Muestra'.$E29]);"";[$'03.Muestra'.$E29]) ->  | E382: of:=IF([.D382]<>"";IF(AND([.B382]<>"";[.C382]<>"");"";"ERR");"") -> 
B383: of:=IF( ISBLANK([$'03.Muestra'.$C30]);"";[$'03.Muestra'.$C30]) ->  | C383: of:=IF( ISBLANK([$'03.Muestra'.$E30]);"";[$'03.Muestra'.$E30]) ->  | E383: of:=IF([.D383]<>"";IF(AND([.B383]<>"";[.C383]<>"");"";"ERR");"") -> 
B384: of:=IF( ISBLANK([$'03.Muestra'.$C31]);"";[$'03.Muestra'.$C31]) ->  | C384: of:=IF( ISBLANK([$'03.Muestra'.$E31]);"";[$'03.Muestra'.$E31]) ->  | E384: of:=IF([.D384]<>"";IF(AND([.B384]<>"";[.C384]<>"");"";"ERR");"") -> 
B385: of:=IF( ISBLANK([$'03.Muestra'.$C32]);"";[$'03.Muestra'.$C32]) ->  | C385: of:=IF( ISBLANK([$'03.Muestra'.$E32]);"";[$'03.Muestra'.$E32]) ->  | E385: of:=IF([.D385]<>"";IF(AND([.B385]<>"";[.C385]<>"");"";"ERR");"") -> 
B386: of:=IF( ISBLANK([$'03.Muestra'.$C33]);"";[$'03.Muestra'.$C33]) ->  | C386: of:=IF( ISBLANK([$'03.Muestra'.$E33]);"";[$'03.Muestra'.$E33]) ->  | E386: of:=IF([.D386]<>"";IF(AND([.B386]<>"";[.C386]<>"");"";"ERR");"") -> 
B387: of:=IF( ISBLANK([$'03.Muestra'.$C34]);"";[$'03.Muestra'.$C34]) ->  | C387: of:=IF( ISBLANK([$'03.Muestra'.$E34]);"";[$'03.Muestra'.$E34]) ->  | E387: of:=IF([.D387]<>"";IF(AND([.B387]<>"";[.C387]<>"");"";"ERR");"") -> 
B388: of:=IF( ISBLANK([$'03.Muestra'.$C35]);"";[$'03.Muestra'.$C35]) ->  | C388: of:=IF( ISBLANK([$'03.Muestra'.$E35]);"";[$'03.Muestra'.$E35]) ->  | E388: of:=IF([.D388]<>"";IF(AND([.B388]<>"";[.C388]<>"");"";"ERR");"") -> 
B389: of:=IF( ISBLANK([$'03.Muestra'.$C36]);"";[$'03.Muestra'.$C36]) ->  | C389: of:=IF( ISBLANK([$'03.Muestra'.$E36]);"";[$'03.Muestra'.$E36]) ->  | E389: of:=IF([.D389]<>"";IF(AND([.B389]<>"";[.C389]<>"");"";"ERR");"") -> 
B390: of:=IF( ISBLANK([$'03.Muestra'.$C37]);"";[$'03.Muestra'.$C37]) ->  | C390: of:=IF( ISBLANK([$'03.Muestra'.$E37]);"";[$'03.Muestra'.$E37]) ->  | E390: of:=IF([.D390]<>"";IF(AND([.B390]<>"";[.C390]<>"");"";"ERR");"") -> 
B391: of:=IF( ISBLANK([$'03.Muestra'.$C38]);"";[$'03.Muestra'.$C38]) ->  | C391: of:=IF( ISBLANK([$'03.Muestra'.$E38]);"";[$'03.Muestra'.$E38]) ->  | E391: of:=IF([.D391]<>"";IF(AND([.B391]<>"";[.C391]<>"");"";"ERR");"") -> 
B392: of:=IF( ISBLANK([$'03.Muestra'.$C39]);"";[$'03.Muestra'.$C39]) ->  | C392: of:=IF( ISBLANK([$'03.Muestra'.$E39]);"";[$'03.Muestra'.$E39]) ->  | E392: of:=IF([.D392]<>"";IF(AND([.B392]<>"";[.C392]<>"");"";"ERR");"") -> 
B393: of:=IF( ISBLANK([$'03.Muestra'.$C40]);"";[$'03.Muestra'.$C40]) ->  | C393: of:=IF( ISBLANK([$'03.Muestra'.$E40]);"";[$'03.Muestra'.$E40]) ->  | E393: of:=IF([.D393]<>"";IF(AND([.B393]<>"";[.C393]<>"");"";"ERR");"") -> 
B394: of:=IF( ISBLANK([$'03.Muestra'.$C41]);"";[$'03.Muestra'.$C41]) ->  | C394: of:=IF( ISBLANK([$'03.Muestra'.$E41]);"";[$'03.Muestra'.$E41]) ->  | E394: of:=IF([.D394]<>"";IF(AND([.B394]<>"";[.C394]<>"");"";"ERR");"") -> 
B395: of:=IF( ISBLANK([$'03.Muestra'.$C42]);"";[$'03.Muestra'.$C42]) ->  | C395: of:=IF( ISBLANK([$'03.Muestra'.$E42]);"";[$'03.Muestra'.$E42]) ->  | E395: of:=IF([.D395]<>"";IF(AND([.B395]<>"";[.C395]<>"");"";"ERR");"") -> 

Sheet: P4.Robusto
B2: Informe de revisión de la accesibilidad
B3: Análisis de accesibilidad en profundidad de un sitio web
B5: Revisión de la muestra
B8: Principio 4: Robusto
B9: El contenido debe ser lo suficientemente robusto para que pueda ser interpretado de manera confiable
B11: Criterios de Conformidad | F11: EVALUADOS | G11: N.º Criterios x N.º Páginas | H11: % | J11: PENDIENTES | K11: N.º Criterios x N.º Páginas | L11: %
B12: A | C12: 2 | F12: Pasa | G12: of:=[.J20]+[.J58]+[.J96] -> 0 | H12: of:=IF(([.$G$15]+[.$K$15])=0;0;[.G12]/([.$G$15]+[.$K$15])) -> 0 | J12: No decide | K12: of:=[.G20]+[.G58]+[.G96] -> 0 | L12: of:=IF(([.$G$15]+[.$K$15])=0;0;[.K12]/([.$G$15]+[.$K$15])) -> 0
B13: AA | C13: 1 | F13: Falla | G13: of:=[.I20]+[.I58]+[.I96] -> 0 | H13: of:=IF(([.$G$15]+[.$K$15])=0;0;[.G13]/([.$G$15]+[.$K$15])) -> 0 | J13: No testeado | K13: of:=[.F20]+[.F58]+[.F96] -> 0 | L13: of:=IF(([.$G$15]+[.$K$15])=0;0;[.K13]/([.$G$15]+[.$K$15])) -> 0
B14: Total | C14: of:=SUM([.C12:.C13]) -> 3 | F14: No aplica | G14: of:=[.H20]+[.H58]+[.H96] -> 0 | H14: of:=IF(([.$G$15]+[.$K$15])=0;0;[.G14]/([.$G$15]+[.$K$15])) -> 0 | J14: En blanco | K14: of:=[.K20]+[.K58]+[.K96] -> 0 | L14: of:=IF(([.$G$15]+[.$K$15])=0;0;[.K14]/([.$G$15]+[.$K$15])) -> 0
F15: Total | G15: of:=SUM([.G12:.G14]) -> 0 | H15: of:=SUM([.H12:.H14]) -> 0 | J15: Total | K15: of:=SUM([.K12:.K14]) -> 0 | L15: of:=SUM([.L12:.L14]) -> 0
B18: A | C18: 4.1.1 Procesamiento | D18: Resultado
B19: of:=IF( ISBLANK([$'03.Muestra'.$C8]);"";[$'03.Muestra'.$C8]) ->  | C19: of:=IF( ISBLANK([$'03.Muestra'.$E8]);"";[$'03.Muestra'.$E8]) ->  | E19: of:=IF([.D19]<>"";IF(AND([.B19]<>"";[.C19]<>"");"";"ERR");"") ->  | F19: N/T | G19: N/D | H19: N/A | I19: Falla | J19: Pasa | K19: En blanco
B20: of:=IF( ISBLANK([$'03.Muestra'.$C9]);"";[$'03.Muestra'.$C9]) ->  | C20: of:=IF( ISBLANK([$'03.Muestra'.$E9]);"";[$'03.Muestra'.$E9]) ->  | E20: of:=IF([.D20]<>"";IF(AND([.B20]<>"";[.C20]<>"");"";"ERR");"") ->  | F20: of:=COUNTIF([.$D19]:INDIRECT("$D" &  SUM(ROW()-1;[$'03.Muestra'.$D$45])-1);[.F19]) -> 0 | G20: of:=COUNTIF([.$D19]:INDIRECT("$D" &  SUM(ROW()-1;[$'03.Muestra'.$D$45])-1);[.G19]) -> 0 | H20: of:=COUNTIF([.$D19]:INDIRECT("$D" &  SUM(ROW()-1;[$'03.Muestra'.$D$45])-1);[.H19]) -> 0 | I20: of:=COUNTIF([.$D19]:INDIRECT("$D" &  SUM(ROW()-1;[$'03.Muestra'.$D$45])-1);[.I19]) -> 0 | J20: of:=COUNTIF([.$D19]:INDIRECT("$D" &  SUM(ROW()-1;[$'03.Muestra'.$D$45])-1);[.J19]) -> 0 | K20: of:=IF([$'03.Muestra'.$D$45]=0;0;COUNTBLANK([.$D19]:INDIRECT("$D" &  SUM(ROW()-1;[$'03.Muestra'.$D$45])-1))) -> 0
B21: of:=IF( ISBLANK([$'03.Muestra'.$C10]);"";[$'03.Muestra'.$C10]) ->  | C21: of:=IF( ISBLANK([$'03.Muestra'.$E10]);"";[$'03.Muestra'.$E10]) ->  | E21: of:=IF([.D21]<>"";IF(AND([.B21]<>"";[.C21]<>"");"";"ERR");"") -> 
B22: of:=IF( ISBLANK([$'03.Muestra'.$C11]);"";[$'03.Muestra'.$C11]) ->  | C22: of:=IF( ISBLANK([$'03.Muestra'.$E11]);"";[$'03.Muestra'.$E11]) ->  | E22: of:=IF([.D22]<>"";IF(AND([.B22]<>"";[.C22]<>"");"";"ERR");"") ->  | K22: N/T | L22: No Testeado
B23: of:=IF( ISBLANK([$'03.Muestra'.$C12]);"";[$'03.Muestra'.$C12]) ->  | C23: of:=IF( ISBLANK([$'03.Muestra'.$E12]);"";[$'03.Muestra'.$E12]) ->  | E23: of:=IF([.D23]<>"";IF(AND([.B23]<>"";[.C23]<>"");"";"ERR");"") ->  | K23: N/A | L23: No Aplica
B24: of:=IF( ISBLANK([$'03.Muestra'.$C13]);"";[$'03.Muestra'.$C13]) ->  | C24: of:=IF( ISBLANK([$'03.Muestra'.$E13]);"";[$'03.Muestra'.$E13]) ->  | E24: of:=IF([.D24]<>"";IF(AND([.B24]<>"";[.C24]<>"");"";"ERR");"") ->  | K24: N/D | L24: No Decide
B25: of:=IF( ISBLANK([$'03.Muestra'.$C14]);"";[$'03.Muestra'.$C14]) ->  | C25: of:=IF( ISBLANK([$'03.Muestra'.$E14]);"";[$'03.Muestra'.$E14]) ->  | E25: of:=IF([.D25]<>"";IF(AND([.B25]<>"";[.C25]<>"");"";"ERR");"") -> 
B26: of:=IF( ISBLANK([$'03.Muestra'.$C15]);"";[$'03.Muestra'.$C15]) ->  | C26: of:=IF( ISBLANK([$'03.Muestra'.$E15]);"";[$'03.Muestra'.$E15]) ->  | E26: of:=IF([.D26]<>"";IF(AND([.B26]<>"";[.C26]<>"");"";"ERR");"") -> 
B27: of:=IF( ISBLANK([$'03.Muestra'.$C16]);"";[$'03.Muestra'.$C16]) ->  | C27: of:=IF( ISBLANK([$'03.Muestra'.$E16]);"";[$'03.Muestra'.$E16]) ->  | E27: of:=IF([.D27]<>"";IF(AND([.B27]<>"";[.C27]<>"");"";"ERR");"") -> 
B28: of:=IF( ISBLANK([$'03.Muestra'.$C17]);"";[$'03.Muestra'.$C17]) ->  | C28: of:=IF( ISBLANK([$'03.Muestra'.$E17]);"";[$'03.Muestra'.$E17]) ->  | E28: of:=IF([.D28]<>"";IF(AND([.B28]<>"";[.C28]<>"");"";"ERR");"") -> 
B29: of:=IF( ISBLANK([$'03.Muestra'.$C18]);"";[$'03.Muestra'.$C18]) ->  | C29: of:=IF( ISBLANK([$'03.Muestra'.$E18]);"";[$'03.Muestra'.$E18]) ->  | E29: of:=IF([.D29]<>"";IF(AND([.B29]<>"";[.C29]<>"");"";"ERR");"") -> 
B30: of:=IF( ISBLANK([$'03.Muestra'.$C19]);"";[$'03.Muestra'.$C19]) ->  | C30: of:=IF( ISBLANK([$'03.Muestra'.$E19]);"";[$'03.Muestra'.$E19]) ->  | E30: of:=IF([.D30]<>"";IF(AND([.B30]<>"";[.C30]<>"");"";"ERR");"") -> 
B31: of:=IF( ISBLANK([$'03.Muestra'.$C20]);"";[$'03.Muestra'.$C20]) ->  | C31: of:=IF( ISBLANK([$'03.Muestra'.$E20]);"";[$'03.Muestra'.$E20]) ->  | E31: of:=IF([.D31]<>"";IF(AND([.B31]<>"";[.C31]<>"");"";"ERR");"") -> 
B32: of:=IF( ISBLANK([$'03.Muestra'.$C21]);"";[$'03.Muestra'.$C21]) ->  | C32: of:=IF( ISBLANK([$'03.Muestra'.$E21]);"";[$'03.Muestra'.$E21]) ->  | E32: of:=IF([.D32]<>"";IF(AND([.B32]<>"";[.C32]<>"");"";"ERR");"") -> 
B33: of:=IF( ISBLANK([$'03.Muestra'.$C22]);"";[$'03.Muestra'.$C22]) ->  | C33: of:=IF( ISBLANK([$'03.Muestra'.$E22]);"";[$'03.Muestra'.$E22]) ->  | E33: of:=IF([.D33]<>"";IF(AND([.B33]<>"";[.C33]<>"");"";"ERR");"") -> 
B34: of:=IF( ISBLANK([$'03.Muestra'.$C23]);"";[$'03.Muestra'.$C23]) ->  | C34: of:=IF( ISBLANK([$'03.Muestra'.$E23]);"";[$'03.Muestra'.$E23]) ->  | E34: of:=IF([.D34]<>"";IF(AND([.B34]<>"";[.C34]<>"");"";"ERR");"") -> 
B35: of:=IF( ISBLANK([$'03.Muestra'.$C24]);"";[$'03.Muestra'.$C24]) ->  | C35: of:=IF( ISBLANK([$'03.Muestra'.$E24]);"";[$'03.Muestra'.$E24]) ->  | E35: of:=IF([.D35]<>"";IF(AND([.B35]<>"";[.C35]<>"");"";"ERR");"") -> 
B36: of:=IF( ISBLANK([$'03.Muestra'.$C25]);"";[$'03.Muestra'.$C25]) ->  | C36: of:=IF( ISBLANK([$'03.Muestra'.$E25]);"";[$'03.Muestra'.$E25]) ->  | E36: of:=IF([.D36]<>"";IF(AND([.B36]<>"";[.C36]<>"");"";"ERR");"") -> 
B37: of:=IF( ISBLANK([$'03.Muestra'.$C26]);"";[$'03.Muestra'.$C26]) ->  | C37: of:=IF( ISBLANK([$'03.Muestra'.$E26]);"";[$'03.Muestra'.$E26]) ->  | E37: of:=IF([.D37]<>"";IF(AND([.B37]<>"";[.C37]<>"");"";"ERR");"") -> 
B38: of:=IF( ISBLANK([$'03.Muestra'.$C27]);"";[$'03.Muestra'.$C27]) ->  | C38: of:=IF( ISBLANK([$'03.Muestra'.$E27]);"";[$'03.Muestra'.$E27]) ->  | E38: of:=IF([.D38]<>"";IF(AND([.B38]<>"";[.C38]<>"");"";"ERR");"") -> 
B39: of:=IF( ISBLANK([$'03.Muestra'.$C28]);"";[$'03.Muestra'.$C28]) ->  | C39: of:=IF( ISBLANK([$'03.Muestra'.$E28]);"";[$'03.Muestra'.$E28]) ->  | E39: of:=IF([.D39]<>"";IF(AND([.B39]<>"";[.C39]<>"");"";"ERR");"") -> 
B40: of:=IF( ISBLANK([$'03.Muestra'.$C29]);"";[$'03.Muestra'.$C29]) ->  | C40: of:=IF( ISBLANK([$'03.Muestra'.$E29]);"";[$'03.Muestra'.$E29]) ->  | E40: of:=IF([.D40]<>"";IF(AND([.B40]<>"";[.C40]<>"");"";"ERR");"") -> 
B41: of:=IF( ISBLANK([$'03.Muestra'.$C30]);"";[$'03.Muestra'.$C30]) ->  | C41: of:=IF( ISBLANK([$'03.Muestra'.$E30]);"";[$'03.Muestra'.$E30]) ->  | E41: of:=IF([.D41]<>"";IF(AND([.B41]<>"";[.C41]<>"");"";"ERR");"") -> 
B42: of:=IF( ISBLANK([$'03.Muestra'.$C31]);"";[$'03.Muestra'.$C31]) ->  | C42: of:=IF( ISBLANK([$'03.Muestra'.$E31]);"";[$'03.Muestra'.$E31]) ->  | E42: of:=IF([.D42]<>"";IF(AND([.B42]<>"";[.C42]<>"");"";"ERR");"") -> 
B43: of:=IF( ISBLANK([$'03.Muestra'.$C32]);"";[$'03.Muestra'.$C32]) ->  | C43: of:=IF( ISBLANK([$'03.Muestra'.$E32]);"";[$'03.Muestra'.$E32]) ->  | E43: of:=IF([.D43]<>"";IF(AND([.B43]<>"";[.C43]<>"");"";"ERR");"") -> 
B44: of:=IF( ISBLANK([$'03.Muestra'.$C33]);"";[$'03.Muestra'.$C33]) ->  | C44: of:=IF( ISBLANK([$'03.Muestra'.$E33]);"";[$'03.Muestra'.$E33]) ->  | E44: of:=IF([.D44]<>"";IF(AND([.B44]<>"";[.C44]<>"");"";"ERR");"") -> 
B45: of:=IF( ISBLANK([$'03.Muestra'.$C34]);"";[$'03.Muestra'.$C34]) ->  | C45: of:=IF( ISBLANK([$'03.Muestra'.$E34]);"";[$'03.Muestra'.$E34]) ->  | E45: of:=IF([.D45]<>"";IF(AND([.B45]<>"";[.C45]<>"");"";"ERR");"") -> 
B46: of:=IF( ISBLANK([$'03.Muestra'.$C35]);"";[$'03.Muestra'.$C35]) ->  | C46: of:=IF( ISBLANK([$'03.Muestra'.$E35]);"";[$'03.Muestra'.$E35]) ->  | E46: of:=IF([.D46]<>"";IF(AND([.B46]<>"";[.C46]<>"");"";"ERR");"") -> 
B47: of:=IF( ISBLANK([$'03.Muestra'.$C36]);"";[$'03.Muestra'.$C36]) ->  | C47: of:=IF( ISBLANK([$'03.Muestra'.$E36]);"";[$'03.Muestra'.$E36]) ->  | E47: of:=IF([.D47]<>"";IF(AND([.B47]<>"";[.C47]<>"");"";"ERR");"") -> 
B48: of:=IF( ISBLANK([$'03.Muestra'.$C37]);"";[$'03.Muestra'.$C37]) ->  | C48: of:=IF( ISBLANK([$'03.Muestra'.$E37]);"";[$'03.Muestra'.$E37]) ->  | E48: of:=IF([.D48]<>"";IF(AND([.B48]<>"";[.C48]<>"");"";"ERR");"") -> 
B49: of:=IF( ISBLANK([$'03.Muestra'.$C38]);"";[$'03.Muestra'.$C38]) ->  | C49: of:=IF( ISBLANK([$'03.Muestra'.$E38]);"";[$'03.Muestra'.$E38]) ->  | E49: of:=IF([.D49]<>"";IF(AND([.B49]<>"";[.C49]<>"");"";"ERR");"") -> 
B50: of:=IF( ISBLANK([$'03.Muestra'.$C39]);"";[$'03.Muestra'.$C39]) ->  | C50: of:=IF( ISBLANK([$'03.Muestra'.$E39]);"";[$'03.Muestra'.$E39]) ->  | E50: of:=IF([.D50]<>"";IF(AND([.B50]<>"";[.C50]<>"");"";"ERR");"") -> 
B51: of:=IF( ISBLANK([$'03.Muestra'.$C40]);"";[$'03.Muestra'.$C40]) ->  | C51: of:=IF( ISBLANK([$'03.Muestra'.$E40]);"";[$'03.Muestra'.$E40]) ->  | E51: of:=IF([.D51]<>"";IF(AND([.B51]<>"";[.C51]<>"");"";"ERR");"") -> 
B52: of:=IF( ISBLANK([$'03.Muestra'.$C41]);"";[$'03.Muestra'.$C41]) ->  | C52: of:=IF( ISBLANK([$'03.Muestra'.$E41]);"";[$'03.Muestra'.$E41]) ->  | E52: of:=IF([.D52]<>"";IF(AND([.B52]<>"";[.C52]<>"");"";"ERR");"") -> 
B53: of:=IF( ISBLANK([$'03.Muestra'.$C42]);"";[$'03.Muestra'.$C42]) ->  | C53: of:=IF( ISBLANK([$'03.Muestra'.$E42]);"";[$'03.Muestra'.$E42]) ->  | E53: of:=IF([.D53]<>"";IF(AND([.B53]<>"";[.C53]<>"");"";"ERR");"") -> 
B56: A | C56: 4.1.2 Nombre, función, valor | D56: Resultado
B57: of:=IF( ISBLANK([$'03.Muestra'.$C8]);"";[$'03.Muestra'.$C8]) ->  | C57: of:=IF( ISBLANK([$'03.Muestra'.$E8]);"";[$'03.Muestra'.$E8]) ->  | E57: of:=IF([.D57]<>"";IF(AND([.B57]<>"";[.C57]<>"");"";"ERR");"") ->  | F57: N/T | G57: N/D | H57: N/A | I57: Falla | J57: Pasa | K57: En blanco
B58: of:=IF( ISBLANK([$'03.Muestra'.$C9]);"";[$'03.Muestra'.$C9]) ->  | C58: of:=IF( ISBLANK([$'03.Muestra'.$E9]);"";[$'03.Muestra'.$E9]) ->  | E58: of:=IF([.D58]<>"";IF(AND([.B58]<>"";[.C58]<>"");"";"ERR");"") ->  | F58: of:=COUNTIF([.$D57]:INDIRECT("$D" &  SUM(ROW()-1;[$'03.Muestra'.$D$45])-1);[.F57]) -> 0 | G58: of:=COUNTIF([.$D57]:INDIRECT("$D" &  SUM(ROW()-1;[$'03.Muestra'.$D$45])-1);[.G57]) -> 0 | H58: of:=COUNTIF([.$D57]:INDIRECT("$D" &  SUM(ROW()-1;[$'03.Muestra'.$D$45])-1);[.H57]) -> 0 | I58: of:=COUNTIF([.$D57]:INDIRECT("$D" &  SUM(ROW()-1;[$'03.Muestra'.$D$45])-1);[.I57]) -> 0 | J58: of:=COUNTIF([.$D57]:INDIRECT("$D" &  SUM(ROW()-1;[$'03.Muestra'.$D$45])-1);[.J57]) -> 0 | K58: of:=IF([$'03.Muestra'.$D$45]=0;0;COUNTBLANK([.$D57]:INDIRECT("$D" &  SUM(ROW()-1;[$'03.Muestra'.$D$45])-1))) -> 0
B59: of:=IF( ISBLANK([$'03.Muestra'.$C10]);"";[$'03.Muestra'.$C10]) ->  | C59: of:=IF( ISBLANK([$'03.Muestra'.$E10]);"";[$'03.Muestra'.$E10]) ->  | E59: of:=IF([.D59]<>"";IF(AND([.B59]<>"";[.C59]<>"");"";"ERR");"") -> 
B60: of:=IF( ISBLANK([$'03.Muestra'.$C11]);"";[$'03.Muestra'.$C11]) ->  | C60: of:=IF( ISBLANK([$'03.Muestra'.$E11]);"";[$'03.Muestra'.$E11]) ->  | E60: of:=IF([.D60]<>"";IF(AND([.B60]<>"";[.C60]<>"");"";"ERR");"") -> 
B61: of:=IF( ISBLANK([$'03.Muestra'.$C12]);"";[$'03.Muestra'.$C12]) ->  | C61: of:=IF( ISBLANK([$'03.Muestra'.$E12]);"";[$'03.Muestra'.$E12]) ->  | E61: of:=IF([.D61]<>"";IF(AND([.B61]<>"";[.C61]<>"");"";"ERR");"") -> 
B62: of:=IF( ISBLANK([$'03.Muestra'.$C13]);"";[$'03.Muestra'.$C13]) ->  | C62: of:=IF( ISBLANK([$'03.Muestra'.$E13]);"";[$'03.Muestra'.$E13]) ->  | E62: of:=IF([.D62]<>"";IF(AND([.B62]<>"";[.C62]<>"");"";"ERR");"") -> 
B63: of:=IF( ISBLANK([$'03.Muestra'.$C14]);"";[$'03.Muestra'.$C14]) ->  | C63: of:=IF( ISBLANK([$'03.Muestra'.$E14]);"";[$'03.Muestra'.$E14]) ->  | E63: of:=IF([.D63]<>"";IF(AND([.B63]<>"";[.C63]<>"");"";"ERR");"") -> 
B64: of:=IF( ISBLANK([$'03.Muestra'.$C15]);"";[$'03.Muestra'.$C15]) ->  | C64: of:=IF( ISBLANK([$'03.Muestra'.$E15]);"";[$'03.Muestra'.$E15]) ->  | E64: of:=IF([.D64]<>"";IF(AND([.B64]<>"";[.C64]<>"");"";"ERR");"") -> 
B65: of:=IF( ISBLANK([$'03.Muestra'.$C16]);"";[$'03.Muestra'.$C16]) ->  | C65: of:=IF( ISBLANK([$'03.Muestra'.$E16]);"";[$'03.Muestra'.$E16]) ->  | E65: of:=IF([.D65]<>"";IF(AND([.B65]<>"";[.C65]<>"");"";"ERR");"") -> 
B66: of:=IF( ISBLANK([$'03.Muestra'.$C17]);"";[$'03.Muestra'.$C17]) ->  | C66: of:=IF( ISBLANK([$'03.Muestra'.$E17]);"";[$'03.Muestra'.$E17]) ->  | E66: of:=IF([.D66]<>"";IF(AND([.B66]<>"";[.C66]<>"");"";"ERR");"") -> 
B67: of:=IF( ISBLANK([$'03.Muestra'.$C18]);"";[$'03.Muestra'.$C18]) ->  | C67: of:=IF( ISBLANK([$'03.Muestra'.$E18]);"";[$'03.Muestra'.$E18]) ->  | E67: of:=IF([.D67]<>"";IF(AND([.B67]<>"";[.C67]<>"");"";"ERR");"") -> 
B68: of:=IF( ISBLANK([$'03.Muestra'.$C19]);"";[$'03.Muestra'.$C19]) ->  | C68: of:=IF( ISBLANK([$'03.Muestra'.$E19]);"";[$'03.Muestra'.$E19]) ->  | E68: of:=IF([.D68]<>"";IF(AND([.B68]<>"";[.C68]<>"");"";"ERR");"") -> 
B69: of:=IF( ISBLANK([$'03.Muestra'.$C20]);"";[$'03.Muestra'.$C20]) ->  | C69: of:=IF( ISBLANK([$'03.Muestra'.$E20]);"";[$'03.Muestra'.$E20]) ->  | E69: of:=IF([.D69]<>"";IF(AND([.B69]<>"";[.C69]<>"");"";"ERR");"") -> 
B70: of:=IF( ISBLANK([$'03.Muestra'.$C21]);"";[$'03.Muestra'.$C21]) ->  | C70: of:=IF( ISBLANK([$'03.Muestra'.$E21]);"";[$'03.Muestra'.$E21]) ->  | E70: of:=IF([.D70]<>"";IF(AND([.B70]<>"";[.C70]<>"");"";"ERR");"") -> 
B71: of:=IF( ISBLANK([$'03.Muestra'.$C22]);"";[$'03.Muestra'.$C22]) ->  | C71: of:=IF( ISBLANK([$'03.Muestra'.$E22]);"";[$'03.Muestra'.$E22]) ->  | E71: of:=IF([.D71]<>"";IF(AND([.B71]<>"";[.C71]<>"");"";"ERR");"") -> 
B72: of:=IF( ISBLANK([$'03.Muestra'.$C23]);"";[$'03.Muestra'.$C23]) ->  | C72: of:=IF( ISBLANK([$'03.Muestra'.$E23]);"";[$'03.Muestra'.$E23]) ->  | E72: of:=IF([.D72]<>"";IF(AND([.B72]<>"";[.C72]<>"");"";"ERR");"") -> 
B73: of:=IF( ISBLANK([$'03.Muestra'.$C24]);"";[$'03.Muestra'.$C24]) ->  | C73: of:=IF( ISBLANK([$'03.Muestra'.$E24]);"";[$'03.Muestra'.$E24]) ->  | E73: of:=IF([.D73]<>"";IF(AND([.B73]<>"";[.C73]<>"");"";"ERR");"") -> 
B74: of:=IF( ISBLANK([$'03.Muestra'.$C25]);"";[$'03.Muestra'.$C25]) ->  | C74: of:=IF( ISBLANK([$'03.Muestra'.$E25]);"";[$'03.Muestra'.$E25]) ->  | E74: of:=IF([.D74]<>"";IF(AND([.B74]<>"";[.C74]<>"");"";"ERR");"") -> 
B75: of:=IF( ISBLANK([$'03.Muestra'.$C26]);"";[$'03.Muestra'.$C26]) ->  | C75: of:=IF( ISBLANK([$'03.Muestra'.$E26]);"";[$'03.Muestra'.$E26]) ->  | E75: of:=IF([.D75]<>"";IF(AND([.B75]<>"";[.C75]<>"");"";"ERR");"") -> 
B76: of:=IF( ISBLANK([$'03.Muestra'.$C27]);"";[$'03.Muestra'.$C27]) ->  | C76: of:=IF( ISBLANK([$'03.Muestra'.$E27]);"";[$'03.Muestra'.$E27]) ->  | E76: of:=IF([.D76]<>"";IF(AND([.B76]<>"";[.C76]<>"");"";"ERR");"") -> 
B77: of:=IF( ISBLANK([$'03.Muestra'.$C28]);"";[$'03.Muestra'.$C28]) ->  | C77: of:=IF( ISBLANK([$'03.Muestra'.$E28]);"";[$'03.Muestra'.$E28]) ->  | E77: of:=IF([.D77]<>"";IF(AND([.B77]<>"";[.C77]<>"");"";"ERR");"") -> 
B78: of:=IF( ISBLANK([$'03.Muestra'.$C29]);"";[$'03.Muestra'.$C29]) ->  | C78: of:=IF( ISBLANK([$'03.Muestra'.$E29]);"";[$'03.Muestra'.$E29]) ->  | E78: of:=IF([.D78]<>"";IF(AND([.B78]<>"";[.C78]<>"");"";"ERR");"") -> 
B79: of:=IF( ISBLANK([$'03.Muestra'.$C30]);"";[$'03.Muestra'.$C30]) ->  | C79: of:=IF( ISBLANK([$'03.Muestra'.$E30]);"";[$'03.Muestra'.$E30]) ->  | E79: of:=IF([.D79]<>"";IF(AND([.B79]<>"";[.C79]<>"");"";"ERR");"") -> 
B80: of:=IF( ISBLANK([$'03.Muestra'.$C31]);"";[$'03.Muestra'.$C31]) ->  | C80: of:=IF( ISBLANK([$'03.Muestra'.$E31]);"";[$'03.Muestra'.$E31]) ->  | E80: of:=IF([.D80]<>"";IF(AND([.B80]<>"";[.C80]<>"");"";"ERR");"") -> 
B81: of:=IF( ISBLANK([$'03.Muestra'.$C32]);"";[$'03.Muestra'.$C32]) ->  | C81: of:=IF( ISBLANK([$'03.Muestra'.$E32]);"";[$'03.Muestra'.$E32]) ->  | E81: of:=IF([.D81]<>"";IF(AND([.B81]<>"";[.C81]<>"");"";"ERR");"") -> 
B82: of:=IF( ISBLANK([$'03.Muestra'.$C33]);"";[$'03.Muestra'.$C33]) ->  | C82: of:=IF( ISBLANK([$'03.Muestra'.$E33]);"";[$'03.Muestra'.$E33]) ->  | E82: of:=IF([.D82]<>"";IF(AND([.B82]<>"";[.C82]<>"");"";"ERR");"") -> 
B83: of:=IF( ISBLANK([$'03.Muestra'.$C34]);"";[$'03.Muestra'.$C34]) ->  | C83: of:=IF( ISBLANK([$'03.Muestra'.$E34]);"";[$'03.Muestra'.$E34]) ->  | E83: of:=IF([.D83]<>"";IF(AND([.B83]<>"";[.C83]<>"");"";"ERR");"") -> 
B84: of:=IF( ISBLANK([$'03.Muestra'.$C35]);"";[$'03.Muestra'.$C35]) ->  | C84: of:=IF( ISBLANK([$'03.Muestra'.$E35]);"";[$'03.Muestra'.$E35]) ->  | E84: of:=IF([.D84]<>"";IF(AND([.B84]<>"";[.C84]<>"");"";"ERR");"") -> 
B85: of:=IF( ISBLANK([$'03.Muestra'.$C36]);"";[$'03.Muestra'.$C36]) ->  | C85: of:=IF( ISBLANK([$'03.Muestra'.$E36]);"";[$'03.Muestra'.$E36]) ->  | E85: of:=IF([.D85]<>"";IF(AND([.B85]<>"";[.C85]<>"");"";"ERR");"") -> 
B86: of:=IF( ISBLANK([$'03.Muestra'.$C37]);"";[$'03.Muestra'.$C37]) ->  | C86: of:=IF( ISBLANK([$'03.Muestra'.$E37]);"";[$'03.Muestra'.$E37]) ->  | E86: of:=IF([.D86]<>"";IF(AND([.B86]<>"";[.C86]<>"");"";"ERR");"") -> 
B87: of:=IF( ISBLANK([$'03.Muestra'.$C38]);"";[$'03.Muestra'.$C38]) ->  | C87: of:=IF( ISBLANK([$'03.Muestra'.$E38]);"";[$'03.Muestra'.$E38]) ->  | E87: of:=IF([.D87]<>"";IF(AND([.B87]<>"";[.C87]<>"");"";"ERR");"") -> 
B88: of:=IF( ISBLANK([$'03.Muestra'.$C39]);"";[$'03.Muestra'.$C39]) ->  | C88: of:=IF( ISBLANK([$'03.Muestra'.$E39]);"";[$'03.Muestra'.$E39]) ->  | E88: of:=IF([.D88]<>"";IF(AND([.B88]<>"";[.C88]<>"");"";"ERR");"") -> 
B89: of:=IF( ISBLANK([$'03.Muestra'.$C40]);"";[$'03.Muestra'.$C40]) ->  | C89: of:=IF( ISBLANK([$'03.Muestra'.$E40]);"";[$'03.Muestra'.$E40]) ->  | E89: of:=IF([.D89]<>"";IF(AND([.B89]<>"";[.C89]<>"");"";"ERR");"") -> 
B90: of:=IF( ISBLANK([$'03.Muestra'.$C41]);"";[$'03.Muestra'.$C41]) ->  | C90: of:=IF( ISBLANK([$'03.Muestra'.$E41]);"";[$'03.Muestra'.$E41]) ->  | E90: of:=IF([.D90]<>"";IF(AND([.B90]<>"";[.C90]<>"");"";"ERR");"") -> 
B91: of:=IF( ISBLANK([$'03.Muestra'.$C42]);"";[$'03.Muestra'.$C42]) ->  | C91: of:=IF( ISBLANK([$'03.Muestra'.$E42]);"";[$'03.Muestra'.$E42]) ->  | E91: of:=IF([.D91]<>"";IF(AND([.B91]<>"";[.C91]<>"");"";"ERR");"") -> 
B94: AA | C94: 4.1.3 Mensajes de estado | D94: Resultado
B95: of:=IF( ISBLANK([$'03.Muestra'.$C8]);"";[$'03.Muestra'.$C8]) ->  | C95: of:=IF( ISBLANK([$'03.Muestra'.$E8]);"";[$'03.Muestra'.$E8]) ->  | E95: of:=IF([.D95]<>"";IF(AND([.B95]<>"";[.C95]<>"");"";"ERR");"") ->  | F95: N/T | G95: N/D | H95: N/A | I95: Falla | J95: Pasa | K95: En blanco
B96: of:=IF( ISBLANK([$'03.Muestra'.$C9]);"";[$'03.Muestra'.$C9]) ->  | C96: of:=IF( ISBLANK([$'03.Muestra'.$E9]);"";[$'03.Muestra'.$E9]) ->  | E96: of:=IF([.D96]<>"";IF(AND([.B96]<>"";[.C96]<>"");"";"ERR");"") ->  | F96: of:=COUNTIF([.$D95]:INDIRECT("$D" &  SUM(ROW()-1;[$'03.Muestra'.$D$45])-1);[.F95]) -> 0 | G96: of:=COUNTIF([.$D95]:INDIRECT("$D" &  SUM(ROW()-1;[$'03.Muestra'.$D$45])-1);[.G95]) -> 0 | H96: of:=COUNTIF([.$D95]:INDIRECT("$D" &  SUM(ROW()-1;[$'03.Muestra'.$D$45])-1);[.H95]) -> 0 | I96: of:=COUNTIF([.$D95]:INDIRECT("$D" &  SUM(ROW()-1;[$'03.Muestra'.$D$45])-1);[.I95]) -> 0 | J96: of:=COUNTIF([.$D95]:INDIRECT("$D" &  SUM(ROW()-1;[$'03.Muestra'.$D$45])-1);[.J95]) -> 0 | K96: of:=IF([$'03.Muestra'.$D$45]=0;0;COUNTBLANK([.$D95]:INDIRECT("$D" &  SUM(ROW()-1;[$'03.Muestra'.$D$45])-1))) -> 0
B97: of:=IF( ISBLANK([$'03.Muestra'.$C10]);"";[$'03.Muestra'.$C10]) ->  | C97: of:=IF( ISBLANK([$'03.Muestra'.$E10]);"";[$'03.Muestra'.$E10]) ->  | E97: of:=IF([.D97]<>"";IF(AND([.B97]<>"";[.C97]<>"");"";"ERR");"") -> 
B98: of:=IF( ISBLANK([$'03.Muestra'.$C11]);"";[$'03.Muestra'.$C11]) ->  | C98: of:=IF( ISBLANK([$'03.Muestra'.$E11]);"";[$'03.Muestra'.$E11]) ->  | E98: of:=IF([.D98]<>"";IF(AND([.B98]<>"";[.C98]<>"");"";"ERR");"") -> 
B99: of:=IF( ISBLANK([$'03.Muestra'.$C12]);"";[$'03.Muestra'.$C12]) ->  | C99: of:=IF( ISBLANK([$'03.Muestra'.$E12]);"";[$'03.Muestra'.$E12]) ->  | E99: of:=IF([.D99]<>"";IF(AND([.B99]<>"";[.C99]<>"");"";"ERR");"") -> 
B100: of:=IF( ISBLANK([$'03.Muestra'.$C13]);"";[$'03.Muestra'.$C13]) ->  | C100: of:=IF( ISBLANK([$'03.Muestra'.$E13]);"";[$'03.Muestra'.$E13]) ->  | E100: of:=IF([.D100]<>"";IF(AND([.B100]<>"";[.C100]<>"");"";"ERR");"") -> 
B101: of:=IF( ISBLANK([$'03.Muestra'.$C14]);"";[$'03.Muestra'.$C14]) ->  | C101: of:=IF( ISBLANK([$'03.Muestra'.$E14]);"";[$'03.Muestra'.$E14]) ->  | E101: of:=IF([.D101]<>"";IF(AND([.B101]<>"";[.C101]<>"");"";"ERR");"") -> 
B102: of:=IF( ISBLANK([$'03.Muestra'.$C15]);"";[$'03.Muestra'.$C15]) ->  | C102: of:=IF( ISBLANK([$'03.Muestra'.$E15]);"";[$'03.Muestra'.$E15]) ->  | E102: of:=IF([.D102]<>"";IF(AND([.B102]<>"";[.C102]<>"");"";"ERR");"") -> 
B103: of:=IF( ISBLANK([$'03.Muestra'.$C16]);"";[$'03.Muestra'.$C16]) ->  | C103: of:=IF( ISBLANK([$'03.Muestra'.$E16]);"";[$'03.Muestra'.$E16]) ->  | E103: of:=IF([.D103]<>"";IF(AND([.B103]<>"";[.C103]<>"");"";"ERR");"") -> 
B104: of:=IF( ISBLANK([$'03.Muestra'.$C17]);"";[$'03.Muestra'.$C17]) ->  | C104: of:=IF( ISBLANK([$'03.Muestra'.$E17]);"";[$'03.Muestra'.$E17]) ->  | E104: of:=IF([.D104]<>"";IF(AND([.B104]<>"";[.C104]<>"");"";"ERR");"") -> 
B105: of:=IF( ISBLANK([$'03.Muestra'.$C18]);"";[$'03.Muestra'.$C18]) ->  | C105: of:=IF( ISBLANK([$'03.Muestra'.$E18]);"";[$'03.Muestra'.$E18]) ->  | E105: of:=IF([.D105]<>"";IF(AND([.B105]<>"";[.C105]<>"");"";"ERR");"") -> 
B106: of:=IF( ISBLANK([$'03.Muestra'.$C19]);"";[$'03.Muestra'.$C19]) ->  | C106: of:=IF( ISBLANK([$'03.Muestra'.$E19]);"";[$'03.Muestra'.$E19]) ->  | E106: of:=IF([.D106]<>"";IF(AND([.B106]<>"";[.C106]<>"");"";"ERR");"") -> 
B107: of:=IF( ISBLANK([$'03.Muestra'.$C20]);"";[$'03.Muestra'.$C20]) ->  | C107: of:=IF( ISBLANK([$'03.Muestra'.$E20]);"";[$'03.Muestra'.$E20]) ->  | E107: of:=IF([.D107]<>"";IF(AND([.B107]<>"";[.C107]<>"");"";"ERR");"") -> 
B108: of:=IF( ISBLANK([$'03.Muestra'.$C21]);"";[$'03.Muestra'.$C21]) ->  | C108: of:=IF( ISBLANK([$'03.Muestra'.$E21]);"";[$'03.Muestra'.$E21]) ->  | E108: of:=IF([.D108]<>"";IF(AND([.B108]<>"";[.C108]<>"");"";"ERR");"") -> 
B109: of:=IF( ISBLANK([$'03.Muestra'.$C22]);"";[$'03.Muestra'.$C22]) ->  | C109: of:=IF( ISBLANK([$'03.Muestra'.$E22]);"";[$'03.Muestra'.$E22]) ->  | E109: of:=IF([.D109]<>"";IF(AND([.B109]<>"";[.C109]<>"");"";"ERR");"") -> 
B110: of:=IF( ISBLANK([$'03.Muestra'.$C23]);"";[$'03.Muestra'.$C23]) ->  | C110: of:=IF( ISBLANK([$'03.Muestra'.$E23]);"";[$'03.Muestra'.$E23]) ->  | E110: of:=IF([.D110]<>"";IF(AND([.B110]<>"";[.C110]<>"");"";"ERR");"") -> 
B111: of:=IF( ISBLANK([$'03.Muestra'.$C24]);"";[$'03.Muestra'.$C24]) ->  | C111: of:=IF( ISBLANK([$'03.Muestra'.$E24]);"";[$'03.Muestra'.$E24]) ->  | E111: of:=IF([.D111]<>"";IF(AND([.B111]<>"";[.C111]<>"");"";"ERR");"") -> 
B112: of:=IF( ISBLANK([$'03.Muestra'.$C25]);"";[$'03.Muestra'.$C25]) ->  | C112: of:=IF( ISBLANK([$'03.Muestra'.$E25]);"";[$'03.Muestra'.$E25]) ->  | E112: of:=IF([.D112]<>"";IF(AND([.B112]<>"";[.C112]<>"");"";"ERR");"") -> 
B113: of:=IF( ISBLANK([$'03.Muestra'.$C26]);"";[$'03.Muestra'.$C26]) ->  | C113: of:=IF( ISBLANK([$'03.Muestra'.$E26]);"";[$'03.Muestra'.$E26]) ->  | E113: of:=IF([.D113]<>"";IF(AND([.B113]<>"";[.C113]<>"");"";"ERR");"") -> 
B114: of:=IF( ISBLANK([$'03.Muestra'.$C27]);"";[$'03.Muestra'.$C27]) ->  | C114: of:=IF( ISBLANK([$'03.Muestra'.$E27]);"";[$'03.Muestra'.$E27]) ->  | E114: of:=IF([.D114]<>"";IF(AND([.B114]<>"";[.C114]<>"");"";"ERR");"") -> 
B115: of:=IF( ISBLANK([$'03.Muestra'.$C28]);"";[$'03.Muestra'.$C28]) ->  | C115: of:=IF( ISBLANK([$'03.Muestra'.$E28]);"";[$'03.Muestra'.$E28]) ->  | E115: of:=IF([.D115]<>"";IF(AND([.B115]<>"";[.C115]<>"");"";"ERR");"") -> 
B116: of:=IF( ISBLANK([$'03.Muestra'.$C29]);"";[$'03.Muestra'.$C29]) ->  | C116: of:=IF( ISBLANK([$'03.Muestra'.$E29]);"";[$'03.Muestra'.$E29]) ->  | E116: of:=IF([.D116]<>"";IF(AND([.B116]<>"";[.C116]<>"");"";"ERR");"") -> 
B117: of:=IF( ISBLANK([$'03.Muestra'.$C30]);"";[$'03.Muestra'.$C30]) ->  | C117: of:=IF( ISBLANK([$'03.Muestra'.$E30]);"";[$'03.Muestra'.$E30]) ->  | E117: of:=IF([.D117]<>"";IF(AND([.B117]<>"";[.C117]<>"");"";"ERR");"") -> 
B118: of:=IF( ISBLANK([$'03.Muestra'.$C31]);"";[$'03.Muestra'.$C31]) ->  | C118: of:=IF( ISBLANK([$'03.Muestra'.$E31]);"";[$'03.Muestra'.$E31]) ->  | E118: of:=IF([.D118]<>"";IF(AND([.B118]<>"";[.C118]<>"");"";"ERR");"") -> 
B119: of:=IF( ISBLANK([$'03.Muestra'.$C32]);"";[$'03.Muestra'.$C32]) ->  | C119: of:=IF( ISBLANK([$'03.Muestra'.$E32]);"";[$'03.Muestra'.$E32]) ->  | E119: of:=IF([.D119]<>"";IF(AND([.B119]<>"";[.C119]<>"");"";"ERR");"") -> 
B120: of:=IF( ISBLANK([$'03.Muestra'.$C33]);"";[$'03.Muestra'.$C33]) ->  | C120: of:=IF( ISBLANK([$'03.Muestra'.$E33]);"";[$'03.Muestra'.$E33]) ->  | E120: of:=IF([.D120]<>"";IF(AND([.B120]<>"";[.C120]<>"");"";"ERR");"") -> 
B121: of:=IF( ISBLANK([$'03.Muestra'.$C34]);"";[$'03.Muestra'.$C34]) ->  | C121: of:=IF( ISBLANK([$'03.Muestra'.$E34]);"";[$'03.Muestra'.$E34]) ->  | E121: of:=IF([.D121]<>"";IF(AND([.B121]<>"";[.C121]<>"");"";"ERR");"") -> 
B122: of:=IF( ISBLANK([$'03.Muestra'.$C35]);"";[$'03.Muestra'.$C35]) ->  | C122: of:=IF( ISBLANK([$'03.Muestra'.$E35]);"";[$'03.Muestra'.$E35]) ->  | E122: of:=IF([.D122]<>"";IF(AND([.B122]<>"";[.C122]<>"");"";"ERR");"") -> 
B123: of:=IF( ISBLANK([$'03.Muestra'.$C36]);"";[$'03.Muestra'.$C36]) ->  | C123: of:=IF( ISBLANK([$'03.Muestra'.$E36]);"";[$'03.Muestra'.$E36]) ->  | E123: of:=IF([.D123]<>"";IF(AND([.B123]<>"";[.C123]<>"");"";"ERR");"") -> 
B124: of:=IF( ISBLANK([$'03.Muestra'.$C37]);"";[$'03.Muestra'.$C37]) ->  | C124: of:=IF( ISBLANK([$'03.Muestra'.$E37]);"";[$'03.Muestra'.$E37]) ->  | E124: of:=IF([.D124]<>"";IF(AND([.B124]<>"";[.C124]<>"");"";"ERR");"") -> 
B125: of:=IF( ISBLANK([$'03.Muestra'.$C38]);"";[$'03.Muestra'.$C38]) ->  | C125: of:=IF( ISBLANK([$'03.Muestra'.$E38]);"";[$'03.Muestra'.$E38]) ->  | E125: of:=IF([.D125]<>"";IF(AND([.B125]<>"";[.C125]<>"");"";"ERR");"") -> 
B126: of:=IF( ISBLANK([$'03.Muestra'.$C39]);"";[$'03.Muestra'.$C39]) ->  | C126: of:=IF( ISBLANK([$'03.Muestra'.$E39]);"";[$'03.Muestra'.$E39]) ->  | E126: of:=IF([.D126]<>"";IF(AND([.B126]<>"";[.C126]<>"");"";"ERR");"") -> 
B127: of:=IF( ISBLANK([$'03.Muestra'.$C40]);"";[$'03.Muestra'.$C40]) ->  | C127: of:=IF( ISBLANK([$'03.Muestra'.$E40]);"";[$'03.Muestra'.$E40]) ->  | E127: of:=IF([.D127]<>"";IF(AND([.B127]<>"";[.C127]<>"");"";"ERR");"") -> 
B128: of:=IF( ISBLANK([$'03.Muestra'.$C41]);"";[$'03.Muestra'.$C41]) ->  | C128: of:=IF( ISBLANK([$'03.Muestra'.$E41]);"";[$'03.Muestra'.$E41]) ->  | E128: of:=IF([.D128]<>"";IF(AND([.B128]<>"";[.C128]<>"");"";"ERR");"") -> 
B129: of:=IF( ISBLANK([$'03.Muestra'.$C42]);"";[$'03.Muestra'.$C42]) ->  | C129: of:=IF( ISBLANK([$'03.Muestra'.$E42]);"";[$'03.Muestra'.$E42]) ->  | E129: of:=IF([.D129]<>"";IF(AND([.B129]<>"";[.C129]<>"");"";"ERR");"") -> 

Sheet: RESULTADOS
B2: Informe de revisión de la accesibilidad
B3: Análisis de accesibilidad en profundidad de un sitio web
B5: Resultados agregados
J6: EVALUADO | N6: PENDIENTE DE EVALUAR
B7: Criterios de Conformidad | D7: Conforme | E7: No conforme | F7: No aplica | G7: Error | H7: En Curso | J7: Evaluación | K7: N.º Criterios x N.º Páginas | L7: % | N7: Evaluación | O7: N.º Criterios x N.º Páginas | P7: %
B8: A | D8: of:=COUNTIF([.D54:.AG54];"CONFORME") -> 0 | E8: of:=COUNTIF([.D54:.AG54];"NO CONFORME") -> 0 | F8: of:=COUNTIF([.D54:.AG54];"N/A") -> 0 | G8: of:=COUNTIF([.D54:.AG54];"ERROR") -> 0 | H8: of:=COUNTIF([.D54:.AG54];"EN CURSO") -> 0 | J8: Pasa | K8: of:=COUNTIF( [.$D$19]:INDIRECT("$AG$" &  SUM(18;[$'03.Muestra'.$D$45]));"Pasa")+ COUNTIF([.$D$60]:INDIRECT("$W$" &  SUM(59;[$'03.Muestra'.$D$45]));"Pasa") -> 0 | L8: of:=IF(([.$K$11]+[.$O$11])=0;0;[.K8]/([.$K$11]+[.$O$11])) -> 0 | N8: No decide | O8: of:=COUNTIF( [.$D$19]:INDIRECT("$AG$" &  SUM(18;[$'03.Muestra'.$D$45]));"N/D")+ COUNTIF([.$D$60]:INDIRECT("$W$" &  SUM(59;[$'03.Muestra'.$D$45]));"N/D") -> 0 | P8: of:=IF(([.$K$11]+[.$O$11])=0;0;[.O8]/([.$K$11]+[.$O$11])) -> 0
B9: AA | D9: of:=COUNTIF([.D95:.W95];"CONFORME") -> 0 | E9: of:=COUNTIF([.D95:.W95];"NO CONFORME") -> 0 | F9: of:=COUNTIF([.D95:.W95];"N/A") -> 0 | G9: of:=COUNTIF([.D95:.W95];"ERROR") -> 0 | H9: of:=COUNTIF([.D95:.W95];"EN CURSO") -> 0 | J9: Falla | K9: of:=COUNTIF( [.$D$19]:INDIRECT("$AG$" &  SUM(18;[$'03.Muestra'.$D$45]));"Falla")+ COUNTIF([.$D$60]:INDIRECT("$W$" &  SUM(59;[$'03.Muestra'.$D$45]));"Falla") -> 0 | L9: of:=IF(([.$K$11]+[.$O$11])=0;0;[.K9]/([.$K$11]+[.$O$11])) -> 0 | N9: No testeado | O9: of:=COUNTIF( [.$D$19]:INDIRECT("$AG$" &  SUM(18;[$'03.Muestra'.$D$45]));"N/T")+ COUNTIF([.$D$60]:INDIRECT("$W$" &  SUM(59;[$'03.Muestra'.$D$45]));"N/T") -> 0 | P9: of:=IF(([.$K$11]+[.$O$11])=0;0;[.O9]/([.$K$11]+[.$O$11])) -> 0
B10: TOTAL | D10: of:=CONCATENATE(SUM([.D8];[.D9]);" (";ROUND(SUM([.D8];[.D9])*100/50;2);" %)") -> 0 (0 %) | E10: of:=CONCATENATE(SUM([.E8];[.E9]);" (";ROUND(SUM([.E8];[.E9])*100/50;2);" %)") -> 0 (0 %) | F10: of:=CONCATENATE(SUM([.F8];[.F9]);" (";ROUND(SUM([.F8];[.F9])*100/50;2);" %)") -> 0 (0 %) | G10: of:=SUM([.G8:.G9]) -> 0 | H10: of:=SUM([.H8:.H9]) -> 0 | J10: No aplica | K10: of:=COUNTIF( [.$D$19]:INDIRECT("$AG$" &  SUM(18;[$'03.Muestra'.$D$45]));"N/A")+ COUNTIF([.$D$60]:INDIRECT("$W$" &  SUM(59;[$'03.Muestra'.$D$45]));"N/A") -> 0 | L10: of:=IF(([.$K$11]+[.$O$11])=0;0;[.K10]/([.$K$11]+[.$O$11])) -> 0 | N10: En blanco | O10: of:=IF([$'03.Muestra'.$D$45]=0;0;SUM(COUNTBLANK([.$D$19]:INDIRECT("$AG$" &  SUM(18;[$'03.Muestra'.$D$45])-1));COUNTBLANK([.$D$60]:INDIRECT("$W$" &  SUM(59;[$'03.Muestra'.$D$45])-1)))) -> 0 | P10: of:=IF(([.$K$11]+[.$O$11])=0;0;[.O10]/([.$K$11]+[.$O$11])) -> 0
J11: TOTAL | K11: of:=SUM([.K8:.K10]) -> 0 | L11: of:=SUM([.L8:.L10]) -> 0 | N11: TOTAL | O11: of:=SUM([.O8:.O10]) -> 0 | P11: of:=SUM([.P8:.P10]) -> 0
C13: Situación de Cumplimiento | E13: Puntuación Media del Sitio Web
C14: of:=IF([$'03.Muestra'.$D$45]=0;"";IF([.G10]>0;"Evaluación con errores";IF([.H10]>0;"Evaluación en curso";IF(VALUE(LEFT([.D10];FIND(" ";[.D10])-1))>=VALUE((LEFT([.D10];FIND(" ";[.D10])-1)+LEFT([.E10];FIND(" ";[.E10])-1))*[$'DATA - Oculta'.$C$27]); "Plenamente Conforme";IF(VALUE(LEFT([.E10];FIND(" ";[.E10])-1))>=VALUE((LEFT([.D10];FIND(" ";[.D10])-1)+LEFT([.E10];FIND(" ";[.E10])-1))*[$'DATA - Oculta'.$C$26]);"No Conforme";"Parcialmente Conforme"))))) ->  | E14: of:=IF((LEFT([.D10];FIND(" ";[.D10])-1)+LEFT([.E10];FIND(" ";[.E10])-1))=0;"";ROUND((LEFT([.D10];FIND(" ";[.D10])-1)/(LEFT([.D10];FIND(" ";[.D10])-1)+(LEFT([.E10];FIND(" ";[.E10])-1))))*10;2)) -> 
C17: A
C18: Muestra | D18: 1.1.1 | E18: 1.2.1 | F18: 1.2.2 | G18: 1.2.3 | H18: 1.3.1 | I18: 1.3.2 | J18: 1.3.3 | K18: 1.4.1 | L18: 1.4.2 | M18: 2.1.1 | N18: 2.1.2 | O18: 2.1.4 | P18: 2.2.1 | Q18: 2.2.2 | R18: 2.3.1 | S18: 2.4.1 | T18: 2.4.2 | U18: 2.4.3 | V18: 2.4.4 | W18: 2.5.1 | X18: 2.5.2 | Y18: 2.5.3 | Z18: 2.5.4 | AA18: 3.1.1 | AB18: 3.2.1 | AC18: 3.2.2 | AD18: 3.3.1 | AE18: 3.3.2 | AF18: 4.1.1 | AG18: 4.1.2
B19: of:=IF( ISBLANK([$'03.Muestra'.$C8]);"";[$'03.Muestra'.$C8]) ->  | C19: of:=IF( ISBLANK([$'03.Muestra'.$E8]);"";[$'03.Muestra'.$E8]) ->  | D19: of:=IF(ISBLANK([$'P1.Perceptible'.D19]);"";[$'P1.Perceptible'.D19]) ->  | E19: of:=IF(ISBLANK([$'P1.Perceptible'.D57]);"";[$'P1.Perceptible'.D57]) ->  | F19: of:=IF(ISBLANK([$'P1.Perceptible'.D95]);"";[$'P1.Perceptible'.D95]) ->  | G19: of:=IF(ISBLANK([$'P1.Perceptible'.D133]);"";[$'P1.Perceptible'.D133]) ->  | H19: of:=IF(ISBLANK([$'P1.Perceptible'.D247]);"";[$'P1.Perceptible'.D247]) ->  | I19: of:=IF(ISBLANK([$'P1.Perceptible'.D285]);"";[$'P1.Perceptible'.D285]) ->  | J19: of:=IF(ISBLANK([$'P1.Perceptible'.D323]);"";[$'P1.Perceptible'.D323]) ->  | K19: of:=IF(ISBLANK([$'P1.Perceptible'.D437]);"";[$'P1.Perceptible'.D437]) ->  | L19: of:=IF(ISBLANK([$'P1.Perceptible'.D475]);"";[$'P1.Perceptible'.D475]) ->  | M19: of:=IF(ISBLANK([$'P2.Operable'.D19]);"";[$'P2.Operable'.D19]) ->  | N19: of:=IF(ISBLANK([$'P2.Operable'.D57]);"";[$'P2.Operable'.D57]) ->  | O19: of:=IF(ISBLANK([$'P2.Operable'.D95]);"";[$'P2.Operable'.D95]) ->  | P19: of:=IF(ISBLANK([$'P2.Operable'.D133]);"";[$'P2.Operable'.D133]) ->  | Q19: of:=IF(ISBLANK([$'P2.Operable'.D171]);"";[$'P2.Operable'.D171]) ->  | R19: of:=IF(ISBLANK([$'P2.Operable'.D209]);"";[$'P2.Operable'.D209]) ->  | S19: of:=IF(ISBLANK([$'P2.Operable'.D247]);"";[$'P2.Operable'.D247]) ->  | T19: of:=IF(ISBLANK([$'P2.Operable'.D285]);"";[$'P2.Operable'.D285]) ->  | U19: of:=IF(ISBLANK([$'P2.Operable'.D323]);"";[$'P2.Operable'.D323]) ->  | V19: of:=IF(ISBLANK([$'P2.Operable'.D361]);"";[$'P2.Operable'.D361]) ->  | W19: of:=IF(ISBLANK([$'P2.Operable'.D513]);"";[$'P2.Operable'.D513]) ->  | X19: of:=IF(ISBLANK([$'P2.Operable'.D551]);"";[$'P2.Operable'.D551]) ->  | Y19: of:=IF(ISBLANK([$'P2.Operable'.D589]);"";[$'P2.Operable'.D589]) ->  | Z19: of:=IF(ISBLANK([$'P2.Operable'.D627]);"";[$'P2.Operable'.D627]) ->  | AA19: of:=IF(ISBLANK([$'P3.Comprensible'.D19]);"";[$'P3.Comprensible'.D19]) ->  | AB19: of:=IF(ISBLANK([$'P3.Comprensible'.D95]);"";[$'P3.Comprensible'.D95]) ->  | AC19: of:=IF(ISBLANK([$'P3.Comprensible'.D133]);"";[$'P3.Comprensible'.D133]) ->  | AD19: of:=IF(ISBLANK([$'P3.Comprensible'.D247]);"";[$'P3.Comprensible'.D247]) ->  | AE19: of:=IF(ISBLANK([$'P3.Comprensible'.D285]);"";[$'P3.Comprensible'.D285]) ->  | AF19: of:=IF(ISBLANK([$'P4.Robusto'.D19]);"";[$'P4.Robusto'.D19]) ->  | AG19: of:=IF(ISBLANK([$'P4.Robusto'.D57]);"";[$'P4.Robusto'.D57]) -> 
B20: of:=IF( ISBLANK([$'03.Muestra'.$C9]);"";[$'03.Muestra'.$C9]) ->  | C20: of:=IF( ISBLANK([$'03.Muestra'.$E9]);"";[$'03.Muestra'.$E9]) ->  | D20: of:=IF(ISBLANK([$'P1.Perceptible'.D20]);"";[$'P1.Perceptible'.D20]) ->  | E20: of:=IF(ISBLANK([$'P1.Perceptible'.D58]);"";[$'P1.Perceptible'.D58]) ->  | F20: of:=IF(ISBLANK([$'P1.Perceptible'.D96]);"";[$'P1.Perceptible'.D96]) ->  | G20: of:=IF(ISBLANK([$'P1.Perceptible'.D134]);"";[$'P1.Perceptible'.D134]) ->  | H20: of:=IF(ISBLANK([$'P1.Perceptible'.D248]);"";[$'P1.Perceptible'.D248]) ->  | I20: of:=IF(ISBLANK([$'P1.Perceptible'.D286]);"";[$'P1.Perceptible'.D286]) ->  | J20: of:=IF(ISBLANK([$'P1.Perceptible'.D324]);"";[$'P1.Perceptible'.D324]) ->  | K20: of:=IF(ISBLANK([$'P1.Perceptible'.D438]);"";[$'P1.Perceptible'.D438]) ->  | L20: of:=IF(ISBLANK([$'P1.Perceptible'.D476]);"";[$'P1.Perceptible'.D476]) ->  | M20: of:=IF(ISBLANK([$'P2.Operable'.D20]);"";[$'P2.Operable'.D20]) ->  | N20: of:=IF(ISBLANK([$'P2.Operable'.D58]);"";[$'P2.Operable'.D58]) ->  | O20: of:=IF(ISBLANK([$'P2.Operable'.D96]);"";[$'P2.Operable'.D96]) ->  | P20: of:=IF(ISBLANK([$'P2.Operable'.D134]);"";[$'P2.Operable'.D134]) ->  | Q20: of:=IF(ISBLANK([$'P2.Operable'.D172]);"";[$'P2.Operable'.D172]) ->  | R20: of:=IF(ISBLANK([$'P2.Operable'.D210]);"";[$'P2.Operable'.D210]) ->  | S20: of:=IF(ISBLANK([$'P2.Operable'.D248]);"";[$'P2.Operable'.D248]) ->  | T20: of:=IF(ISBLANK([$'P2.Operable'.D286]);"";[$'P2.Operable'.D286]) ->  | U20: of:=IF(ISBLANK([$'P2.Operable'.D324]);"";[$'P2.Operable'.D324]) ->  | V20: of:=IF(ISBLANK([$'P2.Operable'.D362]);"";[$'P2.Operable'.D362]) ->  | W20: of:=IF(ISBLANK([$'P2.Operable'.D514]);"";[$'P2.Operable'.D514]) ->  | X20: of:=IF(ISBLANK([$'P2.Operable'.D552]);"";[$'P2.Operable'.D552]) ->  | Y20: of:=IF(ISBLANK([$'P2.Operable'.D590]);"";[$'P2.Operable'.D590]) ->  | Z20: of:=IF(ISBLANK([$'P2.Operable'.D628]);"";[$'P2.Operable'.D628]) ->  | AA20: of:=IF(ISBLANK([$'P3.Comprensible'.D20]);"";[$'P3.Comprensible'.D20]) ->  | AB20: of:=IF(ISBLANK([$'P3.Comprensible'.D96]);"";[$'P3.Comprensible'.D96]) ->  | AC20: of:=IF(ISBLANK([$'P3.Comprensible'.D134]);"";[$'P3.Comprensible'.D134]) ->  | AD20: of:=IF(ISBLANK([$'P3.Comprensible'.D248]);"";[$'P3.Comprensible'.D248]) ->  | AE20: of:=IF(ISBLANK([$'P3.Comprensible'.D286]);"";[$'P3.Comprensible'.D286]) ->  | AF20: of:=IF(ISBLANK([$'P4.Robusto'.D20]);"";[$'P4.Robusto'.D20]) ->  | AG20: of:=IF(ISBLANK([$'P4.Robusto'.D58]);"";[$'P4.Robusto'.D58]) -> 
B21: of:=IF( ISBLANK([$'03.Muestra'.$C10]);"";[$'03.Muestra'.$C10]) ->  | C21: of:=IF( ISBLANK([$'03.Muestra'.$E10]);"";[$'03.Muestra'.$E10]) ->  | D21: of:=IF(ISBLANK([$'P1.Perceptible'.D21]);"";[$'P1.Perceptible'.D21]) ->  | E21: of:=IF(ISBLANK([$'P1.Perceptible'.D59]);"";[$'P1.Perceptible'.D59]) ->  | F21: of:=IF(ISBLANK([$'P1.Perceptible'.D97]);"";[$'P1.Perceptible'.D97]) ->  | G21: of:=IF(ISBLANK([$'P1.Perceptible'.D135]);"";[$'P1.Perceptible'.D135]) ->  | H21: of:=IF(ISBLANK([$'P1.Perceptible'.D249]);"";[$'P1.Perceptible'.D249]) ->  | I21: of:=IF(ISBLANK([$'P1.Perceptible'.D287]);"";[$'P1.Perceptible'.D287]) ->  | J21: of:=IF(ISBLANK([$'P1.Perceptible'.D325]);"";[$'P1.Perceptible'.D325]) ->  | K21: of:=IF(ISBLANK([$'P1.Perceptible'.D439]);"";[$'P1.Perceptible'.D439]) ->  | L21: of:=IF(ISBLANK([$'P1.Perceptible'.D477]);"";[$'P1.Perceptible'.D477]) ->  | M21: of:=IF(ISBLANK([$'P2.Operable'.D21]);"";[$'P2.Operable'.D21]) ->  | N21: of:=IF(ISBLANK([$'P2.Operable'.D59]);"";[$'P2.Operable'.D59]) ->  | O21: of:=IF(ISBLANK([$'P2.Operable'.D97]);"";[$'P2.Operable'.D97]) ->  | P21: of:=IF(ISBLANK([$'P2.Operable'.D135]);"";[$'P2.Operable'.D135]) ->  | Q21: of:=IF(ISBLANK([$'P2.Operable'.D173]);"";[$'P2.Operable'.D173]) ->  | R21: of:=IF(ISBLANK([$'P2.Operable'.D211]);"";[$'P2.Operable'.D211]) ->  | S21: of:=IF(ISBLANK([$'P2.Operable'.D249]);"";[$'P2.Operable'.D249]) ->  | T21: of:=IF(ISBLANK([$'P2.Operable'.D287]);"";[$'P2.Operable'.D287]) ->  | U21: of:=IF(ISBLANK([$'P2.Operable'.D325]);"";[$'P2.Operable'.D325]) ->  | V21: of:=IF(ISBLANK([$'P2.Operable'.D363]);"";[$'P2.Operable'.D363]) ->  | W21: of:=IF(ISBLANK([$'P2.Operable'.D515]);"";[$'P2.Operable'.D515]) ->  | X21: of:=IF(ISBLANK([$'P2.Operable'.D553]);"";[$'P2.Operable'.D553]) ->  | Y21: of:=IF(ISBLANK([$'P2.Operable'.D591]);"";[$'P2.Operable'.D591]) ->  | Z21: of:=IF(ISBLANK([$'P2.Operable'.D629]);"";[$'P2.Operable'.D629]) ->  | AA21: of:=IF(ISBLANK([$'P3.Comprensible'.D21]);"";[$'P3.Comprensible'.D21]) ->  | AB21: of:=IF(ISBLANK([$'P3.Comprensible'.D97]);"";[$'P3.Comprensible'.D97]) ->  | AC21: of:=IF(ISBLANK([$'P3.Comprensible'.D135]);"";[$'P3.Comprensible'.D135]) ->  | AD21: of:=IF(ISBLANK([$'P3.Comprensible'.D249]);"";[$'P3.Comprensible'.D249]) ->  | AE21: of:=IF(ISBLANK([$'P3.Comprensible'.D287]);"";[$'P3.Comprensible'.D287]) ->  | AF21: of:=IF(ISBLANK([$'P4.Robusto'.D21]);"";[$'P4.Robusto'.D21]) ->  | AG21: of:=IF(ISBLANK([$'P4.Robusto'.D59]);"";[$'P4.Robusto'.D59]) -> 
B22: of:=IF( ISBLANK([$'03.Muestra'.$C11]);"";[$'03.Muestra'.$C11]) ->  | C22: of:=IF( ISBLANK([$'03.Muestra'.$E11]);"";[$'03.Muestra'.$E11]) ->  | D22: of:=IF(ISBLANK([$'P1.Perceptible'.D22]);"";[$'P1.Perceptible'.D22]) ->  | E22: of:=IF(ISBLANK([$'P1.Perceptible'.D60]);"";[$'P1.Perceptible'.D60]) ->  | F22: of:=IF(ISBLANK([$'P1.Perceptible'.D98]);"";[$'P1.Perceptible'.D98]) ->  | G22: of:=IF(ISBLANK([$'P1.Perceptible'.D136]);"";[$'P1.Perceptible'.D136]) ->  | H22: of:=IF(ISBLANK([$'P1.Perceptible'.D250]);"";[$'P1.Perceptible'.D250]) ->  | I22: of:=IF(ISBLANK([$'P1.Perceptible'.D288]);"";[$'P1.Perceptible'.D288]) ->  | J22: of:=IF(ISBLANK([$'P1.Perceptible'.D326]);"";[$'P1.Perceptible'.D326]) ->  | K22: of:=IF(ISBLANK([$'P1.Perceptible'.D440]);"";[$'P1.Perceptible'.D440]) ->  | L22: of:=IF(ISBLANK([$'P1.Perceptible'.D478]);"";[$'P1.Perceptible'.D478]) ->  | M22: of:=IF(ISBLANK([$'P2.Operable'.D22]);"";[$'P2.Operable'.D22]) ->  | N22: of:=IF(ISBLANK([$'P2.Operable'.D60]);"";[$'P2.Operable'.D60]) ->  | O22: of:=IF(ISBLANK([$'P2.Operable'.D98]);"";[$'P2.Operable'.D98]) ->  | P22: of:=IF(ISBLANK([$'P2.Operable'.D136]);"";[$'P2.Operable'.D136]) ->  | Q22: of:=IF(ISBLANK([$'P2.Operable'.D174]);"";[$'P2.Operable'.D174]) ->  | R22: of:=IF(ISBLANK([$'P2.Operable'.D212]);"";[$'P2.Operable'.D212]) ->  | S22: of:=IF(ISBLANK([$'P2.Operable'.D250]);"";[$'P2.Operable'.D250]) ->  | T22: of:=IF(ISBLANK([$'P2.Operable'.D288]);"";[$'P2.Operable'.D288]) ->  | U22: of:=IF(ISBLANK([$'P2.Operable'.D326]);"";[$'P2.Operable'.D326]) ->  | V22: of:=IF(ISBLANK([$'P2.Operable'.D364]);"";[$'P2.Operable'.D364]) ->  | W22: of:=IF(ISBLANK([$'P2.Operable'.D516]);"";[$'P2.Operable'.D516]) ->  | X22: of:=IF(ISBLANK([$'P2.Operable'.D554]);"";[$'P2.Operable'.D554]) ->  | Y22: of:=IF(ISBLANK([$'P2.Operable'.D592]);"";[$'P2.Operable'.D592]) ->  | Z22: of:=IF(ISBLANK([$'P2.Operable'.D630]);"";[$'P2.Operable'.D630]) ->  | AA22: of:=IF(ISBLANK([$'P3.Comprensible'.D22]);"";[$'P3.Comprensible'.D22]) ->  | AB22: of:=IF(ISBLANK([$'P3.Comprensible'.D98]);"";[$'P3.Comprensible'.D98]) ->  | AC22: of:=IF(ISBLANK([$'P3.Comprensible'.D136]);"";[$'P3.Comprensible'.D136]) ->  | AD22: of:=IF(ISBLANK([$'P3.Comprensible'.D250]);"";[$'P3.Comprensible'.D250]) ->  | AE22: of:=IF(ISBLANK([$'P3.Comprensible'.D288]);"";[$'P3.Comprensible'.D288]) ->  | AF22: of:=IF(ISBLANK([$'P4.Robusto'.D22]);"";[$'P4.Robusto'.D22]) ->  | AG22: of:=IF(ISBLANK([$'P4.Robusto'.D60]);"";[$'P4.Robusto'.D60]) -> 
B23: of:=IF( ISBLANK([$'03.Muestra'.$C12]);"";[$'03.Muestra'.$C12]) ->  | C23: of:=IF( ISBLANK([$'03.Muestra'.$E12]);"";[$'03.Muestra'.$E12]) ->  | D23: of:=IF(ISBLANK([$'P1.Perceptible'.D23]);"";[$'P1.Perceptible'.D23]) ->  | E23: of:=IF(ISBLANK([$'P1.Perceptible'.D61]);"";[$'P1.Perceptible'.D61]) ->  | F23: of:=IF(ISBLANK([$'P1.Perceptible'.D99]);"";[$'P1.Perceptible'.D99]) ->  | G23: of:=IF(ISBLANK([$'P1.Perceptible'.D137]);"";[$'P1.Perceptible'.D137]) ->  | H23: of:=IF(ISBLANK([$'P1.Perceptible'.D251]);"";[$'P1.Perceptible'.D251]) ->  | I23: of:=IF(ISBLANK([$'P1.Perceptible'.D289]);"";[$'P1.Perceptible'.D289]) ->  | J23: of:=IF(ISBLANK([$'P1.Perceptible'.D327]);"";[$'P1.Perceptible'.D327]) ->  | K23: of:=IF(ISBLANK([$'P1.Perceptible'.D441]);"";[$'P1.Perceptible'.D441]) ->  | L23: of:=IF(ISBLANK([$'P1.Perceptible'.D479]);"";[$'P1.Perceptible'.D479]) ->  | M23: of:=IF(ISBLANK([$'P2.Operable'.D23]);"";[$'P2.Operable'.D23]) ->  | N23: of:=IF(ISBLANK([$'P2.Operable'.D61]);"";[$'P2.Operable'.D61]) ->  | O23: of:=IF(ISBLANK([$'P2.Operable'.D99]);"";[$'P2.Operable'.D99]) ->  | P23: of:=IF(ISBLANK([$'P2.Operable'.D137]);"";[$'P2.Operable'.D137]) ->  | Q23: of:=IF(ISBLANK([$'P2.Operable'.D175]);"";[$'P2.Operable'.D175]) ->  | R23: of:=IF(ISBLANK([$'P2.Operable'.D213]);"";[$'P2.Operable'.D213]) ->  | S23: of:=IF(ISBLANK([$'P2.Operable'.D251]);"";[$'P2.Operable'.D251]) ->  | T23: of:=IF(ISBLANK([$'P2.Operable'.D289]);"";[$'P2.Operable'.D289]) ->  | U23: of:=IF(ISBLANK([$'P2.Operable'.D327]);"";[$'P2.Operable'.D327]) ->  | V23: of:=IF(ISBLANK([$'P2.Operable'.D365]);"";[$'P2.Operable'.D365]) ->  | W23: of:=IF(ISBLANK([$'P2.Operable'.D517]);"";[$'P2.Operable'.D517]) ->  | X23: of:=IF(ISBLANK([$'P2.Operable'.D555]);"";[$'P2.Operable'.D555]) ->  | Y23: of:=IF(ISBLANK([$'P2.Operable'.D593]);"";[$'P2.Operable'.D593]) ->  | Z23: of:=IF(ISBLANK([$'P2.Operable'.D631]);"";[$'P2.Operable'.D631]) ->  | AA23: of:=IF(ISBLANK([$'P3.Comprensible'.D23]);"";[$'P3.Comprensible'.D23]) ->  | AB23: of:=IF(ISBLANK([$'P3.Comprensible'.D99]);"";[$'P3.Comprensible'.D99]) ->  | AC23: of:=IF(ISBLANK([$'P3.Comprensible'.D137]);"";[$'P3.Comprensible'.D137]) ->  | AD23: of:=IF(ISBLANK([$'P3.Comprensible'.D251]);"";[$'P3.Comprensible'.D251]) ->  | AE23: of:=IF(ISBLANK([$'P3.Comprensible'.D289]);"";[$'P3.Comprensible'.D289]) ->  | AF23: of:=IF(ISBLANK([$'P4.Robusto'.D23]);"";[$'P4.Robusto'.D23]) ->  | AG23: of:=IF(ISBLANK([$'P4.Robusto'.D61]);"";[$'P4.Robusto'.D61]) -> 
B24: of:=IF( ISBLANK([$'03.Muestra'.$C13]);"";[$'03.Muestra'.$C13]) ->  | C24: of:=IF( ISBLANK([$'03.Muestra'.$E13]);"";[$'03.Muestra'.$E13]) ->  | D24: of:=IF(ISBLANK([$'P1.Perceptible'.D24]);"";[$'P1.Perceptible'.D24]) ->  | E24: of:=IF(ISBLANK([$'P1.Perceptible'.D62]);"";[$'P1.Perceptible'.D62]) ->  | F24: of:=IF(ISBLANK([$'P1.Perceptible'.D100]);"";[$'P1.Perceptible'.D100]) ->  | G24: of:=IF(ISBLANK([$'P1.Perceptible'.D138]);"";[$'P1.Perceptible'.D138]) ->  | H24: of:=IF(ISBLANK([$'P1.Perceptible'.D252]);"";[$'P1.Perceptible'.D252]) ->  | I24: of:=IF(ISBLANK([$'P1.Perceptible'.D290]);"";[$'P1.Perceptible'.D290]) ->  | J24: of:=IF(ISBLANK([$'P1.Perceptible'.D328]);"";[$'P1.Perceptible'.D328]) ->  | K24: of:=IF(ISBLANK([$'P1.Perceptible'.D442]);"";[$'P1.Perceptible'.D442]) ->  | L24: of:=IF(ISBLANK([$'P1.Perceptible'.D480]);"";[$'P1.Perceptible'.D480]) ->  | M24: of:=IF(ISBLANK([$'P2.Operable'.D24]);"";[$'P2.Operable'.D24]) ->  | N24: of:=IF(ISBLANK([$'P2.Operable'.D62]);"";[$'P2.Operable'.D62]) ->  | O24: of:=IF(ISBLANK([$'P2.Operable'.D100]);"";[$'P2.Operable'.D100]) ->  | P24: of:=IF(ISBLANK([$'P2.Operable'.D138]);"";[$'P2.Operable'.D138]) ->  | Q24: of:=IF(ISBLANK([$'P2.Operable'.D176]);"";[$'P2.Operable'.D176]) ->  | R24: of:=IF(ISBLANK([$'P2.Operable'.D214]);"";[$'P2.Operable'.D214]) ->  | S24: of:=IF(ISBLANK([$'P2.Operable'.D252]);"";[$'P2.Operable'.D252]) ->  | T24: of:=IF(ISBLANK([$'P2.Operable'.D290]);"";[$'P2.Operable'.D290]) ->  | U24: of:=IF(ISBLANK([$'P2.Operable'.D328]);"";[$'P2.Operable'.D328]) ->  | V24: of:=IF(ISBLANK([$'P2.Operable'.D366]);"";[$'P2.Operable'.D366]) ->  | W24: of:=IF(ISBLANK([$'P2.Operable'.D518]);"";[$'P2.Operable'.D518]) ->  | X24: of:=IF(ISBLANK([$'P2.Operable'.D556]);"";[$'P2.Operable'.D556]) ->  | Y24: of:=IF(ISBLANK([$'P2.Operable'.D594]);"";[$'P2.Operable'.D594]) ->  | Z24: of:=IF(ISBLANK([$'P2.Operable'.D632]);"";[$'P2.Operable'.D632]) ->  | AA24: of:=IF(ISBLANK([$'P3.Comprensible'.D24]);"";[$'P3.Comprensible'.D24]) ->  | AB24: of:=IF(ISBLANK([$'P3.Comprensible'.D100]);"";[$'P3.Comprensible'.D100]) ->  | AC24: of:=IF(ISBLANK([$'P3.Comprensible'.D138]);"";[$'P3.Comprensible'.D138]) ->  | AD24: of:=IF(ISBLANK([$'P3.Comprensible'.D252]);"";[$'P3.Comprensible'.D252]) ->  | AE24: of:=IF(ISBLANK([$'P3.Comprensible'.D290]);"";[$'P3.Comprensible'.D290]) ->  | AF24: of:=IF(ISBLANK([$'P4.Robusto'.D24]);"";[$'P4.Robusto'.D24]) ->  | AG24: of:=IF(ISBLANK([$'P4.Robusto'.D62]);"";[$'P4.Robusto'.D62]) -> 
B25: of:=IF( ISBLANK([$'03.Muestra'.$C14]);"";[$'03.Muestra'.$C14]) ->  | C25: of:=IF( ISBLANK([$'03.Muestra'.$E14]);"";[$'03.Muestra'.$E14]) ->  | D25: of:=IF(ISBLANK([$'P1.Perceptible'.D25]);"";[$'P1.Perceptible'.D25]) ->  | E25: of:=IF(ISBLANK([$'P1.Perceptible'.D63]);"";[$'P1.Perceptible'.D63]) ->  | F25: of:=IF(ISBLANK([$'P1.Perceptible'.D101]);"";[$'P1.Perceptible'.D101]) ->  | G25: of:=IF(ISBLANK([$'P1.Perceptible'.D139]);"";[$'P1.Perceptible'.D139]) ->  | H25: of:=IF(ISBLANK([$'P1.Perceptible'.D253]);"";[$'P1.Perceptible'.D253]) ->  | I25: of:=IF(ISBLANK([$'P1.Perceptible'.D291]);"";[$'P1.Perceptible'.D291]) ->  | J25: of:=IF(ISBLANK([$'P1.Perceptible'.D329]);"";[$'P1.Perceptible'.D329]) ->  | K25: of:=IF(ISBLANK([$'P1.Perceptible'.D443]);"";[$'P1.Perceptible'.D443]) ->  | L25: of:=IF(ISBLANK([$'P1.Perceptible'.D481]);"";[$'P1.Perceptible'.D481]) ->  | M25: of:=IF(ISBLANK([$'P2.Operable'.D25]);"";[$'P2.Operable'.D25]) ->  | N25: of:=IF(ISBLANK([$'P2.Operable'.D63]);"";[$'P2.Operable'.D63]) ->  | O25: of:=IF(ISBLANK([$'P2.Operable'.D101]);"";[$'P2.Operable'.D101]) ->  | P25: of:=IF(ISBLANK([$'P2.Operable'.D139]);"";[$'P2.Operable'.D139]) ->  | Q25: of:=IF(ISBLANK([$'P2.Operable'.D177]);"";[$'P2.Operable'.D177]) ->  | R25: of:=IF(ISBLANK([$'P2.Operable'.D215]);"";[$'P2.Operable'.D215]) ->  | S25: of:=IF(ISBLANK([$'P2.Operable'.D253]);"";[$'P2.Operable'.D253]) ->  | T25: of:=IF(ISBLANK([$'P2.Operable'.D291]);"";[$'P2.Operable'.D291]) ->  | U25: of:=IF(ISBLANK([$'P2.Operable'.D329]);"";[$'P2.Operable'.D329]) ->  | V25: of:=IF(ISBLANK([$'P2.Operable'.D367]);"";[$'P2.Operable'.D367]) ->  | W25: of:=IF(ISBLANK([$'P2.Operable'.D519]);"";[$'P2.Operable'.D519]) ->  | X25: of:=IF(ISBLANK([$'P2.Operable'.D557]);"";[$'P2.Operable'.D557]) ->  | Y25: of:=IF(ISBLANK([$'P2.Operable'.D595]);"";[$'P2.Operable'.D595]) ->  | Z25: of:=IF(ISBLANK([$'P2.Operable'.D633]);"";[$'P2.Operable'.D633]) ->  | AA25: of:=IF(ISBLANK([$'P3.Comprensible'.D25]);"";[$'P3.Comprensible'.D25]) ->  | AB25: of:=IF(ISBLANK([$'P3.Comprensible'.D101]);"";[$'P3.Comprensible'.D101]) ->  | AC25: of:=IF(ISBLANK([$'P3.Comprensible'.D139]);"";[$'P3.Comprensible'.D139]) ->  | AD25: of:=IF(ISBLANK([$'P3.Comprensible'.D253]);"";[$'P3.Comprensible'.D253]) ->  | AE25: of:=IF(ISBLANK([$'P3.Comprensible'.D291]);"";[$'P3.Comprensible'.D291]) ->  | AF25: of:=IF(ISBLANK([$'P4.Robusto'.D25]);"";[$'P4.Robusto'.D25]) ->  | AG25: of:=IF(ISBLANK([$'P4.Robusto'.D63]);"";[$'P4.Robusto'.D63]) -> 
B26: of:=IF( ISBLANK([$'03.Muestra'.$C15]);"";[$'03.Muestra'.$C15]) ->  | C26: of:=IF( ISBLANK([$'03.Muestra'.$E15]);"";[$'03.Muestra'.$E15]) ->  | D26: of:=IF(ISBLANK([$'P1.Perceptible'.D26]);"";[$'P1.Perceptible'.D26]) ->  | E26: of:=IF(ISBLANK([$'P1.Perceptible'.D64]);"";[$'P1.Perceptible'.D64]) ->  | F26: of:=IF(ISBLANK([$'P1.Perceptible'.D102]);"";[$'P1.Perceptible'.D102]) ->  | G26: of:=IF(ISBLANK([$'P1.Perceptible'.D140]);"";[$'P1.Perceptible'.D140]) ->  | H26: of:=IF(ISBLANK([$'P1.Perceptible'.D254]);"";[$'P1.Perceptible'.D254]) ->  | I26: of:=IF(ISBLANK([$'P1.Perceptible'.D292]);"";[$'P1.Perceptible'.D292]) ->  | J26: of:=IF(ISBLANK([$'P1.Perceptible'.D330]);"";[$'P1.Perceptible'.D330]) ->  | K26: of:=IF(ISBLANK([$'P1.Perceptible'.D444]);"";[$'P1.Perceptible'.D444]) ->  | L26: of:=IF(ISBLANK([$'P1.Perceptible'.D482]);"";[$'P1.Perceptible'.D482]) ->  | M26: of:=IF(ISBLANK([$'P2.Operable'.D26]);"";[$'P2.Operable'.D26]) ->  | N26: of:=IF(ISBLANK([$'P2.Operable'.D64]);"";[$'P2.Operable'.D64]) ->  | O26: of:=IF(ISBLANK([$'P2.Operable'.D102]);"";[$'P2.Operable'.D102]) ->  | P26: of:=IF(ISBLANK([$'P2.Operable'.D140]);"";[$'P2.Operable'.D140]) ->  | Q26: of:=IF(ISBLANK([$'P2.Operable'.D178]);"";[$'P2.Operable'.D178]) ->  | R26: of:=IF(ISBLANK([$'P2.Operable'.D216]);"";[$'P2.Operable'.D216]) ->  | S26: of:=IF(ISBLANK([$'P2.Operable'.D254]);"";[$'P2.Operable'.D254]) ->  | T26: of:=IF(ISBLANK([$'P2.Operable'.D292]);"";[$'P2.Operable'.D292]) ->  | U26: of:=IF(ISBLANK([$'P2.Operable'.D330]);"";[$'P2.Operable'.D330]) ->  | V26: of:=IF(ISBLANK([$'P2.Operable'.D368]);"";[$'P2.Operable'.D368]) ->  | W26: of:=IF(ISBLANK([$'P2.Operable'.D520]);"";[$'P2.Operable'.D520]) ->  | X26: of:=IF(ISBLANK([$'P2.Operable'.D558]);"";[$'P2.Operable'.D558]) ->  | Y26: of:=IF(ISBLANK([$'P2.Operable'.D596]);"";[$'P2.Operable'.D596]) ->  | Z26: of:=IF(ISBLANK([$'P2.Operable'.D634]);"";[$'P2.Operable'.D634]) ->  | AA26: of:=IF(ISBLANK([$'P3.Comprensible'.D26]);"";[$'P3.Comprensible'.D26]) ->  | AB26: of:=IF(ISBLANK([$'P3.Comprensible'.D102]);"";[$'P3.Comprensible'.D102]) ->  | AC26: of:=IF(ISBLANK([$'P3.Comprensible'.D140]);"";[$'P3.Comprensible'.D140]) ->  | AD26: of:=IF(ISBLANK([$'P3.Comprensible'.D254]);"";[$'P3.Comprensible'.D254]) ->  | AE26: of:=IF(ISBLANK([$'P3.Comprensible'.D292]);"";[$'P3.Comprensible'.D292]) ->  | AF26: of:=IF(ISBLANK([$'P4.Robusto'.D26]);"";[$'P4.Robusto'.D26]) ->  | AG26: of:=IF(ISBLANK([$'P4.Robusto'.D64]);"";[$'P4.Robusto'.D64]) -> 
B27: of:=IF( ISBLANK([$'03.Muestra'.$C16]);"";[$'03.Muestra'.$C16]) ->  | C27: of:=IF( ISBLANK([$'03.Muestra'.$E16]);"";[$'03.Muestra'.$E16]) ->  | D27: of:=IF(ISBLANK([$'P1.Perceptible'.D27]);"";[$'P1.Perceptible'.D27]) ->  | E27: of:=IF(ISBLANK([$'P1.Perceptible'.D65]);"";[$'P1.Perceptible'.D65]) ->  | F27: of:=IF(ISBLANK([$'P1.Perceptible'.D103]);"";[$'P1.Perceptible'.D103]) ->  | G27: of:=IF(ISBLANK([$'P1.Perceptible'.D141]);"";[$'P1.Perceptible'.D141]) ->  | H27: of:=IF(ISBLANK([$'P1.Perceptible'.D255]);"";[$'P1.Perceptible'.D255]) ->  | I27: of:=IF(ISBLANK([$'P1.Perceptible'.D293]);"";[$'P1.Perceptible'.D293]) ->  | J27: of:=IF(ISBLANK([$'P1.Perceptible'.D331]);"";[$'P1.Perceptible'.D331]) ->  | K27: of:=IF(ISBLANK([$'P1.Perceptible'.D445]);"";[$'P1.Perceptible'.D445]) ->  | L27: of:=IF(ISBLANK([$'P1.Perceptible'.D483]);"";[$'P1.Perceptible'.D483]) ->  | M27: of:=IF(ISBLANK([$'P2.Operable'.D27]);"";[$'P2.Operable'.D27]) ->  | N27: of:=IF(ISBLANK([$'P2.Operable'.D65]);"";[$'P2.Operable'.D65]) ->  | O27: of:=IF(ISBLANK([$'P2.Operable'.D103]);"";[$'P2.Operable'.D103]) ->  | P27: of:=IF(ISBLANK([$'P2.Operable'.D141]);"";[$'P2.Operable'.D141]) ->  | Q27: of:=IF(ISBLANK([$'P2.Operable'.D179]);"";[$'P2.Operable'.D179]) ->  | R27: of:=IF(ISBLANK([$'P2.Operable'.D217]);"";[$'P2.Operable'.D217]) ->  | S27: of:=IF(ISBLANK([$'P2.Operable'.D255]);"";[$'P2.Operable'.D255]) ->  | T27: of:=IF(ISBLANK([$'P2.Operable'.D293]);"";[$'P2.Operable'.D293]) ->  | U27: of:=IF(ISBLANK([$'P2.Operable'.D331]);"";[$'P2.Operable'.D331]) ->  | V27: of:=IF(ISBLANK([$'P2.Operable'.D369]);"";[$'P2.Operable'.D369]) ->  | W27: of:=IF(ISBLANK([$'P2.Operable'.D521]);"";[$'P2.Operable'.D521]) ->  | X27: of:=IF(ISBLANK([$'P2.Operable'.D559]);"";[$'P2.Operable'.D559]) ->  | Y27: of:=IF(ISBLANK([$'P2.Operable'.D597]);"";[$'P2.Operable'.D597]) ->  | Z27: of:=IF(ISBLANK([$'P2.Operable'.D635]);"";[$'P2.Operable'.D635]) ->  | AA27: of:=IF(ISBLANK([$'P3.Comprensible'.D27]);"";[$'P3.Comprensible'.D27]) ->  | AB27: of:=IF(ISBLANK([$'P3.Comprensible'.D103]);"";[$'P3.Comprensible'.D103]) ->  | AC27: of:=IF(ISBLANK([$'P3.Comprensible'.D141]);"";[$'P3.Comprensible'.D141]) ->  | AD27: of:=IF(ISBLANK([$'P3.Comprensible'.D255]);"";[$'P3.Comprensible'.D255]) ->  | AE27: of:=IF(ISBLANK([$'P3.Comprensible'.D293]);"";[$'P3.Comprensible'.D293]) ->  | AF27: of:=IF(ISBLANK([$'P4.Robusto'.D27]);"";[$'P4.Robusto'.D27]) ->  | AG27: of:=IF(ISBLANK([$'P4.Robusto'.D65]);"";[$'P4.Robusto'.D65]) -> 
B28: of:=IF( ISBLANK([$'03.Muestra'.$C17]);"";[$'03.Muestra'.$C17]) ->  | C28: of:=IF( ISBLANK([$'03.Muestra'.$E17]);"";[$'03.Muestra'.$E17]) ->  | D28: of:=IF(ISBLANK([$'P1.Perceptible'.D28]);"";[$'P1.Perceptible'.D28]) ->  | E28: of:=IF(ISBLANK([$'P1.Perceptible'.D66]);"";[$'P1.Perceptible'.D66]) ->  | F28: of:=IF(ISBLANK([$'P1.Perceptible'.D104]);"";[$'P1.Perceptible'.D104]) ->  | G28: of:=IF(ISBLANK([$'P1.Perceptible'.D142]);"";[$'P1.Perceptible'.D142]) ->  | H28: of:=IF(ISBLANK([$'P1.Perceptible'.D256]);"";[$'P1.Perceptible'.D256]) ->  | I28: of:=IF(ISBLANK([$'P1.Perceptible'.D294]);"";[$'P1.Perceptible'.D294]) ->  | J28: of:=IF(ISBLANK([$'P1.Perceptible'.D332]);"";[$'P1.Perceptible'.D332]) ->  | K28: of:=IF(ISBLANK([$'P1.Perceptible'.D446]);"";[$'P1.Perceptible'.D446]) ->  | L28: of:=IF(ISBLANK([$'P1.Perceptible'.D484]);"";[$'P1.Perceptible'.D484]) ->  | M28: of:=IF(ISBLANK([$'P2.Operable'.D28]);"";[$'P2.Operable'.D28]) ->  | N28: of:=IF(ISBLANK([$'P2.Operable'.D66]);"";[$'P2.Operable'.D66]) ->  | O28: of:=IF(ISBLANK([$'P2.Operable'.D104]);"";[$'P2.Operable'.D104]) ->  | P28: of:=IF(ISBLANK([$'P2.Operable'.D142]);"";[$'P2.Operable'.D142]) ->  | Q28: of:=IF(ISBLANK([$'P2.Operable'.D180]);"";[$'P2.Operable'.D180]) ->  | R28: of:=IF(ISBLANK([$'P2.Operable'.D218]);"";[$'P2.Operable'.D218]) ->  | S28: of:=IF(ISBLANK([$'P2.Operable'.D256]);"";[$'P2.Operable'.D256]) ->  | T28: of:=IF(ISBLANK([$'P2.Operable'.D294]);"";[$'P2.Operable'.D294]) ->  | U28: of:=IF(ISBLANK([$'P2.Operable'.D332]);"";[$'P2.Operable'.D332]) ->  | V28: of:=IF(ISBLANK([$'P2.Operable'.D370]);"";[$'P2.Operable'.D370]) ->  | W28: of:=IF(ISBLANK([$'P2.Operable'.D522]);"";[$'P2.Operable'.D522]) ->  | X28: of:=IF(ISBLANK([$'P2.Operable'.D560]);"";[$'P2.Operable'.D560]) ->  | Y28: of:=IF(ISBLANK([$'P2.Operable'.D598]);"";[$'P2.Operable'.D598]) ->  | Z28: of:=IF(ISBLANK([$'P2.Operable'.D636]);"";[$'P2.Operable'.D636]) ->  | AA28: of:=IF(ISBLANK([$'P3.Comprensible'.D28]);"";[$'P3.Comprensible'.D28]) ->  | AB28: of:=IF(ISBLANK([$'P3.Comprensible'.D104]);"";[$'P3.Comprensible'.D104]) ->  | AC28: of:=IF(ISBLANK([$'P3.Comprensible'.D142]);"";[$'P3.Comprensible'.D142]) ->  | AD28: of:=IF(ISBLANK([$'P3.Comprensible'.D256]);"";[$'P3.Comprensible'.D256]) ->  | AE28: of:=IF(ISBLANK([$'P3.Comprensible'.D294]);"";[$'P3.Comprensible'.D294]) ->  | AF28: of:=IF(ISBLANK([$'P4.Robusto'.D28]);"";[$'P4.Robusto'.D28]) ->  | AG28: of:=IF(ISBLANK([$'P4.Robusto'.D66]);"";[$'P4.Robusto'.D66]) -> 
B29: of:=IF( ISBLANK([$'03.Muestra'.$C18]);"";[$'03.Muestra'.$C18]) ->  | C29: of:=IF( ISBLANK([$'03.Muestra'.$E18]);"";[$'03.Muestra'.$E18]) ->  | D29: of:=IF(ISBLANK([$'P1.Perceptible'.D29]);"";[$'P1.Perceptible'.D29]) ->  | E29: of:=IF(ISBLANK([$'P1.Perceptible'.D67]);"";[$'P1.Perceptible'.D67]) ->  | F29: of:=IF(ISBLANK([$'P1.Perceptible'.D105]);"";[$'P1.Perceptible'.D105]) ->  | G29: of:=IF(ISBLANK([$'P1.Perceptible'.D143]);"";[$'P1.Perceptible'.D143]) ->  | H29: of:=IF(ISBLANK([$'P1.Perceptible'.D257]);"";[$'P1.Perceptible'.D257]) ->  | I29: of:=IF(ISBLANK([$'P1.Perceptible'.D295]);"";[$'P1.Perceptible'.D295]) ->  | J29: of:=IF(ISBLANK([$'P1.Perceptible'.D333]);"";[$'P1.Perceptible'.D333]) ->  | K29: of:=IF(ISBLANK([$'P1.Perceptible'.D447]);"";[$'P1.Perceptible'.D447]) ->  | L29: of:=IF(ISBLANK([$'P1.Perceptible'.D485]);"";[$'P1.Perceptible'.D485]) ->  | M29: of:=IF(ISBLANK([$'P2.Operable'.D29]);"";[$'P2.Operable'.D29]) ->  | N29: of:=IF(ISBLANK([$'P2.Operable'.D67]);"";[$'P2.Operable'.D67]) ->  | O29: of:=IF(ISBLANK([$'P2.Operable'.D105]);"";[$'P2.Operable'.D105]) ->  | P29: of:=IF(ISBLANK([$'P2.Operable'.D143]);"";[$'P2.Operable'.D143]) ->  | Q29: of:=IF(ISBLANK([$'P2.Operable'.D181]);"";[$'P2.Operable'.D181]) ->  | R29: of:=IF(ISBLANK([$'P2.Operable'.D219]);"";[$'P2.Operable'.D219]) ->  | S29: of:=IF(ISBLANK([$'P2.Operable'.D257]);"";[$'P2.Operable'.D257]) ->  | T29: of:=IF(ISBLANK([$'P2.Operable'.D295]);"";[$'P2.Operable'.D295]) ->  | U29: of:=IF(ISBLANK([$'P2.Operable'.D333]);"";[$'P2.Operable'.D333]) ->  | V29: of:=IF(ISBLANK([$'P2.Operable'.D371]);"";[$'P2.Operable'.D371]) ->  | W29: of:=IF(ISBLANK([$'P2.Operable'.D523]);"";[$'P2.Operable'.D523]) ->  | X29: of:=IF(ISBLANK([$'P2.Operable'.D561]);"";[$'P2.Operable'.D561]) ->  | Y29: of:=IF(ISBLANK([$'P2.Operable'.D599]);"";[$'P2.Operable'.D599]) ->  | Z29: of:=IF(ISBLANK([$'P2.Operable'.D637]);"";[$'P2.Operable'.D637]) ->  | AA29: of:=IF(ISBLANK([$'P3.Comprensible'.D29]);"";[$'P3.Comprensible'.D29]) ->  | AB29: of:=IF(ISBLANK([$'P3.Comprensible'.D105]);"";[$'P3.Comprensible'.D105]) ->  | AC29: of:=IF(ISBLANK([$'P3.Comprensible'.D143]);"";[$'P3.Comprensible'.D143]) ->  | AD29: of:=IF(ISBLANK([$'P3.Comprensible'.D257]);"";[$'P3.Comprensible'.D257]) ->  | AE29: of:=IF(ISBLANK([$'P3.Comprensible'.D295]);"";[$'P3.Comprensible'.D295]) ->  | AF29: of:=IF(ISBLANK([$'P4.Robusto'.D29]);"";[$'P4.Robusto'.D29]) ->  | AG29: of:=IF(ISBLANK([$'P4.Robusto'.D67]);"";[$'P4.Robusto'.D67]) -> 
B30: of:=IF( ISBLANK([$'03.Muestra'.$C19]);"";[$'03.Muestra'.$C19]) ->  | C30: of:=IF( ISBLANK([$'03.Muestra'.$E19]);"";[$'03.Muestra'.$E19]) ->  | D30: of:=IF(ISBLANK([$'P1.Perceptible'.D30]);"";[$'P1.Perceptible'.D30]) ->  | E30: of:=IF(ISBLANK([$'P1.Perceptible'.D68]);"";[$'P1.Perceptible'.D68]) ->  | F30: of:=IF(ISBLANK([$'P1.Perceptible'.D106]);"";[$'P1.Perceptible'.D106]) ->  | G30: of:=IF(ISBLANK([$'P1.Perceptible'.D144]);"";[$'P1.Perceptible'.D144]) ->  | H30: of:=IF(ISBLANK([$'P1.Perceptible'.D258]);"";[$'P1.Perceptible'.D258]) ->  | I30: of:=IF(ISBLANK([$'P1.Perceptible'.D296]);"";[$'P1.Perceptible'.D296]) ->  | J30: of:=IF(ISBLANK([$'P1.Perceptible'.D334]);"";[$'P1.Perceptible'.D334]) ->  | K30: of:=IF(ISBLANK([$'P1.Perceptible'.D448]);"";[$'P1.Perceptible'.D448]) ->  | L30: of:=IF(ISBLANK([$'P1.Perceptible'.D486]);"";[$'P1.Perceptible'.D486]) ->  | M30: of:=IF(ISBLANK([$'P2.Operable'.D30]);"";[$'P2.Operable'.D30]) ->  | N30: of:=IF(ISBLANK([$'P2.Operable'.D68]);"";[$'P2.Operable'.D68]) ->  | O30: of:=IF(ISBLANK([$'P2.Operable'.D106]);"";[$'P2.Operable'.D106]) ->  | P30: of:=IF(ISBLANK([$'P2.Operable'.D144]);"";[$'P2.Operable'.D144]) ->  | Q30: of:=IF(ISBLANK([$'P2.Operable'.D182]);"";[$'P2.Operable'.D182]) ->  | R30: of:=IF(ISBLANK([$'P2.Operable'.D220]);"";[$'P2.Operable'.D220]) ->  | S30: of:=IF(ISBLANK([$'P2.Operable'.D258]);"";[$'P2.Operable'.D258]) ->  | T30: of:=IF(ISBLANK([$'P2.Operable'.D296]);"";[$'P2.Operable'.D296]) ->  | U30: of:=IF(ISBLANK([$'P2.Operable'.D334]);"";[$'P2.Operable'.D334]) ->  | V30: of:=IF(ISBLANK([$'P2.Operable'.D372]);"";[$'P2.Operable'.D372]) ->  | W30: of:=IF(ISBLANK([$'P2.Operable'.D524]);"";[$'P2.Operable'.D524]) ->  | X30: of:=IF(ISBLANK([$'P2.Operable'.D562]);"";[$'P2.Operable'.D562]) ->  | Y30: of:=IF(ISBLANK([$'P2.Operable'.D600]);"";[$'P2.Operable'.D600]) ->  | Z30: of:=IF(ISBLANK([$'P2.Operable'.D638]);"";[$'P2.Operable'.D638]) ->  | AA30: of:=IF(ISBLANK([$'P3.Comprensible'.D30]);"";[$'P3.Comprensible'.D30]) ->  | AB30: of:=IF(ISBLANK([$'P3.Comprensible'.D106]);"";[$'P3.Comprensible'.D106]) ->  | AC30: of:=IF(ISBLANK([$'P3.Comprensible'.D144]);"";[$'P3.Comprensible'.D144]) ->  | AD30: of:=IF(ISBLANK([$'P3.Comprensible'.D258]);"";[$'P3.Comprensible'.D258]) ->  | AE30: of:=IF(ISBLANK([$'P3.Comprensible'.D296]);"";[$'P3.Comprensible'.D296]) ->  | AF30: of:=IF(ISBLANK([$'P4.Robusto'.D30]);"";[$'P4.Robusto'.D30]) ->  | AG30: of:=IF(ISBLANK([$'P4.Robusto'.D68]);"";[$'P4.Robusto'.D68]) -> 
B31: of:=IF( ISBLANK([$'03.Muestra'.$C20]);"";[$'03.Muestra'.$C20]) ->  | C31: of:=IF( ISBLANK([$'03.Muestra'.$E20]);"";[$'03.Muestra'.$E20]) ->  | D31: of:=IF(ISBLANK([$'P1.Perceptible'.D31]);"";[$'P1.Perceptible'.D31]) ->  | E31: of:=IF(ISBLANK([$'P1.Perceptible'.D69]);"";[$'P1.Perceptible'.D69]) ->  | F31: of:=IF(ISBLANK([$'P1.Perceptible'.D107]);"";[$'P1.Perceptible'.D107]) ->  | G31: of:=IF(ISBLANK([$'P1.Perceptible'.D145]);"";[$'P1.Perceptible'.D145]) ->  | H31: of:=IF(ISBLANK([$'P1.Perceptible'.D259]);"";[$'P1.Perceptible'.D259]) ->  | I31: of:=IF(ISBLANK([$'P1.Perceptible'.D297]);"";[$'P1.Perceptible'.D297]) ->  | J31: of:=IF(ISBLANK([$'P1.Perceptible'.D335]);"";[$'P1.Perceptible'.D335]) ->  | K31: of:=IF(ISBLANK([$'P1.Perceptible'.D449]);"";[$'P1.Perceptible'.D449]) ->  | L31: of:=IF(ISBLANK([$'P1.Perceptible'.D487]);"";[$'P1.Perceptible'.D487]) ->  | M31: of:=IF(ISBLANK([$'P2.Operable'.D31]);"";[$'P2.Operable'.D31]) ->  | N31: of:=IF(ISBLANK([$'P2.Operable'.D69]);"";[$'P2.Operable'.D69]) ->  | O31: of:=IF(ISBLANK([$'P2.Operable'.D107]);"";[$'P2.Operable'.D107]) ->  | P31: of:=IF(ISBLANK([$'P2.Operable'.D145]);"";[$'P2.Operable'.D145]) ->  | Q31: of:=IF(ISBLANK([$'P2.Operable'.D183]);"";[$'P2.Operable'.D183]) ->  | R31: of:=IF(ISBLANK([$'P2.Operable'.D221]);"";[$'P2.Operable'.D221]) ->  | S31: of:=IF(ISBLANK([$'P2.Operable'.D259]);"";[$'P2.Operable'.D259]) ->  | T31: of:=IF(ISBLANK([$'P2.Operable'.D297]);"";[$'P2.Operable'.D297]) ->  | U31: of:=IF(ISBLANK([$'P2.Operable'.D335]);"";[$'P2.Operable'.D335]) ->  | V31: of:=IF(ISBLANK([$'P2.Operable'.D373]);"";[$'P2.Operable'.D373]) ->  | W31: of:=IF(ISBLANK([$'P2.Operable'.D525]);"";[$'P2.Operable'.D525]) ->  | X31: of:=IF(ISBLANK([$'P2.Operable'.D563]);"";[$'P2.Operable'.D563]) ->  | Y31: of:=IF(ISBLANK([$'P2.Operable'.D601]);"";[$'P2.Operable'.D601]) ->  | Z31: of:=IF(ISBLANK([$'P2.Operable'.D639]);"";[$'P2.Operable'.D639]) ->  | AA31: of:=IF(ISBLANK([$'P3.Comprensible'.D31]);"";[$'P3.Comprensible'.D31]) ->  | AB31: of:=IF(ISBLANK([$'P3.Comprensible'.D107]);"";[$'P3.Comprensible'.D107]) ->  | AC31: of:=IF(ISBLANK([$'P3.Comprensible'.D145]);"";[$'P3.Comprensible'.D145]) ->  | AD31: of:=IF(ISBLANK([$'P3.Comprensible'.D259]);"";[$'P3.Comprensible'.D259]) ->  | AE31: of:=IF(ISBLANK([$'P3.Comprensible'.D297]);"";[$'P3.Comprensible'.D297]) ->  | AF31: of:=IF(ISBLANK([$'P4.Robusto'.D31]);"";[$'P4.Robusto'.D31]) ->  | AG31: of:=IF(ISBLANK([$'P4.Robusto'.D69]);"";[$'P4.Robusto'.D69]) -> 
B32: of:=IF( ISBLANK([$'03.Muestra'.$C21]);"";[$'03.Muestra'.$C21]) ->  | C32: of:=IF( ISBLANK([$'03.Muestra'.$E21]);"";[$'03.Muestra'.$E21]) ->  | D32: of:=IF(ISBLANK([$'P1.Perceptible'.D32]);"";[$'P1.Perceptible'.D32]) ->  | E32: of:=IF(ISBLANK([$'P1.Perceptible'.D70]);"";[$'P1.Perceptible'.D70]) ->  | F32: of:=IF(ISBLANK([$'P1.Perceptible'.D108]);"";[$'P1.Perceptible'.D108]) ->  | G32: of:=IF(ISBLANK([$'P1.Perceptible'.D146]);"";[$'P1.Perceptible'.D146]) ->  | H32: of:=IF(ISBLANK([$'P1.Perceptible'.D260]);"";[$'P1.Perceptible'.D260]) ->  | I32: of:=IF(ISBLANK([$'P1.Perceptible'.D298]);"";[$'P1.Perceptible'.D298]) ->  | J32: of:=IF(ISBLANK([$'P1.Perceptible'.D336]);"";[$'P1.Perceptible'.D336]) ->  | K32: of:=IF(ISBLANK([$'P1.Perceptible'.D450]);"";[$'P1.Perceptible'.D450]) ->  | L32: of:=IF(ISBLANK([$'P1.Perceptible'.D488]);"";[$'P1.Perceptible'.D488]) ->  | M32: of:=IF(ISBLANK([$'P2.Operable'.D32]);"";[$'P2.Operable'.D32]) ->  | N32: of:=IF(ISBLANK([$'P2.Operable'.D70]);"";[$'P2.Operable'.D70]) ->  | O32: of:=IF(ISBLANK([$'P2.Operable'.D108]);"";[$'P2.Operable'.D108]) ->  | P32: of:=IF(ISBLANK([$'P2.Operable'.D146]);"";[$'P2.Operable'.D146]) ->  | Q32: of:=IF(ISBLANK([$'P2.Operable'.D184]);"";[$'P2.Operable'.D184]) ->  | R32: of:=IF(ISBLANK([$'P2.Operable'.D222]);"";[$'P2.Operable'.D222]) ->  | S32: of:=IF(ISBLANK([$'P2.Operable'.D260]);"";[$'P2.Operable'.D260]) ->  | T32: of:=IF(ISBLANK([$'P2.Operable'.D298]);"";[$'P2.Operable'.D298]) ->  | U32: of:=IF(ISBLANK([$'P2.Operable'.D336]);"";[$'P2.Operable'.D336]) ->  | V32: of:=IF(ISBLANK([$'P2.Operable'.D374]);"";[$'P2.Operable'.D374]) ->  | W32: of:=IF(ISBLANK([$'P2.Operable'.D526]);"";[$'P2.Operable'.D526]) ->  | X32: of:=IF(ISBLANK([$'P2.Operable'.D564]);"";[$'P2.Operable'.D564]) ->  | Y32: of:=IF(ISBLANK([$'P2.Operable'.D602]);"";[$'P2.Operable'.D602]) ->  | Z32: of:=IF(ISBLANK([$'P2.Operable'.D640]);"";[$'P2.Operable'.D640]) ->  | AA32: of:=IF(ISBLANK([$'P3.Comprensible'.D32]);"";[$'P3.Comprensible'.D32]) ->  | AB32: of:=IF(ISBLANK([$'P3.Comprensible'.D108]);"";[$'P3.Comprensible'.D108]) ->  | AC32: of:=IF(ISBLANK([$'P3.Comprensible'.D146]);"";[$'P3.Comprensible'.D146]) ->  | AD32: of:=IF(ISBLANK([$'P3.Comprensible'.D260]);"";[$'P3.Comprensible'.D260]) ->  | AE32: of:=IF(ISBLANK([$'P3.Comprensible'.D298]);"";[$'P3.Comprensible'.D298]) ->  | AF32: of:=IF(ISBLANK([$'P4.Robusto'.D32]);"";[$'P4.Robusto'.D32]) ->  | AG32: of:=IF(ISBLANK([$'P4.Robusto'.D70]);"";[$'P4.Robusto'.D70]) -> 
B33: of:=IF( ISBLANK([$'03.Muestra'.$C22]);"";[$'03.Muestra'.$C22]) ->  | C33: of:=IF( ISBLANK([$'03.Muestra'.$E22]);"";[$'03.Muestra'.$E22]) ->  | D33: of:=IF(ISBLANK([$'P1.Perceptible'.D33]);"";[$'P1.Perceptible'.D33]) ->  | E33: of:=IF(ISBLANK([$'P1.Perceptible'.D71]);"";[$'P1.Perceptible'.D71]) ->  | F33: of:=IF(ISBLANK([$'P1.Perceptible'.D109]);"";[$'P1.Perceptible'.D109]) ->  | G33: of:=IF(ISBLANK([$'P1.Perceptible'.D147]);"";[$'P1.Perceptible'.D147]) ->  | H33: of:=IF(ISBLANK([$'P1.Perceptible'.D261]);"";[$'P1.Perceptible'.D261]) ->  | I33: of:=IF(ISBLANK([$'P1.Perceptible'.D299]);"";[$'P1.Perceptible'.D299]) ->  | J33: of:=IF(ISBLANK([$'P1.Perceptible'.D337]);"";[$'P1.Perceptible'.D337]) ->  | K33: of:=IF(ISBLANK([$'P1.Perceptible'.D451]);"";[$'P1.Perceptible'.D451]) ->  | L33: of:=IF(ISBLANK([$'P1.Perceptible'.D489]);"";[$'P1.Perceptible'.D489]) ->  | M33: of:=IF(ISBLANK([$'P2.Operable'.D33]);"";[$'P2.Operable'.D33]) ->  | N33: of:=IF(ISBLANK([$'P2.Operable'.D71]);"";[$'P2.Operable'.D71]) ->  | O33: of:=IF(ISBLANK([$'P2.Operable'.D109]);"";[$'P2.Operable'.D109]) ->  | P33: of:=IF(ISBLANK([$'P2.Operable'.D147]);"";[$'P2.Operable'.D147]) ->  | Q33: of:=IF(ISBLANK([$'P2.Operable'.D185]);"";[$'P2.Operable'.D185]) ->  | R33: of:=IF(ISBLANK([$'P2.Operable'.D223]);"";[$'P2.Operable'.D223]) ->  | S33: of:=IF(ISBLANK([$'P2.Operable'.D261]);"";[$'P2.Operable'.D261]) ->  | T33: of:=IF(ISBLANK([$'P2.Operable'.D299]);"";[$'P2.Operable'.D299]) ->  | U33: of:=IF(ISBLANK([$'P2.Operable'.D337]);"";[$'P2.Operable'.D337]) ->  | V33: of:=IF(ISBLANK([$'P2.Operable'.D375]);"";[$'P2.Operable'.D375]) ->  | W33: of:=IF(ISBLANK([$'P2.Operable'.D527]);"";[$'P2.Operable'.D527]) ->  | X33: of:=IF(ISBLANK([$'P2.Operable'.D565]);"";[$'P2.Operable'.D565]) ->  | Y33: of:=IF(ISBLANK([$'P2.Operable'.D603]);"";[$'P2.Operable'.D603]) ->  | Z33: of:=IF(ISBLANK([$'P2.Operable'.D641]);"";[$'P2.Operable'.D641]) ->  | AA33: of:=IF(ISBLANK([$'P3.Comprensible'.D33]);"";[$'P3.Comprensible'.D33]) ->  | AB33: of:=IF(ISBLANK([$'P3.Comprensible'.D109]);"";[$'P3.Comprensible'.D109]) ->  | AC33: of:=IF(ISBLANK([$'P3.Comprensible'.D147]);"";[$'P3.Comprensible'.D147]) ->  | AD33: of:=IF(ISBLANK([$'P3.Comprensible'.D261]);"";[$'P3.Comprensible'.D261]) ->  | AE33: of:=IF(ISBLANK([$'P3.Comprensible'.D299]);"";[$'P3.Comprensible'.D299]) ->  | AF33: of:=IF(ISBLANK([$'P4.Robusto'.D33]);"";[$'P4.Robusto'.D33]) ->  | AG33: of:=IF(ISBLANK([$'P4.Robusto'.D71]);"";[$'P4.Robusto'.D71]) -> 
B34: of:=IF( ISBLANK([$'03.Muestra'.$C23]);"";[$'03.Muestra'.$C23]) ->  | C34: of:=IF( ISBLANK([$'03.Muestra'.$E23]);"";[$'03.Muestra'.$E23]) ->  | D34: of:=IF(ISBLANK([$'P1.Perceptible'.D34]);"";[$'P1.Perceptible'.D34]) ->  | E34: of:=IF(ISBLANK([$'P1.Perceptible'.D72]);"";[$'P1.Perceptible'.D72]) ->  | F34: of:=IF(ISBLANK([$'P1.Perceptible'.D110]);"";[$'P1.Perceptible'.D110]) ->  | G34: of:=IF(ISBLANK([$'P1.Perceptible'.D148]);"";[$'P1.Perceptible'.D148]) ->  | H34: of:=IF(ISBLANK([$'P1.Perceptible'.D262]);"";[$'P1.Perceptible'.D262]) ->  | I34: of:=IF(ISBLANK([$'P1.Perceptible'.D300]);"";[$'P1.Perceptible'.D300]) ->  | J34: of:=IF(ISBLANK([$'P1.Perceptible'.D338]);"";[$'P1.Perceptible'.D338]) ->  | K34: of:=IF(ISBLANK([$'P1.Perceptible'.D452]);"";[$'P1.Perceptible'.D452]) ->  | L34: of:=IF(ISBLANK([$'P1.Perceptible'.D490]);"";[$'P1.Perceptible'.D490]) ->  | M34: of:=IF(ISBLANK([$'P2.Operable'.D34]);"";[$'P2.Operable'.D34]) ->  | N34: of:=IF(ISBLANK([$'P2.Operable'.D72]);"";[$'P2.Operable'.D72]) ->  | O34: of:=IF(ISBLANK([$'P2.Operable'.D110]);"";[$'P2.Operable'.D110]) ->  | P34: of:=IF(ISBLANK([$'P2.Operable'.D148]);"";[$'P2.Operable'.D148]) ->  | Q34: of:=IF(ISBLANK([$'P2.Operable'.D186]);"";[$'P2.Operable'.D186]) ->  | R34: of:=IF(ISBLANK([$'P2.Operable'.D224]);"";[$'P2.Operable'.D224]) ->  | S34: of:=IF(ISBLANK([$'P2.Operable'.D262]);"";[$'P2.Operable'.D262]) ->  | T34: of:=IF(ISBLANK([$'P2.Operable'.D300]);"";[$'P2.Operable'.D300]) ->  | U34: of:=IF(ISBLANK([$'P2.Operable'.D338]);"";[$'P2.Operable'.D338]) ->  | V34: of:=IF(ISBLANK([$'P2.Operable'.D376]);"";[$'P2.Operable'.D376]) ->  | W34: of:=IF(ISBLANK([$'P2.Operable'.D528]);"";[$'P2.Operable'.D528]) ->  | X34: of:=IF(ISBLANK([$'P2.Operable'.D566]);"";[$'P2.Operable'.D566]) ->  | Y34: of:=IF(ISBLANK([$'P2.Operable'.D604]);"";[$'P2.Operable'.D604]) ->  | Z34: of:=IF(ISBLANK([$'P2.Operable'.D642]);"";[$'P2.Operable'.D642]) ->  | AA34: of:=IF(ISBLANK([$'P3.Comprensible'.D34]);"";[$'P3.Comprensible'.D34]) ->  | AB34: of:=IF(ISBLANK([$'P3.Comprensible'.D110]);"";[$'P3.Comprensible'.D110]) ->  | AC34: of:=IF(ISBLANK([$'P3.Comprensible'.D148]);"";[$'P3.Comprensible'.D148]) ->  | AD34: of:=IF(ISBLANK([$'P3.Comprensible'.D262]);"";[$'P3.Comprensible'.D262]) ->  | AE34: of:=IF(ISBLANK([$'P3.Comprensible'.D300]);"";[$'P3.Comprensible'.D300]) ->  | AF34: of:=IF(ISBLANK([$'P4.Robusto'.D34]);"";[$'P4.Robusto'.D34]) ->  | AG34: of:=IF(ISBLANK([$'P4.Robusto'.D72]);"";[$'P4.Robusto'.D72]) -> 
B35: of:=IF( ISBLANK([$'03.Muestra'.$C24]);"";[$'03.Muestra'.$C24]) ->  | C35: of:=IF( ISBLANK([$'03.Muestra'.$E24]);"";[$'03.Muestra'.$E24]) ->  | D35: of:=IF(ISBLANK([$'P1.Perceptible'.D35]);"";[$'P1.Perceptible'.D35]) ->  | E35: of:=IF(ISBLANK([$'P1.Perceptible'.D73]);"";[$'P1.Perceptible'.D73]) ->  | F35: of:=IF(ISBLANK([$'P1.Perceptible'.D111]);"";[$'P1.Perceptible'.D111]) ->  | G35: of:=IF(ISBLANK([$'P1.Perceptible'.D149]);"";[$'P1.Perceptible'.D149]) ->  | H35: of:=IF(ISBLANK([$'P1.Perceptible'.D263]);"";[$'P1.Perceptible'.D263]) ->  | I35: of:=IF(ISBLANK([$'P1.Perceptible'.D301]);"";[$'P1.Perceptible'.D301]) ->  | J35: of:=IF(ISBLANK([$'P1.Perceptible'.D339]);"";[$'P1.Perceptible'.D339]) ->  | K35: of:=IF(ISBLANK([$'P1.Perceptible'.D453]);"";[$'P1.Perceptible'.D453]) ->  | L35: of:=IF(ISBLANK([$'P1.Perceptible'.D491]);"";[$'P1.Perceptible'.D491]) ->  | M35: of:=IF(ISBLANK([$'P2.Operable'.D35]);"";[$'P2.Operable'.D35]) ->  | N35: of:=IF(ISBLANK([$'P2.Operable'.D73]);"";[$'P2.Operable'.D73]) ->  | O35: of:=IF(ISBLANK([$'P2.Operable'.D111]);"";[$'P2.Operable'.D111]) ->  | P35: of:=IF(ISBLANK([$'P2.Operable'.D149]);"";[$'P2.Operable'.D149]) ->  | Q35: of:=IF(ISBLANK([$'P2.Operable'.D187]);"";[$'P2.Operable'.D187]) ->  | R35: of:=IF(ISBLANK([$'P2.Operable'.D225]);"";[$'P2.Operable'.D225]) ->  | S35: of:=IF(ISBLANK([$'P2.Operable'.D263]);"";[$'P2.Operable'.D263]) ->  | T35: of:=IF(ISBLANK([$'P2.Operable'.D301]);"";[$'P2.Operable'.D301]) ->  | U35: of:=IF(ISBLANK([$'P2.Operable'.D339]);"";[$'P2.Operable'.D339]) ->  | V35: of:=IF(ISBLANK([$'P2.Operable'.D377]);"";[$'P2.Operable'.D377]) ->  | W35: of:=IF(ISBLANK([$'P2.Operable'.D529]);"";[$'P2.Operable'.D529]) ->  | X35: of:=IF(ISBLANK([$'P2.Operable'.D567]);"";[$'P2.Operable'.D567]) ->  | Y35: of:=IF(ISBLANK([$'P2.Operable'.D605]);"";[$'P2.Operable'.D605]) ->  | Z35: of:=IF(ISBLANK([$'P2.Operable'.D643]);"";[$'P2.Operable'.D643]) ->  | AA35: of:=IF(ISBLANK([$'P3.Comprensible'.D35]);"";[$'P3.Comprensible'.D35]) ->  | AB35: of:=IF(ISBLANK([$'P3.Comprensible'.D111]);"";[$'P3.Comprensible'.D111]) ->  | AC35: of:=IF(ISBLANK([$'P3.Comprensible'.D149]);"";[$'P3.Comprensible'.D149]) ->  | AD35: of:=IF(ISBLANK([$'P3.Comprensible'.D263]);"";[$'P3.Comprensible'.D263]) ->  | AE35: of:=IF(ISBLANK([$'P3.Comprensible'.D301]);"";[$'P3.Comprensible'.D301]) ->  | AF35: of:=IF(ISBLANK([$'P4.Robusto'.D35]);"";[$'P4.Robusto'.D35]) ->  | AG35: of:=IF(ISBLANK([$'P4.Robusto'.D73]);"";[$'P4.Robusto'.D73]) -> 
B36: of:=IF( ISBLANK([$'03.Muestra'.$C25]);"";[$'03.Muestra'.$C25]) ->  | C36: of:=IF( ISBLANK([$'03.Muestra'.$E25]);"";[$'03.Muestra'.$E25]) ->  | D36: of:=IF(ISBLANK([$'P1.Perceptible'.D36]);"";[$'P1.Perceptible'.D36]) ->  | E36: of:=IF(ISBLANK([$'P1.Perceptible'.D74]);"";[$'P1.Perceptible'.D74]) ->  | F36: of:=IF(ISBLANK([$'P1.Perceptible'.D112]);"";[$'P1.Perceptible'.D112]) ->  | G36: of:=IF(ISBLANK([$'P1.Perceptible'.D150]);"";[$'P1.Perceptible'.D150]) ->  | H36: of:=IF(ISBLANK([$'P1.Perceptible'.D264]);"";[$'P1.Perceptible'.D264]) ->  | I36: of:=IF(ISBLANK([$'P1.Perceptible'.D302]);"";[$'P1.Perceptible'.D302]) ->  | J36: of:=IF(ISBLANK([$'P1.Perceptible'.D340]);"";[$'P1.Perceptible'.D340]) ->  | K36: of:=IF(ISBLANK([$'P1.Perceptible'.D454]);"";[$'P1.Perceptible'.D454]) ->  | L36: of:=IF(ISBLANK([$'P1.Perceptible'.D492]);"";[$'P1.Perceptible'.D492]) ->  | M36: of:=IF(ISBLANK([$'P2.Operable'.D36]);"";[$'P2.Operable'.D36]) ->  | N36: of:=IF(ISBLANK([$'P2.Operable'.D74]);"";[$'P2.Operable'.D74]) ->  | O36: of:=IF(ISBLANK([$'P2.Operable'.D112]);"";[$'P2.Operable'.D112]) ->  | P36: of:=IF(ISBLANK([$'P2.Operable'.D150]);"";[$'P2.Operable'.D150]) ->  | Q36: of:=IF(ISBLANK([$'P2.Operable'.D188]);"";[$'P2.Operable'.D188]) ->  | R36: of:=IF(ISBLANK([$'P2.Operable'.D226]);"";[$'P2.Operable'.D226]) ->  | S36: of:=IF(ISBLANK([$'P2.Operable'.D264]);"";[$'P2.Operable'.D264]) ->  | T36: of:=IF(ISBLANK([$'P2.Operable'.D302]);"";[$'P2.Operable'.D302]) ->  | U36: of:=IF(ISBLANK([$'P2.Operable'.D340]);"";[$'P2.Operable'.D340]) ->  | V36: of:=IF(ISBLANK([$'P2.Operable'.D378]);"";[$'P2.Operable'.D378]) ->  | W36: of:=IF(ISBLANK([$'P2.Operable'.D530]);"";[$'P2.Operable'.D530]) ->  | X36: of:=IF(ISBLANK([$'P2.Operable'.D568]);"";[$'P2.Operable'.D568]) ->  | Y36: of:=IF(ISBLANK([$'P2.Operable'.D606]);"";[$'P2.Operable'.D606]) ->  | Z36: of:=IF(ISBLANK([$'P2.Operable'.D644]);"";[$'P2.Operable'.D644]) ->  | AA36: of:=IF(ISBLANK([$'P3.Comprensible'.D36]);"";[$'P3.Comprensible'.D36]) ->  | AB36: of:=IF(ISBLANK([$'P3.Comprensible'.D112]);"";[$'P3.Comprensible'.D112]) ->  | AC36: of:=IF(ISBLANK([$'P3.Comprensible'.D150]);"";[$'P3.Comprensible'.D150]) ->  | AD36: of:=IF(ISBLANK([$'P3.Comprensible'.D264]);"";[$'P3.Comprensible'.D264]) ->  | AE36: of:=IF(ISBLANK([$'P3.Comprensible'.D302]);"";[$'P3.Comprensible'.D302]) ->  | AF36: of:=IF(ISBLANK([$'P4.Robusto'.D36]);"";[$'P4.Robusto'.D36]) ->  | AG36: of:=IF(ISBLANK([$'P4.Robusto'.D74]);"";[$'P4.Robusto'.D74]) -> 
B37: of:=IF( ISBLANK([$'03.Muestra'.$C26]);"";[$'03.Muestra'.$C26]) ->  | C37: of:=IF( ISBLANK([$'03.Muestra'.$E26]);"";[$'03.Muestra'.$E26]) ->  | D37: of:=IF(ISBLANK([$'P1.Perceptible'.D37]);"";[$'P1.Perceptible'.D37]) ->  | E37: of:=IF(ISBLANK([$'P1.Perceptible'.D75]);"";[$'P1.Perceptible'.D75]) ->  | F37: of:=IF(ISBLANK([$'P1.Perceptible'.D113]);"";[$'P1.Perceptible'.D113]) ->  | G37: of:=IF(ISBLANK([$'P1.Perceptible'.D151]);"";[$'P1.Perceptible'.D151]) ->  | H37: of:=IF(ISBLANK([$'P1.Perceptible'.D265]);"";[$'P1.Perceptible'.D265]) ->  | I37: of:=IF(ISBLANK([$'P1.Perceptible'.D303]);"";[$'P1.Perceptible'.D303]) ->  | J37: of:=IF(ISBLANK([$'P1.Perceptible'.D341]);"";[$'P1.Perceptible'.D341]) ->  | K37: of:=IF(ISBLANK([$'P1.Perceptible'.D455]);"";[$'P1.Perceptible'.D455]) ->  | L37: of:=IF(ISBLANK([$'P1.Perceptible'.D493]);"";[$'P1.Perceptible'.D493]) ->  | M37: of:=IF(ISBLANK([$'P2.Operable'.D37]);"";[$'P2.Operable'.D37]) ->  | N37: of:=IF(ISBLANK([$'P2.Operable'.D75]);"";[$'P2.Operable'.D75]) ->  | O37: of:=IF(ISBLANK([$'P2.Operable'.D113]);"";[$'P2.Operable'.D113]) ->  | P37: of:=IF(ISBLANK([$'P2.Operable'.D151]);"";[$'P2.Operable'.D151]) ->  | Q37: of:=IF(ISBLANK([$'P2.Operable'.D189]);"";[$'P2.Operable'.D189]) ->  | R37: of:=IF(ISBLANK([$'P2.Operable'.D227]);"";[$'P2.Operable'.D227]) ->  | S37: of:=IF(ISBLANK([$'P2.Operable'.D265]);"";[$'P2.Operable'.D265]) ->  | T37: of:=IF(ISBLANK([$'P2.Operable'.D303]);"";[$'P2.Operable'.D303]) ->  | U37: of:=IF(ISBLANK([$'P2.Operable'.D341]);"";[$'P2.Operable'.D341]) ->  | V37: of:=IF(ISBLANK([$'P2.Operable'.D379]);"";[$'P2.Operable'.D379]) ->  | W37: of:=IF(ISBLANK([$'P2.Operable'.D531]);"";[$'P2.Operable'.D531]) ->  | X37: of:=IF(ISBLANK([$'P2.Operable'.D569]);"";[$'P2.Operable'.D569]) ->  | Y37: of:=IF(ISBLANK([$'P2.Operable'.D607]);"";[$'P2.Operable'.D607]) ->  | Z37: of:=IF(ISBLANK([$'P2.Operable'.D645]);"";[$'P2.Operable'.D645]) ->  | AA37: of:=IF(ISBLANK([$'P3.Comprensible'.D37]);"";[$'P3.Comprensible'.D37]) ->  | AB37: of:=IF(ISBLANK([$'P3.Comprensible'.D113]);"";[$'P3.Comprensible'.D113]) ->  | AC37: of:=IF(ISBLANK([$'P3.Comprensible'.D151]);"";[$'P3.Comprensible'.D151]) ->  | AD37: of:=IF(ISBLANK([$'P3.Comprensible'.D265]);"";[$'P3.Comprensible'.D265]) ->  | AE37: of:=IF(ISBLANK([$'P3.Comprensible'.D303]);"";[$'P3.Comprensible'.D303]) ->  | AF37: of:=IF(ISBLANK([$'P4.Robusto'.D37]);"";[$'P4.Robusto'.D37]) ->  | AG37: of:=IF(ISBLANK([$'P4.Robusto'.D75]);"";[$'P4.Robusto'.D75]) -> 
B38: of:=IF( ISBLANK([$'03.Muestra'.$C27]);"";[$'03.Muestra'.$C27]) ->  | C38: of:=IF( ISBLANK([$'03.Muestra'.$E27]);"";[$'03.Muestra'.$E27]) ->  | D38: of:=IF(ISBLANK([$'P1.Perceptible'.D38]);"";[$'P1.Perceptible'.D38]) ->  | E38: of:=IF(ISBLANK([$'P1.Perceptible'.D76]);"";[$'P1.Perceptible'.D76]) ->  | F38: of:=IF(ISBLANK([$'P1.Perceptible'.D114]);"";[$'P1.Perceptible'.D114]) ->  | G38: of:=IF(ISBLANK([$'P1.Perceptible'.D152]);"";[$'P1.Perceptible'.D152]) ->  | H38: of:=IF(ISBLANK([$'P1.Perceptible'.D266]);"";[$'P1.Perceptible'.D266]) ->  | I38: of:=IF(ISBLANK([$'P1.Perceptible'.D304]);"";[$'P1.Perceptible'.D304]) ->  | J38: of:=IF(ISBLANK([$'P1.Perceptible'.D342]);"";[$'P1.Perceptible'.D342]) ->  | K38: of:=IF(ISBLANK([$'P1.Perceptible'.D456]);"";[$'P1.Perceptible'.D456]) ->  | L38: of:=IF(ISBLANK([$'P1.Perceptible'.D494]);"";[$'P1.Perceptible'.D494]) ->  | M38: of:=IF(ISBLANK([$'P2.Operable'.D38]);"";[$'P2.Operable'.D38]) ->  | N38: of:=IF(ISBLANK([$'P2.Operable'.D76]);"";[$'P2.Operable'.D76]) ->  | O38: of:=IF(ISBLANK([$'P2.Operable'.D114]);"";[$'P2.Operable'.D114]) ->  | P38: of:=IF(ISBLANK([$'P2.Operable'.D152]);"";[$'P2.Operable'.D152]) ->  | Q38: of:=IF(ISBLANK([$'P2.Operable'.D190]);"";[$'P2.Operable'.D190]) ->  | R38: of:=IF(ISBLANK([$'P2.Operable'.D228]);"";[$'P2.Operable'.D228]) ->  | S38: of:=IF(ISBLANK([$'P2.Operable'.D266]);"";[$'P2.Operable'.D266]) ->  | T38: of:=IF(ISBLANK([$'P2.Operable'.D304]);"";[$'P2.Operable'.D304]) ->  | U38: of:=IF(ISBLANK([$'P2.Operable'.D342]);"";[$'P2.Operable'.D342]) ->  | V38: of:=IF(ISBLANK([$'P2.Operable'.D380]);"";[$'P2.Operable'.D380]) ->  | W38: of:=IF(ISBLANK([$'P2.Operable'.D532]);"";[$'P2.Operable'.D532]) ->  | X38: of:=IF(ISBLANK([$'P2.Operable'.D570]);"";[$'P2.Operable'.D570]) ->  | Y38: of:=IF(ISBLANK([$'P2.Operable'.D608]);"";[$'P2.Operable'.D608]) ->  | Z38: of:=IF(ISBLANK([$'P2.Operable'.D646]);"";[$'P2.Operable'.D646]) ->  | AA38: of:=IF(ISBLANK([$'P3.Comprensible'.D38]);"";[$'P3.Comprensible'.D38]) ->  | AB38: of:=IF(ISBLANK([$'P3.Comprensible'.D114]);"";[$'P3.Comprensible'.D114]) ->  | AC38: of:=IF(ISBLANK([$'P3.Comprensible'.D152]);"";[$'P3.Comprensible'.D152]) ->  | AD38: of:=IF(ISBLANK([$'P3.Comprensible'.D266]);"";[$'P3.Comprensible'.D266]) ->  | AE38: of:=IF(ISBLANK([$'P3.Comprensible'.D304]);"";[$'P3.Comprensible'.D304]) ->  | AF38: of:=IF(ISBLANK([$'P4.Robusto'.D38]);"";[$'P4.Robusto'.D38]) ->  | AG38: of:=IF(ISBLANK([$'P4.Robusto'.D76]);"";[$'P4.Robusto'.D76]) -> 
B39: of:=IF( ISBLANK([$'03.Muestra'.$C28]);"";[$'03.Muestra'.$C28]) ->  | C39: of:=IF( ISBLANK([$'03.Muestra'.$E28]);"";[$'03.Muestra'.$E28]) ->  | D39: of:=IF(ISBLANK([$'P1.Perceptible'.D39]);"";[$'P1.Perceptible'.D39]) ->  | E39: of:=IF(ISBLANK([$'P1.Perceptible'.D77]);"";[$'P1.Perceptible'.D77]) ->  | F39: of:=IF(ISBLANK([$'P1.Perceptible'.D115]);"";[$'P1.Perceptible'.D115]) ->  | G39: of:=IF(ISBLANK([$'P1.Perceptible'.D153]);"";[$'P1.Perceptible'.D153]) ->  | H39: of:=IF(ISBLANK([$'P1.Perceptible'.D267]);"";[$'P1.Perceptible'.D267]) ->  | I39: of:=IF(ISBLANK([$'P1.Perceptible'.D305]);"";[$'P1.Perceptible'.D305]) ->  | J39: of:=IF(ISBLANK([$'P1.Perceptible'.D343]);"";[$'P1.Perceptible'.D343]) ->  | K39: of:=IF(ISBLANK([$'P1.Perceptible'.D457]);"";[$'P1.Perceptible'.D457]) ->  | L39: of:=IF(ISBLANK([$'P1.Perceptible'.D495]);"";[$'P1.Perceptible'.D495]) ->  | M39: of:=IF(ISBLANK([$'P2.Operable'.D39]);"";[$'P2.Operable'.D39]) ->  | N39: of:=IF(ISBLANK([$'P2.Operable'.D77]);"";[$'P2.Operable'.D77]) ->  | O39: of:=IF(ISBLANK([$'P2.Operable'.D115]);"";[$'P2.Operable'.D115]) ->  | P39: of:=IF(ISBLANK([$'P2.Operable'.D153]);"";[$'P2.Operable'.D153]) ->  | Q39: of:=IF(ISBLANK([$'P2.Operable'.D191]);"";[$'P2.Operable'.D191]) ->  | R39: of:=IF(ISBLANK([$'P2.Operable'.D229]);"";[$'P2.Operable'.D229]) ->  | S39: of:=IF(ISBLANK([$'P2.Operable'.D267]);"";[$'P2.Operable'.D267]) ->  | T39: of:=IF(ISBLANK([$'P2.Operable'.D305]);"";[$'P2.Operable'.D305]) ->  | U39: of:=IF(ISBLANK([$'P2.Operable'.D343]);"";[$'P2.Operable'.D343]) ->  | V39: of:=IF(ISBLANK([$'P2.Operable'.D381]);"";[$'P2.Operable'.D381]) ->  | W39: of:=IF(ISBLANK([$'P2.Operable'.D533]);"";[$'P2.Operable'.D533]) ->  | X39: of:=IF(ISBLANK([$'P2.Operable'.D571]);"";[$'P2.Operable'.D571]) ->  | Y39: of:=IF(ISBLANK([$'P2.Operable'.D609]);"";[$'P2.Operable'.D609]) ->  | Z39: of:=IF(ISBLANK([$'P2.Operable'.D647]);"";[$'P2.Operable'.D647]) ->  | AA39: of:=IF(ISBLANK([$'P3.Comprensible'.D39]);"";[$'P3.Comprensible'.D39]) ->  | AB39: of:=IF(ISBLANK([$'P3.Comprensible'.D115]);"";[$'P3.Comprensible'.D115]) ->  | AC39: of:=IF(ISBLANK([$'P3.Comprensible'.D153]);"";[$'P3.Comprensible'.D153]) ->  | AD39: of:=IF(ISBLANK([$'P3.Comprensible'.D267]);"";[$'P3.Comprensible'.D267]) ->  | AE39: of:=IF(ISBLANK([$'P3.Comprensible'.D305]);"";[$'P3.Comprensible'.D305]) ->  | AF39: of:=IF(ISBLANK([$'P4.Robusto'.D39]);"";[$'P4.Robusto'.D39]) ->  | AG39: of:=IF(ISBLANK([$'P4.Robusto'.D77]);"";[$'P4.Robusto'.D77]) -> 
B40: of:=IF( ISBLANK([$'03.Muestra'.$C29]);"";[$'03.Muestra'.$C29]) ->  | C40: of:=IF( ISBLANK([$'03.Muestra'.$E29]);"";[$'03.Muestra'.$E29]) ->  | D40: of:=IF(ISBLANK([$'P1.Perceptible'.D40]);"";[$'P1.Perceptible'.D40]) ->  | E40: of:=IF(ISBLANK([$'P1.Perceptible'.D78]);"";[$'P1.Perceptible'.D78]) ->  | F40: of:=IF(ISBLANK([$'P1.Perceptible'.D116]);"";[$'P1.Perceptible'.D116]) ->  | G40: of:=IF(ISBLANK([$'P1.Perceptible'.D154]);"";[$'P1.Perceptible'.D154]) ->  | H40: of:=IF(ISBLANK([$'P1.Perceptible'.D268]);"";[$'P1.Perceptible'.D268]) ->  | I40: of:=IF(ISBLANK([$'P1.Perceptible'.D306]);"";[$'P1.Perceptible'.D306]) ->  | J40: of:=IF(ISBLANK([$'P1.Perceptible'.D344]);"";[$'P1.Perceptible'.D344]) ->  | K40: of:=IF(ISBLANK([$'P1.Perceptible'.D458]);"";[$'P1.Perceptible'.D458]) ->  | L40: of:=IF(ISBLANK([$'P1.Perceptible'.D496]);"";[$'P1.Perceptible'.D496]) ->  | M40: of:=IF(ISBLANK([$'P2.Operable'.D40]);"";[$'P2.Operable'.D40]) ->  | N40: of:=IF(ISBLANK([$'P2.Operable'.D78]);"";[$'P2.Operable'.D78]) ->  | O40: of:=IF(ISBLANK([$'P2.Operable'.D116]);"";[$'P2.Operable'.D116]) ->  | P40: of:=IF(ISBLANK([$'P2.Operable'.D154]);"";[$'P2.Operable'.D154]) ->  | Q40: of:=IF(ISBLANK([$'P2.Operable'.D192]);"";[$'P2.Operable'.D192]) ->  | R40: of:=IF(ISBLANK([$'P2.Operable'.D230]);"";[$'P2.Operable'.D230]) ->  | S40: of:=IF(ISBLANK([$'P2.Operable'.D268]);"";[$'P2.Operable'.D268]) ->  | T40: of:=IF(ISBLANK([$'P2.Operable'.D306]);"";[$'P2.Operable'.D306]) ->  | U40: of:=IF(ISBLANK([$'P2.Operable'.D344]);"";[$'P2.Operable'.D344]) ->  | V40: of:=IF(ISBLANK([$'P2.Operable'.D382]);"";[$'P2.Operable'.D382]) ->  | W40: of:=IF(ISBLANK([$'P2.Operable'.D534]);"";[$'P2.Operable'.D534]) ->  | X40: of:=IF(ISBLANK([$'P2.Operable'.D572]);"";[$'P2.Operable'.D572]) ->  | Y40: of:=IF(ISBLANK([$'P2.Operable'.D610]);"";[$'P2.Operable'.D610]) ->  | Z40: of:=IF(ISBLANK([$'P2.Operable'.D648]);"";[$'P2.Operable'.D648]) ->  | AA40: of:=IF(ISBLANK([$'P3.Comprensible'.D40]);"";[$'P3.Comprensible'.D40]) ->  | AB40: of:=IF(ISBLANK([$'P3.Comprensible'.D116]);"";[$'P3.Comprensible'.D116]) ->  | AC40: of:=IF(ISBLANK([$'P3.Comprensible'.D154]);"";[$'P3.Comprensible'.D154]) ->  | AD40: of:=IF(ISBLANK([$'P3.Comprensible'.D268]);"";[$'P3.Comprensible'.D268]) ->  | AE40: of:=IF(ISBLANK([$'P3.Comprensible'.D306]);"";[$'P3.Comprensible'.D306]) ->  | AF40: of:=IF(ISBLANK([$'P4.Robusto'.D40]);"";[$'P4.Robusto'.D40]) ->  | AG40: of:=IF(ISBLANK([$'P4.Robusto'.D78]);"";[$'P4.Robusto'.D78]) -> 
B41: of:=IF( ISBLANK([$'03.Muestra'.$C30]);"";[$'03.Muestra'.$C30]) ->  | C41: of:=IF( ISBLANK([$'03.Muestra'.$E30]);"";[$'03.Muestra'.$E30]) ->  | D41: of:=IF(ISBLANK([$'P1.Perceptible'.D41]);"";[$'P1.Perceptible'.D41]) ->  | E41: of:=IF(ISBLANK([$'P1.Perceptible'.D79]);"";[$'P1.Perceptible'.D79]) ->  | F41: of:=IF(ISBLANK([$'P1.Perceptible'.D117]);"";[$'P1.Perceptible'.D117]) ->  | G41: of:=IF(ISBLANK([$'P1.Perceptible'.D155]);"";[$'P1.Perceptible'.D155]) ->  | H41: of:=IF(ISBLANK([$'P1.Perceptible'.D269]);"";[$'P1.Perceptible'.D269]) ->  | I41: of:=IF(ISBLANK([$'P1.Perceptible'.D307]);"";[$'P1.Perceptible'.D307]) ->  | J41: of:=IF(ISBLANK([$'P1.Perceptible'.D345]);"";[$'P1.Perceptible'.D345]) ->  | K41: of:=IF(ISBLANK([$'P1.Perceptible'.D459]);"";[$'P1.Perceptible'.D459]) ->  | L41: of:=IF(ISBLANK([$'P1.Perceptible'.D497]);"";[$'P1.Perceptible'.D497]) ->  | M41: of:=IF(ISBLANK([$'P2.Operable'.D41]);"";[$'P2.Operable'.D41]) ->  | N41: of:=IF(ISBLANK([$'P2.Operable'.D79]);"";[$'P2.Operable'.D79]) ->  | O41: of:=IF(ISBLANK([$'P2.Operable'.D117]);"";[$'P2.Operable'.D117]) ->  | P41: of:=IF(ISBLANK([$'P2.Operable'.D155]);"";[$'P2.Operable'.D155]) ->  | Q41: of:=IF(ISBLANK([$'P2.Operable'.D193]);"";[$'P2.Operable'.D193]) ->  | R41: of:=IF(ISBLANK([$'P2.Operable'.D231]);"";[$'P2.Operable'.D231]) ->  | S41: of:=IF(ISBLANK([$'P2.Operable'.D269]);"";[$'P2.Operable'.D269]) ->  | T41: of:=IF(ISBLANK([$'P2.Operable'.D307]);"";[$'P2.Operable'.D307]) ->  | U41: of:=IF(ISBLANK([$'P2.Operable'.D345]);"";[$'P2.Operable'.D345]) ->  | V41: of:=IF(ISBLANK([$'P2.Operable'.D383]);"";[$'P2.Operable'.D383]) ->  | W41: of:=IF(ISBLANK([$'P2.Operable'.D535]);"";[$'P2.Operable'.D535]) ->  | X41: of:=IF(ISBLANK([$'P2.Operable'.D573]);"";[$'P2.Operable'.D573]) ->  | Y41: of:=IF(ISBLANK([$'P2.Operable'.D611]);"";[$'P2.Operable'.D611]) ->  | Z41: of:=IF(ISBLANK([$'P2.Operable'.D649]);"";[$'P2.Operable'.D649]) ->  | AA41: of:=IF(ISBLANK([$'P3.Comprensible'.D41]);"";[$'P3.Comprensible'.D41]) ->  | AB41: of:=IF(ISBLANK([$'P3.Comprensible'.D117]);"";[$'P3.Comprensible'.D117]) ->  | AC41: of:=IF(ISBLANK([$'P3.Comprensible'.D155]);"";[$'P3.Comprensible'.D155]) ->  | AD41: of:=IF(ISBLANK([$'P3.Comprensible'.D269]);"";[$'P3.Comprensible'.D269]) ->  | AE41: of:=IF(ISBLANK([$'P3.Comprensible'.D307]);"";[$'P3.Comprensible'.D307]) ->  | AF41: of:=IF(ISBLANK([$'P4.Robusto'.D41]);"";[$'P4.Robusto'.D41]) ->  | AG41: of:=IF(ISBLANK([$'P4.Robusto'.D79]);"";[$'P4.Robusto'.D79]) -> 
B42: of:=IF( ISBLANK([$'03.Muestra'.$C31]);"";[$'03.Muestra'.$C31]) ->  | C42: of:=IF( ISBLANK([$'03.Muestra'.$E31]);"";[$'03.Muestra'.$E31]) ->  | D42: of:=IF(ISBLANK([$'P1.Perceptible'.D42]);"";[$'P1.Perceptible'.D42]) ->  | E42: of:=IF(ISBLANK([$'P1.Perceptible'.D80]);"";[$'P1.Perceptible'.D80]) ->  | F42: of:=IF(ISBLANK([$'P1.Perceptible'.D118]);"";[$'P1.Perceptible'.D118]) ->  | G42: of:=IF(ISBLANK([$'P1.Perceptible'.D156]);"";[$'P1.Perceptible'.D156]) ->  | H42: of:=IF(ISBLANK([$'P1.Perceptible'.D270]);"";[$'P1.Perceptible'.D270]) ->  | I42: of:=IF(ISBLANK([$'P1.Perceptible'.D308]);"";[$'P1.Perceptible'.D308]) ->  | J42: of:=IF(ISBLANK([$'P1.Perceptible'.D346]);"";[$'P1.Perceptible'.D346]) ->  | K42: of:=IF(ISBLANK([$'P1.Perceptible'.D460]);"";[$'P1.Perceptible'.D460]) ->  | L42: of:=IF(ISBLANK([$'P1.Perceptible'.D498]);"";[$'P1.Perceptible'.D498]) ->  | M42: of:=IF(ISBLANK([$'P2.Operable'.D42]);"";[$'P2.Operable'.D42]) ->  | N42: of:=IF(ISBLANK([$'P2.Operable'.D80]);"";[$'P2.Operable'.D80]) ->  | O42: of:=IF(ISBLANK([$'P2.Operable'.D118]);"";[$'P2.Operable'.D118]) ->  | P42: of:=IF(ISBLANK([$'P2.Operable'.D156]);"";[$'P2.Operable'.D156]) ->  | Q42: of:=IF(ISBLANK([$'P2.Operable'.D194]);"";[$'P2.Operable'.D194]) ->  | R42: of:=IF(ISBLANK([$'P2.Operable'.D232]);"";[$'P2.Operable'.D232]) ->  | S42: of:=IF(ISBLANK([$'P2.Operable'.D270]);"";[$'P2.Operable'.D270]) ->  | T42: of:=IF(ISBLANK([$'P2.Operable'.D308]);"";[$'P2.Operable'.D308]) ->  | U42: of:=IF(ISBLANK([$'P2.Operable'.D346]);"";[$'P2.Operable'.D346]) ->  | V42: of:=IF(ISBLANK([$'P2.Operable'.D384]);"";[$'P2.Operable'.D384]) ->  | W42: of:=IF(ISBLANK([$'P2.Operable'.D536]);"";[$'P2.Operable'.D536]) ->  | X42: of:=IF(ISBLANK([$'P2.Operable'.D574]);"";[$'P2.Operable'.D574]) ->  | Y42: of:=IF(ISBLANK([$'P2.Operable'.D612]);"";[$'P2.Operable'.D612]) ->  | Z42: of:=IF(ISBLANK([$'P2.Operable'.D650]);"";[$'P2.Operable'.D650]) ->  | AA42: of:=IF(ISBLANK([$'P3.Comprensible'.D42]);"";[$'P3.Comprensible'.D42]) ->  | AB42: of:=IF(ISBLANK([$'P3.Comprensible'.D118]);"";[$'P3.Comprensible'.D118]) ->  | AC42: of:=IF(ISBLANK([$'P3.Comprensible'.D156]);"";[$'P3.Comprensible'.D156]) ->  | AD42: of:=IF(ISBLANK([$'P3.Comprensible'.D270]);"";[$'P3.Comprensible'.D270]) ->  | AE42: of:=IF(ISBLANK([$'P3.Comprensible'.D308]);"";[$'P3.Comprensible'.D308]) ->  | AF42: of:=IF(ISBLANK([$'P4.Robusto'.D42]);"";[$'P4.Robusto'.D42]) ->  | AG42: of:=IF(ISBLANK([$'P4.Robusto'.D80]);"";[$'P4.Robusto'.D80]) -> 
B43: of:=IF( ISBLANK([$'03.Muestra'.$C32]);"";[$'03.Muestra'.$C32]) ->  | C43: of:=IF( ISBLANK([$'03.Muestra'.$E32]);"";[$'03.Muestra'.$E32]) ->  | D43: of:=IF(ISBLANK([$'P1.Perceptible'.D43]);"";[$'P1.Perceptible'.D43]) ->  | E43: of:=IF(ISBLANK([$'P1.Perceptible'.D81]);"";[$'P1.Perceptible'.D81]) ->  | F43: of:=IF(ISBLANK([$'P1.Perceptible'.D119]);"";[$'P1.Perceptible'.D119]) ->  | G43: of:=IF(ISBLANK([$'P1.Perceptible'.D157]);"";[$'P1.Perceptible'.D157]) ->  | H43: of:=IF(ISBLANK([$'P1.Perceptible'.D271]);"";[$'P1.Perceptible'.D271]) ->  | I43: of:=IF(ISBLANK([$'P1.Perceptible'.D309]);"";[$'P1.Perceptible'.D309]) ->  | J43: of:=IF(ISBLANK([$'P1.Perceptible'.D347]);"";[$'P1.Perceptible'.D347]) ->  | K43: of:=IF(ISBLANK([$'P1.Perceptible'.D461]);"";[$'P1.Perceptible'.D461]) ->  | L43: of:=IF(ISBLANK([$'P1.Perceptible'.D499]);"";[$'P1.Perceptible'.D499]) ->  | M43: of:=IF(ISBLANK([$'P2.Operable'.D43]);"";[$'P2.Operable'.D43]) ->  | N43: of:=IF(ISBLANK([$'P2.Operable'.D81]);"";[$'P2.Operable'.D81]) ->  | O43: of:=IF(ISBLANK([$'P2.Operable'.D119]);"";[$'P2.Operable'.D119]) ->  | P43: of:=IF(ISBLANK([$'P2.Operable'.D157]);"";[$'P2.Operable'.D157]) ->  | Q43: of:=IF(ISBLANK([$'P2.Operable'.D195]);"";[$'P2.Operable'.D195]) ->  | R43: of:=IF(ISBLANK([$'P2.Operable'.D233]);"";[$'P2.Operable'.D233]) ->  | S43: of:=IF(ISBLANK([$'P2.Operable'.D271]);"";[$'P2.Operable'.D271]) ->  | T43: of:=IF(ISBLANK([$'P2.Operable'.D309]);"";[$'P2.Operable'.D309]) ->  | U43: of:=IF(ISBLANK([$'P2.Operable'.D347]);"";[$'P2.Operable'.D347]) ->  | V43: of:=IF(ISBLANK([$'P2.Operable'.D385]);"";[$'P2.Operable'.D385]) ->  | W43: of:=IF(ISBLANK([$'P2.Operable'.D537]);"";[$'P2.Operable'.D537]) ->  | X43: of:=IF(ISBLANK([$'P2.Operable'.D575]);"";[$'P2.Operable'.D575]) ->  | Y43: of:=IF(ISBLANK([$'P2.Operable'.D613]);"";[$'P2.Operable'.D613]) ->  | Z43: of:=IF(ISBLANK([$'P2.Operable'.D651]);"";[$'P2.Operable'.D651]) ->  | AA43: of:=IF(ISBLANK([$'P3.Comprensible'.D43]);"";[$'P3.Comprensible'.D43]) ->  | AB43: of:=IF(ISBLANK([$'P3.Comprensible'.D119]);"";[$'P3.Comprensible'.D119]) ->  | AC43: of:=IF(ISBLANK([$'P3.Comprensible'.D157]);"";[$'P3.Comprensible'.D157]) ->  | AD43: of:=IF(ISBLANK([$'P3.Comprensible'.D271]);"";[$'P3.Comprensible'.D271]) ->  | AE43: of:=IF(ISBLANK([$'P3.Comprensible'.D309]);"";[$'P3.Comprensible'.D309]) ->  | AF43: of:=IF(ISBLANK([$'P4.Robusto'.D43]);"";[$'P4.Robusto'.D43]) ->  | AG43: of:=IF(ISBLANK([$'P4.Robusto'.D81]);"";[$'P4.Robusto'.D81]) -> 
B44: of:=IF( ISBLANK([$'03.Muestra'.$C33]);"";[$'03.Muestra'.$C33]) ->  | C44: of:=IF( ISBLANK([$'03.Muestra'.$E33]);"";[$'03.Muestra'.$E33]) ->  | D44: of:=IF(ISBLANK([$'P1.Perceptible'.D44]);"";[$'P1.Perceptible'.D44]) ->  | E44: of:=IF(ISBLANK([$'P1.Perceptible'.D82]);"";[$'P1.Perceptible'.D82]) ->  | F44: of:=IF(ISBLANK([$'P1.Perceptible'.D120]);"";[$'P1.Perceptible'.D120]) ->  | G44: of:=IF(ISBLANK([$'P1.Perceptible'.D158]);"";[$'P1.Perceptible'.D158]) ->  | H44: of:=IF(ISBLANK([$'P1.Perceptible'.D272]);"";[$'P1.Perceptible'.D272]) ->  | I44: of:=IF(ISBLANK([$'P1.Perceptible'.D310]);"";[$'P1.Perceptible'.D310]) ->  | J44: of:=IF(ISBLANK([$'P1.Perceptible'.D348]);"";[$'P1.Perceptible'.D348]) ->  | K44: of:=IF(ISBLANK([$'P1.Perceptible'.D462]);"";[$'P1.Perceptible'.D462]) ->  | L44: of:=IF(ISBLANK([$'P1.Perceptible'.D500]);"";[$'P1.Perceptible'.D500]) ->  | M44: of:=IF(ISBLANK([$'P2.Operable'.D44]);"";[$'P2.Operable'.D44]) ->  | N44: of:=IF(ISBLANK([$'P2.Operable'.D82]);"";[$'P2.Operable'.D82]) ->  | O44: of:=IF(ISBLANK([$'P2.Operable'.D120]);"";[$'P2.Operable'.D120]) ->  | P44: of:=IF(ISBLANK([$'P2.Operable'.D158]);"";[$'P2.Operable'.D158]) ->  | Q44: of:=IF(ISBLANK([$'P2.Operable'.D196]);"";[$'P2.Operable'.D196]) ->  | R44: of:=IF(ISBLANK([$'P2.Operable'.D234]);"";[$'P2.Operable'.D234]) ->  | S44: of:=IF(ISBLANK([$'P2.Operable'.D272]);"";[$'P2.Operable'.D272]) ->  | T44: of:=IF(ISBLANK([$'P2.Operable'.D310]);"";[$'P2.Operable'.D310]) ->  | U44: of:=IF(ISBLANK([$'P2.Operable'.D348]);"";[$'P2.Operable'.D348]) ->  | V44: of:=IF(ISBLANK([$'P2.Operable'.D386]);"";[$'P2.Operable'.D386]) ->  | W44: of:=IF(ISBLANK([$'P2.Operable'.D538]);"";[$'P2.Operable'.D538]) ->  | X44: of:=IF(ISBLANK([$'P2.Operable'.D576]);"";[$'P2.Operable'.D576]) ->  | Y44: of:=IF(ISBLANK([$'P2.Operable'.D614]);"";[$'P2.Operable'.D614]) ->  | Z44: of:=IF(ISBLANK([$'P2.Operable'.D652]);"";[$'P2.Operable'.D652]) ->  | AA44: of:=IF(ISBLANK([$'P3.Comprensible'.D44]);"";[$'P3.Comprensible'.D44]) ->  | AB44: of:=IF(ISBLANK([$'P3.Comprensible'.D120]);"";[$'P3.Comprensible'.D120]) ->  | AC44: of:=IF(ISBLANK([$'P3.Comprensible'.D158]);"";[$'P3.Comprensible'.D158]) ->  | AD44: of:=IF(ISBLANK([$'P3.Comprensible'.D272]);"";[$'P3.Comprensible'.D272]) ->  | AE44: of:=IF(ISBLANK([$'P3.Comprensible'.D310]);"";[$'P3.Comprensible'.D310]) ->  | AF44: of:=IF(ISBLANK([$'P4.Robusto'.D44]);"";[$'P4.Robusto'.D44]) ->  | AG44: of:=IF(ISBLANK([$'P4.Robusto'.D82]);"";[$'P4.Robusto'.D82]) -> 
B45: of:=IF( ISBLANK([$'03.Muestra'.$C34]);"";[$'03.Muestra'.$C34]) ->  | C45: of:=IF( ISBLANK([$'03.Muestra'.$E34]);"";[$'03.Muestra'.$E34]) ->  | D45: of:=IF(ISBLANK([$'P1.Perceptible'.D45]);"";[$'P1.Perceptible'.D45]) ->  | E45: of:=IF(ISBLANK([$'P1.Perceptible'.D83]);"";[$'P1.Perceptible'.D83]) ->  | F45: of:=IF(ISBLANK([$'P1.Perceptible'.D121]);"";[$'P1.Perceptible'.D121]) ->  | G45: of:=IF(ISBLANK([$'P1.Perceptible'.D159]);"";[$'P1.Perceptible'.D159]) ->  | H45: of:=IF(ISBLANK([$'P1.Perceptible'.D273]);"";[$'P1.Perceptible'.D273]) ->  | I45: of:=IF(ISBLANK([$'P1.Perceptible'.D311]);"";[$'P1.Perceptible'.D311]) ->  | J45: of:=IF(ISBLANK([$'P1.Perceptible'.D349]);"";[$'P1.Perceptible'.D349]) ->  | K45: of:=IF(ISBLANK([$'P1.Perceptible'.D463]);"";[$'P1.Perceptible'.D463]) ->  | L45: of:=IF(ISBLANK([$'P1.Perceptible'.D501]);"";[$'P1.Perceptible'.D501]) ->  | M45: of:=IF(ISBLANK([$'P2.Operable'.D45]);"";[$'P2.Operable'.D45]) ->  | N45: of:=IF(ISBLANK([$'P2.Operable'.D83]);"";[$'P2.Operable'.D83]) ->  | O45: of:=IF(ISBLANK([$'P2.Operable'.D121]);"";[$'P2.Operable'.D121]) ->  | P45: of:=IF(ISBLANK([$'P2.Operable'.D159]);"";[$'P2.Operable'.D159]) ->  | Q45: of:=IF(ISBLANK([$'P2.Operable'.D197]);"";[$'P2.Operable'.D197]) ->  | R45: of:=IF(ISBLANK([$'P2.Operable'.D235]);"";[$'P2.Operable'.D235]) ->  | S45: of:=IF(ISBLANK([$'P2.Operable'.D273]);"";[$'P2.Operable'.D273]) ->  | T45: of:=IF(ISBLANK([$'P2.Operable'.D311]);"";[$'P2.Operable'.D311]) ->  | U45: of:=IF(ISBLANK([$'P2.Operable'.D349]);"";[$'P2.Operable'.D349]) ->  | V45: of:=IF(ISBLANK([$'P2.Operable'.D387]);"";[$'P2.Operable'.D387]) ->  | W45: of:=IF(ISBLANK([$'P2.Operable'.D539]);"";[$'P2.Operable'.D539]) ->  | X45: of:=IF(ISBLANK([$'P2.Operable'.D577]);"";[$'P2.Operable'.D577]) ->  | Y45: of:=IF(ISBLANK([$'P2.Operable'.D615]);"";[$'P2.Operable'.D615]) ->  | Z45: of:=IF(ISBLANK([$'P2.Operable'.D653]);"";[$'P2.Operable'.D653]) ->  | AA45: of:=IF(ISBLANK([$'P3.Comprensible'.D45]);"";[$'P3.Comprensible'.D45]) ->  | AB45: of:=IF(ISBLANK([$'P3.Comprensible'.D121]);"";[$'P3.Comprensible'.D121]) ->  | AC45: of:=IF(ISBLANK([$'P3.Comprensible'.D159]);"";[$'P3.Comprensible'.D159]) ->  | AD45: of:=IF(ISBLANK([$'P3.Comprensible'.D273]);"";[$'P3.Comprensible'.D273]) ->  | AE45: of:=IF(ISBLANK([$'P3.Comprensible'.D311]);"";[$'P3.Comprensible'.D311]) ->  | AF45: of:=IF(ISBLANK([$'P4.Robusto'.D45]);"";[$'P4.Robusto'.D45]) ->  | AG45: of:=IF(ISBLANK([$'P4.Robusto'.D83]);"";[$'P4.Robusto'.D83]) -> 
B46: of:=IF( ISBLANK([$'03.Muestra'.$C35]);"";[$'03.Muestra'.$C35]) ->  | C46: of:=IF( ISBLANK([$'03.Muestra'.$E35]);"";[$'03.Muestra'.$E35]) ->  | D46: of:=IF(ISBLANK([$'P1.Perceptible'.D46]);"";[$'P1.Perceptible'.D46]) ->  | E46: of:=IF(ISBLANK([$'P1.Perceptible'.D84]);"";[$'P1.Perceptible'.D84]) ->  | F46: of:=IF(ISBLANK([$'P1.Perceptible'.D122]);"";[$'P1.Perceptible'.D122]) ->  | G46: of:=IF(ISBLANK([$'P1.Perceptible'.D160]);"";[$'P1.Perceptible'.D160]) ->  | H46: of:=IF(ISBLANK([$'P1.Perceptible'.D274]);"";[$'P1.Perceptible'.D274]) ->  | I46: of:=IF(ISBLANK([$'P1.Perceptible'.D312]);"";[$'P1.Perceptible'.D312]) ->  | J46: of:=IF(ISBLANK([$'P1.Perceptible'.D350]);"";[$'P1.Perceptible'.D350]) ->  | K46: of:=IF(ISBLANK([$'P1.Perceptible'.D464]);"";[$'P1.Perceptible'.D464]) ->  | L46: of:=IF(ISBLANK([$'P1.Perceptible'.D502]);"";[$'P1.Perceptible'.D502]) ->  | M46: of:=IF(ISBLANK([$'P2.Operable'.D46]);"";[$'P2.Operable'.D46]) ->  | N46: of:=IF(ISBLANK([$'P2.Operable'.D84]);"";[$'P2.Operable'.D84]) ->  | O46: of:=IF(ISBLANK([$'P2.Operable'.D122]);"";[$'P2.Operable'.D122]) ->  | P46: of:=IF(ISBLANK([$'P2.Operable'.D160]);"";[$'P2.Operable'.D160]) ->  | Q46: of:=IF(ISBLANK([$'P2.Operable'.D198]);"";[$'P2.Operable'.D198]) ->  | R46: of:=IF(ISBLANK([$'P2.Operable'.D236]);"";[$'P2.Operable'.D236]) ->  | S46: of:=IF(ISBLANK([$'P2.Operable'.D274]);"";[$'P2.Operable'.D274]) ->  | T46: of:=IF(ISBLANK([$'P2.Operable'.D312]);"";[$'P2.Operable'.D312]) ->  | U46: of:=IF(ISBLANK([$'P2.Operable'.D350]);"";[$'P2.Operable'.D350]) ->  | V46: of:=IF(ISBLANK([$'P2.Operable'.D388]);"";[$'P2.Operable'.D388]) ->  | W46: of:=IF(ISBLANK([$'P2.Operable'.D540]);"";[$'P2.Operable'.D540]) ->  | X46: of:=IF(ISBLANK([$'P2.Operable'.D578]);"";[$'P2.Operable'.D578]) ->  | Y46: of:=IF(ISBLANK([$'P2.Operable'.D616]);"";[$'P2.Operable'.D616]) ->  | Z46: of:=IF(ISBLANK([$'P2.Operable'.D654]);"";[$'P2.Operable'.D654]) ->  | AA46: of:=IF(ISBLANK([$'P3.Comprensible'.D46]);"";[$'P3.Comprensible'.D46]) ->  | AB46: of:=IF(ISBLANK([$'P3.Comprensible'.D122]);"";[$'P3.Comprensible'.D122]) ->  | AC46: of:=IF(ISBLANK([$'P3.Comprensible'.D160]);"";[$'P3.Comprensible'.D160]) ->  | AD46: of:=IF(ISBLANK([$'P3.Comprensible'.D274]);"";[$'P3.Comprensible'.D274]) ->  | AE46: of:=IF(ISBLANK([$'P3.Comprensible'.D312]);"";[$'P3.Comprensible'.D312]) ->  | AF46: of:=IF(ISBLANK([$'P4.Robusto'.D46]);"";[$'P4.Robusto'.D46]) ->  | AG46: of:=IF(ISBLANK([$'P4.Robusto'.D84]);"";[$'P4.Robusto'.D84]) -> 
B47: of:=IF( ISBLANK([$'03.Muestra'.$C36]);"";[$'03.Muestra'.$C36]) ->  | C47: of:=IF( ISBLANK([$'03.Muestra'.$E36]);"";[$'03.Muestra'.$E36]) ->  | D47: of:=IF(ISBLANK([$'P1.Perceptible'.D47]);"";[$'P1.Perceptible'.D47]) ->  | E47: of:=IF(ISBLANK([$'P1.Perceptible'.D85]);"";[$'P1.Perceptible'.D85]) ->  | F47: of:=IF(ISBLANK([$'P1.Perceptible'.D123]);"";[$'P1.Perceptible'.D123]) ->  | G47: of:=IF(ISBLANK([$'P1.Perceptible'.D161]);"";[$'P1.Perceptible'.D161]) ->  | H47: of:=IF(ISBLANK([$'P1.Perceptible'.D275]);"";[$'P1.Perceptible'.D275]) ->  | I47: of:=IF(ISBLANK([$'P1.Perceptible'.D313]);"";[$'P1.Perceptible'.D313]) ->  | J47: of:=IF(ISBLANK([$'P1.Perceptible'.D351]);"";[$'P1.Perceptible'.D351]) ->  | K47: of:=IF(ISBLANK([$'P1.Perceptible'.D465]);"";[$'P1.Perceptible'.D465]) ->  | L47: of:=IF(ISBLANK([$'P1.Perceptible'.D503]);"";[$'P1.Perceptible'.D503]) ->  | M47: of:=IF(ISBLANK([$'P2.Operable'.D47]);"";[$'P2.Operable'.D47]) ->  | N47: of:=IF(ISBLANK([$'P2.Operable'.D85]);"";[$'P2.Operable'.D85]) ->  | O47: of:=IF(ISBLANK([$'P2.Operable'.D123]);"";[$'P2.Operable'.D123]) ->  | P47: of:=IF(ISBLANK([$'P2.Operable'.D161]);"";[$'P2.Operable'.D161]) ->  | Q47: of:=IF(ISBLANK([$'P2.Operable'.D199]);"";[$'P2.Operable'.D199]) ->  | R47: of:=IF(ISBLANK([$'P2.Operable'.D237]);"";[$'P2.Operable'.D237]) ->  | S47: of:=IF(ISBLANK([$'P2.Operable'.D275]);"";[$'P2.Operable'.D275]) ->  | T47: of:=IF(ISBLANK([$'P2.Operable'.D313]);"";[$'P2.Operable'.D313]) ->  | U47: of:=IF(ISBLANK([$'P2.Operable'.D351]);"";[$'P2.Operable'.D351]) ->  | V47: of:=IF(ISBLANK([$'P2.Operable'.D389]);"";[$'P2.Operable'.D389]) ->  | W47: of:=IF(ISBLANK([$'P2.Operable'.D541]);"";[$'P2.Operable'.D541]) ->  | X47: of:=IF(ISBLANK([$'P2.Operable'.D579]);"";[$'P2.Operable'.D579]) ->  | Y47: of:=IF(ISBLANK([$'P2.Operable'.D617]);"";[$'P2.Operable'.D617]) ->  | Z47: of:=IF(ISBLANK([$'P2.Operable'.D655]);"";[$'P2.Operable'.D655]) ->  | AA47: of:=IF(ISBLANK([$'P3.Comprensible'.D47]);"";[$'P3.Comprensible'.D47]) ->  | AB47: of:=IF(ISBLANK([$'P3.Comprensible'.D123]);"";[$'P3.Comprensible'.D123]) ->  | AC47: of:=IF(ISBLANK([$'P3.Comprensible'.D161]);"";[$'P3.Comprensible'.D161]) ->  | AD47: of:=IF(ISBLANK([$'P3.Comprensible'.D275]);"";[$'P3.Comprensible'.D275]) ->  | AE47: of:=IF(ISBLANK([$'P3.Comprensible'.D313]);"";[$'P3.Comprensible'.D313]) ->  | AF47: of:=IF(ISBLANK([$'P4.Robusto'.D47]);"";[$'P4.Robusto'.D47]) ->  | AG47: of:=IF(ISBLANK([$'P4.Robusto'.D85]);"";[$'P4.Robusto'.D85]) -> 
B48: of:=IF( ISBLANK([$'03.Muestra'.$C37]);"";[$'03.Muestra'.$C37]) ->  | C48: of:=IF( ISBLANK([$'03.Muestra'.$E37]);"";[$'03.Muestra'.$E37]) ->  | D48: of:=IF(ISBLANK([$'P1.Perceptible'.D48]);"";[$'P1.Perceptible'.D48]) ->  | E48: of:=IF(ISBLANK([$'P1.Perceptible'.D86]);"";[$'P1.Perceptible'.D86]) ->  | F48: of:=IF(ISBLANK([$'P1.Perceptible'.D124]);"";[$'P1.Perceptible'.D124]) ->  | G48: of:=IF(ISBLANK([$'P1.Perceptible'.D162]);"";[$'P1.Perceptible'.D162]) ->  | H48: of:=IF(ISBLANK([$'P1.Perceptible'.D276]);"";[$'P1.Perceptible'.D276]) ->  | I48: of:=IF(ISBLANK([$'P1.Perceptible'.D314]);"";[$'P1.Perceptible'.D314]) ->  | J48: of:=IF(ISBLANK([$'P1.Perceptible'.D352]);"";[$'P1.Perceptible'.D352]) ->  | K48: of:=IF(ISBLANK([$'P1.Perceptible'.D466]);"";[$'P1.Perceptible'.D466]) ->  | L48: of:=IF(ISBLANK([$'P1.Perceptible'.D504]);"";[$'P1.Perceptible'.D504]) ->  | M48: of:=IF(ISBLANK([$'P2.Operable'.D48]);"";[$'P2.Operable'.D48]) ->  | N48: of:=IF(ISBLANK([$'P2.Operable'.D86]);"";[$'P2.Operable'.D86]) ->  | O48: of:=IF(ISBLANK([$'P2.Operable'.D124]);"";[$'P2.Operable'.D124]) ->  | P48: of:=IF(ISBLANK([$'P2.Operable'.D162]);"";[$'P2.Operable'.D162]) ->  | Q48: of:=IF(ISBLANK([$'P2.Operable'.D200]);"";[$'P2.Operable'.D200]) ->  | R48: of:=IF(ISBLANK([$'P2.Operable'.D238]);"";[$'P2.Operable'.D238]) ->  | S48: of:=IF(ISBLANK([$'P2.Operable'.D276]);"";[$'P2.Operable'.D276]) ->  | T48: of:=IF(ISBLANK([$'P2.Operable'.D314]);"";[$'P2.Operable'.D314]) ->  | U48: of:=IF(ISBLANK([$'P2.Operable'.D352]);"";[$'P2.Operable'.D352]) ->  | V48: of:=IF(ISBLANK([$'P2.Operable'.D390]);"";[$'P2.Operable'.D390]) ->  | W48: of:=IF(ISBLANK([$'P2.Operable'.D542]);"";[$'P2.Operable'.D542]) ->  | X48: of:=IF(ISBLANK([$'P2.Operable'.D580]);"";[$'P2.Operable'.D580]) ->  | Y48: of:=IF(ISBLANK([$'P2.Operable'.D618]);"";[$'P2.Operable'.D618]) ->  | Z48: of:=IF(ISBLANK([$'P2.Operable'.D656]);"";[$'P2.Operable'.D656]) ->  | AA48: of:=IF(ISBLANK([$'P3.Comprensible'.D48]);"";[$'P3.Comprensible'.D48]) ->  | AB48: of:=IF(ISBLANK([$'P3.Comprensible'.D124]);"";[$'P3.Comprensible'.D124]) ->  | AC48: of:=IF(ISBLANK([$'P3.Comprensible'.D162]);"";[$'P3.Comprensible'.D162]) ->  | AD48: of:=IF(ISBLANK([$'P3.Comprensible'.D276]);"";[$'P3.Comprensible'.D276]) ->  | AE48: of:=IF(ISBLANK([$'P3.Comprensible'.D314]);"";[$'P3.Comprensible'.D314]) ->  | AF48: of:=IF(ISBLANK([$'P4.Robusto'.D48]);"";[$'P4.Robusto'.D48]) ->  | AG48: of:=IF(ISBLANK([$'P4.Robusto'.D86]);"";[$'P4.Robusto'.D86]) -> 
B49: of:=IF( ISBLANK([$'03.Muestra'.$C38]);"";[$'03.Muestra'.$C38]) ->  | C49: of:=IF( ISBLANK([$'03.Muestra'.$E38]);"";[$'03.Muestra'.$E38]) ->  | D49: of:=IF(ISBLANK([$'P1.Perceptible'.D49]);"";[$'P1.Perceptible'.D49]) ->  | E49: of:=IF(ISBLANK([$'P1.Perceptible'.D87]);"";[$'P1.Perceptible'.D87]) ->  | F49: of:=IF(ISBLANK([$'P1.Perceptible'.D125]);"";[$'P1.Perceptible'.D125]) ->  | G49: of:=IF(ISBLANK([$'P1.Perceptible'.D163]);"";[$'P1.Perceptible'.D163]) ->  | H49: of:=IF(ISBLANK([$'P1.Perceptible'.D277]);"";[$'P1.Perceptible'.D277]) ->  | I49: of:=IF(ISBLANK([$'P1.Perceptible'.D315]);"";[$'P1.Perceptible'.D315]) ->  | J49: of:=IF(ISBLANK([$'P1.Perceptible'.D353]);"";[$'P1.Perceptible'.D353]) ->  | K49: of:=IF(ISBLANK([$'P1.Perceptible'.D467]);"";[$'P1.Perceptible'.D467]) ->  | L49: of:=IF(ISBLANK([$'P1.Perceptible'.D505]);"";[$'P1.Perceptible'.D505]) ->  | M49: of:=IF(ISBLANK([$'P2.Operable'.D49]);"";[$'P2.Operable'.D49]) ->  | N49: of:=IF(ISBLANK([$'P2.Operable'.D87]);"";[$'P2.Operable'.D87]) ->  | O49: of:=IF(ISBLANK([$'P2.Operable'.D125]);"";[$'P2.Operable'.D125]) ->  | P49: of:=IF(ISBLANK([$'P2.Operable'.D163]);"";[$'P2.Operable'.D163]) ->  | Q49: of:=IF(ISBLANK([$'P2.Operable'.D201]);"";[$'P2.Operable'.D201]) ->  | R49: of:=IF(ISBLANK([$'P2.Operable'.D239]);"";[$'P2.Operable'.D239]) ->  | S49: of:=IF(ISBLANK([$'P2.Operable'.D277]);"";[$'P2.Operable'.D277]) ->  | T49: of:=IF(ISBLANK([$'P2.Operable'.D315]);"";[$'P2.Operable'.D315]) ->  | U49: of:=IF(ISBLANK([$'P2.Operable'.D353]);"";[$'P2.Operable'.D353]) ->  | V49: of:=IF(ISBLANK([$'P2.Operable'.D391]);"";[$'P2.Operable'.D391]) ->  | W49: of:=IF(ISBLANK([$'P2.Operable'.D543]);"";[$'P2.Operable'.D543]) ->  | X49: of:=IF(ISBLANK([$'P2.Operable'.D581]);"";[$'P2.Operable'.D581]) ->  | Y49: of:=IF(ISBLANK([$'P2.Operable'.D619]);"";[$'P2.Operable'.D619]) ->  | Z49: of:=IF(ISBLANK([$'P2.Operable'.D657]);"";[$'P2.Operable'.D657]) ->  | AA49: of:=IF(ISBLANK([$'P3.Comprensible'.D49]);"";[$'P3.Comprensible'.D49]) ->  | AB49: of:=IF(ISBLANK([$'P3.Comprensible'.D125]);"";[$'P3.Comprensible'.D125]) ->  | AC49: of:=IF(ISBLANK([$'P3.Comprensible'.D163]);"";[$'P3.Comprensible'.D163]) ->  | AD49: of:=IF(ISBLANK([$'P3.Comprensible'.D277]);"";[$'P3.Comprensible'.D277]) ->  | AE49: of:=IF(ISBLANK([$'P3.Comprensible'.D315]);"";[$'P3.Comprensible'.D315]) ->  | AF49: of:=IF(ISBLANK([$'P4.Robusto'.D49]);"";[$'P4.Robusto'.D49]) ->  | AG49: of:=IF(ISBLANK([$'P4.Robusto'.D87]);"";[$'P4.Robusto'.D87]) -> 
B50: of:=IF( ISBLANK([$'03.Muestra'.$C39]);"";[$'03.Muestra'.$C39]) ->  | C50: of:=IF( ISBLANK([$'03.Muestra'.$E39]);"";[$'03.Muestra'.$E39]) ->  | D50: of:=IF(ISBLANK([$'P1.Perceptible'.D50]);"";[$'P1.Perceptible'.D50]) ->  | E50: of:=IF(ISBLANK([$'P1.Perceptible'.D88]);"";[$'P1.Perceptible'.D88]) ->  | F50: of:=IF(ISBLANK([$'P1.Perceptible'.D126]);"";[$'P1.Perceptible'.D126]) ->  | G50: of:=IF(ISBLANK([$'P1.Perceptible'.D164]);"";[$'P1.Perceptible'.D164]) ->  | H50: of:=IF(ISBLANK([$'P1.Perceptible'.D278]);"";[$'P1.Perceptible'.D278]) ->  | I50: of:=IF(ISBLANK([$'P1.Perceptible'.D316]);"";[$'P1.Perceptible'.D316]) ->  | J50: of:=IF(ISBLANK([$'P1.Perceptible'.D354]);"";[$'P1.Perceptible'.D354]) ->  | K50: of:=IF(ISBLANK([$'P1.Perceptible'.D468]);"";[$'P1.Perceptible'.D468]) ->  | L50: of:=IF(ISBLANK([$'P1.Perceptible'.D506]);"";[$'P1.Perceptible'.D506]) ->  | M50: of:=IF(ISBLANK([$'P2.Operable'.D50]);"";[$'P2.Operable'.D50]) ->  | N50: of:=IF(ISBLANK([$'P2.Operable'.D88]);"";[$'P2.Operable'.D88]) ->  | O50: of:=IF(ISBLANK([$'P2.Operable'.D126]);"";[$'P2.Operable'.D126]) ->  | P50: of:=IF(ISBLANK([$'P2.Operable'.D164]);"";[$'P2.Operable'.D164]) ->  | Q50: of:=IF(ISBLANK([$'P2.Operable'.D202]);"";[$'P2.Operable'.D202]) ->  | R50: of:=IF(ISBLANK([$'P2.Operable'.D240]);"";[$'P2.Operable'.D240]) ->  | S50: of:=IF(ISBLANK([$'P2.Operable'.D278]);"";[$'P2.Operable'.D278]) ->  | T50: of:=IF(ISBLANK([$'P2.Operable'.D316]);"";[$'P2.Operable'.D316]) ->  | U50: of:=IF(ISBLANK([$'P2.Operable'.D354]);"";[$'P2.Operable'.D354]) ->  | V50: of:=IF(ISBLANK([$'P2.Operable'.D392]);"";[$'P2.Operable'.D392]) ->  | W50: of:=IF(ISBLANK([$'P2.Operable'.D544]);"";[$'P2.Operable'.D544]) ->  | X50: of:=IF(ISBLANK([$'P2.Operable'.D582]);"";[$'P2.Operable'.D582]) ->  | Y50: of:=IF(ISBLANK([$'P2.Operable'.D620]);"";[$'P2.Operable'.D620]) ->  | Z50: of:=IF(ISBLANK([$'P2.Operable'.D658]);"";[$'P2.Operable'.D658]) ->  | AA50: of:=IF(ISBLANK([$'P3.Comprensible'.D50]);"";[$'P3.Comprensible'.D50]) ->  | AB50: of:=IF(ISBLANK([$'P3.Comprensible'.D126]);"";[$'P3.Comprensible'.D126]) ->  | AC50: of:=IF(ISBLANK([$'P3.Comprensible'.D164]);"";[$'P3.Comprensible'.D164]) ->  | AD50: of:=IF(ISBLANK([$'P3.Comprensible'.D278]);"";[$'P3.Comprensible'.D278]) ->  | AE50: of:=IF(ISBLANK([$'P3.Comprensible'.D316]);"";[$'P3.Comprensible'.D316]) ->  | AF50: of:=IF(ISBLANK([$'P4.Robusto'.D50]);"";[$'P4.Robusto'.D50]) ->  | AG50: of:=IF(ISBLANK([$'P4.Robusto'.D88]);"";[$'P4.Robusto'.D88]) -> 
B51: of:=IF( ISBLANK([$'03.Muestra'.$C40]);"";[$'03.Muestra'.$C40]) ->  | C51: of:=IF( ISBLANK([$'03.Muestra'.$E40]);"";[$'03.Muestra'.$E40]) ->  | D51: of:=IF(ISBLANK([$'P1.Perceptible'.D51]);"";[$'P1.Perceptible'.D51]) ->  | E51: of:=IF(ISBLANK([$'P1.Perceptible'.D89]);"";[$'P1.Perceptible'.D89]) ->  | F51: of:=IF(ISBLANK([$'P1.Perceptible'.D127]);"";[$'P1.Perceptible'.D127]) ->  | G51: of:=IF(ISBLANK([$'P1.Perceptible'.D165]);"";[$'P1.Perceptible'.D165]) ->  | H51: of:=IF(ISBLANK([$'P1.Perceptible'.D279]);"";[$'P1.Perceptible'.D279]) ->  | I51: of:=IF(ISBLANK([$'P1.Perceptible'.D317]);"";[$'P1.Perceptible'.D317]) ->  | J51: of:=IF(ISBLANK([$'P1.Perceptible'.D355]);"";[$'P1.Perceptible'.D355]) ->  | K51: of:=IF(ISBLANK([$'P1.Perceptible'.D469]);"";[$'P1.Perceptible'.D469]) ->  | L51: of:=IF(ISBLANK([$'P1.Perceptible'.D507]);"";[$'P1.Perceptible'.D507]) ->  | M51: of:=IF(ISBLANK([$'P2.Operable'.D51]);"";[$'P2.Operable'.D51]) ->  | N51: of:=IF(ISBLANK([$'P2.Operable'.D89]);"";[$'P2.Operable'.D89]) ->  | O51: of:=IF(ISBLANK([$'P2.Operable'.D127]);"";[$'P2.Operable'.D127]) ->  | P51: of:=IF(ISBLANK([$'P2.Operable'.D165]);"";[$'P2.Operable'.D165]) ->  | Q51: of:=IF(ISBLANK([$'P2.Operable'.D203]);"";[$'P2.Operable'.D203]) ->  | R51: of:=IF(ISBLANK([$'P2.Operable'.D241]);"";[$'P2.Operable'.D241]) ->  | S51: of:=IF(ISBLANK([$'P2.Operable'.D279]);"";[$'P2.Operable'.D279]) ->  | T51: of:=IF(ISBLANK([$'P2.Operable'.D317]);"";[$'P2.Operable'.D317]) ->  | U51: of:=IF(ISBLANK([$'P2.Operable'.D355]);"";[$'P2.Operable'.D355]) ->  | V51: of:=IF(ISBLANK([$'P2.Operable'.D393]);"";[$'P2.Operable'.D393]) ->  | W51: of:=IF(ISBLANK([$'P2.Operable'.D545]);"";[$'P2.Operable'.D545]) ->  | X51: of:=IF(ISBLANK([$'P2.Operable'.D583]);"";[$'P2.Operable'.D583]) ->  | Y51: of:=IF(ISBLANK([$'P2.Operable'.D621]);"";[$'P2.Operable'.D621]) ->  | Z51: of:=IF(ISBLANK([$'P2.Operable'.D659]);"";[$'P2.Operable'.D659]) ->  | AA51: of:=IF(ISBLANK([$'P3.Comprensible'.D51]);"";[$'P3.Comprensible'.D51]) ->  | AB51: of:=IF(ISBLANK([$'P3.Comprensible'.D127]);"";[$'P3.Comprensible'.D127]) ->  | AC51: of:=IF(ISBLANK([$'P3.Comprensible'.D165]);"";[$'P3.Comprensible'.D165]) ->  | AD51: of:=IF(ISBLANK([$'P3.Comprensible'.D279]);"";[$'P3.Comprensible'.D279]) ->  | AE51: of:=IF(ISBLANK([$'P3.Comprensible'.D317]);"";[$'P3.Comprensible'.D317]) ->  | AF51: of:=IF(ISBLANK([$'P4.Robusto'.D51]);"";[$'P4.Robusto'.D51]) ->  | AG51: of:=IF(ISBLANK([$'P4.Robusto'.D89]);"";[$'P4.Robusto'.D89]) -> 
B52: of:=IF( ISBLANK([$'03.Muestra'.$C41]);"";[$'03.Muestra'.$C41]) ->  | C52: of:=IF( ISBLANK([$'03.Muestra'.$E41]);"";[$'03.Muestra'.$E41]) ->  | D52: of:=IF(ISBLANK([$'P1.Perceptible'.D52]);"";[$'P1.Perceptible'.D52]) ->  | E52: of:=IF(ISBLANK([$'P1.Perceptible'.D90]);"";[$'P1.Perceptible'.D90]) ->  | F52: of:=IF(ISBLANK([$'P1.Perceptible'.D128]);"";[$'P1.Perceptible'.D128]) ->  | G52: of:=IF(ISBLANK([$'P1.Perceptible'.D166]);"";[$'P1.Perceptible'.D166]) ->  | H52: of:=IF(ISBLANK([$'P1.Perceptible'.D280]);"";[$'P1.Perceptible'.D280]) ->  | I52: of:=IF(ISBLANK([$'P1.Perceptible'.D318]);"";[$'P1.Perceptible'.D318]) ->  | J52: of:=IF(ISBLANK([$'P1.Perceptible'.D356]);"";[$'P1.Perceptible'.D356]) ->  | K52: of:=IF(ISBLANK([$'P1.Perceptible'.D470]);"";[$'P1.Perceptible'.D470]) ->  | L52: of:=IF(ISBLANK([$'P1.Perceptible'.D508]);"";[$'P1.Perceptible'.D508]) ->  | M52: of:=IF(ISBLANK([$'P2.Operable'.D52]);"";[$'P2.Operable'.D52]) ->  | N52: of:=IF(ISBLANK([$'P2.Operable'.D90]);"";[$'P2.Operable'.D90]) ->  | O52: of:=IF(ISBLANK([$'P2.Operable'.D128]);"";[$'P2.Operable'.D128]) ->  | P52: of:=IF(ISBLANK([$'P2.Operable'.D166]);"";[$'P2.Operable'.D166]) ->  | Q52: of:=IF(ISBLANK([$'P2.Operable'.D204]);"";[$'P2.Operable'.D204]) ->  | R52: of:=IF(ISBLANK([$'P2.Operable'.D242]);"";[$'P2.Operable'.D242]) ->  | S52: of:=IF(ISBLANK([$'P2.Operable'.D280]);"";[$'P2.Operable'.D280]) ->  | T52: of:=IF(ISBLANK([$'P2.Operable'.D318]);"";[$'P2.Operable'.D318]) ->  | U52: of:=IF(ISBLANK([$'P2.Operable'.D356]);"";[$'P2.Operable'.D356]) ->  | V52: of:=IF(ISBLANK([$'P2.Operable'.D394]);"";[$'P2.Operable'.D394]) ->  | W52: of:=IF(ISBLANK([$'P2.Operable'.D546]);"";[$'P2.Operable'.D546]) ->  | X52: of:=IF(ISBLANK([$'P2.Operable'.D584]);"";[$'P2.Operable'.D584]) ->  | Y52: of:=IF(ISBLANK([$'P2.Operable'.D622]);"";[$'P2.Operable'.D622]) ->  | Z52: of:=IF(ISBLANK([$'P2.Operable'.D660]);"";[$'P2.Operable'.D660]) ->  | AA52: of:=IF(ISBLANK([$'P3.Comprensible'.D52]);"";[$'P3.Comprensible'.D52]) ->  | AB52: of:=IF(ISBLANK([$'P3.Comprensible'.D128]);"";[$'P3.Comprensible'.D128]) ->  | AC52: of:=IF(ISBLANK([$'P3.Comprensible'.D166]);"";[$'P3.Comprensible'.D166]) ->  | AD52: of:=IF(ISBLANK([$'P3.Comprensible'.D280]);"";[$'P3.Comprensible'.D280]) ->  | AE52: of:=IF(ISBLANK([$'P3.Comprensible'.D318]);"";[$'P3.Comprensible'.D318]) ->  | AF52: of:=IF(ISBLANK([$'P4.Robusto'.D52]);"";[$'P4.Robusto'.D52]) ->  | AG52: of:=IF(ISBLANK([$'P4.Robusto'.D90]);"";[$'P4.Robusto'.D90]) -> 
B53: of:=IF( ISBLANK([$'03.Muestra'.$C42]);"";[$'03.Muestra'.$C42]) ->  | C53: of:=IF( ISBLANK([$'03.Muestra'.$E42]);"";[$'03.Muestra'.$E42]) ->  | D53: of:=IF(ISBLANK([$'P1.Perceptible'.D53]);"";[$'P1.Perceptible'.D53]) ->  | E53: of:=IF(ISBLANK([$'P1.Perceptible'.D91]);"";[$'P1.Perceptible'.D91]) ->  | F53: of:=IF(ISBLANK([$'P1.Perceptible'.D129]);"";[$'P1.Perceptible'.D129]) ->  | G53: of:=IF(ISBLANK([$'P1.Perceptible'.D167]);"";[$'P1.Perceptible'.D167]) ->  | H53: of:=IF(ISBLANK([$'P1.Perceptible'.D281]);"";[$'P1.Perceptible'.D281]) ->  | I53: of:=IF(ISBLANK([$'P1.Perceptible'.D319]);"";[$'P1.Perceptible'.D319]) ->  | J53: of:=IF(ISBLANK([$'P1.Perceptible'.D357]);"";[$'P1.Perceptible'.D357]) ->  | K53: of:=IF(ISBLANK([$'P1.Perceptible'.D471]);"";[$'P1.Perceptible'.D471]) ->  | L53: of:=IF(ISBLANK([$'P1.Perceptible'.D509]);"";[$'P1.Perceptible'.D509]) ->  | M53: of:=IF(ISBLANK([$'P2.Operable'.D53]);"";[$'P2.Operable'.D53]) ->  | N53: of:=IF(ISBLANK([$'P2.Operable'.D91]);"";[$'P2.Operable'.D91]) ->  | O53: of:=IF(ISBLANK([$'P2.Operable'.D129]);"";[$'P2.Operable'.D129]) ->  | P53: of:=IF(ISBLANK([$'P2.Operable'.D167]);"";[$'P2.Operable'.D167]) ->  | Q53: of:=IF(ISBLANK([$'P2.Operable'.D205]);"";[$'P2.Operable'.D205]) ->  | R53: of:=IF(ISBLANK([$'P2.Operable'.D243]);"";[$'P2.Operable'.D243]) ->  | S53: of:=IF(ISBLANK([$'P2.Operable'.D281]);"";[$'P2.Operable'.D281]) ->  | T53: of:=IF(ISBLANK([$'P2.Operable'.D319]);"";[$'P2.Operable'.D319]) ->  | U53: of:=IF(ISBLANK([$'P2.Operable'.D357]);"";[$'P2.Operable'.D357]) ->  | V53: of:=IF(ISBLANK([$'P2.Operable'.D395]);"";[$'P2.Operable'.D395]) ->  | W53: of:=IF(ISBLANK([$'P2.Operable'.D547]);"";[$'P2.Operable'.D547]) ->  | X53: of:=IF(ISBLANK([$'P2.Operable'.D585]);"";[$'P2.Operable'.D585]) ->  | Y53: of:=IF(ISBLANK([$'P2.Operable'.D623]);"";[$'P2.Operable'.D623]) ->  | Z53: of:=IF(ISBLANK([$'P2.Operable'.D661]);"";[$'P2.Operable'.D661]) ->  | AA53: of:=IF(ISBLANK([$'P3.Comprensible'.D53]);"";[$'P3.Comprensible'.D53]) ->  | AB53: of:=IF(ISBLANK([$'P3.Comprensible'.D129]);"";[$'P3.Comprensible'.D129]) ->  | AC53: of:=IF(ISBLANK([$'P3.Comprensible'.D167]);"";[$'P3.Comprensible'.D167]) ->  | AD53: of:=IF(ISBLANK([$'P3.Comprensible'.D281]);"";[$'P3.Comprensible'.D281]) ->  | AE53: of:=IF(ISBLANK([$'P3.Comprensible'.D319]);"";[$'P3.Comprensible'.D319]) ->  | AF53: of:=IF(ISBLANK([$'P4.Robusto'.D53]);"";[$'P4.Robusto'.D53]) ->  | AG53: of:=IF(ISBLANK([$'P4.Robusto'.D91]);"";[$'P4.Robusto'.D91]) -> 
C54: SITIO WEB | D54: of:=IF(COUNTIF([.$C19:.$C53]; "<>")=0;""; IF (COUNTIF([$'P1.Perceptible'.$E19:$'P1.Perceptible'.$E53];"ERR")>0;"ERROR";      IF(COUNTIF([.D19:.D53];"N/T")>0 ; "EN CURSO";         IF (COUNTIF([.D19:.D53];"N/D") > 0;"EN CURSO";              IF (COUNTIF([.$C19:.$C53]; "<>") <> COUNTIF([.D19:.D53];"<>");"EN CURSO" ;  IF(COUNTIF([.$C19:.$C53]; "<>") = COUNTIF([.D19:.D53];"N/A"); "N/A";                   IF(COUNTIF([.D19:.D53];"Falla")>([$'DATA - Oculta'.$C$25]*((COUNTIF([.D19:.D53];"Pasa")+COUNTIF([.D19:.D53];"Falla"))));                 "NO CONFORME";"CONFORME"))))))) ->  | E54: of:=IF(COUNTIF([.$C19:.$C53]; "<>")=0;""; IF (COUNTIF([$'P1.Perceptible'.$E57:$'P1.Perceptible'.$E91];"ERR")>0;"ERROR";      IF(COUNTIF([.E19:.E53];"N/T")>0 ; "EN CURSO";         IF (COUNTIF([.E19:.E53];"N/D") > 0;"EN CURSO";              IF (COUNTIF([.$C19:.$C53]; "<>") <> COUNTIF([.E19:.E53];"<>");"EN CURSO" ;  IF(COUNTIF([.$C19:.$C53]; "<>") = COUNTIF([.E19:.E53];"N/A"); "N/A";                   IF(COUNTIF([.E19:.E53];"Falla")>([$'DATA - Oculta'.$C$25]*((COUNTIF([.E19:.E53];"Pasa")+COUNTIF([.E19:.E53];"Falla"))));                 "NO CONFORME";"CONFORME"))))))) ->  | F54: of:=IF(COUNTIF([.$C19:.$C53]; "<>")=0;""; IF (COUNTIF([$'P1.Perceptible'.$E95:$'P1.Perceptible'.$E129];"ERR")>0;"ERROR";      IF(COUNTIF([.F19:.F53];"N/T")>0 ; "EN CURSO";         IF (COUNTIF([.F19:.F53];"N/D") > 0;"EN CURSO";              IF (COUNTIF([.$C19:.$C53]; "<>") <> COUNTIF([.F19:.F53];"<>");"EN CURSO" ;  IF(COUNTIF([.$C19:.$C53]; "<>") = COUNTIF([.F19:.F53];"N/A"); "N/A";                   IF(COUNTIF([.F19:.F53];"Falla")>([$'DATA - Oculta'.$C$25]*((COUNTIF([.F19:.F53];"Pasa")+COUNTIF([.F19:.F53];"Falla"))));                 "NO CONFORME";"CONFORME"))))))) ->  | G54: of:=IF(COUNTIF([.$C19:.$C53]; "<>")=0;""; IF (COUNTIF([$'P1.Perceptible'.$E133:$'P1.Perceptible'.$E167];"ERR")>0;"ERROR";      IF(COUNTIF([.G19:.G53];"N/T")>0 ; "EN CURSO";         IF (COUNTIF([.G19:.G53];"N/D") > 0;"EN CURSO";              IF (COUNTIF([.$C19:.$C53]; "<>") <> COUNTIF([.G19:.G53];"<>");"EN CURSO" ;  IF(COUNTIF([.$C19:.$C53]; "<>") = COUNTIF([.G19:.G53];"N/A"); "N/A";                   IF(COUNTIF([.G19:.G53];"Falla")>([$'DATA - Oculta'.$C$25]*((COUNTIF([.G19:.G53];"Pasa")+COUNTIF([.G19:.G53];"Falla"))));                 "NO CONFORME";"CONFORME"))))))) ->  | H54: of:=IF(COUNTIF([.$C19:.$C53]; "<>")=0;""; IF (COUNTIF([$'P1.Perceptible'.$E247:$'P1.Perceptible'.$E281];"ERR")>0;"ERROR";      IF(COUNTIF([.H19:.H53];"N/T")>0 ; "EN CURSO";         IF (COUNTIF([.H19:.H53];"N/D") > 0;"EN CURSO";              IF (COUNTIF([.$C19:.$C53]; "<>") <> COUNTIF([.H19:.H53];"<>");"EN CURSO" ;  IF(COUNTIF([.$C19:.$C53]; "<>") = COUNTIF([.H19:.H53];"N/A"); "N/A";                   IF(COUNTIF([.H19:.H53];"Falla")>([$'DATA - Oculta'.$C$25]*((COUNTIF([.H19:.H53];"Pasa")+COUNTIF([.H19:.H53];"Falla"))));                 "NO CONFORME";"CONFORME"))))))) ->  | I54: of:=IF(COUNTIF([.$C19:.$C53]; "<>")=0;""; IF (COUNTIF([$'P1.Perceptible'.$E285:$'P1.Perceptible'.$E319];"ERR")>0;"ERROR";      IF(COUNTIF([.I19:.I53];"N/T")>0 ; "EN CURSO";         IF (COUNTIF([.I19:.I53];"N/D") > 0;"EN CURSO";              IF (COUNTIF([.$C19:.$C53]; "<>") <> COUNTIF([.I19:.I53];"<>");"EN CURSO" ;  IF(COUNTIF([.$C19:.$C53]; "<>") = COUNTIF([.I19:.I53];"N/A"); "N/A";                   IF(COUNTIF([.I19:.I53];"Falla")>([$'DATA - Oculta'.$C$25]*((COUNTIF([.I19:.I53];"Pasa")+COUNTIF([.I19:.I53];"Falla"))));                 "NO CONFORME";"CONFORME"))))))) ->  | J54: of:=IF(COUNTIF([.$C19:.$C53]; "<>")=0;""; IF (COUNTIF([$'P1.Perceptible'.$E323:$'P1.Perceptible'.$E357];"ERR")>0;"ERROR";      IF(COUNTIF([.J19:.J53];"N/T")>0 ; "EN CURSO";         IF (COUNTIF([.J19:.J53];"N/D") > 0;"EN CURSO";              IF (COUNTIF([.$C19:.$C53]; "<>") <> COUNTIF([.J19:.J53];"<>");"EN CURSO" ;  IF(COUNTIF([.$C19:.$C53]; "<>") = COUNTIF([.J19:.J53];"N/A"); "N/A";                   IF(COUNTIF([.J19:.J53];"Falla")>([$'DATA - Oculta'.$C$25]*((COUNTIF([.J19:.J53];"Pasa")+COUNTIF([.J19:.J53];"Falla"))));                 "NO CONFORME";"CONFORME"))))))) ->  | K54: of:=IF(COUNTIF([.$C19:.$C53]; "<>")=0;""; IF (COUNTIF([$'P1.Perceptible'.$E437:$'P1.Perceptible'.$E471];"ERR")>0;"ERROR";      IF(COUNTIF([.K19:.K53];"N/T")>0 ; "EN CURSO";         IF (COUNTIF([.K19:.K53];"N/D") > 0;"EN CURSO";              IF (COUNTIF([.$C19:.$C53]; "<>") <> COUNTIF([.K19:.K53];"<>");"EN CURSO" ;  IF(COUNTIF([.$C19:.$C53]; "<>") = COUNTIF([.K19:.K53];"N/A"); "N/A";                   IF(COUNTIF([.K19:.K53];"Falla")>([$'DATA - Oculta'.$C$25]*((COUNTIF([.K19:.K53];"Pasa")+COUNTIF([.K19:.K53];"Falla"))));                 "NO CONFORME";"CONFORME"))))))) ->  | L54: of:=IF(COUNTIF([.$C19:.$C53]; "<>")=0;""; IF (COUNTIF([$'P1.Perceptible'.$E475:$'P1.Perceptible'.$E509];"ERR")>0;"ERROR";      IF(COUNTIF([.L19:.L53];"N/T")>0 ; "EN CURSO";         IF (COUNTIF([.L19:.L53];"N/D") > 0;"EN CURSO";              IF (COUNTIF([.$C19:.$C53]; "<>") <> COUNTIF([.L19:.L53];"<>");"EN CURSO" ;  IF(COUNTIF([.$C19:.$C53]; "<>") = COUNTIF([.L19:.L53];"N/A"); "N/A";                   IF(COUNTIF([.L19:.L53];"Falla")>([$'DATA - Oculta'.$C$25]*((COUNTIF([.L19:.L53];"Pasa")+COUNTIF([.L19:.L53];"Falla"))));                 "NO CONFORME";"CONFORME"))))))) ->  | M54: of:=IF(COUNTIF([.$C19:.$C53]; "<>")=0;""; IF (COUNTIF([$'P2.Operable'.$E19:$'P2.Operable'.$E53];"ERR")>0;"ERROR";      IF(COUNTIF([.M19:.M53];"N/T")>0 ; "EN CURSO";         IF (COUNTIF([.M19:.M53];"N/D") > 0;"EN CURSO";              IF (COUNTIF([.$C19:.$C53]; "<>") <> COUNTIF([.M19:.M53];"<>");"EN CURSO" ;  IF(COUNTIF([.$C19:.$C53]; "<>") = COUNTIF([.M19:.M53];"N/A"); "N/A";                   IF(COUNTIF([.M19:.M53];"Falla")>([$'DATA - Oculta'.$C$25]*((COUNTIF([.M19:.M53];"Pasa")+COUNTIF([.M19:.M53];"Falla"))));                 "NO CONFORME";"CONFORME"))))))) ->  | N54: of:=IF(COUNTIF([.$C19:.$C53]; "<>")=0;""; IF (COUNTIF([$'P2.Operable'.$E57:$'P2.Operable'.$E91];"ERR")>0;"ERROR";      IF(COUNTIF([.N19:.N53];"N/T")>0 ; "EN CURSO";         IF (COUNTIF([.N19:.N53];"N/D") > 0;"EN CURSO";              IF (COUNTIF([.$C19:.$C53]; "<>") <> COUNTIF([.N19:.N53];"<>");"EN CURSO" ;  IF(COUNTIF([.$C19:.$C53]; "<>") = COUNTIF([.N19:.N53];"N/A"); "N/A";                   IF(COUNTIF([.N19:.N53];"Falla")>([$'DATA - Oculta'.$C$25]*((COUNTIF([.N19:.N53];"Pasa")+COUNTIF([.N19:.N53];"Falla"))));                 "NO CONFORME";"CONFORME"))))))) ->  | O54: of:=IF(COUNTIF([.$C19:.$C53]; "<>")=0;""; IF (COUNTIF([$'P2.Operable'.$E95:$'P2.Operable'.$E129];"ERR")>0;"ERROR";      IF(COUNTIF([.O19:.O53];"N/T")>0 ; "EN CURSO";         IF (COUNTIF([.O19:.O53];"N/D") > 0;"EN CURSO";              IF (COUNTIF([.$C19:.$C53]; "<>") <> COUNTIF([.O19:.O53];"<>");"EN CURSO" ;  IF(COUNTIF([.$C19:.$C53]; "<>") = COUNTIF([.O19:.O53];"N/A"); "N/A";                   IF(COUNTIF([.O19:.O53];"Falla")>([$'DATA - Oculta'.$C$25]*((COUNTIF([.O19:.O53];"Pasa")+COUNTIF([.O19:.O53];"Falla"))));                 "NO CONFORME";"CONFORME"))))))) ->  | P54: of:=IF(COUNTIF([.$C19:.$C53]; "<>")=0;""; IF (COUNTIF([$'P2.Operable'.$E133:$'P2.Operable'.$E167];"ERR")>0;"ERROR";      IF(COUNTIF([.P19:.P53];"N/T")>0 ; "EN CURSO";         IF (COUNTIF([.P19:.P53];"N/D") > 0;"EN CURSO";              IF (COUNTIF([.$C19:.$C53]; "<>") <> COUNTIF([.P19:.P53];"<>");"EN CURSO" ;  IF(COUNTIF([.$C19:.$C53]; "<>") = COUNTIF([.P19:.P53];"N/A"); "N/A";                   IF(COUNTIF([.P19:.P53];"Falla")>([$'DATA - Oculta'.$C$25]*((COUNTIF([.P19:.P53];"Pasa")+COUNTIF([.P19:.P53];"Falla"))));                 "NO CONFORME";"CONFORME"))))))) ->  | Q54: of:=IF(COUNTIF([.$C19:.$C53]; "<>")=0;""; IF (COUNTIF([$'P2.Operable'.$E171:$'P2.Operable'.$E205];"ERR")>0;"ERROR";      IF(COUNTIF([.Q19:.Q53];"N/T")>0 ; "EN CURSO";         IF (COUNTIF([.Q19:.Q53];"N/D") > 0;"EN CURSO";              IF (COUNTIF([.$C19:.$C53]; "<>") <> COUNTIF([.Q19:.Q53];"<>");"EN CURSO" ;  IF(COUNTIF([.$C19:.$C53]; "<>") = COUNTIF([.Q19:.Q53];"N/A"); "N/A";                   IF(COUNTIF([.Q19:.Q53];"Falla")>([$'DATA - Oculta'.$C$25]*((COUNTIF([.Q19:.Q53];"Pasa")+COUNTIF([.Q19:.Q53];"Falla"))));                 "NO CONFORME";"CONFORME"))))))) ->  | R54: of:=IF(COUNTIF([.$C19:.$C53]; "<>")=0;""; IF (COUNTIF([$'P2.Operable'.$E209:$'P2.Operable'.$E243];"ERR")>0;"ERROR";      IF(COUNTIF([.R19:.R53];"N/T")>0 ; "EN CURSO";         IF (COUNTIF([.R19:.R53];"N/D") > 0;"EN CURSO";              IF (COUNTIF([.$C19:.$C53]; "<>") <> COUNTIF([.R19:.R53];"<>");"EN CURSO" ;  IF(COUNTIF([.$C19:.$C53]; "<>") = COUNTIF([.R19:.R53];"N/A"); "N/A";                   IF(COUNTIF([.R19:.R53];"Falla")>([$'DATA - Oculta'.$C$25]*((COUNTIF([.R19:.R53];"Pasa")+COUNTIF([.R19:.R53];"Falla"))));                 "NO CONFORME";"CONFORME"))))))) ->  | S54: of:=IF(COUNTIF([.$C19:.$C53]; "<>")=0;""; IF (COUNTIF([$'P2.Operable'.$E247:$'P2.Operable'.$E281];"ERR")>0;"ERROR";      IF(COUNTIF([.S19:.S53];"N/T")>0 ; "EN CURSO";         IF (COUNTIF([.S19:.S53];"N/D") > 0;"EN CURSO";              IF (COUNTIF([.$C19:.$C53]; "<>") <> COUNTIF([.S19:.S53];"<>");"EN CURSO" ;  IF(COUNTIF([.$C19:.$C53]; "<>") = COUNTIF([.S19:.S53];"N/A"); "N/A";                   IF(COUNTIF([.S19:.S53];"Falla")>([$'DATA - Oculta'.$C$25]*((COUNTIF([.S19:.S53];"Pasa")+COUNTIF([.S19:.S53];"Falla"))));                 "NO CONFORME";"CONFORME"))))))) ->  | T54: of:=IF(COUNTIF([.$C19:.$C53]; "<>")=0;""; IF (COUNTIF([$'P2.Operable'.$E285:$'P2.Operable'.$E319];"ERR")>0;"ERROR";      IF(COUNTIF([.T19:.T53];"N/T")>0 ; "EN CURSO";         IF (COUNTIF([.T19:.T53];"N/D") > 0;"EN CURSO";              IF (COUNTIF([.$C19:.$C53]; "<>") <> COUNTIF([.T19:.T53];"<>");"EN CURSO" ;  IF(COUNTIF([.$C19:.$C53]; "<>") = COUNTIF([.T19:.T53];"N/A"); "N/A";                   IF(COUNTIF([.T19:.T53];"Falla")>([$'DATA - Oculta'.$C$25]*((COUNTIF([.T19:.T53];"Pasa")+COUNTIF([.T19:.T53];"Falla"))));                 "NO CONFORME";"CONFORME"))))))) ->  | U54: of:=IF(COUNTIF([.$C19:.$C53]; "<>")=0;""; IF (COUNTIF([$'P2.Operable'.$E323:$'P2.Operable'.$E357];"ERR")>0;"ERROR";      IF(COUNTIF([.U19:.U53];"N/T")>0 ; "EN CURSO";         IF (COUNTIF([.U19:.U53];"N/D") > 0;"EN CURSO";              IF (COUNTIF([.$C19:.$C53]; "<>") <> COUNTIF([.U19:.U53];"<>");"EN CURSO" ;  IF(COUNTIF([.$C19:.$C53]; "<>") = COUNTIF([.U19:.U53];"N/A"); "N/A";                   IF(COUNTIF([.U19:.U53];"Falla")>([$'DATA - Oculta'.$C$25]*((COUNTIF([.U19:.U53];"Pasa")+COUNTIF([.U19:.U53];"Falla"))));                 "NO CONFORME";"CONFORME"))))))) ->  | V54: of:=IF(COUNTIF([.$C19:.$C53]; "<>")=0;""; IF (COUNTIF([$'P2.Operable'.$E361:$'P2.Operable'.$E395];"ERR")>0;"ERROR";      IF(COUNTIF([.V19:.V53];"N/T")>0 ; "EN CURSO";         IF (COUNTIF([.V19:.V53];"N/D") > 0;"EN CURSO";              IF (COUNTIF([.$C19:.$C53]; "<>") <> COUNTIF([.V19:.V53];"<>");"EN CURSO" ;  IF(COUNTIF([.$C19:.$C53]; "<>") = COUNTIF([.V19:.V53];"N/A"); "N/A";                   IF(COUNTIF([.V19:.V53];"Falla")>([$'DATA - Oculta'.$C$25]*((COUNTIF([.V19:.V53];"Pasa")+COUNTIF([.V19:.V53];"Falla"))));                 "NO CONFORME";"CONFORME"))))))) ->  | W54: of:=IF(COUNTIF([.$C19:.$C53]; "<>")=0;""; IF (COUNTIF([$'P2.Operable'.$E513:$'P2.Operable'.$E547];"ERR")>0;"ERROR";      IF(COUNTIF([.W19:.W53];"N/T")>0 ; "EN CURSO";         IF (COUNTIF([.W19:.W53];"N/D") > 0;"EN CURSO";              IF (COUNTIF([.$C19:.$C53]; "<>") <> COUNTIF([.W19:.W53];"<>");"EN CURSO" ;  IF(COUNTIF([.$C19:.$C53]; "<>") = COUNTIF([.W19:.W53];"N/A"); "N/A";                   IF(COUNTIF([.W19:.W53];"Falla")>([$'DATA - Oculta'.$C$25]*((COUNTIF([.W19:.W53];"Pasa")+COUNTIF([.W19:.W53];"Falla"))));                 "NO CONFORME";"CONFORME"))))))) ->  | X54: of:=IF(COUNTIF([.$C19:.$C53]; "<>")=0;""; IF (COUNTIF([$'P2.Operable'.$E551:$'P2.Operable'.$E585];"ERR")>0;"ERROR";      IF(COUNTIF([.X19:.X53];"N/T")>0 ; "EN CURSO";         IF (COUNTIF([.X19:.X53];"N/D") > 0;"EN CURSO";              IF (COUNTIF([.$C19:.$C53]; "<>") <> COUNTIF([.X19:.X53];"<>");"EN CURSO" ;  IF(COUNTIF([.$C19:.$C53]; "<>") = COUNTIF([.X19:.X53];"N/A"); "N/A";                   IF(COUNTIF([.X19:.X53];"Falla")>([$'DATA - Oculta'.$C$25]*((COUNTIF([.X19:.X53];"Pasa")+COUNTIF([.X19:.X53];"Falla"))));                 "NO CONFORME";"CONFORME"))))))) ->  | Y54: of:=IF(COUNTIF([.$C19:.$C53]; "<>")=0;""; IF (COUNTIF([$'P2.Operable'.$E589:$'P2.Operable'.$E623];"ERR")>0;"ERROR";      IF(COUNTIF([.Y19:.Y53];"N/T")>0 ; "EN CURSO";         IF (COUNTIF([.Y19:.Y53];"N/D") > 0;"EN CURSO";              IF (COUNTIF([.$C19:.$C53]; "<>") <> COUNTIF([.Y19:.Y53];"<>");"EN CURSO" ;  IF(COUNTIF([.$C19:.$C53]; "<>") = COUNTIF([.Y19:.Y53];"N/A"); "N/A";                   IF(COUNTIF([.Y19:.Y53];"Falla")>([$'DATA - Oculta'.$C$25]*((COUNTIF([.Y19:.Y53];"Pasa")+COUNTIF([.Y19:.Y53];"Falla"))));                 "NO CONFORME";"CONFORME"))))))) ->  | Z54: of:=IF(COUNTIF([.$C19:.$C53]; "<>")=0;""; IF (COUNTIF([$'P2.Operable'.$E627:$'P2.Operable'.$E661];"ERR")>0;"ERROR";      IF(COUNTIF([.Z19:.Z53];"N/T")>0 ; "EN CURSO";         IF (COUNTIF([.Z19:.Z53];"N/D") > 0;"EN CURSO";              IF (COUNTIF([.$C19:.$C53]; "<>") <> COUNTIF([.Z19:.Z53];"<>");"EN CURSO" ;  IF(COUNTIF([.$C19:.$C53]; "<>") = COUNTIF([.Z19:.Z53];"N/A"); "N/A";                   IF(COUNTIF([.Z19:.Z53];"Falla")>([$'DATA - Oculta'.$C$25]*((COUNTIF([.Z19:.Z53];"Pasa")+COUNTIF([.Z19:.Z53];"Falla"))));                 "NO CONFORME";"CONFORME"))))))) ->  | AA54: of:=IF(COUNTIF([.$C19:.$C53]; "<>")=0;""; IF (COUNTIF([$'P3.Comprensible'.$E19:$'P3.Comprensible'.$E53];"ERR")>0;"ERROR";      IF(COUNTIF([.AA19:.AA53];"N/T")>0 ; "EN CURSO";         IF (COUNTIF([.AA19:.AA53];"N/D") > 0;"EN CURSO";              IF (COUNTIF([.$C19:.$C53]; "<>") <> COUNTIF([.AA19:.AA53];"<>");"EN CURSO" ;  IF(COUNTIF([.$C19:.$C53]; "<>") = COUNTIF([.AA19:.AA53];"N/A"); "N/A";                   IF(COUNTIF([.AA19:.AA53];"Falla")>([$'DATA - Oculta'.$C$25]*((COUNTIF([.AA19:.AA53];"Pasa")+COUNTIF([.AA19:.AA53];"Falla"))));                 "NO CONFORME";"CONFORME"))))))) ->  | AB54: of:=IF(COUNTIF([.$C19:.$C53]; "<>")=0;""; IF (COUNTIF([$'P3.Comprensible'.$E95:$'P3.Comprensible'.$E129];"ERR")>0;"ERROR";      IF(COUNTIF([.AB19:.AB53];"N/T")>0 ; "EN CURSO";         IF (COUNTIF([.AB19:.AB53];"N/D") > 0;"EN CURSO";              IF (COUNTIF([.$C19:.$C53]; "<>") <> COUNTIF([.AB19:.AB53];"<>");"EN CURSO" ;  IF(COUNTIF([.$C19:.$C53]; "<>") = COUNTIF([.AB19:.AB53];"N/A"); "N/A";                   IF(COUNTIF([.AB19:.AB53];"Falla")>([$'DATA - Oculta'.$C$25]*((COUNTIF([.AB19:.AB53];"Pasa")+COUNTIF([.AB19:.AB53];"Falla"))));                 "NO CONFORME";"CONFORME"))))))) ->  | AC54: of:=IF(COUNTIF([.$C19:.$C53]; "<>")=0;""; IF (COUNTIF([$'P3.Comprensible'.$E133:$'P3.Comprensible'.$E167];"ERR")>0;"ERROR";      IF(COUNTIF([.AC19:.AC53];"N/T")>0 ; "EN CURSO";         IF (COUNTIF([.AC19:.AC53];"N/D") > 0;"EN CURSO";              IF (COUNTIF([.$C19:.$C53]; "<>") <> COUNTIF([.AC19:.AC53];"<>");"EN CURSO" ;  IF(COUNTIF([.$C19:.$C53]; "<>") = COUNTIF([.AC19:.AC53];"N/A"); "N/A";                   IF(COUNTIF([.AC19:.AC53];"Falla")>([$'DATA - Oculta'.$C$25]*((COUNTIF([.AC19:.AC53];"Pasa")+COUNTIF([.AC19:.AC53];"Falla"))));                 "NO CONFORME";"CONFORME"))))))) ->  | AD54: of:=IF(COUNTIF([.$C19:.$C53]; "<>")=0;""; IF (COUNTIF([$'P3.Comprensible'.$E247:$'P3.Comprensible'.$E281];"ERR")>0;"ERROR";      IF(COUNTIF([.AD19:.AD53];"N/T")>0 ; "EN CURSO";         IF (COUNTIF([.AD19:.AD53];"N/D") > 0;"EN CURSO";              IF (COUNTIF([.$C19:.$C53]; "<>") <> COUNTIF([.AD19:.AD53];"<>");"EN CURSO" ;  IF(COUNTIF([.$C19:.$C53]; "<>") = COUNTIF([.AD19:.AD53];"N/A"); "N/A";                   IF(COUNTIF([.AD19:.AD53];"Falla")>([$'DATA - Oculta'.$C$25]*((COUNTIF([.AD19:.AD53];"Pasa")+COUNTIF([.AD19:.AD53];"Falla"))));                 "NO CONFORME";"CONFORME"))))))) ->  | AE54: of:=IF(COUNTIF([.$C19:.$C53]; "<>")=0;""; IF (COUNTIF([$'P3.Comprensible'.$E285:$'P3.Comprensible'.$E319];"ERR")>0;"ERROR";      IF(COUNTIF([.AE19:.AE53];"N/T")>0 ; "EN CURSO";         IF (COUNTIF([.AE19:.AE53];"N/D") > 0;"EN CURSO";              IF (COUNTIF([.$C19:.$C53]; "<>") <> COUNTIF([.AE19:.AE53];"<>");"EN CURSO" ;  IF(COUNTIF([.$C19:.$C53]; "<>") = COUNTIF([.AE19:.AE53];"N/A"); "N/A";                   IF(COUNTIF([.AE19:.AE53];"Falla")>([$'DATA - Oculta'.$C$25]*((COUNTIF([.AE19:.AE53];"Pasa")+COUNTIF([.AE19:.AE53];"Falla"))));                 "NO CONFORME";"CONFORME"))))))) ->  | AF54: of:=IF(COUNTIF([.$C19:.$C53]; "<>")=0;""; IF (COUNTIF([$'P4.Robusto'.$E19:$'P4.Robusto'.$E53];"ERR")>0;"ERROR";      IF(COUNTIF([.AF19:.AF53];"N/T")>0 ; "EN CURSO";         IF (COUNTIF([.AF19:.AF53];"N/D") > 0;"EN CURSO";              IF (COUNTIF([.$C19:.$C53]; "<>") <> COUNTIF([.AF19:.AF53];"<>");"EN CURSO" ;  IF(COUNTIF([.$C19:.$C53]; "<>") = COUNTIF([.AF19:.AF53];"N/A"); "N/A";                   IF(COUNTIF([.AF19:.AF53];"Falla")>([$'DATA - Oculta'.$C$25]*((COUNTIF([.AF19:.AF53];"Pasa")+COUNTIF([.AF19:.AF53];"Falla"))));                 "NO CONFORME";"CONFORME"))))))) ->  | AG54: of:=IF(COUNTIF([.$C19:.$C53]; "<>")=0;""; IF (COUNTIF([$'P4.Robusto'.$E57:$'P4.Robusto'.$E91];"ERR")>0;"ERROR";      IF(COUNTIF([.AG19:.AG53];"N/T")>0 ; "EN CURSO";         IF (COUNTIF([.AG19:.AG53];"N/D") > 0;"EN CURSO";              IF (COUNTIF([.$C19:.$C53]; "<>") <> COUNTIF([.AG19:.AG53];"<>");"EN CURSO" ;  IF(COUNTIF([.$C19:.$C53]; "<>") = COUNTIF([.AG19:.AG53];"N/A"); "N/A";                   IF(COUNTIF([.AG19:.AG53];"Falla")>([$'DATA - Oculta'.$C$25]*((COUNTIF([.AG19:.AG53];"Pasa")+COUNTIF([.AG19:.AG53];"Falla"))));                 "NO CONFORME";"CONFORME"))))))) -> 
C58: AA
C59: Muestra | D59: 1.2.4 | E59: 1.2.5 | F59: 1.3.4 | G59: 1.3.5 | H59: 1.4.3 | I59: 1.4.4 | J59: 1.4.5 | K59: 1.4.10 | L59: 1.4.11 | M59: 1.4.12 | N59: 1.4.13 | O59: 2.4.5 | P59: 2.4.6 | Q59: 2.4.7 | R59: 3.1.2 | S59: 3.2.3 | T59: 3.2.4 | U59: 3.3.3 | V59: 3.3.4 | W59: 4.1.3
B60: of:=IF( ISBLANK([$'03.Muestra'.$C8]);"";[$'03.Muestra'.$C8]) ->  | C60: of:=IF( ISBLANK([$'03.Muestra'.$E8]);"";[$'03.Muestra'.$E8]) ->  | D60: of:=IF( ISBLANK([$'P1.Perceptible'.D171]);"";[$'P1.Perceptible'.D171]) ->  | E60: of:=IF( ISBLANK([$'P1.Perceptible'.D209]);"";[$'P1.Perceptible'.D209]) ->  | F60: of:=IF( ISBLANK([$'P1.Perceptible'.D361]);"";[$'P1.Perceptible'.D361]) ->  | G60: of:=IF( ISBLANK([$'P1.Perceptible'.D399]);"";[$'P1.Perceptible'.D399]) ->  | H60: of:=IF( ISBLANK([$'P1.Perceptible'.D513]);"";[$'P1.Perceptible'.D513]) ->  | I60: of:=IF( ISBLANK([$'P1.Perceptible'.D551]);"";[$'P1.Perceptible'.D551]) ->  | J60: of:=IF( ISBLANK([$'P1.Perceptible'.D589]);"";[$'P1.Perceptible'.D589]) ->  | K60: of:=IF( ISBLANK([$'P1.Perceptible'.D627]);"";[$'P1.Perceptible'.D627]) ->  | L60: of:=IF( ISBLANK([$'P1.Perceptible'.D665]);"";[$'P1.Perceptible'.D665]) ->  | M60: of:=IF( ISBLANK([$'P1.Perceptible'.D703]);"";[$'P1.Perceptible'.D703]) ->  | N60: of:=IF( ISBLANK([$'P1.Perceptible'.D741]);"";[$'P1.Perceptible'.D741]) ->  | O60: of:=IF( ISBLANK([$'P2.Operable'.D399]);"";[$'P2.Operable'.D399]) ->  | P60: of:=IF( ISBLANK([$'P2.Operable'.D437]);"";[$'P2.Operable'.D437]) ->  | Q60: of:=IF( ISBLANK([$'P2.Operable'.D475]);"";[$'P2.Operable'.D475]) ->  | R60: of:=IF( ISBLANK([$'P3.Comprensible'.D57]);"";[$'P3.Comprensible'.D57]) ->  | S60: of:=IF( ISBLANK([$'P3.Comprensible'.D171]);"";[$'P3.Comprensible'.D171]) ->  | T60: of:=IF( ISBLANK([$'P3.Comprensible'.D209]);"";[$'P3.Comprensible'.D209]) ->  | U60: of:=IF( ISBLANK([$'P3.Comprensible'.D323]);"";[$'P3.Comprensible'.D323]) ->  | V60: of:=IF( ISBLANK([$'P3.Comprensible'.D361]);"";[$'P3.Comprensible'.D361]) ->  | W60: of:=IF(ISBLANK([$'P4.Robusto'.D95]);"";[$'P4.Robusto'.D95]) -> 
B61: of:=IF( ISBLANK([$'03.Muestra'.$C9]);"";[$'03.Muestra'.$C9]) ->  | C61: of:=IF( ISBLANK([$'03.Muestra'.$E9]);"";[$'03.Muestra'.$E9]) ->  | D61: of:=IF( ISBLANK([$'P1.Perceptible'.D172]);"";[$'P1.Perceptible'.D172]) ->  | E61: of:=IF( ISBLANK([$'P1.Perceptible'.D210]);"";[$'P1.Perceptible'.D210]) ->  | F61: of:=IF( ISBLANK([$'P1.Perceptible'.D362]);"";[$'P1.Perceptible'.D362]) ->  | G61: of:=IF( ISBLANK([$'P1.Perceptible'.D400]);"";[$'P1.Perceptible'.D400]) ->  | H61: of:=IF( ISBLANK([$'P1.Perceptible'.D514]);"";[$'P1.Perceptible'.D514]) ->  | I61: of:=IF( ISBLANK([$'P1.Perceptible'.D552]);"";[$'P1.Perceptible'.D552]) ->  | J61: of:=IF( ISBLANK([$'P1.Perceptible'.D590]);"";[$'P1.Perceptible'.D590]) ->  | K61: of:=IF( ISBLANK([$'P1.Perceptible'.D628]);"";[$'P1.Perceptible'.D628]) ->  | L61: of:=IF( ISBLANK([$'P1.Perceptible'.D666]);"";[$'P1.Perceptible'.D666]) ->  | M61: of:=IF( ISBLANK([$'P1.Perceptible'.D704]);"";[$'P1.Perceptible'.D704]) ->  | N61: of:=IF( ISBLANK([$'P1.Perceptible'.D742]);"";[$'P1.Perceptible'.D742]) ->  | O61: of:=IF( ISBLANK([$'P2.Operable'.D400]);"";[$'P2.Operable'.D400]) ->  | P61: of:=IF( ISBLANK([$'P2.Operable'.D438]);"";[$'P2.Operable'.D438]) ->  | Q61: of:=IF( ISBLANK([$'P2.Operable'.D476]);"";[$'P2.Operable'.D476]) ->  | R61: of:=IF( ISBLANK([$'P3.Comprensible'.D58]);"";[$'P3.Comprensible'.D58]) ->  | S61: of:=IF( ISBLANK([$'P3.Comprensible'.D172]);"";[$'P3.Comprensible'.D172]) ->  | T61: of:=IF( ISBLANK([$'P3.Comprensible'.D210]);"";[$'P3.Comprensible'.D210]) ->  | U61: of:=IF( ISBLANK([$'P3.Comprensible'.D324]);"";[$'P3.Comprensible'.D324]) ->  | V61: of:=IF( ISBLANK([$'P3.Comprensible'.D362]);"";[$'P3.Comprensible'.D362]) ->  | W61: of:=IF(ISBLANK([$'P4.Robusto'.D96]);"";[$'P4.Robusto'.D96]) -> 
B62: of:=IF( ISBLANK([$'03.Muestra'.$C10]);"";[$'03.Muestra'.$C10]) ->  | C62: of:=IF( ISBLANK([$'03.Muestra'.$E10]);"";[$'03.Muestra'.$E10]) ->  | D62: of:=IF( ISBLANK([$'P1.Perceptible'.D173]);"";[$'P1.Perceptible'.D173]) ->  | E62: of:=IF( ISBLANK([$'P1.Perceptible'.D211]);"";[$'P1.Perceptible'.D211]) ->  | F62: of:=IF( ISBLANK([$'P1.Perceptible'.D363]);"";[$'P1.Perceptible'.D363]) ->  | G62: of:=IF( ISBLANK([$'P1.Perceptible'.D401]);"";[$'P1.Perceptible'.D401]) ->  | H62: of:=IF( ISBLANK([$'P1.Perceptible'.D515]);"";[$'P1.Perceptible'.D515]) ->  | I62: of:=IF( ISBLANK([$'P1.Perceptible'.D553]);"";[$'P1.Perceptible'.D553]) ->  | J62: of:=IF( ISBLANK([$'P1.Perceptible'.D591]);"";[$'P1.Perceptible'.D591]) ->  | K62: of:=IF( ISBLANK([$'P1.Perceptible'.D629]);"";[$'P1.Perceptible'.D629]) ->  | L62: of:=IF( ISBLANK([$'P1.Perceptible'.D667]);"";[$'P1.Perceptible'.D667]) ->  | M62: of:=IF( ISBLANK([$'P1.Perceptible'.D705]);"";[$'P1.Perceptible'.D705]) ->  | N62: of:=IF( ISBLANK([$'P1.Perceptible'.D743]);"";[$'P1.Perceptible'.D743]) ->  | O62: of:=IF( ISBLANK([$'P2.Operable'.D401]);"";[$'P2.Operable'.D401]) ->  | P62: of:=IF( ISBLANK([$'P2.Operable'.D439]);"";[$'P2.Operable'.D439]) ->  | Q62: of:=IF( ISBLANK([$'P2.Operable'.D477]);"";[$'P2.Operable'.D477]) ->  | R62: of:=IF( ISBLANK([$'P3.Comprensible'.D59]);"";[$'P3.Comprensible'.D59]) ->  | S62: of:=IF( ISBLANK([$'P3.Comprensible'.D173]);"";[$'P3.Comprensible'.D173]) ->  | T62: of:=IF( ISBLANK([$'P3.Comprensible'.D211]);"";[$'P3.Comprensible'.D211]) ->  | U62: of:=IF( ISBLANK([$'P3.Comprensible'.D325]);"";[$'P3.Comprensible'.D325]) ->  | V62: of:=IF( ISBLANK([$'P3.Comprensible'.D363]);"";[$'P3.Comprensible'.D363]) ->  | W62: of:=IF(ISBLANK([$'P4.Robusto'.D97]);"";[$'P4.Robusto'.D97]) -> 
B63: of:=IF( ISBLANK([$'03.Muestra'.$C11]);"";[$'03.Muestra'.$C11]) ->  | C63: of:=IF( ISBLANK([$'03.Muestra'.$E11]);"";[$'03.Muestra'.$E11]) ->  | D63: of:=IF( ISBLANK([$'P1.Perceptible'.D174]);"";[$'P1.Perceptible'.D174]) ->  | E63: of:=IF( ISBLANK([$'P1.Perceptible'.D212]);"";[$'P1.Perceptible'.D212]) ->  | F63: of:=IF( ISBLANK([$'P1.Perceptible'.D364]);"";[$'P1.Perceptible'.D364]) ->  | G63: of:=IF( ISBLANK([$'P1.Perceptible'.D402]);"";[$'P1.Perceptible'.D402]) ->  | H63: of:=IF( ISBLANK([$'P1.Perceptible'.D516]);"";[$'P1.Perceptible'.D516]) ->  | I63: of:=IF( ISBLANK([$'P1.Perceptible'.D554]);"";[$'P1.Perceptible'.D554]) ->  | J63: of:=IF( ISBLANK([$'P1.Perceptible'.D592]);"";[$'P1.Perceptible'.D592]) ->  | K63: of:=IF( ISBLANK([$'P1.Perceptible'.D630]);"";[$'P1.Perceptible'.D630]) ->  | L63: of:=IF( ISBLANK([$'P1.Perceptible'.D668]);"";[$'P1.Perceptible'.D668]) ->  | M63: of:=IF( ISBLANK([$'P1.Perceptible'.D706]);"";[$'P1.Perceptible'.D706]) ->  | N63: of:=IF( ISBLANK([$'P1.Perceptible'.D744]);"";[$'P1.Perceptible'.D744]) ->  | O63: of:=IF( ISBLANK([$'P2.Operable'.D402]);"";[$'P2.Operable'.D402]) ->  | P63: of:=IF( ISBLANK([$'P2.Operable'.D440]);"";[$'P2.Operable'.D440]) ->  | Q63: of:=IF( ISBLANK([$'P2.Operable'.D478]);"";[$'P2.Operable'.D478]) ->  | R63: of:=IF( ISBLANK([$'P3.Comprensible'.D60]);"";[$'P3.Comprensible'.D60]) ->  | S63: of:=IF( ISBLANK([$'P3.Comprensible'.D174]);"";[$'P3.Comprensible'.D174]) ->  | T63: of:=IF( ISBLANK([$'P3.Comprensible'.D212]);"";[$'P3.Comprensible'.D212]) ->  | U63: of:=IF( ISBLANK([$'P3.Comprensible'.D326]);"";[$'P3.Comprensible'.D326]) ->  | V63: of:=IF( ISBLANK([$'P3.Comprensible'.D364]);"";[$'P3.Comprensible'.D364]) ->  | W63: of:=IF(ISBLANK([$'P4.Robusto'.D98]);"";[$'P4.Robusto'.D98]) -> 
B64: of:=IF( ISBLANK([$'03.Muestra'.$C12]);"";[$'03.Muestra'.$C12]) ->  | C64: of:=IF( ISBLANK([$'03.Muestra'.$E12]);"";[$'03.Muestra'.$E12]) ->  | D64: of:=IF( ISBLANK([$'P1.Perceptible'.D175]);"";[$'P1.Perceptible'.D175]) ->  | E64: of:=IF( ISBLANK([$'P1.Perceptible'.D213]);"";[$'P1.Perceptible'.D213]) ->  | F64: of:=IF( ISBLANK([$'P1.Perceptible'.D365]);"";[$'P1.Perceptible'.D365]) ->  | G64: of:=IF( ISBLANK([$'P1.Perceptible'.D403]);"";[$'P1.Perceptible'.D403]) ->  | H64: of:=IF( ISBLANK([$'P1.Perceptible'.D517]);"";[$'P1.Perceptible'.D517]) ->  | I64: of:=IF( ISBLANK([$'P1.Perceptible'.D555]);"";[$'P1.Perceptible'.D555]) ->  | J64: of:=IF( ISBLANK([$'P1.Perceptible'.D593]);"";[$'P1.Perceptible'.D593]) ->  | K64: of:=IF( ISBLANK([$'P1.Perceptible'.D631]);"";[$'P1.Perceptible'.D631]) ->  | L64: of:=IF( ISBLANK([$'P1.Perceptible'.D669]);"";[$'P1.Perceptible'.D669]) ->  | M64: of:=IF( ISBLANK([$'P1.Perceptible'.D707]);"";[$'P1.Perceptible'.D707]) ->  | N64: of:=IF( ISBLANK([$'P1.Perceptible'.D745]);"";[$'P1.Perceptible'.D745]) ->  | O64: of:=IF( ISBLANK([$'P2.Operable'.D403]);"";[$'P2.Operable'.D403]) ->  | P64: of:=IF( ISBLANK([$'P2.Operable'.D441]);"";[$'P2.Operable'.D441]) ->  | Q64: of:=IF( ISBLANK([$'P2.Operable'.D479]);"";[$'P2.Operable'.D479]) ->  | R64: of:=IF( ISBLANK([$'P3.Comprensible'.D61]);"";[$'P3.Comprensible'.D61]) ->  | S64: of:=IF( ISBLANK([$'P3.Comprensible'.D175]);"";[$'P3.Comprensible'.D175]) ->  | T64: of:=IF( ISBLANK([$'P3.Comprensible'.D213]);"";[$'P3.Comprensible'.D213]) ->  | U64: of:=IF( ISBLANK([$'P3.Comprensible'.D327]);"";[$'P3.Comprensible'.D327]) ->  | V64: of:=IF( ISBLANK([$'P3.Comprensible'.D365]);"";[$'P3.Comprensible'.D365]) ->  | W64: of:=IF(ISBLANK([$'P4.Robusto'.D99]);"";[$'P4.Robusto'.D99]) -> 
B65: of:=IF( ISBLANK([$'03.Muestra'.$C13]);"";[$'03.Muestra'.$C13]) ->  | C65: of:=IF( ISBLANK([$'03.Muestra'.$E13]);"";[$'03.Muestra'.$E13]) ->  | D65: of:=IF( ISBLANK([$'P1.Perceptible'.D176]);"";[$'P1.Perceptible'.D176]) ->  | E65: of:=IF( ISBLANK([$'P1.Perceptible'.D214]);"";[$'P1.Perceptible'.D214]) ->  | F65: of:=IF( ISBLANK([$'P1.Perceptible'.D366]);"";[$'P1.Perceptible'.D366]) ->  | G65: of:=IF( ISBLANK([$'P1.Perceptible'.D404]);"";[$'P1.Perceptible'.D404]) ->  | H65: of:=IF( ISBLANK([$'P1.Perceptible'.D518]);"";[$'P1.Perceptible'.D518]) ->  | I65: of:=IF( ISBLANK([$'P1.Perceptible'.D556]);"";[$'P1.Perceptible'.D556]) ->  | J65: of:=IF( ISBLANK([$'P1.Perceptible'.D594]);"";[$'P1.Perceptible'.D594]) ->  | K65: of:=IF( ISBLANK([$'P1.Perceptible'.D632]);"";[$'P1.Perceptible'.D632]) ->  | L65: of:=IF( ISBLANK([$'P1.Perceptible'.D670]);"";[$'P1.Perceptible'.D670]) ->  | M65: of:=IF( ISBLANK([$'P1.Perceptible'.D708]);"";[$'P1.Perceptible'.D708]) ->  | N65: of:=IF( ISBLANK([$'P1.Perceptible'.D746]);"";[$'P1.Perceptible'.D746]) ->  | O65: of:=IF( ISBLANK([$'P2.Operable'.D404]);"";[$'P2.Operable'.D404]) ->  | P65: of:=IF( ISBLANK([$'P2.Operable'.D442]);"";[$'P2.Operable'.D442]) ->  | Q65: of:=IF( ISBLANK([$'P2.Operable'.D480]);"";[$'P2.Operable'.D480]) ->  | R65: of:=IF( ISBLANK([$'P3.Comprensible'.D62]);"";[$'P3.Comprensible'.D62]) ->  | S65: of:=IF( ISBLANK([$'P3.Comprensible'.D176]);"";[$'P3.Comprensible'.D176]) ->  | T65: of:=IF( ISBLANK([$'P3.Comprensible'.D214]);"";[$'P3.Comprensible'.D214]) ->  | U65: of:=IF( ISBLANK([$'P3.Comprensible'.D328]);"";[$'P3.Comprensible'.D328]) ->  | V65: of:=IF( ISBLANK([$'P3.Comprensible'.D366]);"";[$'P3.Comprensible'.D366]) ->  | W65: of:=IF(ISBLANK([$'P4.Robusto'.D100]);"";[$'P4.Robusto'.D100]) -> 
B66: of:=IF( ISBLANK([$'03.Muestra'.$C14]);"";[$'03.Muestra'.$C14]) ->  | C66: of:=IF( ISBLANK([$'03.Muestra'.$E14]);"";[$'03.Muestra'.$E14]) ->  | D66: of:=IF( ISBLANK([$'P1.Perceptible'.D177]);"";[$'P1.Perceptible'.D177]) ->  | E66: of:=IF( ISBLANK([$'P1.Perceptible'.D215]);"";[$'P1.Perceptible'.D215]) ->  | F66: of:=IF( ISBLANK([$'P1.Perceptible'.D367]);"";[$'P1.Perceptible'.D367]) ->  | G66: of:=IF( ISBLANK([$'P1.Perceptible'.D405]);"";[$'P1.Perceptible'.D405]) ->  | H66: of:=IF( ISBLANK([$'P1.Perceptible'.D519]);"";[$'P1.Perceptible'.D519]) ->  | I66: of:=IF( ISBLANK([$'P1.Perceptible'.D557]);"";[$'P1.Perceptible'.D557]) ->  | J66: of:=IF( ISBLANK([$'P1.Perceptible'.D595]);"";[$'P1.Perceptible'.D595]) ->  | K66: of:=IF( ISBLANK([$'P1.Perceptible'.D633]);"";[$'P1.Perceptible'.D633]) ->  | L66: of:=IF( ISBLANK([$'P1.Perceptible'.D671]);"";[$'P1.Perceptible'.D671]) ->  | M66: of:=IF( ISBLANK([$'P1.Perceptible'.D709]);"";[$'P1.Perceptible'.D709]) ->  | N66: of:=IF( ISBLANK([$'P1.Perceptible'.D747]);"";[$'P1.Perceptible'.D747]) ->  | O66: of:=IF( ISBLANK([$'P2.Operable'.D405]);"";[$'P2.Operable'.D405]) ->  | P66: of:=IF( ISBLANK([$'P2.Operable'.D443]);"";[$'P2.Operable'.D443]) ->  | Q66: of:=IF( ISBLANK([$'P2.Operable'.D481]);"";[$'P2.Operable'.D481]) ->  | R66: of:=IF( ISBLANK([$'P3.Comprensible'.D63]);"";[$'P3.Comprensible'.D63]) ->  | S66: of:=IF( ISBLANK([$'P3.Comprensible'.D177]);"";[$'P3.Comprensible'.D177]) ->  | T66: of:=IF( ISBLANK([$'P3.Comprensible'.D215]);"";[$'P3.Comprensible'.D215]) ->  | U66: of:=IF( ISBLANK([$'P3.Comprensible'.D329]);"";[$'P3.Comprensible'.D329]) ->  | V66: of:=IF( ISBLANK([$'P3.Comprensible'.D367]);"";[$'P3.Comprensible'.D367]) ->  | W66: of:=IF(ISBLANK([$'P4.Robusto'.D101]);"";[$'P4.Robusto'.D101]) -> 
B67: of:=IF( ISBLANK([$'03.Muestra'.$C15]);"";[$'03.Muestra'.$C15]) ->  | C67: of:=IF( ISBLANK([$'03.Muestra'.$E15]);"";[$'03.Muestra'.$E15]) ->  | D67: of:=IF( ISBLANK([$'P1.Perceptible'.D178]);"";[$'P1.Perceptible'.D178]) ->  | E67: of:=IF( ISBLANK([$'P1.Perceptible'.D216]);"";[$'P1.Perceptible'.D216]) ->  | F67: of:=IF( ISBLANK([$'P1.Perceptible'.D368]);"";[$'P1.Perceptible'.D368]) ->  | G67: of:=IF( ISBLANK([$'P1.Perceptible'.D406]);"";[$'P1.Perceptible'.D406]) ->  | H67: of:=IF( ISBLANK([$'P1.Perceptible'.D520]);"";[$'P1.Perceptible'.D520]) ->  | I67: of:=IF( ISBLANK([$'P1.Perceptible'.D558]);"";[$'P1.Perceptible'.D558]) ->  | J67: of:=IF( ISBLANK([$'P1.Perceptible'.D596]);"";[$'P1.Perceptible'.D596]) ->  | K67: of:=IF( ISBLANK([$'P1.Perceptible'.D634]);"";[$'P1.Perceptible'.D634]) ->  | L67: of:=IF( ISBLANK([$'P1.Perceptible'.D672]);"";[$'P1.Perceptible'.D672]) ->  | M67: of:=IF( ISBLANK([$'P1.Perceptible'.D710]);"";[$'P1.Perceptible'.D710]) ->  | N67: of:=IF( ISBLANK([$'P1.Perceptible'.D748]);"";[$'P1.Perceptible'.D748]) ->  | O67: of:=IF( ISBLANK([$'P2.Operable'.D406]);"";[$'P2.Operable'.D406]) ->  | P67: of:=IF( ISBLANK([$'P2.Operable'.D444]);"";[$'P2.Operable'.D444]) ->  | Q67: of:=IF( ISBLANK([$'P2.Operable'.D482]);"";[$'P2.Operable'.D482]) ->  | R67: of:=IF( ISBLANK([$'P3.Comprensible'.D64]);"";[$'P3.Comprensible'.D64]) ->  | S67: of:=IF( ISBLANK([$'P3.Comprensible'.D178]);"";[$'P3.Comprensible'.D178]) ->  | T67: of:=IF( ISBLANK([$'P3.Comprensible'.D216]);"";[$'P3.Comprensible'.D216]) ->  | U67: of:=IF( ISBLANK([$'P3.Comprensible'.D330]);"";[$'P3.Comprensible'.D330]) ->  | V67: of:=IF( ISBLANK([$'P3.Comprensible'.D368]);"";[$'P3.Comprensible'.D368]) ->  | W67: of:=IF(ISBLANK([$'P4.Robusto'.D102]);"";[$'P4.Robusto'.D102]) -> 
B68: of:=IF( ISBLANK([$'03.Muestra'.$C16]);"";[$'03.Muestra'.$C16]) ->  | C68: of:=IF( ISBLANK([$'03.Muestra'.$E16]);"";[$'03.Muestra'.$E16]) ->  | D68: of:=IF( ISBLANK([$'P1.Perceptible'.D179]);"";[$'P1.Perceptible'.D179]) ->  | E68: of:=IF( ISBLANK([$'P1.Perceptible'.D217]);"";[$'P1.Perceptible'.D217]) ->  | F68: of:=IF( ISBLANK([$'P1.Perceptible'.D369]);"";[$'P1.Perceptible'.D369]) ->  | G68: of:=IF( ISBLANK([$'P1.Perceptible'.D407]);"";[$'P1.Perceptible'.D407]) ->  | H68: of:=IF( ISBLANK([$'P1.Perceptible'.D521]);"";[$'P1.Perceptible'.D521]) ->  | I68: of:=IF( ISBLANK([$'P1.Perceptible'.D559]);"";[$'P1.Perceptible'.D559]) ->  | J68: of:=IF( ISBLANK([$'P1.Perceptible'.D597]);"";[$'P1.Perceptible'.D597]) ->  | K68: of:=IF( ISBLANK([$'P1.Perceptible'.D635]);"";[$'P1.Perceptible'.D635]) ->  | L68: of:=IF( ISBLANK([$'P1.Perceptible'.D673]);"";[$'P1.Perceptible'.D673]) ->  | M68: of:=IF( ISBLANK([$'P1.Perceptible'.D711]);"";[$'P1.Perceptible'.D711]) ->  | N68: of:=IF( ISBLANK([$'P1.Perceptible'.D749]);"";[$'P1.Perceptible'.D749]) ->  | O68: of:=IF( ISBLANK([$'P2.Operable'.D407]);"";[$'P2.Operable'.D407]) ->  | P68: of:=IF( ISBLANK([$'P2.Operable'.D445]);"";[$'P2.Operable'.D445]) ->  | Q68: of:=IF( ISBLANK([$'P2.Operable'.D483]);"";[$'P2.Operable'.D483]) ->  | R68: of:=IF( ISBLANK([$'P3.Comprensible'.D65]);"";[$'P3.Comprensible'.D65]) ->  | S68: of:=IF( ISBLANK([$'P3.Comprensible'.D179]);"";[$'P3.Comprensible'.D179]) ->  | T68: of:=IF( ISBLANK([$'P3.Comprensible'.D217]);"";[$'P3.Comprensible'.D217]) ->  | U68: of:=IF( ISBLANK([$'P3.Comprensible'.D331]);"";[$'P3.Comprensible'.D331]) ->  | V68: of:=IF( ISBLANK([$'P3.Comprensible'.D369]);"";[$'P3.Comprensible'.D369]) ->  | W68: of:=IF(ISBLANK([$'P4.Robusto'.D103]);"";[$'P4.Robusto'.D103]) -> 
B69: of:=IF( ISBLANK([$'03.Muestra'.$C17]);"";[$'03.Muestra'.$C17]) ->  | C69: of:=IF( ISBLANK([$'03.Muestra'.$E17]);"";[$'03.Muestra'.$E17]) ->  | D69: of:=IF( ISBLANK([$'P1.Perceptible'.D180]);"";[$'P1.Perceptible'.D180]) ->  | E69: of:=IF( ISBLANK([$'P1.Perceptible'.D218]);"";[$'P1.Perceptible'.D218]) ->  | F69: of:=IF( ISBLANK([$'P1.Perceptible'.D370]);"";[$'P1.Perceptible'.D370]) ->  | G69: of:=IF( ISBLANK([$'P1.Perceptible'.D408]);"";[$'P1.Perceptible'.D408]) ->  | H69: of:=IF( ISBLANK([$'P1.Perceptible'.D522]);"";[$'P1.Perceptible'.D522]) ->  | I69: of:=IF( ISBLANK([$'P1.Perceptible'.D560]);"";[$'P1.Perceptible'.D560]) ->  | J69: of:=IF( ISBLANK([$'P1.Perceptible'.D598]);"";[$'P1.Perceptible'.D598]) ->  | K69: of:=IF( ISBLANK([$'P1.Perceptible'.D636]);"";[$'P1.Perceptible'.D636]) ->  | L69: of:=IF( ISBLANK([$'P1.Perceptible'.D674]);"";[$'P1.Perceptible'.D674]) ->  | M69: of:=IF( ISBLANK([$'P1.Perceptible'.D712]);"";[$'P1.Perceptible'.D712]) ->  | N69: of:=IF( ISBLANK([$'P1.Perceptible'.D750]);"";[$'P1.Perceptible'.D750]) ->  | O69: of:=IF( ISBLANK([$'P2.Operable'.D408]);"";[$'P2.Operable'.D408]) ->  | P69: of:=IF( ISBLANK([$'P2.Operable'.D446]);"";[$'P2.Operable'.D446]) ->  | Q69: of:=IF( ISBLANK([$'P2.Operable'.D484]);"";[$'P2.Operable'.D484]) ->  | R69: of:=IF( ISBLANK([$'P3.Comprensible'.D66]);"";[$'P3.Comprensible'.D66]) ->  | S69: of:=IF( ISBLANK([$'P3.Comprensible'.D180]);"";[$'P3.Comprensible'.D180]) ->  | T69: of:=IF( ISBLANK([$'P3.Comprensible'.D218]);"";[$'P3.Comprensible'.D218]) ->  | U69: of:=IF( ISBLANK([$'P3.Comprensible'.D332]);"";[$'P3.Comprensible'.D332]) ->  | V69: of:=IF( ISBLANK([$'P3.Comprensible'.D370]);"";[$'P3.Comprensible'.D370]) ->  | W69: of:=IF(ISBLANK([$'P4.Robusto'.D104]);"";[$'P4.Robusto'.D104]) -> 
B70: of:=IF( ISBLANK([$'03.Muestra'.$C18]);"";[$'03.Muestra'.$C18]) ->  | C70: of:=IF( ISBLANK([$'03.Muestra'.$E18]);"";[$'03.Muestra'.$E18]) ->  | D70: of:=IF( ISBLANK([$'P1.Perceptible'.D181]);"";[$'P1.Perceptible'.D181]) ->  | E70: of:=IF( ISBLANK([$'P1.Perceptible'.D219]);"";[$'P1.Perceptible'.D219]) ->  | F70: of:=IF( ISBLANK([$'P1.Perceptible'.D371]);"";[$'P1.Perceptible'.D371]) ->  | G70: of:=IF( ISBLANK([$'P1.Perceptible'.D409]);"";[$'P1.Perceptible'.D409]) ->  | H70: of:=IF( ISBLANK([$'P1.Perceptible'.D523]);"";[$'P1.Perceptible'.D523]) ->  | I70: of:=IF( ISBLANK([$'P1.Perceptible'.D561]);"";[$'P1.Perceptible'.D561]) ->  | J70: of:=IF( ISBLANK([$'P1.Perceptible'.D599]);"";[$'P1.Perceptible'.D599]) ->  | K70: of:=IF( ISBLANK([$'P1.Perceptible'.D637]);"";[$'P1.Perceptible'.D637]) ->  | L70: of:=IF( ISBLANK([$'P1.Perceptible'.D675]);"";[$'P1.Perceptible'.D675]) ->  | M70: of:=IF( ISBLANK([$'P1.Perceptible'.D713]);"";[$'P1.Perceptible'.D713]) ->  | N70: of:=IF( ISBLANK([$'P1.Perceptible'.D751]);"";[$'P1.Perceptible'.D751]) ->  | O70: of:=IF( ISBLANK([$'P2.Operable'.D409]);"";[$'P2.Operable'.D409]) ->  | P70: of:=IF( ISBLANK([$'P2.Operable'.D447]);"";[$'P2.Operable'.D447]) ->  | Q70: of:=IF( ISBLANK([$'P2.Operable'.D485]);"";[$'P2.Operable'.D485]) ->  | R70: of:=IF( ISBLANK([$'P3.Comprensible'.D67]);"";[$'P3.Comprensible'.D67]) ->  | S70: of:=IF( ISBLANK([$'P3.Comprensible'.D181]);"";[$'P3.Comprensible'.D181]) ->  | T70: of:=IF( ISBLANK([$'P3.Comprensible'.D219]);"";[$'P3.Comprensible'.D219]) ->  | U70: of:=IF( ISBLANK([$'P3.Comprensible'.D333]);"";[$'P3.Comprensible'.D333]) ->  | V70: of:=IF( ISBLANK([$'P3.Comprensible'.D371]);"";[$'P3.Comprensible'.D371]) ->  | W70: of:=IF(ISBLANK([$'P4.Robusto'.D105]);"";[$'P4.Robusto'.D105]) -> 
B71: of:=IF( ISBLANK([$'03.Muestra'.$C19]);"";[$'03.Muestra'.$C19]) ->  | C71: of:=IF( ISBLANK([$'03.Muestra'.$E19]);"";[$'03.Muestra'.$E19]) ->  | D71: of:=IF( ISBLANK([$'P1.Perceptible'.D182]);"";[$'P1.Perceptible'.D182]) ->  | E71: of:=IF( ISBLANK([$'P1.Perceptible'.D220]);"";[$'P1.Perceptible'.D220]) ->  | F71: of:=IF( ISBLANK([$'P1.Perceptible'.D372]);"";[$'P1.Perceptible'.D372]) ->  | G71: of:=IF( ISBLANK([$'P1.Perceptible'.D410]);"";[$'P1.Perceptible'.D410]) ->  | H71: of:=IF( ISBLANK([$'P1.Perceptible'.D524]);"";[$'P1.Perceptible'.D524]) ->  | I71: of:=IF( ISBLANK([$'P1.Perceptible'.D562]);"";[$'P1.Perceptible'.D562]) ->  | J71: of:=IF( ISBLANK([$'P1.Perceptible'.D600]);"";[$'P1.Perceptible'.D600]) ->  | K71: of:=IF( ISBLANK([$'P1.Perceptible'.D638]);"";[$'P1.Perceptible'.D638]) ->  | L71: of:=IF( ISBLANK([$'P1.Perceptible'.D676]);"";[$'P1.Perceptible'.D676]) ->  | M71: of:=IF( ISBLANK([$'P1.Perceptible'.D714]);"";[$'P1.Perceptible'.D714]) ->  | N71: of:=IF( ISBLANK([$'P1.Perceptible'.D752]);"";[$'P1.Perceptible'.D752]) ->  | O71: of:=IF( ISBLANK([$'P2.Operable'.D410]);"";[$'P2.Operable'.D410]) ->  | P71: of:=IF( ISBLANK([$'P2.Operable'.D448]);"";[$'P2.Operable'.D448]) ->  | Q71: of:=IF( ISBLANK([$'P2.Operable'.D486]);"";[$'P2.Operable'.D486]) ->  | R71: of:=IF( ISBLANK([$'P3.Comprensible'.D68]);"";[$'P3.Comprensible'.D68]) ->  | S71: of:=IF( ISBLANK([$'P3.Comprensible'.D182]);"";[$'P3.Comprensible'.D182]) ->  | T71: of:=IF( ISBLANK([$'P3.Comprensible'.D220]);"";[$'P3.Comprensible'.D220]) ->  | U71: of:=IF( ISBLANK([$'P3.Comprensible'.D334]);"";[$'P3.Comprensible'.D334]) ->  | V71: of:=IF( ISBLANK([$'P3.Comprensible'.D372]);"";[$'P3.Comprensible'.D372]) ->  | W71: of:=IF(ISBLANK([$'P4.Robusto'.D106]);"";[$'P4.Robusto'.D106]) -> 
B72: of:=IF( ISBLANK([$'03.Muestra'.$C20]);"";[$'03.Muestra'.$C20]) ->  | C72: of:=IF( ISBLANK([$'03.Muestra'.$E20]);"";[$'03.Muestra'.$E20]) ->  | D72: of:=IF( ISBLANK([$'P1.Perceptible'.D183]);"";[$'P1.Perceptible'.D183]) ->  | E72: of:=IF( ISBLANK([$'P1.Perceptible'.D221]);"";[$'P1.Perceptible'.D221]) ->  | F72: of:=IF( ISBLANK([$'P1.Perceptible'.D373]);"";[$'P1.Perceptible'.D373]) ->  | G72: of:=IF( ISBLANK([$'P1.Perceptible'.D411]);"";[$'P1.Perceptible'.D411]) ->  | H72: of:=IF( ISBLANK([$'P1.Perceptible'.D525]);"";[$'P1.Perceptible'.D525]) ->  | I72: of:=IF( ISBLANK([$'P1.Perceptible'.D563]);"";[$'P1.Perceptible'.D563]) ->  | J72: of:=IF( ISBLANK([$'P1.Perceptible'.D601]);"";[$'P1.Perceptible'.D601]) ->  | K72: of:=IF( ISBLANK([$'P1.Perceptible'.D639]);"";[$'P1.Perceptible'.D639]) ->  | L72: of:=IF( ISBLANK([$'P1.Perceptible'.D677]);"";[$'P1.Perceptible'.D677]) ->  | M72: of:=IF( ISBLANK([$'P1.Perceptible'.D715]);"";[$'P1.Perceptible'.D715]) ->  | N72: of:=IF( ISBLANK([$'P1.Perceptible'.D753]);"";[$'P1.Perceptible'.D753]) ->  | O72: of:=IF( ISBLANK([$'P2.Operable'.D411]);"";[$'P2.Operable'.D411]) ->  | P72: of:=IF( ISBLANK([$'P2.Operable'.D449]);"";[$'P2.Operable'.D449]) ->  | Q72: of:=IF( ISBLANK([$'P2.Operable'.D487]);"";[$'P2.Operable'.D487]) ->  | R72: of:=IF( ISBLANK([$'P3.Comprensible'.D69]);"";[$'P3.Comprensible'.D69]) ->  | S72: of:=IF( ISBLANK([$'P3.Comprensible'.D183]);"";[$'P3.Comprensible'.D183]) ->  | T72: of:=IF( ISBLANK([$'P3.Comprensible'.D221]);"";[$'P3.Comprensible'.D221]) ->  | U72: of:=IF( ISBLANK([$'P3.Comprensible'.D335]);"";[$'P3.Comprensible'.D335]) ->  | V72: of:=IF( ISBLANK([$'P3.Comprensible'.D373]);"";[$'P3.Comprensible'.D373]) ->  | W72: of:=IF(ISBLANK([$'P4.Robusto'.D107]);"";[$'P4.Robusto'.D107]) -> 
B73: of:=IF( ISBLANK([$'03.Muestra'.$C21]);"";[$'03.Muestra'.$C21]) ->  | C73: of:=IF( ISBLANK([$'03.Muestra'.$E21]);"";[$'03.Muestra'.$E21]) ->  | D73: of:=IF( ISBLANK([$'P1.Perceptible'.D184]);"";[$'P1.Perceptible'.D184]) ->  | E73: of:=IF( ISBLANK([$'P1.Perceptible'.D222]);"";[$'P1.Perceptible'.D222]) ->  | F73: of:=IF( ISBLANK([$'P1.Perceptible'.D374]);"";[$'P1.Perceptible'.D374]) ->  | G73: of:=IF( ISBLANK([$'P1.Perceptible'.D412]);"";[$'P1.Perceptible'.D412]) ->  | H73: of:=IF( ISBLANK([$'P1.Perceptible'.D526]);"";[$'P1.Perceptible'.D526]) ->  | I73: of:=IF( ISBLANK([$'P1.Perceptible'.D564]);"";[$'P1.Perceptible'.D564]) ->  | J73: of:=IF( ISBLANK([$'P1.Perceptible'.D602]);"";[$'P1.Perceptible'.D602]) ->  | K73: of:=IF( ISBLANK([$'P1.Perceptible'.D640]);"";[$'P1.Perceptible'.D640]) ->  | L73: of:=IF( ISBLANK([$'P1.Perceptible'.D678]);"";[$'P1.Perceptible'.D678]) ->  | M73: of:=IF( ISBLANK([$'P1.Perceptible'.D716]);"";[$'P1.Perceptible'.D716]) ->  | N73: of:=IF( ISBLANK([$'P1.Perceptible'.D754]);"";[$'P1.Perceptible'.D754]) ->  | O73: of:=IF( ISBLANK([$'P2.Operable'.D412]);"";[$'P2.Operable'.D412]) ->  | P73: of:=IF( ISBLANK([$'P2.Operable'.D450]);"";[$'P2.Operable'.D450]) ->  | Q73: of:=IF( ISBLANK([$'P2.Operable'.D488]);"";[$'P2.Operable'.D488]) ->  | R73: of:=IF( ISBLANK([$'P3.Comprensible'.D70]);"";[$'P3.Comprensible'.D70]) ->  | S73: of:=IF( ISBLANK([$'P3.Comprensible'.D184]);"";[$'P3.Comprensible'.D184]) ->  | T73: of:=IF( ISBLANK([$'P3.Comprensible'.D222]);"";[$'P3.Comprensible'.D222]) ->  | U73: of:=IF( ISBLANK([$'P3.Comprensible'.D336]);"";[$'P3.Comprensible'.D336]) ->  | V73: of:=IF( ISBLANK([$'P3.Comprensible'.D374]);"";[$'P3.Comprensible'.D374]) ->  | W73: of:=IF(ISBLANK([$'P4.Robusto'.D108]);"";[$'P4.Robusto'.D108]) -> 
B74: of:=IF( ISBLANK([$'03.Muestra'.$C22]);"";[$'03.Muestra'.$C22]) ->  | C74: of:=IF( ISBLANK([$'03.Muestra'.$E22]);"";[$'03.Muestra'.$E22]) ->  | D74: of:=IF( ISBLANK([$'P1.Perceptible'.D185]);"";[$'P1.Perceptible'.D185]) ->  | E74: of:=IF( ISBLANK([$'P1.Perceptible'.D223]);"";[$'P1.Perceptible'.D223]) ->  | F74: of:=IF( ISBLANK([$'P1.Perceptible'.D375]);"";[$'P1.Perceptible'.D375]) ->  | G74: of:=IF( ISBLANK([$'P1.Perceptible'.D413]);"";[$'P1.Perceptible'.D413]) ->  | H74: of:=IF( ISBLANK([$'P1.Perceptible'.D527]);"";[$'P1.Perceptible'.D527]) ->  | I74: of:=IF( ISBLANK([$'P1.Perceptible'.D565]);"";[$'P1.Perceptible'.D565]) ->  | J74: of:=IF( ISBLANK([$'P1.Perceptible'.D603]);"";[$'P1.Perceptible'.D603]) ->  | K74: of:=IF( ISBLANK([$'P1.Perceptible'.D641]);"";[$'P1.Perceptible'.D641]) ->  | L74: of:=IF( ISBLANK([$'P1.Perceptible'.D679]);"";[$'P1.Perceptible'.D679]) ->  | M74: of:=IF( ISBLANK([$'P1.Perceptible'.D717]);"";[$'P1.Perceptible'.D717]) ->  | N74: of:=IF( ISBLANK([$'P1.Perceptible'.D755]);"";[$'P1.Perceptible'.D755]) ->  | O74: of:=IF( ISBLANK([$'P2.Operable'.D413]);"";[$'P2.Operable'.D413]) ->  | P74: of:=IF( ISBLANK([$'P2.Operable'.D451]);"";[$'P2.Operable'.D451]) ->  | Q74: of:=IF( ISBLANK([$'P2.Operable'.D489]);"";[$'P2.Operable'.D489]) ->  | R74: of:=IF( ISBLANK([$'P3.Comprensible'.D71]);"";[$'P3.Comprensible'.D71]) ->  | S74: of:=IF( ISBLANK([$'P3.Comprensible'.D185]);"";[$'P3.Comprensible'.D185]) ->  | T74: of:=IF( ISBLANK([$'P3.Comprensible'.D223]);"";[$'P3.Comprensible'.D223]) ->  | U74: of:=IF( ISBLANK([$'P3.Comprensible'.D337]);"";[$'P3.Comprensible'.D337]) ->  | V74: of:=IF( ISBLANK([$'P3.Comprensible'.D375]);"";[$'P3.Comprensible'.D375]) ->  | W74: of:=IF(ISBLANK([$'P4.Robusto'.D109]);"";[$'P4.Robusto'.D109]) -> 
B75: of:=IF( ISBLANK([$'03.Muestra'.$C23]);"";[$'03.Muestra'.$C23]) ->  | C75: of:=IF( ISBLANK([$'03.Muestra'.$E23]);"";[$'03.Muestra'.$E23]) ->  | D75: of:=IF( ISBLANK([$'P1.Perceptible'.D186]);"";[$'P1.Perceptible'.D186]) ->  | E75: of:=IF( ISBLANK([$'P1.Perceptible'.D224]);"";[$'P1.Perceptible'.D224]) ->  | F75: of:=IF( ISBLANK([$'P1.Perceptible'.D376]);"";[$'P1.Perceptible'.D376]) ->  | G75: of:=IF( ISBLANK([$'P1.Perceptible'.D414]);"";[$'P1.Perceptible'.D414]) ->  | H75: of:=IF( ISBLANK([$'P1.Perceptible'.D528]);"";[$'P1.Perceptible'.D528]) ->  | I75: of:=IF( ISBLANK([$'P1.Perceptible'.D566]);"";[$'P1.Perceptible'.D566]) ->  | J75: of:=IF( ISBLANK([$'P1.Perceptible'.D604]);"";[$'P1.Perceptible'.D604]) ->  | K75: of:=IF( ISBLANK([$'P1.Perceptible'.D642]);"";[$'P1.Perceptible'.D642]) ->  | L75: of:=IF( ISBLANK([$'P1.Perceptible'.D680]);"";[$'P1.Perceptible'.D680]) ->  | M75: of:=IF( ISBLANK([$'P1.Perceptible'.D718]);"";[$'P1.Perceptible'.D718]) ->  | N75: of:=IF( ISBLANK([$'P1.Perceptible'.D756]);"";[$'P1.Perceptible'.D756]) ->  | O75: of:=IF( ISBLANK([$'P2.Operable'.D414]);"";[$'P2.Operable'.D414]) ->  | P75: of:=IF( ISBLANK([$'P2.Operable'.D452]);"";[$'P2.Operable'.D452]) ->  | Q75: of:=IF( ISBLANK([$'P2.Operable'.D490]);"";[$'P2.Operable'.D490]) ->  | R75: of:=IF( ISBLANK([$'P3.Comprensible'.D72]);"";[$'P3.Comprensible'.D72]) ->  | S75: of:=IF( ISBLANK([$'P3.Comprensible'.D186]);"";[$'P3.Comprensible'.D186]) ->  | T75: of:=IF( ISBLANK([$'P3.Comprensible'.D224]);"";[$'P3.Comprensible'.D224]) ->  | U75: of:=IF( ISBLANK([$'P3.Comprensible'.D338]);"";[$'P3.Comprensible'.D338]) ->  | V75: of:=IF( ISBLANK([$'P3.Comprensible'.D376]);"";[$'P3.Comprensible'.D376]) ->  | W75: of:=IF(ISBLANK([$'P4.Robusto'.D110]);"";[$'P4.Robusto'.D110]) -> 
B76: of:=IF( ISBLANK([$'03.Muestra'.$C24]);"";[$'03.Muestra'.$C24]) ->  | C76: of:=IF( ISBLANK([$'03.Muestra'.$E24]);"";[$'03.Muestra'.$E24]) ->  | D76: of:=IF( ISBLANK([$'P1.Perceptible'.D187]);"";[$'P1.Perceptible'.D187]) ->  | E76: of:=IF( ISBLANK([$'P1.Perceptible'.D225]);"";[$'P1.Perceptible'.D225]) ->  | F76: of:=IF( ISBLANK([$'P1.Perceptible'.D377]);"";[$'P1.Perceptible'.D377]) ->  | G76: of:=IF( ISBLANK([$'P1.Perceptible'.D415]);"";[$'P1.Perceptible'.D415]) ->  | H76: of:=IF( ISBLANK([$'P1.Perceptible'.D529]);"";[$'P1.Perceptible'.D529]) ->  | I76: of:=IF( ISBLANK([$'P1.Perceptible'.D567]);"";[$'P1.Perceptible'.D567]) ->  | J76: of:=IF( ISBLANK([$'P1.Perceptible'.D605]);"";[$'P1.Perceptible'.D605]) ->  | K76: of:=IF( ISBLANK([$'P1.Perceptible'.D643]);"";[$'P1.Perceptible'.D643]) ->  | L76: of:=IF( ISBLANK([$'P1.Perceptible'.D681]);"";[$'P1.Perceptible'.D681]) ->  | M76: of:=IF( ISBLANK([$'P1.Perceptible'.D719]);"";[$'P1.Perceptible'.D719]) ->  | N76: of:=IF( ISBLANK([$'P1.Perceptible'.D757]);"";[$'P1.Perceptible'.D757]) ->  | O76: of:=IF( ISBLANK([$'P2.Operable'.D415]);"";[$'P2.Operable'.D415]) ->  | P76: of:=IF( ISBLANK([$'P2.Operable'.D453]);"";[$'P2.Operable'.D453]) ->  | Q76: of:=IF( ISBLANK([$'P2.Operable'.D491]);"";[$'P2.Operable'.D491]) ->  | R76: of:=IF( ISBLANK([$'P3.Comprensible'.D73]);"";[$'P3.Comprensible'.D73]) ->  | S76: of:=IF( ISBLANK([$'P3.Comprensible'.D187]);"";[$'P3.Comprensible'.D187]) ->  | T76: of:=IF( ISBLANK([$'P3.Comprensible'.D225]);"";[$'P3.Comprensible'.D225]) ->  | U76: of:=IF( ISBLANK([$'P3.Comprensible'.D339]);"";[$'P3.Comprensible'.D339]) ->  | V76: of:=IF( ISBLANK([$'P3.Comprensible'.D377]);"";[$'P3.Comprensible'.D377]) ->  | W76: of:=IF(ISBLANK([$'P4.Robusto'.D111]);"";[$'P4.Robusto'.D111]) -> 
B77: of:=IF( ISBLANK([$'03.Muestra'.$C25]);"";[$'03.Muestra'.$C25]) ->  | C77: of:=IF( ISBLANK([$'03.Muestra'.$E25]);"";[$'03.Muestra'.$E25]) ->  | D77: of:=IF( ISBLANK([$'P1.Perceptible'.D188]);"";[$'P1.Perceptible'.D188]) ->  | E77: of:=IF( ISBLANK([$'P1.Perceptible'.D226]);"";[$'P1.Perceptible'.D226]) ->  | F77: of:=IF( ISBLANK([$'P1.Perceptible'.D378]);"";[$'P1.Perceptible'.D378]) ->  | G77: of:=IF( ISBLANK([$'P1.Perceptible'.D416]);"";[$'P1.Perceptible'.D416]) ->  | H77: of:=IF( ISBLANK([$'P1.Perceptible'.D530]);"";[$'P1.Perceptible'.D530]) ->  | I77: of:=IF( ISBLANK([$'P1.Perceptible'.D568]);"";[$'P1.Perceptible'.D568]) ->  | J77: of:=IF( ISBLANK([$'P1.Perceptible'.D606]);"";[$'P1.Perceptible'.D606]) ->  | K77: of:=IF( ISBLANK([$'P1.Perceptible'.D644]);"";[$'P1.Perceptible'.D644]) ->  | L77: of:=IF( ISBLANK([$'P1.Perceptible'.D682]);"";[$'P1.Perceptible'.D682]) ->  | M77: of:=IF( ISBLANK([$'P1.Perceptible'.D720]);"";[$'P1.Perceptible'.D720]) ->  | N77: of:=IF( ISBLANK([$'P1.Perceptible'.D758]);"";[$'P1.Perceptible'.D758]) ->  | O77: of:=IF( ISBLANK([$'P2.Operable'.D416]);"";[$'P2.Operable'.D416]) ->  | P77: of:=IF( ISBLANK([$'P2.Operable'.D454]);"";[$'P2.Operable'.D454]) ->  | Q77: of:=IF( ISBLANK([$'P2.Operable'.D492]);"";[$'P2.Operable'.D492]) ->  | R77: of:=IF( ISBLANK([$'P3.Comprensible'.D74]);"";[$'P3.Comprensible'.D74]) ->  | S77: of:=IF( ISBLANK([$'P3.Comprensible'.D188]);"";[$'P3.Comprensible'.D188]) ->  | T77: of:=IF( ISBLANK([$'P3.Comprensible'.D226]);"";[$'P3.Comprensible'.D226]) ->  | U77: of:=IF( ISBLANK([$'P3.Comprensible'.D340]);"";[$'P3.Comprensible'.D340]) ->  | V77: of:=IF( ISBLANK([$'P3.Comprensible'.D378]);"";[$'P3.Comprensible'.D378]) ->  | W77: of:=IF(ISBLANK([$'P4.Robusto'.D112]);"";[$'P4.Robusto'.D112]) -> 
B78: of:=IF( ISBLANK([$'03.Muestra'.$C26]);"";[$'03.Muestra'.$C26]) ->  | C78: of:=IF( ISBLANK([$'03.Muestra'.$E26]);"";[$'03.Muestra'.$E26]) ->  | D78: of:=IF( ISBLANK([$'P1.Perceptible'.D189]);"";[$'P1.Perceptible'.D189]) ->  | E78: of:=IF( ISBLANK([$'P1.Perceptible'.D227]);"";[$'P1.Perceptible'.D227]) ->  | F78: of:=IF( ISBLANK([$'P1.Perceptible'.D379]);"";[$'P1.Perceptible'.D379]) ->  | G78: of:=IF( ISBLANK([$'P1.Perceptible'.D417]);"";[$'P1.Perceptible'.D417]) ->  | H78: of:=IF( ISBLANK([$'P1.Perceptible'.D531]);"";[$'P1.Perceptible'.D531]) ->  | I78: of:=IF( ISBLANK([$'P1.Perceptible'.D569]);"";[$'P1.Perceptible'.D569]) ->  | J78: of:=IF( ISBLANK([$'P1.Perceptible'.D607]);"";[$'P1.Perceptible'.D607]) ->  | K78: of:=IF( ISBLANK([$'P1.Perceptible'.D645]);"";[$'P1.Perceptible'.D645]) ->  | L78: of:=IF( ISBLANK([$'P1.Perceptible'.D683]);"";[$'P1.Perceptible'.D683]) ->  | M78: of:=IF( ISBLANK([$'P1.Perceptible'.D721]);"";[$'P1.Perceptible'.D721]) ->  | N78: of:=IF( ISBLANK([$'P1.Perceptible'.D759]);"";[$'P1.Perceptible'.D759]) ->  | O78: of:=IF( ISBLANK([$'P2.Operable'.D417]);"";[$'P2.Operable'.D417]) ->  | P78: of:=IF( ISBLANK([$'P2.Operable'.D455]);"";[$'P2.Operable'.D455]) ->  | Q78: of:=IF( ISBLANK([$'P2.Operable'.D493]);"";[$'P2.Operable'.D493]) ->  | R78: of:=IF( ISBLANK([$'P3.Comprensible'.D75]);"";[$'P3.Comprensible'.D75]) ->  | S78: of:=IF( ISBLANK([$'P3.Comprensible'.D189]);"";[$'P3.Comprensible'.D189]) ->  | T78: of:=IF( ISBLANK([$'P3.Comprensible'.D227]);"";[$'P3.Comprensible'.D227]) ->  | U78: of:=IF( ISBLANK([$'P3.Comprensible'.D341]);"";[$'P3.Comprensible'.D341]) ->  | V78: of:=IF( ISBLANK([$'P3.Comprensible'.D379]);"";[$'P3.Comprensible'.D379]) ->  | W78: of:=IF(ISBLANK([$'P4.Robusto'.D113]);"";[$'P4.Robusto'.D113]) -> 
B79: of:=IF( ISBLANK([$'03.Muestra'.$C27]);"";[$'03.Muestra'.$C27]) ->  | C79: of:=IF( ISBLANK([$'03.Muestra'.$E27]);"";[$'03.Muestra'.$E27]) ->  | D79: of:=IF( ISBLANK([$'P1.Perceptible'.D190]);"";[$'P1.Perceptible'.D190]) ->  | E79: of:=IF( ISBLANK([$'P1.Perceptible'.D228]);"";[$'P1.Perceptible'.D228]) ->  | F79: of:=IF( ISBLANK([$'P1.Perceptible'.D380]);"";[$'P1.Perceptible'.D380]) ->  | G79: of:=IF( ISBLANK([$'P1.Perceptible'.D418]);"";[$'P1.Perceptible'.D418]) ->  | H79: of:=IF( ISBLANK([$'P1.Perceptible'.D532]);"";[$'P1.Perceptible'.D532]) ->  | I79: of:=IF( ISBLANK([$'P1.Perceptible'.D570]);"";[$'P1.Perceptible'.D570]) ->  | J79: of:=IF( ISBLANK([$'P1.Perceptible'.D608]);"";[$'P1.Perceptible'.D608]) ->  | K79: of:=IF( ISBLANK([$'P1.Perceptible'.D646]);"";[$'P1.Perceptible'.D646]) ->  | L79: of:=IF( ISBLANK([$'P1.Perceptible'.D684]);"";[$'P1.Perceptible'.D684]) ->  | M79: of:=IF( ISBLANK([$'P1.Perceptible'.D722]);"";[$'P1.Perceptible'.D722]) ->  | N79: of:=IF( ISBLANK([$'P1.Perceptible'.D760]);"";[$'P1.Perceptible'.D760]) ->  | O79: of:=IF( ISBLANK([$'P2.Operable'.D418]);"";[$'P2.Operable'.D418]) ->  | P79: of:=IF( ISBLANK([$'P2.Operable'.D456]);"";[$'P2.Operable'.D456]) ->  | Q79: of:=IF( ISBLANK([$'P2.Operable'.D494]);"";[$'P2.Operable'.D494]) ->  | R79: of:=IF( ISBLANK([$'P3.Comprensible'.D76]);"";[$'P3.Comprensible'.D76]) ->  | S79: of:=IF( ISBLANK([$'P3.Comprensible'.D190]);"";[$'P3.Comprensible'.D190]) ->  | T79: of:=IF( ISBLANK([$'P3.Comprensible'.D228]);"";[$'P3.Comprensible'.D228]) ->  | U79: of:=IF( ISBLANK([$'P3.Comprensible'.D342]);"";[$'P3.Comprensible'.D342]) ->  | V79: of:=IF( ISBLANK([$'P3.Comprensible'.D380]);"";[$'P3.Comprensible'.D380]) ->  | W79: of:=IF(ISBLANK([$'P4.Robusto'.D114]);"";[$'P4.Robusto'.D114]) -> 
B80: of:=IF( ISBLANK([$'03.Muestra'.$C28]);"";[$'03.Muestra'.$C28]) ->  | C80: of:=IF( ISBLANK([$'03.Muestra'.$E28]);"";[$'03.Muestra'.$E28]) ->  | D80: of:=IF( ISBLANK([$'P1.Perceptible'.D191]);"";[$'P1.Perceptible'.D191]) ->  | E80: of:=IF( ISBLANK([$'P1.Perceptible'.D229]);"";[$'P1.Perceptible'.D229]) ->  | F80: of:=IF( ISBLANK([$'P1.Perceptible'.D381]);"";[$'P1.Perceptible'.D381]) ->  | G80: of:=IF( ISBLANK([$'P1.Perceptible'.D419]);"";[$'P1.Perceptible'.D419]) ->  | H80: of:=IF( ISBLANK([$'P1.Perceptible'.D533]);"";[$'P1.Perceptible'.D533]) ->  | I80: of:=IF( ISBLANK([$'P1.Perceptible'.D571]);"";[$'P1.Perceptible'.D571]) ->  | J80: of:=IF( ISBLANK([$'P1.Perceptible'.D609]);"";[$'P1.Perceptible'.D609]) ->  | K80: of:=IF( ISBLANK([$'P1.Perceptible'.D647]);"";[$'P1.Perceptible'.D647]) ->  | L80: of:=IF( ISBLANK([$'P1.Perceptible'.D685]);"";[$'P1.Perceptible'.D685]) ->  | M80: of:=IF( ISBLANK([$'P1.Perceptible'.D723]);"";[$'P1.Perceptible'.D723]) ->  | N80: of:=IF( ISBLANK([$'P1.Perceptible'.D761]);"";[$'P1.Perceptible'.D761]) ->  | O80: of:=IF( ISBLANK([$'P2.Operable'.D419]);"";[$'P2.Operable'.D419]) ->  | P80: of:=IF( ISBLANK([$'P2.Operable'.D457]);"";[$'P2.Operable'.D457]) ->  | Q80: of:=IF( ISBLANK([$'P2.Operable'.D495]);"";[$'P2.Operable'.D495]) ->  | R80: of:=IF( ISBLANK([$'P3.Comprensible'.D77]);"";[$'P3.Comprensible'.D77]) ->  | S80: of:=IF( ISBLANK([$'P3.Comprensible'.D191]);"";[$'P3.Comprensible'.D191]) ->  | T80: of:=IF( ISBLANK([$'P3.Comprensible'.D229]);"";[$'P3.Comprensible'.D229]) ->  | U80: of:=IF( ISBLANK([$'P3.Comprensible'.D343]);"";[$'P3.Comprensible'.D343]) ->  | V80: of:=IF( ISBLANK([$'P3.Comprensible'.D381]);"";[$'P3.Comprensible'.D381]) ->  | W80: of:=IF(ISBLANK([$'P4.Robusto'.D115]);"";[$'P4.Robusto'.D115]) -> 
B81: of:=IF( ISBLANK([$'03.Muestra'.$C29]);"";[$'03.Muestra'.$C29]) ->  | C81: of:=IF( ISBLANK([$'03.Muestra'.$E29]);"";[$'03.Muestra'.$E29]) ->  | D81: of:=IF( ISBLANK([$'P1.Perceptible'.D192]);"";[$'P1.Perceptible'.D192]) ->  | E81: of:=IF( ISBLANK([$'P1.Perceptible'.D230]);"";[$'P1.Perceptible'.D230]) ->  | F81: of:=IF( ISBLANK([$'P1.Perceptible'.D382]);"";[$'P1.Perceptible'.D382]) ->  | G81: of:=IF( ISBLANK([$'P1.Perceptible'.D420]);"";[$'P1.Perceptible'.D420]) ->  | H81: of:=IF( ISBLANK([$'P1.Perceptible'.D534]);"";[$'P1.Perceptible'.D534]) ->  | I81: of:=IF( ISBLANK([$'P1.Perceptible'.D572]);"";[$'P1.Perceptible'.D572]) ->  | J81: of:=IF( ISBLANK([$'P1.Perceptible'.D610]);"";[$'P1.Perceptible'.D610]) ->  | K81: of:=IF( ISBLANK([$'P1.Perceptible'.D648]);"";[$'P1.Perceptible'.D648]) ->  | L81: of:=IF( ISBLANK([$'P1.Perceptible'.D686]);"";[$'P1.Perceptible'.D686]) ->  | M81: of:=IF( ISBLANK([$'P1.Perceptible'.D724]);"";[$'P1.Perceptible'.D724]) ->  | N81: of:=IF( ISBLANK([$'P1.Perceptible'.D762]);"";[$'P1.Perceptible'.D762]) ->  | O81: of:=IF( ISBLANK([$'P2.Operable'.D420]);"";[$'P2.Operable'.D420]) ->  | P81: of:=IF( ISBLANK([$'P2.Operable'.D458]);"";[$'P2.Operable'.D458]) ->  | Q81: of:=IF( ISBLANK([$'P2.Operable'.D496]);"";[$'P2.Operable'.D496]) ->  | R81: of:=IF( ISBLANK([$'P3.Comprensible'.D78]);"";[$'P3.Comprensible'.D78]) ->  | S81: of:=IF( ISBLANK([$'P3.Comprensible'.D192]);"";[$'P3.Comprensible'.D192]) ->  | T81: of:=IF( ISBLANK([$'P3.Comprensible'.D230]);"";[$'P3.Comprensible'.D230]) ->  | U81: of:=IF( ISBLANK([$'P3.Comprensible'.D344]);"";[$'P3.Comprensible'.D344]) ->  | V81: of:=IF( ISBLANK([$'P3.Comprensible'.D382]);"";[$'P3.Comprensible'.D382]) ->  | W81: of:=IF(ISBLANK([$'P4.Robusto'.D116]);"";[$'P4.Robusto'.D116]) -> 
B82: of:=IF( ISBLANK([$'03.Muestra'.$C30]);"";[$'03.Muestra'.$C30]) ->  | C82: of:=IF( ISBLANK([$'03.Muestra'.$E30]);"";[$'03.Muestra'.$E30]) ->  | D82: of:=IF( ISBLANK([$'P1.Perceptible'.D193]);"";[$'P1.Perceptible'.D193]) ->  | E82: of:=IF( ISBLANK([$'P1.Perceptible'.D231]);"";[$'P1.Perceptible'.D231]) ->  | F82: of:=IF( ISBLANK([$'P1.Perceptible'.D383]);"";[$'P1.Perceptible'.D383]) ->  | G82: of:=IF( ISBLANK([$'P1.Perceptible'.D421]);"";[$'P1.Perceptible'.D421]) ->  | H82: of:=IF( ISBLANK([$'P1.Perceptible'.D535]);"";[$'P1.Perceptible'.D535]) ->  | I82: of:=IF( ISBLANK([$'P1.Perceptible'.D573]);"";[$'P1.Perceptible'.D573]) ->  | J82: of:=IF( ISBLANK([$'P1.Perceptible'.D611]);"";[$'P1.Perceptible'.D611]) ->  | K82: of:=IF( ISBLANK([$'P1.Perceptible'.D649]);"";[$'P1.Perceptible'.D649]) ->  | L82: of:=IF( ISBLANK([$'P1.Perceptible'.D687]);"";[$'P1.Perceptible'.D687]) ->  | M82: of:=IF( ISBLANK([$'P1.Perceptible'.D725]);"";[$'P1.Perceptible'.D725]) ->  | N82: of:=IF( ISBLANK([$'P1.Perceptible'.D763]);"";[$'P1.Perceptible'.D763]) ->  | O82: of:=IF( ISBLANK([$'P2.Operable'.D421]);"";[$'P2.Operable'.D421]) ->  | P82: of:=IF( ISBLANK([$'P2.Operable'.D459]);"";[$'P2.Operable'.D459]) ->  | Q82: of:=IF( ISBLANK([$'P2.Operable'.D497]);"";[$'P2.Operable'.D497]) ->  | R82: of:=IF( ISBLANK([$'P3.Comprensible'.D79]);"";[$'P3.Comprensible'.D79]) ->  | S82: of:=IF( ISBLANK([$'P3.Comprensible'.D193]);"";[$'P3.Comprensible'.D193]) ->  | T82: of:=IF( ISBLANK([$'P3.Comprensible'.D231]);"";[$'P3.Comprensible'.D231]) ->  | U82: of:=IF( ISBLANK([$'P3.Comprensible'.D345]);"";[$'P3.Comprensible'.D345]) ->  | V82: of:=IF( ISBLANK([$'P3.Comprensible'.D383]);"";[$'P3.Comprensible'.D383]) ->  | W82: of:=IF(ISBLANK([$'P4.Robusto'.D117]);"";[$'P4.Robusto'.D117]) -> 
B83: of:=IF( ISBLANK([$'03.Muestra'.$C31]);"";[$'03.Muestra'.$C31]) ->  | C83: of:=IF( ISBLANK([$'03.Muestra'.$E31]);"";[$'03.Muestra'.$E31]) ->  | D83: of:=IF( ISBLANK([$'P1.Perceptible'.D194]);"";[$'P1.Perceptible'.D194]) ->  | E83: of:=IF( ISBLANK([$'P1.Perceptible'.D232]);"";[$'P1.Perceptible'.D232]) ->  | F83: of:=IF( ISBLANK([$'P1.Perceptible'.D384]);"";[$'P1.Perceptible'.D384]) ->  | G83: of:=IF( ISBLANK([$'P1.Perceptible'.D422]);"";[$'P1.Perceptible'.D422]) ->  | H83: of:=IF( ISBLANK([$'P1.Perceptible'.D536]);"";[$'P1.Perceptible'.D536]) ->  | I83: of:=IF( ISBLANK([$'P1.Perceptible'.D574]);"";[$'P1.Perceptible'.D574]) ->  | J83: of:=IF( ISBLANK([$'P1.Perceptible'.D612]);"";[$'P1.Perceptible'.D612]) ->  | K83: of:=IF( ISBLANK([$'P1.Perceptible'.D650]);"";[$'P1.Perceptible'.D650]) ->  | L83: of:=IF( ISBLANK([$'P1.Perceptible'.D688]);"";[$'P1.Perceptible'.D688]) ->  | M83: of:=IF( ISBLANK([$'P1.Perceptible'.D726]);"";[$'P1.Perceptible'.D726]) ->  | N83: of:=IF( ISBLANK([$'P1.Perceptible'.D764]);"";[$'P1.Perceptible'.D764]) ->  | O83: of:=IF( ISBLANK([$'P2.Operable'.D422]);"";[$'P2.Operable'.D422]) ->  | P83: of:=IF( ISBLANK([$'P2.Operable'.D460]);"";[$'P2.Operable'.D460]) ->  | Q83: of:=IF( ISBLANK([$'P2.Operable'.D498]);"";[$'P2.Operable'.D498]) ->  | R83: of:=IF( ISBLANK([$'P3.Comprensible'.D80]);"";[$'P3.Comprensible'.D80]) ->  | S83: of:=IF( ISBLANK([$'P3.Comprensible'.D194]);"";[$'P3.Comprensible'.D194]) ->  | T83: of:=IF( ISBLANK([$'P3.Comprensible'.D232]);"";[$'P3.Comprensible'.D232]) ->  | U83: of:=IF( ISBLANK([$'P3.Comprensible'.D346]);"";[$'P3.Comprensible'.D346]) ->  | V83: of:=IF( ISBLANK([$'P3.Comprensible'.D384]);"";[$'P3.Comprensible'.D384]) ->  | W83: of:=IF(ISBLANK([$'P4.Robusto'.D118]);"";[$'P4.Robusto'.D118]) -> 
B84: of:=IF( ISBLANK([$'03.Muestra'.$C32]);"";[$'03.Muestra'.$C32]) ->  | C84: of:=IF( ISBLANK([$'03.Muestra'.$E32]);"";[$'03.Muestra'.$E32]) ->  | D84: of:=IF( ISBLANK([$'P1.Perceptible'.D195]);"";[$'P1.Perceptible'.D195]) ->  | E84: of:=IF( ISBLANK([$'P1.Perceptible'.D233]);"";[$'P1.Perceptible'.D233]) ->  | F84: of:=IF( ISBLANK([$'P1.Perceptible'.D385]);"";[$'P1.Perceptible'.D385]) ->  | G84: of:=IF( ISBLANK([$'P1.Perceptible'.D423]);"";[$'P1.Perceptible'.D423]) ->  | H84: of:=IF( ISBLANK([$'P1.Perceptible'.D537]);"";[$'P1.Perceptible'.D537]) ->  | I84: of:=IF( ISBLANK([$'P1.Perceptible'.D575]);"";[$'P1.Perceptible'.D575]) ->  | J84: of:=IF( ISBLANK([$'P1.Perceptible'.D613]);"";[$'P1.Perceptible'.D613]) ->  | K84: of:=IF( ISBLANK([$'P1.Perceptible'.D651]);"";[$'P1.Perceptible'.D651]) ->  | L84: of:=IF( ISBLANK([$'P1.Perceptible'.D689]);"";[$'P1.Perceptible'.D689]) ->  | M84: of:=IF( ISBLANK([$'P1.Perceptible'.D727]);"";[$'P1.Perceptible'.D727]) ->  | N84: of:=IF( ISBLANK([$'P1.Perceptible'.D765]);"";[$'P1.Perceptible'.D765]) ->  | O84: of:=IF( ISBLANK([$'P2.Operable'.D423]);"";[$'P2.Operable'.D423]) ->  | P84: of:=IF( ISBLANK([$'P2.Operable'.D461]);"";[$'P2.Operable'.D461]) ->  | Q84: of:=IF( ISBLANK([$'P2.Operable'.D499]);"";[$'P2.Operable'.D499]) ->  | R84: of:=IF( ISBLANK([$'P3.Comprensible'.D81]);"";[$'P3.Comprensible'.D81]) ->  | S84: of:=IF( ISBLANK([$'P3.Comprensible'.D195]);"";[$'P3.Comprensible'.D195]) ->  | T84: of:=IF( ISBLANK([$'P3.Comprensible'.D233]);"";[$'P3.Comprensible'.D233]) ->  | U84: of:=IF( ISBLANK([$'P3.Comprensible'.D347]);"";[$'P3.Comprensible'.D347]) ->  | V84: of:=IF( ISBLANK([$'P3.Comprensible'.D385]);"";[$'P3.Comprensible'.D385]) ->  | W84: of:=IF(ISBLANK([$'P4.Robusto'.D119]);"";[$'P4.Robusto'.D119]) -> 
B85: of:=IF( ISBLANK([$'03.Muestra'.$C33]);"";[$'03.Muestra'.$C33]) ->  | C85: of:=IF( ISBLANK([$'03.Muestra'.$E33]);"";[$'03.Muestra'.$E33]) ->  | D85: of:=IF( ISBLANK([$'P1.Perceptible'.D196]);"";[$'P1.Perceptible'.D196]) ->  | E85: of:=IF( ISBLANK([$'P1.Perceptible'.D234]);"";[$'P1.Perceptible'.D234]) ->  | F85: of:=IF( ISBLANK([$'P1.Perceptible'.D386]);"";[$'P1.Perceptible'.D386]) ->  | G85: of:=IF( ISBLANK([$'P1.Perceptible'.D424]);"";[$'P1.Perceptible'.D424]) ->  | H85: of:=IF( ISBLANK([$'P1.Perceptible'.D538]);"";[$'P1.Perceptible'.D538]) ->  | I85: of:=IF( ISBLANK([$'P1.Perceptible'.D576]);"";[$'P1.Perceptible'.D576]) ->  | J85: of:=IF( ISBLANK([$'P1.Perceptible'.D614]);"";[$'P1.Perceptible'.D614]) ->  | K85: of:=IF( ISBLANK([$'P1.Perceptible'.D652]);"";[$'P1.Perceptible'.D652]) ->  | L85: of:=IF( ISBLANK([$'P1.Perceptible'.D690]);"";[$'P1.Perceptible'.D690]) ->  | M85: of:=IF( ISBLANK([$'P1.Perceptible'.D728]);"";[$'P1.Perceptible'.D728]) ->  | N85: of:=IF( ISBLANK([$'P1.Perceptible'.D766]);"";[$'P1.Perceptible'.D766]) ->  | O85: of:=IF( ISBLANK([$'P2.Operable'.D424]);"";[$'P2.Operable'.D424]) ->  | P85: of:=IF( ISBLANK([$'P2.Operable'.D462]);"";[$'P2.Operable'.D462]) ->  | Q85: of:=IF( ISBLANK([$'P2.Operable'.D500]);"";[$'P2.Operable'.D500]) ->  | R85: of:=IF( ISBLANK([$'P3.Comprensible'.D82]);"";[$'P3.Comprensible'.D82]) ->  | S85: of:=IF( ISBLANK([$'P3.Comprensible'.D196]);"";[$'P3.Comprensible'.D196]) ->  | T85: of:=IF( ISBLANK([$'P3.Comprensible'.D234]);"";[$'P3.Comprensible'.D234]) ->  | U85: of:=IF( ISBLANK([$'P3.Comprensible'.D348]);"";[$'P3.Comprensible'.D348]) ->  | V85: of:=IF( ISBLANK([$'P3.Comprensible'.D386]);"";[$'P3.Comprensible'.D386]) ->  | W85: of:=IF(ISBLANK([$'P4.Robusto'.D120]);"";[$'P4.Robusto'.D120]) -> 
B86: of:=IF( ISBLANK([$'03.Muestra'.$C34]);"";[$'03.Muestra'.$C34]) ->  | C86: of:=IF( ISBLANK([$'03.Muestra'.$E34]);"";[$'03.Muestra'.$E34]) ->  | D86: of:=IF( ISBLANK([$'P1.Perceptible'.D197]);"";[$'P1.Perceptible'.D197]) ->  | E86: of:=IF( ISBLANK([$'P1.Perceptible'.D235]);"";[$'P1.Perceptible'.D235]) ->  | F86: of:=IF( ISBLANK([$'P1.Perceptible'.D387]);"";[$'P1.Perceptible'.D387]) ->  | G86: of:=IF( ISBLANK([$'P1.Perceptible'.D425]);"";[$'P1.Perceptible'.D425]) ->  | H86: of:=IF( ISBLANK([$'P1.Perceptible'.D539]);"";[$'P1.Perceptible'.D539]) ->  | I86: of:=IF( ISBLANK([$'P1.Perceptible'.D577]);"";[$'P1.Perceptible'.D577]) ->  | J86: of:=IF( ISBLANK([$'P1.Perceptible'.D615]);"";[$'P1.Perceptible'.D615]) ->  | K86: of:=IF( ISBLANK([$'P1.Perceptible'.D653]);"";[$'P1.Perceptible'.D653]) ->  | L86: of:=IF( ISBLANK([$'P1.Perceptible'.D691]);"";[$'P1.Perceptible'.D691]) ->  | M86: of:=IF( ISBLANK([$'P1.Perceptible'.D729]);"";[$'P1.Perceptible'.D729]) ->  | N86: of:=IF( ISBLANK([$'P1.Perceptible'.D767]);"";[$'P1.Perceptible'.D767]) ->  | O86: of:=IF( ISBLANK([$'P2.Operable'.D425]);"";[$'P2.Operable'.D425]) ->  | P86: of:=IF( ISBLANK([$'P2.Operable'.D463]);"";[$'P2.Operable'.D463]) ->  | Q86: of:=IF( ISBLANK([$'P2.Operable'.D501]);"";[$'P2.Operable'.D501]) ->  | R86: of:=IF( ISBLANK([$'P3.Comprensible'.D83]);"";[$'P3.Comprensible'.D83]) ->  | S86: of:=IF( ISBLANK([$'P3.Comprensible'.D197]);"";[$'P3.Comprensible'.D197]) ->  | T86: of:=IF( ISBLANK([$'P3.Comprensible'.D235]);"";[$'P3.Comprensible'.D235]) ->  | U86: of:=IF( ISBLANK([$'P3.Comprensible'.D349]);"";[$'P3.Comprensible'.D349]) ->  | V86: of:=IF( ISBLANK([$'P3.Comprensible'.D387]);"";[$'P3.Comprensible'.D387]) ->  | W86: of:=IF(ISBLANK([$'P4.Robusto'.D121]);"";[$'P4.Robusto'.D121]) -> 
B87: of:=IF( ISBLANK([$'03.Muestra'.$C35]);"";[$'03.Muestra'.$C35]) ->  | C87: of:=IF( ISBLANK([$'03.Muestra'.$E35]);"";[$'03.Muestra'.$E35]) ->  | D87: of:=IF( ISBLANK([$'P1.Perceptible'.D198]);"";[$'P1.Perceptible'.D198]) ->  | E87: of:=IF( ISBLANK([$'P1.Perceptible'.D236]);"";[$'P1.Perceptible'.D236]) ->  | F87: of:=IF( ISBLANK([$'P1.Perceptible'.D388]);"";[$'P1.Perceptible'.D388]) ->  | G87: of:=IF( ISBLANK([$'P1.Perceptible'.D426]);"";[$'P1.Perceptible'.D426]) ->  | H87: of:=IF( ISBLANK([$'P1.Perceptible'.D540]);"";[$'P1.Perceptible'.D540]) ->  | I87: of:=IF( ISBLANK([$'P1.Perceptible'.D578]);"";[$'P1.Perceptible'.D578]) ->  | J87: of:=IF( ISBLANK([$'P1.Perceptible'.D616]);"";[$'P1.Perceptible'.D616]) ->  | K87: of:=IF( ISBLANK([$'P1.Perceptible'.D654]);"";[$'P1.Perceptible'.D654]) ->  | L87: of:=IF( ISBLANK([$'P1.Perceptible'.D692]);"";[$'P1.Perceptible'.D692]) ->  | M87: of:=IF( ISBLANK([$'P1.Perceptible'.D730]);"";[$'P1.Perceptible'.D730]) ->  | N87: of:=IF( ISBLANK([$'P1.Perceptible'.D768]);"";[$'P1.Perceptible'.D768]) ->  | O87: of:=IF( ISBLANK([$'P2.Operable'.D426]);"";[$'P2.Operable'.D426]) ->  | P87: of:=IF( ISBLANK([$'P2.Operable'.D464]);"";[$'P2.Operable'.D464]) ->  | Q87: of:=IF( ISBLANK([$'P2.Operable'.D502]);"";[$'P2.Operable'.D502]) ->  | R87: of:=IF( ISBLANK([$'P3.Comprensible'.D84]);"";[$'P3.Comprensible'.D84]) ->  | S87: of:=IF( ISBLANK([$'P3.Comprensible'.D198]);"";[$'P3.Comprensible'.D198]) ->  | T87: of:=IF( ISBLANK([$'P3.Comprensible'.D236]);"";[$'P3.Comprensible'.D236]) ->  | U87: of:=IF( ISBLANK([$'P3.Comprensible'.D350]);"";[$'P3.Comprensible'.D350]) ->  | V87: of:=IF( ISBLANK([$'P3.Comprensible'.D388]);"";[$'P3.Comprensible'.D388]) ->  | W87: of:=IF(ISBLANK([$'P4.Robusto'.D122]);"";[$'P4.Robusto'.D122]) -> 
B88: of:=IF( ISBLANK([$'03.Muestra'.$C36]);"";[$'03.Muestra'.$C36]) ->  | C88: of:=IF( ISBLANK([$'03.Muestra'.$E36]);"";[$'03.Muestra'.$E36]) ->  | D88: of:=IF( ISBLANK([$'P1.Perceptible'.D199]);"";[$'P1.Perceptible'.D199]) ->  | E88: of:=IF( ISBLANK([$'P1.Perceptible'.D237]);"";[$'P1.Perceptible'.D237]) ->  | F88: of:=IF( ISBLANK([$'P1.Perceptible'.D389]);"";[$'P1.Perceptible'.D389]) ->  | G88: of:=IF( ISBLANK([$'P1.Perceptible'.D427]);"";[$'P1.Perceptible'.D427]) ->  | H88: of:=IF( ISBLANK([$'P1.Perceptible'.D541]);"";[$'P1.Perceptible'.D541]) ->  | I88: of:=IF( ISBLANK([$'P1.Perceptible'.D579]);"";[$'P1.Perceptible'.D579]) ->  | J88: of:=IF( ISBLANK([$'P1.Perceptible'.D617]);"";[$'P1.Perceptible'.D617]) ->  | K88: of:=IF( ISBLANK([$'P1.Perceptible'.D655]);"";[$'P1.Perceptible'.D655]) ->  | L88: of:=IF( ISBLANK([$'P1.Perceptible'.D693]);"";[$'P1.Perceptible'.D693]) ->  | M88: of:=IF( ISBLANK([$'P1.Perceptible'.D731]);"";[$'P1.Perceptible'.D731]) ->  | N88: of:=IF( ISBLANK([$'P1.Perceptible'.D769]);"";[$'P1.Perceptible'.D769]) ->  | O88: of:=IF( ISBLANK([$'P2.Operable'.D427]);"";[$'P2.Operable'.D427]) ->  | P88: of:=IF( ISBLANK([$'P2.Operable'.D465]);"";[$'P2.Operable'.D465]) ->  | Q88: of:=IF( ISBLANK([$'P2.Operable'.D503]);"";[$'P2.Operable'.D503]) ->  | R88: of:=IF( ISBLANK([$'P3.Comprensible'.D85]);"";[$'P3.Comprensible'.D85]) ->  | S88: of:=IF( ISBLANK([$'P3.Comprensible'.D199]);"";[$'P3.Comprensible'.D199]) ->  | T88: of:=IF( ISBLANK([$'P3.Comprensible'.D237]);"";[$'P3.Comprensible'.D237]) ->  | U88: of:=IF( ISBLANK([$'P3.Comprensible'.D351]);"";[$'P3.Comprensible'.D351]) ->  | V88: of:=IF( ISBLANK([$'P3.Comprensible'.D389]);"";[$'P3.Comprensible'.D389]) ->  | W88: of:=IF(ISBLANK([$'P4.Robusto'.D123]);"";[$'P4.Robusto'.D123]) -> 
B89: of:=IF( ISBLANK([$'03.Muestra'.$C37]);"";[$'03.Muestra'.$C37]) ->  | C89: of:=IF( ISBLANK([$'03.Muestra'.$E37]);"";[$'03.Muestra'.$E37]) ->  | D89: of:=IF( ISBLANK([$'P1.Perceptible'.D200]);"";[$'P1.Perceptible'.D200]) ->  | E89: of:=IF( ISBLANK([$'P1.Perceptible'.D238]);"";[$'P1.Perceptible'.D238]) ->  | F89: of:=IF( ISBLANK([$'P1.Perceptible'.D390]);"";[$'P1.Perceptible'.D390]) ->  | G89: of:=IF( ISBLANK([$'P1.Perceptible'.D428]);"";[$'P1.Perceptible'.D428]) ->  | H89: of:=IF( ISBLANK([$'P1.Perceptible'.D542]);"";[$'P1.Perceptible'.D542]) ->  | I89: of:=IF( ISBLANK([$'P1.Perceptible'.D580]);"";[$'P1.Perceptible'.D580]) ->  | J89: of:=IF( ISBLANK([$'P1.Perceptible'.D618]);"";[$'P1.Perceptible'.D618]) ->  | K89: of:=IF( ISBLANK([$'P1.Perceptible'.D656]);"";[$'P1.Perceptible'.D656]) ->  | L89: of:=IF( ISBLANK([$'P1.Perceptible'.D694]);"";[$'P1.Perceptible'.D694]) ->  | M89: of:=IF( ISBLANK([$'P1.Perceptible'.D732]);"";[$'P1.Perceptible'.D732]) ->  | N89: of:=IF( ISBLANK([$'P1.Perceptible'.D770]);"";[$'P1.Perceptible'.D770]) ->  | O89: of:=IF( ISBLANK([$'P2.Operable'.D428]);"";[$'P2.Operable'.D428]) ->  | P89: of:=IF( ISBLANK([$'P2.Operable'.D466]);"";[$'P2.Operable'.D466]) ->  | Q89: of:=IF( ISBLANK([$'P2.Operable'.D504]);"";[$'P2.Operable'.D504]) ->  | R89: of:=IF( ISBLANK([$'P3.Comprensible'.D86]);"";[$'P3.Comprensible'.D86]) ->  | S89: of:=IF( ISBLANK([$'P3.Comprensible'.D200]);"";[$'P3.Comprensible'.D200]) ->  | T89: of:=IF( ISBLANK([$'P3.Comprensible'.D238]);"";[$'P3.Comprensible'.D238]) ->  | U89: of:=IF( ISBLANK([$'P3.Comprensible'.D352]);"";[$'P3.Comprensible'.D352]) ->  | V89: of:=IF( ISBLANK([$'P3.Comprensible'.D390]);"";[$'P3.Comprensible'.D390]) ->  | W89: of:=IF(ISBLANK([$'P4.Robusto'.D124]);"";[$'P4.Robusto'.D124]) -> 
B90: of:=IF( ISBLANK([$'03.Muestra'.$C38]);"";[$'03.Muestra'.$C38]) ->  | C90: of:=IF( ISBLANK([$'03.Muestra'.$E38]);"";[$'03.Muestra'.$E38]) ->  | D90: of:=IF( ISBLANK([$'P1.Perceptible'.D201]);"";[$'P1.Perceptible'.D201]) ->  | E90: of:=IF( ISBLANK([$'P1.Perceptible'.D239]);"";[$'P1.Perceptible'.D239]) ->  | F90: of:=IF( ISBLANK([$'P1.Perceptible'.D391]);"";[$'P1.Perceptible'.D391]) ->  | G90: of:=IF( ISBLANK([$'P1.Perceptible'.D429]);"";[$'P1.Perceptible'.D429]) ->  | H90: of:=IF( ISBLANK([$'P1.Perceptible'.D543]);"";[$'P1.Perceptible'.D543]) ->  | I90: of:=IF( ISBLANK([$'P1.Perceptible'.D581]);"";[$'P1.Perceptible'.D581]) ->  | J90: of:=IF( ISBLANK([$'P1.Perceptible'.D619]);"";[$'P1.Perceptible'.D619]) ->  | K90: of:=IF( ISBLANK([$'P1.Perceptible'.D657]);"";[$'P1.Perceptible'.D657]) ->  | L90: of:=IF( ISBLANK([$'P1.Perceptible'.D695]);"";[$'P1.Perceptible'.D695]) ->  | M90: of:=IF( ISBLANK([$'P1.Perceptible'.D733]);"";[$'P1.Perceptible'.D733]) ->  | N90: of:=IF( ISBLANK([$'P1.Perceptible'.D771]);"";[$'P1.Perceptible'.D771]) ->  | O90: of:=IF( ISBLANK([$'P2.Operable'.D429]);"";[$'P2.Operable'.D429]) ->  | P90: of:=IF( ISBLANK([$'P2.Operable'.D467]);"";[$'P2.Operable'.D467]) ->  | Q90: of:=IF( ISBLANK([$'P2.Operable'.D505]);"";[$'P2.Operable'.D505]) ->  | R90: of:=IF( ISBLANK([$'P3.Comprensible'.D87]);"";[$'P3.Comprensible'.D87]) ->  | S90: of:=IF( ISBLANK([$'P3.Comprensible'.D201]);"";[$'P3.Comprensible'.D201]) ->  | T90: of:=IF( ISBLANK([$'P3.Comprensible'.D239]);"";[$'P3.Comprensible'.D239]) ->  | U90: of:=IF( ISBLANK([$'P3.Comprensible'.D353]);"";[$'P3.Comprensible'.D353]) ->  | V90: of:=IF( ISBLANK([$'P3.Comprensible'.D391]);"";[$'P3.Comprensible'.D391]) ->  | W90: of:=IF(ISBLANK([$'P4.Robusto'.D125]);"";[$'P4.Robusto'.D125]) -> 
B91: of:=IF( ISBLANK([$'03.Muestra'.$C39]);"";[$'03.Muestra'.$C39]) ->  | C91: of:=IF( ISBLANK([$'03.Muestra'.$E39]);"";[$'03.Muestra'.$E39]) ->  | D91: of:=IF( ISBLANK([$'P1.Perceptible'.D202]);"";[$'P1.Perceptible'.D202]) ->  | E91: of:=IF( ISBLANK([$'P1.Perceptible'.D240]);"";[$'P1.Perceptible'.D240]) ->  | F91: of:=IF( ISBLANK([$'P1.Perceptible'.D392]);"";[$'P1.Perceptible'.D392]) ->  | G91: of:=IF( ISBLANK([$'P1.Perceptible'.D430]);"";[$'P1.Perceptible'.D430]) ->  | H91: of:=IF( ISBLANK([$'P1.Perceptible'.D544]);"";[$'P1.Perceptible'.D544]) ->  | I91: of:=IF( ISBLANK([$'P1.Perceptible'.D582]);"";[$'P1.Perceptible'.D582]) ->  | J91: of:=IF( ISBLANK([$'P1.Perceptible'.D620]);"";[$'P1.Perceptible'.D620]) ->  | K91: of:=IF( ISBLANK([$'P1.Perceptible'.D658]);"";[$'P1.Perceptible'.D658]) ->  | L91: of:=IF( ISBLANK([$'P1.Perceptible'.D696]);"";[$'P1.Perceptible'.D696]) ->  | M91: of:=IF( ISBLANK([$'P1.Perceptible'.D734]);"";[$'P1.Perceptible'.D734]) ->  | N91: of:=IF( ISBLANK([$'P1.Perceptible'.D772]);"";[$'P1.Perceptible'.D772]) ->  | O91: of:=IF( ISBLANK([$'P2.Operable'.D430]);"";[$'P2.Operable'.D430]) ->  | P91: of:=IF( ISBLANK([$'P2.Operable'.D468]);"";[$'P2.Operable'.D468]) ->  | Q91: of:=IF( ISBLANK([$'P2.Operable'.D506]);"";[$'P2.Operable'.D506]) ->  | R91: of:=IF( ISBLANK([$'P3.Comprensible'.D88]);"";[$'P3.Comprensible'.D88]) ->  | S91: of:=IF( ISBLANK([$'P3.Comprensible'.D202]);"";[$'P3.Comprensible'.D202]) ->  | T91: of:=IF( ISBLANK([$'P3.Comprensible'.D240]);"";[$'P3.Comprensible'.D240]) ->  | U91: of:=IF( ISBLANK([$'P3.Comprensible'.D354]);"";[$'P3.Comprensible'.D354]) ->  | V91: of:=IF( ISBLANK([$'P3.Comprensible'.D392]);"";[$'P3.Comprensible'.D392]) ->  | W91: of:=IF(ISBLANK([$'P4.Robusto'.D126]);"";[$'P4.Robusto'.D126]) -> 
B92: of:=IF( ISBLANK([$'03.Muestra'.$C40]);"";[$'03.Muestra'.$C40]) ->  | C92: of:=IF( ISBLANK([$'03.Muestra'.$E40]);"";[$'03.Muestra'.$E40]) ->  | D92: of:=IF( ISBLANK([$'P1.Perceptible'.D203]);"";[$'P1.Perceptible'.D203]) ->  | E92: of:=IF( ISBLANK([$'P1.Perceptible'.D241]);"";[$'P1.Perceptible'.D241]) ->  | F92: of:=IF( ISBLANK([$'P1.Perceptible'.D393]);"";[$'P1.Perceptible'.D393]) ->  | G92: of:=IF( ISBLANK([$'P1.Perceptible'.D431]);"";[$'P1.Perceptible'.D431]) ->  | H92: of:=IF( ISBLANK([$'P1.Perceptible'.D545]);"";[$'P1.Perceptible'.D545]) ->  | I92: of:=IF( ISBLANK([$'P1.Perceptible'.D583]);"";[$'P1.Perceptible'.D583]) ->  | J92: of:=IF( ISBLANK([$'P1.Perceptible'.D621]);"";[$'P1.Perceptible'.D621]) ->  | K92: of:=IF( ISBLANK([$'P1.Perceptible'.D659]);"";[$'P1.Perceptible'.D659]) ->  | L92: of:=IF( ISBLANK([$'P1.Perceptible'.D697]);"";[$'P1.Perceptible'.D697]) ->  | M92: of:=IF( ISBLANK([$'P1.Perceptible'.D735]);"";[$'P1.Perceptible'.D735]) ->  | N92: of:=IF( ISBLANK([$'P1.Perceptible'.D773]);"";[$'P1.Perceptible'.D773]) ->  | O92: of:=IF( ISBLANK([$'P2.Operable'.D431]);"";[$'P2.Operable'.D431]) ->  | P92: of:=IF( ISBLANK([$'P2.Operable'.D469]);"";[$'P2.Operable'.D469]) ->  | Q92: of:=IF( ISBLANK([$'P2.Operable'.D507]);"";[$'P2.Operable'.D507]) ->  | R92: of:=IF( ISBLANK([$'P3.Comprensible'.D89]);"";[$'P3.Comprensible'.D89]) ->  | S92: of:=IF( ISBLANK([$'P3.Comprensible'.D203]);"";[$'P3.Comprensible'.D203]) ->  | T92: of:=IF( ISBLANK([$'P3.Comprensible'.D241]);"";[$'P3.Comprensible'.D241]) ->  | U92: of:=IF( ISBLANK([$'P3.Comprensible'.D355]);"";[$'P3.Comprensible'.D355]) ->  | V92: of:=IF( ISBLANK([$'P3.Comprensible'.D393]);"";[$'P3.Comprensible'.D393]) ->  | W92: of:=IF(ISBLANK([$'P4.Robusto'.D127]);"";[$'P4.Robusto'.D127]) -> 
B93: of:=IF( ISBLANK([$'03.Muestra'.$C41]);"";[$'03.Muestra'.$C41]) ->  | C93: of:=IF( ISBLANK([$'03.Muestra'.$E41]);"";[$'03.Muestra'.$E41]) ->  | D93: of:=IF( ISBLANK([$'P1.Perceptible'.D204]);"";[$'P1.Perceptible'.D204]) ->  | E93: of:=IF( ISBLANK([$'P1.Perceptible'.D242]);"";[$'P1.Perceptible'.D242]) ->  | F93: of:=IF( ISBLANK([$'P1.Perceptible'.D394]);"";[$'P1.Perceptible'.D394]) ->  | G93: of:=IF( ISBLANK([$'P1.Perceptible'.D432]);"";[$'P1.Perceptible'.D432]) ->  | H93: of:=IF( ISBLANK([$'P1.Perceptible'.D546]);"";[$'P1.Perceptible'.D546]) ->  | I93: of:=IF( ISBLANK([$'P1.Perceptible'.D584]);"";[$'P1.Perceptible'.D584]) ->  | J93: of:=IF( ISBLANK([$'P1.Perceptible'.D622]);"";[$'P1.Perceptible'.D622]) ->  | K93: of:=IF( ISBLANK([$'P1.Perceptible'.D660]);"";[$'P1.Perceptible'.D660]) ->  | L93: of:=IF( ISBLANK([$'P1.Perceptible'.D698]);"";[$'P1.Perceptible'.D698]) ->  | M93: of:=IF( ISBLANK([$'P1.Perceptible'.D736]);"";[$'P1.Perceptible'.D736]) ->  | N93: of:=IF( ISBLANK([$'P1.Perceptible'.D774]);"";[$'P1.Perceptible'.D774]) ->  | O93: of:=IF( ISBLANK([$'P2.Operable'.D432]);"";[$'P2.Operable'.D432]) ->  | P93: of:=IF( ISBLANK([$'P2.Operable'.D470]);"";[$'P2.Operable'.D470]) ->  | Q93: of:=IF( ISBLANK([$'P2.Operable'.D508]);"";[$'P2.Operable'.D508]) ->  | R93: of:=IF( ISBLANK([$'P3.Comprensible'.D90]);"";[$'P3.Comprensible'.D90]) ->  | S93: of:=IF( ISBLANK([$'P3.Comprensible'.D204]);"";[$'P3.Comprensible'.D204]) ->  | T93: of:=IF( ISBLANK([$'P3.Comprensible'.D242]);"";[$'P3.Comprensible'.D242]) ->  | U93: of:=IF( ISBLANK([$'P3.Comprensible'.D356]);"";[$'P3.Comprensible'.D356]) ->  | V93: of:=IF( ISBLANK([$'P3.Comprensible'.D394]);"";[$'P3.Comprensible'.D394]) ->  | W93: of:=IF(ISBLANK([$'P4.Robusto'.D128]);"";[$'P4.Robusto'.D128]) -> 
B94: of:=IF( ISBLANK([$'03.Muestra'.$C42]);"";[$'03.Muestra'.$C42]) ->  | C94: of:=IF( ISBLANK([$'03.Muestra'.$E42]);"";[$'03.Muestra'.$E42]) ->  | D94: of:=IF( ISBLANK([$'P1.Perceptible'.D205]);"";[$'P1.Perceptible'.D205]) ->  | E94: of:=IF( ISBLANK([$'P1.Perceptible'.D243]);"";[$'P1.Perceptible'.D243]) ->  | F94: of:=IF( ISBLANK([$'P1.Perceptible'.D395]);"";[$'P1.Perceptible'.D395]) ->  | G94: of:=IF( ISBLANK([$'P1.Perceptible'.D433]);"";[$'P1.Perceptible'.D433]) ->  | H94: of:=IF( ISBLANK([$'P1.Perceptible'.D547]);"";[$'P1.Perceptible'.D547]) ->  | I94: of:=IF( ISBLANK([$'P1.Perceptible'.D585]);"";[$'P1.Perceptible'.D585]) ->  | J94: of:=IF( ISBLANK([$'P1.Perceptible'.D623]);"";[$'P1.Perceptible'.D623]) ->  | K94: of:=IF( ISBLANK([$'P1.Perceptible'.D661]);"";[$'P1.Perceptible'.D661]) ->  | L94: of:=IF( ISBLANK([$'P1.Perceptible'.D699]);"";[$'P1.Perceptible'.D699]) ->  | M94: of:=IF( ISBLANK([$'P1.Perceptible'.D737]);"";[$'P1.Perceptible'.D737]) ->  | N94: of:=IF( ISBLANK([$'P1.Perceptible'.D775]);"";[$'P1.Perceptible'.D775]) ->  | O94: of:=IF( ISBLANK([$'P2.Operable'.D433]);"";[$'P2.Operable'.D433]) ->  | P94: of:=IF( ISBLANK([$'P2.Operable'.D471]);"";[$'P2.Operable'.D471]) ->  | Q94: of:=IF( ISBLANK([$'P2.Operable'.D509]);"";[$'P2.Operable'.D509]) ->  | R94: of:=IF( ISBLANK([$'P3.Comprensible'.D91]);"";[$'P3.Comprensible'.D91]) ->  | S94: of:=IF( ISBLANK([$'P3.Comprensible'.D205]);"";[$'P3.Comprensible'.D205]) ->  | T94: of:=IF( ISBLANK([$'P3.Comprensible'.D243]);"";[$'P3.Comprensible'.D243]) ->  | U94: of:=IF( ISBLANK([$'P3.Comprensible'.D357]);"";[$'P3.Comprensible'.D357]) ->  | V94: of:=IF( ISBLANK([$'P3.Comprensible'.D395]);"";[$'P3.Comprensible'.D395]) ->  | W94: of:=IF(ISBLANK([$'P4.Robusto'.D129]);"";[$'P4.Robusto'.D129]) -> 
C95: SITIO WEB | D95: of:=IF(COUNTIF([.$C60:.$C94]; "<>")=0;""; IF (COUNTIF([$'P1.Perceptible'.$E171:$'P1.Perceptible'.$E205];"ERR")>0;"ERROR";      IF(COUNTIF([.D60:.D94];"N/T")>0 ; "EN CURSO";         IF (COUNTIF([.D60:.D94];"N/D") > 0;"EN CURSO";              IF (COUNTIF([.$C$60:.$C$94]; "<>") <> COUNTIF([.D60:.D94];"<>");"EN CURSO" ;  IF(COUNTIF([.$C$60:.$C$94]; "<>") = COUNTIF([.D60:.D94];"N/A"); "N/A";                   IF(COUNTIF([.D60:.D94];"Falla")>([$'DATA - Oculta'.$C$25]*((COUNTIF([.D60:.D94];"Pasa")+COUNTIF([.D60:.D94];"Falla"))));                 "NO CONFORME";"CONFORME"))))))) ->  | E95: of:=IF(COUNTIF([.$C60:.$C94]; "<>")=0;""; IF (COUNTIF([$'P1.Perceptible'.$E209:$'P1.Perceptible'.$E243];"ERR")>0;"ERROR";      IF(COUNTIF([.E60:.E94];"N/T")>0 ; "EN CURSO";         IF (COUNTIF([.E60:.E94];"N/D") > 0;"EN CURSO";              IF (COUNTIF([.$C$60:.$C$94]; "<>") <> COUNTIF([.E60:.E94];"<>");"EN CURSO" ;  IF(COUNTIF([.$C$60:.$C$94]; "<>") = COUNTIF([.E60:.E94];"N/A"); "N/A";                   IF(COUNTIF([.E60:.E94];"Falla")>([$'DATA - Oculta'.$C$25]*((COUNTIF([.E60:.E94];"Pasa")+COUNTIF([.E60:.E94];"Falla"))));                 "NO CONFORME";"CONFORME"))))))) ->  | F95: of:=IF(COUNTIF([.$C60:.$C94]; "<>")=0;""; IF (COUNTIF([$'P1.Perceptible'.$E361:$'P1.Perceptible'.$E395];"ERR")>0;"ERROR";      IF(COUNTIF([.F60:.F94];"N/T")>0 ; "EN CURSO";         IF (COUNTIF([.F60:.F94];"N/D") > 0;"EN CURSO";              IF (COUNTIF([.$C$60:.$C$94]; "<>") <> COUNTIF([.F60:.F94];"<>");"EN CURSO" ;  IF(COUNTIF([.$C$60:.$C$94]; "<>") = COUNTIF([.F60:.F94];"N/A"); "N/A";                   IF(COUNTIF([.F60:.F94];"Falla")>([$'DATA - Oculta'.$C$25]*((COUNTIF([.F60:.F94];"Pasa")+COUNTIF([.F60:.F94];"Falla"))));                 "NO CONFORME";"CONFORME"))))))) ->  | G95: of:=IF(COUNTIF([.$C60:.$C94]; "<>")=0;""; IF (COUNTIF([$'P1.Perceptible'.$E399:$'P1.Perceptible'.$E433];"ERR")>0;"ERROR";      IF(COUNTIF([.G60:.G94];"N/T")>0 ; "EN CURSO";         IF (COUNTIF([.G60:.G94];"N/D") > 0;"EN CURSO";              IF (COUNTIF([.$C$60:.$C$94]; "<>") <> COUNTIF([.G60:.G94];"<>");"EN CURSO" ;  IF(COUNTIF([.$C$60:.$C$94]; "<>") = COUNTIF([.G60:.G94];"N/A"); "N/A";                   IF(COUNTIF([.G60:.G94];"Falla")>([$'DATA - Oculta'.$C$25]*((COUNTIF([.G60:.G94];"Pasa")+COUNTIF([.G60:.G94];"Falla"))));                 "NO CONFORME";"CONFORME"))))))) ->  | H95: of:=IF(COUNTIF([.$C60:.$C94]; "<>")=0;""; IF (COUNTIF([$'P1.Perceptible'.$E513:$'P1.Perceptible'.$E547];"ERR")>0;"ERROR";      IF(COUNTIF([.H60:.H94];"N/T")>0 ; "EN CURSO";         IF (COUNTIF([.H60:.H94];"N/D") > 0;"EN CURSO";              IF (COUNTIF([.$C$60:.$C$94]; "<>") <> COUNTIF([.H60:.H94];"<>");"EN CURSO" ;  IF(COUNTIF([.$C$60:.$C$94]; "<>") = COUNTIF([.H60:.H94];"N/A"); "N/A";                   IF(COUNTIF([.H60:.H94];"Falla")>([$'DATA - Oculta'.$C$25]*((COUNTIF([.H60:.H94];"Pasa")+COUNTIF([.H60:.H94];"Falla"))));                 "NO CONFORME";"CONFORME"))))))) ->  | I95: of:=IF(COUNTIF([.$C60:.$C94]; "<>")=0;""; IF (COUNTIF([$'P1.Perceptible'.$E551:$'P1.Perceptible'.$E585];"ERR")>0;"ERROR";      IF(COUNTIF([.I60:.I94];"N/T")>0 ; "EN CURSO";         IF (COUNTIF([.I60:.I94];"N/D") > 0;"EN CURSO";              IF (COUNTIF([.$C$60:.$C$94]; "<>") <> COUNTIF([.I60:.I94];"<>");"EN CURSO" ;  IF(COUNTIF([.$C$60:.$C$94]; "<>") = COUNTIF([.I60:.I94];"N/A"); "N/A";                   IF(COUNTIF([.I60:.I94];"Falla")>([$'DATA - Oculta'.$C$25]*((COUNTIF([.I60:.I94];"Pasa")+COUNTIF([.I60:.I94];"Falla"))));                 "NO CONFORME";"CONFORME"))))))) ->  | J95: of:=IF(COUNTIF([.$C60:.$C94]; "<>")=0;""; IF (COUNTIF([$'P1.Perceptible'.$E589:$'P1.Perceptible'.$E623];"ERR")>0;"ERROR";      IF(COUNTIF([.J60:.J94];"N/T")>0 ; "EN CURSO";         IF (COUNTIF([.J60:.J94];"N/D") > 0;"EN CURSO";              IF (COUNTIF([.$C$60:.$C$94]; "<>") <> COUNTIF([.J60:.J94];"<>");"EN CURSO" ;  IF(COUNTIF([.$C$60:.$C$94]; "<>") = COUNTIF([.J60:.J94];"N/A"); "N/A";                   IF(COUNTIF([.J60:.J94];"Falla")>([$'DATA - Oculta'.$C$25]*((COUNTIF([.J60:.J94];"Pasa")+COUNTIF([.J60:.J94];"Falla"))));                 "NO CONFORME";"CONFORME"))))))) ->  | K95: of:=IF(COUNTIF([.$C60:.$C94]; "<>")=0;""; IF (COUNTIF([$'P1.Perceptible'.$E627:$'P1.Perceptible'.$E661];"ERR")>0;"ERROR";      IF(COUNTIF([.K60:.K94];"N/T")>0 ; "EN CURSO";         IF (COUNTIF([.K60:.K94];"N/D") > 0;"EN CURSO";              IF (COUNTIF([.$C$60:.$C$94]; "<>") <> COUNTIF([.K60:.K94];"<>");"EN CURSO" ;  IF(COUNTIF([.$C$60:.$C$94]; "<>") = COUNTIF([.K60:.K94];"N/A"); "N/A";                   IF(COUNTIF([.K60:.K94];"Falla")>([$'DATA - Oculta'.$C$25]*((COUNTIF([.K60:.K94];"Pasa")+COUNTIF([.K60:.K94];"Falla"))));                 "NO CONFORME";"CONFORME"))))))) ->  | L95: of:=IF(COUNTIF([.$C60:.$C94]; "<>")=0;""; IF (COUNTIF([$'P1.Perceptible'.$E665:$'P1.Perceptible'.$E699];"ERR")>0;"ERROR";      IF(COUNTIF([.L60:.L94];"N/T")>0 ; "EN CURSO";         IF (COUNTIF([.L60:.L94];"N/D") > 0;"EN CURSO";              IF (COUNTIF([.$C$60:.$C$94]; "<>") <> COUNTIF([.L60:.L94];"<>");"EN CURSO" ;  IF(COUNTIF([.$C$60:.$C$94]; "<>") = COUNTIF([.L60:.L94];"N/A"); "N/A";                   IF(COUNTIF([.L60:.L94];"Falla")>([$'DATA - Oculta'.$C$25]*((COUNTIF([.L60:.L94];"Pasa")+COUNTIF([.L60:.L94];"Falla"))));                 "NO CONFORME";"CONFORME"))))))) ->  | M95: of:=IF(COUNTIF([.$C60:.$C94]; "<>")=0;""; IF (COUNTIF([$'P1.Perceptible'.$E703:$'P1.Perceptible'.$E737];"ERR")>0;"ERROR";      IF(COUNTIF([.M60:.M94];"N/T")>0 ; "EN CURSO";         IF (COUNTIF([.M60:.M94];"N/D") > 0;"EN CURSO";              IF (COUNTIF([.$C$60:.$C$94]; "<>") <> COUNTIF([.M60:.M94];"<>");"EN CURSO" ;  IF(COUNTIF([.$C$60:.$C$94]; "<>") = COUNTIF([.M60:.M94];"N/A"); "N/A";                   IF(COUNTIF([.M60:.M94];"Falla")>([$'DATA - Oculta'.$C$25]*((COUNTIF([.M60:.M94];"Pasa")+COUNTIF([.M60:.M94];"Falla"))));                 "NO CONFORME";"CONFORME"))))))) ->  | N95: of:=IF(COUNTIF([.$C60:.$C94]; "<>")=0;""; IF (COUNTIF([$'P1.Perceptible'.$E741:$'P1.Perceptible'.$E775];"ERR")>0;"ERROR";      IF(COUNTIF([.N60:.N94];"N/T")>0 ; "EN CURSO";         IF (COUNTIF([.N60:.N94];"N/D") > 0;"EN CURSO";              IF (COUNTIF([.$C$60:.$C$94]; "<>") <> COUNTIF([.N60:.N94];"<>");"EN CURSO" ;  IF(COUNTIF([.$C$60:.$C$94]; "<>") = COUNTIF([.N60:.N94];"N/A"); "N/A";                   IF(COUNTIF([.N60:.N94];"Falla")>([$'DATA - Oculta'.$C$25]*((COUNTIF([.N60:.N94];"Pasa")+COUNTIF([.N60:.N94];"Falla"))));                 "NO CONFORME";"CONFORME"))))))) ->  | O95: of:=IF(COUNTIF([.$C60:.$C94]; "<>")=0;""; IF (COUNTIF([$'P2.Operable'.$E399:$'P2.Operable'.$E433];"ERR")>0;"ERROR";      IF(COUNTIF([.O60:.O94];"N/T")>0 ; "EN CURSO";         IF (COUNTIF([.O60:.O94];"N/D") > 0;"EN CURSO";              IF (COUNTIF([.$C$60:.$C$94]; "<>") <> COUNTIF([.O60:.O94];"<>");"EN CURSO" ;  IF(COUNTIF([.$C$60:.$C$94]; "<>") = COUNTIF([.O60:.O94];"N/A"); "N/A";                   IF(COUNTIF([.O60:.O94];"Falla")>([$'DATA - Oculta'.$C$25]*((COUNTIF([.O60:.O94];"Pasa")+COUNTIF([.O60:.O94];"Falla"))));                 "NO CONFORME";"CONFORME"))))))) ->  | P95: of:=IF(COUNTIF([.$C60:.$C94]; "<>")=0;""; IF (COUNTIF([$'P2.Operable'.$E437:$'P2.Operable'.$E471];"ERR")>0;"ERROR";      IF(COUNTIF([.P60:.P94];"N/T")>0 ; "EN CURSO";         IF (COUNTIF([.P60:.P94];"N/D") > 0;"EN CURSO";              IF (COUNTIF([.$C$60:.$C$94]; "<>") <> COUNTIF([.P60:.P94];"<>");"EN CURSO" ;  IF(COUNTIF([.$C$60:.$C$94]; "<>") = COUNTIF([.P60:.P94];"N/A"); "N/A";                   IF(COUNTIF([.P60:.P94];"Falla")>([$'DATA - Oculta'.$C$25]*((COUNTIF([.P60:.P94];"Pasa")+COUNTIF([.P60:.P94];"Falla"))));                 "NO CONFORME";"CONFORME"))))))) ->  | Q95: of:=IF(COUNTIF([.$C60:.$C94]; "<>")=0;""; IF (COUNTIF([$'P2.Operable'.$E475:$'P2.Operable'.$E509];"ERR")>0;"ERROR";      IF(COUNTIF([.Q60:.Q94];"N/T")>0 ; "EN CURSO";         IF (COUNTIF([.Q60:.Q94];"N/D") > 0;"EN CURSO";              IF (COUNTIF([.$C$60:.$C$94]; "<>") <> COUNTIF([.Q60:.Q94];"<>");"EN CURSO" ;  IF(COUNTIF([.$C$60:.$C$94]; "<>") = COUNTIF([.Q60:.Q94];"N/A"); "N/A";                   IF(COUNTIF([.Q60:.Q94];"Falla")>([$'DATA - Oculta'.$C$25]*((COUNTIF([.Q60:.Q94];"Pasa")+COUNTIF([.Q60:.Q94];"Falla"))));                 "NO CONFORME";"CONFORME"))))))) ->  | R95: of:=IF(COUNTIF([.$C60:.$C94]; "<>")=0;""; IF (COUNTIF([$'P3.Comprensible'.$E57:$'P3.Comprensible'.$E91];"ERR")>0;"ERROR";      IF(COUNTIF([.R60:.R94];"N/T")>0 ; "EN CURSO";         IF (COUNTIF([.R60:.R94];"N/D") > 0;"EN CURSO";              IF (COUNTIF([.$C$60:.$C$94]; "<>") <> COUNTIF([.R60:.R94];"<>");"EN CURSO" ;  IF(COUNTIF([.$C$60:.$C$94]; "<>") = COUNTIF([.R60:.R94];"N/A"); "N/A";                   IF(COUNTIF([.R60:.R94];"Falla")>([$'DATA - Oculta'.$C$25]*((COUNTIF([.R60:.R94];"Pasa")+COUNTIF([.R60:.R94];"Falla"))));                 "NO CONFORME";"CONFORME"))))))) ->  | S95: of:=IF(COUNTIF([.$C60:.$C94]; "<>")=0;""; IF (COUNTIF([$'P3.Comprensible'.$E171:$'P3.Comprensible'.$E205];"ERR")>0;"ERROR";      IF(COUNTIF([.S60:.S94];"N/T")>0 ; "EN CURSO";         IF (COUNTIF([.S60:.S94];"N/D") > 0;"EN CURSO";              IF (COUNTIF([.$C$60:.$C$94]; "<>") <> COUNTIF([.S60:.S94];"<>");"EN CURSO" ;  IF(COUNTIF([.$C$60:.$C$94]; "<>") = COUNTIF([.S60:.S94];"N/A"); "N/A";                   IF(COUNTIF([.S60:.S94];"Falla")>([$'DATA - Oculta'.$C$25]*((COUNTIF([.S60:.S94];"Pasa")+COUNTIF([.S60:.S94];"Falla"))));                 "NO CONFORME";"CONFORME"))))))) ->  | T95: of:=IF(COUNTIF([.$C60:.$C94]; "<>")=0;""; IF (COUNTIF([$'P3.Comprensible'.$E209:$'P3.Comprensible'.$E243];"ERR")>0;"ERROR";      IF(COUNTIF([.T60:.T94];"N/T")>0 ; "EN CURSO";         IF (COUNTIF([.T60:.T94];"N/D") > 0;"EN CURSO";              IF (COUNTIF([.$C$60:.$C$94]; "<>") <> COUNTIF([.T60:.T94];"<>");"EN CURSO" ;  IF(COUNTIF([.$C$60:.$C$94]; "<>") = COUNTIF([.T60:.T94];"N/A"); "N/A";                   IF(COUNTIF([.T60:.T94];"Falla")>([$'DATA - Oculta'.$C$25]*((COUNTIF([.T60:.T94];"Pasa")+COUNTIF([.T60:.T94];"Falla"))));                 "NO CONFORME";"CONFORME"))))))) ->  | U95: of:=IF(COUNTIF([.$C60:.$C94]; "<>")=0;""; IF (COUNTIF([$'P3.Comprensible'.$E323:$'P3.Comprensible'.$E357];"ERR")>0;"ERROR";      IF(COUNTIF([.U60:.U94];"N/T")>0 ; "EN CURSO";         IF (COUNTIF([.U60:.U94];"N/D") > 0;"EN CURSO";              IF (COUNTIF([.$C$60:.$C$94]; "<>") <> COUNTIF([.U60:.U94];"<>");"EN CURSO" ;  IF(COUNTIF([.$C$60:.$C$94]; "<>") = COUNTIF([.U60:.U94];"N/A"); "N/A";                   IF(COUNTIF([.U60:.U94];"Falla")>([$'DATA - Oculta'.$C$25]*((COUNTIF([.U60:.U94];"Pasa")+COUNTIF([.U60:.U94];"Falla"))));                 "NO CONFORME";"CONFORME"))))))) ->  | V95: of:=IF(COUNTIF([.$C60:.$C94]; "<>")=0;""; IF (COUNTIF([$'P3.Comprensible'.$E361:$'P3.Comprensible'.$E395];"ERR")>0;"ERROR";      IF(COUNTIF([.V60:.V94];"N/T")>0 ; "EN CURSO";         IF (COUNTIF([.V60:.V94];"N/D") > 0;"EN CURSO";              IF (COUNTIF([.$C$60:.$C$94]; "<>") <> COUNTIF([.V60:.V94];"<>");"EN CURSO" ;  IF(COUNTIF([.$C$60:.$C$94]; "<>") = COUNTIF([.V60:.V94];"N/A"); "N/A";                   IF(COUNTIF([.V60:.V94];"Falla")>([$'DATA - Oculta'.$C$25]*((COUNTIF([.V60:.V94];"Pasa")+COUNTIF([.V60:.V94];"Falla"))));                 "NO CONFORME";"CONFORME"))))))) ->  | W95: of:=IF(COUNTIF([.$C60:.$C94]; "<>")=0;""; IF (COUNTIF([$'P4.Robusto'.$E95:$'P4.Robusto'.$E129];"ERR")>0;"ERROR";      IF(COUNTIF([.W60:.W94];"N/T")>0 ; "EN CURSO";         IF (COUNTIF([.W60:.W94];"N/D") > 0;"EN CURSO";              IF (COUNTIF([.$C$60:.$C$94]; "<>") <> COUNTIF([.W60:.W94];"<>");"EN CURSO" ;  IF(COUNTIF([.$C$60:.$C$94]; "<>") = COUNTIF([.W60:.W94];"N/A"); "N/A";                   IF(COUNTIF([.W60:.W94];"Falla")>([$'DATA - Oculta'.$C$25]*((COUNTIF([.W60:.W94];"Pasa")+COUNTIF([.W60:.W94];"Falla"))));                 "NO CONFORME";"CONFORME"))))))) -> 

Sheet: DATA - Oculta
C7: Ambito geográfico | E7: Ambito temático | G7: Tipo de evaluación | I7: Nivel compliance | K7: V/F | M7: V/F | O7: Tipos de página | Q7: Tipo de sitio | S7: Tipo de sitio web | U7: Resultado
C9: AGE | E9: Educación | G9: Autoevaluacion con recursos propios | I9: A WCAG2.1 | K9: Sí | M9: Fija | O9: Página inicio | Q9: Sitio web | S9: Mayoritariamente estático | U9: N/T | V9: NT
C10: CCAA | E10: Empleo | G10: Autoevaluación con recursos externos | I10: AA WCAG 2.1 | K10: No | M10: Aleatoria | O10: Inicio de sesión | Q10: Aplicación móvil | S10: Servicio electrónico | U10: N/D | V10: N/D
C11: EELL | E11: Hacienda | G11: Inspección acreditada por ENAC | O11: Mapa web | U11: N/A | V11: N/A
C12: Otros | E12: Medio ambiente | O12: Contacto | U12: Falla | V12: Falla
E13: Ocio y cultura | O13: Ayuda | U13: Pasa | V13: Pasa
E14: Protección social | O14: Legal
E15: Sanidad | O15: Servicio / Proceso
E16: Seguridad orden público | O16: Búsqueda
E17: Servicios comunitarios | O17: Declaración accesibilidad
E18: Transporte | O18: Mecanismo de comunicación
E19: Vivienda | O19: Pagina tipo
O20: Otras páginas
O21: Documento descargable
O22: Aleatoria
B23: PARÁMETROS DE CONTEO
B25: Porcentaje fallos por criterio para OK | C25: 0.1
B26: Límite para Situación Cumplimiento = No Conforme | C26: 0.5
B27: Límite para Situación Cumplimiento = Plenamente Conforme | C27: 1
B30: CÁLCULOS INTERMEDIOS
B32: Columnas A | C32: 30
B33: Columnas AA | C33: 20

Sheet: Para BD+DWH - Oculta
A1: of:=[$RESULTADOS.B17] -> 0 | B1: of:=[$RESULTADOS.C17] -> A | C1: of:=[$RESULTADOS.D17] -> 0 | D1: of:=[$RESULTADOS.E17] -> 0 | E1: of:=[$RESULTADOS.F17] -> 0 | F1: of:=[$RESULTADOS.G17] -> 0 | G1: of:=[$RESULTADOS.H17] -> 0 | H1: of:=[$RESULTADOS.I17] -> 0 | I1: of:=[$RESULTADOS.J17] -> 0 | J1: of:=[$RESULTADOS.K17] -> 0 | K1: of:=[$RESULTADOS.L17] -> 0 | L1: of:=[$RESULTADOS.M17] -> 0 | M1: of:=[$RESULTADOS.N17] -> 0 | N1: of:=[$RESULTADOS.O17] -> 0 | O1: of:=[$RESULTADOS.P17] -> 0 | P1: of:=[$RESULTADOS.Q17] -> 0 | Q1: of:=[$RESULTADOS.R17] -> 0 | R1: of:=[$RESULTADOS.S17] -> 0 | S1: of:=[$RESULTADOS.T17] -> 0 | T1: of:=[$RESULTADOS.U17] -> 0 | U1: of:=[$RESULTADOS.V17] -> 0 | V1: of:=[$RESULTADOS.W17] -> 0 | W1: of:=[$RESULTADOS.X17] -> 0 | X1: of:=[$RESULTADOS.Y17] -> 0 | Y1: of:=[$RESULTADOS.Z17] -> 0 | Z1: of:=[$RESULTADOS.AA17] -> 0 | AA1: of:=[$RESULTADOS.AB17] -> 0 | AB1: of:=[$RESULTADOS.AC17] -> 0 | AC1: of:=[$RESULTADOS.AD17] -> 0 | AD1: of:=[$RESULTADOS.AE17] -> 0 | AE1: of:=[$RESULTADOS.AF17] -> 0 | AF1: of:=[$RESULTADOS.AG17] -> 0 | AG1: of:=[$RESULTADOS.AH17] -> 0 | AI1: of:=[$RESULTADOS.B58] -> 0 | AJ1: of:=[$RESULTADOS.C58] -> AA | AK1: of:=[$RESULTADOS.D58] -> 0 | AL1: of:=[$RESULTADOS.E58] -> 0 | AM1: of:=[$RESULTADOS.F58] -> 0 | AN1: of:=[$RESULTADOS.G58] -> 0 | AO1: of:=[$RESULTADOS.H58] -> 0 | AP1: of:=[$RESULTADOS.I58] -> 0 | AQ1: of:=[$RESULTADOS.J58] -> 0 | AR1: of:=[$RESULTADOS.K58] -> 0 | AS1: of:=[$RESULTADOS.L58] -> 0 | AT1: of:=[$RESULTADOS.M58] -> 0 | AU1: of:=[$RESULTADOS.N58] -> 0 | AV1: of:=[$RESULTADOS.O58] -> 0 | AW1: of:=[$RESULTADOS.P58] -> 0 | AX1: of:=[$RESULTADOS.Q58] -> 0 | AY1: of:=[$RESULTADOS.R58] -> 0 | AZ1: of:=[$RESULTADOS.S58] -> 0 | BA1: of:=[$RESULTADOS.T58] -> 0 | BB1: of:=[$RESULTADOS.U58] -> 0 | BC1: of:=[$RESULTADOS.V58] -> 0 | BD1: of:=[$RESULTADOS.W58] -> 0 | BE1: of:=[$RESULTADOS.X58] -> 0
A2: of:=[$RESULTADOS.B18] -> 0 | B2: of:=[$RESULTADOS.C18] -> Muestra | C2: of:=[$RESULTADOS.D18] -> 1.1.1 | D2: of:=[$RESULTADOS.E18] -> 1.2.1 | E2: of:=[$RESULTADOS.F18] -> 1.2.2 | F2: of:=[$RESULTADOS.G18] -> 1.2.3 | G2: of:=[$RESULTADOS.H18] -> 1.3.1 | H2: of:=[$RESULTADOS.I18] -> 1.3.2 | I2: of:=[$RESULTADOS.J18] -> 1.3.3 | J2: of:=[$RESULTADOS.K18] -> 1.4.1 | K2: of:=[$RESULTADOS.L18] -> 1.4.2 | L2: of:=[$RESULTADOS.M18] -> 2.1.1 | M2: of:=[$RESULTADOS.N18] -> 2.1.2 | N2: of:=[$RESULTADOS.O18] -> 2.1.4 | O2: of:=[$RESULTADOS.P18] -> 2.2.1 | P2: of:=[$RESULTADOS.Q18] -> 2.2.2 | Q2: of:=[$RESULTADOS.R18] -> 2.3.1 | R2: of:=[$RESULTADOS.S18] -> 2.4.1 | S2: of:=[$RESULTADOS.T18] -> 2.4.2 | T2: of:=[$RESULTADOS.U18] -> 2.4.3 | U2: of:=[$RESULTADOS.V18] -> 2.4.4 | V2: of:=[$RESULTADOS.W18] -> 2.5.1 | W2: of:=[$RESULTADOS.X18] -> 2.5.2 | X2: of:=[$RESULTADOS.Y18] -> 2.5.3 | Y2: of:=[$RESULTADOS.Z18] -> 2.5.4 | Z2: of:=[$RESULTADOS.AA18] -> 3.1.1 | AA2: of:=[$RESULTADOS.AB18] -> 3.2.1 | AB2: of:=[$RESULTADOS.AC18] -> 3.2.2 | AC2: of:=[$RESULTADOS.AD18] -> 3.3.1 | AD2: of:=[$RESULTADOS.AE18] -> 3.3.2 | AE2: of:=[$RESULTADOS.AF18] -> 4.1.1 | AF2: of:=[$RESULTADOS.AG18] -> 4.1.2 | AG2: of:=[$RESULTADOS.AH18] -> 0 | AI2: of:=[$RESULTADOS.B59] -> 0 | AJ2: of:=[$RESULTADOS.C59] -> Muestra | AK2: of:=[$RESULTADOS.D59] -> 1.2.4 | AL2: of:=[$RESULTADOS.E59] -> 1.2.5 | AM2: of:=[$RESULTADOS.F59] -> 1.3.4 | AN2: of:=[$RESULTADOS.G59] -> 1.3.5 | AO2: of:=[$RESULTADOS.H59] -> 1.4.3 | AP2: of:=[$RESULTADOS.I59] -> 1.4.4 | AQ2: of:=[$RESULTADOS.J59] -> 1.4.5 | AR2: of:=[$RESULTADOS.K59] -> 1.4.10 | AS2: of:=[$RESULTADOS.L59] -> 1.4.11 | AT2: of:=[$RESULTADOS.M59] -> 1.4.12 | AU2: of:=[$RESULTADOS.N59] -> 1.4.13 | AV2: of:=[$RESULTADOS.O59] -> 2.4.5 | AW2: of:=[$RESULTADOS.P59] -> 2.4.6 | AX2: of:=[$RESULTADOS.Q59] -> 2.4.7 | AY2: of:=[$RESULTADOS.R59] -> 3.1.2 | AZ2: of:=[$RESULTADOS.S59] -> 3.2.3 | BA2: of:=[$RESULTADOS.T59] -> 3.2.4 | BB2: of:=[$RESULTADOS.U59] -> 3.3.3 | BC2: of:=[$RESULTADOS.V59] -> 3.3.4 | BD2: of:=[$RESULTADOS.W59] -> 4.1.3 | BE2: of:=[$RESULTADOS.X59] -> 0
A3: of:=[$RESULTADOS.B19] ->  | B3: of:=[$RESULTADOS.C19] ->  | C3: of:=[$RESULTADOS.D19] ->  | D3: of:=[$RESULTADOS.E19] ->  | E3: of:=[$RESULTADOS.F19] ->  | F3: of:=[$RESULTADOS.G19] ->  | G3: of:=[$RESULTADOS.H19] ->  | H3: of:=[$RESULTADOS.I19] ->  | I3: of:=[$RESULTADOS.J19] ->  | J3: of:=[$RESULTADOS.K19] ->  | K3: of:=[$RESULTADOS.L19] ->  | L3: of:=[$RESULTADOS.M19] ->  | M3: of:=[$RESULTADOS.N19] ->  | N3: of:=[$RESULTADOS.O19] ->  | O3: of:=[$RESULTADOS.P19] ->  | P3: of:=[$RESULTADOS.Q19] ->  | Q3: of:=[$RESULTADOS.R19] ->  | R3: of:=[$RESULTADOS.S19] ->  | S3: of:=[$RESULTADOS.T19] ->  | T3: of:=[$RESULTADOS.U19] ->  | U3: of:=[$RESULTADOS.V19] ->  | V3: of:=[$RESULTADOS.W19] ->  | W3: of:=[$RESULTADOS.X19] ->  | X3: of:=[$RESULTADOS.Y19] ->  | Y3: of:=[$RESULTADOS.Z19] ->  | Z3: of:=[$RESULTADOS.AA19] ->  | AA3: of:=[$RESULTADOS.AB19] ->  | AB3: of:=[$RESULTADOS.AC19] ->  | AC3: of:=[$RESULTADOS.AD19] ->  | AD3: of:=[$RESULTADOS.AE19] ->  | AE3: of:=[$RESULTADOS.AF19] ->  | AF3: of:=[$RESULTADOS.AG19] ->  | AG3: of:=[$RESULTADOS.AH19] -> 0 | AI3: of:=[$RESULTADOS.B60] ->  | AJ3: of:=[$RESULTADOS.C60] ->  | AK3: of:=[$RESULTADOS.D60] ->  | AL3: of:=[$RESULTADOS.E60] ->  | AM3: of:=[$RESULTADOS.F60] ->  | AN3: of:=[$RESULTADOS.G60] ->  | AO3: of:=[$RESULTADOS.H60] ->  | AP3: of:=[$RESULTADOS.I60] ->  | AQ3: of:=[$RESULTADOS.J60] ->  | AR3: of:=[$RESULTADOS.K60] ->  | AS3: of:=[$RESULTADOS.L60] ->  | AT3: of:=[$RESULTADOS.M60] ->  | AU3: of:=[$RESULTADOS.N60] ->  | AV3: of:=[$RESULTADOS.O60] ->  | AW3: of:=[$RESULTADOS.P60] ->  | AX3: of:=[$RESULTADOS.Q60] ->  | AY3: of:=[$RESULTADOS.R60] ->  | AZ3: of:=[$RESULTADOS.S60] ->  | BA3: of:=[$RESULTADOS.T60] ->  | BB3: of:=[$RESULTADOS.U60] ->  | BC3: of:=[$RESULTADOS.V60] ->  | BD3: of:=[$RESULTADOS.W60] ->  | BE3: of:=[$RESULTADOS.X60] -> 0
A4: of:=[$RESULTADOS.B20] ->  | B4: of:=[$RESULTADOS.C20] ->  | C4: of:=[$RESULTADOS.D20] ->  | D4: of:=[$RESULTADOS.E20] ->  | E4: of:=[$RESULTADOS.F20] ->  | F4: of:=[$RESULTADOS.G20] ->  | G4: of:=[$RESULTADOS.H20] ->  | H4: of:=[$RESULTADOS.I20] ->  | I4: of:=[$RESULTADOS.J20] ->  | J4: of:=[$RESULTADOS.K20] ->  | K4: of:=[$RESULTADOS.L20] ->  | L4: of:=[$RESULTADOS.M20] ->  | M4: of:=[$RESULTADOS.N20] ->  | N4: of:=[$RESULTADOS.O20] ->  | O4: of:=[$RESULTADOS.P20] ->  | P4: of:=[$RESULTADOS.Q20] ->  | Q4: of:=[$RESULTADOS.R20] ->  | R4: of:=[$RESULTADOS.S20] ->  | S4: of:=[$RESULTADOS.T20] ->  | T4: of:=[$RESULTADOS.U20] ->  | U4: of:=[$RESULTADOS.V20] ->  | V4: of:=[$RESULTADOS.W20] ->  | W4: of:=[$RESULTADOS.X20] ->  | X4: of:=[$RESULTADOS.Y20] ->  | Y4: of:=[$RESULTADOS.Z20] ->  | Z4: of:=[$RESULTADOS.AA20] ->  | AA4: of:=[$RESULTADOS.AB20] ->  | AB4: of:=[$RESULTADOS.AC20] ->  | AC4: of:=[$RESULTADOS.AD20] ->  | AD4: of:=[$RESULTADOS.AE20] ->  | AE4: of:=[$RESULTADOS.AF20] ->  | AF4: of:=[$RESULTADOS.AG20] ->  | AG4: of:=[$RESULTADOS.AH20] -> 0 | AI4: of:=[$RESULTADOS.B61] ->  | AJ4: of:=[$RESULTADOS.C61] ->  | AK4: of:=[$RESULTADOS.D61] ->  | AL4: of:=[$RESULTADOS.E61] ->  | AM4: of:=[$RESULTADOS.F61] ->  | AN4: of:=[$RESULTADOS.G61] ->  | AO4: of:=[$RESULTADOS.H61] ->  | AP4: of:=[$RESULTADOS.I61] ->  | AQ4: of:=[$RESULTADOS.J61] ->  | AR4: of:=[$RESULTADOS.K61] ->  | AS4: of:=[$RESULTADOS.L61] ->  | AT4: of:=[$RESULTADOS.M61] ->  | AU4: of:=[$RESULTADOS.N61] ->  | AV4: of:=[$RESULTADOS.O61] ->  | AW4: of:=[$RESULTADOS.P61] ->  | AX4: of:=[$RESULTADOS.Q61] ->  | AY4: of:=[$RESULTADOS.R61] ->  | AZ4: of:=[$RESULTADOS.S61] ->  | BA4: of:=[$RESULTADOS.T61] ->  | BB4: of:=[$RESULTADOS.U61] ->  | BC4: of:=[$RESULTADOS.V61] ->  | BD4: of:=[$RESULTADOS.W61] ->  | BE4: of:=[$RESULTADOS.X61] -> 0
A5: of:=[$RESULTADOS.B21] ->  | B5: of:=[$RESULTADOS.C21] ->  | C5: of:=[$RESULTADOS.D21] ->  | D5: of:=[$RESULTADOS.E21] ->  | E5: of:=[$RESULTADOS.F21] ->  | F5: of:=[$RESULTADOS.G21] ->  | G5: of:=[$RESULTADOS.H21] ->  | H5: of:=[$RESULTADOS.I21] ->  | I5: of:=[$RESULTADOS.J21] ->  | J5: of:=[$RESULTADOS.K21] ->  | K5: of:=[$RESULTADOS.L21] ->  | L5: of:=[$RESULTADOS.M21] ->  | M5: of:=[$RESULTADOS.N21] ->  | N5: of:=[$RESULTADOS.O21] ->  | O5: of:=[$RESULTADOS.P21] ->  | P5: of:=[$RESULTADOS.Q21] ->  | Q5: of:=[$RESULTADOS.R21] ->  | R5: of:=[$RESULTADOS.S21] ->  | S5: of:=[$RESULTADOS.T21] ->  | T5: of:=[$RESULTADOS.U21] ->  | U5: of:=[$RESULTADOS.V21] ->  | V5: of:=[$RESULTADOS.W21] ->  | W5: of:=[$RESULTADOS.X21] ->  | X5: of:=[$RESULTADOS.Y21] ->  | Y5: of:=[$RESULTADOS.Z21] ->  | Z5: of:=[$RESULTADOS.AA21] ->  | AA5: of:=[$RESULTADOS.AB21] ->  | AB5: of:=[$RESULTADOS.AC21] ->  | AC5: of:=[$RESULTADOS.AD21] ->  | AD5: of:=[$RESULTADOS.AE21] ->  | AE5: of:=[$RESULTADOS.AF21] ->  | AF5: of:=[$RESULTADOS.AG21] ->  | AG5: of:=[$RESULTADOS.AH21] -> 0 | AI5: of:=[$RESULTADOS.B62] ->  | AJ5: of:=[$RESULTADOS.C62] ->  | AK5: of:=[$RESULTADOS.D62] ->  | AL5: of:=[$RESULTADOS.E62] ->  | AM5: of:=[$RESULTADOS.F62] ->  | AN5: of:=[$RESULTADOS.G62] ->  | AO5: of:=[$RESULTADOS.H62] ->  | AP5: of:=[$RESULTADOS.I62] ->  | AQ5: of:=[$RESULTADOS.J62] ->  | AR5: of:=[$RESULTADOS.K62] ->  | AS5: of:=[$RESULTADOS.L62] ->  | AT5: of:=[$RESULTADOS.M62] ->  | AU5: of:=[$RESULTADOS.N62] ->  | AV5: of:=[$RESULTADOS.O62] ->  | AW5: of:=[$RESULTADOS.P62] ->  | AX5: of:=[$RESULTADOS.Q62] ->  | AY5: of:=[$RESULTADOS.R62] ->  | AZ5: of:=[$RESULTADOS.S62] ->  | BA5: of:=[$RESULTADOS.T62] ->  | BB5: of:=[$RESULTADOS.U62] ->  | BC5: of:=[$RESULTADOS.V62] ->  | BD5: of:=[$RESULTADOS.W62] ->  | BE5: of:=[$RESULTADOS.X62] -> 0
A6: of:=[$RESULTADOS.B22] ->  | B6: of:=[$RESULTADOS.C22] ->  | C6: of:=[$RESULTADOS.D22] ->  | D6: of:=[$RESULTADOS.E22] ->  | E6: of:=[$RESULTADOS.F22] ->  | F6: of:=[$RESULTADOS.G22] ->  | G6: of:=[$RESULTADOS.H22] ->  | H6: of:=[$RESULTADOS.I22] ->  | I6: of:=[$RESULTADOS.J22] ->  | J6: of:=[$RESULTADOS.K22] ->  | K6: of:=[$RESULTADOS.L22] ->  | L6: of:=[$RESULTADOS.M22] ->  | M6: of:=[$RESULTADOS.N22] ->  | N6: of:=[$RESULTADOS.O22] ->  | O6: of:=[$RESULTADOS.P22] ->  | P6: of:=[$RESULTADOS.Q22] ->  | Q6: of:=[$RESULTADOS.R22] ->  | R6: of:=[$RESULTADOS.S22] ->  | S6: of:=[$RESULTADOS.T22] ->  | T6: of:=[$RESULTADOS.U22] ->  | U6: of:=[$RESULTADOS.V22] ->  | V6: of:=[$RESULTADOS.W22] ->  | W6: of:=[$RESULTADOS.X22] ->  | X6: of:=[$RESULTADOS.Y22] ->  | Y6: of:=[$RESULTADOS.Z22] ->  | Z6: of:=[$RESULTADOS.AA22] ->  | AA6: of:=[$RESULTADOS.AB22] ->  | AB6: of:=[$RESULTADOS.AC22] ->  | AC6: of:=[$RESULTADOS.AD22] ->  | AD6: of:=[$RESULTADOS.AE22] ->  | AE6: of:=[$RESULTADOS.AF22] ->  | AF6: of:=[$RESULTADOS.AG22] ->  | AG6: of:=[$RESULTADOS.AH22] -> 0 | AI6: of:=[$RESULTADOS.B63] ->  | AJ6: of:=[$RESULTADOS.C63] ->  | AK6: of:=[$RESULTADOS.D63] ->  | AL6: of:=[$RESULTADOS.E63] ->  | AM6: of:=[$RESULTADOS.F63] ->  | AN6: of:=[$RESULTADOS.G63] ->  | AO6: of:=[$RESULTADOS.H63] ->  | AP6: of:=[$RESULTADOS.I63] ->  | AQ6: of:=[$RESULTADOS.J63] ->  | AR6: of:=[$RESULTADOS.K63] ->  | AS6: of:=[$RESULTADOS.L63] ->  | AT6: of:=[$RESULTADOS.M63] ->  | AU6: of:=[$RESULTADOS.N63] ->  | AV6: of:=[$RESULTADOS.O63] ->  | AW6: of:=[$RESULTADOS.P63] ->  | AX6: of:=[$RESULTADOS.Q63] ->  | AY6: of:=[$RESULTADOS.R63] ->  | AZ6: of:=[$RESULTADOS.S63] ->  | BA6: of:=[$RESULTADOS.T63] ->  | BB6: of:=[$RESULTADOS.U63] ->  | BC6: of:=[$RESULTADOS.V63] ->  | BD6: of:=[$RESULTADOS.W63] ->  | BE6: of:=[$RESULTADOS.X63] -> 0
A7: of:=[$RESULTADOS.B23] ->  | B7: of:=[$RESULTADOS.C23] ->  | C7: of:=[$RESULTADOS.D23] ->  | D7: of:=[$RESULTADOS.E23] ->  | E7: of:=[$RESULTADOS.F23] ->  | F7: of:=[$RESULTADOS.G23] ->  | G7: of:=[$RESULTADOS.H23] ->  | H7: of:=[$RESULTADOS.I23] ->  | I7: of:=[$RESULTADOS.J23] ->  | J7: of:=[$RESULTADOS.K23] ->  | K7: of:=[$RESULTADOS.L23] ->  | L7: of:=[$RESULTADOS.M23] ->  | M7: of:=[$RESULTADOS.N23] ->  | N7: of:=[$RESULTADOS.O23] ->  | O7: of:=[$RESULTADOS.P23] ->  | P7: of:=[$RESULTADOS.Q23] ->  | Q7: of:=[$RESULTADOS.R23] ->  | R7: of:=[$RESULTADOS.S23] ->  | S7: of:=[$RESULTADOS.T23] ->  | T7: of:=[$RESULTADOS.U23] ->  | U7: of:=[$RESULTADOS.V23] ->  | V7: of:=[$RESULTADOS.W23] ->  | W7: of:=[$RESULTADOS.X23] ->  | X7: of:=[$RESULTADOS.Y23] ->  | Y7: of:=[$RESULTADOS.Z23] ->  | Z7: of:=[$RESULTADOS.AA23] ->  | AA7: of:=[$RESULTADOS.AB23] ->  | AB7: of:=[$RESULTADOS.AC23] ->  | AC7: of:=[$RESULTADOS.AD23] ->  | AD7: of:=[$RESULTADOS.AE23] ->  | AE7: of:=[$RESULTADOS.AF23] ->  | AF7: of:=[$RESULTADOS.AG23] ->  | AG7: of:=[$RESULTADOS.AH23] -> 0 | AI7: of:=[$RESULTADOS.B64] ->  | AJ7: of:=[$RESULTADOS.C64] ->  | AK7: of:=[$RESULTADOS.D64] ->  | AL7: of:=[$RESULTADOS.E64] ->  | AM7: of:=[$RESULTADOS.F64] ->  | AN7: of:=[$RESULTADOS.G64] ->  | AO7: of:=[$RESULTADOS.H64] ->  | AP7: of:=[$RESULTADOS.I64] ->  | AQ7: of:=[$RESULTADOS.J64] ->  | AR7: of:=[$RESULTADOS.K64] ->  | AS7: of:=[$RESULTADOS.L64] ->  | AT7: of:=[$RESULTADOS.M64] ->  | AU7: of:=[$RESULTADOS.N64] ->  | AV7: of:=[$RESULTADOS.O64] ->  | AW7: of:=[$RESULTADOS.P64] ->  | AX7: of:=[$RESULTADOS.Q64] ->  | AY7: of:=[$RESULTADOS.R64] ->  | AZ7: of:=[$RESULTADOS.S64] ->  | BA7: of:=[$RESULTADOS.T64] ->  | BB7: of:=[$RESULTADOS.U64] ->  | BC7: of:=[$RESULTADOS.V64] ->  | BD7: of:=[$RESULTADOS.W64] ->  | BE7: of:=[$RESULTADOS.X64] -> 0
A8: of:=[$RESULTADOS.B24] ->  | B8: of:=[$RESULTADOS.C24] ->  | C8: of:=[$RESULTADOS.D24] ->  | D8: of:=[$RESULTADOS.E24] ->  | E8: of:=[$RESULTADOS.F24] ->  | F8: of:=[$RESULTADOS.G24] ->  | G8: of:=[$RESULTADOS.H24] ->  | H8: of:=[$RESULTADOS.I24] ->  | I8: of:=[$RESULTADOS.J24] ->  | J8: of:=[$RESULTADOS.K24] ->  | K8: of:=[$RESULTADOS.L24] ->  | L8: of:=[$RESULTADOS.M24] ->  | M8: of:=[$RESULTADOS.N24] ->  | N8: of:=[$RESULTADOS.O24] ->  | O8: of:=[$RESULTADOS.P24] ->  | P8: of:=[$RESULTADOS.Q24] ->  | Q8: of:=[$RESULTADOS.R24] ->  | R8: of:=[$RESULTADOS.S24] ->  | S8: of:=[$RESULTADOS.T24] ->  | T8: of:=[$RESULTADOS.U24] ->  | U8: of:=[$RESULTADOS.V24] ->  | V8: of:=[$RESULTADOS.W24] ->  | W8: of:=[$RESULTADOS.X24] ->  | X8: of:=[$RESULTADOS.Y24] ->  | Y8: of:=[$RESULTADOS.Z24] ->  | Z8: of:=[$RESULTADOS.AA24] ->  | AA8: of:=[$RESULTADOS.AB24] ->  | AB8: of:=[$RESULTADOS.AC24] ->  | AC8: of:=[$RESULTADOS.AD24] ->  | AD8: of:=[$RESULTADOS.AE24] ->  | AE8: of:=[$RESULTADOS.AF24] ->  | AF8: of:=[$RESULTADOS.AG24] ->  | AG8: of:=[$RESULTADOS.AH24] -> 0 | AI8: of:=[$RESULTADOS.B65] ->  | AJ8: of:=[$RESULTADOS.C65] ->  | AK8: of:=[$RESULTADOS.D65] ->  | AL8: of:=[$RESULTADOS.E65] ->  | AM8: of:=[$RESULTADOS.F65] ->  | AN8: of:=[$RESULTADOS.G65] ->  | AO8: of:=[$RESULTADOS.H65] ->  | AP8: of:=[$RESULTADOS.I65] ->  | AQ8: of:=[$RESULTADOS.J65] ->  | AR8: of:=[$RESULTADOS.K65] ->  | AS8: of:=[$RESULTADOS.L65] ->  | AT8: of:=[$RESULTADOS.M65] ->  | AU8: of:=[$RESULTADOS.N65] ->  | AV8: of:=[$RESULTADOS.O65] ->  | AW8: of:=[$RESULTADOS.P65] ->  | AX8: of:=[$RESULTADOS.Q65] ->  | AY8: of:=[$RESULTADOS.R65] ->  | AZ8: of:=[$RESULTADOS.S65] ->  | BA8: of:=[$RESULTADOS.T65] ->  | BB8: of:=[$RESULTADOS.U65] ->  | BC8: of:=[$RESULTADOS.V65] ->  | BD8: of:=[$RESULTADOS.W65] ->  | BE8: of:=[$RESULTADOS.X65] -> 0
A9: of:=[$RESULTADOS.B25] ->  | B9: of:=[$RESULTADOS.C25] ->  | C9: of:=[$RESULTADOS.D25] ->  | D9: of:=[$RESULTADOS.E25] ->  | E9: of:=[$RESULTADOS.F25] ->  | F9: of:=[$RESULTADOS.G25] ->  | G9: of:=[$RESULTADOS.H25] ->  | H9: of:=[$RESULTADOS.I25] ->  | I9: of:=[$RESULTADOS.J25] ->  | J9: of:=[$RESULTADOS.K25] ->  | K9: of:=[$RESULTADOS.L25] ->  | L9: of:=[$RESULTADOS.M25] ->  | M9: of:=[$RESULTADOS.N25] ->  | N9: of:=[$RESULTADOS.O25] ->  | O9: of:=[$RESULTADOS.P25] ->  | P9: of:=[$RESULTADOS.Q25] ->  | Q9: of:=[$RESULTADOS.R25] ->  | R9: of:=[$RESULTADOS.S25] ->  | S9: of:=[$RESULTADOS.T25] ->  | T9: of:=[$RESULTADOS.U25] ->  | U9: of:=[$RESULTADOS.V25] ->  | V9: of:=[$RESULTADOS.W25] ->  | W9: of:=[$RESULTADOS.X25] ->  | X9: of:=[$RESULTADOS.Y25] ->  | Y9: of:=[$RESULTADOS.Z25] ->  | Z9: of:=[$RESULTADOS.AA25] ->  | AA9: of:=[$RESULTADOS.AB25] ->  | AB9: of:=[$RESULTADOS.AC25] ->  | AC9: of:=[$RESULTADOS.AD25] ->  | AD9: of:=[$RESULTADOS.AE25] ->  | AE9: of:=[$RESULTADOS.AF25] ->  | AF9: of:=[$RESULTADOS.AG25] ->  | AG9: of:=[$RESULTADOS.AH25] -> 0 | AI9: of:=[$RESULTADOS.B66] ->  | AJ9: of:=[$RESULTADOS.C66] ->  | AK9: of:=[$RESULTADOS.D66] ->  | AL9: of:=[$RESULTADOS.E66] ->  | AM9: of:=[$RESULTADOS.F66] ->  | AN9: of:=[$RESULTADOS.G66] ->  | AO9: of:=[$RESULTADOS.H66] ->  | AP9: of:=[$RESULTADOS.I66] ->  | AQ9: of:=[$RESULTADOS.J66] ->  | AR9: of:=[$RESULTADOS.K66] ->  | AS9: of:=[$RESULTADOS.L66] ->  | AT9: of:=[$RESULTADOS.M66] ->  | AU9: of:=[$RESULTADOS.N66] ->  | AV9: of:=[$RESULTADOS.O66] ->  | AW9: of:=[$RESULTADOS.P66] ->  | AX9: of:=[$RESULTADOS.Q66] ->  | AY9: of:=[$RESULTADOS.R66] ->  | AZ9: of:=[$RESULTADOS.S66] ->  | BA9: of:=[$RESULTADOS.T66] ->  | BB9: of:=[$RESULTADOS.U66] ->  | BC9: of:=[$RESULTADOS.V66] ->  | BD9: of:=[$RESULTADOS.W66] ->  | BE9: of:=[$RESULTADOS.X66] -> 0
A10: of:=[$RESULTADOS.B26] ->  | B10: of:=[$RESULTADOS.C26] ->  | C10: of:=[$RESULTADOS.D26] ->  | D10: of:=[$RESULTADOS.E26] ->  | E10: of:=[$RESULTADOS.F26] ->  | F10: of:=[$RESULTADOS.G26] ->  | G10: of:=[$RESULTADOS.H26] ->  | H10: of:=[$RESULTADOS.I26] ->  | I10: of:=[$RESULTADOS.J26] ->  | J10: of:=[$RESULTADOS.K26] ->  | K10: of:=[$RESULTADOS.L26] ->  | L10: of:=[$RESULTADOS.M26] ->  | M10: of:=[$RESULTADOS.N26] ->  | N10: of:=[$RESULTADOS.O26] ->  | O10: of:=[$RESULTADOS.P26] ->  | P10: of:=[$RESULTADOS.Q26] ->  | Q10: of:=[$RESULTADOS.R26] ->  | R10: of:=[$RESULTADOS.S26] ->  | S10: of:=[$RESULTADOS.T26] ->  | T10: of:=[$RESULTADOS.U26] ->  | U10: of:=[$RESULTADOS.V26] ->  | V10: of:=[$RESULTADOS.W26] ->  | W10: of:=[$RESULTADOS.X26] ->  | X10: of:=[$RESULTADOS.Y26] ->  | Y10: of:=[$RESULTADOS.Z26] ->  | Z10: of:=[$RESULTADOS.AA26] ->  | AA10: of:=[$RESULTADOS.AB26] ->  | AB10: of:=[$RESULTADOS.AC26] ->  | AC10: of:=[$RESULTADOS.AD26] ->  | AD10: of:=[$RESULTADOS.AE26] ->  | AE10: of:=[$RESULTADOS.AF26] ->  | AF10: of:=[$RESULTADOS.AG26] ->  | AG10: of:=[$RESULTADOS.AH26] -> 0 | AI10: of:=[$RESULTADOS.B67] ->  | AJ10: of:=[$RESULTADOS.C67] ->  | AK10: of:=[$RESULTADOS.D67] ->  | AL10: of:=[$RESULTADOS.E67] ->  | AM10: of:=[$RESULTADOS.F67] ->  | AN10: of:=[$RESULTADOS.G67] ->  | AO10: of:=[$RESULTADOS.H67] ->  | AP10: of:=[$RESULTADOS.I67] ->  | AQ10: of:=[$RESULTADOS.J67] ->  | AR10: of:=[$RESULTADOS.K67] ->  | AS10: of:=[$RESULTADOS.L67] ->  | AT10: of:=[$RESULTADOS.M67] ->  | AU10: of:=[$RESULTADOS.N67] ->  | AV10: of:=[$RESULTADOS.O67] ->  | AW10: of:=[$RESULTADOS.P67] ->  | AX10: of:=[$RESULTADOS.Q67] ->  | AY10: of:=[$RESULTADOS.R67] ->  | AZ10: of:=[$RESULTADOS.S67] ->  | BA10: of:=[$RESULTADOS.T67] ->  | BB10: of:=[$RESULTADOS.U67] ->  | BC10: of:=[$RESULTADOS.V67] ->  | BD10: of:=[$RESULTADOS.W67] ->  | BE10: of:=[$RESULTADOS.X67] -> 0
A11: of:=[$RESULTADOS.B27] ->  | B11: of:=[$RESULTADOS.C27] ->  | C11: of:=[$RESULTADOS.D27] ->  | D11: of:=[$RESULTADOS.E27] ->  | E11: of:=[$RESULTADOS.F27] ->  | F11: of:=[$RESULTADOS.G27] ->  | G11: of:=[$RESULTADOS.H27] ->  | H11: of:=[$RESULTADOS.I27] ->  | I11: of:=[$RESULTADOS.J27] ->  | J11: of:=[$RESULTADOS.K27] ->  | K11: of:=[$RESULTADOS.L27] ->  | L11: of:=[$RESULTADOS.M27] ->  | M11: of:=[$RESULTADOS.N27] ->  | N11: of:=[$RESULTADOS.O27] ->  | O11: of:=[$RESULTADOS.P27] ->  | P11: of:=[$RESULTADOS.Q27] ->  | Q11: of:=[$RESULTADOS.R27] ->  | R11: of:=[$RESULTADOS.S27] ->  | S11: of:=[$RESULTADOS.T27] ->  | T11: of:=[$RESULTADOS.U27] ->  | U11: of:=[$RESULTADOS.V27] ->  | V11: of:=[$RESULTADOS.W27] ->  | W11: of:=[$RESULTADOS.X27] ->  | X11: of:=[$RESULTADOS.Y27] ->  | Y11: of:=[$RESULTADOS.Z27] ->  | Z11: of:=[$RESULTADOS.AA27] ->  | AA11: of:=[$RESULTADOS.AB27] ->  | AB11: of:=[$RESULTADOS.AC27] ->  | AC11: of:=[$RESULTADOS.AD27] ->  | AD11: of:=[$RESULTADOS.AE27] ->  | AE11: of:=[$RESULTADOS.AF27] ->  | AF11: of:=[$RESULTADOS.AG27] ->  | AG11: of:=[$RESULTADOS.AH27] -> 0 | AI11: of:=[$RESULTADOS.B68] ->  | AJ11: of:=[$RESULTADOS.C68] ->  | AK11: of:=[$RESULTADOS.D68] ->  | AL11: of:=[$RESULTADOS.E68] ->  | AM11: of:=[$RESULTADOS.F68] ->  | AN11: of:=[$RESULTADOS.G68] ->  | AO11: of:=[$RESULTADOS.H68] ->  | AP11: of:=[$RESULTADOS.I68] ->  | AQ11: of:=[$RESULTADOS.J68] ->  | AR11: of:=[$RESULTADOS.K68] ->  | AS11: of:=[$RESULTADOS.L68] ->  | AT11: of:=[$RESULTADOS.M68] ->  | AU11: of:=[$RESULTADOS.N68] ->  | AV11: of:=[$RESULTADOS.O68] ->  | AW11: of:=[$RESULTADOS.P68] ->  | AX11: of:=[$RESULTADOS.Q68] ->  | AY11: of:=[$RESULTADOS.R68] ->  | AZ11: of:=[$RESULTADOS.S68] ->  | BA11: of:=[$RESULTADOS.T68] ->  | BB11: of:=[$RESULTADOS.U68] ->  | BC11: of:=[$RESULTADOS.V68] ->  | BD11: of:=[$RESULTADOS.W68] ->  | BE11: of:=[$RESULTADOS.X68] -> 0
A12: of:=[$RESULTADOS.B28] ->  | B12: of:=[$RESULTADOS.C28] ->  | C12: of:=[$RESULTADOS.D28] ->  | D12: of:=[$RESULTADOS.E28] ->  | E12: of:=[$RESULTADOS.F28] ->  | F12: of:=[$RESULTADOS.G28] ->  | G12: of:=[$RESULTADOS.H28] ->  | H12: of:=[$RESULTADOS.I28] ->  | I12: of:=[$RESULTADOS.J28] ->  | J12: of:=[$RESULTADOS.K28] ->  | K12: of:=[$RESULTADOS.L28] ->  | L12: of:=[$RESULTADOS.M28] ->  | M12: of:=[$RESULTADOS.N28] ->  | N12: of:=[$RESULTADOS.O28] ->  | O12: of:=[$RESULTADOS.P28] ->  | P12: of:=[$RESULTADOS.Q28] ->  | Q12: of:=[$RESULTADOS.R28] ->  | R12: of:=[$RESULTADOS.S28] ->  | S12: of:=[$RESULTADOS.T28] ->  | T12: of:=[$RESULTADOS.U28] ->  | U12: of:=[$RESULTADOS.V28] ->  | V12: of:=[$RESULTADOS.W28] ->  | W12: of:=[$RESULTADOS.X28] ->  | X12: of:=[$RESULTADOS.Y28] ->  | Y12: of:=[$RESULTADOS.Z28] ->  | Z12: of:=[$RESULTADOS.AA28] ->  | AA12: of:=[$RESULTADOS.AB28] ->  | AB12: of:=[$RESULTADOS.AC28] ->  | AC12: of:=[$RESULTADOS.AD28] ->  | AD12: of:=[$RESULTADOS.AE28] ->  | AE12: of:=[$RESULTADOS.AF28] ->  | AF12: of:=[$RESULTADOS.AG28] ->  | AG12: of:=[$RESULTADOS.AH28] -> 0 | AI12: of:=[$RESULTADOS.B69] ->  | AJ12: of:=[$RESULTADOS.C69] ->  | AK12: of:=[$RESULTADOS.D69] ->  | AL12: of:=[$RESULTADOS.E69] ->  | AM12: of:=[$RESULTADOS.F69] ->  | AN12: of:=[$RESULTADOS.G69] ->  | AO12: of:=[$RESULTADOS.H69] ->  | AP12: of:=[$RESULTADOS.I69] ->  | AQ12: of:=[$RESULTADOS.J69] ->  | AR12: of:=[$RESULTADOS.K69] ->  | AS12: of:=[$RESULTADOS.L69] ->  | AT12: of:=[$RESULTADOS.M69] ->  | AU12: of:=[$RESULTADOS.N69] ->  | AV12: of:=[$RESULTADOS.O69] ->  | AW12: of:=[$RESULTADOS.P69] ->  | AX12: of:=[$RESULTADOS.Q69] ->  | AY12: of:=[$RESULTADOS.R69] ->  | AZ12: of:=[$RESULTADOS.S69] ->  | BA12: of:=[$RESULTADOS.T69] ->  | BB12: of:=[$RESULTADOS.U69] ->  | BC12: of:=[$RESULTADOS.V69] ->  | BD12: of:=[$RESULTADOS.W69] ->  | BE12: of:=[$RESULTADOS.X69] -> 0
A13: of:=[$RESULTADOS.B29] ->  | B13: of:=[$RESULTADOS.C29] ->  | C13: of:=[$RESULTADOS.D29] ->  | D13: of:=[$RESULTADOS.E29] ->  | E13: of:=[$RESULTADOS.F29] ->  | F13: of:=[$RESULTADOS.G29] ->  | G13: of:=[$RESULTADOS.H29] ->  | H13: of:=[$RESULTADOS.I29] ->  | I13: of:=[$RESULTADOS.J29] ->  | J13: of:=[$RESULTADOS.K29] ->  | K13: of:=[$RESULTADOS.L29] ->  | L13: of:=[$RESULTADOS.M29] ->  | M13: of:=[$RESULTADOS.N29] ->  | N13: of:=[$RESULTADOS.O29] ->  | O13: of:=[$RESULTADOS.P29] ->  | P13: of:=[$RESULTADOS.Q29] ->  | Q13: of:=[$RESULTADOS.R29] ->  | R13: of:=[$RESULTADOS.S29] ->  | S13: of:=[$RESULTADOS.T29] ->  | T13: of:=[$RESULTADOS.U29] ->  | U13: of:=[$RESULTADOS.V29] ->  | V13: of:=[$RESULTADOS.W29] ->  | W13: of:=[$RESULTADOS.X29] ->  | X13: of:=[$RESULTADOS.Y29] ->  | Y13: of:=[$RESULTADOS.Z29] ->  | Z13: of:=[$RESULTADOS.AA29] ->  | AA13: of:=[$RESULTADOS.AB29] ->  | AB13: of:=[$RESULTADOS.AC29] ->  | AC13: of:=[$RESULTADOS.AD29] ->  | AD13: of:=[$RESULTADOS.AE29] ->  | AE13: of:=[$RESULTADOS.AF29] ->  | AF13: of:=[$RESULTADOS.AG29] ->  | AG13: of:=[$RESULTADOS.AH29] -> 0 | AI13: of:=[$RESULTADOS.B70] ->  | AJ13: of:=[$RESULTADOS.C70] ->  | AK13: of:=[$RESULTADOS.D70] ->  | AL13: of:=[$RESULTADOS.E70] ->  | AM13: of:=[$RESULTADOS.F70] ->  | AN13: of:=[$RESULTADOS.G70] ->  | AO13: of:=[$RESULTADOS.H70] ->  | AP13: of:=[$RESULTADOS.I70] ->  | AQ13: of:=[$RESULTADOS.J70] ->  | AR13: of:=[$RESULTADOS.K70] ->  | AS13: of:=[$RESULTADOS.L70] ->  | AT13: of:=[$RESULTADOS.M70] ->  | AU13: of:=[$RESULTADOS.N70] ->  | AV13: of:=[$RESULTADOS.O70] ->  | AW13: of:=[$RESULTADOS.P70] ->  | AX13: of:=[$RESULTADOS.Q70] ->  | AY13: of:=[$RESULTADOS.R70] ->  | AZ13: of:=[$RESULTADOS.S70] ->  | BA13: of:=[$RESULTADOS.T70] ->  | BB13: of:=[$RESULTADOS.U70] ->  | BC13: of:=[$RESULTADOS.V70] ->  | BD13: of:=[$RESULTADOS.W70] ->  | BE13: of:=[$RESULTADOS.X70] -> 0
A14: of:=[$RESULTADOS.B30] ->  | B14: of:=[$RESULTADOS.C30] ->  | C14: of:=[$RESULTADOS.D30] ->  | D14: of:=[$RESULTADOS.E30] ->  | E14: of:=[$RESULTADOS.F30] ->  | F14: of:=[$RESULTADOS.G30] ->  | G14: of:=[$RESULTADOS.H30] ->  | H14: of:=[$RESULTADOS.I30] ->  | I14: of:=[$RESULTADOS.J30] ->  | J14: of:=[$RESULTADOS.K30] ->  | K14: of:=[$RESULTADOS.L30] ->  | L14: of:=[$RESULTADOS.M30] ->  | M14: of:=[$RESULTADOS.N30] ->  | N14: of:=[$RESULTADOS.O30] ->  | O14: of:=[$RESULTADOS.P30] ->  | P14: of:=[$RESULTADOS.Q30] ->  | Q14: of:=[$RESULTADOS.R30] ->  | R14: of:=[$RESULTADOS.S30] ->  | S14: of:=[$RESULTADOS.T30] ->  | T14: of:=[$RESULTADOS.U30] ->  | U14: of:=[$RESULTADOS.V30] ->  | V14: of:=[$RESULTADOS.W30] ->  | W14: of:=[$RESULTADOS.X30] ->  | X14: of:=[$RESULTADOS.Y30] ->  | Y14: of:=[$RESULTADOS.Z30] ->  | Z14: of:=[$RESULTADOS.AA30] ->  | AA14: of:=[$RESULTADOS.AB30] ->  | AB14: of:=[$RESULTADOS.AC30] ->  | AC14: of:=[$RESULTADOS.AD30] ->  | AD14: of:=[$RESULTADOS.AE30] ->  | AE14: of:=[$RESULTADOS.AF30] ->  | AF14: of:=[$RESULTADOS.AG30] ->  | AG14: of:=[$RESULTADOS.AH30] -> 0 | AI14: of:=[$RESULTADOS.B71] ->  | AJ14: of:=[$RESULTADOS.C71] ->  | AK14: of:=[$RESULTADOS.D71] ->  | AL14: of:=[$RESULTADOS.E71] ->  | AM14: of:=[$RESULTADOS.F71] ->  | AN14: of:=[$RESULTADOS.G71] ->  | AO14: of:=[$RESULTADOS.H71] ->  | AP14: of:=[$RESULTADOS.I71] ->  | AQ14: of:=[$RESULTADOS.J71] ->  | AR14: of:=[$RESULTADOS.K71] ->  | AS14: of:=[$RESULTADOS.L71] ->  | AT14: of:=[$RESULTADOS.M71] ->  | AU14: of:=[$RESULTADOS.N71] ->  | AV14: of:=[$RESULTADOS.O71] ->  | AW14: of:=[$RESULTADOS.P71] ->  | AX14: of:=[$RESULTADOS.Q71] ->  | AY14: of:=[$RESULTADOS.R71] ->  | AZ14: of:=[$RESULTADOS.S71] ->  | BA14: of:=[$RESULTADOS.T71] ->  | BB14: of:=[$RESULTADOS.U71] ->  | BC14: of:=[$RESULTADOS.V71] ->  | BD14: of:=[$RESULTADOS.W71] ->  | BE14: of:=[$RESULTADOS.X71] -> 0
A15: of:=[$RESULTADOS.B42] ->  | B15: of:=[$RESULTADOS.C42] ->  | C15: of:=[$RESULTADOS.D42] ->  | D15: of:=[$RESULTADOS.E42] ->  | E15: of:=[$RESULTADOS.F42] ->  | F15: of:=[$RESULTADOS.G42] ->  | G15: of:=[$RESULTADOS.H42] ->  | H15: of:=[$RESULTADOS.I42] ->  | I15: of:=[$RESULTADOS.J42] ->  | J15: of:=[$RESULTADOS.K42] ->  | K15: of:=[$RESULTADOS.L42] ->  | L15: of:=[$RESULTADOS.M42] ->  | M15: of:=[$RESULTADOS.N42] ->  | N15: of:=[$RESULTADOS.O42] ->  | O15: of:=[$RESULTADOS.P42] ->  | P15: of:=[$RESULTADOS.Q42] ->  | Q15: of:=[$RESULTADOS.R42] ->  | R15: of:=[$RESULTADOS.S42] ->  | S15: of:=[$RESULTADOS.T42] ->  | T15: of:=[$RESULTADOS.U42] ->  | U15: of:=[$RESULTADOS.V42] ->  | V15: of:=[$RESULTADOS.W42] ->  | W15: of:=[$RESULTADOS.X42] ->  | X15: of:=[$RESULTADOS.Y42] ->  | Y15: of:=[$RESULTADOS.Z42] ->  | Z15: of:=[$RESULTADOS.AA42] ->  | AA15: of:=[$RESULTADOS.AB42] ->  | AB15: of:=[$RESULTADOS.AC42] ->  | AC15: of:=[$RESULTADOS.AD42] ->  | AD15: of:=[$RESULTADOS.AE42] ->  | AE15: of:=[$RESULTADOS.AF42] ->  | AF15: of:=[$RESULTADOS.AG42] ->  | AG15: of:=[$RESULTADOS.AH42] -> 0 | AI15: of:=[$RESULTADOS.B83] ->  | AJ15: of:=[$RESULTADOS.C83] ->  | AK15: of:=[$RESULTADOS.D83] ->  | AL15: of:=[$RESULTADOS.E83] ->  | AM15: of:=[$RESULTADOS.F83] ->  | AN15: of:=[$RESULTADOS.G83] ->  | AO15: of:=[$RESULTADOS.H83] ->  | AP15: of:=[$RESULTADOS.I83] ->  | AQ15: of:=[$RESULTADOS.J83] ->  | AR15: of:=[$RESULTADOS.K83] ->  | AS15: of:=[$RESULTADOS.L83] ->  | AT15: of:=[$RESULTADOS.M83] ->  | AU15: of:=[$RESULTADOS.N83] ->  | AV15: of:=[$RESULTADOS.O83] ->  | AW15: of:=[$RESULTADOS.P83] ->  | AX15: of:=[$RESULTADOS.Q83] ->  | AY15: of:=[$RESULTADOS.R83] ->  | AZ15: of:=[$RESULTADOS.S83] ->  | BA15: of:=[$RESULTADOS.T83] ->  | BB15: of:=[$RESULTADOS.U83] ->  | BC15: of:=[$RESULTADOS.V83] ->  | BD15: of:=[$RESULTADOS.W83] ->  | BE15: of:=[$RESULTADOS.X83] -> 0
A16: of:=[$RESULTADOS.B43] ->  | B16: of:=[$RESULTADOS.C43] ->  | C16: of:=[$RESULTADOS.D43] ->  | D16: of:=[$RESULTADOS.E43] ->  | E16: of:=[$RESULTADOS.F43] ->  | F16: of:=[$RESULTADOS.G43] ->  | G16: of:=[$RESULTADOS.H43] ->  | H16: of:=[$RESULTADOS.I43] ->  | I16: of:=[$RESULTADOS.J43] ->  | J16: of:=[$RESULTADOS.K43] ->  | K16: of:=[$RESULTADOS.L43] ->  | L16: of:=[$RESULTADOS.M43] ->  | M16: of:=[$RESULTADOS.N43] ->  | N16: of:=[$RESULTADOS.O43] ->  | O16: of:=[$RESULTADOS.P43] ->  | P16: of:=[$RESULTADOS.Q43] ->  | Q16: of:=[$RESULTADOS.R43] ->  | R16: of:=[$RESULTADOS.S43] ->  | S16: of:=[$RESULTADOS.T43] ->  | T16: of:=[$RESULTADOS.U43] ->  | U16: of:=[$RESULTADOS.V43] ->  | V16: of:=[$RESULTADOS.W43] ->  | W16: of:=[$RESULTADOS.X43] ->  | X16: of:=[$RESULTADOS.Y43] ->  | Y16: of:=[$RESULTADOS.Z43] ->  | Z16: of:=[$RESULTADOS.AA43] ->  | AA16: of:=[$RESULTADOS.AB43] ->  | AB16: of:=[$RESULTADOS.AC43] ->  | AC16: of:=[$RESULTADOS.AD43] ->  | AD16: of:=[$RESULTADOS.AE43] ->  | AE16: of:=[$RESULTADOS.AF43] ->  | AF16: of:=[$RESULTADOS.AG43] ->  | AG16: of:=[$RESULTADOS.AH43] -> 0 | AI16: of:=[$RESULTADOS.B84] ->  | AJ16: of:=[$RESULTADOS.C84] ->  | AK16: of:=[$RESULTADOS.D84] ->  | AL16: of:=[$RESULTADOS.E84] ->  | AM16: of:=[$RESULTADOS.F84] ->  | AN16: of:=[$RESULTADOS.G84] ->  | AO16: of:=[$RESULTADOS.H84] ->  | AP16: of:=[$RESULTADOS.I84] ->  | AQ16: of:=[$RESULTADOS.J84] ->  | AR16: of:=[$RESULTADOS.K84] ->  | AS16: of:=[$RESULTADOS.L84] ->  | AT16: of:=[$RESULTADOS.M84] ->  | AU16: of:=[$RESULTADOS.N84] ->  | AV16: of:=[$RESULTADOS.O84] ->  | AW16: of:=[$RESULTADOS.P84] ->  | AX16: of:=[$RESULTADOS.Q84] ->  | AY16: of:=[$RESULTADOS.R84] ->  | AZ16: of:=[$RESULTADOS.S84] ->  | BA16: of:=[$RESULTADOS.T84] ->  | BB16: of:=[$RESULTADOS.U84] ->  | BC16: of:=[$RESULTADOS.V84] ->  | BD16: of:=[$RESULTADOS.W84] ->  | BE16: of:=[$RESULTADOS.X84] -> 0
A17: of:=[$RESULTADOS.B44] ->  | B17: of:=[$RESULTADOS.C44] ->  | C17: of:=[$RESULTADOS.D44] ->  | D17: of:=[$RESULTADOS.E44] ->  | E17: of:=[$RESULTADOS.F44] ->  | F17: of:=[$RESULTADOS.G44] ->  | G17: of:=[$RESULTADOS.H44] ->  | H17: of:=[$RESULTADOS.I44] ->  | I17: of:=[$RESULTADOS.J44] ->  | J17: of:=[$RESULTADOS.K44] ->  | K17: of:=[$RESULTADOS.L44] ->  | L17: of:=[$RESULTADOS.M44] ->  | M17: of:=[$RESULTADOS.N44] ->  | N17: of:=[$RESULTADOS.O44] ->  | O17: of:=[$RESULTADOS.P44] ->  | P17: of:=[$RESULTADOS.Q44] ->  | Q17: of:=[$RESULTADOS.R44] ->  | R17: of:=[$RESULTADOS.S44] ->  | S17: of:=[$RESULTADOS.T44] ->  | T17: of:=[$RESULTADOS.U44] ->  | U17: of:=[$RESULTADOS.V44] ->  | V17: of:=[$RESULTADOS.W44] ->  | W17: of:=[$RESULTADOS.X44] ->  | X17: of:=[$RESULTADOS.Y44] ->  | Y17: of:=[$RESULTADOS.Z44] ->  | Z17: of:=[$RESULTADOS.AA44] ->  | AA17: of:=[$RESULTADOS.AB44] ->  | AB17: of:=[$RESULTADOS.AC44] ->  | AC17: of:=[$RESULTADOS.AD44] ->  | AD17: of:=[$RESULTADOS.AE44] ->  | AE17: of:=[$RESULTADOS.AF44] ->  | AF17: of:=[$RESULTADOS.AG44] ->  | AG17: of:=[$RESULTADOS.AH44] -> 0 | AI17: of:=[$RESULTADOS.B85] ->  | AJ17: of:=[$RESULTADOS.C85] ->  | AK17: of:=[$RESULTADOS.D85] ->  | AL17: of:=[$RESULTADOS.E85] ->  | AM17: of:=[$RESULTADOS.F85] ->  | AN17: of:=[$RESULTADOS.G85] ->  | AO17: of:=[$RESULTADOS.H85] ->  | AP17: of:=[$RESULTADOS.I85] ->  | AQ17: of:=[$RESULTADOS.J85] ->  | AR17: of:=[$RESULTADOS.K85] ->  | AS17: of:=[$RESULTADOS.L85] ->  | AT17: of:=[$RESULTADOS.M85] ->  | AU17: of:=[$RESULTADOS.N85] ->  | AV17: of:=[$RESULTADOS.O85] ->  | AW17: of:=[$RESULTADOS.P85] ->  | AX17: of:=[$RESULTADOS.Q85] ->  | AY17: of:=[$RESULTADOS.R85] ->  | AZ17: of:=[$RESULTADOS.S85] ->  | BA17: of:=[$RESULTADOS.T85] ->  | BB17: of:=[$RESULTADOS.U85] ->  | BC17: of:=[$RESULTADOS.V85] ->  | BD17: of:=[$RESULTADOS.W85] ->  | BE17: of:=[$RESULTADOS.X85] -> 0
A18: of:=[$RESULTADOS.B45] ->  | B18: of:=[$RESULTADOS.C45] ->  | C18: of:=[$RESULTADOS.D45] ->  | D18: of:=[$RESULTADOS.E45] ->  | E18: of:=[$RESULTADOS.F45] ->  | F18: of:=[$RESULTADOS.G45] ->  | G18: of:=[$RESULTADOS.H45] ->  | H18: of:=[$RESULTADOS.I45] ->  | I18: of:=[$RESULTADOS.J45] ->  | J18: of:=[$RESULTADOS.K45] ->  | K18: of:=[$RESULTADOS.L45] ->  | L18: of:=[$RESULTADOS.M45] ->  | M18: of:=[$RESULTADOS.N45] ->  | N18: of:=[$RESULTADOS.O45] ->  | O18: of:=[$RESULTADOS.P45] ->  | P18: of:=[$RESULTADOS.Q45] ->  | Q18: of:=[$RESULTADOS.R45] ->  | R18: of:=[$RESULTADOS.S45] ->  | S18: of:=[$RESULTADOS.T45] ->  | T18: of:=[$RESULTADOS.U45] ->  | U18: of:=[$RESULTADOS.V45] ->  | V18: of:=[$RESULTADOS.W45] ->  | W18: of:=[$RESULTADOS.X45] ->  | X18: of:=[$RESULTADOS.Y45] ->  | Y18: of:=[$RESULTADOS.Z45] ->  | Z18: of:=[$RESULTADOS.AA45] ->  | AA18: of:=[$RESULTADOS.AB45] ->  | AB18: of:=[$RESULTADOS.AC45] ->  | AC18: of:=[$RESULTADOS.AD45] ->  | AD18: of:=[$RESULTADOS.AE45] ->  | AE18: of:=[$RESULTADOS.AF45] ->  | AF18: of:=[$RESULTADOS.AG45] ->  | AG18: of:=[$RESULTADOS.AH45] -> 0 | AI18: of:=[$RESULTADOS.B86] ->  | AJ18: of:=[$RESULTADOS.C86] ->  | AK18: of:=[$RESULTADOS.D86] ->  | AL18: of:=[$RESULTADOS.E86] ->  | AM18: of:=[$RESULTADOS.F86] ->  | AN18: of:=[$RESULTADOS.G86] ->  | AO18: of:=[$RESULTADOS.H86] ->  | AP18: of:=[$RESULTADOS.I86] ->  | AQ18: of:=[$RESULTADOS.J86] ->  | AR18: of:=[$RESULTADOS.K86] ->  | AS18: of:=[$RESULTADOS.L86] ->  | AT18: of:=[$RESULTADOS.M86] ->  | AU18: of:=[$RESULTADOS.N86] ->  | AV18: of:=[$RESULTADOS.O86] ->  | AW18: of:=[$RESULTADOS.P86] ->  | AX18: of:=[$RESULTADOS.Q86] ->  | AY18: of:=[$RESULTADOS.R86] ->  | AZ18: of:=[$RESULTADOS.S86] ->  | BA18: of:=[$RESULTADOS.T86] ->  | BB18: of:=[$RESULTADOS.U86] ->  | BC18: of:=[$RESULTADOS.V86] ->  | BD18: of:=[$RESULTADOS.W86] ->  | BE18: of:=[$RESULTADOS.X86] -> 0
A19: of:=[$RESULTADOS.B46] ->  | B19: of:=[$RESULTADOS.C46] ->  | C19: of:=[$RESULTADOS.D46] ->  | D19: of:=[$RESULTADOS.E46] ->  | E19: of:=[$RESULTADOS.F46] ->  | F19: of:=[$RESULTADOS.G46] ->  | G19: of:=[$RESULTADOS.H46] ->  | H19: of:=[$RESULTADOS.I46] ->  | I19: of:=[$RESULTADOS.J46] ->  | J19: of:=[$RESULTADOS.K46] ->  | K19: of:=[$RESULTADOS.L46] ->  | L19: of:=[$RESULTADOS.M46] ->  | M19: of:=[$RESULTADOS.N46] ->  | N19: of:=[$RESULTADOS.O46] ->  | O19: of:=[$RESULTADOS.P46] ->  | P19: of:=[$RESULTADOS.Q46] ->  | Q19: of:=[$RESULTADOS.R46] ->  | R19: of:=[$RESULTADOS.S46] ->  | S19: of:=[$RESULTADOS.T46] ->  | T19: of:=[$RESULTADOS.U46] ->  | U19: of:=[$RESULTADOS.V46] ->  | V19: of:=[$RESULTADOS.W46] ->  | W19: of:=[$RESULTADOS.X46] ->  | X19: of:=[$RESULTADOS.Y46] ->  | Y19: of:=[$RESULTADOS.Z46] ->  | Z19: of:=[$RESULTADOS.AA46] ->  | AA19: of:=[$RESULTADOS.AB46] ->  | AB19: of:=[$RESULTADOS.AC46] ->  | AC19: of:=[$RESULTADOS.AD46] ->  | AD19: of:=[$RESULTADOS.AE46] ->  | AE19: of:=[$RESULTADOS.AF46] ->  | AF19: of:=[$RESULTADOS.AG46] ->  | AG19: of:=[$RESULTADOS.AH46] -> 0 | AI19: of:=[$RESULTADOS.B87] ->  | AJ19: of:=[$RESULTADOS.C87] ->  | AK19: of:=[$RESULTADOS.D87] ->  | AL19: of:=[$RESULTADOS.E87] ->  | AM19: of:=[$RESULTADOS.F87] ->  | AN19: of:=[$RESULTADOS.G87] ->  | AO19: of:=[$RESULTADOS.H87] ->  | AP19: of:=[$RESULTADOS.I87] ->  | AQ19: of:=[$RESULTADOS.J87] ->  | AR19: of:=[$RESULTADOS.K87] ->  | AS19: of:=[$RESULTADOS.L87] ->  | AT19: of:=[$RESULTADOS.M87] ->  | AU19: of:=[$RESULTADOS.N87] ->  | AV19: of:=[$RESULTADOS.O87] ->  | AW19: of:=[$RESULTADOS.P87] ->  | AX19: of:=[$RESULTADOS.Q87] ->  | AY19: of:=[$RESULTADOS.R87] ->  | AZ19: of:=[$RESULTADOS.S87] ->  | BA19: of:=[$RESULTADOS.T87] ->  | BB19: of:=[$RESULTADOS.U87] ->  | BC19: of:=[$RESULTADOS.V87] ->  | BD19: of:=[$RESULTADOS.W87] ->  | BE19: of:=[$RESULTADOS.X87] -> 0
A20: of:=[$RESULTADOS.B47] ->  | B20: of:=[$RESULTADOS.C47] ->  | C20: of:=[$RESULTADOS.D47] ->  | D20: of:=[$RESULTADOS.E47] ->  | E20: of:=[$RESULTADOS.F47] ->  | F20: of:=[$RESULTADOS.G47] ->  | G20: of:=[$RESULTADOS.H47] ->  | H20: of:=[$RESULTADOS.I47] ->  | I20: of:=[$RESULTADOS.J47] ->  | J20: of:=[$RESULTADOS.K47] ->  | K20: of:=[$RESULTADOS.L47] ->  | L20: of:=[$RESULTADOS.M47] ->  | M20: of:=[$RESULTADOS.N47] ->  | N20: of:=[$RESULTADOS.O47] ->  | O20: of:=[$RESULTADOS.P47] ->  | P20: of:=[$RESULTADOS.Q47] ->  | Q20: of:=[$RESULTADOS.R47] ->  | R20: of:=[$RESULTADOS.S47] ->  | S20: of:=[$RESULTADOS.T47] ->  | T20: of:=[$RESULTADOS.U47] ->  | U20: of:=[$RESULTADOS.V47] ->  | V20: of:=[$RESULTADOS.W47] ->  | W20: of:=[$RESULTADOS.X47] ->  | X20: of:=[$RESULTADOS.Y47] ->  | Y20: of:=[$RESULTADOS.Z47] ->  | Z20: of:=[$RESULTADOS.AA47] ->  | AA20: of:=[$RESULTADOS.AB47] ->  | AB20: of:=[$RESULTADOS.AC47] ->  | AC20: of:=[$RESULTADOS.AD47] ->  | AD20: of:=[$RESULTADOS.AE47] ->  | AE20: of:=[$RESULTADOS.AF47] ->  | AF20: of:=[$RESULTADOS.AG47] ->  | AG20: of:=[$RESULTADOS.AH47] -> 0 | AI20: of:=[$RESULTADOS.B88] ->  | AJ20: of:=[$RESULTADOS.C88] ->  | AK20: of:=[$RESULTADOS.D88] ->  | AL20: of:=[$RESULTADOS.E88] ->  | AM20: of:=[$RESULTADOS.F88] ->  | AN20: of:=[$RESULTADOS.G88] ->  | AO20: of:=[$RESULTADOS.H88] ->  | AP20: of:=[$RESULTADOS.I88] ->  | AQ20: of:=[$RESULTADOS.J88] ->  | AR20: of:=[$RESULTADOS.K88] ->  | AS20: of:=[$RESULTADOS.L88] ->  | AT20: of:=[$RESULTADOS.M88] ->  | AU20: of:=[$RESULTADOS.N88] ->  | AV20: of:=[$RESULTADOS.O88] ->  | AW20: of:=[$RESULTADOS.P88] ->  | AX20: of:=[$RESULTADOS.Q88] ->  | AY20: of:=[$RESULTADOS.R88] ->  | AZ20: of:=[$RESULTADOS.S88] ->  | BA20: of:=[$RESULTADOS.T88] ->  | BB20: of:=[$RESULTADOS.U88] ->  | BC20: of:=[$RESULTADOS.V88] ->  | BD20: of:=[$RESULTADOS.W88] ->  | BE20: of:=[$RESULTADOS.X88] -> 0
A21: of:=[$RESULTADOS.B47] ->  | B21: of:=[$RESULTADOS.C47] ->  | C21: of:=[$RESULTADOS.D47] ->  | D21: of:=[$RESULTADOS.E47] ->  | E21: of:=[$RESULTADOS.F47] ->  | F21: of:=[$RESULTADOS.G47] ->  | G21: of:=[$RESULTADOS.H47] ->  | H21: of:=[$RESULTADOS.I47] ->  | I21: of:=[$RESULTADOS.J47] ->  | J21: of:=[$RESULTADOS.K47] ->  | K21: of:=[$RESULTADOS.L47] ->  | L21: of:=[$RESULTADOS.M47] ->  | M21: of:=[$RESULTADOS.N47] ->  | N21: of:=[$RESULTADOS.O47] ->  | O21: of:=[$RESULTADOS.P47] ->  | P21: of:=[$RESULTADOS.Q47] ->  | Q21: of:=[$RESULTADOS.R47] ->  | R21: of:=[$RESULTADOS.S47] ->  | S21: of:=[$RESULTADOS.T47] ->  | T21: of:=[$RESULTADOS.U47] ->  | U21: of:=[$RESULTADOS.V47] ->  | V21: of:=[$RESULTADOS.W47] ->  | W21: of:=[$RESULTADOS.X47] ->  | X21: of:=[$RESULTADOS.Y47] ->  | Y21: of:=[$RESULTADOS.Z47] ->  | Z21: of:=[$RESULTADOS.AA47] ->  | AA21: of:=[$RESULTADOS.AB47] ->  | AB21: of:=[$RESULTADOS.AC47] ->  | AC21: of:=[$RESULTADOS.AD47] ->  | AD21: of:=[$RESULTADOS.AE47] ->  | AE21: of:=[$RESULTADOS.AF47] ->  | AF21: of:=[$RESULTADOS.AG47] ->  | AG21: of:=[$RESULTADOS.AH47] -> 0 | AI21: of:=#REF! ->  | AJ21: of:=#REF! ->  | AK21: of:=#REF! ->  | AL21: of:=#REF! ->  | AM21: of:=#REF! ->  | AN21: of:=#REF! ->  | AO21: of:=#REF! ->  | AP21: of:=#REF! ->  | AQ21: of:=#REF! ->  | AR21: of:=#REF! ->  | AS21: of:=#REF! ->  | AT21: of:=#REF! ->  | AU21: of:=#REF! ->  | AV21: of:=#REF! ->  | AW21: of:=#REF! ->  | AX21: of:=#REF! ->  | AY21: of:=#REF! ->  | AZ21: of:=#REF! ->  | BA21: of:=#REF! ->  | BB21: of:=#REF! ->  | BC21: of:=#REF! ->  | BD21: of:=#REF! ->  | BE21: of:=#REF! -> 
A22: of:=[$RESULTADOS.B53] ->  | B22: of:=[$RESULTADOS.C53] ->  | C22: of:=[$RESULTADOS.D53] ->  | D22: of:=[$RESULTADOS.E53] ->  | E22: of:=[$RESULTADOS.F53] ->  | F22: of:=[$RESULTADOS.G53] ->  | G22: of:=[$RESULTADOS.H53] ->  | H22: of:=[$RESULTADOS.I53] ->  | I22: of:=[$RESULTADOS.J53] ->  | J22: of:=[$RESULTADOS.K53] ->  | K22: of:=[$RESULTADOS.L53] ->  | L22: of:=[$RESULTADOS.M53] ->  | M22: of:=[$RESULTADOS.N53] ->  | N22: of:=[$RESULTADOS.O53] ->  | O22: of:=[$RESULTADOS.P53] ->  | P22: of:=[$RESULTADOS.Q53] ->  | Q22: of:=[$RESULTADOS.R53] ->  | R22: of:=[$RESULTADOS.S53] ->  | S22: of:=[$RESULTADOS.T53] ->  | T22: of:=[$RESULTADOS.U53] ->  | U22: of:=[$RESULTADOS.V53] ->  | V22: of:=[$RESULTADOS.W53] ->  | W22: of:=[$RESULTADOS.X53] ->  | X22: of:=[$RESULTADOS.Y53] ->  | Y22: of:=[$RESULTADOS.Z53] ->  | Z22: of:=[$RESULTADOS.AA53] ->  | AA22: of:=[$RESULTADOS.AB53] ->  | AB22: of:=[$RESULTADOS.AC53] ->  | AC22: of:=[$RESULTADOS.AD53] ->  | AD22: of:=[$RESULTADOS.AE53] ->  | AE22: of:=[$RESULTADOS.AF53] ->  | AF22: of:=[$RESULTADOS.AG53] ->  | AG22: of:=[$RESULTADOS.AH53] -> 0 | AI22: of:=[$RESULTADOS.B94] ->  | AJ22: of:=[$RESULTADOS.C94] ->  | AK22: of:=[$RESULTADOS.D94] ->  | AL22: of:=[$RESULTADOS.E94] ->  | AM22: of:=[$RESULTADOS.F94] ->  | AN22: of:=[$RESULTADOS.G94] ->  | AO22: of:=[$RESULTADOS.H94] ->  | AP22: of:=[$RESULTADOS.I94] ->  | AQ22: of:=[$RESULTADOS.J94] ->  | AR22: of:=[$RESULTADOS.K94] ->  | AS22: of:=[$RESULTADOS.L94] ->  | AT22: of:=[$RESULTADOS.M94] ->  | AU22: of:=[$RESULTADOS.N94] ->  | AV22: of:=[$RESULTADOS.O94] ->  | AW22: of:=[$RESULTADOS.P94] ->  | AX22: of:=[$RESULTADOS.Q94] ->  | AY22: of:=[$RESULTADOS.R94] ->  | AZ22: of:=[$RESULTADOS.S94] ->  | BA22: of:=[$RESULTADOS.T94] ->  | BB22: of:=[$RESULTADOS.U94] ->  | BC22: of:=[$RESULTADOS.V94] ->  | BD22: of:=[$RESULTADOS.W94] ->  | BE22: of:=[$RESULTADOS.X94] -> 0
A23: of:=[$RESULTADOS.B54] -> 0 | B23: of:=[$RESULTADOS.C54] -> SITIO WEB | C23: of:=[$RESULTADOS.D54] ->  | D23: of:=[$RESULTADOS.E54] ->  | E23: of:=[$RESULTADOS.F54] ->  | F23: of:=[$RESULTADOS.G54] ->  | G23: of:=[$RESULTADOS.H54] ->  | H23: of:=[$RESULTADOS.I54] ->  | I23: of:=[$RESULTADOS.J54] ->  | J23: of:=[$RESULTADOS.K54] ->  | K23: of:=[$RESULTADOS.L54] ->  | L23: of:=[$RESULTADOS.M54] ->  | M23: of:=[$RESULTADOS.N54] ->  | N23: of:=[$RESULTADOS.O54] ->  | O23: of:=[$RESULTADOS.P54] ->  | P23: of:=[$RESULTADOS.Q54] ->  | Q23: of:=[$RESULTADOS.R54] ->  | R23: of:=[$RESULTADOS.S54] ->  | S23: of:=[$RESULTADOS.T54] ->  | T23: of:=[$RESULTADOS.U54] ->  | U23: of:=[$RESULTADOS.V54] ->  | V23: of:=[$RESULTADOS.W54] ->  | W23: of:=[$RESULTADOS.X54] ->  | X23: of:=[$RESULTADOS.Y54] ->  | Y23: of:=[$RESULTADOS.Z54] ->  | Z23: of:=[$RESULTADOS.AA54] ->  | AA23: of:=[$RESULTADOS.AB54] ->  | AB23: of:=[$RESULTADOS.AC54] ->  | AC23: of:=[$RESULTADOS.AD54] ->  | AD23: of:=[$RESULTADOS.AE54] ->  | AE23: of:=[$RESULTADOS.AF54] ->  | AF23: of:=[$RESULTADOS.AG54] ->  | AG23: of:=[$RESULTADOS.D11] -> 0 | AI23: of:=[$RESULTADOS.B95] -> 0 | AJ23: of:=[$RESULTADOS.C95] -> SITIO WEB | AK23: of:=[$RESULTADOS.D95] ->  | AL23: of:=[$RESULTADOS.E95] ->  | AM23: of:=[$RESULTADOS.F95] ->  | AN23: of:=[$RESULTADOS.G95] ->  | AO23: of:=[$RESULTADOS.H95] ->  | AP23: of:=[$RESULTADOS.I95] ->  | AQ23: of:=[$RESULTADOS.J95] ->  | AR23: of:=[$RESULTADOS.K95] ->  | AS23: of:=[$RESULTADOS.L95] ->  | AT23: of:=[$RESULTADOS.M95] ->  | AU23: of:=[$RESULTADOS.N95] ->  | AV23: of:=[$RESULTADOS.O95] ->  | AW23: of:=[$RESULTADOS.P95] ->  | AX23: of:=[$RESULTADOS.Q95] ->  | AY23: of:=[$RESULTADOS.R95] ->  | AZ23: of:=[$RESULTADOS.S95] ->  | BA23: of:=[$RESULTADOS.T95] ->  | BB23: of:=[$RESULTADOS.U95] ->  | BC23: of:=[$RESULTADOS.V95] ->  | BD23: of:=[$RESULTADOS.W95] ->  | BE23: of:=[$RESULTADOS.K12] -> 0
A24: of:=[$RESULTADOS.B55] -> 0 | B24: of:=[$RESULTADOS.C55] -> 0 | C24: of:=[$RESULTADOS.D55] -> 0 | D24: of:=[$RESULTADOS.E55] -> 0 | E24: of:=[$RESULTADOS.F55] -> 0 | F24: of:=[$RESULTADOS.G55] -> 0 | G24: of:=[$RESULTADOS.H55] -> 0 | H24: of:=[$RESULTADOS.I55] -> 0 | I24: of:=[$RESULTADOS.J55] -> 0 | J24: of:=[$RESULTADOS.K55] -> 0 | K24: of:=[$RESULTADOS.L55] -> 0 | L24: of:=[$RESULTADOS.M55] -> 0 | M24: of:=[$RESULTADOS.N55] -> 0 | N24: of:=[$RESULTADOS.O55] -> 0 | O24: of:=[$RESULTADOS.P55] -> 0 | P24: of:=[$RESULTADOS.Q55] -> 0 | Q24: of:=[$RESULTADOS.R55] -> 0 | R24: of:=[$RESULTADOS.S55] -> 0 | S24: of:=[$RESULTADOS.T55] -> 0 | T24: of:=[$RESULTADOS.U55] -> 0 | U24: of:=[$RESULTADOS.V55] -> 0 | V24: of:=[$RESULTADOS.W55] -> 0 | W24: of:=[$RESULTADOS.X55] -> 0 | X24: of:=[$RESULTADOS.Y55] -> 0 | Y24: of:=[$RESULTADOS.Z55] -> 0 | Z24: of:=[$RESULTADOS.AA55] -> 0 | AA24: of:=[$RESULTADOS.AB55] -> 0 | AB24: of:=[$RESULTADOS.AC55] -> 0 | AC24: of:=[$RESULTADOS.AD55] -> 0 | AD24: of:=[$RESULTADOS.AE55] -> 0 | AE24: of:=[$RESULTADOS.AF55] -> 0 | AF24: of:=[$RESULTADOS.AG55] -> 0 | AG24: of:=[$RESULTADOS.AH55] -> 0 | AI24: of:=[$RESULTADOS.B96] -> 0 | AJ24: of:=[$RESULTADOS.C96] -> 0 | AK24: of:=[$RESULTADOS.D96] -> 0 | AL24: of:=[$RESULTADOS.E96] -> 0 | AM24: of:=[$RESULTADOS.F96] -> 0 | AN24: of:=[$RESULTADOS.G96] -> 0 | AO24: of:=[$RESULTADOS.H96] -> 0 | AP24: of:=[$RESULTADOS.I96] -> 0 | AQ24: of:=[$RESULTADOS.J96] -> 0 | AR24: of:=[$RESULTADOS.K96] -> 0 | AS24: of:=[$RESULTADOS.L96] -> 0 | AT24: of:=[$RESULTADOS.M96] -> 0 | AU24: of:=[$RESULTADOS.N96] -> 0 | AV24: of:=[$RESULTADOS.O96] -> 0 | AW24: of:=[$RESULTADOS.P96] -> 0 | AX24: of:=[$RESULTADOS.Q96] -> 0 | AY24: of:=[$RESULTADOS.R96] -> 0 | AZ24: of:=[$RESULTADOS.S96] -> 0 | BA24: of:=[$RESULTADOS.T96] -> 0 | BB24: of:=[$RESULTADOS.U96] -> 0 | BC24: of:=[$RESULTADOS.V96] -> 0 | BD24: of:=[$RESULTADOS.W96] -> 0 | BE24: of:=[$RESULTADOS.X96] -> 0
A25: of:=#REF! ->  | B25: of:=#REF! ->  | C25: of:=#REF! ->  | D25: of:=#REF! ->  | E25: of:=#REF! ->  | F25: of:=#REF! ->  | G25: of:=#REF! ->  | H25: of:=#REF! ->  | I25: of:=#REF! ->  | J25: of:=#REF! ->  | K25: of:=#REF! ->  | L25: of:=#REF! ->  | M25: of:=#REF! ->  | N25: of:=#REF! ->  | O25: of:=#REF! ->  | P25: of:=#REF! ->  | Q25: of:=#REF! ->  | R25: of:=#REF! ->  | S25: of:=#REF! ->  | T25: of:=#REF! ->  | U25: of:=#REF! ->  | V25: of:=#REF! ->  | W25: of:=#REF! ->  | X25: of:=#REF! ->  | Y25: of:=#REF! ->  | Z25: of:=#REF! ->  | AA25: of:=#REF! ->  | AB25: of:=#REF! ->  | AC25: of:=#REF! ->  | AD25: of:=#REF! ->  | AE25: of:=#REF! ->  | AF25: of:=#REF! ->  | AG25: of:=#REF! ->  | AI25: of:=[$RESULTADOS.B97] -> 0 | AJ25: of:=[$RESULTADOS.C97] -> 0 | AK25: of:=[$RESULTADOS.D97] -> 0 | AL25: of:=[$RESULTADOS.E97] -> 0 | AM25: of:=[$RESULTADOS.F97] -> 0 | AN25: of:=[$RESULTADOS.G97] -> 0 | AO25: of:=[$RESULTADOS.H97] -> 0 | AP25: of:=[$RESULTADOS.I97] -> 0 | AQ25: of:=[$RESULTADOS.J97] -> 0 | AR25: of:=[$RESULTADOS.K97] -> 0 | AS25: of:=[$RESULTADOS.L97] -> 0 | AT25: of:=[$RESULTADOS.M97] -> 0 | AU25: of:=[$RESULTADOS.N97] -> 0 | AV25: of:=[$RESULTADOS.O97] -> 0 | AW25: of:=[$RESULTADOS.P97] -> 0 | AX25: of:=[$RESULTADOS.Q97] -> 0 | AY25: of:=[$RESULTADOS.R97] -> 0 | AZ25: of:=[$RESULTADOS.S97] -> 0 | BA25: of:=[$RESULTADOS.T97] -> 0 | BB25: of:=[$RESULTADOS.U97] -> 0 | BC25: of:=[$RESULTADOS.V97] -> 0 | BD25: of:=[$RESULTADOS.W97] -> 0 | BE25: of:=[$RESULTADOS.X97] -> 0
A26: of:=[$RESULTADOS.B56] -> 0 | B26: of:=[$RESULTADOS.C56] -> 0 | C26: of:=[$RESULTADOS.D56] -> 0 | D26: of:=[$RESULTADOS.E56] -> 0 | E26: of:=[$RESULTADOS.F56] -> 0 | F26: of:=[$RESULTADOS.G56] -> 0 | G26: of:=[$RESULTADOS.H56] -> 0 | H26: of:=[$RESULTADOS.I56] -> 0 | I26: of:=[$RESULTADOS.J56] -> 0 | J26: of:=[$RESULTADOS.K56] -> 0 | K26: of:=[$RESULTADOS.L56] -> 0 | L26: of:=[$RESULTADOS.M56] -> 0 | M26: of:=[$RESULTADOS.N56] -> false | N26: of:=[$RESULTADOS.O56] -> 0 | O26: of:=[$RESULTADOS.P56] -> 0 | P26: of:=[$RESULTADOS.Q56] -> 0 | Q26: of:=[$RESULTADOS.R56] -> 0 | R26: of:=[$RESULTADOS.S56] -> 0 | S26: of:=[$RESULTADOS.T56] -> 0 | T26: of:=[$RESULTADOS.U56] -> 0 | U26: of:=[$RESULTADOS.V56] -> 0 | V26: of:=[$RESULTADOS.W56] -> 0 | W26: of:=[$RESULTADOS.X56] -> 0 | X26: of:=[$RESULTADOS.Y56] -> 0 | Y26: of:=[$RESULTADOS.Z56] -> 0 | Z26: of:=[$RESULTADOS.AA56] -> 0 | AA26: of:=[$RESULTADOS.AB56] -> 0 | AB26: of:=[$RESULTADOS.AC56] -> 0 | AC26: of:=[$RESULTADOS.AD56] -> 0 | AD26: of:=[$RESULTADOS.AE56] -> 0 | AE26: of:=[$RESULTADOS.AF56] -> 0 | AF26: of:=[$RESULTADOS.AG56] -> 0 | AG26: of:=[$RESULTADOS.AH56] -> 0 | AI26: of:=[$RESULTADOS.B98] -> 0 | AJ26: of:=[$RESULTADOS.C98] -> 0 | AK26: of:=[$RESULTADOS.D98] -> 0 | AL26: of:=[$RESULTADOS.E98] -> 0 | AM26: of:=[$RESULTADOS.F98] -> 0 | AN26: of:=[$RESULTADOS.G98] -> 0 | AO26: of:=[$RESULTADOS.H98] -> 0 | AP26: of:=[$RESULTADOS.I98] -> 0 | AQ26: of:=[$RESULTADOS.J98] -> 0 | AR26: of:=[$RESULTADOS.K98] -> 0 | AS26: of:=[$RESULTADOS.L98] -> 0 | AT26: of:=[$RESULTADOS.M98] -> 0 | AU26: of:=[$RESULTADOS.N98] -> 0 | AV26: of:=[$RESULTADOS.O98] -> 0 | AW26: of:=[$RESULTADOS.P98] -> 0 | AX26: of:=[$RESULTADOS.Q98] -> 0 | AY26: of:=[$RESULTADOS.R98] -> 0 | AZ26: of:=[$RESULTADOS.S98] -> 0 | BA26: of:=[$RESULTADOS.T98] -> 0 | BB26: of:=[$RESULTADOS.U98] -> 0 | BC26: of:=[$RESULTADOS.V98] -> 0 | BD26: of:=[$RESULTADOS.W98] -> 0 | BE26: of:=[$RESULTADOS.X98] -> 0
A27: of:=[$RESULTADOS.B57] -> 0 | B27: of:=[$RESULTADOS.C57] -> 0 | C27: of:=[$RESULTADOS.D57] -> 0 | D27: of:=[$RESULTADOS.E57] -> 0 | E27: of:=[$RESULTADOS.F57] -> 0 | F27: of:=[$RESULTADOS.G57] -> 0 | G27: of:=[$RESULTADOS.H57] -> 0 | H27: of:=[$RESULTADOS.I57] -> 0 | I27: of:=[$RESULTADOS.J57] -> 0 | J27: of:=[$RESULTADOS.K57] -> 0 | K27: of:=[$RESULTADOS.L57] -> 0 | L27: of:=[$RESULTADOS.M57] -> 0 | M27: of:=[$RESULTADOS.N57] -> 0 | N27: of:=[$RESULTADOS.O57] -> 0 | O27: of:=[$RESULTADOS.P57] -> 0 | P27: of:=[$RESULTADOS.Q57] -> 0 | Q27: of:=[$RESULTADOS.R57] -> 0 | R27: of:=[$RESULTADOS.S57] -> 0 | S27: of:=[$RESULTADOS.T57] -> 0 | T27: of:=[$RESULTADOS.U57] -> 0 | U27: of:=[$RESULTADOS.V57] -> 0 | V27: of:=[$RESULTADOS.W57] -> 0 | W27: of:=[$RESULTADOS.X57] -> 0 | X27: of:=[$RESULTADOS.Y57] -> 0 | Y27: of:=[$RESULTADOS.Z57] -> 0 | Z27: of:=[$RESULTADOS.AA57] -> 0 | AA27: of:=[$RESULTADOS.AB57] -> 0 | AB27: of:=[$RESULTADOS.AC57] -> 0 | AC27: of:=[$RESULTADOS.AD57] -> 0 | AD27: of:=[$RESULTADOS.AE57] -> 0 | AE27: of:=[$RESULTADOS.AF57] -> 0 | AF27: of:=[$RESULTADOS.AG57] -> 0 | AG27: of:=[$RESULTADOS.AH57] -> 0 | AH27: of:=[$RESULTADOS.A99] -> 0 | AI27: of:=[$RESULTADOS.B99] -> 0 | AJ27: of:=[$RESULTADOS.C99] -> 0 | AK27: of:=[$RESULTADOS.D99] -> 0 | AL27: of:=[$RESULTADOS.E99] -> 0 | AM27: of:=[$RESULTADOS.F99] -> 0 | AN27: of:=[$RESULTADOS.G99] -> 0 | AO27: of:=[$RESULTADOS.H99] -> 0 | AP27: of:=[$RESULTADOS.I99] -> 0 | AQ27: of:=[$RESULTADOS.J99] -> 0 | AR27: of:=[$RESULTADOS.K99] -> 0 | AS27: of:=[$RESULTADOS.L99] -> 0 | AT27: of:=[$RESULTADOS.M99] -> 0 | AU27: of:=[$RESULTADOS.N99] -> 0 | AV27: of:=[$RESULTADOS.O99] -> 0 | AW27: of:=[$RESULTADOS.P99] -> 0 | AX27: of:=[$RESULTADOS.Q99] -> 0 | AY27: of:=[$RESULTADOS.R99] -> 0 | AZ27: of:=[$RESULTADOS.S99] -> 0 | BA27: of:=[$RESULTADOS.T99] -> 0 | BB27: of:=[$RESULTADOS.U99] -> 0 | BC27: of:=[$RESULTADOS.V99] -> 0 | BD27: of:=[$RESULTADOS.W99] -> 0 | BE27: of:=[$RESULTADOS.X99] -> 0
A29: of:=[$'01.Definición de ámbito'.C7] -> 0 | B29: of:=[$'01.Definición de ámbito'.E11] -> 0 | C29: of:=[$'01.Definición de ámbito'.C9] -> 0 | D29: of:=#REF! ->  | E29: of:=[$'01.Definición de ámbito'.C27] -> 0 | F29: of:=#REF! ->  | G29: of:=[$'01.Definición de ámbito'.C29] -> 0 | H29: of:=[$'01.Definición de ámbito'.C39] -> UNE-EN 301549 : 2019 - AA WCAG 2.1 (excluyendo el contenido excluido por el RD 1112/2018) | I29: of:=[$'01.Definición de ámbito'.C45] -> 0 | J29: of:=[$'01.Definición de ámbito'.C46] -> 0 | K29: of:=[$'01.Definición de ámbito'.C38] -> 0 | L29: of:=[$'01.Definición de ámbito'.C58] -> Vivienda | M29: of:=[$'01.Definición de ámbito'.C64] -> 0
A31: of:=[$'03.Muestra'.C8] -> 0 | B31: of:=[$'03.Muestra'.D8] -> 0 | C31: of:=[$'03.Muestra'.E8] -> 0
A32: of:=[$'03.Muestra'.C9] -> 0 | B32: of:=[$'03.Muestra'.D9] -> 0 | C32: of:=[$'03.Muestra'.E9] -> 0
A33: of:=[$'03.Muestra'.C10] -> 0 | B33: of:=[$'03.Muestra'.D10] -> 0 | C33: of:=[$'03.Muestra'.E10] -> 0
A34: of:=[$'03.Muestra'.C11] -> 0 | B34: of:=[$'03.Muestra'.D11] -> 0 | C34: of:=[$'03.Muestra'.E11] -> 0
A35: of:=[$'03.Muestra'.C12] -> 0 | B35: of:=[$'03.Muestra'.D12] -> 0 | C35: of:=[$'03.Muestra'.E12] -> 0
A36: of:=[$'03.Muestra'.C13] -> 0 | B36: of:=[$'03.Muestra'.D13] -> 0 | C36: of:=[$'03.Muestra'.E13] -> 0
A37: of:=[$'03.Muestra'.C14] -> 0 | B37: of:=[$'03.Muestra'.D14] -> 0 | C37: of:=[$'03.Muestra'.E14] -> 0
A38: of:=[$'03.Muestra'.C15] -> 0 | B38: of:=[$'03.Muestra'.D15] -> 0 | C38: of:=[$'03.Muestra'.E15] -> 0
A39: of:=[$'03.Muestra'.C16] -> 0 | B39: of:=[$'03.Muestra'.D16] -> 0 | C39: of:=[$'03.Muestra'.E16] -> 0
A40: of:=[$'03.Muestra'.C17] -> 0 | B40: of:=[$'03.Muestra'.D17] -> 0 | C40: of:=[$'03.Muestra'.E17] -> 0
A41: of:=[$'03.Muestra'.C18] -> 0 | B41: of:=[$'03.Muestra'.D18] -> 0 | C41: of:=[$'03.Muestra'.E18] -> 0
A42: of:=[$'03.Muestra'.C19] -> 0 | B42: of:=[$'03.Muestra'.D19] -> 0 | C42: of:=[$'03.Muestra'.E19] -> 0
A43: of:=[$'03.Muestra'.C31] -> 0 | B43: of:=[$'03.Muestra'.D31] -> 0 | C43: of:=[$'03.Muestra'.E31] -> 0
A44: of:=[$'03.Muestra'.C32] -> 0 | B44: of:=[$'03.Muestra'.D32] -> 0 | C44: of:=[$'03.Muestra'.E32] -> 0
A45: of:=[$'03.Muestra'.C33] -> 0 | B45: of:=[$'03.Muestra'.D33] -> 0 | C45: of:=[$'03.Muestra'.E33] -> 0
A46: of:=[$'03.Muestra'.C34] -> 0 | B46: of:=[$'03.Muestra'.D34] -> 0 | C46: of:=[$'03.Muestra'.E34] -> 0
A47: of:=[$'03.Muestra'.C35] -> 0 | B47: of:=[$'03.Muestra'.D35] -> 0 | C47: of:=[$'03.Muestra'.E35] -> 0
A48: of:=[$'03.Muestra'.C36] -> 0 | B48: of:=[$'03.Muestra'.D36] -> 0 | C48: of:=[$'03.Muestra'.E36] -> 0
A49: of:=#REF! ->  | B49: of:=#REF! ->  | C49: of:=#REF! -> 
A50: of:=[$'03.Muestra'.C42] -> 0 | B50: of:=[$'03.Muestra'.D42] -> 0 | C50: of:=[$'03.Muestra'.E42] -> 0

Sheet: Change Log
B1: Informe de revisión de la accesibilidad
B2: Análisis de accesibilidad en profundidad de un sitio web
B4: Change Log
B6: Versión 1.0.3 - 01. Definición de ámbito. Añadidas las marcas a los campos obligatorios y varios comentarios que faltaban, como por ejemplo el relacionado con el campo “Funcionalidad esencial del sitio web” - 02. Tecnologías. Añadido el texto “Es obligatorio rellenar esta pestaña” - RESULTADOS. Añadida la puntuación media del sitio web (PMSW) y los porcentajes de cumplimiento de los criterios e nivel web en los totales. Versión 1.0.2 - P1. Perceptible. Se corrige el texto informativo del criterio de conformidad 1.1.1 y se añade una nota en el criterio 1.2.4. - P2. Operable. Se añade un pequeño texto al texto informativo del criterio 2.2.1, 2.2.2 y 2.4.6. - P3 Comprensible. Se añade un pequeño texto al texto informativo del criterio 3.2.4. Versión 1.0.1 - 01. Definición de ámbito. Campo "Soporte de accesibilidad mínimo". Se ha actualizado la descripción del campo en el comentario. - 02. Tecnologías. Campo "Indicar las tecnologías web en las que se basa la conformidad de la accesibilidad". Se ha modificado la descripción de lo que se pide en esta pestaña en el comentario. - P1. Perceptible. Se elimina una fila vacía entre las dos últimas tablas. - RESULTADOS. Se corrigen las fórmulas de las filas resumen.

Sheet: DatosBD - Oculta
A1: Pestaña 00.Info | C1: Pestaña 01. Definición de ámbito | E1: Pestaña 02.Tecnologías | K1: Pestaña 03. Muestra | Z1: A | BD1: AA
A2: Versión | B2: of:=[$'00.Info'.N2] -> Versión: 1.0.3 | C2: Nombre de la URA* | D2: of:=[$'01.Definición de ámbito'.C7] -> 0 | E2: HTML5 | F2: of:=[$'02.Tecnologías'.C9] -> No | G2: Nombre | H2: url | K2: Páginas seleccionadas | L2: of:=[$'03.Muestra'.D45] -> 0 | T2: Id | U2: Nombre corto | V2: Tipo | W2: Url | X2: Migas | Y2: Tipos de elementos | Z2: 1.1.1 | AA2: 1.2.1 | AB2: 1.2.2 | AC2: 1.2.3 | AD2: 1.3.1 | AE2: 1.3.2 | AF2: 1.3.3 | AG2: 1.4.1 | AH2: 1.4.2 | AI2: 2.1.1 | AJ2: 2.1.2 | AK2: 2.1.4 | AL2: 2.2.1 | AM2: 2.2.2 | AN2: 2.3.1 | AO2: 2.4.1 | AP2: 2.4.2 | AQ2: 2.4.3 | AR2: 2.4.4 | AS2: 2.5.1 | AT2: 2.5.2 | AU2: 2.5.3 | AV2: 2.5.4 | AW2: 3.1.1 | AX2: 3.2.1 | AY2: 3.2.2 | AZ2: 3.3.1 | BA2: 3.3.2 | BB2: 4.1.1 | BC2: 4.1.2 | BD2: 1.2.4 | BE2: 1.2.5 | BF2: 1.3.4 | BG2: 1.3.5 | BH2: 1.4.3 | BI2: 1.4.4 | BJ2: 1.4.5 | BK2: 1.4.10 | BL2: 1.4.11 | BM2: 1.4.12 | BN2: 1.4.13 | BO2: 2.4.5 | BP2: 2.4.6 | BQ2: 2.4.7 | BR2: 3.1.2 | BS2: 3.2.3 | BT2: 3.2.4 | BU2: 3.3.3 | BV2: 3.3.4 | BW2: 4.1.3
C3: DIR3 de la URA* | D3: of:=[$'01.Definición de ámbito'.C9] -> 0 | E3: XHTML 1.0 | F3: of:=[$'02.Tecnologías'.C10] -> No | G3: of:=[$'02.Tecnologías'.K13] -> 0 | H3: of:=[$'02.Tecnologías'.L13] -> 0 | K3: Páginas no aleatorias | L3: of:=[$'03.Muestra'.D47] -> 0 | T3: of:=[$'03.Muestra'.B8] -> 1 | U3: of:=[$'03.Muestra'.C8] -> 0 | V3: of:=[$'03.Muestra'.D8] -> 0 | W3: of:=[$'03.Muestra'.E8] -> 0 | X3: of:=IF(LEFT([$'03.Muestra'.F8];3)="Ej.";0;[$'03.Muestra'.F8]) ->   | Y3: of:=IF(LEFT([$'03.Muestra'.G8];3)="Ej.";0;[$'03.Muestra'.G8]) -> 0 | Z3: of:=[$RESULTADOS.D19] ->  | AA3: of:=[$RESULTADOS.E19] ->  | AB3: of:=[$RESULTADOS.F19] ->  | AC3: of:=[$RESULTADOS.G19] ->  | AD3: of:=[$RESULTADOS.H19] ->  | AE3: of:=[$RESULTADOS.I19] ->  | AF3: of:=[$RESULTADOS.J19] ->  | AG3: of:=[$RESULTADOS.K19] ->  | AH3: of:=[$RESULTADOS.L19] ->  | AI3: of:=[$RESULTADOS.M19] ->  | AJ3: of:=[$RESULTADOS.N19] ->  | AK3: of:=[$RESULTADOS.O19] ->  | AL3: of:=[$RESULTADOS.P19] ->  | AM3: of:=[$RESULTADOS.Q19] ->  | AN3: of:=[$RESULTADOS.R19] ->  | AO3: of:=[$RESULTADOS.S19] ->  | AP3: of:=[$RESULTADOS.T19] ->  | AQ3: of:=[$RESULTADOS.U19] ->  | AR3: of:=[$RESULTADOS.V19] ->  | AS3: of:=[$RESULTADOS.W19] ->  | AT3: of:=[$RESULTADOS.X19] ->  | AU3: of:=[$RESULTADOS.Y19] ->  | AV3: of:=[$RESULTADOS.Z19] ->  | AW3: of:=[$RESULTADOS.AA19] ->  | AX3: of:=[$RESULTADOS.AB19] ->  | AY3: of:=[$RESULTADOS.AC19] ->  | AZ3: of:=[$RESULTADOS.AD19] ->  | BA3: of:=[$RESULTADOS.AE19] ->  | BB3: of:=[$RESULTADOS.AF19] ->  | BC3: of:=[$RESULTADOS.AG19] ->  | BD3: of:=[$RESULTADOS.D60] ->  | BE3: of:=[$RESULTADOS.E60] ->  | BF3: of:=[$RESULTADOS.F60] ->  | BG3: of:=[$RESULTADOS.G60] ->  | BH3: of:=[$RESULTADOS.H60] ->  | BI3: of:=[$RESULTADOS.I60] ->  | BJ3: of:=[$RESULTADOS.J60] ->  | BK3: of:=[$RESULTADOS.K60] ->  | BL3: of:=[$RESULTADOS.L60] ->  | BM3: of:=[$RESULTADOS.M60] ->  | BN3: of:=[$RESULTADOS.N60] ->  | BO3: of:=[$RESULTADOS.O60] ->  | BP3: of:=[$RESULTADOS.P60] ->  | BQ3: of:=[$RESULTADOS.Q60] ->  | BR3: of:=[$RESULTADOS.R60] ->  | BS3: of:=[$RESULTADOS.S60] ->  | BT3: of:=[$RESULTADOS.T60] ->  | BU3: of:=[$RESULTADOS.U60] ->  | BV3: of:=[$RESULTADOS.V60] ->  | BW3: of:=[$RESULTADOS.W60] -> 
C4: Ámbito competencial de la URA* | D4: of:=[$'01.Definición de ámbito'.C11] -> 0 | E4: HTML 4.01 | F4: of:=[$'02.Tecnologías'.C11] -> No | G4: of:=[$'02.Tecnologías'.K14] -> 0 | H4: of:=[$'02.Tecnologías'.L14] -> 0 | K4: Páginas aleatorias | L4: of:=[$'03.Muestra'.D49] -> 0 | T4: of:=[$'03.Muestra'.B9] -> 2 | U4: of:=[$'03.Muestra'.C9] -> 0 | V4: of:=[$'03.Muestra'.D9] -> 0 | W4: of:=[$'03.Muestra'.E9] -> 0 | X4: of:=[$'03.Muestra'.F9] ->   | Y4: of:=[$'03.Muestra'.G9] -> 0 | Z4: of:=[$RESULTADOS.D20] ->  | AA4: of:=[$RESULTADOS.E20] ->  | AB4: of:=[$RESULTADOS.F20] ->  | AC4: of:=[$RESULTADOS.G20] ->  | AD4: of:=[$RESULTADOS.H20] ->  | AE4: of:=[$RESULTADOS.I20] ->  | AF4: of:=[$RESULTADOS.J20] ->  | AG4: of:=[$RESULTADOS.K20] ->  | AH4: of:=[$RESULTADOS.L20] ->  | AI4: of:=[$RESULTADOS.M20] ->  | AJ4: of:=[$RESULTADOS.N20] ->  | AK4: of:=[$RESULTADOS.O20] ->  | AL4: of:=[$RESULTADOS.P20] ->  | AM4: of:=[$RESULTADOS.Q20] ->  | AN4: of:=[$RESULTADOS.R20] ->  | AO4: of:=[$RESULTADOS.S20] ->  | AP4: of:=[$RESULTADOS.T20] ->  | AQ4: of:=[$RESULTADOS.U20] ->  | AR4: of:=[$RESULTADOS.V20] ->  | AS4: of:=[$RESULTADOS.W20] ->  | AT4: of:=[$RESULTADOS.X20] ->  | AU4: of:=[$RESULTADOS.Y20] ->  | AV4: of:=[$RESULTADOS.Z20] ->  | AW4: of:=[$RESULTADOS.AA20] ->  | AX4: of:=[$RESULTADOS.AB20] ->  | AY4: of:=[$RESULTADOS.AC20] ->  | AZ4: of:=[$RESULTADOS.AD20] ->  | BA4: of:=[$RESULTADOS.AE20] ->  | BB4: of:=[$RESULTADOS.AF20] ->  | BC4: of:=[$RESULTADOS.AG20] ->  | BD4: of:=[$RESULTADOS.D61] ->  | BE4: of:=[$RESULTADOS.E61] ->  | BF4: of:=[$RESULTADOS.F61] ->  | BG4: of:=[$RESULTADOS.G61] ->  | BH4: of:=[$RESULTADOS.H61] ->  | BI4: of:=[$RESULTADOS.I61] ->  | BJ4: of:=[$RESULTADOS.J61] ->  | BK4: of:=[$RESULTADOS.K61] ->  | BL4: of:=[$RESULTADOS.L61] ->  | BM4: of:=[$RESULTADOS.M61] ->  | BN4: of:=[$RESULTADOS.N61] ->  | BO4: of:=[$RESULTADOS.O61] ->  | BP4: of:=[$RESULTADOS.P61] ->  | BQ4: of:=[$RESULTADOS.Q61] ->  | BR4: of:=[$RESULTADOS.R61] ->  | BS4: of:=[$RESULTADOS.S61] ->  | BT4: of:=[$RESULTADOS.T61] ->  | BU4: of:=[$RESULTADOS.U61] ->  | BV4: of:=[$RESULTADOS.V61] ->  | BW4: of:=[$RESULTADOS.W61] -> 
C5: DIR3 del ámbito competencial de la URA* | D5: of:=[$'01.Definición de ámbito'.C13] -> 0 | E5: CSS | F5: of:=[$'02.Tecnologías'.C12] -> No | G5: of:=[$'02.Tecnologías'.K15] -> 0 | H5: of:=[$'02.Tecnologías'.L15] -> 0 | K5: ¿Muestra correcta? | L5: of:=[$'03.Muestra'.D52] -> NO | T5: of:=[$'03.Muestra'.B10] -> 3 | U5: of:=[$'03.Muestra'.C10] -> 0 | V5: of:=[$'03.Muestra'.D10] -> 0 | W5: of:=[$'03.Muestra'.E10] -> 0 | X5: of:=[$'03.Muestra'.F10] ->   | Y5: of:=[$'03.Muestra'.G10] -> 0 | Z5: of:=[$RESULTADOS.D21] ->  | AA5: of:=[$RESULTADOS.E21] ->  | AB5: of:=[$RESULTADOS.F21] ->  | AC5: of:=[$RESULTADOS.G21] ->  | AD5: of:=[$RESULTADOS.H21] ->  | AE5: of:=[$RESULTADOS.I21] ->  | AF5: of:=[$RESULTADOS.J21] ->  | AG5: of:=[$RESULTADOS.K21] ->  | AH5: of:=[$RESULTADOS.L21] ->  | AI5: of:=[$RESULTADOS.M21] ->  | AJ5: of:=[$RESULTADOS.N21] ->  | AK5: of:=[$RESULTADOS.O21] ->  | AL5: of:=[$RESULTADOS.P21] ->  | AM5: of:=[$RESULTADOS.Q21] ->  | AN5: of:=[$RESULTADOS.R21] ->  | AO5: of:=[$RESULTADOS.S21] ->  | AP5: of:=[$RESULTADOS.T21] ->  | AQ5: of:=[$RESULTADOS.U21] ->  | AR5: of:=[$RESULTADOS.V21] ->  | AS5: of:=[$RESULTADOS.W21] ->  | AT5: of:=[$RESULTADOS.X21] ->  | AU5: of:=[$RESULTADOS.Y21] ->  | AV5: of:=[$RESULTADOS.Z21] ->  | AW5: of:=[$RESULTADOS.AA21] ->  | AX5: of:=[$RESULTADOS.AB21] ->  | AY5: of:=[$RESULTADOS.AC21] ->  | AZ5: of:=[$RESULTADOS.AD21] ->  | BA5: of:=[$RESULTADOS.AE21] ->  | BB5: of:=[$RESULTADOS.AF21] ->  | BC5: of:=[$RESULTADOS.AG21] ->  | BD5: of:=[$RESULTADOS.D62] ->  | BE5: of:=[$RESULTADOS.E62] ->  | BF5: of:=[$RESULTADOS.F62] ->  | BG5: of:=[$RESULTADOS.G62] ->  | BH5: of:=[$RESULTADOS.H62] ->  | BI5: of:=[$RESULTADOS.I62] ->  | BJ5: of:=[$RESULTADOS.J62] ->  | BK5: of:=[$RESULTADOS.K62] ->  | BL5: of:=[$RESULTADOS.L62] ->  | BM5: of:=[$RESULTADOS.M62] ->  | BN5: of:=[$RESULTADOS.N62] ->  | BO5: of:=[$RESULTADOS.O62] ->  | BP5: of:=[$RESULTADOS.P62] ->  | BQ5: of:=[$RESULTADOS.Q62] ->  | BR5: of:=[$RESULTADOS.R62] ->  | BS5: of:=[$RESULTADOS.S62] ->  | BT5: of:=[$RESULTADOS.T62] ->  | BU5: of:=[$RESULTADOS.U62] ->  | BV5: of:=[$RESULTADOS.V62] ->  | BW5: of:=[$RESULTADOS.W62] -> 
C6: Entidad responsable del Sitio web* | D6: of:=[$'01.Definición de ámbito'.C17] -> 0 | E6: WAI-ARIA | F6: of:=[$'02.Tecnologías'.C13] -> No | G6: of:=[$'02.Tecnologías'.K16] -> 0 | H6: of:=[$'02.Tecnologías'.L16] -> 0 | T6: of:=[$'03.Muestra'.B11] -> 4 | U6: of:=[$'03.Muestra'.C11] -> 0 | V6: of:=[$'03.Muestra'.D11] -> 0 | W6: of:=[$'03.Muestra'.E11] -> 0 | X6: of:=[$'03.Muestra'.F11] ->   | Y6: of:=[$'03.Muestra'.G11] -> 0 | Z6: of:=[$RESULTADOS.D22] ->  | AA6: of:=[$RESULTADOS.E22] ->  | AB6: of:=[$RESULTADOS.F22] ->  | AC6: of:=[$RESULTADOS.G22] ->  | AD6: of:=[$RESULTADOS.H22] ->  | AE6: of:=[$RESULTADOS.I22] ->  | AF6: of:=[$RESULTADOS.J22] ->  | AG6: of:=[$RESULTADOS.K22] ->  | AH6: of:=[$RESULTADOS.L22] ->  | AI6: of:=[$RESULTADOS.M22] ->  | AJ6: of:=[$RESULTADOS.N22] ->  | AK6: of:=[$RESULTADOS.O22] ->  | AL6: of:=[$RESULTADOS.P22] ->  | AM6: of:=[$RESULTADOS.Q22] ->  | AN6: of:=[$RESULTADOS.R22] ->  | AO6: of:=[$RESULTADOS.S22] ->  | AP6: of:=[$RESULTADOS.T22] ->  | AQ6: of:=[$RESULTADOS.U22] ->  | AR6: of:=[$RESULTADOS.V22] ->  | AS6: of:=[$RESULTADOS.W22] ->  | AT6: of:=[$RESULTADOS.X22] ->  | AU6: of:=[$RESULTADOS.Y22] ->  | AV6: of:=[$RESULTADOS.Z22] ->  | AW6: of:=[$RESULTADOS.AA22] ->  | AX6: of:=[$RESULTADOS.AB22] ->  | AY6: of:=[$RESULTADOS.AC22] ->  | AZ6: of:=[$RESULTADOS.AD22] ->  | BA6: of:=[$RESULTADOS.AE22] ->  | BB6: of:=[$RESULTADOS.AF22] ->  | BC6: of:=[$RESULTADOS.AG22] ->  | BD6: of:=[$RESULTADOS.D63] ->  | BE6: of:=[$RESULTADOS.E63] ->  | BF6: of:=[$RESULTADOS.F63] ->  | BG6: of:=[$RESULTADOS.G63] ->  | BH6: of:=[$RESULTADOS.H63] ->  | BI6: of:=[$RESULTADOS.I63] ->  | BJ6: of:=[$RESULTADOS.J63] ->  | BK6: of:=[$RESULTADOS.K63] ->  | BL6: of:=[$RESULTADOS.L63] ->  | BM6: of:=[$RESULTADOS.M63] ->  | BN6: of:=[$RESULTADOS.N63] ->  | BO6: of:=[$RESULTADOS.O63] ->  | BP6: of:=[$RESULTADOS.P63] ->  | BQ6: of:=[$RESULTADOS.Q63] ->  | BR6: of:=[$RESULTADOS.R63] ->  | BS6: of:=[$RESULTADOS.S63] ->  | BT6: of:=[$RESULTADOS.T63] ->  | BU6: of:=[$RESULTADOS.U63] ->  | BV6: of:=[$RESULTADOS.V63] ->  | BW6: of:=[$RESULTADOS.W63] -> 
C7: DIR3 de la Entidad responsable* | D7: of:=[$'01.Definición de ámbito'.C19] -> 0 | E7: ECMAScript 3 | F7: of:=[$'02.Tecnologías'.F9] -> No | G7: of:=[$'02.Tecnologías'.K17] -> 0 | H7: of:=[$'02.Tecnologías'.L17] -> 0 | T7: of:=[$'03.Muestra'.B12] -> 5 | U7: of:=[$'03.Muestra'.C12] -> 0 | V7: of:=[$'03.Muestra'.D12] -> 0 | W7: of:=[$'03.Muestra'.E12] -> 0 | X7: of:=[$'03.Muestra'.F12] ->   | Y7: of:=[$'03.Muestra'.G12] -> 0 | Z7: of:=[$RESULTADOS.D23] ->  | AA7: of:=[$RESULTADOS.E23] ->  | AB7: of:=[$RESULTADOS.F23] ->  | AC7: of:=[$RESULTADOS.G23] ->  | AD7: of:=[$RESULTADOS.H23] ->  | AE7: of:=[$RESULTADOS.I23] ->  | AF7: of:=[$RESULTADOS.J23] ->  | AG7: of:=[$RESULTADOS.K23] ->  | AH7: of:=[$RESULTADOS.L23] ->  | AI7: of:=[$RESULTADOS.M23] ->  | AJ7: of:=[$RESULTADOS.N23] ->  | AK7: of:=[$RESULTADOS.O23] ->  | AL7: of:=[$RESULTADOS.P23] ->  | AM7: of:=[$RESULTADOS.Q23] ->  | AN7: of:=[$RESULTADOS.R23] ->  | AO7: of:=[$RESULTADOS.S23] ->  | AP7: of:=[$RESULTADOS.T23] ->  | AQ7: of:=[$RESULTADOS.U23] ->  | AR7: of:=[$RESULTADOS.V23] ->  | AS7: of:=[$RESULTADOS.W23] ->  | AT7: of:=[$RESULTADOS.X23] ->  | AU7: of:=[$RESULTADOS.Y23] ->  | AV7: of:=[$RESULTADOS.Z23] ->  | AW7: of:=[$RESULTADOS.AA23] ->  | AX7: of:=[$RESULTADOS.AB23] ->  | AY7: of:=[$RESULTADOS.AC23] ->  | AZ7: of:=[$RESULTADOS.AD23] ->  | BA7: of:=[$RESULTADOS.AE23] ->  | BB7: of:=[$RESULTADOS.AF23] ->  | BC7: of:=[$RESULTADOS.AG23] ->  | BD7: of:=[$RESULTADOS.D64] ->  | BE7: of:=[$RESULTADOS.E64] ->  | BF7: of:=[$RESULTADOS.F64] ->  | BG7: of:=[$RESULTADOS.G64] ->  | BH7: of:=[$RESULTADOS.H64] ->  | BI7: of:=[$RESULTADOS.I64] ->  | BJ7: of:=[$RESULTADOS.J64] ->  | BK7: of:=[$RESULTADOS.K64] ->  | BL7: of:=[$RESULTADOS.L64] ->  | BM7: of:=[$RESULTADOS.M64] ->  | BN7: of:=[$RESULTADOS.N64] ->  | BO7: of:=[$RESULTADOS.O64] ->  | BP7: of:=[$RESULTADOS.P64] ->  | BQ7: of:=[$RESULTADOS.Q64] ->  | BR7: of:=[$RESULTADOS.R64] ->  | BS7: of:=[$RESULTADOS.S64] ->  | BT7: of:=[$RESULTADOS.T64] ->  | BU7: of:=[$RESULTADOS.U64] ->  | BV7: of:=[$RESULTADOS.V64] ->  | BW7: of:=[$RESULTADOS.W64] -> 
C8: Correo electrónico de la Entidad/Persona responsable del Sitio web* | D8: of:=[$'01.Definición de ámbito'.C21] -> 0 | E8: ECMAScript 5 | F8: of:=[$'02.Tecnologías'.F10] -> No | G8: of:=[$'02.Tecnologías'.K18] -> 0 | H8: of:=[$'02.Tecnologías'.L18] -> 0 | T8: of:=[$'03.Muestra'.B13] -> 6 | U8: of:=[$'03.Muestra'.C13] -> 0 | V8: of:=[$'03.Muestra'.D13] -> 0 | W8: of:=[$'03.Muestra'.E13] -> 0 | X8: of:=[$'03.Muestra'.F13] ->   | Y8: of:=[$'03.Muestra'.G13] -> 0 | Z8: of:=[$RESULTADOS.D24] ->  | AA8: of:=[$RESULTADOS.E24] ->  | AB8: of:=[$RESULTADOS.F24] ->  | AC8: of:=[$RESULTADOS.G24] ->  | AD8: of:=[$RESULTADOS.H24] ->  | AE8: of:=[$RESULTADOS.I24] ->  | AF8: of:=[$RESULTADOS.J24] ->  | AG8: of:=[$RESULTADOS.K24] ->  | AH8: of:=[$RESULTADOS.L24] ->  | AI8: of:=[$RESULTADOS.M24] ->  | AJ8: of:=[$RESULTADOS.N24] ->  | AK8: of:=[$RESULTADOS.O24] ->  | AL8: of:=[$RESULTADOS.P24] ->  | AM8: of:=[$RESULTADOS.Q24] ->  | AN8: of:=[$RESULTADOS.R24] ->  | AO8: of:=[$RESULTADOS.S24] ->  | AP8: of:=[$RESULTADOS.T24] ->  | AQ8: of:=[$RESULTADOS.U24] ->  | AR8: of:=[$RESULTADOS.V24] ->  | AS8: of:=[$RESULTADOS.W24] ->  | AT8: of:=[$RESULTADOS.X24] ->  | AU8: of:=[$RESULTADOS.Y24] ->  | AV8: of:=[$RESULTADOS.Z24] ->  | AW8: of:=[$RESULTADOS.AA24] ->  | AX8: of:=[$RESULTADOS.AB24] ->  | AY8: of:=[$RESULTADOS.AC24] ->  | AZ8: of:=[$RESULTADOS.AD24] ->  | BA8: of:=[$RESULTADOS.AE24] ->  | BB8: of:=[$RESULTADOS.AF24] ->  | BC8: of:=[$RESULTADOS.AG24] ->  | BD8: of:=[$RESULTADOS.D65] ->  | BE8: of:=[$RESULTADOS.E65] ->  | BF8: of:=[$RESULTADOS.F65] ->  | BG8: of:=[$RESULTADOS.G65] ->  | BH8: of:=[$RESULTADOS.H65] ->  | BI8: of:=[$RESULTADOS.I65] ->  | BJ8: of:=[$RESULTADOS.J65] ->  | BK8: of:=[$RESULTADOS.K65] ->  | BL8: of:=[$RESULTADOS.L65] ->  | BM8: of:=[$RESULTADOS.M65] ->  | BN8: of:=[$RESULTADOS.N65] ->  | BO8: of:=[$RESULTADOS.O65] ->  | BP8: of:=[$RESULTADOS.P65] ->  | BQ8: of:=[$RESULTADOS.Q65] ->  | BR8: of:=[$RESULTADOS.R65] ->  | BS8: of:=[$RESULTADOS.S65] ->  | BT8: of:=[$RESULTADOS.T65] ->  | BU8: of:=[$RESULTADOS.U65] ->  | BV8: of:=[$RESULTADOS.V65] ->  | BW8: of:=[$RESULTADOS.W65] -> 
C9: Tipología del sitio web* | D9: of:=[$'01.Definición de ámbito'.C25] -> 0 | E9: DOM | F9: of:=[$'02.Tecnologías'.F11] -> No | G9: of:=[$'02.Tecnologías'.K19] -> 0 | H9: of:=[$'02.Tecnologías'.L19] -> 0 | T9: of:=[$'03.Muestra'.B14] -> 7 | U9: of:=[$'03.Muestra'.C14] -> 0 | V9: of:=[$'03.Muestra'.D14] -> 0 | W9: of:=[$'03.Muestra'.E14] -> 0 | X9: of:=[$'03.Muestra'.F14] ->   | Y9: of:=[$'03.Muestra'.G14] -> 0 | Z9: of:=[$RESULTADOS.D25] ->  | AA9: of:=[$RESULTADOS.E25] ->  | AB9: of:=[$RESULTADOS.F25] ->  | AC9: of:=[$RESULTADOS.G25] ->  | AD9: of:=[$RESULTADOS.H25] ->  | AE9: of:=[$RESULTADOS.I25] ->  | AF9: of:=[$RESULTADOS.J25] ->  | AG9: of:=[$RESULTADOS.K25] ->  | AH9: of:=[$RESULTADOS.L25] ->  | AI9: of:=[$RESULTADOS.M25] ->  | AJ9: of:=[$RESULTADOS.N25] ->  | AK9: of:=[$RESULTADOS.O25] ->  | AL9: of:=[$RESULTADOS.P25] ->  | AM9: of:=[$RESULTADOS.Q25] ->  | AN9: of:=[$RESULTADOS.R25] ->  | AO9: of:=[$RESULTADOS.S25] ->  | AP9: of:=[$RESULTADOS.T25] ->  | AQ9: of:=[$RESULTADOS.U25] ->  | AR9: of:=[$RESULTADOS.V25] ->  | AS9: of:=[$RESULTADOS.W25] ->  | AT9: of:=[$RESULTADOS.X25] ->  | AU9: of:=[$RESULTADOS.Y25] ->  | AV9: of:=[$RESULTADOS.Z25] ->  | AW9: of:=[$RESULTADOS.AA25] ->  | AX9: of:=[$RESULTADOS.AB25] ->  | AY9: of:=[$RESULTADOS.AC25] ->  | AZ9: of:=[$RESULTADOS.AD25] ->  | BA9: of:=[$RESULTADOS.AE25] ->  | BB9: of:=[$RESULTADOS.AF25] ->  | BC9: of:=[$RESULTADOS.AG25] ->  | BD9: of:=[$RESULTADOS.D66] ->  | BE9: of:=[$RESULTADOS.E66] ->  | BF9: of:=[$RESULTADOS.F66] ->  | BG9: of:=[$RESULTADOS.G66] ->  | BH9: of:=[$RESULTADOS.H66] ->  | BI9: of:=[$RESULTADOS.I66] ->  | BJ9: of:=[$RESULTADOS.J66] ->  | BK9: of:=[$RESULTADOS.K66] ->  | BL9: of:=[$RESULTADOS.L66] ->  | BM9: of:=[$RESULTADOS.M66] ->  | BN9: of:=[$RESULTADOS.N66] ->  | BO9: of:=[$RESULTADOS.O66] ->  | BP9: of:=[$RESULTADOS.P66] ->  | BQ9: of:=[$RESULTADOS.Q66] ->  | BR9: of:=[$RESULTADOS.R66] ->  | BS9: of:=[$RESULTADOS.S66] ->  | BT9: of:=[$RESULTADOS.T66] ->  | BU9: of:=[$RESULTADOS.U66] ->  | BV9: of:=[$RESULTADOS.V66] ->  | BW9: of:=[$RESULTADOS.W66] -> 
C10: Nombre Sitio Web* | D10: of:=[$'01.Definición de ámbito'.C27] -> 0 | E10: Flash | F10: of:=[$'02.Tecnologías'.F12] -> No | G10: of:=[$'02.Tecnologías'.K20] -> 0 | H10: of:=[$'02.Tecnologías'.L20] -> 0 | K10: Pestaña RESULTADOS | T10: of:=[$'03.Muestra'.B15] -> 8 | U10: of:=[$'03.Muestra'.C15] -> 0 | V10: of:=[$'03.Muestra'.D15] -> 0 | W10: of:=[$'03.Muestra'.E15] -> 0 | X10: of:=[$'03.Muestra'.F15] ->   | Y10: of:=[$'03.Muestra'.G15] -> 0 | Z10: of:=[$RESULTADOS.D26] ->  | AA10: of:=[$RESULTADOS.E26] ->  | AB10: of:=[$RESULTADOS.F26] ->  | AC10: of:=[$RESULTADOS.G26] ->  | AD10: of:=[$RESULTADOS.H26] ->  | AE10: of:=[$RESULTADOS.I26] ->  | AF10: of:=[$RESULTADOS.J26] ->  | AG10: of:=[$RESULTADOS.K26] ->  | AH10: of:=[$RESULTADOS.L26] ->  | AI10: of:=[$RESULTADOS.M26] ->  | AJ10: of:=[$RESULTADOS.N26] ->  | AK10: of:=[$RESULTADOS.O26] ->  | AL10: of:=[$RESULTADOS.P26] ->  | AM10: of:=[$RESULTADOS.Q26] ->  | AN10: of:=[$RESULTADOS.R26] ->  | AO10: of:=[$RESULTADOS.S26] ->  | AP10: of:=[$RESULTADOS.T26] ->  | AQ10: of:=[$RESULTADOS.U26] ->  | AR10: of:=[$RESULTADOS.V26] ->  | AS10: of:=[$RESULTADOS.W26] ->  | AT10: of:=[$RESULTADOS.X26] ->  | AU10: of:=[$RESULTADOS.Y26] ->  | AV10: of:=[$RESULTADOS.Z26] ->  | AW10: of:=[$RESULTADOS.AA26] ->  | AX10: of:=[$RESULTADOS.AB26] ->  | AY10: of:=[$RESULTADOS.AC26] ->  | AZ10: of:=[$RESULTADOS.AD26] ->  | BA10: of:=[$RESULTADOS.AE26] ->  | BB10: of:=[$RESULTADOS.AF26] ->  | BC10: of:=[$RESULTADOS.AG26] ->  | BD10: of:=[$RESULTADOS.D67] ->  | BE10: of:=[$RESULTADOS.E67] ->  | BF10: of:=[$RESULTADOS.F67] ->  | BG10: of:=[$RESULTADOS.G67] ->  | BH10: of:=[$RESULTADOS.H67] ->  | BI10: of:=[$RESULTADOS.I67] ->  | BJ10: of:=[$RESULTADOS.J67] ->  | BK10: of:=[$RESULTADOS.K67] ->  | BL10: of:=[$RESULTADOS.L67] ->  | BM10: of:=[$RESULTADOS.M67] ->  | BN10: of:=[$RESULTADOS.N67] ->  | BO10: of:=[$RESULTADOS.O67] ->  | BP10: of:=[$RESULTADOS.P67] ->  | BQ10: of:=[$RESULTADOS.Q67] ->  | BR10: of:=[$RESULTADOS.R67] ->  | BS10: of:=[$RESULTADOS.S67] ->  | BT10: of:=[$RESULTADOS.T67] ->  | BU10: of:=[$RESULTADOS.U67] ->  | BV10: of:=[$RESULTADOS.V67] ->  | BW10: of:=[$RESULTADOS.W67] -> 
C11: URL del Sitio Web* | D11: of:=[$'01.Definición de ámbito'.C29] -> 0 | E11: Silverlight | F11: of:=[$'02.Tecnologías'.F13] -> No | G11: of:=[$'02.Tecnologías'.K21] -> 0 | H11: of:=[$'02.Tecnologías'.L21] -> 0 | K11: Resultados agregados | T11: of:=[$'03.Muestra'.B16] -> 9 | U11: of:=[$'03.Muestra'.C16] -> 0 | V11: of:=[$'03.Muestra'.D16] -> 0 | W11: of:=[$'03.Muestra'.E16] -> 0 | X11: of:=[$'03.Muestra'.F16] -> 0 | Y11: of:=[$'03.Muestra'.G16] -> 0 | Z11: of:=[$RESULTADOS.D27] ->  | AA11: of:=[$RESULTADOS.E27] ->  | AB11: of:=[$RESULTADOS.F27] ->  | AC11: of:=[$RESULTADOS.G27] ->  | AD11: of:=[$RESULTADOS.H27] ->  | AE11: of:=[$RESULTADOS.I27] ->  | AF11: of:=[$RESULTADOS.J27] ->  | AG11: of:=[$RESULTADOS.K27] ->  | AH11: of:=[$RESULTADOS.L27] ->  | AI11: of:=[$RESULTADOS.M27] ->  | AJ11: of:=[$RESULTADOS.N27] ->  | AK11: of:=[$RESULTADOS.O27] ->  | AL11: of:=[$RESULTADOS.P27] ->  | AM11: of:=[$RESULTADOS.Q27] ->  | AN11: of:=[$RESULTADOS.R27] ->  | AO11: of:=[$RESULTADOS.S27] ->  | AP11: of:=[$RESULTADOS.T27] ->  | AQ11: of:=[$RESULTADOS.U27] ->  | AR11: of:=[$RESULTADOS.V27] ->  | AS11: of:=[$RESULTADOS.W27] ->  | AT11: of:=[$RESULTADOS.X27] ->  | AU11: of:=[$RESULTADOS.Y27] ->  | AV11: of:=[$RESULTADOS.Z27] ->  | AW11: of:=[$RESULTADOS.AA27] ->  | AX11: of:=[$RESULTADOS.AB27] ->  | AY11: of:=[$RESULTADOS.AC27] ->  | AZ11: of:=[$RESULTADOS.AD27] ->  | BA11: of:=[$RESULTADOS.AE27] ->  | BB11: of:=[$RESULTADOS.AF27] ->  | BC11: of:=[$RESULTADOS.AG27] ->  | BD11: of:=[$RESULTADOS.D68] ->  | BE11: of:=[$RESULTADOS.E68] ->  | BF11: of:=[$RESULTADOS.F68] ->  | BG11: of:=[$RESULTADOS.G68] ->  | BH11: of:=[$RESULTADOS.H68] ->  | BI11: of:=[$RESULTADOS.I68] ->  | BJ11: of:=[$RESULTADOS.J68] ->  | BK11: of:=[$RESULTADOS.K68] ->  | BL11: of:=[$RESULTADOS.L68] ->  | BM11: of:=[$RESULTADOS.M68] ->  | BN11: of:=[$RESULTADOS.N68] ->  | BO11: of:=[$RESULTADOS.O68] ->  | BP11: of:=[$RESULTADOS.P68] ->  | BQ11: of:=[$RESULTADOS.Q68] ->  | BR11: of:=[$RESULTADOS.R68] ->  | BS11: of:=[$RESULTADOS.S68] ->  | BT11: of:=[$RESULTADOS.T68] ->  | BU11: of:=[$RESULTADOS.U68] ->  | BV11: of:=[$RESULTADOS.V68] ->  | BW11: of:=[$RESULTADOS.W68] -> 
C12: Alcance de la revisión* | D12: of:=[$'01.Definición de ámbito'.C31] -> 0 | E12: OOXML | F12: of:=[$'02.Tecnologías'.I9] -> No | G12: of:=[$'02.Tecnologías'.K22] -> 0 | H12: of:=[$'02.Tecnologías'.L22] -> 0 | K12: Criterios de conformidad | L12: Conforme | M12: No conforme | N12: No aplica | O12: Error | P12: En curso | T12: of:=[$'03.Muestra'.B17] -> 10 | U12: of:=[$'03.Muestra'.C17] -> 0 | V12: of:=[$'03.Muestra'.D17] -> 0 | W12: of:=[$'03.Muestra'.E17] -> 0 | X12: of:=[$'03.Muestra'.F17] ->   | Y12: of:=[$'03.Muestra'.G17] -> 0 | Z12: of:=[$RESULTADOS.D28] ->  | AA12: of:=[$RESULTADOS.E28] ->  | AB12: of:=[$RESULTADOS.F28] ->  | AC12: of:=[$RESULTADOS.G28] ->  | AD12: of:=[$RESULTADOS.H28] ->  | AE12: of:=[$RESULTADOS.I28] ->  | AF12: of:=[$RESULTADOS.J28] ->  | AG12: of:=[$RESULTADOS.K28] ->  | AH12: of:=[$RESULTADOS.L28] ->  | AI12: of:=[$RESULTADOS.M28] ->  | AJ12: of:=[$RESULTADOS.N28] ->  | AK12: of:=[$RESULTADOS.O28] ->  | AL12: of:=[$RESULTADOS.P28] ->  | AM12: of:=[$RESULTADOS.Q28] ->  | AN12: of:=[$RESULTADOS.R28] ->  | AO12: of:=[$RESULTADOS.S28] ->  | AP12: of:=[$RESULTADOS.T28] ->  | AQ12: of:=[$RESULTADOS.U28] ->  | AR12: of:=[$RESULTADOS.V28] ->  | AS12: of:=[$RESULTADOS.W28] ->  | AT12: of:=[$RESULTADOS.X28] ->  | AU12: of:=[$RESULTADOS.Y28] ->  | AV12: of:=[$RESULTADOS.Z28] ->  | AW12: of:=[$RESULTADOS.AA28] ->  | AX12: of:=[$RESULTADOS.AB28] ->  | AY12: of:=[$RESULTADOS.AC28] ->  | AZ12: of:=[$RESULTADOS.AD28] ->  | BA12: of:=[$RESULTADOS.AE28] ->  | BB12: of:=[$RESULTADOS.AF28] ->  | BC12: of:=[$RESULTADOS.AG28] ->  | BD12: of:=[$RESULTADOS.D69] ->  | BE12: of:=[$RESULTADOS.E69] ->  | BF12: of:=[$RESULTADOS.F69] ->  | BG12: of:=[$RESULTADOS.G69] ->  | BH12: of:=[$RESULTADOS.H69] ->  | BI12: of:=[$RESULTADOS.I69] ->  | BJ12: of:=[$RESULTADOS.J69] ->  | BK12: of:=[$RESULTADOS.K69] ->  | BL12: of:=[$RESULTADOS.L69] ->  | BM12: of:=[$RESULTADOS.M69] ->  | BN12: of:=[$RESULTADOS.N69] ->  | BO12: of:=[$RESULTADOS.O69] ->  | BP12: of:=[$RESULTADOS.P69] ->  | BQ12: of:=[$RESULTADOS.Q69] ->  | BR12: of:=[$RESULTADOS.R69] ->  | BS12: of:=[$RESULTADOS.S69] ->  | BT12: of:=[$RESULTADOS.T69] ->  | BU12: of:=[$RESULTADOS.U69] ->  | BV12: of:=[$RESULTADOS.V69] ->  | BW12: of:=[$RESULTADOS.W69] -> 
C13: Funcionalidad esencial del sitio web* | D13: of:=[$'01.Definición de ámbito'.C33] -> 0 | E13: ODF 1.2 | F13: of:=[$'02.Tecnologías'.I10] -> No | G13: of:=[$'02.Tecnologías'.K23] -> 0 | H13: of:=[$'02.Tecnologías'.L23] -> 0 | K13: A | L13: of:=[$RESULTADOS.D8] -> 0 | M13: of:=[$RESULTADOS.E8] -> 0 | N13: of:=[$RESULTADOS.F8] -> 0 | O13: of:=[$RESULTADOS.G8] -> 0 | P13: of:=[$RESULTADOS.H8] -> 0 | T13: of:=[$'03.Muestra'.B18] -> 11 | U13: of:=[$'03.Muestra'.C18] -> 0 | V13: of:=[$'03.Muestra'.D18] -> 0 | W13: of:=[$'03.Muestra'.E18] -> 0 | X13: of:=[$'03.Muestra'.F18] ->   | Y13: of:=[$'03.Muestra'.G18] -> 0 | Z13: of:=[$RESULTADOS.D29] ->  | AA13: of:=[$RESULTADOS.E29] ->  | AB13: of:=[$RESULTADOS.F29] ->  | AC13: of:=[$RESULTADOS.G29] ->  | AD13: of:=[$RESULTADOS.H29] ->  | AE13: of:=[$RESULTADOS.I29] ->  | AF13: of:=[$RESULTADOS.J29] ->  | AG13: of:=[$RESULTADOS.K29] ->  | AH13: of:=[$RESULTADOS.L29] ->  | AI13: of:=[$RESULTADOS.M29] ->  | AJ13: of:=[$RESULTADOS.N29] ->  | AK13: of:=[$RESULTADOS.O29] ->  | AL13: of:=[$RESULTADOS.P29] ->  | AM13: of:=[$RESULTADOS.Q29] ->  | AN13: of:=[$RESULTADOS.R29] ->  | AO13: of:=[$RESULTADOS.S29] ->  | AP13: of:=[$RESULTADOS.T29] ->  | AQ13: of:=[$RESULTADOS.U29] ->  | AR13: of:=[$RESULTADOS.V29] ->  | AS13: of:=[$RESULTADOS.W29] ->  | AT13: of:=[$RESULTADOS.X29] ->  | AU13: of:=[$RESULTADOS.Y29] ->  | AV13: of:=[$RESULTADOS.Z29] ->  | AW13: of:=[$RESULTADOS.AA29] ->  | AX13: of:=[$RESULTADOS.AB29] ->  | AY13: of:=[$RESULTADOS.AC29] ->  | AZ13: of:=[$RESULTADOS.AD29] ->  | BA13: of:=[$RESULTADOS.AE29] ->  | BB13: of:=[$RESULTADOS.AF29] ->  | BC13: of:=[$RESULTADOS.AG29] ->  | BD13: of:=[$RESULTADOS.D70] ->  | BE13: of:=[$RESULTADOS.E70] ->  | BF13: of:=[$RESULTADOS.F70] ->  | BG13: of:=[$RESULTADOS.G70] ->  | BH13: of:=[$RESULTADOS.H70] ->  | BI13: of:=[$RESULTADOS.I70] ->  | BJ13: of:=[$RESULTADOS.J70] ->  | BK13: of:=[$RESULTADOS.K70] ->  | BL13: of:=[$RESULTADOS.L70] ->  | BM13: of:=[$RESULTADOS.M70] ->  | BN13: of:=[$RESULTADOS.N70] ->  | BO13: of:=[$RESULTADOS.O70] ->  | BP13: of:=[$RESULTADOS.P70] ->  | BQ13: of:=[$RESULTADOS.Q70] ->  | BR13: of:=[$RESULTADOS.R70] ->  | BS13: of:=[$RESULTADOS.S70] ->  | BT13: of:=[$RESULTADOS.T70] ->  | BU13: of:=[$RESULTADOS.U70] ->  | BV13: of:=[$RESULTADOS.V70] ->  | BW13: of:=[$RESULTADOS.W70] -> 
C14: Fecha de la revisión* | D14: of:=[$'01.Definición de ámbito'.C35] -> 0 | E14: SVG | F14: of:=[$'02.Tecnologías'.I11] -> No | K14: AA | L14: of:=[$RESULTADOS.D9] -> 0 | M14: of:=[$RESULTADOS.E9] -> 0 | N14: of:=[$RESULTADOS.F9] -> 0 | O14: of:=[$RESULTADOS.G9] -> 0 | P14: of:=[$RESULTADOS.H9] -> 0 | T14: of:=[$'03.Muestra'.B19] -> 12 | U14: of:=[$'03.Muestra'.C19] -> 0 | V14: of:=[$'03.Muestra'.D19] -> 0 | W14: of:=[$'03.Muestra'.E19] -> 0 | X14: of:=[$'03.Muestra'.F19] ->   | Y14: of:=[$'03.Muestra'.G19] -> 0 | Z14: of:=[$RESULTADOS.D30] ->  | AA14: of:=[$RESULTADOS.E30] ->  | AB14: of:=[$RESULTADOS.F30] ->  | AC14: of:=[$RESULTADOS.G30] ->  | AD14: of:=[$RESULTADOS.H30] ->  | AE14: of:=[$RESULTADOS.I30] ->  | AF14: of:=[$RESULTADOS.J30] ->  | AG14: of:=[$RESULTADOS.K30] ->  | AH14: of:=[$RESULTADOS.L30] ->  | AI14: of:=[$RESULTADOS.M30] ->  | AJ14: of:=[$RESULTADOS.N30] ->  | AK14: of:=[$RESULTADOS.O30] ->  | AL14: of:=[$RESULTADOS.P30] ->  | AM14: of:=[$RESULTADOS.Q30] ->  | AN14: of:=[$RESULTADOS.R30] ->  | AO14: of:=[$RESULTADOS.S30] ->  | AP14: of:=[$RESULTADOS.T30] ->  | AQ14: of:=[$RESULTADOS.U30] ->  | AR14: of:=[$RESULTADOS.V30] ->  | AS14: of:=[$RESULTADOS.W30] ->  | AT14: of:=[$RESULTADOS.X30] ->  | AU14: of:=[$RESULTADOS.Y30] ->  | AV14: of:=[$RESULTADOS.Z30] ->  | AW14: of:=[$RESULTADOS.AA30] ->  | AX14: of:=[$RESULTADOS.AB30] ->  | AY14: of:=[$RESULTADOS.AC30] ->  | AZ14: of:=[$RESULTADOS.AD30] ->  | BA14: of:=[$RESULTADOS.AE30] ->  | BB14: of:=[$RESULTADOS.AF30] ->  | BC14: of:=[$RESULTADOS.AG30] ->  | BD14: of:=[$RESULTADOS.D71] ->  | BE14: of:=[$RESULTADOS.E71] ->  | BF14: of:=[$RESULTADOS.F71] ->  | BG14: of:=[$RESULTADOS.G71] ->  | BH14: of:=[$RESULTADOS.H71] ->  | BI14: of:=[$RESULTADOS.I71] ->  | BJ14: of:=[$RESULTADOS.J71] ->  | BK14: of:=[$RESULTADOS.K71] ->  | BL14: of:=[$RESULTADOS.L71] ->  | BM14: of:=[$RESULTADOS.M71] ->  | BN14: of:=[$RESULTADOS.N71] ->  | BO14: of:=[$RESULTADOS.O71] ->  | BP14: of:=[$RESULTADOS.P71] ->  | BQ14: of:=[$RESULTADOS.Q71] ->  | BR14: of:=[$RESULTADOS.R71] ->  | BS14: of:=[$RESULTADOS.S71] ->  | BT14: of:=[$RESULTADOS.T71] ->  | BU14: of:=[$RESULTADOS.U71] ->  | BV14: of:=[$RESULTADOS.V71] ->  | BW14: of:=[$RESULTADOS.W71] -> 
C15: Nivel de conformidad a analizar* | D15: of:=[$'01.Definición de ámbito'.C39] -> UNE-EN 301549 : 2019 - AA WCAG 2.1 (excluyendo el contenido excluido por el RD 1112/2018) | E15: OTRAS | F15: of:=[$'02.Tecnologías'.I12] -> No | K15: TOTAL | L15: of:=[$RESULTADOS.D10] -> 0 (0 %) | M15: of:=[$RESULTADOS.E10] -> 0 (0 %) | N15: of:=[$RESULTADOS.F10] -> 0 (0 %) | O15: of:=[$RESULTADOS.G10] -> 0 | P15: of:=[$RESULTADOS.H10] -> 0 | T15: of:=[$'03.Muestra'.B20] -> 13 | U15: of:=[$'03.Muestra'.C20] -> 0 | V15: of:=[$'03.Muestra'.D20] -> 0 | W15: of:=[$'03.Muestra'.E20] -> 0 | X15: of:=[$'03.Muestra'.F20] -> 0 | Y15: of:=[$'03.Muestra'.G20] -> 0 | Z15: of:=[$RESULTADOS.D31] ->  | AA15: of:=[$RESULTADOS.E31] ->  | AB15: of:=[$RESULTADOS.F31] ->  | AC15: of:=[$RESULTADOS.G31] ->  | AD15: of:=[$RESULTADOS.H31] ->  | AE15: of:=[$RESULTADOS.I31] ->  | AF15: of:=[$RESULTADOS.J31] ->  | AG15: of:=[$RESULTADOS.K31] ->  | AH15: of:=[$RESULTADOS.L31] ->  | AI15: of:=[$RESULTADOS.M31] ->  | AJ15: of:=[$RESULTADOS.N31] ->  | AK15: of:=[$RESULTADOS.O31] ->  | AL15: of:=[$RESULTADOS.P31] ->  | AM15: of:=[$RESULTADOS.Q31] ->  | AN15: of:=[$RESULTADOS.R31] ->  | AO15: of:=[$RESULTADOS.S31] ->  | AP15: of:=[$RESULTADOS.T31] ->  | AQ15: of:=[$RESULTADOS.U31] ->  | AR15: of:=[$RESULTADOS.V31] ->  | AS15: of:=[$RESULTADOS.W31] ->  | AT15: of:=[$RESULTADOS.X31] ->  | AU15: of:=[$RESULTADOS.Y31] ->  | AV15: of:=[$RESULTADOS.Z31] ->  | AW15: of:=[$RESULTADOS.AA31] ->  | AX15: of:=[$RESULTADOS.AB31] ->  | AY15: of:=[$RESULTADOS.AC31] ->  | AZ15: of:=[$RESULTADOS.AD31] ->  | BA15: of:=[$RESULTADOS.AE31] ->  | BB15: of:=[$RESULTADOS.AF31] ->  | BC15: of:=[$RESULTADOS.AG31] ->  | BD15: of:=[$RESULTADOS.D72] ->  | BE15: of:=[$RESULTADOS.E72] ->  | BF15: of:=[$RESULTADOS.F72] ->  | BG15: of:=[$RESULTADOS.G72] ->  | BH15: of:=[$RESULTADOS.H72] ->  | BI15: of:=[$RESULTADOS.I72] ->  | BJ15: of:=[$RESULTADOS.J72] ->  | BK15: of:=[$RESULTADOS.K72] ->  | BL15: of:=[$RESULTADOS.L72] ->  | BM15: of:=[$RESULTADOS.M72] ->  | BN15: of:=[$RESULTADOS.N72] ->  | BO15: of:=[$RESULTADOS.O72] ->  | BP15: of:=[$RESULTADOS.P72] ->  | BQ15: of:=[$RESULTADOS.Q72] ->  | BR15: of:=[$RESULTADOS.R72] ->  | BS15: of:=[$RESULTADOS.S72] ->  | BT15: of:=[$RESULTADOS.T72] ->  | BU15: of:=[$RESULTADOS.U72] ->  | BV15: of:=[$RESULTADOS.V72] ->  | BW15: of:=[$RESULTADOS.W72] -> 
C16: Soporte de accesibilidad mínimo* | D16: of:=[$'01.Definición de ámbito'.C41] -> 0 | T16: of:=[$'03.Muestra'.B21] -> 14 | U16: of:=[$'03.Muestra'.C21] -> 0 | V16: of:=[$'03.Muestra'.D21] -> 0 | W16: of:=[$'03.Muestra'.E21] -> 0 | X16: of:=[$'03.Muestra'.F21] -> 0 | Y16: of:=[$'03.Muestra'.G21] -> 0 | Z16: of:=[$RESULTADOS.D32] ->  | AA16: of:=[$RESULTADOS.E32] ->  | AB16: of:=[$RESULTADOS.F32] ->  | AC16: of:=[$RESULTADOS.G32] ->  | AD16: of:=[$RESULTADOS.H32] ->  | AE16: of:=[$RESULTADOS.I32] ->  | AF16: of:=[$RESULTADOS.J32] ->  | AG16: of:=[$RESULTADOS.K32] ->  | AH16: of:=[$RESULTADOS.L32] ->  | AI16: of:=[$RESULTADOS.M32] ->  | AJ16: of:=[$RESULTADOS.N32] ->  | AK16: of:=[$RESULTADOS.O32] ->  | AL16: of:=[$RESULTADOS.P32] ->  | AM16: of:=[$RESULTADOS.Q32] ->  | AN16: of:=[$RESULTADOS.R32] ->  | AO16: of:=[$RESULTADOS.S32] ->  | AP16: of:=[$RESULTADOS.T32] ->  | AQ16: of:=[$RESULTADOS.U32] ->  | AR16: of:=[$RESULTADOS.V32] ->  | AS16: of:=[$RESULTADOS.W32] ->  | AT16: of:=[$RESULTADOS.X32] ->  | AU16: of:=[$RESULTADOS.Y32] ->  | AV16: of:=[$RESULTADOS.Z32] ->  | AW16: of:=[$RESULTADOS.AA32] ->  | AX16: of:=[$RESULTADOS.AB32] ->  | AY16: of:=[$RESULTADOS.AC32] ->  | AZ16: of:=[$RESULTADOS.AD32] ->  | BA16: of:=[$RESULTADOS.AE32] ->  | BB16: of:=[$RESULTADOS.AF32] ->  | BC16: of:=[$RESULTADOS.AG32] ->  | BD16: of:=[$RESULTADOS.D73] ->  | BE16: of:=[$RESULTADOS.E73] ->  | BF16: of:=[$RESULTADOS.F73] ->  | BG16: of:=[$RESULTADOS.G73] ->  | BH16: of:=[$RESULTADOS.H73] ->  | BI16: of:=[$RESULTADOS.I73] ->  | BJ16: of:=[$RESULTADOS.J73] ->  | BK16: of:=[$RESULTADOS.K73] ->  | BL16: of:=[$RESULTADOS.L73] ->  | BM16: of:=[$RESULTADOS.M73] ->  | BN16: of:=[$RESULTADOS.N73] ->  | BO16: of:=[$RESULTADOS.O73] ->  | BP16: of:=[$RESULTADOS.P73] ->  | BQ16: of:=[$RESULTADOS.Q73] ->  | BR16: of:=[$RESULTADOS.R73] ->  | BS16: of:=[$RESULTADOS.S73] ->  | BT16: of:=[$RESULTADOS.T73] ->  | BU16: of:=[$RESULTADOS.U73] ->  | BV16: of:=[$RESULTADOS.V73] ->  | BW16: of:=[$RESULTADOS.W73] -> 
C17: Ámbito territorial* | D17: of:=[$'01.Definición de ámbito'.C45] -> 0 | K17: Evaluado | T17: of:=[$'03.Muestra'.B22] -> 15 | U17: of:=[$'03.Muestra'.C22] -> 0 | V17: of:=[$'03.Muestra'.D22] -> 0 | W17: of:=[$'03.Muestra'.E22] -> 0 | X17: of:=[$'03.Muestra'.F22] -> 0 | Y17: of:=[$'03.Muestra'.G22] -> 0 | Z17: of:=[$RESULTADOS.D33] ->  | AA17: of:=[$RESULTADOS.E33] ->  | AB17: of:=[$RESULTADOS.F33] ->  | AC17: of:=[$RESULTADOS.G33] ->  | AD17: of:=[$RESULTADOS.H33] ->  | AE17: of:=[$RESULTADOS.I33] ->  | AF17: of:=[$RESULTADOS.J33] ->  | AG17: of:=[$RESULTADOS.K33] ->  | AH17: of:=[$RESULTADOS.L33] ->  | AI17: of:=[$RESULTADOS.M33] ->  | AJ17: of:=[$RESULTADOS.N33] ->  | AK17: of:=[$RESULTADOS.O33] ->  | AL17: of:=[$RESULTADOS.P33] ->  | AM17: of:=[$RESULTADOS.Q33] ->  | AN17: of:=[$RESULTADOS.R33] ->  | AO17: of:=[$RESULTADOS.S33] ->  | AP17: of:=[$RESULTADOS.T33] ->  | AQ17: of:=[$RESULTADOS.U33] ->  | AR17: of:=[$RESULTADOS.V33] ->  | AS17: of:=[$RESULTADOS.W33] ->  | AT17: of:=[$RESULTADOS.X33] ->  | AU17: of:=[$RESULTADOS.Y33] ->  | AV17: of:=[$RESULTADOS.Z33] ->  | AW17: of:=[$RESULTADOS.AA33] ->  | AX17: of:=[$RESULTADOS.AB33] ->  | AY17: of:=[$RESULTADOS.AC33] ->  | AZ17: of:=[$RESULTADOS.AD33] ->  | BA17: of:=[$RESULTADOS.AE33] ->  | BB17: of:=[$RESULTADOS.AF33] ->  | BC17: of:=[$RESULTADOS.AG33] ->  | BD17: of:=[$RESULTADOS.D74] ->  | BE17: of:=[$RESULTADOS.E74] ->  | BF17: of:=[$RESULTADOS.F74] ->  | BG17: of:=[$RESULTADOS.G74] ->  | BH17: of:=[$RESULTADOS.H74] ->  | BI17: of:=[$RESULTADOS.I74] ->  | BJ17: of:=[$RESULTADOS.J74] ->  | BK17: of:=[$RESULTADOS.K74] ->  | BL17: of:=[$RESULTADOS.L74] ->  | BM17: of:=[$RESULTADOS.M74] ->  | BN17: of:=[$RESULTADOS.N74] ->  | BO17: of:=[$RESULTADOS.O74] ->  | BP17: of:=[$RESULTADOS.P74] ->  | BQ17: of:=[$RESULTADOS.Q74] ->  | BR17: of:=[$RESULTADOS.R74] ->  | BS17: of:=[$RESULTADOS.S74] ->  | BT17: of:=[$RESULTADOS.T74] ->  | BU17: of:=[$RESULTADOS.U74] ->  | BV17: of:=[$RESULTADOS.V74] ->  | BW17: of:=[$RESULTADOS.W74] -> 
C18: Educación | D18: of:=[$'01.Definición de ámbito'.D48] -> No | K18: Pasa | L18: of:=[$RESULTADOS.K8] -> 0 | M18: of:=[$RESULTADOS.L8] -> 0 | T18: of:=[$'03.Muestra'.B23] -> 16 | U18: of:=[$'03.Muestra'.C23] -> 0 | V18: of:=[$'03.Muestra'.D23] -> 0 | W18: of:=[$'03.Muestra'.E23] -> 0 | X18: of:=[$'03.Muestra'.F23] -> 0 | Y18: of:=[$'03.Muestra'.G23] -> 0 | Z18: of:=[$RESULTADOS.D34] ->  | AA18: of:=[$RESULTADOS.E34] ->  | AB18: of:=[$RESULTADOS.F34] ->  | AC18: of:=[$RESULTADOS.G34] ->  | AD18: of:=[$RESULTADOS.H34] ->  | AE18: of:=[$RESULTADOS.I34] ->  | AF18: of:=[$RESULTADOS.J34] ->  | AG18: of:=[$RESULTADOS.K34] ->  | AH18: of:=[$RESULTADOS.L34] ->  | AI18: of:=[$RESULTADOS.M34] ->  | AJ18: of:=[$RESULTADOS.N34] ->  | AK18: of:=[$RESULTADOS.O34] ->  | AL18: of:=[$RESULTADOS.P34] ->  | AM18: of:=[$RESULTADOS.Q34] ->  | AN18: of:=[$RESULTADOS.R34] ->  | AO18: of:=[$RESULTADOS.S34] ->  | AP18: of:=[$RESULTADOS.T34] ->  | AQ18: of:=[$RESULTADOS.U34] ->  | AR18: of:=[$RESULTADOS.V34] ->  | AS18: of:=[$RESULTADOS.W34] ->  | AT18: of:=[$RESULTADOS.X34] ->  | AU18: of:=[$RESULTADOS.Y34] ->  | AV18: of:=[$RESULTADOS.Z34] ->  | AW18: of:=[$RESULTADOS.AA34] ->  | AX18: of:=[$RESULTADOS.AB34] ->  | AY18: of:=[$RESULTADOS.AC34] ->  | AZ18: of:=[$RESULTADOS.AD34] ->  | BA18: of:=[$RESULTADOS.AE34] ->  | BB18: of:=[$RESULTADOS.AF34] ->  | BC18: of:=[$RESULTADOS.AG34] ->  | BD18: of:=[$RESULTADOS.D75] ->  | BE18: of:=[$RESULTADOS.E75] ->  | BF18: of:=[$RESULTADOS.F75] ->  | BG18: of:=[$RESULTADOS.G75] ->  | BH18: of:=[$RESULTADOS.H75] ->  | BI18: of:=[$RESULTADOS.I75] ->  | BJ18: of:=[$RESULTADOS.J75] ->  | BK18: of:=[$RESULTADOS.K75] ->  | BL18: of:=[$RESULTADOS.L75] ->  | BM18: of:=[$RESULTADOS.M75] ->  | BN18: of:=[$RESULTADOS.N75] ->  | BO18: of:=[$RESULTADOS.O75] ->  | BP18: of:=[$RESULTADOS.P75] ->  | BQ18: of:=[$RESULTADOS.Q75] ->  | BR18: of:=[$RESULTADOS.R75] ->  | BS18: of:=[$RESULTADOS.S75] ->  | BT18: of:=[$RESULTADOS.T75] ->  | BU18: of:=[$RESULTADOS.U75] ->  | BV18: of:=[$RESULTADOS.V75] ->  | BW18: of:=[$RESULTADOS.W75] -> 
C19: Empleo | D19: of:=[$'01.Definición de ámbito'.D49] -> No | K19: Falla | L19: of:=[$RESULTADOS.K9] -> 0 | M19: of:=[$RESULTADOS.L9] -> 0 | T19: of:=[$'03.Muestra'.B24] -> 17 | U19: of:=[$'03.Muestra'.C24] -> 0 | V19: of:=[$'03.Muestra'.D24] -> 0 | W19: of:=[$'03.Muestra'.E24] -> 0 | X19: of:=[$'03.Muestra'.F24] -> 0 | Y19: of:=[$'03.Muestra'.G24] -> 0 | Z19: of:=[$RESULTADOS.D35] ->  | AA19: of:=[$RESULTADOS.E35] ->  | AB19: of:=[$RESULTADOS.F35] ->  | AC19: of:=[$RESULTADOS.G35] ->  | AD19: of:=[$RESULTADOS.H35] ->  | AE19: of:=[$RESULTADOS.I35] ->  | AF19: of:=[$RESULTADOS.J35] ->  | AG19: of:=[$RESULTADOS.K35] ->  | AH19: of:=[$RESULTADOS.L35] ->  | AI19: of:=[$RESULTADOS.M35] ->  | AJ19: of:=[$RESULTADOS.N35] ->  | AK19: of:=[$RESULTADOS.O35] ->  | AL19: of:=[$RESULTADOS.P35] ->  | AM19: of:=[$RESULTADOS.Q35] ->  | AN19: of:=[$RESULTADOS.R35] ->  | AO19: of:=[$RESULTADOS.S35] ->  | AP19: of:=[$RESULTADOS.T35] ->  | AQ19: of:=[$RESULTADOS.U35] ->  | AR19: of:=[$RESULTADOS.V35] ->  | AS19: of:=[$RESULTADOS.W35] ->  | AT19: of:=[$RESULTADOS.X35] ->  | AU19: of:=[$RESULTADOS.Y35] ->  | AV19: of:=[$RESULTADOS.Z35] ->  | AW19: of:=[$RESULTADOS.AA35] ->  | AX19: of:=[$RESULTADOS.AB35] ->  | AY19: of:=[$RESULTADOS.AC35] ->  | AZ19: of:=[$RESULTADOS.AD35] ->  | BA19: of:=[$RESULTADOS.AE35] ->  | BB19: of:=[$RESULTADOS.AF35] ->  | BC19: of:=[$RESULTADOS.AG35] ->  | BD19: of:=[$RESULTADOS.D76] ->  | BE19: of:=[$RESULTADOS.E76] ->  | BF19: of:=[$RESULTADOS.F76] ->  | BG19: of:=[$RESULTADOS.G76] ->  | BH19: of:=[$RESULTADOS.H76] ->  | BI19: of:=[$RESULTADOS.I76] ->  | BJ19: of:=[$RESULTADOS.J76] ->  | BK19: of:=[$RESULTADOS.K76] ->  | BL19: of:=[$RESULTADOS.L76] ->  | BM19: of:=[$RESULTADOS.M76] ->  | BN19: of:=[$RESULTADOS.N76] ->  | BO19: of:=[$RESULTADOS.O76] ->  | BP19: of:=[$RESULTADOS.P76] ->  | BQ19: of:=[$RESULTADOS.Q76] ->  | BR19: of:=[$RESULTADOS.R76] ->  | BS19: of:=[$RESULTADOS.S76] ->  | BT19: of:=[$RESULTADOS.T76] ->  | BU19: of:=[$RESULTADOS.U76] ->  | BV19: of:=[$RESULTADOS.V76] ->  | BW19: of:=[$RESULTADOS.W76] -> 
C20: Hacienda | D20: of:=[$'01.Definición de ámbito'.D50] -> No | K20: No aplica | L20: of:=[$RESULTADOS.K10] -> 0 | M20: of:=[$RESULTADOS.L10] -> 0 | T20: of:=[$'03.Muestra'.B25] -> 18 | U20: of:=[$'03.Muestra'.C25] -> 0 | V20: of:=[$'03.Muestra'.D25] -> 0 | W20: of:=[$'03.Muestra'.E25] -> 0 | X20: of:=[$'03.Muestra'.F25] -> 0 | Y20: of:=[$'03.Muestra'.G25] -> 0 | Z20: of:=[$RESULTADOS.D36] ->  | AA20: of:=[$RESULTADOS.E36] ->  | AB20: of:=[$RESULTADOS.F36] ->  | AC20: of:=[$RESULTADOS.G36] ->  | AD20: of:=[$RESULTADOS.H36] ->  | AE20: of:=[$RESULTADOS.I36] ->  | AF20: of:=[$RESULTADOS.J36] ->  | AG20: of:=[$RESULTADOS.K36] ->  | AH20: of:=[$RESULTADOS.L36] ->  | AI20: of:=[$RESULTADOS.M36] ->  | AJ20: of:=[$RESULTADOS.N36] ->  | AK20: of:=[$RESULTADOS.O36] ->  | AL20: of:=[$RESULTADOS.P36] ->  | AM20: of:=[$RESULTADOS.Q36] ->  | AN20: of:=[$RESULTADOS.R36] ->  | AO20: of:=[$RESULTADOS.S36] ->  | AP20: of:=[$RESULTADOS.T36] ->  | AQ20: of:=[$RESULTADOS.U36] ->  | AR20: of:=[$RESULTADOS.V36] ->  | AS20: of:=[$RESULTADOS.W36] ->  | AT20: of:=[$RESULTADOS.X36] ->  | AU20: of:=[$RESULTADOS.Y36] ->  | AV20: of:=[$RESULTADOS.Z36] ->  | AW20: of:=[$RESULTADOS.AA36] ->  | AX20: of:=[$RESULTADOS.AB36] ->  | AY20: of:=[$RESULTADOS.AC36] ->  | AZ20: of:=[$RESULTADOS.AD36] ->  | BA20: of:=[$RESULTADOS.AE36] ->  | BB20: of:=[$RESULTADOS.AF36] ->  | BC20: of:=[$RESULTADOS.AG36] ->  | BD20: of:=[$RESULTADOS.D77] ->  | BE20: of:=[$RESULTADOS.E77] ->  | BF20: of:=[$RESULTADOS.F77] ->  | BG20: of:=[$RESULTADOS.G77] ->  | BH20: of:=[$RESULTADOS.H77] ->  | BI20: of:=[$RESULTADOS.I77] ->  | BJ20: of:=[$RESULTADOS.J77] ->  | BK20: of:=[$RESULTADOS.K77] ->  | BL20: of:=[$RESULTADOS.L77] ->  | BM20: of:=[$RESULTADOS.M77] ->  | BN20: of:=[$RESULTADOS.N77] ->  | BO20: of:=[$RESULTADOS.O77] ->  | BP20: of:=[$RESULTADOS.P77] ->  | BQ20: of:=[$RESULTADOS.Q77] ->  | BR20: of:=[$RESULTADOS.R77] ->  | BS20: of:=[$RESULTADOS.S77] ->  | BT20: of:=[$RESULTADOS.T77] ->  | BU20: of:=[$RESULTADOS.U77] ->  | BV20: of:=[$RESULTADOS.V77] ->  | BW20: of:=[$RESULTADOS.W77] -> 
C21: Medio Ambiente | D21: of:=[$'01.Definición de ámbito'.D51] -> No | K21: TOTAL | L21: of:=[$RESULTADOS.K11] -> 0 | M21: of:=[$RESULTADOS.L11] -> 0 | T21: of:=[$'03.Muestra'.B26] -> 19 | U21: of:=[$'03.Muestra'.C26] -> 0 | V21: of:=[$'03.Muestra'.D26] -> 0 | W21: of:=[$'03.Muestra'.E26] -> 0 | X21: of:=[$'03.Muestra'.F26] -> 0 | Y21: of:=[$'03.Muestra'.G26] -> 0 | Z21: of:=[$RESULTADOS.D37] ->  | AA21: of:=[$RESULTADOS.E37] ->  | AB21: of:=[$RESULTADOS.F37] ->  | AC21: of:=[$RESULTADOS.G37] ->  | AD21: of:=[$RESULTADOS.H37] ->  | AE21: of:=[$RESULTADOS.I37] ->  | AF21: of:=[$RESULTADOS.J37] ->  | AG21: of:=[$RESULTADOS.K37] ->  | AH21: of:=[$RESULTADOS.L37] ->  | AI21: of:=[$RESULTADOS.M37] ->  | AJ21: of:=[$RESULTADOS.N37] ->  | AK21: of:=[$RESULTADOS.O37] ->  | AL21: of:=[$RESULTADOS.P37] ->  | AM21: of:=[$RESULTADOS.Q37] ->  | AN21: of:=[$RESULTADOS.R37] ->  | AO21: of:=[$RESULTADOS.S37] ->  | AP21: of:=[$RESULTADOS.T37] ->  | AQ21: of:=[$RESULTADOS.U37] ->  | AR21: of:=[$RESULTADOS.V37] ->  | AS21: of:=[$RESULTADOS.W37] ->  | AT21: of:=[$RESULTADOS.X37] ->  | AU21: of:=[$RESULTADOS.Y37] ->  | AV21: of:=[$RESULTADOS.Z37] ->  | AW21: of:=[$RESULTADOS.AA37] ->  | AX21: of:=[$RESULTADOS.AB37] ->  | AY21: of:=[$RESULTADOS.AC37] ->  | AZ21: of:=[$RESULTADOS.AD37] ->  | BA21: of:=[$RESULTADOS.AE37] ->  | BB21: of:=[$RESULTADOS.AF37] ->  | BC21: of:=[$RESULTADOS.AG37] ->  | BD21: of:=[$RESULTADOS.D78] ->  | BE21: of:=[$RESULTADOS.E78] ->  | BF21: of:=[$RESULTADOS.F78] ->  | BG21: of:=[$RESULTADOS.G78] ->  | BH21: of:=[$RESULTADOS.H78] ->  | BI21: of:=[$RESULTADOS.I78] ->  | BJ21: of:=[$RESULTADOS.J78] ->  | BK21: of:=[$RESULTADOS.K78] ->  | BL21: of:=[$RESULTADOS.L78] ->  | BM21: of:=[$RESULTADOS.M78] ->  | BN21: of:=[$RESULTADOS.N78] ->  | BO21: of:=[$RESULTADOS.O78] ->  | BP21: of:=[$RESULTADOS.P78] ->  | BQ21: of:=[$RESULTADOS.Q78] ->  | BR21: of:=[$RESULTADOS.R78] ->  | BS21: of:=[$RESULTADOS.S78] ->  | BT21: of:=[$RESULTADOS.T78] ->  | BU21: of:=[$RESULTADOS.U78] ->  | BV21: of:=[$RESULTADOS.V78] ->  | BW21: of:=[$RESULTADOS.W78] -> 
C22: Ocio y Cultura | D22: of:=[$'01.Definición de ámbito'.D52] -> No | T22: of:=[$'03.Muestra'.B27] -> 20 | U22: of:=[$'03.Muestra'.C27] -> 0 | V22: of:=[$'03.Muestra'.D27] -> 0 | W22: of:=[$'03.Muestra'.E27] -> 0 | X22: of:=[$'03.Muestra'.F27] -> 0 | Y22: of:=[$'03.Muestra'.G27] -> 0 | Z22: of:=[$RESULTADOS.D38] ->  | AA22: of:=[$RESULTADOS.E38] ->  | AB22: of:=[$RESULTADOS.F38] ->  | AC22: of:=[$RESULTADOS.G38] ->  | AD22: of:=[$RESULTADOS.H38] ->  | AE22: of:=[$RESULTADOS.I38] ->  | AF22: of:=[$RESULTADOS.J38] ->  | AG22: of:=[$RESULTADOS.K38] ->  | AH22: of:=[$RESULTADOS.L38] ->  | AI22: of:=[$RESULTADOS.M38] ->  | AJ22: of:=[$RESULTADOS.N38] ->  | AK22: of:=[$RESULTADOS.O38] ->  | AL22: of:=[$RESULTADOS.P38] ->  | AM22: of:=[$RESULTADOS.Q38] ->  | AN22: of:=[$RESULTADOS.R38] ->  | AO22: of:=[$RESULTADOS.S38] ->  | AP22: of:=[$RESULTADOS.T38] ->  | AQ22: of:=[$RESULTADOS.U38] ->  | AR22: of:=[$RESULTADOS.V38] ->  | AS22: of:=[$RESULTADOS.W38] ->  | AT22: of:=[$RESULTADOS.X38] ->  | AU22: of:=[$RESULTADOS.Y38] ->  | AV22: of:=[$RESULTADOS.Z38] ->  | AW22: of:=[$RESULTADOS.AA38] ->  | AX22: of:=[$RESULTADOS.AB38] ->  | AY22: of:=[$RESULTADOS.AC38] ->  | AZ22: of:=[$RESULTADOS.AD38] ->  | BA22: of:=[$RESULTADOS.AE38] ->  | BB22: of:=[$RESULTADOS.AF38] ->  | BC22: of:=[$RESULTADOS.AG38] ->  | BD22: of:=[$RESULTADOS.D79] ->  | BE22: of:=[$RESULTADOS.E79] ->  | BF22: of:=[$RESULTADOS.F79] ->  | BG22: of:=[$RESULTADOS.G79] ->  | BH22: of:=[$RESULTADOS.H79] ->  | BI22: of:=[$RESULTADOS.I79] ->  | BJ22: of:=[$RESULTADOS.J79] ->  | BK22: of:=[$RESULTADOS.K79] ->  | BL22: of:=[$RESULTADOS.L79] ->  | BM22: of:=[$RESULTADOS.M79] ->  | BN22: of:=[$RESULTADOS.N79] ->  | BO22: of:=[$RESULTADOS.O79] ->  | BP22: of:=[$RESULTADOS.P79] ->  | BQ22: of:=[$RESULTADOS.Q79] ->  | BR22: of:=[$RESULTADOS.R79] ->  | BS22: of:=[$RESULTADOS.S79] ->  | BT22: of:=[$RESULTADOS.T79] ->  | BU22: of:=[$RESULTADOS.U79] ->  | BV22: of:=[$RESULTADOS.V79] ->  | BW22: of:=[$RESULTADOS.W79] -> 
C23: Protección social | D23: of:=[$'01.Definición de ámbito'.D53] -> No | K23: Pendiente de evaluar | T23: of:=[$'03.Muestra'.B28] -> 21 | U23: of:=[$'03.Muestra'.C28] -> 0 | V23: of:=[$'03.Muestra'.D28] -> 0 | W23: of:=[$'03.Muestra'.E28] -> 0 | X23: of:=[$'03.Muestra'.F28] -> 0 | Y23: of:=[$'03.Muestra'.G28] -> 0 | Z23: of:=[$RESULTADOS.D39] ->  | AA23: of:=[$RESULTADOS.E39] ->  | AB23: of:=[$RESULTADOS.F39] ->  | AC23: of:=[$RESULTADOS.G39] ->  | AD23: of:=[$RESULTADOS.H39] ->  | AE23: of:=[$RESULTADOS.I39] ->  | AF23: of:=[$RESULTADOS.J39] ->  | AG23: of:=[$RESULTADOS.K39] ->  | AH23: of:=[$RESULTADOS.L39] ->  | AI23: of:=[$RESULTADOS.M39] ->  | AJ23: of:=[$RESULTADOS.N39] ->  | AK23: of:=[$RESULTADOS.O39] ->  | AL23: of:=[$RESULTADOS.P39] ->  | AM23: of:=[$RESULTADOS.Q39] ->  | AN23: of:=[$RESULTADOS.R39] ->  | AO23: of:=[$RESULTADOS.S39] ->  | AP23: of:=[$RESULTADOS.T39] ->  | AQ23: of:=[$RESULTADOS.U39] ->  | AR23: of:=[$RESULTADOS.V39] ->  | AS23: of:=[$RESULTADOS.W39] ->  | AT23: of:=[$RESULTADOS.X39] ->  | AU23: of:=[$RESULTADOS.Y39] ->  | AV23: of:=[$RESULTADOS.Z39] ->  | AW23: of:=[$RESULTADOS.AA39] ->  | AX23: of:=[$RESULTADOS.AB39] ->  | AY23: of:=[$RESULTADOS.AC39] ->  | AZ23: of:=[$RESULTADOS.AD39] ->  | BA23: of:=[$RESULTADOS.AE39] ->  | BB23: of:=[$RESULTADOS.AF39] ->  | BC23: of:=[$RESULTADOS.AG39] ->  | BD23: of:=[$RESULTADOS.D80] ->  | BE23: of:=[$RESULTADOS.E80] ->  | BF23: of:=[$RESULTADOS.F80] ->  | BG23: of:=[$RESULTADOS.G80] ->  | BH23: of:=[$RESULTADOS.H80] ->  | BI23: of:=[$RESULTADOS.I80] ->  | BJ23: of:=[$RESULTADOS.J80] ->  | BK23: of:=[$RESULTADOS.K80] ->  | BL23: of:=[$RESULTADOS.L80] ->  | BM23: of:=[$RESULTADOS.M80] ->  | BN23: of:=[$RESULTADOS.N80] ->  | BO23: of:=[$RESULTADOS.O80] ->  | BP23: of:=[$RESULTADOS.P80] ->  | BQ23: of:=[$RESULTADOS.Q80] ->  | BR23: of:=[$RESULTADOS.R80] ->  | BS23: of:=[$RESULTADOS.S80] ->  | BT23: of:=[$RESULTADOS.T80] ->  | BU23: of:=[$RESULTADOS.U80] ->  | BV23: of:=[$RESULTADOS.V80] ->  | BW23: of:=[$RESULTADOS.W80] -> 
C24: Sanidad | D24: of:=[$'01.Definición de ámbito'.D54] -> No | K24: No decide | L24: of:=[$RESULTADOS.O8] -> 0 | M24: of:=[$RESULTADOS.P8] -> 0 | T24: of:=[$'03.Muestra'.B29] -> 22 | U24: of:=[$'03.Muestra'.C29] -> 0 | V24: of:=[$'03.Muestra'.D29] -> 0 | W24: of:=[$'03.Muestra'.E29] -> 0 | X24: of:=[$'03.Muestra'.F29] -> 0 | Y24: of:=[$'03.Muestra'.G29] -> 0 | Z24: of:=[$RESULTADOS.D40] ->  | AA24: of:=[$RESULTADOS.E40] ->  | AB24: of:=[$RESULTADOS.F40] ->  | AC24: of:=[$RESULTADOS.G40] ->  | AD24: of:=[$RESULTADOS.H40] ->  | AE24: of:=[$RESULTADOS.I40] ->  | AF24: of:=[$RESULTADOS.J40] ->  | AG24: of:=[$RESULTADOS.K40] ->  | AH24: of:=[$RESULTADOS.L40] ->  | AI24: of:=[$RESULTADOS.M40] ->  | AJ24: of:=[$RESULTADOS.N40] ->  | AK24: of:=[$RESULTADOS.O40] ->  | AL24: of:=[$RESULTADOS.P40] ->  | AM24: of:=[$RESULTADOS.Q40] ->  | AN24: of:=[$RESULTADOS.R40] ->  | AO24: of:=[$RESULTADOS.S40] ->  | AP24: of:=[$RESULTADOS.T40] ->  | AQ24: of:=[$RESULTADOS.U40] ->  | AR24: of:=[$RESULTADOS.V40] ->  | AS24: of:=[$RESULTADOS.W40] ->  | AT24: of:=[$RESULTADOS.X40] ->  | AU24: of:=[$RESULTADOS.Y40] ->  | AV24: of:=[$RESULTADOS.Z40] ->  | AW24: of:=[$RESULTADOS.AA40] ->  | AX24: of:=[$RESULTADOS.AB40] ->  | AY24: of:=[$RESULTADOS.AC40] ->  | AZ24: of:=[$RESULTADOS.AD40] ->  | BA24: of:=[$RESULTADOS.AE40] ->  | BB24: of:=[$RESULTADOS.AF40] ->  | BC24: of:=[$RESULTADOS.AG40] ->  | BD24: of:=[$RESULTADOS.D81] ->  | BE24: of:=[$RESULTADOS.E81] ->  | BF24: of:=[$RESULTADOS.F81] ->  | BG24: of:=[$RESULTADOS.G81] ->  | BH24: of:=[$RESULTADOS.H81] ->  | BI24: of:=[$RESULTADOS.I81] ->  | BJ24: of:=[$RESULTADOS.J81] ->  | BK24: of:=[$RESULTADOS.K81] ->  | BL24: of:=[$RESULTADOS.L81] ->  | BM24: of:=[$RESULTADOS.M81] ->  | BN24: of:=[$RESULTADOS.N81] ->  | BO24: of:=[$RESULTADOS.O81] ->  | BP24: of:=[$RESULTADOS.P81] ->  | BQ24: of:=[$RESULTADOS.Q81] ->  | BR24: of:=[$RESULTADOS.R81] ->  | BS24: of:=[$RESULTADOS.S81] ->  | BT24: of:=[$RESULTADOS.T81] ->  | BU24: of:=[$RESULTADOS.U81] ->  | BV24: of:=[$RESULTADOS.V81] ->  | BW24: of:=[$RESULTADOS.W81] -> 
C25: Seguridad y Orden Público | D25: of:=[$'01.Definición de ámbito'.D55] -> No | K25: No testeado | L25: of:=[$RESULTADOS.O9] -> 0 | M25: of:=[$RESULTADOS.P9] -> 0 | T25: of:=[$'03.Muestra'.B30] -> 23 | U25: of:=[$'03.Muestra'.C30] -> 0 | V25: of:=[$'03.Muestra'.D30] -> 0 | W25: of:=[$'03.Muestra'.E30] -> 0 | X25: of:=[$'03.Muestra'.F30] -> 0 | Y25: of:=[$'03.Muestra'.G30] -> 0 | Z25: of:=[$RESULTADOS.D41] ->  | AA25: of:=[$RESULTADOS.E41] ->  | AB25: of:=[$RESULTADOS.F41] ->  | AC25: of:=[$RESULTADOS.G41] ->  | AD25: of:=[$RESULTADOS.H41] ->  | AE25: of:=[$RESULTADOS.I41] ->  | AF25: of:=[$RESULTADOS.J41] ->  | AG25: of:=[$RESULTADOS.K41] ->  | AH25: of:=[$RESULTADOS.L41] ->  | AI25: of:=[$RESULTADOS.M41] ->  | AJ25: of:=[$RESULTADOS.N41] ->  | AK25: of:=[$RESULTADOS.O41] ->  | AL25: of:=[$RESULTADOS.P41] ->  | AM25: of:=[$RESULTADOS.Q41] ->  | AN25: of:=[$RESULTADOS.R41] ->  | AO25: of:=[$RESULTADOS.S41] ->  | AP25: of:=[$RESULTADOS.T41] ->  | AQ25: of:=[$RESULTADOS.U41] ->  | AR25: of:=[$RESULTADOS.V41] ->  | AS25: of:=[$RESULTADOS.W41] ->  | AT25: of:=[$RESULTADOS.X41] ->  | AU25: of:=[$RESULTADOS.Y41] ->  | AV25: of:=[$RESULTADOS.Z41] ->  | AW25: of:=[$RESULTADOS.AA41] ->  | AX25: of:=[$RESULTADOS.AB41] ->  | AY25: of:=[$RESULTADOS.AC41] ->  | AZ25: of:=[$RESULTADOS.AD41] ->  | BA25: of:=[$RESULTADOS.AE41] ->  | BB25: of:=[$RESULTADOS.AF41] ->  | BC25: of:=[$RESULTADOS.AG41] ->  | BD25: of:=[$RESULTADOS.D82] ->  | BE25: of:=[$RESULTADOS.E82] ->  | BF25: of:=[$RESULTADOS.F82] ->  | BG25: of:=[$RESULTADOS.G82] ->  | BH25: of:=[$RESULTADOS.H82] ->  | BI25: of:=[$RESULTADOS.I82] ->  | BJ25: of:=[$RESULTADOS.J82] ->  | BK25: of:=[$RESULTADOS.K82] ->  | BL25: of:=[$RESULTADOS.L82] ->  | BM25: of:=[$RESULTADOS.M82] ->  | BN25: of:=[$RESULTADOS.N82] ->  | BO25: of:=[$RESULTADOS.O82] ->  | BP25: of:=[$RESULTADOS.P82] ->  | BQ25: of:=[$RESULTADOS.Q82] ->  | BR25: of:=[$RESULTADOS.R82] ->  | BS25: of:=[$RESULTADOS.S82] ->  | BT25: of:=[$RESULTADOS.T82] ->  | BU25: of:=[$RESULTADOS.U82] ->  | BV25: of:=[$RESULTADOS.V82] ->  | BW25: of:=[$RESULTADOS.W82] -> 
C26: Servicios Comunitarios | D26: of:=[$'01.Definición de ámbito'.D56] -> No | K26: En blanco | L26: of:=[$RESULTADOS.O10] -> 0 | M26: of:=[$RESULTADOS.P10] -> 0 | T26: of:=[$'03.Muestra'.B31] -> 24 | U26: of:=[$'03.Muestra'.C31] -> 0 | V26: of:=[$'03.Muestra'.D31] -> 0 | W26: of:=[$'03.Muestra'.E31] -> 0 | X26: of:=[$'03.Muestra'.F31] ->   | Y26: of:=[$'03.Muestra'.G31] -> 0 | Z26: of:=[$RESULTADOS.D42] ->  | AA26: of:=[$RESULTADOS.E42] ->  | AB26: of:=[$RESULTADOS.F42] ->  | AC26: of:=[$RESULTADOS.G42] ->  | AD26: of:=[$RESULTADOS.H42] ->  | AE26: of:=[$RESULTADOS.I42] ->  | AF26: of:=[$RESULTADOS.J42] ->  | AG26: of:=[$RESULTADOS.K42] ->  | AH26: of:=[$RESULTADOS.L42] ->  | AI26: of:=[$RESULTADOS.M42] ->  | AJ26: of:=[$RESULTADOS.N42] ->  | AK26: of:=[$RESULTADOS.O42] ->  | AL26: of:=[$RESULTADOS.P42] ->  | AM26: of:=[$RESULTADOS.Q42] ->  | AN26: of:=[$RESULTADOS.R42] ->  | AO26: of:=[$RESULTADOS.S42] ->  | AP26: of:=[$RESULTADOS.T42] ->  | AQ26: of:=[$RESULTADOS.U42] ->  | AR26: of:=[$RESULTADOS.V42] ->  | AS26: of:=[$RESULTADOS.W42] ->  | AT26: of:=[$RESULTADOS.X42] ->  | AU26: of:=[$RESULTADOS.Y42] ->  | AV26: of:=[$RESULTADOS.Z42] ->  | AW26: of:=[$RESULTADOS.AA42] ->  | AX26: of:=[$RESULTADOS.AB42] ->  | AY26: of:=[$RESULTADOS.AC42] ->  | AZ26: of:=[$RESULTADOS.AD42] ->  | BA26: of:=[$RESULTADOS.AE42] ->  | BB26: of:=[$RESULTADOS.AF42] ->  | BC26: of:=[$RESULTADOS.AG42] ->  | BD26: of:=[$RESULTADOS.D83] ->  | BE26: of:=[$RESULTADOS.E83] ->  | BF26: of:=[$RESULTADOS.F83] ->  | BG26: of:=[$RESULTADOS.G83] ->  | BH26: of:=[$RESULTADOS.H83] ->  | BI26: of:=[$RESULTADOS.I83] ->  | BJ26: of:=[$RESULTADOS.J83] ->  | BK26: of:=[$RESULTADOS.K83] ->  | BL26: of:=[$RESULTADOS.L83] ->  | BM26: of:=[$RESULTADOS.M83] ->  | BN26: of:=[$RESULTADOS.N83] ->  | BO26: of:=[$RESULTADOS.O83] ->  | BP26: of:=[$RESULTADOS.P83] ->  | BQ26: of:=[$RESULTADOS.Q83] ->  | BR26: of:=[$RESULTADOS.R83] ->  | BS26: of:=[$RESULTADOS.S83] ->  | BT26: of:=[$RESULTADOS.T83] ->  | BU26: of:=[$RESULTADOS.U83] ->  | BV26: of:=[$RESULTADOS.V83] ->  | BW26: of:=[$RESULTADOS.W83] -> 
C27: Transporte | D27: of:=[$'01.Definición de ámbito'.D57] -> No | K27: TOTAL | L27: of:=[$RESULTADOS.O11] -> 0 | M27: of:=[$RESULTADOS.P11] -> 0 | T27: of:=[$'03.Muestra'.B32] -> 25 | U27: of:=[$'03.Muestra'.C32] -> 0 | V27: of:=[$'03.Muestra'.D32] -> 0 | W27: of:=[$'03.Muestra'.E32] -> 0 | X27: of:=[$'03.Muestra'.F32] ->   | Y27: of:=[$'03.Muestra'.G32] -> 0 | Z27: of:=[$RESULTADOS.D43] ->  | AA27: of:=[$RESULTADOS.E43] ->  | AB27: of:=[$RESULTADOS.F43] ->  | AC27: of:=[$RESULTADOS.G43] ->  | AD27: of:=[$RESULTADOS.H43] ->  | AE27: of:=[$RESULTADOS.I43] ->  | AF27: of:=[$RESULTADOS.J43] ->  | AG27: of:=[$RESULTADOS.K43] ->  | AH27: of:=[$RESULTADOS.L43] ->  | AI27: of:=[$RESULTADOS.M43] ->  | AJ27: of:=[$RESULTADOS.N43] ->  | AK27: of:=[$RESULTADOS.O43] ->  | AL27: of:=[$RESULTADOS.P43] ->  | AM27: of:=[$RESULTADOS.Q43] ->  | AN27: of:=[$RESULTADOS.R43] ->  | AO27: of:=[$RESULTADOS.S43] ->  | AP27: of:=[$RESULTADOS.T43] ->  | AQ27: of:=[$RESULTADOS.U43] ->  | AR27: of:=[$RESULTADOS.V43] ->  | AS27: of:=[$RESULTADOS.W43] ->  | AT27: of:=[$RESULTADOS.X43] ->  | AU27: of:=[$RESULTADOS.Y43] ->  | AV27: of:=[$RESULTADOS.Z43] ->  | AW27: of:=[$RESULTADOS.AA43] ->  | AX27: of:=[$RESULTADOS.AB43] ->  | AY27: of:=[$RESULTADOS.AC43] ->  | AZ27: of:=[$RESULTADOS.AD43] ->  | BA27: of:=[$RESULTADOS.AE43] ->  | BB27: of:=[$RESULTADOS.AF43] ->  | BC27: of:=[$RESULTADOS.AG43] ->  | BD27: of:=[$RESULTADOS.D84] ->  | BE27: of:=[$RESULTADOS.E84] ->  | BF27: of:=[$RESULTADOS.F84] ->  | BG27: of:=[$RESULTADOS.G84] ->  | BH27: of:=[$RESULTADOS.H84] ->  | BI27: of:=[$RESULTADOS.I84] ->  | BJ27: of:=[$RESULTADOS.J84] ->  | BK27: of:=[$RESULTADOS.K84] ->  | BL27: of:=[$RESULTADOS.L84] ->  | BM27: of:=[$RESULTADOS.M84] ->  | BN27: of:=[$RESULTADOS.N84] ->  | BO27: of:=[$RESULTADOS.O84] ->  | BP27: of:=[$RESULTADOS.P84] ->  | BQ27: of:=[$RESULTADOS.Q84] ->  | BR27: of:=[$RESULTADOS.R84] ->  | BS27: of:=[$RESULTADOS.S84] ->  | BT27: of:=[$RESULTADOS.T84] ->  | BU27: of:=[$RESULTADOS.U84] ->  | BV27: of:=[$RESULTADOS.V84] ->  | BW27: of:=[$RESULTADOS.W84] -> 
C28: Vivienda | D28: of:=[$'01.Definición de ámbito'.D58] -> No | T28: of:=[$'03.Muestra'.B33] -> 26 | U28: of:=[$'03.Muestra'.C33] -> 0 | V28: of:=[$'03.Muestra'.D33] -> 0 | W28: of:=[$'03.Muestra'.E33] -> 0 | X28: of:=[$'03.Muestra'.F33] ->   | Y28: of:=[$'03.Muestra'.G33] -> 0 | Z28: of:=[$RESULTADOS.D44] ->  | AA28: of:=[$RESULTADOS.E44] ->  | AB28: of:=[$RESULTADOS.F44] ->  | AC28: of:=[$RESULTADOS.G44] ->  | AD28: of:=[$RESULTADOS.H44] ->  | AE28: of:=[$RESULTADOS.I44] ->  | AF28: of:=[$RESULTADOS.J44] ->  | AG28: of:=[$RESULTADOS.K44] ->  | AH28: of:=[$RESULTADOS.L44] ->  | AI28: of:=[$RESULTADOS.M44] ->  | AJ28: of:=[$RESULTADOS.N44] ->  | AK28: of:=[$RESULTADOS.O44] ->  | AL28: of:=[$RESULTADOS.P44] ->  | AM28: of:=[$RESULTADOS.Q44] ->  | AN28: of:=[$RESULTADOS.R44] ->  | AO28: of:=[$RESULTADOS.S44] ->  | AP28: of:=[$RESULTADOS.T44] ->  | AQ28: of:=[$RESULTADOS.U44] ->  | AR28: of:=[$RESULTADOS.V44] ->  | AS28: of:=[$RESULTADOS.W44] ->  | AT28: of:=[$RESULTADOS.X44] ->  | AU28: of:=[$RESULTADOS.Y44] ->  | AV28: of:=[$RESULTADOS.Z44] ->  | AW28: of:=[$RESULTADOS.AA44] ->  | AX28: of:=[$RESULTADOS.AB44] ->  | AY28: of:=[$RESULTADOS.AC44] ->  | AZ28: of:=[$RESULTADOS.AD44] ->  | BA28: of:=[$RESULTADOS.AE44] ->  | BB28: of:=[$RESULTADOS.AF44] ->  | BC28: of:=[$RESULTADOS.AG44] ->  | BD28: of:=[$RESULTADOS.D85] ->  | BE28: of:=[$RESULTADOS.E85] ->  | BF28: of:=[$RESULTADOS.F85] ->  | BG28: of:=[$RESULTADOS.G85] ->  | BH28: of:=[$RESULTADOS.H85] ->  | BI28: of:=[$RESULTADOS.I85] ->  | BJ28: of:=[$RESULTADOS.J85] ->  | BK28: of:=[$RESULTADOS.K85] ->  | BL28: of:=[$RESULTADOS.L85] ->  | BM28: of:=[$RESULTADOS.M85] ->  | BN28: of:=[$RESULTADOS.N85] ->  | BO28: of:=[$RESULTADOS.O85] ->  | BP28: of:=[$RESULTADOS.P85] ->  | BQ28: of:=[$RESULTADOS.Q85] ->  | BR28: of:=[$RESULTADOS.R85] ->  | BS28: of:=[$RESULTADOS.S85] ->  | BT28: of:=[$RESULTADOS.T85] ->  | BU28: of:=[$RESULTADOS.U85] ->  | BV28: of:=[$RESULTADOS.V85] ->  | BW28: of:=[$RESULTADOS.W85] -> 
C29: Tipo de evaluación* | D29: of:=[$'01.Definición de ámbito'.C60] -> 0 | K29: Situación de cumplimiento | L29: of:=[$RESULTADOS.C14] ->  | T29: of:=[$'03.Muestra'.B34] -> 27 | U29: of:=[$'03.Muestra'.C34] -> 0 | V29: of:=[$'03.Muestra'.D34] -> 0 | W29: of:=[$'03.Muestra'.E34] -> 0 | X29: of:=[$'03.Muestra'.F34] ->   | Y29: of:=[$'03.Muestra'.G34] -> 0 | Z29: of:=[$RESULTADOS.D45] ->  | AA29: of:=[$RESULTADOS.E45] ->  | AB29: of:=[$RESULTADOS.F45] ->  | AC29: of:=[$RESULTADOS.G45] ->  | AD29: of:=[$RESULTADOS.H45] ->  | AE29: of:=[$RESULTADOS.I45] ->  | AF29: of:=[$RESULTADOS.J45] ->  | AG29: of:=[$RESULTADOS.K45] ->  | AH29: of:=[$RESULTADOS.L45] ->  | AI29: of:=[$RESULTADOS.M45] ->  | AJ29: of:=[$RESULTADOS.N45] ->  | AK29: of:=[$RESULTADOS.O45] ->  | AL29: of:=[$RESULTADOS.P45] ->  | AM29: of:=[$RESULTADOS.Q45] ->  | AN29: of:=[$RESULTADOS.R45] ->  | AO29: of:=[$RESULTADOS.S45] ->  | AP29: of:=[$RESULTADOS.T45] ->  | AQ29: of:=[$RESULTADOS.U45] ->  | AR29: of:=[$RESULTADOS.V45] ->  | AS29: of:=[$RESULTADOS.W45] ->  | AT29: of:=[$RESULTADOS.X45] ->  | AU29: of:=[$RESULTADOS.Y45] ->  | AV29: of:=[$RESULTADOS.Z45] ->  | AW29: of:=[$RESULTADOS.AA45] ->  | AX29: of:=[$RESULTADOS.AB45] ->  | AY29: of:=[$RESULTADOS.AC45] ->  | AZ29: of:=[$RESULTADOS.AD45] ->  | BA29: of:=[$RESULTADOS.AE45] ->  | BB29: of:=[$RESULTADOS.AF45] ->  | BC29: of:=[$RESULTADOS.AG45] ->  | BD29: of:=[$RESULTADOS.D86] ->  | BE29: of:=[$RESULTADOS.E86] ->  | BF29: of:=[$RESULTADOS.F86] ->  | BG29: of:=[$RESULTADOS.G86] ->  | BH29: of:=[$RESULTADOS.H86] ->  | BI29: of:=[$RESULTADOS.I86] ->  | BJ29: of:=[$RESULTADOS.J86] ->  | BK29: of:=[$RESULTADOS.K86] ->  | BL29: of:=[$RESULTADOS.L86] ->  | BM29: of:=[$RESULTADOS.M86] ->  | BN29: of:=[$RESULTADOS.N86] ->  | BO29: of:=[$RESULTADOS.O86] ->  | BP29: of:=[$RESULTADOS.P86] ->  | BQ29: of:=[$RESULTADOS.Q86] ->  | BR29: of:=[$RESULTADOS.R86] ->  | BS29: of:=[$RESULTADOS.S86] ->  | BT29: of:=[$RESULTADOS.T86] ->  | BU29: of:=[$RESULTADOS.U86] ->  | BV29: of:=[$RESULTADOS.V86] ->  | BW29: of:=[$RESULTADOS.W86] -> 
C30: Nombre de empresa | D30: of:=[$'01.Definición de ámbito'.C62] -> 0 | K30: Puntuación media del sitio web | L30: of:=[$RESULTADOS.E14] ->  | T30: of:=[$'03.Muestra'.B35] -> 28 | U30: of:=[$'03.Muestra'.C35] -> 0 | V30: of:=[$'03.Muestra'.D35] -> 0 | W30: of:=[$'03.Muestra'.E35] -> 0 | X30: of:=[$'03.Muestra'.F35] ->   | Y30: of:=[$'03.Muestra'.G35] -> 0 | Z30: of:=[$RESULTADOS.D46] ->  | AA30: of:=[$RESULTADOS.E46] ->  | AB30: of:=[$RESULTADOS.F46] ->  | AC30: of:=[$RESULTADOS.G46] ->  | AD30: of:=[$RESULTADOS.H46] ->  | AE30: of:=[$RESULTADOS.I46] ->  | AF30: of:=[$RESULTADOS.J46] ->  | AG30: of:=[$RESULTADOS.K46] ->  | AH30: of:=[$RESULTADOS.L46] ->  | AI30: of:=[$RESULTADOS.M46] ->  | AJ30: of:=[$RESULTADOS.N46] ->  | AK30: of:=[$RESULTADOS.O46] ->  | AL30: of:=[$RESULTADOS.P46] ->  | AM30: of:=[$RESULTADOS.Q46] ->  | AN30: of:=[$RESULTADOS.R46] ->  | AO30: of:=[$RESULTADOS.S46] ->  | AP30: of:=[$RESULTADOS.T46] ->  | AQ30: of:=[$RESULTADOS.U46] ->  | AR30: of:=[$RESULTADOS.V46] ->  | AS30: of:=[$RESULTADOS.W46] ->  | AT30: of:=[$RESULTADOS.X46] ->  | AU30: of:=[$RESULTADOS.Y46] ->  | AV30: of:=[$RESULTADOS.Z46] ->  | AW30: of:=[$RESULTADOS.AA46] ->  | AX30: of:=[$RESULTADOS.AB46] ->  | AY30: of:=[$RESULTADOS.AC46] ->  | AZ30: of:=[$RESULTADOS.AD46] ->  | BA30: of:=[$RESULTADOS.AE46] ->  | BB30: of:=[$RESULTADOS.AF46] ->  | BC30: of:=[$RESULTADOS.AG46] ->  | BD30: of:=[$RESULTADOS.D87] ->  | BE30: of:=[$RESULTADOS.E87] ->  | BF30: of:=[$RESULTADOS.F87] ->  | BG30: of:=[$RESULTADOS.G87] ->  | BH30: of:=[$RESULTADOS.H87] ->  | BI30: of:=[$RESULTADOS.I87] ->  | BJ30: of:=[$RESULTADOS.J87] ->  | BK30: of:=[$RESULTADOS.K87] ->  | BL30: of:=[$RESULTADOS.L87] ->  | BM30: of:=[$RESULTADOS.M87] ->  | BN30: of:=[$RESULTADOS.N87] ->  | BO30: of:=[$RESULTADOS.O87] ->  | BP30: of:=[$RESULTADOS.P87] ->  | BQ30: of:=[$RESULTADOS.Q87] ->  | BR30: of:=[$RESULTADOS.R87] ->  | BS30: of:=[$RESULTADOS.S87] ->  | BT30: of:=[$RESULTADOS.T87] ->  | BU30: of:=[$RESULTADOS.U87] ->  | BV30: of:=[$RESULTADOS.V87] ->  | BW30: of:=[$RESULTADOS.W87] -> 
C31: Observaciones | D31: of:=[$'01.Definición de ámbito'.C64] -> 0 | T31: of:=[$'03.Muestra'.B36] -> 29 | U31: of:=[$'03.Muestra'.C36] -> 0 | V31: of:=[$'03.Muestra'.D36] -> 0 | W31: of:=[$'03.Muestra'.E36] -> 0 | X31: of:=[$'03.Muestra'.F36] ->   | Y31: of:=[$'03.Muestra'.G36] -> 0 | Z31: of:=[$RESULTADOS.D47] ->  | AA31: of:=[$RESULTADOS.E47] ->  | AB31: of:=[$RESULTADOS.F47] ->  | AC31: of:=[$RESULTADOS.G47] ->  | AD31: of:=[$RESULTADOS.H47] ->  | AE31: of:=[$RESULTADOS.I47] ->  | AF31: of:=[$RESULTADOS.J47] ->  | AG31: of:=[$RESULTADOS.K47] ->  | AH31: of:=[$RESULTADOS.L47] ->  | AI31: of:=[$RESULTADOS.M47] ->  | AJ31: of:=[$RESULTADOS.N47] ->  | AK31: of:=[$RESULTADOS.O47] ->  | AL31: of:=[$RESULTADOS.P47] ->  | AM31: of:=[$RESULTADOS.Q47] ->  | AN31: of:=[$RESULTADOS.R47] ->  | AO31: of:=[$RESULTADOS.S47] ->  | AP31: of:=[$RESULTADOS.T47] ->  | AQ31: of:=[$RESULTADOS.U47] ->  | AR31: of:=[$RESULTADOS.V47] ->  | AS31: of:=[$RESULTADOS.W47] ->  | AT31: of:=[$RESULTADOS.X47] ->  | AU31: of:=[$RESULTADOS.Y47] ->  | AV31: of:=[$RESULTADOS.Z47] ->  | AW31: of:=[$RESULTADOS.AA47] ->  | AX31: of:=[$RESULTADOS.AB47] ->  | AY31: of:=[$RESULTADOS.AC47] ->  | AZ31: of:=[$RESULTADOS.AD47] ->  | BA31: of:=[$RESULTADOS.AE47] ->  | BB31: of:=[$RESULTADOS.AF47] ->  | BC31: of:=[$RESULTADOS.AG47] ->  | BD31: of:=[$RESULTADOS.D88] ->  | BE31: of:=[$RESULTADOS.E88] ->  | BF31: of:=[$RESULTADOS.F88] ->  | BG31: of:=[$RESULTADOS.G88] ->  | BH31: of:=[$RESULTADOS.H88] ->  | BI31: of:=[$RESULTADOS.I88] ->  | BJ31: of:=[$RESULTADOS.J88] ->  | BK31: of:=[$RESULTADOS.K88] ->  | BL31: of:=[$RESULTADOS.L88] ->  | BM31: of:=[$RESULTADOS.M88] ->  | BN31: of:=[$RESULTADOS.N88] ->  | BO31: of:=[$RESULTADOS.O88] ->  | BP31: of:=[$RESULTADOS.P88] ->  | BQ31: of:=[$RESULTADOS.Q88] ->  | BR31: of:=[$RESULTADOS.R88] ->  | BS31: of:=[$RESULTADOS.S88] ->  | BT31: of:=[$RESULTADOS.T88] ->  | BU31: of:=[$RESULTADOS.U88] ->  | BV31: of:=[$RESULTADOS.V88] ->  | BW31: of:=[$RESULTADOS.W88] -> 
T32: of:=[$'03.Muestra'.B37] -> 30 | U32: of:=[$'03.Muestra'.C37] -> 0 | V32: of:=[$'03.Muestra'.D37] -> 0 | W32: of:=[$'03.Muestra'.E37] -> 0 | X32: of:=[$'03.Muestra'.F37] -> 0 | Y32: of:=[$'03.Muestra'.G37] -> 0 | Z32: of:=[$RESULTADOS.D48] ->  | AA32: of:=[$RESULTADOS.E48] ->  | AB32: of:=[$RESULTADOS.F48] ->  | AC32: of:=[$RESULTADOS.G48] ->  | AD32: of:=[$RESULTADOS.H48] ->  | AE32: of:=[$RESULTADOS.I48] ->  | AF32: of:=[$RESULTADOS.J48] ->  | AG32: of:=[$RESULTADOS.K48] ->  | AH32: of:=[$RESULTADOS.L48] ->  | AI32: of:=[$RESULTADOS.M48] ->  | AJ32: of:=[$RESULTADOS.N48] ->  | AK32: of:=[$RESULTADOS.O48] ->  | AL32: of:=[$RESULTADOS.P48] ->  | AM32: of:=[$RESULTADOS.Q48] ->  | AN32: of:=[$RESULTADOS.R48] ->  | AO32: of:=[$RESULTADOS.S48] ->  | AP32: of:=[$RESULTADOS.T48] ->  | AQ32: of:=[$RESULTADOS.U48] ->  | AR32: of:=[$RESULTADOS.V48] ->  | AS32: of:=[$RESULTADOS.W48] ->  | AT32: of:=[$RESULTADOS.X48] ->  | AU32: of:=[$RESULTADOS.Y48] ->  | AV32: of:=[$RESULTADOS.Z48] ->  | AW32: of:=[$RESULTADOS.AA48] ->  | AX32: of:=[$RESULTADOS.AB48] ->  | AY32: of:=[$RESULTADOS.AC48] ->  | AZ32: of:=[$RESULTADOS.AD48] ->  | BA32: of:=[$RESULTADOS.AE48] ->  | BB32: of:=[$RESULTADOS.AF48] ->  | BC32: of:=[$RESULTADOS.AG48] ->  | BD32: of:=[$RESULTADOS.D89] ->  | BE32: of:=[$RESULTADOS.E89] ->  | BF32: of:=[$RESULTADOS.F89] ->  | BG32: of:=[$RESULTADOS.G89] ->  | BH32: of:=[$RESULTADOS.H89] ->  | BI32: of:=[$RESULTADOS.I89] ->  | BJ32: of:=[$RESULTADOS.J89] ->  | BK32: of:=[$RESULTADOS.K89] ->  | BL32: of:=[$RESULTADOS.L89] ->  | BM32: of:=[$RESULTADOS.M89] ->  | BN32: of:=[$RESULTADOS.N89] ->  | BO32: of:=[$RESULTADOS.O89] ->  | BP32: of:=[$RESULTADOS.P89] ->  | BQ32: of:=[$RESULTADOS.Q89] ->  | BR32: of:=[$RESULTADOS.R89] ->  | BS32: of:=[$RESULTADOS.S89] ->  | BT32: of:=[$RESULTADOS.T89] ->  | BU32: of:=[$RESULTADOS.U89] ->  | BV32: of:=[$RESULTADOS.V89] ->  | BW32: of:=[$RESULTADOS.W89] -> 
T33: of:=[$'03.Muestra'.B38] -> 31 | U33: of:=[$'03.Muestra'.C38] -> 0 | V33: of:=[$'03.Muestra'.D38] -> 0 | W33: of:=[$'03.Muestra'.E38] -> 0 | X33: of:=[$'03.Muestra'.F38] -> 0 | Y33: of:=[$'03.Muestra'.G38] -> 0 | Z33: of:=[$RESULTADOS.D49] ->  | AA33: of:=[$RESULTADOS.E49] ->  | AB33: of:=[$RESULTADOS.F49] ->  | AC33: of:=[$RESULTADOS.G49] ->  | AD33: of:=[$RESULTADOS.H49] ->  | AE33: of:=[$RESULTADOS.I49] ->  | AF33: of:=[$RESULTADOS.J49] ->  | AG33: of:=[$RESULTADOS.K49] ->  | AH33: of:=[$RESULTADOS.L49] ->  | AI33: of:=[$RESULTADOS.M49] ->  | AJ33: of:=[$RESULTADOS.N49] ->  | AK33: of:=[$RESULTADOS.O49] ->  | AL33: of:=[$RESULTADOS.P49] ->  | AM33: of:=[$RESULTADOS.Q49] ->  | AN33: of:=[$RESULTADOS.R49] ->  | AO33: of:=[$RESULTADOS.S49] ->  | AP33: of:=[$RESULTADOS.T49] ->  | AQ33: of:=[$RESULTADOS.U49] ->  | AR33: of:=[$RESULTADOS.V49] ->  | AS33: of:=[$RESULTADOS.W49] ->  | AT33: of:=[$RESULTADOS.X49] ->  | AU33: of:=[$RESULTADOS.Y49] ->  | AV33: of:=[$RESULTADOS.Z49] ->  | AW33: of:=[$RESULTADOS.AA49] ->  | AX33: of:=[$RESULTADOS.AB49] ->  | AY33: of:=[$RESULTADOS.AC49] ->  | AZ33: of:=[$RESULTADOS.AD49] ->  | BA33: of:=[$RESULTADOS.AE49] ->  | BB33: of:=[$RESULTADOS.AF49] ->  | BC33: of:=[$RESULTADOS.AG49] ->  | BD33: of:=[$RESULTADOS.D90] ->  | BE33: of:=[$RESULTADOS.E90] ->  | BF33: of:=[$RESULTADOS.F90] ->  | BG33: of:=[$RESULTADOS.G90] ->  | BH33: of:=[$RESULTADOS.H90] ->  | BI33: of:=[$RESULTADOS.I90] ->  | BJ33: of:=[$RESULTADOS.J90] ->  | BK33: of:=[$RESULTADOS.K90] ->  | BL33: of:=[$RESULTADOS.L90] ->  | BM33: of:=[$RESULTADOS.M90] ->  | BN33: of:=[$RESULTADOS.N90] ->  | BO33: of:=[$RESULTADOS.O90] ->  | BP33: of:=[$RESULTADOS.P90] ->  | BQ33: of:=[$RESULTADOS.Q90] ->  | BR33: of:=[$RESULTADOS.R90] ->  | BS33: of:=[$RESULTADOS.S90] ->  | BT33: of:=[$RESULTADOS.T90] ->  | BU33: of:=[$RESULTADOS.U90] ->  | BV33: of:=[$RESULTADOS.V90] ->  | BW33: of:=[$RESULTADOS.W90] -> 
T34: of:=[$'03.Muestra'.B39] -> 32 | U34: of:=[$'03.Muestra'.C39] -> 0 | V34: of:=[$'03.Muestra'.D39] -> 0 | W34: of:=[$'03.Muestra'.E39] -> 0 | X34: of:=[$'03.Muestra'.F39] -> 0 | Y34: of:=[$'03.Muestra'.G39] -> 0 | Z34: of:=[$RESULTADOS.D50] ->  | AA34: of:=[$RESULTADOS.E50] ->  | AB34: of:=[$RESULTADOS.F50] ->  | AC34: of:=[$RESULTADOS.G50] ->  | AD34: of:=[$RESULTADOS.H50] ->  | AE34: of:=[$RESULTADOS.I50] ->  | AF34: of:=[$RESULTADOS.J50] ->  | AG34: of:=[$RESULTADOS.K50] ->  | AH34: of:=[$RESULTADOS.L50] ->  | AI34: of:=[$RESULTADOS.M50] ->  | AJ34: of:=[$RESULTADOS.N50] ->  | AK34: of:=[$RESULTADOS.O50] ->  | AL34: of:=[$RESULTADOS.P50] ->  | AM34: of:=[$RESULTADOS.Q50] ->  | AN34: of:=[$RESULTADOS.R50] ->  | AO34: of:=[$RESULTADOS.S50] ->  | AP34: of:=[$RESULTADOS.T50] ->  | AQ34: of:=[$RESULTADOS.U50] ->  | AR34: of:=[$RESULTADOS.V50] ->  | AS34: of:=[$RESULTADOS.W50] ->  | AT34: of:=[$RESULTADOS.X50] ->  | AU34: of:=[$RESULTADOS.Y50] ->  | AV34: of:=[$RESULTADOS.Z50] ->  | AW34: of:=[$RESULTADOS.AA50] ->  | AX34: of:=[$RESULTADOS.AB50] ->  | AY34: of:=[$RESULTADOS.AC50] ->  | AZ34: of:=[$RESULTADOS.AD50] ->  | BA34: of:=[$RESULTADOS.AE50] ->  | BB34: of:=[$RESULTADOS.AF50] ->  | BC34: of:=[$RESULTADOS.AG50] ->  | BD34: of:=[$RESULTADOS.D91] ->  | BE34: of:=[$RESULTADOS.E91] ->  | BF34: of:=[$RESULTADOS.F91] ->  | BG34: of:=[$RESULTADOS.G91] ->  | BH34: of:=[$RESULTADOS.H91] ->  | BI34: of:=[$RESULTADOS.I91] ->  | BJ34: of:=[$RESULTADOS.J91] ->  | BK34: of:=[$RESULTADOS.K91] ->  | BL34: of:=[$RESULTADOS.L91] ->  | BM34: of:=[$RESULTADOS.M91] ->  | BN34: of:=[$RESULTADOS.N91] ->  | BO34: of:=[$RESULTADOS.O91] ->  | BP34: of:=[$RESULTADOS.P91] ->  | BQ34: of:=[$RESULTADOS.Q91] ->  | BR34: of:=[$RESULTADOS.R91] ->  | BS34: of:=[$RESULTADOS.S91] ->  | BT34: of:=[$RESULTADOS.T91] ->  | BU34: of:=[$RESULTADOS.U91] ->  | BV34: of:=[$RESULTADOS.V91] ->  | BW34: of:=[$RESULTADOS.W91] -> 
T35: of:=[$'03.Muestra'.B40] -> 33 | U35: of:=[$'03.Muestra'.C40] -> 0 | V35: of:=[$'03.Muestra'.D40] -> 0 | W35: of:=[$'03.Muestra'.E40] -> 0 | X35: of:=[$'03.Muestra'.F40] -> 0 | Y35: of:=[$'03.Muestra'.G40] -> 0 | Z35: of:=[$RESULTADOS.D51] ->  | AA35: of:=[$RESULTADOS.E51] ->  | AB35: of:=[$RESULTADOS.F51] ->  | AC35: of:=[$RESULTADOS.G51] ->  | AD35: of:=[$RESULTADOS.H51] ->  | AE35: of:=[$RESULTADOS.I51] ->  | AF35: of:=[$RESULTADOS.J51] ->  | AG35: of:=[$RESULTADOS.K51] ->  | AH35: of:=[$RESULTADOS.L51] ->  | AI35: of:=[$RESULTADOS.M51] ->  | AJ35: of:=[$RESULTADOS.N51] ->  | AK35: of:=[$RESULTADOS.O51] ->  | AL35: of:=[$RESULTADOS.P51] ->  | AM35: of:=[$RESULTADOS.Q51] ->  | AN35: of:=[$RESULTADOS.R51] ->  | AO35: of:=[$RESULTADOS.S51] ->  | AP35: of:=[$RESULTADOS.T51] ->  | AQ35: of:=[$RESULTADOS.U51] ->  | AR35: of:=[$RESULTADOS.V51] ->  | AS35: of:=[$RESULTADOS.W51] ->  | AT35: of:=[$RESULTADOS.X51] ->  | AU35: of:=[$RESULTADOS.Y51] ->  | AV35: of:=[$RESULTADOS.Z51] ->  | AW35: of:=[$RESULTADOS.AA51] ->  | AX35: of:=[$RESULTADOS.AB51] ->  | AY35: of:=[$RESULTADOS.AC51] ->  | AZ35: of:=[$RESULTADOS.AD51] ->  | BA35: of:=[$RESULTADOS.AE51] ->  | BB35: of:=[$RESULTADOS.AF51] ->  | BC35: of:=[$RESULTADOS.AG51] ->  | BD35: of:=[$RESULTADOS.D92] ->  | BE35: of:=[$RESULTADOS.E92] ->  | BF35: of:=[$RESULTADOS.F92] ->  | BG35: of:=[$RESULTADOS.G92] ->  | BH35: of:=[$RESULTADOS.H92] ->  | BI35: of:=[$RESULTADOS.I92] ->  | BJ35: of:=[$RESULTADOS.J92] ->  | BK35: of:=[$RESULTADOS.K92] ->  | BL35: of:=[$RESULTADOS.L92] ->  | BM35: of:=[$RESULTADOS.M92] ->  | BN35: of:=[$RESULTADOS.N92] ->  | BO35: of:=[$RESULTADOS.O92] ->  | BP35: of:=[$RESULTADOS.P92] ->  | BQ35: of:=[$RESULTADOS.Q92] ->  | BR35: of:=[$RESULTADOS.R92] ->  | BS35: of:=[$RESULTADOS.S92] ->  | BT35: of:=[$RESULTADOS.T92] ->  | BU35: of:=[$RESULTADOS.U92] ->  | BV35: of:=[$RESULTADOS.V92] ->  | BW35: of:=[$RESULTADOS.W92] -> 
T36: of:=[$'03.Muestra'.B41] -> 34 | U36: of:=[$'03.Muestra'.C41] -> 0 | V36: of:=[$'03.Muestra'.D41] -> 0 | W36: of:=[$'03.Muestra'.E41] -> 0 | X36: of:=[$'03.Muestra'.F41] -> 0 | Y36: of:=[$'03.Muestra'.G41] -> 0 | Z36: of:=[$RESULTADOS.D52] ->  | AA36: of:=[$RESULTADOS.E52] ->  | AB36: of:=[$RESULTADOS.F52] ->  | AC36: of:=[$RESULTADOS.G52] ->  | AD36: of:=[$RESULTADOS.H52] ->  | AE36: of:=[$RESULTADOS.I52] ->  | AF36: of:=[$RESULTADOS.J52] ->  | AG36: of:=[$RESULTADOS.K52] ->  | AH36: of:=[$RESULTADOS.L52] ->  | AI36: of:=[$RESULTADOS.M52] ->  | AJ36: of:=[$RESULTADOS.N52] ->  | AK36: of:=[$RESULTADOS.O52] ->  | AL36: of:=[$RESULTADOS.P52] ->  | AM36: of:=[$RESULTADOS.Q52] ->  | AN36: of:=[$RESULTADOS.R52] ->  | AO36: of:=[$RESULTADOS.S52] ->  | AP36: of:=[$RESULTADOS.T52] ->  | AQ36: of:=[$RESULTADOS.U52] ->  | AR36: of:=[$RESULTADOS.V52] ->  | AS36: of:=[$RESULTADOS.W52] ->  | AT36: of:=[$RESULTADOS.X52] ->  | AU36: of:=[$RESULTADOS.Y52] ->  | AV36: of:=[$RESULTADOS.Z52] ->  | AW36: of:=[$RESULTADOS.AA52] ->  | AX36: of:=[$RESULTADOS.AB52] ->  | AY36: of:=[$RESULTADOS.AC52] ->  | AZ36: of:=[$RESULTADOS.AD52] ->  | BA36: of:=[$RESULTADOS.AE52] ->  | BB36: of:=[$RESULTADOS.AF52] ->  | BC36: of:=[$RESULTADOS.AG52] ->  | BD36: of:=[$RESULTADOS.D93] ->  | BE36: of:=[$RESULTADOS.E93] ->  | BF36: of:=[$RESULTADOS.F93] ->  | BG36: of:=[$RESULTADOS.G93] ->  | BH36: of:=[$RESULTADOS.H93] ->  | BI36: of:=[$RESULTADOS.I93] ->  | BJ36: of:=[$RESULTADOS.J93] ->  | BK36: of:=[$RESULTADOS.K93] ->  | BL36: of:=[$RESULTADOS.L93] ->  | BM36: of:=[$RESULTADOS.M93] ->  | BN36: of:=[$RESULTADOS.N93] ->  | BO36: of:=[$RESULTADOS.O93] ->  | BP36: of:=[$RESULTADOS.P93] ->  | BQ36: of:=[$RESULTADOS.Q93] ->  | BR36: of:=[$RESULTADOS.R93] ->  | BS36: of:=[$RESULTADOS.S93] ->  | BT36: of:=[$RESULTADOS.T93] ->  | BU36: of:=[$RESULTADOS.U93] ->  | BV36: of:=[$RESULTADOS.V93] ->  | BW36: of:=[$RESULTADOS.W93] -> 
T37: of:=[$'03.Muestra'.B42] -> 35 | U37: of:=[$'03.Muestra'.C42] -> 0 | V37: of:=[$'03.Muestra'.D42] -> 0 | W37: of:=[$'03.Muestra'.E42] -> 0 | X37: of:=[$'03.Muestra'.F42] ->   | Y37: of:=[$'03.Muestra'.G42] -> 0 | Z37: of:=[$RESULTADOS.D53] ->  | AA37: of:=[$RESULTADOS.E53] ->  | AB37: of:=[$RESULTADOS.F53] ->  | AC37: of:=[$RESULTADOS.G53] ->  | AD37: of:=[$RESULTADOS.H53] ->  | AE37: of:=[$RESULTADOS.I53] ->  | AF37: of:=[$RESULTADOS.J53] ->  | AG37: of:=[$RESULTADOS.K53] ->  | AH37: of:=[$RESULTADOS.L53] ->  | AI37: of:=[$RESULTADOS.M53] ->  | AJ37: of:=[$RESULTADOS.N53] ->  | AK37: of:=[$RESULTADOS.O53] ->  | AL37: of:=[$RESULTADOS.P53] ->  | AM37: of:=[$RESULTADOS.Q53] ->  | AN37: of:=[$RESULTADOS.R53] ->  | AO37: of:=[$RESULTADOS.S53] ->  | AP37: of:=[$RESULTADOS.T53] ->  | AQ37: of:=[$RESULTADOS.U53] ->  | AR37: of:=[$RESULTADOS.V53] ->  | AS37: of:=[$RESULTADOS.W53] ->  | AT37: of:=[$RESULTADOS.X53] ->  | AU37: of:=[$RESULTADOS.Y53] ->  | AV37: of:=[$RESULTADOS.Z53] ->  | AW37: of:=[$RESULTADOS.AA53] ->  | AX37: of:=[$RESULTADOS.AB53] ->  | AY37: of:=[$RESULTADOS.AC53] ->  | AZ37: of:=[$RESULTADOS.AD53] ->  | BA37: of:=[$RESULTADOS.AE53] ->  | BB37: of:=[$RESULTADOS.AF53] ->  | BC37: of:=[$RESULTADOS.AG53] ->  | BD37: of:=[$RESULTADOS.D94] ->  | BE37: of:=[$RESULTADOS.E94] ->  | BF37: of:=[$RESULTADOS.F94] ->  | BG37: of:=[$RESULTADOS.G94] ->  | BH37: of:=[$RESULTADOS.H94] ->  | BI37: of:=[$RESULTADOS.I94] ->  | BJ37: of:=[$RESULTADOS.J94] ->  | BK37: of:=[$RESULTADOS.K94] ->  | BL37: of:=[$RESULTADOS.L94] ->  | BM37: of:=[$RESULTADOS.M94] ->  | BN37: of:=[$RESULTADOS.N94] ->  | BO37: of:=[$RESULTADOS.O94] ->  | BP37: of:=[$RESULTADOS.P94] ->  | BQ37: of:=[$RESULTADOS.Q94] ->  | BR37: of:=[$RESULTADOS.R94] ->  | BS37: of:=[$RESULTADOS.S94] ->  | BT37: of:=[$RESULTADOS.T94] ->  | BU37: of:=[$RESULTADOS.U94] ->  | BV37: of:=[$RESULTADOS.V94] ->  | BW37: of:=[$RESULTADOS.W94] -> 